ffff8e2303c4c540 2161780757 C Ii:2:008:1 0:1 7 = 0200ff0f 000000
ffff8e2303c4c540 2161780808 S Ii:2:008:1 -115:1 8 <
ffff8e2303c4c540 2161788760 C Ii:2:008:1 0:1 7 = 0200ff0f 000000
ffff8e2303c4c540 2161788786 S Ii:2:008:1 -115:1 8 <
ffff8e2303c4c540 2161796758 C Ii:2:008:1 0:1 7 = 0200fd0f 000000
ffff8e2303c4c540 2161796787 S Ii:2:008:1 -115:1 8 <
ffff8e2303c4c540 2161804760 C Ii:2:008:1 0:1 7 = 0200f80f 000000
ffff8e2303c4c540 2161804786 S Ii:2:008:1 -115:1 8 <
ffff8e2303c4c540 2161812752 C Ii:2:008:1 0:1 7 = 0200f60f 000000
ffff8e2303c4c540 2161812776 S Ii:2:008:1 -115:1 8 <
ffff8e2303c4c540 2161820762 C Ii:2:008:1 0:1 7 = 0200f60f 000000
ffff8e2303c4c540 2161820788 S Ii:2:008:1 -115:1 8 <
ffff8e2303c4c540 2161828761 C Ii:2:008:1 0:1 7 = 0200f80f 000000
ffff8e2303c4c540 2161828787 S Ii:2:008:1 -115:1 8 <
ffff8e2303c4c540 2161836759 C Ii:2:008:1 0:1 7 = 0200fb0f 000000
ffff8e2303c4c540 2161836784 S Ii:2:008:1 -115:1 8 <
ffff8e2303c4c540 2161844759 C Ii:2:008:1 0:1 7 = 0200ff0f 000000
ffff8e2303c4c540 2161844785 S Ii:2:008:1 -115:1 8 <
ffff8e2303c4c540 2161852753 C Ii:2:008:1 0:1 7 = 0200ff0f 000000
ffff8e2303c4c540 2161852778 S Ii:2:008:1 -115:1 8 <
ffff8e2303c4c540 2162228763 C Ii:2:008:1 0:1 7 = 02000100 000000
ffff8e2303c4c540 2162228791 S Ii:2:008:1 -115:1 8 <
ffff8e2303c4c540 2162236833 C Ii:2:008:1 0:1 7 = 02000100 000000
ffff8e2303c4c540 2162236858 S Ii:2:008:1 -115:1 8 <
ffff8e2303c4c540 2162244760 C Ii:2:008:1 0:1 7 = 02000400 000000
ffff8e2303c4c540 2162244786 S Ii:2:008:1 -115:1 8 <
ffff8e2303c4c540 2162252764 C Ii:2:008:1 0:1 7 = 02000400 000000
ffff8e2303c4c540 2162252789 S Ii:2:008:1 -115:1 8 <
ffff8e2303c4c540 2162260753 C Ii:2:008:1 0:1 7 = 02000400 000000
ffff8e2303c4c540 2162260779 S Ii:2:008:1 -115:1 8 <
ffff8e2303c4c540 2162268765 C Ii:2:008:1 0:1 7 = 02000400 000000
ffff8e2303c4c540 2162268790 S Ii:2:008:1 -115:1 8 <
ffff8e2303c4c540 2162276754 C Ii:2:008:1 0:1 7 = 02000100 000000
ffff8e2303c4c540 2162276779 S Ii:2:008:1 -115:1 8 <
ffff8e2303c4c540 2162284761 C Ii:2:008:1 0:1 7 = 02000100 000000
ffff8e2303c4c540 2162284787 S Ii:2:008:1 -115:1 8 <
ffff8e2303c4c540 2162292754 C Ii:2:008:1 0:1 7 = 02000100 000000
ffff8e2303c4c540 2162292779 S Ii:2:008:1 -115:1 8 <
ffff8e2302151980 2162378144 S Bo:2:002:2 -115 31 = 55534243 83050000 00000000 00000600 00000000 00000000 00000000 000000
ffff8e2302151980 2162378169 C Bo:2:002:2 0 31 >
ffff8e2302151980 2162378176 S Bi:2:002:1 -115 13 <
ffff8e2302151980 2162378219 C Bi:2:002:1 0 13 = 55534253 83050000 00000000 00
ffff8e2303c4c540 2164379767 C Ii:2:008:1 0:1 7 = 02000100 000000
ffff8e2303c4c540 2164379800 S Ii:2:008:1 -115:1 8 <
ffff8e2303c4c540 2164387762 C Ii:2:008:1 0:1 7 = 020002f0 ff0000
ffff8e2303c4c540 2164387788 S Ii:2:008:1 -115:1 8 <
ffff8e2303c4c540 2164395769 C Ii:2:008:1 0:1 7 = 020002f0 ff0000
ffff8e2303c4c540 2164395797 S Ii:2:008:1 -115:1 8 <
ffff8e2303c4c540 2164403769 C Ii:2:008:1 0:1 7 = 02000200 000000
ffff8e2303c4c540 2164403796 S Ii:2:008:1 -115:1 8 <
ffff8e2303c4c540 2164411763 C Ii:2:008:1 0:1 7 = 020002f0 ff0000
ffff8e2303c4c540 2164411790 S Ii:2:008:1 -115:1 8 <
ffff8e2302151980 2164426142 S Bo:2:002:2 -115 31 = 55534243 84050000 00000000 00000600 00000000 00000000 00000000 000000
ffff8e2302151980 2164426167 C Bo:2:002:2 0 31 >
ffff8e2302151980 2164426174 S Bi:2:002:1 -115 13 <
ffff8e2302151980 2164426212 C Bi:2:002:1 0 13 = 55534253 84050000 00000000 00
ffff8e2303c4c540 2164435772 C Ii:2:008:1 0:1 7 = 020000f0 ff0000
ffff8e2303c4c540 2164435799 S Ii:2:008:1 -115:1 8 <
ffff8e2303c4c540 2164443772 C Ii:2:008:1 0:1 7 = 020000f0 ff0000
ffff8e2303c4c540 2164443798 S Ii:2:008:1 -115:1 8 <
ffff8e2303c4c540 2164451770 C Ii:2:008:1 0:1 7 = 0200ffef ff0000
ffff8e2303c4c540 2164451810 S Ii:2:008:1 -115:1 8 <
ffff8e2303c4c540 2164459763 C Ii:2:008:1 0:1 7 = 0200ffef ff0000
ffff8e2303c4c540 2164459790 S Ii:2:008:1 -115:1 8 <
ffff8e2303c4c540 2164467763 C Ii:2:008:1 0:1 7 = 0200feef ff0000
ffff8e2303c4c540 2164467790 S Ii:2:008:1 -115:1 8 <
ffff8e2303c4c540 2164475770 C Ii:2:008:1 0:1 7 = 0200fe0f 000000
ffff8e2303c4c540 2164475796 S Ii:2:008:1 -115:1 8 <
ffff8e2303c4c540 2164483738 C Ii:2:008:1 0:1 7 = 0200feff ff0000
ffff8e2303c4c540 2164483763 S Ii:2:008:1 -115:1 8 <
ffff8e2303c4c540 2164499764 C Ii:2:008:1 0:1 7 = 0200ff0f 000000
ffff8e2303c4c540 2164499792 S Ii:2:008:1 -115:1 8 <
ffff8e2302151980 2166474147 S Bo:2:002:2 -115 31 = 55534243 85050000 00000000 00000600 00000000 00000000 00000000 000000
ffff8e2302151980 2166474180 C Bo:2:002:2 0 31 >
ffff8e2302151980 2166474188 S Bi:2:002:1 -115 13 <
ffff8e2302151980 2166474237 C Bi:2:002:1 0 13 = 55534253 85050000 00000000 00
ffff8e2302151980 2168523131 S Bo:2:002:2 -115 31 = 55534243 86050000 00000000 00000600 00000000 00000000 00000000 000000
ffff8e2302151980 2168523160 C Bo:2:002:2 0 31 >
ffff8e2302151980 2168523167 S Bi:2:002:1 -115 13 <
ffff8e2302151980 2168523203 C Bi:2:002:1 0 13 = 55534253 86050000 00000000 00
ffff8e2303c4c540 2170432794 C Ii:2:008:1 0:1 7 = 02000010 000000
ffff8e2303c4c540 2170432828 S Ii:2:008:1 -115:1 8 <
ffff8e2303c4c540 2170440787 C Ii:2:008:1 0:1 7 = 02000010 000000
ffff8e2303c4c540 2170440814 S Ii:2:008:1 -115:1 8 <
ffff8e2303c4c540 2170456794 C Ii:2:008:1 0:1 7 = 02000010 000000
ffff8e2303c4c540 2170456819 S Ii:2:008:1 -115:1 8 <
ffff8e2303c4c540 2170464787 C Ii:2:008:1 0:1 7 = 02000010 000000
ffff8e2303c4c540 2170464814 S Ii:2:008:1 -115:1 8 <
ffff8e2303c4c540 2170472788 C Ii:2:008:1 0:1 7 = 0200ff1f 000000
ffff8e2303c4c540 2170472814 S Ii:2:008:1 -115:1 8 <
ffff8e2303c4c540 2170480794 C Ii:2:008:1 0:1 7 = 0200fe0f 000000
ffff8e2303c4c540 2170480820 S Ii:2:008:1 -115:1 8 <
ffff8e2303c4c540 2170488794 C Ii:2:008:1 0:1 7 = 0200fe1f 000000
ffff8e2303c4c540 2170488822 S Ii:2:008:1 -115:1 8 <
ffff8e2303c4c540 2170496787 C Ii:2:008:1 0:1 7 = 0200fe0f 000000
ffff8e2303c4c540 2170496813 S Ii:2:008:1 -115:1 8 <
ffff8e2303c4c540 2170504789 C Ii:2:008:1 0:1 7 = 0200ff0f 000000
ffff8e2303c4c540 2170504816 S Ii:2:008:1 -115:1 8 <
ffff8e2303c4c540 2170512797 C Ii:2:008:1 0:1 7 = 0200ff0f 000000
ffff8e2303c4c540 2170512823 S Ii:2:008:1 -115:1 8 <
ffff8e2302151980 2170570115 S Bo:2:002:2 -115 31 = 55534243 87050000 00000000 00000600 00000000 00000000 00000000 000000
ffff8e2302151980 2170570140 C Bo:2:002:2 0 31 >
ffff8e2302151980 2170570147 S Bi:2:002:1 -115 13 <
ffff8e2302151980 2170570184 C Bi:2:002:1 0 13 = 55534253 87050000 00000000 00
ffff8e2303c4c540 2170632795 C Ii:2:008:1 0:1 7 = 02000010 000000
ffff8e2303c4c540 2170632822 S Ii:2:008:1 -115:1 8 <
ffff8e2303c4c540 2170640797 C Ii:2:008:1 0:1 7 = 02000010 000000
ffff8e2303c4c540 2170640822 S Ii:2:008:1 -115:1 8 <
ffff8e2303c4c540 2170656796 C Ii:2:008:1 0:1 7 = 02000010 000000
ffff8e2303c4c540 2170656822 S Ii:2:008:1 -115:1 8 <
ffff8e2303c4c540 2171488793 C Ii:2:008:1 0:1 7 = 02000100 000000
ffff8e2303c4c540 2171488820 S Ii:2:008:1 -115:1 8 <
ffff8e2303c4c540 2171496807 C Ii:2:008:1 0:1 7 = 02000110 000000
ffff8e2303c4c540 2171496833 S Ii:2:008:1 -115:1 8 <
ffff8e2303c4c540 2171504798 C Ii:2:008:1 0:1 7 = 02000210 000000
ffff8e2303c4c540 2171504824 S Ii:2:008:1 -115:1 8 <
ffff8e2303c4c540 2171512792 C Ii:2:008:1 0:1 7 = 02000100 000000
ffff8e2303c4c540 2171512819 S Ii:2:008:1 -115:1 8 <
ffff8e2303c4c540 2171520793 C Ii:2:008:1 0:1 7 = 02000110 000000
ffff8e2303c4c540 2171520820 S Ii:2:008:1 -115:1 8 <
ffff8e2302151980 2172618136 S Bo:2:002:2 -115 31 = 55534243 88050000 00000000 00000600 00000000 00000000 00000000 000000
ffff8e2302151980 2172618183 C Bo:2:002:2 0 31 >
ffff8e2302151980 2172618191 S Bi:2:002:1 -115 13 <
ffff8e2302151980 2172618226 C Bi:2:002:1 0 13 = 55534253 88050000 00000000 00
ffff8e2302151980 2174666126 S Bo:2:002:2 -115 31 = 55534243 89050000 00000000 00000600 00000000 00000000 00000000 000000
ffff8e2302151980 2174666156 C Bo:2:002:2 0 31 >
ffff8e2302151980 2174666164 S Bi:2:002:1 -115 13 <
ffff8e2302151980 2174666201 C Bi:2:002:1 0 13 = 55534253 89050000 00000000 00
ffff8e2302151980 2176714086 S Bo:2:002:2 -115 31 = 55534243 8a050000 00000000 00000600 00000000 00000000 00000000 000000
ffff8e2302151980 2176714115 C Bo:2:002:2 0 31 >
ffff8e2302151980 2176714120 S Bi:2:002:1 -115 13 <
ffff8e2302151980 2176714156 C Bi:2:002:1 0 13 = 55534253 8a050000 00000000 00
ffff8e2303c4c540 2178221833 C Ii:2:008:1 0:1 7 = 02010000 000000
ffff8e2303c4c540 2178221866 S Ii:2:008:1 -115:1 8 <
ffff8e2303c4c540 2178277818 C Ii:2:008:1 0:1 7 = 02000000 000000
ffff8e2303c4c540 2178277846 S Ii:2:008:1 -115:1 8 <
ffff8e2303c4c540 2178605836 C Ii:2:008:1 0:1 7 = 02000500 000000
ffff8e2303c4c540 2178605868 S Ii:2:008:1 -115:1 8 <
ffff8e2303c4c540 2178613820 C Ii:2:008:1 0:1 7 = 02000a10 000000
ffff8e2303c4c540 2178613846 S Ii:2:008:1 -115:1 8 <
ffff8e2303c4c540 2178621827 C Ii:2:008:1 0:1 7 = 02001230 000000
ffff8e2303c4c540 2178621854 S Ii:2:008:1 -115:1 8 <
ffff8e2303c4c540 2178629827 C Ii:2:008:1 0:1 7 = 02001c70 000000
ffff8e2303c4c540 2178629853 S Ii:2:008:1 -115:1 8 <
ffff8e2303c4c540 2178637821 C Ii:2:008:1 0:1 7 = 020024c0 000000
ffff8e2303c4c540 2178637848 S Ii:2:008:1 -115:1 8 <
ffff8e2303c4c540 2178645829 C Ii:2:008:1 0:1 7 = 02002ef0 000000
ffff8e2303c4c540 2178645856 S Ii:2:008:1 -115:1 8 <
ffff8e2303c4c540 2178653821 C Ii:2:008:1 0:1 7 = 02003920 010000
ffff8e2303c4c540 2178653848 S Ii:2:008:1 -115:1 8 <
ffff8e2303c4c540 2178661820 C Ii:2:008:1 0:1 7 = 02004220 010000
ffff8e2303c4c540 2178661847 S Ii:2:008:1 -115:1 8 <
ffff8e2303c4c540 2178669822 C Ii:2:008:1 0:1 7 = 02004b20 010000
ffff8e2303c4c540 2178669849 S Ii:2:008:1 -115:1 8 <
ffff8e2303c4c540 2178677827 C Ii:2:008:1 0:1 7 = 02005130 010000
ffff8e2303c4c540 2178677853 S Ii:2:008:1 -115:1 8 <
ffff8e2303c4c540 2178685828 C Ii:2:008:1 0:1 7 = 02005420 010000
ffff8e2303c4c540 2178685854 S Ii:2:008:1 -115:1 8 <
ffff8e2303c4c540 2178693821 C Ii:2:008:1 0:1 7 = 02005b20 010000
ffff8e2303c4c540 2178693845 S Ii:2:008:1 -115:1 8 <
ffff8e2303c4c540 2178701823 C Ii:2:008:1 0:1 7 = 02006120 010000
ffff8e2303c4c540 2178701850 S Ii:2:008:1 -115:1 8 <
ffff8e2303c4c540 2178709828 C Ii:2:008:1 0:1 7 = 02006710 010000
ffff8e2303c4c540 2178709855 S Ii:2:008:1 -115:1 8 <
ffff8e2303c4c540 2178717822 C Ii:2:008:1 0:1 7 = 02006c10 010000
ffff8e2303c4c540 2178717848 S Ii:2:008:1 -115:1 8 <
ffff8e2303c4c540 2178725827 C Ii:2:008:1 0:1 7 = 02006b00 010000
ffff8e2303c4c540 2178725855 S Ii:2:008:1 -115:1 8 <
ffff8e2303c4c540 2178733821 C Ii:2:008:1 0:1 7 = 02006820 010000
ffff8e2303c4c540 2178733847 S Ii:2:008:1 -115:1 8 <
ffff8e2303c4c540 2178741831 C Ii:2:008:1 0:1 7 = 02006420 010000
ffff8e2303c4c540 2178741858 S Ii:2:008:1 -115:1 8 <
ffff8e2303c4c540 2178749820 C Ii:2:008:1 0:1 7 = 02005f20 010000
ffff8e2303c4c540 2178749846 S Ii:2:008:1 -115:1 8 <
ffff8e2303c4c540 2178757820 C Ii:2:008:1 0:1 7 = 02005c50 010000
ffff8e2303c4c540 2178757845 S Ii:2:008:1 -115:1 8 <
ffff8e2302151980 2178762132 S Bo:2:002:2 -115 31 = 55534243 8b050000 00000000 00000600 00000000 00000000 00000000 000000
ffff8e2302151980 2178762163 C Bo:2:002:2 0 31 >
ffff8e2302151980 2178762170 S Bi:2:002:1 -115 13 <
ffff8e2302151980 2178762206 C Bi:2:002:1 0 13 = 55534253 8b050000 00000000 00
ffff8e2303c4c540 2178765828 C Ii:2:008:1 0:1 7 = 02005b50 010000
ffff8e2303c4c540 2178765858 S Ii:2:008:1 -115:1 8 <
ffff8e2303c4c540 2178773827 C Ii:2:008:1 0:1 7 = 02005770 010000
ffff8e2303c4c540 2178773853 S Ii:2:008:1 -115:1 8 <
ffff8e2303c4c540 2178781828 C Ii:2:008:1 0:1 7 = 02005390 010000
ffff8e2303c4c540 2178781856 S Ii:2:008:1 -115:1 8 <
ffff8e2303c4c540 2178789821 C Ii:2:008:1 0:1 7 = 02004c80 010000
ffff8e2303c4c540 2178789847 S Ii:2:008:1 -115:1 8 <
ffff8e2303c4c540 2178797821 C Ii:2:008:1 0:1 7 = 02004480 010000
ffff8e2303c4c540 2178797847 S Ii:2:008:1 -115:1 8 <
ffff8e2303c4c540 2178805828 C Ii:2:008:1 0:1 7 = 02003c60 010000
ffff8e2303c4c540 2178805856 S Ii:2:008:1 -115:1 8 <
ffff8e2303c4c540 2178813828 C Ii:2:008:1 0:1 7 = 02003340 010000
ffff8e2303c4c540 2178813854 S Ii:2:008:1 -115:1 8 <
ffff8e2303c4c540 2178821832 C Ii:2:008:1 0:1 7 = 02002e10 010000
ffff8e2303c4c540 2178821858 S Ii:2:008:1 -115:1 8 <
ffff8e2303c4c540 2178829821 C Ii:2:008:1 0:1 7 = 020028f0 000000
ffff8e2303c4c540 2178829848 S Ii:2:008:1 -115:1 8 <
ffff8e2303c4c540 2178837828 C Ii:2:008:1 0:1 7 = 020024d0 000000
ffff8e2303c4c540 2178837853 S Ii:2:008:1 -115:1 8 <
ffff8e2303c4c540 2178845828 C Ii:2:008:1 0:1 7 = 020021a0 000000
ffff8e2303c4c540 2178845855 S Ii:2:008:1 -115:1 8 <
ffff8e2303c4c540 2178853830 C Ii:2:008:1 0:1 7 = 02001f80 000000
ffff8e2303c4c540 2178853855 S Ii:2:008:1 -115:1 8 <
ffff8e2303c4c540 2178861821 C Ii:2:008:1 0:1 7 = 02001e70 000000
ffff8e2303c4c540 2178861849 S Ii:2:008:1 -115:1 8 <
ffff8e2303c4c540 2178869832 C Ii:2:008:1 0:1 7 = 02001d60 000000
ffff8e2303c4c540 2178869858 S Ii:2:008:1 -115:1 8 <
ffff8e2303c4c540 2178877821 C Ii:2:008:1 0:1 7 = 02001b50 000000
ffff8e2303c4c540 2178877847 S Ii:2:008:1 -115:1 8 <
ffff8e2303c4c540 2178885836 C Ii:2:008:1 0:1 7 = 02001950 000000
ffff8e2303c4c540 2178885864 S Ii:2:008:1 -115:1 8 <
ffff8e2303c4c540 2178893823 C Ii:2:008:1 0:1 7 = 02001840 000000
ffff8e2303c4c540 2178893850 S Ii:2:008:1 -115:1 8 <
ffff8e2303c4c540 2178901824 C Ii:2:008:1 0:1 7 = 02001720 000000
ffff8e2303c4c540 2178901851 S Ii:2:008:1 -115:1 8 <
ffff8e2303c4c540 2178909831 C Ii:2:008:1 0:1 7 = 02001610 000000
ffff8e2303c4c540 2178909858 S Ii:2:008:1 -115:1 8 <
ffff8e2303c4c540 2178917822 C Ii:2:008:1 0:1 7 = 02001710 000000
ffff8e2303c4c540 2178917848 S Ii:2:008:1 -115:1 8 <
ffff8e2303c4c540 2178925831 C Ii:2:008:1 0:1 7 = 02001700 000000
ffff8e2303c4c540 2178925858 S Ii:2:008:1 -115:1 8 <
ffff8e2303c4c540 2178933837 C Ii:2:008:1 0:1 7 = 02001800 000000
ffff8e2303c4c540 2178933863 S Ii:2:008:1 -115:1 8 <
ffff8e2303c4c540 2178941831 C Ii:2:008:1 0:1 7 = 020017f0 ff0000
ffff8e2303c4c540 2178941858 S Ii:2:008:1 -115:1 8 <
ffff8e2303c4c540 2178949829 C Ii:2:008:1 0:1 7 = 02001700 000000
ffff8e2303c4c540 2178949854 S Ii:2:008:1 -115:1 8 <
ffff8e2303c4c540 2178957834 C Ii:2:008:1 0:1 7 = 020016f0 ff0000
ffff8e2303c4c540 2178957862 S Ii:2:008:1 -115:1 8 <
ffff8e2303c4c540 2178965823 C Ii:2:008:1 0:1 7 = 020015f0 ff0000
ffff8e2303c4c540 2178965853 S Ii:2:008:1 -115:1 8 <
ffff8e2303c4c540 2178973829 C Ii:2:008:1 0:1 7 = 02001600 000000
ffff8e2303c4c540 2178973855 S Ii:2:008:1 -115:1 8 <
ffff8e2303c4c540 2178981830 C Ii:2:008:1 0:1 7 = 02001a10 000000
ffff8e2303c4c540 2178981856 S Ii:2:008:1 -115:1 8 <
ffff8e2303c4c540 2178989828 C Ii:2:008:1 0:1 7 = 02001b10 000000
ffff8e2303c4c540 2178989855 S Ii:2:008:1 -115:1 8 <
ffff8e2303c4c540 2178997821 C Ii:2:008:1 0:1 7 = 02002030 000000
ffff8e2303c4c540 2178997847 S Ii:2:008:1 -115:1 8 <
ffff8e2303c4c540 2179005831 C Ii:2:008:1 0:1 7 = 02002230 000000
ffff8e2303c4c540 2179005857 S Ii:2:008:1 -115:1 8 <
ffff8e2303c4c540 2179013828 C Ii:2:008:1 0:1 7 = 02002430 000000
ffff8e2303c4c540 2179013854 S Ii:2:008:1 -115:1 8 <
ffff8e2303c4c540 2179021822 C Ii:2:008:1 0:1 7 = 02002730 000000
ffff8e2303c4c540 2179021849 S Ii:2:008:1 -115:1 8 <
ffff8e2303c4c540 2179029821 C Ii:2:008:1 0:1 7 = 02002730 000000
ffff8e2303c4c540 2179029851 S Ii:2:008:1 -115:1 8 <
ffff8e2303c4c540 2179037828 C Ii:2:008:1 0:1 7 = 02002730 000000
ffff8e2303c4c540 2179037854 S Ii:2:008:1 -115:1 8 <
ffff8e2303c4c540 2179045832 C Ii:2:008:1 0:1 7 = 02002930 000000
ffff8e2303c4c540 2179045859 S Ii:2:008:1 -115:1 8 <
ffff8e2303c4c540 2179053822 C Ii:2:008:1 0:1 7 = 02002720 000000
ffff8e2303c4c540 2179053849 S Ii:2:008:1 -115:1 8 <
ffff8e2303c4c540 2179061831 C Ii:2:008:1 0:1 7 = 02002510 000000
ffff8e2303c4c540 2179061855 S Ii:2:008:1 -115:1 8 <
ffff8e2303c4c540 2179069829 C Ii:2:008:1 0:1 7 = 02002010 000000
ffff8e2303c4c540 2179069855 S Ii:2:008:1 -115:1 8 <
ffff8e2303c4c540 2179077822 C Ii:2:008:1 0:1 7 = 02001c00 000000
ffff8e2303c4c540 2179077849 S Ii:2:008:1 -115:1 8 <
ffff8e2303c4c540 2179085827 C Ii:2:008:1 0:1 7 = 02001900 000000
ffff8e2303c4c540 2179085853 S Ii:2:008:1 -115:1 8 <
ffff8e2303c4c540 2179093831 C Ii:2:008:1 0:1 7 = 02001900 000000
ffff8e2303c4c540 2179093857 S Ii:2:008:1 -115:1 8 <
ffff8e2303c4c540 2179101822 C Ii:2:008:1 0:1 7 = 02001900 000000
ffff8e2303c4c540 2179101848 S Ii:2:008:1 -115:1 8 <
ffff8e2303c4c540 2179109832 C Ii:2:008:1 0:1 7 = 02001b00 000000
ffff8e2303c4c540 2179109857 S Ii:2:008:1 -115:1 8 <
ffff8e2303c4c540 2179117829 C Ii:2:008:1 0:1 7 = 02001d00 000000
ffff8e2303c4c540 2179117854 S Ii:2:008:1 -115:1 8 <
ffff8e2303c4c540 2179125829 C Ii:2:008:1 0:1 7 = 02001c00 000000
ffff8e2303c4c540 2179125855 S Ii:2:008:1 -115:1 8 <
ffff8e2303c4c540 2179133823 C Ii:2:008:1 0:1 7 = 02001900 000000
ffff8e2303c4c540 2179133854 S Ii:2:008:1 -115:1 8 <
ffff8e2303c4c540 2179141829 C Ii:2:008:1 0:1 7 = 020012f0 ff0000
ffff8e2303c4c540 2179141855 S Ii:2:008:1 -115:1 8 <
ffff8e2303c4c540 2179149797 C Ii:2:008:1 0:1 7 = 02000bf0 ff0000
ffff8e2303c4c540 2179149819 S Ii:2:008:1 -115:1 8 <
ffff8e2303c4c540 2179157791 C Ii:2:008:1 0:1 7 = 020004d0 ff0000
ffff8e2303c4c540 2179157803 S Ii:2:008:1 -115:1 8 <
ffff8e2303c4c540 2179165822 C Ii:2:008:1 0:1 7 = 020000b0 ff0000
ffff8e2303c4c540 2179165847 S Ii:2:008:1 -115:1 8 <
ffff8e2303c4c540 2179173804 C Ii:2:008:1 0:1 7 = 0200feaf ff0000
ffff8e2303c4c540 2179173824 S Ii:2:008:1 -115:1 8 <
ffff8e2303c4c540 2179181830 C Ii:2:008:1 0:1 7 = 0200fb7f ff0000
ffff8e2303c4c540 2179181855 S Ii:2:008:1 -115:1 8 <
ffff8e2303c4c540 2179189837 C Ii:2:008:1 0:1 7 = 0200fa8f ff0000
ffff8e2303c4c540 2179189852 S Ii:2:008:1 -115:1 8 <
ffff8e2303c4c540 2179197843 C Ii:2:008:1 0:1 7 = 0200f77f ff0000
ffff8e2303c4c540 2179197854 S Ii:2:008:1 -115:1 8 <
ffff8e2303c4c540 2179205810 C Ii:2:008:1 0:1 7 = 0200f79f ff0000
ffff8e2303c4c540 2179205826 S Ii:2:008:1 -115:1 8 <
ffff8e2303c4c540 2179213828 C Ii:2:008:1 0:1 7 = 0200f8af ff0000
ffff8e2303c4c540 2179213856 S Ii:2:008:1 -115:1 8 <
ffff8e2303c4c540 2179221833 C Ii:2:008:1 0:1 7 = 0200f99f ff0000
ffff8e2303c4c540 2179221849 S Ii:2:008:1 -115:1 8 <
ffff8e2303c4c540 2179229796 C Ii:2:008:1 0:1 7 = 0200fa8f ff0000
ffff8e2303c4c540 2179229812 S Ii:2:008:1 -115:1 8 <
ffff8e2303c4c540 2179237795 C Ii:2:008:1 0:1 7 = 0200f88f ff0000
ffff8e2303c4c540 2179237811 S Ii:2:008:1 -115:1 8 <
ffff8e2303c4c540 2179245829 C Ii:2:008:1 0:1 7 = 0200f97f ff0000
ffff8e2303c4c540 2179245846 S Ii:2:008:1 -115:1 8 <
ffff8e2303c4c540 2179253832 C Ii:2:008:1 0:1 7 = 0200f76f ff0000
ffff8e2303c4c540 2179253849 S Ii:2:008:1 -115:1 8 <
ffff8e2303c4c540 2179261844 C Ii:2:008:1 0:1 7 = 0200f78f ff0000
ffff8e2303c4c540 2179261860 S Ii:2:008:1 -115:1 8 <
ffff8e2303c4c540 2179269795 C Ii:2:008:1 0:1 7 = 0200fa9f ff0000
ffff8e2303c4c540 2179269818 S Ii:2:008:1 -115:1 8 <
ffff8e2303c4c540 2179277830 C Ii:2:008:1 0:1 7 = 0200faaf ff0000
ffff8e2303c4c540 2179277853 S Ii:2:008:1 -115:1 8 <
ffff8e2303c4c540 2179285834 C Ii:2:008:1 0:1 7 = 0200fcbf ff0000
ffff8e2303c4c540 2179285860 S Ii:2:008:1 -115:1 8 <
ffff8e2303c4c540 2179293795 C Ii:2:008:1 0:1 7 = 0200fcbf ff0000
ffff8e2303c4c540 2179293816 S Ii:2:008:1 -115:1 8 <
ffff8e2303c4c540 2179301832 C Ii:2:008:1 0:1 7 = 0200fcbf ff0000
ffff8e2303c4c540 2179301855 S Ii:2:008:1 -115:1 8 <
ffff8e2303c4c540 2179309835 C Ii:2:008:1 0:1 7 = 0200fdaf ff0000
ffff8e2303c4c540 2179309860 S Ii:2:008:1 -115:1 8 <
ffff8e2303c4c540 2179317837 C Ii:2:008:1 0:1 7 = 0200fbaf ff0000
ffff8e2303c4c540 2179317869 S Ii:2:008:1 -115:1 8 <
ffff8e2303c4c540 2179325827 C Ii:2:008:1 0:1 7 = 0200fccf ff0000
ffff8e2303c4c540 2179325853 S Ii:2:008:1 -115:1 8 <
ffff8e2303c4c540 2179333830 C Ii:2:008:1 0:1 7 = 0200fbbf ff0000
ffff8e2303c4c540 2179333857 S Ii:2:008:1 -115:1 8 <
ffff8e2303c4c540 2179341830 C Ii:2:008:1 0:1 7 = 0200fbbf ff0000
ffff8e2303c4c540 2179341856 S Ii:2:008:1 -115:1 8 <
ffff8e2303c4c540 2179349826 C Ii:2:008:1 0:1 7 = 0200fbbf ff0000
ffff8e2303c4c540 2179349852 S Ii:2:008:1 -115:1 8 <
ffff8e2303c4c540 2179357829 C Ii:2:008:1 0:1 7 = 0200fc9f ff0000
ffff8e2303c4c540 2179357856 S Ii:2:008:1 -115:1 8 <
ffff8e2303c4c540 2179365836 C Ii:2:008:1 0:1 7 = 0200fb9f ff0000
ffff8e2303c4c540 2179365862 S Ii:2:008:1 -115:1 8 <
ffff8e2303c4c540 2179372829 C Ii:2:008:1 0:1 7 = 0200fa8f ff0000
ffff8e2303c4c540 2179372855 S Ii:2:008:1 -115:1 8 <
ffff8e2303c4c540 2179381825 C Ii:2:008:1 0:1 7 = 0200fa9f ff0000
ffff8e2303c4c540 2179381853 S Ii:2:008:1 -115:1 8 <
ffff8e2303c4c540 2179388830 C Ii:2:008:1 0:1 7 = 0200faaf ff0000
ffff8e2303c4c540 2179388855 S Ii:2:008:1 -115:1 8 <
ffff8e2303c4c540 2179396830 C Ii:2:008:1 0:1 7 = 0200faaf ff0000
ffff8e2303c4c540 2179396856 S Ii:2:008:1 -115:1 8 <
ffff8e2303c4c540 2179404825 C Ii:2:008:1 0:1 7 = 0200fabf ff0000
ffff8e2303c4c540 2179404852 S Ii:2:008:1 -115:1 8 <
ffff8e2303c4c540 2179412813 C Ii:2:008:1 0:1 7 = 0200f8cf ff0000
ffff8e2303c4c540 2179412834 S Ii:2:008:1 -115:1 8 <
ffff8e2303c4c540 2179420830 C Ii:2:008:1 0:1 7 = 0200f9cf ff0000
ffff8e2303c4c540 2179420856 S Ii:2:008:1 -115:1 8 <
ffff8e2303c4c540 2179428831 C Ii:2:008:1 0:1 7 = 0200f8bf ff0000
ffff8e2303c4c540 2179428854 S Ii:2:008:1 -115:1 8 <
ffff8e2303c4c540 2179436797 C Ii:2:008:1 0:1 7 = 0200f9cf ff0000
ffff8e2303c4c540 2179436816 S Ii:2:008:1 -115:1 8 <
ffff8e2303c4c540 2179444833 C Ii:2:008:1 0:1 7 = 0200f9cf ff0000
ffff8e2303c4c540 2179444859 S Ii:2:008:1 -115:1 8 <
ffff8e2303c4c540 2179452824 C Ii:2:008:1 0:1 7 = 0200f8ef ff0000
ffff8e2303c4c540 2179452849 S Ii:2:008:1 -115:1 8 <
ffff8e2303c4c540 2179460837 C Ii:2:008:1 0:1 7 = 0200faff ff0000
ffff8e2303c4c540 2179460863 S Ii:2:008:1 -115:1 8 <
ffff8e2303c4c540 2179468796 C Ii:2:008:1 0:1 7 = 0200f8ff ff0000
ffff8e2303c4c540 2179468814 S Ii:2:008:1 -115:1 8 <
ffff8e2303c4c540 2179476831 C Ii:2:008:1 0:1 7 = 0200f9ff ff0000
ffff8e2303c4c540 2179476855 S Ii:2:008:1 -115:1 8 <
ffff8e2303c4c540 2179484833 C Ii:2:008:1 0:1 7 = 0200f9ef ff0000
ffff8e2303c4c540 2179484859 S Ii:2:008:1 -115:1 8 <
ffff8e2303c4c540 2179492834 C Ii:2:008:1 0:1 7 = 0200faff ff0000
ffff8e2303c4c540 2179492858 S Ii:2:008:1 -115:1 8 <
ffff8e2303c4c540 2179500796 C Ii:2:008:1 0:1 7 = 0200fbff ff0000
ffff8e2303c4c540 2179500815 S Ii:2:008:1 -115:1 8 <
ffff8e2303c4c540 2179508833 C Ii:2:008:1 0:1 7 = 0200fd0f 000000
ffff8e2303c4c540 2179508859 S Ii:2:008:1 -115:1 8 <
ffff8e2303c4c540 2179516831 C Ii:2:008:1 0:1 7 = 0200fd0f 000000
ffff8e2303c4c540 2179516854 S Ii:2:008:1 -115:1 8 <
ffff8e2303c4c540 2179524833 C Ii:2:008:1 0:1 7 = 0200fe0f 000000
ffff8e2303c4c540 2179524858 S Ii:2:008:1 -115:1 8 <
ffff8e2303c4c540 2179532813 C Ii:2:008:1 0:1 7 = 0200ff0f 000000
ffff8e2303c4c540 2179532835 S Ii:2:008:1 -115:1 8 <
ffff8e2303c4c540 2179540831 C Ii:2:008:1 0:1 7 = 0200fd0f 000000
ffff8e2303c4c540 2179540854 S Ii:2:008:1 -115:1 8 <
ffff8e2303c4c540 2179548832 C Ii:2:008:1 0:1 7 = 0200fb0f 000000
ffff8e2303c4c540 2179548858 S Ii:2:008:1 -115:1 8 <
ffff8e2303c4c540 2179556832 C Ii:2:008:1 0:1 7 = 0200fc0f 000000
ffff8e2303c4c540 2179556855 S Ii:2:008:1 -115:1 8 <
ffff8e2303c4c540 2179564796 C Ii:2:008:1 0:1 7 = 0200fb0f 000000
ffff8e2303c4c540 2179564814 S Ii:2:008:1 -115:1 8 <
ffff8e2303c4c540 2179572827 C Ii:2:008:1 0:1 7 = 0200fd0f 000000
ffff8e2303c4c540 2179572852 S Ii:2:008:1 -115:1 8 <
ffff8e2303c4c540 2179580823 C Ii:2:008:1 0:1 7 = 0200fd0f 000000
ffff8e2303c4c540 2179580848 S Ii:2:008:1 -115:1 8 <
ffff8e2303c4c540 2179588848 C Ii:2:008:1 0:1 7 = 0200fc1f 000000
ffff8e2303c4c540 2179588866 S Ii:2:008:1 -115:1 8 <
ffff8e2303c4c540 2179596831 C Ii:2:008:1 0:1 7 = 0200fc2f 000000
ffff8e2303c4c540 2179596847 S Ii:2:008:1 -115:1 8 <
ffff8e2303c4c540 2179604830 C Ii:2:008:1 0:1 7 = 0200f94f 000000
ffff8e2303c4c540 2179604847 S Ii:2:008:1 -115:1 8 <
ffff8e2303c4c540 2179612825 C Ii:2:008:1 0:1 7 = 0200f94f 000000
ffff8e2303c4c540 2179612842 S Ii:2:008:1 -115:1 8 <
ffff8e2303c4c540 2179620831 C Ii:2:008:1 0:1 7 = 0200f74f 000000
ffff8e2303c4c540 2179620861 S Ii:2:008:1 -115:1 8 <
ffff8e2303c4c540 2179628796 C Ii:2:008:1 0:1 7 = 0200f64f 000000
ffff8e2303c4c540 2179628813 S Ii:2:008:1 -115:1 8 <
ffff8e2303c4c540 2179636824 C Ii:2:008:1 0:1 7 = 0200f62f 000000
ffff8e2303c4c540 2179636841 S Ii:2:008:1 -115:1 8 <
ffff8e2303c4c540 2179644835 C Ii:2:008:1 0:1 7 = 0200f63f 000000
ffff8e2303c4c540 2179644852 S Ii:2:008:1 -115:1 8 <
ffff8e2303c4c540 2179652846 C Ii:2:008:1 0:1 7 = 0200f72f 000000
ffff8e2303c4c540 2179652862 S Ii:2:008:1 -115:1 8 <
ffff8e2303c4c540 2179660832 C Ii:2:008:1 0:1 7 = 0200f73f 000000
ffff8e2303c4c540 2179660848 S Ii:2:008:1 -115:1 8 <
ffff8e2303c4c540 2179668831 C Ii:2:008:1 0:1 7 = 0200f73f 000000
ffff8e2303c4c540 2179668848 S Ii:2:008:1 -115:1 8 <
ffff8e2303c4c540 2179676832 C Ii:2:008:1 0:1 7 = 0200f73f 000000
ffff8e2303c4c540 2179676849 S Ii:2:008:1 -115:1 8 <
ffff8e2303c4c540 2179684825 C Ii:2:008:1 0:1 7 = 0200f83f 000000
ffff8e2303c4c540 2179684853 S Ii:2:008:1 -115:1 8 <
ffff8e2303c4c540 2179692796 C Ii:2:008:1 0:1 7 = 0200f93f 000000
ffff8e2303c4c540 2179692813 S Ii:2:008:1 -115:1 8 <
ffff8e2303c4c540 2179700824 C Ii:2:008:1 0:1 7 = 0200f93f 000000
ffff8e2303c4c540 2179700840 S Ii:2:008:1 -115:1 8 <
ffff8e2303c4c540 2179708831 C Ii:2:008:1 0:1 7 = 0200fb2f 000000
ffff8e2303c4c540 2179708848 S Ii:2:008:1 -115:1 8 <
ffff8e2303c4c540 2179716849 C Ii:2:008:1 0:1 7 = 0200f92f 000000
ffff8e2303c4c540 2179716865 S Ii:2:008:1 -115:1 8 <
ffff8e2303c4c540 2179724803 C Ii:2:008:1 0:1 7 = 0200fb2f 000000
ffff8e2303c4c540 2179724820 S Ii:2:008:1 -115:1 8 <
ffff8e2303c4c540 2179732831 C Ii:2:008:1 0:1 7 = 0200fc0f 000000
ffff8e2303c4c540 2179732847 S Ii:2:008:1 -115:1 8 <
ffff8e2303c4c540 2179740836 C Ii:2:008:1 0:1 7 = 0200fb1f 000000
ffff8e2303c4c540 2179740852 S Ii:2:008:1 -115:1 8 <
ffff8e2303c4c540 2179748826 C Ii:2:008:1 0:1 7 = 0200fe0f 000000
ffff8e2303c4c540 2179748843 S Ii:2:008:1 -115:1 8 <
ffff8e2303c4c540 2179756797 C Ii:2:008:1 0:1 7 = 0200fe0f 000000
ffff8e2303c4c540 2179756813 S Ii:2:008:1 -115:1 8 <
ffff8e2303c4c540 2179764838 C Ii:2:008:1 0:1 7 = 0200ff0f 000000
ffff8e2303c4c540 2179764854 S Ii:2:008:1 -115:1 8 <
ffff8e2303c4c540 2179828832 C Ii:2:008:1 0:1 7 = 0200ff0f 000000
ffff8e2303c4c540 2179828848 S Ii:2:008:1 -115:1 8 <
ffff8e2303c4c540 2179844836 C Ii:2:008:1 0:1 7 = 0200ff0f 000000
ffff8e2303c4c540 2179844852 S Ii:2:008:1 -115:1 8 <
ffff8e2303c4c540 2179852828 C Ii:2:008:1 0:1 7 = 0200ff0f 000000
ffff8e2303c4c540 2179852856 S Ii:2:008:1 -115:1 8 <
ffff8e2303c4c540 2179908832 C Ii:2:008:1 0:1 7 = 0200ff0f 000000
ffff8e2303c4c540 2179908858 S Ii:2:008:1 -115:1 8 <
ffff8e2303c4c540 2179924826 C Ii:2:008:1 0:1 7 = 0200ff0f 000000
ffff8e2303c4c540 2179924853 S Ii:2:008:1 -115:1 8 <
ffff8e2303c4c540 2179932828 C Ii:2:008:1 0:1 7 = 0200ff0f 000000
ffff8e2303c4c540 2179932854 S Ii:2:008:1 -115:1 8 <
ffff8e2303c4c540 2180220843 C Ii:2:008:1 0:1 7 = 02010000 000000
ffff8e2303c4c540 2180220877 S Ii:2:008:1 -115:1 8 <
ffff8e2303c4c540 2180324834 C Ii:2:008:1 0:1 7 = 02000000 000000
ffff8e2303c4c540 2180324860 S Ii:2:008:1 -115:1 8 <
ffff8e2302151980 2180810127 S Bo:2:002:2 -115 31 = 55534243 8c050000 00000000 00000600 00000000 00000000 00000000 000000
ffff8e2302151980 2180810165 C Bo:2:002:2 0 31 >
ffff8e2302151980 2180810173 S Bi:2:002:1 -115 13 <
ffff8e2302151980 2180810220 C Bi:2:002:1 0 13 = 55534253 8c050000 00000000 00
ffff8e2303c4c540 2181252841 C Ii:2:008:1 0:1 7 = 0200ff4f 000000
ffff8e2303c4c540 2181252864 S Ii:2:008:1 -115:1 8 <
ffff8e2303c4c540 2181260841 C Ii:2:008:1 0:1 7 = 02000060 000000
ffff8e2303c4c540 2181260858 S Ii:2:008:1 -115:1 8 <
ffff8e2303c4c540 2181268838 C Ii:2:008:1 0:1 7 = 020000a0 000000
ffff8e2303c4c540 2181268855 S Ii:2:008:1 -115:1 8 <
ffff8e2303c4c540 2181276843 C Ii:2:008:1 0:1 7 = 02000210 010000
ffff8e2303c4c540 2181276859 S Ii:2:008:1 -115:1 8 <
ffff8e2303c4c540 2181284832 C Ii:2:008:1 0:1 7 = 02000630 010000
ffff8e2303c4c540 2181284850 S Ii:2:008:1 -115:1 8 <
ffff8e2303c4c540 2181292840 C Ii:2:008:1 0:1 7 = 02000860 010000
ffff8e2303c4c540 2181292856 S Ii:2:008:1 -115:1 8 <
ffff8e2303c4c540 2181300838 C Ii:2:008:1 0:1 7 = 02000a80 010000
ffff8e2303c4c540 2181300854 S Ii:2:008:1 -115:1 8 <
ffff8e2303c4c540 2181308838 C Ii:2:008:1 0:1 7 = 02000980 010000
ffff8e2303c4c540 2181308855 S Ii:2:008:1 -115:1 8 <
ffff8e2303c4c540 2181316832 C Ii:2:008:1 0:1 7 = 02000870 010000
ffff8e2303c4c540 2181316848 S Ii:2:008:1 -115:1 8 <
ffff8e2303c4c540 2181324830 C Ii:2:008:1 0:1 7 = 02000840 010000
ffff8e2303c4c540 2181324846 S Ii:2:008:1 -115:1 8 <
ffff8e2303c4c540 2181332842 C Ii:2:008:1 0:1 7 = 02000920 010000
ffff8e2303c4c540 2181332859 S Ii:2:008:1 -115:1 8 <
ffff8e2303c4c540 2181340843 C Ii:2:008:1 0:1 7 = 02000b00 010000
ffff8e2303c4c540 2181340859 S Ii:2:008:1 -115:1 8 <
ffff8e2303c4c540 2181348839 C Ii:2:008:1 0:1 7 = 02000cf0 000000
ffff8e2303c4c540 2181348856 S Ii:2:008:1 -115:1 8 <
ffff8e2303c4c540 2181356840 C Ii:2:008:1 0:1 7 = 02000df0 000000
ffff8e2303c4c540 2181356856 S Ii:2:008:1 -115:1 8 <
ffff8e2303c4c540 2181364838 C Ii:2:008:1 0:1 7 = 02000e10 010000
ffff8e2303c4c540 2181364856 S Ii:2:008:1 -115:1 8 <
ffff8e2303c4c540 2181372838 C Ii:2:008:1 0:1 7 = 02000f20 010000
ffff8e2303c4c540 2181372854 S Ii:2:008:1 -115:1 8 <
ffff8e2303c4c540 2181380808 C Ii:2:008:1 0:1 7 = 02000f40 010000
ffff8e2303c4c540 2181380826 S Ii:2:008:1 -115:1 8 <
ffff8e2303c4c540 2181388810 C Ii:2:008:1 0:1 7 = 02001070 010000
ffff8e2303c4c540 2181388834 S Ii:2:008:1 -115:1 8 <
ffff8e2303c4c540 2181396809 C Ii:2:008:1 0:1 7 = 02001090 010000
ffff8e2303c4c540 2181396830 S Ii:2:008:1 -115:1 8 <
ffff8e2303c4c540 2181404831 C Ii:2:008:1 0:1 7 = 020011b0 010000
ffff8e2303c4c540 2181404848 S Ii:2:008:1 -115:1 8 <
ffff8e2303c4c540 2181412838 C Ii:2:008:1 0:1 7 = 020010c0 010000
ffff8e2303c4c540 2181412856 S Ii:2:008:1 -115:1 8 <
ffff8e2303c4c540 2181420841 C Ii:2:008:1 0:1 7 = 020010b0 010000
ffff8e2303c4c540 2181420858 S Ii:2:008:1 -115:1 8 <
ffff8e2303c4c540 2181428833 C Ii:2:008:1 0:1 7 = 02001090 010000
ffff8e2303c4c540 2181428850 S Ii:2:008:1 -115:1 8 <
ffff8e2303c4c540 2181436845 C Ii:2:008:1 0:1 7 = 02000e90 010000
ffff8e2303c4c540 2181436862 S Ii:2:008:1 -115:1 8 <
ffff8e2303c4c540 2181444842 C Ii:2:008:1 0:1 7 = 02000d80 010000
ffff8e2303c4c540 2181444859 S Ii:2:008:1 -115:1 8 <
ffff8e2303c4c540 2181452832 C Ii:2:008:1 0:1 7 = 02000d80 010000
ffff8e2303c4c540 2181452849 S Ii:2:008:1 -115:1 8 <
ffff8e2303c4c540 2181460843 C Ii:2:008:1 0:1 7 = 02000d70 010000
ffff8e2303c4c540 2181460859 S Ii:2:008:1 -115:1 8 <
ffff8e2303c4c540 2181468843 C Ii:2:008:1 0:1 7 = 02000d80 010000
ffff8e2303c4c540 2181468860 S Ii:2:008:1 -115:1 8 <
ffff8e2303c4c540 2181476804 C Ii:2:008:1 0:1 7 = 02000c50 010000
ffff8e2303c4c540 2181476821 S Ii:2:008:1 -115:1 8 <
ffff8e2303c4c540 2181484846 C Ii:2:008:1 0:1 7 = 02000a20 010000
ffff8e2303c4c540 2181484874 S Ii:2:008:1 -115:1 8 <
ffff8e2303c4c540 2181492834 C Ii:2:008:1 0:1 7 = 020008f0 000000
ffff8e2303c4c540 2181492851 S Ii:2:008:1 -115:1 8 <
ffff8e2303c4c540 2181500831 C Ii:2:008:1 0:1 7 = 020007d0 000000
ffff8e2303c4c540 2181500848 S Ii:2:008:1 -115:1 8 <
ffff8e2303c4c540 2181508833 C Ii:2:008:1 0:1 7 = 020007d0 000000
ffff8e2303c4c540 2181508849 S Ii:2:008:1 -115:1 8 <
ffff8e2303c4c540 2181516832 C Ii:2:008:1 0:1 7 = 020007d0 000000
ffff8e2303c4c540 2181516850 S Ii:2:008:1 -115:1 8 <
ffff8e2303c4c540 2181524833 C Ii:2:008:1 0:1 7 = 020007f0 000000
ffff8e2303c4c540 2181524849 S Ii:2:008:1 -115:1 8 <
ffff8e2303c4c540 2181532840 C Ii:2:008:1 0:1 7 = 020008e0 000000
ffff8e2303c4c540 2181532857 S Ii:2:008:1 -115:1 8 <
ffff8e2303c4c540 2181540839 C Ii:2:008:1 0:1 7 = 020009d0 000000
ffff8e2303c4c540 2181540856 S Ii:2:008:1 -115:1 8 <
ffff8e2303c4c540 2181548846 C Ii:2:008:1 0:1 7 = 020009c0 000000
ffff8e2303c4c540 2181548862 S Ii:2:008:1 -115:1 8 <
ffff8e2303c4c540 2181556832 C Ii:2:008:1 0:1 7 = 02000790 000000
ffff8e2303c4c540 2181556850 S Ii:2:008:1 -115:1 8 <
ffff8e2303c4c540 2181564831 C Ii:2:008:1 0:1 7 = 02000780 000000
ffff8e2303c4c540 2181564848 S Ii:2:008:1 -115:1 8 <
ffff8e2303c4c540 2181572841 C Ii:2:008:1 0:1 7 = 02000740 000000
ffff8e2303c4c540 2181572858 S Ii:2:008:1 -115:1 8 <
ffff8e2303c4c540 2181580833 C Ii:2:008:1 0:1 7 = 02000630 000000
ffff8e2303c4c540 2181580850 S Ii:2:008:1 -115:1 8 <
ffff8e2303c4c540 2181588840 C Ii:2:008:1 0:1 7 = 02000510 000000
ffff8e2303c4c540 2181588856 S Ii:2:008:1 -115:1 8 <
ffff8e2303c4c540 2181596839 C Ii:2:008:1 0:1 7 = 02000400 000000
ffff8e2303c4c540 2181596855 S Ii:2:008:1 -115:1 8 <
ffff8e2303c4c540 2181604834 C Ii:2:008:1 0:1 7 = 02000100 000000
ffff8e2303c4c540 2181604850 S Ii:2:008:1 -115:1 8 <
ffff8e2303c4c540 2181628840 C Ii:2:008:1 0:1 7 = 02000100 000000
ffff8e2303c4c540 2181628856 S Ii:2:008:1 -115:1 8 <
ffff8e2303c4c540 2181636839 C Ii:2:008:1 0:1 7 = 02000100 000000
ffff8e2303c4c540 2181636854 S Ii:2:008:1 -115:1 8 <
ffff8e2303c4c540 2181644824 C Ii:2:008:1 0:1 7 = 02000200 000000
ffff8e2303c4c540 2181644841 S Ii:2:008:1 -115:1 8 <
ffff8e2303c4c540 2181652839 C Ii:2:008:1 0:1 7 = 020003f0 ff0000
ffff8e2303c4c540 2181652856 S Ii:2:008:1 -115:1 8 <
ffff8e2303c4c540 2181660805 C Ii:2:008:1 0:1 7 = 02000200 000000
ffff8e2303c4c540 2181660820 S Ii:2:008:1 -115:1 8 <
ffff8e2303c4c540 2181668811 C Ii:2:008:1 0:1 7 = 020002f0 ff0000
ffff8e2303c4c540 2181668833 S Ii:2:008:1 -115:1 8 <
ffff8e2303c4c540 2181676842 C Ii:2:008:1 0:1 7 = 020002f0 ff0000
ffff8e2303c4c540 2181676859 S Ii:2:008:1 -115:1 8 <
ffff8e2303c4c540 2181684840 C Ii:2:008:1 0:1 7 = 020002f0 ff0000
ffff8e2303c4c540 2181684856 S Ii:2:008:1 -115:1 8 <
ffff8e2303c4c540 2181692836 C Ii:2:008:1 0:1 7 = 020003d0 ff0000
ffff8e2303c4c540 2181692853 S Ii:2:008:1 -115:1 8 <
ffff8e2303c4c540 2181699839 C Ii:2:008:1 0:1 7 = 020004d0 ff0000
ffff8e2303c4c540 2181699855 S Ii:2:008:1 -115:1 8 <
ffff8e2303c4c540 2181707843 C Ii:2:008:1 0:1 7 = 020004b0 ff0000
ffff8e2303c4c540 2181707860 S Ii:2:008:1 -115:1 8 <
ffff8e2303c4c540 2181715833 C Ii:2:008:1 0:1 7 = 020006b0 ff0000
ffff8e2303c4c540 2181715850 S Ii:2:008:1 -115:1 8 <
ffff8e2303c4c540 2181723844 C Ii:2:008:1 0:1 7 = 020006b0 ff0000
ffff8e2303c4c540 2181723860 S Ii:2:008:1 -115:1 8 <
ffff8e2303c4c540 2181731843 C Ii:2:008:1 0:1 7 = 020006a0 ff0000
ffff8e2303c4c540 2181731860 S Ii:2:008:1 -115:1 8 <
ffff8e2303c4c540 2181739835 C Ii:2:008:1 0:1 7 = 020006c0 ff0000
ffff8e2303c4c540 2181739852 S Ii:2:008:1 -115:1 8 <
ffff8e2303c4c540 2181747842 C Ii:2:008:1 0:1 7 = 020003d0 ff0000
ffff8e2303c4c540 2181747858 S Ii:2:008:1 -115:1 8 <
ffff8e2303c4c540 2181755842 C Ii:2:008:1 0:1 7 = 020004c0 ff0000
ffff8e2303c4c540 2181755859 S Ii:2:008:1 -115:1 8 <
ffff8e2303c4c540 2181763847 C Ii:2:008:1 0:1 7 = 020004c0 ff0000
ffff8e2303c4c540 2181763863 S Ii:2:008:1 -115:1 8 <
ffff8e2303c4c540 2181771832 C Ii:2:008:1 0:1 7 = 020004d0 ff0000
ffff8e2303c4c540 2181771849 S Ii:2:008:1 -115:1 8 <
ffff8e2303c4c540 2181779833 C Ii:2:008:1 0:1 7 = 020003c0 ff0000
ffff8e2303c4c540 2181779849 S Ii:2:008:1 -115:1 8 <
ffff8e2303c4c540 2181787834 C Ii:2:008:1 0:1 7 = 020003e0 ff0000
ffff8e2303c4c540 2181787851 S Ii:2:008:1 -115:1 8 <
ffff8e2303c4c540 2181795840 C Ii:2:008:1 0:1 7 = 020001d0 ff0000
ffff8e2303c4c540 2181795856 S Ii:2:008:1 -115:1 8 <
ffff8e2303c4c540 2181803834 C Ii:2:008:1 0:1 7 = 020002e0 ff0000
ffff8e2303c4c540 2181803851 S Ii:2:008:1 -115:1 8 <
ffff8e2303c4c540 2181811833 C Ii:2:008:1 0:1 7 = 020001e0 ff0000
ffff8e2303c4c540 2181811851 S Ii:2:008:1 -115:1 8 <
ffff8e2303c4c540 2181819841 C Ii:2:008:1 0:1 7 = 020002b0 ff0000
ffff8e2303c4c540 2181819857 S Ii:2:008:1 -115:1 8 <
ffff8e2303c4c540 2181827805 C Ii:2:008:1 0:1 7 = 020003c0 ff0000
ffff8e2303c4c540 2181827821 S Ii:2:008:1 -115:1 8 <
ffff8e2303c4c540 2181835843 C Ii:2:008:1 0:1 7 = 020001b0 ff0000
ffff8e2303c4c540 2181835861 S Ii:2:008:1 -115:1 8 <
ffff8e2303c4c540 2181843833 C Ii:2:008:1 0:1 7 = 020002b0 ff0000
ffff8e2303c4c540 2181843849 S Ii:2:008:1 -115:1 8 <
ffff8e2303c4c540 2181851842 C Ii:2:008:1 0:1 7 = 020000c0 ff0000
ffff8e2303c4c540 2181851858 S Ii:2:008:1 -115:1 8 <
ffff8e2303c4c540 2181859843 C Ii:2:008:1 0:1 7 = 020002a0 ff0000
ffff8e2303c4c540 2181859861 S Ii:2:008:1 -115:1 8 <
ffff8e2303c4c540 2181867834 C Ii:2:008:1 0:1 7 = 020001d0 ff0000
ffff8e2303c4c540 2181867850 S Ii:2:008:1 -115:1 8 <
ffff8e2303c4c540 2181875840 C Ii:2:008:1 0:1 7 = 020000a0 ff0000
ffff8e2303c4c540 2181875857 S Ii:2:008:1 -115:1 8 <
ffff8e2303c4c540 2181883842 C Ii:2:008:1 0:1 7 = 020003c0 ff0000
ffff8e2303c4c540 2181883858 S Ii:2:008:1 -115:1 8 <
ffff8e2303c4c540 2181891834 C Ii:2:008:1 0:1 7 = 020001c0 ff0000
ffff8e2303c4c540 2181891851 S Ii:2:008:1 -115:1 8 <
ffff8e2303c4c540 2181899843 C Ii:2:008:1 0:1 7 = 020002c0 ff0000
ffff8e2303c4c540 2181899860 S Ii:2:008:1 -115:1 8 <
ffff8e2303c4c540 2181907834 C Ii:2:008:1 0:1 7 = 020001d0 ff0000
ffff8e2303c4c540 2181907850 S Ii:2:008:1 -115:1 8 <
ffff8e2303c4c540 2181915834 C Ii:2:008:1 0:1 7 = 020000d0 ff0000
ffff8e2303c4c540 2181915851 S Ii:2:008:1 -115:1 8 <
ffff8e2303c4c540 2181923840 C Ii:2:008:1 0:1 7 = 020000d0 ff0000
ffff8e2303c4c540 2181923856 S Ii:2:008:1 -115:1 8 <
ffff8e2303c4c540 2181931835 C Ii:2:008:1 0:1 7 = 020000d0 ff0000
ffff8e2303c4c540 2181931852 S Ii:2:008:1 -115:1 8 <
ffff8e2303c4c540 2181939841 C Ii:2:008:1 0:1 7 = 020000d0 ff0000
ffff8e2303c4c540 2181939857 S Ii:2:008:1 -115:1 8 <
ffff8e2303c4c540 2181955843 C Ii:2:008:1 0:1 7 = 020000f0 ff0000
ffff8e2303c4c540 2181955860 S Ii:2:008:1 -115:1 8 <
ffff8e2303c4c540 2181963835 C Ii:2:008:1 0:1 7 = 020000f0 ff0000
ffff8e2303c4c540 2181963851 S Ii:2:008:1 -115:1 8 <
ffff8e2303c4c540 2181987835 C Ii:2:008:1 0:1 7 = 020001f0 ff0000
ffff8e2303c4c540 2181987852 S Ii:2:008:1 -115:1 8 <
ffff8e2303c4c540 2181995833 C Ii:2:008:1 0:1 7 = 02000100 000000
ffff8e2303c4c540 2181995849 S Ii:2:008:1 -115:1 8 <
ffff8e2303c4c540 2182003834 C Ii:2:008:1 0:1 7 = 020000f0 ff0000
ffff8e2303c4c540 2182003851 S Ii:2:008:1 -115:1 8 <
ffff8e2303c4c540 2182011805 C Ii:2:008:1 0:1 7 = 020001f0 ff0000
ffff8e2303c4c540 2182011821 S Ii:2:008:1 -115:1 8 <
ffff8e2303c4c540 2182091841 C Ii:2:008:1 0:1 7 = 02010000 000000
ffff8e2303c4c540 2182091859 S Ii:2:008:1 -115:1 8 <
ffff8e2303c4c540 2182187836 C Ii:2:008:1 0:1 7 = 02000000 000000
ffff8e2303c4c540 2182187855 S Ii:2:008:1 -115:1 8 <
ffff8e23112d6300 2182194169 S Co:2:011:0 s 40 9a 1312 cc83 0000 0
ffff8e23112d6300 2182194285 C Co:2:011:0 0 0
ffff8e23112d6300 2182194305 S Co:2:011:0 s 40 9a 2518 00c3 0000 0
ffff8e23112d6300 2182194369 C Co:2:011:0 0 0
ffff8e23112d6300 2182194379 S Co:2:011:0 s 40 a4 ff9f 0000 0000 0
ffff8e23112d6300 2182194448 C Co:2:011:0 0 0
ffff8e23112d6300 2182194457 S Co:2:011:0 s 40 9a 2727 0000 0000 0
ffff8e23112d6300 2182194519 C Co:2:011:0 0 0
ffff8e2301f33b00 2182194528 S Ii:2:011:1 -115:1 8 <
ffff8e23112d6300 2182194536 S Ci:2:011:0 s c0 95 0706 0000 0002 2 <
ffff8e23112d6300 2182194631 C Ci:2:011:0 0 2 = 9fee
ffff8e2301f326c0 2182194641 S Bi:2:011:2 -115 32 <
ffff8e2301f32e40 2182194645 S Bi:2:011:2 -115 32 <
ffff8e23112d6300 2182194649 S Co:2:011:0 s 40 a4 ff9f 0000 0000 0
ffff8e23112d6300 2182194735 C Co:2:011:0 0 0
ffff8e23021506c0 2182194889 S Co:2:011:0 s 40 9a 1312 cc83 0000 0
ffff8e23021506c0 2182194974 C Co:2:011:0 0 0
ffff8e23021506c0 2182194989 S Co:2:011:0 s 40 9a 2518 00c3 0000 0
ffff8e23021506c0 2182195053 C Co:2:011:0 0 0
ffff8e23021506c0 2182195064 S Co:2:011:0 s 40 a4 ff9f 0000 0000 0
ffff8e23021506c0 2182195128 C Co:2:011:0 0 0
ffff8e23021506c0 2182195140 S Co:2:011:0 s 40 9a 2727 0000 0000 0
ffff8e23021506c0 2182195203 C Co:2:011:0 0 0
ffff8e23021506c0 2182195228 S Co:2:011:0 s 40 a4 ffbf 0000 0000 0
ffff8e23021506c0 2182195301 C Co:2:011:0 0 0
ffff8e23021506c0 2182195315 S Co:2:011:0 s 40 a4 ffbf 0000 0000 0
ffff8e23021506c0 2182195377 C Co:2:011:0 0 0
ffff8e23021506c0 2182195410 S Co:2:011:0 s 40 a4 ffbf 0000 0000 0
ffff8e23021506c0 2182195482 C Co:2:011:0 0 0
ffff8e23021506c0 2182195495 S Co:2:011:0 s 40 a4 ffbf 0000 0000 0
ffff8e23021506c0 2182195558 C Co:2:011:0 0 0
ffff8e23021506c0 2182195580 S Co:2:011:0 s 40 a4 ffbf 0000 0000 0
ffff8e23021506c0 2182195720 C Co:2:011:0 0 0
ffff8e23021506c0 2182195745 S Co:2:011:0 s 40 a4 ffbf 0000 0000 0
ffff8e23021506c0 2182195810 C Co:2:011:0 0 0
ffff8e23021506c0 2182195823 S Co:2:011:0 s 40 a4 ffff 0000 0000 0
ffff8e23021506c0 2182195887 C Co:2:011:0 0 0
ffff8e23021506c0 2182195911 S Co:2:011:0 s 40 a4 ffff 0000 0000 0
ffff8e23021506c0 2182195978 C Co:2:011:0 0 0
ffff8e2301f32240 2182203482 S Bo:2:011:2 -115 14 = 50524f47 52414d42 54393030 3055
ffff8e2301f32240 2182203533 C Bo:2:011:2 0 14 >
ffff8e2303c4c540 2182211804 C Ii:2:008:1 0:1 7 = 0200ffff ff0000
ffff8e2303c4c540 2182211816 S Ii:2:008:1 -115:1 8 <
ffff8e2303c4c540 2182219804 C Ii:2:008:1 0:1 7 = 0200feef ff0000
ffff8e2303c4c540 2182219815 S Ii:2:008:1 -115:1 8 <
ffff8e2303c4c540 2182227805 C Ii:2:008:1 0:1 7 = 0200ffff ff0000
ffff8e2303c4c540 2182227819 S Ii:2:008:1 -115:1 8 <
ffff8e2303c4c540 2182235806 C Ii:2:008:1 0:1 7 = 0200feef ff0000
ffff8e2303c4c540 2182235822 S Ii:2:008:1 -115:1 8 <
ffff8e2301f326c0 2182291862 C Bi:2:011:2 0 1 = 06
ffff8e2301f326c0 2182291868 S Bi:2:011:2 -115 32 <
ffff8e2301f32240 2182292283 S Bo:2:011:2 -115 1 = 46
ffff8e2301f32240 2182292328 C Bo:2:011:2 0 1 >
ffff8e2301f32e40 2182295982 C Bi:2:011:2 0 16 = 01360174 04000520 02000260 01033004
ffff8e2301f32e40 2182295988 S Bi:2:011:2 -115 32 <
ffff8e2301f32240 2182296325 S Bo:2:011:2 -115 1 = 4d
ffff8e2301f32240 2182296395 C Bo:2:011:2 0 1 >
ffff8e2301f326c0 2182299576 C Bi:2:011:2 0 12 = 52542d39 35302020 20202020
ffff8e2301f326c0 2182299583 S Bi:2:011:2 -115 32 <
ffff8e2303c4c540 2182299801 C Ii:2:008:1 0:1 7 = 0200ff0f 000000
ffff8e2303c4c540 2182299824 S Ii:2:008:1 -115:1 8 <
ffff8e2301f32240 2182300052 S Bo:2:011:2 -115 25 = 53454e44 23040302 0a020910 010a0208 07100c00 05011200 00
ffff8e2301f32240 2182300125 C Bo:2:011:2 0 25 >
ffff8e2301f32e40 2182304323 C Bi:2:011:2 0 1 = 06
ffff8e2301f32e40 2182304330 S Bi:2:011:2 -115 32 <
ffff8e2301f32240 2182305105 S Bo:2:011:2 -115 32 = 57000080 00005223 00005223 00000000 00000073 ffffffff 727b3519 717f3017
ffff8e2301f33740 2182305110 S Bo:2:011:2 -115 32 = 10266d47 135d5223 135d5223 00000000 00000073 ffffffff 727b3519 717e3202
ffff8e2301f32240 2182305171 C Bo:2:011:2 0 32 >
ffff8e2301f32240 2182305175 S Bo:2:011:2 -115 32 = 631c695a 006a5223 006a5223 00000000 00000073 ffffffff 727b3519 717d3517
ffff8e2301f33740 2182305222 C Bo:2:011:2 0 32 >
ffff8e2301f33740 2182305225 S Bo:2:011:2 -115 32 = 10266d47 13785223 13785223 00000000 00000073 ffffffff 727b3519 717c3702
ffff8e2301f32240 2182308023 C Bo:2:011:2 0 32 >
ffff8e2301f32240 2182308026 S Bo:2:011:2 -115 4 = 631c695a
ffff8e2301f33740 2182310732 C Bo:2:011:2 0 32 >
ffff8e2301f32240 2182313494 C Bo:2:011:2 0 4 >
ffff8e2303c4c540 2182315801 C Ii:2:008:1 0:1 7 = 0200ff0f 000000
ffff8e2303c4c540 2182315820 S Ii:2:008:1 -115:1 8 <
ffff8e2303c4c540 2182323802 C Ii:2:008:1 0:1 7 = 0200fe0f 000000
ffff8e2303c4c540 2182323816 S Ii:2:008:1 -115:1 8 <
ffff8e2301f326c0 2182324602 C Bi:2:011:2 0 1 = 06
ffff8e2301f326c0 2182324616 S Bi:2:011:2 -115 32 <
ffff8e2301f32240 2182325099 S Bo:2:011:2 -115 32 = 57008080 001f5223 001f5223 00000000 00000073 ffffffff 727b3519 717a3017
ffff8e2301f33740 2182325103 S Bo:2:011:2 -115 32 = 10266d47 132d5223 132d5223 00000000 00000073 ffffffff 727b3519 71793202
ffff8e2301f32240 2182325161 C Bo:2:011:2 0 32 >
ffff8e2301f32240 2182325163 S Bo:2:011:2 -115 32 = 631c695a 003a5223 003a5223 00000000 00000073 ffffffff 727b3519 71783517
ffff8e2301f33740 2182325210 C Bo:2:011:2 0 32 >
ffff8e2301f33740 2182325212 S Bo:2:011:2 -115 32 = 10266d47 13cd5223 13cd5223 00000000 00000073 ffffffff 727b3519 71773202
ffff8e2301f32240 2182328021 C Bo:2:011:2 0 32 >
ffff8e2301f32240 2182328024 S Bo:2:011:2 -115 4 = 631c695a
ffff8e2301f33740 2182330735 C Bo:2:011:2 0 32 >
ffff8e2301f32240 2182333498 C Bo:2:011:2 0 4 >
ffff8e2301f32e40 2182338928 C Bi:2:011:2 0 1 = 06
ffff8e2301f32e40 2182338931 S Bi:2:011:2 -115 32 <
ffff8e2301f32240 2182339319 S Bo:2:011:2 -115 32 = 57010080 00005323 00005323 00000000 00000073 ffffffff 727b3519 707f3017
ffff8e2301f33740 2182339323 S Bo:2:011:2 -115 32 = 10266d47 135d5323 135d5323 00000000 00000073 ffffffff 727b3519 707e3202
ffff8e2301f32240 2182339381 C Bo:2:011:2 0 32 >
ffff8e2301f32240 2182339383 S Bo:2:011:2 -115 32 = 631c695a 006a5323 006a5323 00000000 00000073 ffffffff 727b3519 707d3517
ffff8e2301f33740 2182339430 C Bo:2:011:2 0 32 >
ffff8e2301f33740 2182339431 S Bo:2:011:2 -115 32 = 10266d47 13785323 13785323 00000000 00000073 ffffffff 727b3519 707c3702
ffff8e2303c4c540 2182339803 C Ii:2:008:1 0:1 7 = 0200ff0f 000000
ffff8e2303c4c540 2182339819 S Ii:2:008:1 -115:1 8 <
ffff8e2301f32240 2182342246 C Bo:2:011:2 0 32 >
ffff8e2301f32240 2182342248 S Bo:2:011:2 -115 4 = 631c695a
ffff8e2301f33740 2182344953 C Bo:2:011:2 0 32 >
ffff8e2301f32240 2182347724 C Bo:2:011:2 0 4 >
ffff8e2303c4c540 2182347800 C Ii:2:008:1 0:1 7 = 0200fe0f 000000
ffff8e2303c4c540 2182347812 S Ii:2:008:1 -115:1 8 <
ffff8e2301f326c0 2182353245 C Bi:2:011:2 0 1 = 06
ffff8e2301f326c0 2182353248 S Bi:2:011:2 -115 32 <
ffff8e2301f32240 2182353628 S Bo:2:011:2 -115 32 = 57018080 001f5323 001f5323 00000000 00000073 ffffffff 727b3519 707a3017
ffff8e2301f33740 2182353633 S Bo:2:011:2 -115 32 = 10266d47 132d5323 132d5323 00000000 00000073 ffffffff 727b3519 70793202
ffff8e2301f32240 2182353735 C Bo:2:011:2 0 32 >
ffff8e2301f32240 2182353740 S Bo:2:011:2 -115 32 = 631c695a 003a5323 003a5323 00000000 00000073 ffffffff 727b3519 70783517
ffff8e2301f33740 2182353784 C Bo:2:011:2 0 32 >
ffff8e2301f33740 2182353785 S Bo:2:011:2 -115 32 = 10266d47 13c85323 13c85323 00000000 00000073 ffffffff 727b3519 70773702
ffff8e2301f32240 2182356556 C Bo:2:011:2 0 32 >
ffff8e2301f32240 2182356562 S Bo:2:011:2 -115 4 = 631c695a
ffff8e2301f33740 2182359385 C Bo:2:011:2 0 32 >
ffff8e2301f32240 2182362101 C Bo:2:011:2 0 4 >
ffff8e2303c4c540 2182363801 C Ii:2:008:1 0:1 7 = 0200ff0f 000000
ffff8e2303c4c540 2182363814 S Ii:2:008:1 -115:1 8 <
ffff8e2301f32e40 2182367544 C Bi:2:011:2 0 1 = 06
ffff8e2301f32e40 2182367551 S Bi:2:011:2 -115 32 <
ffff8e2301f32240 2182367834 S Bo:2:011:2 -115 32 = 57020080 00005423 00005423 00000000 00000073 ffffffff 727b3519 777f3017
ffff8e2301f33740 2182367838 S Bo:2:011:2 -115 32 = 10266d47 135d5423 135d5423 00000000 00000073 ffffffff 727b3519 777e3202
ffff8e2301f32240 2182367896 C Bo:2:011:2 0 32 >
ffff8e2301f32240 2182367900 S Bo:2:011:2 -115 32 = 631c695a 006a5423 006a5423 00000000 00000073 ffffffff 727b3519 777d3517
ffff8e2301f33740 2182367948 C Bo:2:011:2 0 32 >
ffff8e2301f33740 2182367949 S Bo:2:011:2 -115 32 = 10266d47 13785423 13785423 00000000 00000073 ffffffff 727b3519 777c3702
ffff8e2301f32240 2182370737 C Bo:2:011:2 0 32 >
ffff8e2301f32240 2182370743 S Bo:2:011:2 -115 4 = 631c695a
ffff8e2303c4c540 2182371802 C Ii:2:008:1 0:1 7 = 0200ff0f 000000
ffff8e2303c4c540 2182371813 S Ii:2:008:1 -115:1 8 <
ffff8e2301f33740 2182373519 C Bo:2:011:2 0 32 >
ffff8e2301f32240 2182376220 C Bo:2:011:2 0 4 >
ffff8e2301f326c0 2182381720 C Bi:2:011:2 0 1 = 06
ffff8e2301f326c0 2182381725 S Bi:2:011:2 -115 32 <
ffff8e2301f32240 2182382156 S Bo:2:011:2 -115 32 = 57028080 001f5423 001f5423 00000000 00000073 ffffffff 727b3519 777a3017
ffff8e2301f33740 2182382160 S Bo:2:011:2 -115 32 = 10266d47 132d5423 132d5423 00000000 00000073 ffffffff 727b3519 77793202
ffff8e2301f32240 2182382222 C Bo:2:011:2 0 32 >
ffff8e2301f32240 2182382225 S Bo:2:011:2 -115 32 = 631c695a 003a5423 003a5423 00000000 00000073 ffffffff 727b3519 77783517
ffff8e2301f33740 2182382270 C Bo:2:011:2 0 32 >
ffff8e2301f33740 2182382272 S Bo:2:011:2 -115 32 = 10266d47 13c85423 13c85423 00000000 00000073 ffffffff 727b3519 77773702
ffff8e2301f32240 2182385053 C Bo:2:011:2 0 32 >
ffff8e2301f32240 2182385059 S Bo:2:011:2 -115 4 = 631c695a
ffff8e2301f33740 2182387805 C Bo:2:011:2 0 32 >
ffff8e2301f32240 2182390541 C Bo:2:011:2 0 4 >
ffff8e2301f32e40 2182395997 C Bi:2:011:2 0 1 = 06
ffff8e2301f32e40 2182396003 S Bi:2:011:2 -115 32 <
ffff8e2301f32240 2182396331 S Bo:2:011:2 -115 32 = 57030080 00005523 00005523 00000000 00000073 ffffffff 71022074 02034c17
ffff8e2301f33740 2182396335 S Bo:2:011:2 -115 32 = 727b3519 135d5523 135d5523 00000000 00000073 ffffffff 727b3519 767e3202
ffff8e2301f32240 2182396393 C Bo:2:011:2 0 32 >
ffff8e2301f32240 2182396396 S Bo:2:011:2 -115 32 = 631c695a 006a5523 006a5523 00000000 00000073 ffffffff 727b3519 767d3517
ffff8e2301f33740 2182396448 C Bo:2:011:2 0 32 >
ffff8e2301f33740 2182396451 S Bo:2:011:2 -115 32 = 10266d47 13785523 13785523 00000000 00000073 ffffffff 727b3519 767c3702
ffff8e2301f32240 2182399237 C Bo:2:011:2 0 32 >
ffff8e2301f32240 2182399244 S Bo:2:011:2 -115 4 = 631c695a
ffff8e2301f33740 2182402018 C Bo:2:011:2 0 32 >
ffff8e2301f32240 2182404766 C Bo:2:011:2 0 4 >
ffff8e2301f326c0 2182410128 C Bi:2:011:2 0 1 = 06
ffff8e2301f326c0 2182410134 S Bi:2:011:2 -115 32 <
ffff8e2301f32240 2182410447 S Bo:2:011:2 -115 32 = 57038080 001f5523 001f5523 00000000 00000073 ffffffff 727b3519 767a3017
ffff8e2301f33740 2182410450 S Bo:2:011:2 -115 32 = 10266d47 132d5523 132d5523 00000000 00000073 ffffffff 727b3519 76793202
ffff8e2301f32240 2182410508 C Bo:2:011:2 0 32 >
ffff8e2301f32240 2182410512 S Bo:2:011:2 -115 32 = 631c695a 003a5523 003a5523 00000000 00000073 ffffffff 727b3519 76783517
ffff8e2301f33740 2182410557 C Bo:2:011:2 0 32 >
ffff8e2301f33740 2182410560 S Bo:2:011:2 -115 32 = 10266d47 13c85523 13c85523 00000000 00000073 ffffffff 727b3519 76773702
ffff8e2301f32240 2182413373 C Bo:2:011:2 0 32 >
ffff8e2301f32240 2182413379 S Bo:2:011:2 -115 4 = 631c695a
ffff8e2301f33740 2182416143 C Bo:2:011:2 0 32 >
ffff8e2301f32240 2182418848 C Bo:2:011:2 0 4 >
ffff8e2301f32e40 2182424313 C Bi:2:011:2 0 1 = 06
ffff8e2301f32e40 2182424318 S Bi:2:011:2 -115 32 <
ffff8e2301f32240 2182424903 S Bo:2:011:2 -115 32 = 57040080 00005623 00005023 164b5533 00000033 ffffffff 040d337b 1a6f325a
ffff8e2301f33740 2182424908 S Bo:2:011:2 -115 32 = ffffffff 006a5623 006a5023 164b5533 00000033 ffffffff 040d3370 076f4978
ffff8e2301f32240 2182424972 C Bo:2:011:2 0 32 >
ffff8e2301f32240 2182424975 S Bo:2:011:2 -115 32 = 0effffff 001f5623 001f5023 164b5533 00000033 ffffffff 727b3519 757a3007
ffff8e2301f33740 2182425021 C Bo:2:011:2 0 32 >
ffff8e2301f33740 2182425021 S Bo:2:011:2 -115 32 = 737fffff 003a5623 003a5023 164b5533 00000033 ffffffff 727b3519 75783507
ffff8e2301f32240 2182427811 C Bo:2:011:2 0 32 >
ffff8e2301f32240 2182427817 S Bo:2:011:2 -115 4 = 737fffff
ffff8e2301f33740 2182430598 C Bo:2:011:2 0 32 >
ffff8e2301f32240 2182433313 C Bo:2:011:2 0 4 >
ffff8e2301f326c0 2182438788 C Bi:2:011:2 0 1 = 06
ffff8e2301f326c0 2182438793 S Bi:2:011:2 -115 32 <
ffff8e2301f32240 2182439152 S Bo:2:011:2 -115 32 = 57048080 00005723 00005123 164b5533 00000033 ffffffff 040d3779 0a6f445e
ffff8e2301f33740 2182439156 S Bo:2:011:2 -115 32 = 24267456 006a5723 006a5123 164b5533 00000033 ffffffff 040d3379 0a6f325a
ffff8e2301f32240 2182439212 C Bo:2:011:2 0 32 >
ffff8e2301f32240 2182439215 S Bo:2:011:2 -115 32 = ffffffff 001f5723 001f5723 164b5533 00000033 ffffffff 727b3519 747a3007
ffff8e2301f33740 2182439261 C Bo:2:011:2 0 32 >
ffff8e2301f33740 2182439262 S Bo:2:011:2 -115 32 = 737fffff ffffffff ffffffff ffffffff ffffffff ffffffff ffffffff ffffffff
ffff8e2301f32240 2182442020 C Bo:2:011:2 0 32 >
ffff8e2301f32240 2182442025 S Bo:2:011:2 -115 4 = ffffffff
ffff8e2301f33740 2182444803 C Bo:2:011:2 0 32 >
ffff8e2301f32240 2182447541 C Bo:2:011:2 0 4 >
ffff8e2301f32e40 2182453108 C Bi:2:011:2 0 1 = 06
ffff8e2301f32e40 2182453114 S Bi:2:011:2 -115 32 <
ffff8e2301f32240 2182453419 S Bo:2:011:2 -115 32 = 57050080 00003474 00003474 00000000 00000073 ffffffff 777c3319 777f3017
ffff8e2301f33740 2182453422 S Bo:2:011:2 -115 32 = 10266d47 135d3474 135d3474 00000000 00000073 ffffffff 777c3319 777e3202
ffff8e2301f32240 2182453480 C Bo:2:011:2 0 32 >
ffff8e2301f32240 2182453483 S Bo:2:011:2 -115 32 = 631c695a 006a3474 006a3474 00000000 00000073 ffffffff 777c3319 777d3517
ffff8e2301f33740 2182453528 C Bo:2:011:2 0 32 >
ffff8e2301f33740 2182453531 S Bo:2:011:2 -115 32 = 10266d47 13783474 13783474 00000000 00000073 ffffffff 777c3319 777c3702
ffff8e2301f32240 2182456315 C Bo:2:011:2 0 32 >
ffff8e2301f32240 2182456320 S Bo:2:011:2 -115 4 = 631c695a
ffff8e2301f33740 2182459087 C Bo:2:011:2 0 32 >
ffff8e2301f32240 2182461805 C Bo:2:011:2 0 4 >
ffff8e2301f326c0 2182467246 C Bi:2:011:2 0 1 = 06
ffff8e2301f326c0 2182467251 S Bi:2:011:2 -115 32 <
ffff8e2301f32240 2182467575 S Bo:2:011:2 -115 32 = 57058080 001f3474 001f3474 00000000 00000073 ffffffff 777c3319 777a3017
ffff8e2301f33740 2182467579 S Bo:2:011:2 -115 32 = 10266d47 132d3474 132d3474 00000000 00000073 ffffffff 777c3319 77793202
ffff8e2301f32240 2182467637 C Bo:2:011:2 0 32 >
ffff8e2301f32240 2182467640 S Bo:2:011:2 -115 32 = 631c695a 003a3474 003a3474 00000000 00000073 ffffffff 777c3319 77783517
ffff8e2301f33740 2182467754 C Bo:2:011:2 0 32 >
ffff8e2301f33740 2182467757 S Bo:2:011:2 -115 32 = 10266d47 13c83474 13c83474 00000000 00000073 ffffffff 777c3319 77773702
ffff8e2301f32240 2182470449 C Bo:2:011:2 0 32 >
ffff8e2301f32240 2182470453 S Bo:2:011:2 -115 4 = 631c695a
ffff8e2301f33740 2182473234 C Bo:2:011:2 0 32 >
ffff8e2303c4c540 2182475800 C Ii:2:008:1 0:1 7 = 0200ff0f 000000
ffff8e2303c4c540 2182475810 S Ii:2:008:1 -115:1 8 <
ffff8e2301f32240 2182475974 C Bo:2:011:2 0 4 >
ffff8e2301f32e40 2182481380 C Bi:2:011:2 0 1 = 06
ffff8e2301f32e40 2182481384 S Bi:2:011:2 -115 32 <
ffff8e2301f32240 2182481757 S Bo:2:011:2 -115 32 = 57060080 00003574 00003574 00000000 00000073 ffffffff 747f437a 630c417b
ffff8e2301f33740 2182481761 S Bo:2:011:2 -115 32 = 0f6f3404 135d3574 135d3574 00000000 00000073 ffffffff 777c3319 767e3202
ffff8e2301f32240 2182481827 C Bo:2:011:2 0 32 >
ffff8e2301f32240 2182481830 S Bo:2:011:2 -115 32 = 631c695a 006a3574 006a3574 00000000 00000073 ffffffff 777c3319 767d3517
ffff8e2301f33740 2182481876 C Bo:2:011:2 0 32 >
ffff8e2301f33740 2182481878 S Bo:2:011:2 -115 32 = 10266d47 13783574 13783574 00000000 00000073 ffffffff 777c3319 767c3702
ffff8e2303c4c540 2182483802 C Ii:2:008:1 0:1 7 = 0200fd0f 000000
ffff8e2303c4c540 2182483812 S Ii:2:008:1 -115:1 8 <
ffff8e2301f32240 2182484623 C Bo:2:011:2 0 32 >
ffff8e2301f32240 2182484628 S Bo:2:011:2 -115 4 = 631c695a
ffff8e2301f33740 2182487448 C Bo:2:011:2 0 32 >
ffff8e2301f32240 2182490166 C Bo:2:011:2 0 4 >
ffff8e2303c4c540 2182491800 C Ii:2:008:1 0:1 7 = 0200fe0f 000000
ffff8e2303c4c540 2182491808 S Ii:2:008:1 -115:1 8 <
ffff8e2301f326c0 2182495763 C Bi:2:011:2 0 1 = 06
ffff8e2301f326c0 2182495767 S Bi:2:011:2 -115 32 <
ffff8e2301f32240 2182496132 S Bo:2:011:2 -115 32 = 57068080 001f3574 001f3574 00000000 00000073 ffffffff 777c3319 767a3017
ffff8e2301f33740 2182496136 S Bo:2:011:2 -115 32 = 10266d47 132d3574 132d3574 00000000 00000073 ffffffff 777c3319 76793202
ffff8e2301f32240 2182496199 C Bo:2:011:2 0 32 >
ffff8e2301f32240 2182496202 S Bo:2:011:2 -115 32 = 631c695a 003a3574 003a3574 00000000 00000073 ffffffff 777c3319 76783517
ffff8e2301f33740 2182496247 C Bo:2:011:2 0 32 >
ffff8e2301f33740 2182496250 S Bo:2:011:2 -115 32 = 10266d47 001f3074 001f4674 164b5533 00000033 ffffffff 040d3362 0f6f3707
ffff8e2301f32240 2182499021 C Bo:2:011:2 0 32 >
ffff8e2301f32240 2182499027 S Bo:2:011:2 -115 4 = 2022ffff
ffff8e2303c4c540 2182499801 C Ii:2:008:1 0:1 7 = 0200fe0f 000000
ffff8e2303c4c540 2182499810 S Ii:2:008:1 -115:1 8 <
ffff8e2301f33740 2182501805 C Bo:2:011:2 0 32 >
ffff8e2301f32240 2182504555 C Bo:2:011:2 0 4 >
ffff8e2303c4c540 2182507801 C Ii:2:008:1 0:1 7 = 0200ff0f 000000
ffff8e2303c4c540 2182507808 S Ii:2:008:1 -115:1 8 <
ffff8e2301f32e40 2182510041 C Bi:2:011:2 0 1 = 06
ffff8e2301f32e40 2182510047 S Bi:2:011:2 -115 32 <
ffff8e2301f32240 2182510337 S Bo:2:011:2 -115 32 = 57070080 ffffffff ffffffff ffffffff ffffffff ffffffff ffffffff ffffffff
ffff8e2301f33740 2182510341 S Bo:2:011:2 -115 32 = ffffffff 00004823 00004823 00000000 00000033 ffffffff 71022076 131d53ff
ffff8e2301f32240 2182510398 C Bo:2:011:2 0 32 >
ffff8e2301f32240 2182510401 S Bo:2:011:2 -115 32 = ffffffff 007a5823 007a5823 00000000 00000033 ffffffff 0a1c5317 687effff
ffff8e2301f33740 2182510453 C Bo:2:011:2 0 32 >
ffff8e2301f33740 2182510456 S Bo:2:011:2 -115 32 = ffffffff 006a5823 006a5823 00000000 00000033 ffffffff 0a1c53ff ffffffff
ffff8e2301f32240 2182513238 C Bo:2:011:2 0 32 >
ffff8e2301f32240 2182513242 S Bo:2:011:2 -115 4 = ffffffff
ffff8e2301f33740 2182516018 C Bo:2:011:2 0 32 >
ffff8e2301f32240 2182518766 C Bo:2:011:2 0 4 >
ffff8e2301f326c0 2182524176 C Bi:2:011:2 0 1 = 06
ffff8e2301f326c0 2182524181 S Bi:2:011:2 -115 32 <
ffff8e2301f32240 2182524587 S Bo:2:011:2 -115 32 = 57078080 005a5823 005a5823 00000000 00000033 ffffffff 0a1c5317 6e7effff
ffff8e2301f33740 2182524591 S Bo:2:011:2 -115 32 = ffffffff 004a5823 004a5823 00000000 00000033 ffffffff 0a1c5317 6e7dffff
ffff8e2301f32240 2182524648 C Bo:2:011:2 0 32 >
ffff8e2301f32240 2182524652 S Bo:2:011:2 -115 32 = ffffffff 00df5823 002f5274 00000000 00000033 ffffffff 024f2d0e 726f2b06
ffff8e2301f33740 2182524744 C Bo:2:011:2 0 32 >
ffff8e2301f33740 2182524748 S Bo:2:011:2 -115 32 = ffffffff 00cf5823 001f5274 00000000 00000033 ffffffff 024f2d0e 72ffffff
ffff8e2301f32240 2182527456 C Bo:2:011:2 0 32 >
ffff8e2301f32240 2182527460 S Bo:2:011:2 -115 4 = ffffffff
ffff8e2301f33740 2182530233 C Bo:2:011:2 0 32 >
ffff8e2301f32240 2182533001 C Bo:2:011:2 0 4 >
ffff8e2301f32e40 2182538495 C Bi:2:011:2 0 1 = 06
ffff8e2301f32e40 2182538500 S Bi:2:011:2 -115 32 <
ffff8e2301f32240 2182538847 S Bo:2:011:2 -115 32 = 57080080 003f5823 000f5274 00000000 00000033 ffffffff 024f2d0e 726f2d06
ffff8e2301f33740 2182538851 S Bo:2:011:2 -115 32 = ffffffff 002f5823 007f5274 00000000 00000033 ffffffff 024f2d0e 726f2d05
ffff8e2301f32240 2182538909 C Bo:2:011:2 0 32 >
ffff8e2301f32240 2182538912 S Bo:2:011:2 -115 32 = ffffffff 00df5823 002f5274 00000000 00000033 ffffffff 024f2d0e 716f2b06
ffff8e2301f33740 2182538957 C Bo:2:011:2 0 32 >
ffff8e2301f33740 2182538959 S Bo:2:011:2 -115 32 = ffffffff 00cf5823 001f5274 00000000 00000033 ffffffff 024f2d0e 71ffffff
ffff8e2301f32240 2182541733 C Bo:2:011:2 0 32 >
ffff8e2301f32240 2182541738 S Bo:2:011:2 -115 4 = ffffffff
ffff8e2301f33740 2182544509 C Bo:2:011:2 0 32 >
ffff8e2301f32240 2182547229 C Bo:2:011:2 0 4 >
ffff8e2301f326c0 2182552789 C Bi:2:011:2 0 1 = 06
ffff8e2301f326c0 2182552794 S Bi:2:011:2 -115 32 <
ffff8e2301f32240 2182553169 S Bo:2:011:2 -115 32 = 57088080 003f5823 000f5274 00000000 00000033 ffffffff 024f2d0e 716f2d06
ffff8e2301f33740 2182553172 S Bo:2:011:2 -115 32 = ffffffff 002f5823 007f5274 00000000 00000033 ffffffff 024f2d0e 716f2d05
ffff8e2301f32240 2182553230 C Bo:2:011:2 0 32 >
ffff8e2301f32240 2182553232 S Bo:2:011:2 -115 32 = ffffffff 006a5923 00ca6774 00000000 00000033 ffffffff 0f064c76 431c4163
ffff8e2301f33740 2182553279 C Bo:2:011:2 0 32 >
ffff8e2301f33740 2182553280 S Bo:2:011:2 -115 32 = 716f2b06 005a5923 003a6774 00000000 00000033 ffffffff 0f064c76 431c4163
ffff8e2301f32240 2182556097 C Bo:2:011:2 0 32 >
ffff8e2301f32240 2182556103 S Bo:2:011:2 -115 4 = 71ffffff
ffff8e2301f33740 2182558810 C Bo:2:011:2 0 32 >
ffff8e2301f32240 2182561588 C Bo:2:011:2 0 4 >
ffff8e2301f32e40 2182567111 C Bi:2:011:2 0 1 = 06
ffff8e2301f32e40 2182567115 S Bi:2:011:2 -115 32 <
ffff8e2301f32240 2182567418 S Bo:2:011:2 -115 32 = 57090080 004a5923 002a6774 00000000 00000033 ffffffff 0f064c76 431c4163
ffff8e2301f33740 2182567421 S Bo:2:011:2 -115 32 = 716f2d06 00da5823 001a6774 00000000 00000033 ffffffff 0f064c76 431c4163
ffff8e2301f32240 2182567479 C Bo:2:011:2 0 32 >
ffff8e2301f32240 2182567482 S Bo:2:011:2 -115 32 = 716f2d05 ffffffff ffffffff ffffffff ffffffff ffffffff ffffffff ffffffff
ffff8e2301f33740 2182567528 C Bo:2:011:2 0 32 >
ffff8e2301f33740 2182567529 S Bo:2:011:2 -115 32 = ffffffff 006f7874 007f181e 00009e35 00000033 ffffffff 0a1c5317 687dffff
ffff8e2301f32240 2182570316 C Bo:2:011:2 0 32 >
ffff8e2301f32240 2182570321 S Bo:2:011:2 -115 4 = ffffffff
ffff8e2301f33740 2182573088 C Bo:2:011:2 0 32 >
ffff8e2301f32240 2182575828 C Bo:2:011:2 0 4 >
ffff8e2301f326c0 2182581289 C Bi:2:011:2 0 1 = 06
ffff8e2301f326c0 2182581294 S Bi:2:011:2 -115 32 <
ffff8e2301f32240 2182581639 S Bo:2:011:2 -115 32 = 57098080 005f7874 006f181e 00009e35 00000033 ffffffff 0a1c5317 687effff
ffff8e2301f33740 2182581642 S Bo:2:011:2 -115 32 = ffffffff 00007874 005f181e 00009e35 00000033 ffffffff 0a1c53ff ffffffff
ffff8e2301f32240 2182581746 C Bo:2:011:2 0 32 >
ffff8e2301f32240 2182581749 S Bo:2:011:2 -115 32 = ffffffff 00df7774 0000181e 00009e35 00000033 ffffffff 0a1c5317 6e7effff
ffff8e2301f33740 2182581805 C Bo:2:011:2 0 32 >
ffff8e2301f33740 2182581808 S Bo:2:011:2 -115 32 = ffffffff 00cf7774 00df171e 00009e35 00000033 ffffffff 0a1c5317 6e7dffff
ffff8e2301f32240 2182584590 C Bo:2:011:2 0 32 >
ffff8e2301f32240 2182584595 S Bo:2:011:2 -115 4 = ffffffff
ffff8e2301f33740 2182587376 C Bo:2:011:2 0 32 >
ffff8e2301f32240 2182590100 C Bo:2:011:2 0 4 >
ffff8e2301f32e40 2182595587 C Bi:2:011:2 0 1 = 06
ffff8e2301f32e40 2182595590 S Bi:2:011:2 -115 32 <
ffff8e2301f32240 2182595960 S Bo:2:011:2 -115 32 = 570a0080 001f7574 001f7574 00000000 00000033 ffffffff 0a1c5317 10266d47
ffff8e2301f33740 2182595964 S Bo:2:011:2 -115 32 = 2f2a78ff 00005823 00005223 00000000 00000033 ffffffff 0a1c5317 15206954
ffff8e2301f32240 2182596022 C Bo:2:011:2 0 32 >
ffff8e2301f32240 2182596026 S Bo:2:011:2 -115 32 = 26ffffff 00005823 00005823 00000000 00000033 ffffffff 0a1c5317 101c5461
ffff8e2301f33740 2182596073 C Bo:2:011:2 0 32 >
ffff8e2301f33740 2182596076 S Bo:2:011:2 -115 32 = ffffffff ffffffff ffffffff ffffffff ffffffff ffffffff ffffffff ffffffff
ffff8e2301f32240 2182598881 C Bo:2:011:2 0 32 >
ffff8e2301f32240 2182598887 S Bo:2:011:2 -115 4 = ffffffff
ffff8e2301f33740 2182601589 C Bo:2:011:2 0 32 >
ffff8e2301f32240 2182604367 C Bo:2:011:2 0 4 >
ffff8e2301f326c0 2182609902 C Bi:2:011:2 0 1 = 06
ffff8e2301f326c0 2182609906 S Bi:2:011:2 -115 32 <
ffff8e2301f32240 2182610220 S Bo:2:011:2 -115 32 = 570a8080 ffffffff ffffffff ffffffff ffffffff ffffffff ffffffff ffffffff
ffff8e2301f33740 2182610224 S Bo:2:011:2 -115 32 = ffffffff ffffffff ffffffff ffffffff ffffffff ffffffff ffffffff ffffffff
ffff8e2301f32240 2182610281 C Bo:2:011:2 0 32 >
ffff8e2301f32240 2182610284 S Bo:2:011:2 -115 32 = ffffffff ffffffff ffffffff ffffffff ffffffff ffffffff ffffffff ffffffff
ffff8e2301f33740 2182610329 C Bo:2:011:2 0 32 >
ffff8e2301f33740 2182610330 S Bo:2:011:2 -115 32 = ffffffff ffffffff ffffffff ffffffff ffffffff ffffffff ffffffff ffffffff
ffff8e2301f32240 2182613099 C Bo:2:011:2 0 32 >
ffff8e2301f32240 2182613103 S Bo:2:011:2 -115 4 = ffffffff
ffff8e2301f33740 2182615879 C Bo:2:011:2 0 32 >
ffff8e2301f32240 2182618703 C Bo:2:011:2 0 4 >
ffff8e2301f32e40 2182624086 C Bi:2:011:2 0 1 = 06
ffff8e2301f32e40 2182624091 S Bi:2:011:2 -115 32 <
ffff8e2301f32240 2182624390 S Bo:2:011:2 -115 32 = 570b0080 ffffffff ffffffff ffffffff ffffffff ffffffff ffffffff ffffffff
ffff8e2301f33740 2182624393 S Bo:2:011:2 -115 32 = ffffffff ffffffff ffffffff ffffffff ffffffff ffffffff ffffffff ffffffff
ffff8e2301f32240 2182624452 C Bo:2:011:2 0 32 >
ffff8e2301f32240 2182624455 S Bo:2:011:2 -115 32 = ffffffff ffffffff ffffffff ffffffff ffffffff ffffffff ffffffff ffffffff
ffff8e2301f33740 2182624499 C Bo:2:011:2 0 32 >
ffff8e2301f33740 2182624502 S Bo:2:011:2 -115 32 = ffffffff ffffffff ffffffff ffffffff ffffffff ffffffff ffffffff ffffffff
ffff8e2301f32240 2182627307 C Bo:2:011:2 0 32 >
ffff8e2301f32240 2182627313 S Bo:2:011:2 -115 4 = ffffffff
ffff8e2301f33740 2182630088 C Bo:2:011:2 0 32 >
ffff8e2301f32240 2182632813 C Bo:2:011:2 0 4 >
ffff8e2301f326c0 2182638227 C Bi:2:011:2 0 1 = 06
ffff8e2301f326c0 2182638231 S Bi:2:011:2 -115 32 <
ffff8e2301f32240 2182638572 S Bo:2:011:2 -115 32 = 570b8080 ffffffff ffffffff ffffffff ffffffff ffffffff ffffffff ffffffff
ffff8e2301f33740 2182638576 S Bo:2:011:2 -115 32 = ffffffff ffffffff ffffffff ffffffff ffffffff ffffffff ffffffff ffffffff
ffff8e2301f32240 2182638634 C Bo:2:011:2 0 32 >
ffff8e2301f32240 2182638637 S Bo:2:011:2 -115 32 = ffffffff ffffffff ffffffff ffffffff ffffffff ffffffff ffffffff ffffffff
ffff8e2301f33740 2182638749 C Bo:2:011:2 0 32 >
ffff8e2301f33740 2182638755 S Bo:2:011:2 -115 32 = ffffffff ffffffff ffffffff ffffffff ffffffff ffffffff ffffffff ffffffff
ffff8e2301f32240 2182641464 C Bo:2:011:2 0 32 >
ffff8e2301f32240 2182641469 S Bo:2:011:2 -115 4 = ffffffff
ffff8e2301f33740 2182644234 C Bo:2:011:2 0 32 >
ffff8e2301f32240 2182646948 C Bo:2:011:2 0 4 >
ffff8e2301f32e40 2182652358 C Bi:2:011:2 0 1 = 06
ffff8e2301f32e40 2182652362 S Bi:2:011:2 -115 32 <
ffff8e2301f32240 2182652732 S Bo:2:011:2 -115 32 = 570c0080 ffffffff ffffffff ffffffff ffffffff ffffffff ffffffff ffffffff
ffff8e2301f33740 2182652736 S Bo:2:011:2 -115 32 = ffffffff ffffffff ffffffff ffffffff ffffffff ffffffff ffffffff ffffffff
ffff8e2301f32240 2182652795 C Bo:2:011:2 0 32 >
ffff8e2301f32240 2182652798 S Bo:2:011:2 -115 32 = ffffffff ffffffff ffffffff ffffffff ffffffff ffffffff ffffffff ffffffff
ffff8e2301f33740 2182652848 C Bo:2:011:2 0 32 >
ffff8e2301f33740 2182652850 S Bo:2:011:2 -115 32 = ffffffff 00008326 00008326 00000000 00000072 ffffffff 02236452 31287258
ffff8e2301f32240 2182655601 C Bo:2:011:2 0 32 >
ffff8e2301f32240 2182655606 S Bo:2:011:2 -115 4 = 352a2063
ffff8e2301f33740 2182658414 C Bo:2:011:2 0 32 >
ffff8e2301f32240 2182661136 C Bo:2:011:2 0 4 >
ffff8e2301f326c0 2182666496 C Bi:2:011:2 0 1 = 06
ffff8e2301f326c0 2182666500 S Bi:2:011:2 -115 32 <
ffff8e2301f32240 2182666884 S Bo:2:011:2 -115 32 = 570c8080 00ca8626 00ca8626 00000000 00000072 ffffffff 012a6c5b 223d6559
ffff8e2301f33740 2182666887 S Bo:2:011:2 -115 32 = 22ffffff 00001525 00001525 00000000 00000072 ffffffff 06226545 242a6e54
ffff8e2301f32240 2182666947 C Bo:2:011:2 0 32 >
ffff8e2301f32240 2182666950 S Bo:2:011:2 -115 32 = 3affffff 00001625 00001625 00000000 00000072 ffffffff 012a6c17 4326744e
ffff8e2301f33740 2182666998 C Bo:2:011:2 0 32 >
ffff8e2301f33740 2182666999 S Bo:2:011:2 -115 32 = 63096945 006a2825 006a2825 00000000 00000072 ffffffff 012a6c17 4326744e
ffff8e2301f32240 2182669807 C Bo:2:011:2 0 32 >
ffff8e2301f32240 2182669813 S Bo:2:011:2 -115 4 = 631b5765
ffff8e2301f33740 2182672575 C Bo:2:011:2 0 32 >
ffff8e2301f32240 2182675277 C Bo:2:011:2 0 4 >
ffff8e2301f32e40 2182680833 C Bi:2:011:2 0 1 = 06
ffff8e2301f32e40 2182680838 S Bi:2:011:2 -115 32 <
ffff8e2301f32240 2182681207 S Bo:2:011:2 -115 32 = 570d0080 001f3425 001f3425 00000000 00000072 ffffffff 02604117 13266c58
ffff8e2301f33740 2182681211 S Bo:2:011:2 -115 32 = 376f435f 006a3625 006a3625 00000000 00000072 ffffffff 06286c5e 2d3b6f59
ffff8e2301f32240 2182681269 C Bo:2:011:2 0 32 >
ffff8e2301f32240 2182681272 S Bo:2:011:2 -115 32 = 630e7047 003a3725 003a3725 00000000 00000072 ffffffff 102c6f43 3726735f
ffff8e2301f33740 2182681325 C Bo:2:011:2 0 32 >
ffff8e2301f33740 2182681327 S Bo:2:011:2 -115 32 = 637f31ff 006a4825 006a4825 00000000 00000072 ffffffff 102c6f43 3726735f
ffff8e2301f32240 2182684098 C Bo:2:011:2 0 32 >
ffff8e2301f32240 2182684103 S Bo:2:011:2 -115 4 = 637f32ff
ffff8e2301f33740 2182686881 C Bo:2:011:2 0 32 >
ffff8e2301f32240 2182689590 C Bo:2:011:2 0 4 >
ffff8e2301f326c0 2182695154 C Bi:2:011:2 0 1 = 06
ffff8e2301f326c0 2182695159 S Bi:2:011:2 -115 32 <
ffff8e2301f32240 2182695554 S Bo:2:011:2 -115 32 = 570d8080 003a5625 003a5625 00000000 00000072 ffffffff 102c6f43 3726735f
ffff8e2301f33740 2182695558 S Bo:2:011:2 -115 32 = 637f33ff 003a7225 003a7225 00000000 00000072 ffffffff 102c6f43 3726735f
ffff8e2301f32240 2182695616 C Bo:2:011:2 0 32 >
ffff8e2301f32240 2182695619 S Bo:2:011:2 -115 32 = 637f34ff 001f7425 001f7425 00000000 00000072 ffffffff 10386159 3426635c
ffff8e2301f33740 2182695754 C Bo:2:011:2 0 32 >
ffff8e2301f33740 2182695758 S Bo:2:011:2 -115 32 = 630157ff 00008225 00008225 00000000 00000072 ffffffff 02236452 31287258
ffff8e2301f32240 2182698450 C Bo:2:011:2 0 32 >
ffff8e2301f32240 2182698454 S Bo:2:011:2 -115 4 = 352a2076
ffff8e2301f33740 2182701235 C Bo:2:011:2 0 32 >
ffff8e2301f32240 2182703952 C Bo:2:011:2 0 4 >
ffff8e2301f32e40 2182709453 C Bi:2:011:2 0 1 = 06
ffff8e2301f32e40 2182709457 S Bi:2:011:2 -115 32 <
ffff8e2301f32240 2182709860 S Bo:2:011:2 -115 32 = 570e0080 00008325 00008325 00000000 00000072 ffffffff 0d2a7743 2c386e56
ffff8e2301f33740 2182709864 S Bo:2:011:2 -115 32 = 312b7317 00008725 00008725 00000000 00000072 ffffffff 10386159 3426635c
ffff8e2301f32240 2182709927 C Bo:2:011:2 0 32 >
ffff8e2301f32240 2182709930 S Bo:2:011:2 -115 32 = 630c46ff 00009125 00009125 00000000 00000072 ffffffff 102c6f43 3726735f
ffff8e2301f33740 2182709975 C Bo:2:011:2 0 32 >
ffff8e2301f33740 2182709977 S Bo:2:011:2 -115 32 = 637f35ff 001f0824 001f0824 00000000 00000072 ffffffff 012a6c17 4326744e
ffff8e2301f32240 2182712737 C Bo:2:011:2 0 32 >
ffff8e2301f32240 2182712742 S Bo:2:011:2 -115 4 = 630e5067
ffff8e2301f33740 2182715519 C Bo:2:011:2 0 32 >
ffff8e2301f32240 2182718268 C Bo:2:011:2 0 4 >
ffff8e2301f326c0 2182723761 C Bi:2:011:2 0 1 = 06
ffff8e2301f326c0 2182723765 S Bi:2:011:2 -115 32 <
ffff8e2301f32240 2182724121 S Bo:2:011:2 -115 32 = 570e8080 70171924 70171924 00000000 00000072 ffffffff 11194817 0b2a6c5e
ffff8e2301f33740 2182724124 S Bo:2:011:2 -115 32 = 332e64ff 006a3124 006a3124 00000000 00000072 ffffffff 02236417 021f50ff
ffff8e2301f32240 2182724182 C Bo:2:011:2 0 32 >
ffff8e2301f32240 2182724184 S Bo:2:011:2 -115 32 = ffffffff 00003924 00003924 00000000 00000072 ffffffff 10386159 3426635c
ffff8e2301f33740 2182724230 C Bo:2:011:2 0 32 >
ffff8e2301f33740 2182724231 S Bo:2:011:2 -115 32 = 631f725e 001f4124 001f4124 00000000 00000072 ffffffff 06286c5e 2d3b6f59
ffff8e2301f32240 2182727025 C Bo:2:011:2 0 32 >
ffff8e2301f32240 2182727030 S Bo:2:011:2 -115 4 = 631b7745
ffff8e2301f33740 2182729806 C Bo:2:011:2 0 32 >
ffff8e2301f32240 2182732509 C Bo:2:011:2 0 4 >
ffff8e2301f32e40 2182738089 C Bi:2:011:2 0 1 = 06
ffff8e2301f32e40 2182738093 S Bi:2:011:2 -115 32 <
ffff8e2301f32240 2182738461 S Bo:2:011:2 -115 32 = 570f0080 003a4224 003a4224 00000000 00000072 ffffffff 102c6f43 3726735f
ffff8e2301f33740 2182738465 S Bo:2:011:2 -115 32 = 637f36ff 001f5124 001f5124 00000000 00000072 ffffffff 10386159 3426635c
ffff8e2301f32240 2182738523 C Bo:2:011:2 0 32 >
ffff8e2301f32240 2182738526 S Bo:2:011:2 -115 32 = 631c57ff 006a6624 006a6624 00000000 00000072 ffffffff 012a6c17 4326744e
ffff8e2301f33740 2182738575 C Bo:2:011:2 0 32 >
ffff8e2301f33740 2182738577 S Bo:2:011:2 -115 32 = 630e547e 00001624 00001624 00000000 00000072 ffffffff 131c4e7e 634f7044
ffff8e2301f32240 2182741376 C Bo:2:011:2 0 32 >
ffff8e2301f32240 2182741380 S Bo:2:011:2 -115 4 = ffffffff
ffff8e2301f33740 2182744097 C Bo:2:011:2 0 32 >
ffff8e2301f32240 2182746849 C Bo:2:011:2 0 4 >
ffff8e2301f326c0 2182752415 C Bi:2:011:2 0 1 = 06
ffff8e2301f326c0 2182752419 S Bi:2:011:2 -115 32 <
ffff8e2301f32240 2182752823 S Bo:2:011:2 -115 32 = 570f8080 00004824 00004824 00000000 00000072 ffffffff 06084176 631d6153
ffff8e2301f33740 2182752827 S Bo:2:011:2 -115 32 = 223dffff 737c1424 737c1424 00000000 00000072 ffffffff 10386944 303f6f45
ffff8e2301f32240 2182752884 C Bo:2:011:2 0 32 >
ffff8e2301f32240 2182752888 S Bo:2:011:2 -115 32 = 37ffffff 13789176 13789176 00000000 00000072 ffffffff 0a3d6944 2b6f4370
ffff8e2301f33740 2182752933 C Bo:2:011:2 0 32 >
ffff8e2301f33740 2182752935 S Bo:2:011:2 -115 32 = ffffffff 00004324 00004324 00000000 00000072 ffffffff 102c6f43 3726735f
ffff8e2301f32240 2182755744 C Bo:2:011:2 0 32 >
ffff8e2301f32240 2182755749 S Bo:2:011:2 -115 4 = 631d6153
ffff8e2301f33740 2182758485 C Bo:2:011:2 0 32 >
ffff8e2301f32240 2182761247 C Bo:2:011:2 0 4 >
ffff8e2301f32e40 2182766722 C Bi:2:011:2 0 1 = 06
ffff8e2301f32e40 2182766727 S Bi:2:011:2 -115 32 <
ffff8e2301f32240 2182767169 S Bo:2:011:2 -115 32 = 57100080 003a4424 003a4424 00000000 00000072 ffffffff 102c6f43 3726735f
ffff8e2301f33740 2182767172 S Bo:2:011:2 -115 32 = 6302695b 00003013 00003013 00000000 00000072 ffffffff 041a4165 076f457a
ffff8e2301f32240 2182767230 C Bo:2:011:2 0 32 >
ffff8e2301f32240 2182767233 S Bo:2:011:2 -115 32 = 061d47ff 00002513 00002513 00000000 00000072 ffffffff 0206521a 020652ff
ffff8e2301f33740 2182767279 C Bo:2:011:2 0 32 >
ffff8e2301f33740 2182767281 S Bo:2:011:2 -115 32 = ffffffff 003a8213 003a8213 00000000 00000072 ffffffff 0206521a 020652ff
ffff8e2301f32240 2182770090 C Bo:2:011:2 0 32 >
ffff8e2301f32240 2182770094 S Bo:2:011:2 -115 4 = ffffffff
ffff8e2301f33740 2182772804 C Bo:2:011:2 0 32 >
ffff8e2301f32240 2182775589 C Bo:2:011:2 0 4 >
ffff8e2301f326c0 2182786312 C Bi:2:011:2 0 1 = 06
ffff8e2301f326c0 2182786317 S Bi:2:011:2 -115 32 <
ffff8e2301f32240 2182786726 S Bo:2:011:2 -115 32 = 57108080 003a2313 003a2313 00000000 00000072 ffffffff 0206521a 020652ff
ffff8e2301f33740 2182786730 S Bo:2:011:2 -115 32 = ffffffff 001f051f 001f051f 00000000 00000072 ffffffff 0206521a 020652ff
ffff8e2301f32240 2182786787 C Bo:2:011:2 0 32 >
ffff8e2301f32240 2182786790 S Bo:2:011:2 -115 32 = ffffffff 00006113 00006113 00000000 00000072 ffffffff 0206521a 020652ff
ffff8e2301f33740 2182786836 C Bo:2:011:2 0 32 >
ffff8e2301f33740 2182786837 S Bo:2:011:2 -115 32 = ffffffff 003a091e 003a091e 00000000 00000072 ffffffff 0206521a 020652ff
ffff8e2301f32240 2182789590 C Bo:2:011:2 0 32 >
ffff8e2301f32240 2182789595 S Bo:2:011:2 -115 4 = ffffffff
ffff8e2301f33740 2182792414 C Bo:2:011:2 0 32 >
ffff8e2301f32240 2182795136 C Bo:2:011:2 0 4 >
ffff8e2301f32e40 2182800722 C Bi:2:011:2 0 1 = 06
ffff8e2301f32e40 2182800727 S Bi:2:011:2 -115 32 <
ffff8e2301f32240 2182801023 S Bo:2:011:2 -115 32 = 57110080 006a9310 006a9310 00000000 00000072 ffffffff 0206521a 020652ff
ffff8e2301f33740 2182801028 S Bo:2:011:2 -115 32 = ffffffff 001f2413 001f2413 00000000 00000072 ffffffff 0206521a 020652ff
ffff8e2301f32240 2182801086 C Bo:2:011:2 0 32 >
ffff8e2301f32240 2182801090 S Bo:2:011:2 -115 32 = ffffffff 003a3213 003a3213 00000000 00000072 ffffffff 0206521a 020652ff
ffff8e2301f33740 2182801134 C Bo:2:011:2 0 32 >
ffff8e2301f33740 2182801137 S Bo:2:011:2 -115 32 = ffffffff 001f9111 001f9111 00000000 00000072 ffffffff 0206521a 020652ff
ffff8e2301f32240 2182803953 C Bo:2:011:2 0 32 >
ffff8e2301f32240 2182803959 S Bo:2:011:2 -115 4 = ffffffff
ffff8e2301f33740 2182806736 C Bo:2:011:2 0 32 >
ffff8e2301f32240 2182809449 C Bo:2:011:2 0 4 >
ffff8e2301f326c0 2182814951 C Bi:2:011:2 0 1 = 06
ffff8e2301f326c0 2182814956 S Bi:2:011:2 -115 32 <
ffff8e2301f32240 2182815270 S Bo:2:011:2 -115 32 = 57118080 003a7213 003a7213 00000000 00000072 ffffffff 110e4476 116f4774
ffff8e2301f33740 2182815274 S Bo:2:011:2 -115 32 = 0affffff 00000413 00000413 00000000 00000072 ffffffff 110e4476 116f4774
ffff8e2301f32240 2182815332 C Bo:2:011:2 0 32 >
ffff8e2301f32240 2182815335 S Bo:2:011:2 -115 32 = 0affffff 00001013 00001013 00000000 00000072 ffffffff 110e4476 116f4774
ffff8e2301f33740 2182815380 C Bo:2:011:2 0 32 >
ffff8e2301f33740 2182815382 S Bo:2:011:2 -115 32 = 0affffff 001f2013 001f2013 00000000 00000072 ffffffff 110e4476 116f4774
ffff8e2301f32240 2182818165 C Bo:2:011:2 0 32 >
ffff8e2301f32240 2182818170 S Bo:2:011:2 -115 4 = 0affffff
ffff8e2301f33740 2182820949 C Bo:2:011:2 0 32 >
ffff8e2301f32240 2182823725 C Bo:2:011:2 0 4 >
ffff8e2301f32e40 2182829112 C Bi:2:011:2 0 1 = 06
ffff8e2301f32e40 2182829116 S Bi:2:011:2 -115 32 <
ffff8e2301f32240 2182829402 S Bo:2:011:2 -115 32 = 57120080 00002313 00002313 00000000 00000072 ffffffff 110e4476 116f4774
ffff8e2301f33740 2182829406 S Bo:2:011:2 -115 32 = 0affffff 006a9413 006a9413 00000000 00000072 ffffffff 110e4476 116f4774
ffff8e2301f32240 2182829464 C Bo:2:011:2 0 32 >
ffff8e2301f32240 2182829468 S Bo:2:011:2 -115 32 = 0affffff 001f9613 001f9613 00000000 00000072 ffffffff 110e4476 116f4774
ffff8e2301f33740 2182829513 C Bo:2:011:2 0 32 >
ffff8e2301f33740 2182829515 S Bo:2:011:2 -115 32 = 0affffff 003a9713 003a9713 00000000 00000072 ffffffff 110e4476 116f4774
ffff8e2301f32240 2182832296 C Bo:2:011:2 0 32 >
ffff8e2301f32240 2182832300 S Bo:2:011:2 -115 4 = 0affffff
ffff8e2301f33740 2182835098 C Bo:2:011:2 0 32 >
ffff8e2301f32240 2182837828 C Bo:2:011:2 0 4 >
ffff8e2301f326c0 2182843245 C Bi:2:011:2 0 1 = 06
ffff8e2301f326c0 2182843251 S Bi:2:011:2 -115 32 <
ffff8e2301f32240 2182843615 S Bo:2:011:2 -115 32 = 57128080 001f1914 001f1914 00000000 00000072 ffffffff 021f5065 0c0e437f
ffff8e2301f33740 2182843619 S Bo:2:011:2 -115 32 = ffffffff 003a2013 003a2013 00000000 00000072 ffffffff 021f5065 0c0e437f
ffff8e2301f32240 2182843743 C Bo:2:011:2 0 32 >
ffff8e2301f32240 2182843746 S Bo:2:011:2 -115 32 = ffffffff 006a4837 006a4837 00000000 00000072 ffffffff 021f5065 0c0e437f
ffff8e2301f33740 2182843793 C Bo:2:011:2 0 32 >
ffff8e2301f33740 2182843794 S Bo:2:011:2 -115 32 = ffffffff 001f8310 001f8310 00000000 00000072 ffffffff 021f5065 0c0e437f
ffff8e2301f32240 2182846590 C Bo:2:011:2 0 32 >
ffff8e2301f32240 2182846596 S Bo:2:011:2 -115 4 = ffffffff
ffff8e2301f33740 2182849339 C Bo:2:011:2 0 32 >
ffff8e2301f32240 2182852074 C Bo:2:011:2 0 4 >
ffff8e2301f32e40 2182857588 C Bi:2:011:2 0 1 = 06
ffff8e2301f32e40 2182857592 S Bi:2:011:2 -115 32 <
ffff8e2302151980 2182858029 S Bo:2:002:2 -115 31 = 55534243 8d050000 00000000 00000600 00000000 00000000 00000000 000000
ffff8e2302151980 2182858046 C Bo:2:002:2 0 31 >
ffff8e2302151980 2182858050 S Bi:2:002:1 -115 13 <
ffff8e2301f32240 2182858078 S Bo:2:011:2 -115 32 = 57130080 003a2537 003a2537 00000000 00000072 ffffffff 174f5772 11ffffff
ffff8e2301f33740 2182858081 S Bo:2:011:2 -115 32 = ffffffff 003a9111 003a9111 00000000 00000072 ffffffff 174f5772 11ffffff
ffff8e2302151980 2182858105 C Bi:2:002:1 0 13 = 55534253 8d050000 00000000 00
ffff8e2301f32240 2182858150 C Bo:2:011:2 0 32 >
ffff8e2301f32240 2182858151 S Bo:2:011:2 -115 32 = ffffffff 001f0837 001f0837 00000000 00000072 ffffffff 174f5772 11ffffff
ffff8e2301f33740 2182858194 C Bo:2:011:2 0 32 >
ffff8e2301f33740 2182858194 S Bo:2:011:2 -115 32 = ffffffff 006a1813 006a1813 00000000 00000072 ffffffff 174f5772 11ffffff
ffff8e2301f32240 2182860956 C Bo:2:011:2 0 32 >
ffff8e2301f32240 2182860958 S Bo:2:011:2 -115 4 = ffffffff
ffff8e2301f33740 2182863788 C Bo:2:011:2 0 32 >
ffff8e2301f32240 2182866463 C Bo:2:011:2 0 4 >
ffff8e2301f326c0 2182871900 C Bi:2:011:2 0 1 = 06
ffff8e2301f326c0 2182871903 S Bi:2:011:2 -115 32 <
ffff8e2301f32240 2182872216 S Bo:2:011:2 -115 32 = 57138080 001f6313 001f6313 00000000 00000072 ffffffff 174f5772 11ffffff
ffff8e2301f33740 2182872220 S Bo:2:011:2 -115 32 = ffffffff 003a2613 003a2613 00000000 00000072 ffffffff 0c1f53ff ffffffff
ffff8e2301f32240 2182872276 C Bo:2:011:2 0 32 >
ffff8e2301f32240 2182872277 S Bo:2:011:2 -115 32 = ffffffff 003a0513 003a0513 00000000 00000072 ffffffff 0c1f53ff ffffffff
ffff8e2301f33740 2182872324 C Bo:2:011:2 0 32 >
ffff8e2301f33740 2182872324 S Bo:2:011:2 -115 32 = ffffffff 006a3203 006a3203 00000000 00000072 ffffffff 0c1f53ff ffffffff
ffff8e2301f32240 2182875090 C Bo:2:011:2 0 32 >
ffff8e2301f32240 2182875091 S Bo:2:011:2 -115 4 = ffffffff
ffff8e2301f33740 2182877876 C Bo:2:011:2 0 32 >
ffff8e2301f32240 2182880603 C Bo:2:011:2 0 4 >
ffff8e2301f32e40 2182886042 C Bi:2:011:2 0 1 = 06
ffff8e2301f32e40 2182886044 S Bi:2:011:2 -115 32 <
ffff8e2301f32240 2182886352 S Bo:2:011:2 -115 32 = 57140080 001f2206 001f2206 00000000 00000072 ffffffff 0c1f53ff ffffffff
ffff8e2301f33740 2182886356 S Bo:2:011:2 -115 32 = ffffffff 001f7537 001f7537 00000000 00000072 ffffffff 0c1f53ff ffffffff
ffff8e2301f32240 2182886412 C Bo:2:011:2 0 32 >
ffff8e2301f32240 2182886413 S Bo:2:011:2 -115 32 = ffffffff 006a8910 006a8910 00000000 00000072 ffffffff 0c1f53ff ffffffff
ffff8e2301f33740 2182886461 C Bo:2:011:2 0 32 >
ffff8e2301f33740 2182886462 S Bo:2:011:2 -115 32 = ffffffff 00008311 00008311 00000000 00000072 ffffffff 0c1f53ff ffffffff
ffff8e2301f32240 2182889246 C Bo:2:011:2 0 32 >
ffff8e2301f32240 2182889248 S Bo:2:011:2 -115 4 = ffffffff
ffff8e2301f33740 2182892021 C Bo:2:011:2 0 32 >
ffff8e2301f32240 2182894747 C Bo:2:011:2 0 4 >
ffff8e2301f326c0 2182900177 C Bi:2:011:2 0 1 = 06
ffff8e2301f326c0 2182900179 S Bi:2:011:2 -115 32 <
ffff8e2301f32240 2182900510 S Bo:2:011:2 -115 32 = 57148080 006a2313 006a2313 00000000 00000072 ffffffff 021b4964 ffffffff
ffff8e2301f33740 2182900514 S Bo:2:011:2 -115 32 = ffffffff 006a9513 006a9513 00000000 00000072 ffffffff 021b4964 ffffffff
ffff8e2301f32240 2182900574 C Bo:2:011:2 0 32 >
ffff8e2301f32240 2182900574 S Bo:2:011:2 -115 32 = ffffffff 003a9513 003a9513 00000000 00000072 ffffffff 021b4964 ffffffff
ffff8e2301f33740 2182900623 C Bo:2:011:2 0 32 >
ffff8e2301f33740 2182900624 S Bo:2:011:2 -115 32 = ffffffff 00009713 00009713 00000000 00000072 ffffffff 021b4964 ffffffff
ffff8e2301f32240 2182903375 C Bo:2:011:2 0 32 >
ffff8e2301f32240 2182903376 S Bo:2:011:2 -115 4 = ffffffff
ffff8e2301f33740 2182906168 C Bo:2:011:2 0 32 >
ffff8e2301f32240 2182908895 C Bo:2:011:2 0 4 >
ffff8e2301f32e40 2182914365 C Bi:2:011:2 0 1 = 06
ffff8e2301f32e40 2182914367 S Bi:2:011:2 -115 32 <
ffff8e2301f32240 2182914802 S Bo:2:011:2 -115 32 = 57150080 0000231e 0000231e 00000000 00000072 ffffffff 021b4964 ffffffff
ffff8e2301f33740 2182914806 S Bo:2:011:2 -115 32 = ffffffff 001f3413 001f3413 00000000 00000072 ffffffff 110a4417 021d5278
ffff8e2301f32240 2182914862 C Bo:2:011:2 0 32 >
ffff8e2301f32240 2182914863 S Bo:2:011:2 -115 32 = 141cffff 00002613 00002613 00000000 00000072 ffffffff 110a4417 021d5278
ffff8e2301f33740 2182914910 C Bo:2:011:2 0 32 >
ffff8e2301f33740 2182914911 S Bo:2:011:2 -115 32 = 141cffff 003a7007 003a7007 00000000 00000072 ffffffff 110a4417 021d5278
ffff8e2301f32240 2182917734 C Bo:2:011:2 0 32 >
ffff8e2301f32240 2182917736 S Bo:2:011:2 -115 4 = 141cffff
ffff8e2301f33740 2182920483 C Bo:2:011:2 0 32 >
ffff8e2301f32240 2182923199 C Bo:2:011:2 0 4 >
ffff8e2301f326c0 2182928713 C Bi:2:011:2 0 1 = 06
ffff8e2301f326c0 2182928716 S Bi:2:011:2 -115 32 <
ffff8e2301f32240 2182929037 S Bo:2:011:2 -115 32 = 57158080 006a6504 006a6504 00000000 00000072 ffffffff 110a4417 021d5278
ffff8e2301f33740 2182929041 S Bo:2:011:2 -115 32 = 141cffff 001f2213 001f2213 00000000 00000072 ffffffff 021d4d6e 630e4174
ffff8e2301f32240 2182929098 C Bo:2:011:2 0 32 >
ffff8e2301f32240 2182929099 S Bo:2:011:2 -115 32 = ffffffff 00001112 00001112 00000000 00000072 ffffffff 021d4d6e 630e4174
ffff8e2301f33740 2182929146 C Bo:2:011:2 0 32 >
ffff8e2301f33740 2182929146 S Bo:2:011:2 -115 32 = ffffffff 006a483f 006a483f 00000000 00000072 ffffffff 100e5217 110a5374
ffff8e2301f32240 2182931951 C Bo:2:011:2 0 32 >
ffff8e2301f32240 2182931953 S Bo:2:011:2 -115 4 = 160affff
ffff8e2301f33740 2182934743 C Bo:2:011:2 0 32 >
ffff8e2301f32240 2182937448 C Bo:2:011:2 0 4 >
ffff8e2301f32e40 2182942975 C Bi:2:011:2 0 1 = 06
ffff8e2301f32e40 2182942977 S Bi:2:011:2 -115 32 <
ffff8e2301f32240 2182943283 S Bo:2:011:2 -115 32 = 57160080 00008010 00008010 00000000 00000072 ffffffff 0f4f5717 0f0a5672
ffff8e2301f33740 2182943287 S Bo:2:011:2 -115 32 = 0fffffff ffffffff ffffffff ffffffff ffffffff ffffffff ffffffff ffffffff
ffff8e2301f32240 2182943347 C Bo:2:011:2 0 32 >
ffff8e2301f32240 2182943347 S Bo:2:011:2 -115 32 = ffffffff ffffffff ffffffff ffffffff ffffffff ffffffff ffffffff ffffffff
ffff8e2301f33740 2182943395 C Bo:2:011:2 0 32 >
ffff8e2301f33740 2182943396 S Bo:2:011:2 -115 32 = ffffffff ffffffff ffffffff ffffffff ffffffff ffffffff ffffffff ffffffff
ffff8e2301f32240 2182946191 C Bo:2:011:2 0 32 >
ffff8e2301f32240 2182946193 S Bo:2:011:2 -115 4 = ffffffff
ffff8e2301f33740 2182948949 C Bo:2:011:2 0 32 >
ffff8e2301f32240 2182951721 C Bo:2:011:2 0 4 >
ffff8e2301f326c0 2182957111 C Bi:2:011:2 0 1 = 06
ffff8e2301f326c0 2182957113 S Bi:2:011:2 -115 32 <
ffff8e2301f32240 2182957397 S Bo:2:011:2 -115 32 = 57168080 ffffffff ffffffff ffffffff ffffffff ffffffff ffffffff ffffffff
ffff8e2301f33740 2182957401 S Bo:2:011:2 -115 32 = ffffffff ffffffff ffffffff ffffffff ffffffff ffffffff ffffffff ffffffff
ffff8e2301f32240 2182957457 C Bo:2:011:2 0 32 >
ffff8e2301f32240 2182957458 S Bo:2:011:2 -115 32 = ffffffff ffffffff ffffffff ffffffff ffffffff ffffffff ffffffff ffffffff
ffff8e2301f33740 2182957507 C Bo:2:011:2 0 32 >
ffff8e2301f33740 2182957507 S Bo:2:011:2 -115 32 = ffffffff ffffffff ffffffff ffffffff ffffffff ffffffff ffffffff ffffffff
ffff8e2301f32240 2182960290 C Bo:2:011:2 0 32 >
ffff8e2301f32240 2182960292 S Bo:2:011:2 -115 4 = ffffffff
ffff8e2301f33740 2182963089 C Bo:2:011:2 0 32 >
ffff8e2301f32240 2182965827 C Bo:2:011:2 0 4 >
ffff8e2301f32e40 2182971288 C Bi:2:011:2 0 1 = 06
ffff8e2301f32e40 2182971290 S Bi:2:011:2 -115 32 <
ffff8e2301f32240 2182971620 S Bo:2:011:2 -115 32 = 57170080 ffffffff ffffffff ffffffff ffffffff ffffffff ffffffff ffffffff
ffff8e2301f33740 2182971623 S Bo:2:011:2 -115 32 = ffffffff ffffffff ffffffff ffffffff ffffffff ffffffff ffffffff ffffffff
ffff8e2301f32240 2182971746 C Bo:2:011:2 0 32 >
ffff8e2301f32240 2182971747 S Bo:2:011:2 -115 32 = ffffffff ffffffff ffffffff ffffffff ffffffff ffffffff ffffffff ffffffff
ffff8e2301f33740 2182971796 C Bo:2:011:2 0 32 >
ffff8e2301f33740 2182971797 S Bo:2:011:2 -115 32 = ffffffff ffffffff ffffffff ffffffff ffffffff ffffffff ffffffff ffffffff
ffff8e2301f32240 2182974600 C Bo:2:011:2 0 32 >
ffff8e2301f32240 2182974603 S Bo:2:011:2 -115 4 = ffffffff
ffff8e2301f33740 2182977323 C Bo:2:011:2 0 32 >
ffff8e2301f32240 2182980073 C Bo:2:011:2 0 4 >
ffff8e2301f326c0 2182985428 C Bi:2:011:2 0 1 = 06
ffff8e2301f326c0 2182985430 S Bi:2:011:2 -115 32 <
ffff8e2301f32240 2182985726 S Bo:2:011:2 -115 32 = 57178080 ffffffff ffffffff ffffffff ffffffff ffffffff ffffffff ffffffff
ffff8e2301f33740 2182985729 S Bo:2:011:2 -115 32 = ffffffff ffffffff ffffffff ffffffff ffffffff ffffffff ffffffff ffffffff
ffff8e2301f32240 2182985785 C Bo:2:011:2 0 32 >
ffff8e2301f32240 2182985787 S Bo:2:011:2 -115 32 = ffffffff ffffffff ffffffff ffffffff ffffffff ffffffff ffffffff ffffffff
ffff8e2301f33740 2182985834 C Bo:2:011:2 0 32 >
ffff8e2301f33740 2182985835 S Bo:2:011:2 -115 32 = ffffffff ffffffff ffffffff ffffffff ffffffff ffffffff ffffffff ffffffff
ffff8e2301f32240 2182988601 C Bo:2:011:2 0 32 >
ffff8e2301f32240 2182988602 S Bo:2:011:2 -115 4 = ffffffff
ffff8e2301f33740 2182991377 C Bo:2:011:2 0 32 >
ffff8e2301f32240 2182994148 C Bo:2:011:2 0 4 >
ffff8e2301f32e40 2182999588 C Bi:2:011:2 0 1 = 06
ffff8e2301f32e40 2182999590 S Bi:2:011:2 -115 32 <
ffff8e2301f32240 2182999969 S Bo:2:011:2 -115 32 = 57180080 ffffffff ffffffff ffffffff ffffffff ffffffff ffffffff ffffffff
ffff8e2301f33740 2182999973 S Bo:2:011:2 -115 32 = ffffffff ffffffff ffffffff ffffffff ffffffff ffffffff ffffffff ffffffff
ffff8e2301f32240 2183000031 C Bo:2:011:2 0 32 >
ffff8e2301f32240 2183000032 S Bo:2:011:2 -115 32 = ffffffff ffffffff ffffffff ffffffff ffffffff ffffffff ffffffff ffffffff
ffff8e2301f33740 2183000078 C Bo:2:011:2 0 32 >
ffff8e2301f33740 2183000079 S Bo:2:011:2 -115 32 = ffffffff ffffffff ffffffff ffffffff ffffffff ffffffff ffffffff ffffffff
ffff8e2301f32240 2183002885 C Bo:2:011:2 0 32 >
ffff8e2301f32240 2183002887 S Bo:2:011:2 -115 4 = ffffffff
ffff8e2301f33740 2183005737 C Bo:2:011:2 0 32 >
ffff8e2301f32240 2183008368 C Bo:2:011:2 0 4 >
ffff8e2301f326c0 2183013721 C Bi:2:011:2 0 1 = 06
ffff8e2301f326c0 2183013723 S Bi:2:011:2 -115 32 <
ffff8e2301f32240 2183014153 S Bo:2:011:2 -115 32 = 57188080 ffffffff ffffffff ffffffff ffffffff ffffffff ffffffff ffffffff
ffff8e2301f33740 2183014157 S Bo:2:011:2 -115 32 = ffffffff ffffffff ffffffff ffffffff ffffffff ffffffff ffffffff ffffffff
ffff8e2301f32240 2183014213 C Bo:2:011:2 0 32 >
ffff8e2301f32240 2183014214 S Bo:2:011:2 -115 32 = ffffffff 00006822 00006822 00007534 00000073 ffffffff 07065363 110a5364
ffff8e2301f33740 2183014262 C Bo:2:011:2 0 32 >
ffff8e2301f33740 2183014263 S Bo:2:011:2 -115 32 = 630c6819 00006022 00006022 00007534 00000073 ffffffff 434f4164 17085576
ffff8e2301f32240 2183017026 C Bo:2:011:2 0 32 >
ffff8e2301f32240 2183017028 S Bo:2:011:2 -115 4 = 110b2074
ffff8e2301f33740 2183019805 C Bo:2:011:2 0 32 >
ffff8e2301f32240 2183022556 C Bo:2:011:2 0 4 >
ffff8e2301f32e40 2183028040 C Bi:2:011:2 0 1 = 06
ffff8e2301f32e40 2183028042 S Bi:2:011:2 -115 32 <
ffff8e2301f32240 2183028402 S Bo:2:011:2 -115 32 = 57190080 003a6322 003a6322 00007534 00000073 ffffffff 100e5217 43272e01
ffff8e2301f33740 2183028406 S Bo:2:011:2 -115 32 = 74ffffff 00006622 00006622 00007534 00000073 ffffffff 012a6c51 223c7417
ffff8e2301f32240 2183028462 C Bo:2:011:2 0 32 >
ffff8e2301f32240 2183028463 S Bo:2:011:2 -115 32 = 151b53ff 003a7822 003a2421 00007534 00000073 ffffffff 0e0e527e 0d0e207a
ffff8e2301f33740 2183028510 C Bo:2:011:2 0 32 >
ffff8e2301f33740 2183028511 S Bo:2:011:2 -115 32 = 71ffffff 00006322 00006322 00007534 00000073 ffffffff 10074967 6e1c487e
ffff8e2301f32240 2183031317 C Bo:2:011:2 0 32 >
ffff8e2301f32240 2183031319 S Bo:2:011:2 -115 4 = 136f3001
ffff8e2301f33740 2183034088 C Bo:2:011:2 0 32 >
ffff8e2301f32240 2183036816 C Bo:2:011:2 0 4 >
ffff8e2301f326c0 2183042359 C Bi:2:011:2 0 1 = 06
ffff8e2301f326c0 2183042362 S Bi:2:011:2 -115 32 <
ffff8e2301f32240 2183042724 S Bo:2:011:2 -115 32 = 57198080 00006422 00006422 00007534 00000073 ffffffff 10074967 6e1c487e
ffff8e2301f33740 2183042728 S Bo:2:011:2 -115 32 = 136f300f 00006522 00006522 00007534 00000073 ffffffff 100e5217 134f5263
ffff8e2301f32240 2183042784 C Bo:2:011:2 0 32 >
ffff8e2301f32240 2183042785 S Bo:2:011:2 -115 32 = 637e30ff 001f7822 001f2421 00007534 00000073 ffffffff 0e0e527e 0d0e207a
ffff8e2301f33740 2183042833 C Bo:2:011:2 0 32 >
ffff8e2301f33740 2183042833 S Bo:2:011:2 -115 32 = 72ffffff 001f6622 001f6622 00007534 00000273 ffffffff 011d4973 040a2006
ffff8e2301f32240 2183045591 C Bo:2:011:2 0 32 >
ffff8e2301f32240 2183045593 S Bo:2:011:2 -115 4 = 70ffffff
ffff8e2301f33740 2183048375 C Bo:2:011:2 0 32 >
ffff8e2301f32240 2183051102 C Bo:2:011:2 0 4 >
ffff8e2301f32e40 2183056723 C Bi:2:011:2 0 1 = 06
ffff8e2301f32e40 2183056725 S Bi:2:011:2 -115 32 <
ffff8e2301f32240 2183057138 S Bo:2:011:2 -115 32 = 571a0080 00006722 00006722 00007534 00000073 ffffffff 134f5263 634f5064
ffff8e2301f33740 2183057142 S Bo:2:011:2 -115 32 = 637e34ff 001f6522 001f6522 00007534 00000073 ffffffff 151b5317 727effff
ffff8e2301f32240 2183057199 C Bo:2:011:2 0 32 >
ffff8e2301f32240 2183057200 S Bo:2:011:2 -115 32 = ffffffff 001f6422 001f6422 00007534 00000073 ffffffff 430e4c7b 0a014717
ffff8e2301f33740 2183057248 C Bo:2:011:2 0 32 >
ffff8e2301f33740 2183057249 S Bo:2:011:2 -115 32 = 7376ffff 006a6622 006a6622 00007534 00000073 ffffffff 10074967 6e1c487e
ffff8e2301f32240 2183060021 C Bo:2:011:2 0 32 >
ffff8e2301f32240 2183060023 S Bo:2:011:2 -115 4 = 136f3705
ffff8e2301f33740 2183062805 C Bo:2:011:2 0 32 >
ffff8e2301f32240 2183065543 C Bo:2:011:2 0 4 >
ffff8e2301f326c0 2183071021 C Bi:2:011:2 0 1 = 06
ffff8e2301f326c0 2183071023 S Bi:2:011:2 -115 32 <
ffff8e2301f32240 2183071356 S Bo:2:011:2 -115 32 = 571a8080 003a6822 003a6822 00007534 00000073 ffffffff 10074967 6e1c487e
ffff8e2301f33740 2183071360 S Bo:2:011:2 -115 32 = 136f3737 001f6822 001f6822 00007534 00000273 ffffffff 100e5217 101b4163
ffff8e2301f32240 2183071418 C Bo:2:011:2 0 32 >
ffff8e2301f32240 2183071418 S Bo:2:011:2 -115 32 = 066f3137 006a7022 006a1621 00007534 00000073 ffffffff 0e0e527e 0d0e2065
ffff8e2301f33740 2183071473 C Bo:2:011:2 0 32 >
ffff8e2301f33740 2183071474 S Bo:2:011:2 -115 32 = 131b52ff 003a7222 003a1821 00007534 00000073 ffffffff 0e0e527e 0d0e2065
ffff8e2301f32240 2183074271 C Bo:2:011:2 0 32 >
ffff8e2301f32240 2183074272 S Bo:2:011:2 -115 4 = 131b52ff
ffff8e2301f33740 2183077024 C Bo:2:011:2 0 32 >
ffff8e2301f32240 2183079768 C Bo:2:011:2 0 4 >
ffff8e2301f32e40 2183085337 C Bi:2:011:2 0 1 = 06
ffff8e2301f32e40 2183085339 S Bi:2:011:2 -115 32 <
ffff8e2301f32240 2183085665 S Bo:2:011:2 -115 32 = 571b0080 001f7522 001f2121 00007534 00000073 ffffffff 0e0e527e 0d0e2065
ffff8e2301f33740 2183085669 S Bo:2:011:2 -115 32 = 131b52ff 001f7822 001f7822 00007534 00000273 ffffffff 0e7e207b 06084174
ffff8e2301f32240 2183085748 C Bo:2:011:2 0 32 >
ffff8e2301f32240 2183085749 S Bo:2:011:2 -115 32 = 1a6f3337 006a6522 006a6522 00007534 00000073 ffffffff 071c4317 747fffff
ffff8e2301f33740 2183085806 C Bo:2:011:2 0 32 >
ffff8e2301f33740 2183085806 S Bo:2:011:2 -115 32 = ffffffff 001f6022 001f0621 00007534 00000073 ffffffff 134f5263 634f5064
ffff8e2301f32240 2183088578 C Bo:2:011:2 0 32 >
ffff8e2301f32240 2183088580 S Bo:2:011:2 -115 4 = 637f31ff
ffff8e2301f33740 2183091374 C Bo:2:011:2 0 32 >
ffff8e2301f32240 2183094074 C Bo:2:011:2 0 4 >
ffff8e2301f326c0 2183099723 C Bi:2:011:2 0 1 = 06
ffff8e2301f326c0 2183099724 S Bi:2:011:2 -115 32 <
ffff8e2301f32240 2183100080 S Bo:2:011:2 -115 32 = 571b8080 00006122 00006122 00007534 00000073 ffffffff 434f4164 17085576
ffff8e2301f33740 2183100084 S Bo:2:011:2 -115 32 = 110b2007 001f6122 001f6122 00007534 00000073 ffffffff 434f4164 17085576
ffff8e2301f32240 2183100140 C Bo:2:011:2 0 32 >
ffff8e2301f32240 2183100141 S Bo:2:011:2 -115 32 = 110b2007 00006222 00006222 00007534 00000073 ffffffff 134f5263 634f5064
ffff8e2301f33740 2183100188 C Bo:2:011:2 0 32 >
ffff8e2301f33740 2183100189 S Bo:2:011:2 -115 32 = 637f34ff 001f6222 001f6222 00007534 00000073 ffffffff 134f5263 634f5064
ffff8e2301f32240 2183102962 C Bo:2:011:2 0 32 >
ffff8e2301f32240 2183102963 S Bo:2:011:2 -115 4 = 637f35ff
ffff8e2301f33740 2183105737 C Bo:2:011:2 0 32 >
ffff8e2301f32240 2183108499 C Bo:2:011:2 0 4 >
ffff8e2301f32e40 2183113951 C Bi:2:011:2 0 1 = 06
ffff8e2301f32e40 2183113953 S Bi:2:011:2 -115 32 <
ffff8e2301f32240 2183114274 S Bo:2:011:2 -115 32 = 571c0080 001f6322 001f6322 00007534 00000073 ffffffff 10074967 6e1c487e
ffff8e2301f33740 2183114278 S Bo:2:011:2 -115 32 = 136f3037 001f6722 001f6722 00007534 00000073 ffffffff 0f4f5717 134f5772
ffff8e2301f32240 2183114334 C Bo:2:011:2 0 32 >
ffff8e2301f32240 2183114335 S Bo:2:011:2 -115 32 = 116f3102 00006922 00006922 00007534 00000073 ffffffff 10074967 6e1c487e
ffff8e2301f33740 2183114382 C Bo:2:011:2 0 32 >
ffff8e2301f33740 2183114382 S Bo:2:011:2 -115 32 = 136f310f 001f6922 001f6922 00007534 00000073 ffffffff 10074967 6e1c487e
ffff8e2301f32240 2183117169 C Bo:2:011:2 0 32 >
ffff8e2301f32240 2183117171 S Bo:2:011:2 -115 4 = 136f310e
ffff8e2301f33740 2183119927 C Bo:2:011:2 0 32 >
ffff8e2301f32240 2183122721 C Bo:2:011:2 0 4 >
ffff8e2301f326c0 2183128085 C Bi:2:011:2 0 1 = 06
ffff8e2301f326c0 2183128087 S Bi:2:011:2 -115 32 <
ffff8e2301f32240 2183128404 S Bo:2:011:2 -115 32 = 571c8080 00007022 00001621 00007534 00000073 ffffffff 134f5263 634f5064
ffff8e2301f33740 2183128408 S Bo:2:011:2 -115 32 = 637d30ff 00007122 00007122 00007534 00000073 ffffffff 434f4164 17085576
ffff8e2301f32240 2183128464 C Bo:2:011:2 0 32 >
ffff8e2301f32240 2183128465 S Bo:2:011:2 -115 32 = 110b2005 003a1921 003a1921 00007534 00000073 ffffffff 0e1c4917 0d4f5263
ffff8e2301f33740 2183128512 C Bo:2:011:2 0 32 >
ffff8e2301f33740 2183128513 S Bo:2:011:2 -115 32 = 0b6f3204 006a1921 006a1921 00007534 00000073 ffffffff 0e1c4917 104f5563
ffff8e2301f32240 2183131309 C Bo:2:011:2 0 32 >
ffff8e2301f32240 2183131311 S Bo:2:011:2 -115 4 = 0b6f3203
ffff8e2301f33740 2183134089 C Bo:2:011:2 0 32 >
ffff8e2301f32240 2183136815 C Bo:2:011:2 0 4 >
ffff8e2301f32e40 2183142228 C Bi:2:011:2 0 1 = 06
ffff8e2301f32e40 2183142230 S Bi:2:011:2 -115 32 <
ffff8e2301f32240 2183142534 S Bo:2:011:2 -115 32 = 571d0080 001f1821 001f1821 00007534 00000073 ffffffff 0e1c4917 1707417a
ffff8e2301f33740 2183142538 S Bo:2:011:2 -115 32 = 061c2005 001f1921 001f1921 00007534 00000073 ffffffff 0e1c4917 140a5363
ffff8e2301f32240 2183142599 C Bo:2:011:2 0 32 >
ffff8e2301f32240 2183142599 S Bo:2:011:2 -115 32 = 637d36ff 006a6122 006a6122 00007534 00000073 ffffffff 104f4c72 0d1b2074
ffff8e2301f33740 2183142647 C Bo:2:011:2 0 32 >
ffff8e2301f33740 2183142648 S Bo:2:011:2 -115 32 = 046f3605 003a6122 003a6122 00007534 00000073 ffffffff 134f5263 0f0e4e73
ffff8e2301f32240 2183145452 C Bo:2:011:2 0 32 >
ffff8e2301f32240 2183145454 S Bo:2:011:2 -115 4 = 630c47ff
ffff8e2301f33740 2183148234 C Bo:2:011:2 0 32 >
ffff8e2301f32240 2183150956 C Bo:2:011:2 0 4 >
ffff8e2301f326c0 2183156406 C Bi:2:011:2 0 1 = 06
ffff8e2301f326c0 2183156408 S Bi:2:011:2 -115 32 <
ffff8e2301f32240 2183156790 S Bo:2:011:2 -115 32 = 571d8080 006a6222 006a6222 00007534 00000073 ffffffff 011d496f 0b0e4d17
ffff8e2301f33740 2183156794 S Bo:2:011:2 -115 32 = 43082001 003a6222 003a6222 00007534 00000073 ffffffff 1303597a 0c1a547f
ffff8e2301f32240 2183156850 C Bo:2:011:2 0 32 >
ffff8e2301f32240 2183156851 S Bo:2:011:2 -115 32 = 631c4165 006a6422 006a6422 00007534 00000073 ffffffff 0f0a4964 161d4517
ffff8e2301f33740 2183156899 C Bo:2:011:2 0 32 >
ffff8e2301f33740 2183156900 S Bo:2:011:2 -115 32 = 7577ffff 003a6422 003a6422 00007534 00000073 ffffffff 0f0a4964 161d4517
ffff8e2301f32240 2183159737 C Bo:2:011:2 0 32 >
ffff8e2301f32240 2183159739 S Bo:2:011:2 -115 4 = 7576ffff
ffff8e2301f33740 2183162450 C Bo:2:011:2 0 32 >
ffff8e2301f32240 2183165183 C Bo:2:011:2 0 4 >
ffff8e2301f32e40 2183170723 C Bi:2:011:2 0 1 = 06
ffff8e2301f32e40 2183170725 S Bi:2:011:2 -115 32 <
ffff8e2301f32240 2183171034 S Bo:2:011:2 -115 32 = 571e0080 003a6522 003a6522 00007534 00000073 ffffffff 0f0a4964 161d4517
ffff8e2301f33740 2183171038 S Bo:2:011:2 -115 32 = 747effff 006a6722 006a6722 00007534 00000073 ffffffff 0f0a4964 161d4517
ffff8e2301f32240 2183171097 C Bo:2:011:2 0 32 >
ffff8e2301f32240 2183171098 S Bo:2:011:2 -115 32 = 747bffff 006a6922 006a6922 00007534 00000073 ffffffff 10074967 6e1c487e
ffff8e2301f33740 2183171145 C Bo:2:011:2 0 32 >
ffff8e2301f33740 2183171146 S Bo:2:011:2 -115 32 = 136f370f 003a6922 003a6922 00007534 00000073 ffffffff 10074967 6e1c487e
ffff8e2301f32240 2183173954 C Bo:2:011:2 0 32 >
ffff8e2301f32240 2183173956 S Bo:2:011:2 -115 4 = 136f370e
ffff8e2301f33740 2183176737 C Bo:2:011:2 0 32 >
ffff8e2301f32240 2183179450 C Bo:2:011:2 0 4 >
ffff8e2301f326c0 2183184879 C Bi:2:011:2 0 1 = 06
ffff8e2301f326c0 2183184881 S Bi:2:011:2 -115 32 <
ffff8e2301f32240 2183185230 S Bo:2:011:2 -115 32 = 571e8080 003a7022 003a1621 00007534 00000073 ffffffff 0e0e527e 0d0e2065
ffff8e2301f33740 2183185234 S Bo:2:011:2 -115 32 = 131b52ff 006a7122 006a7122 00007534 00000073 ffffffff 434f4164 17085576
ffff8e2301f32240 2183185290 C Bo:2:011:2 0 32 >
ffff8e2301f32240 2183185291 S Bo:2:011:2 -115 32 = 110b200f 003a7122 003a7122 00007534 00000073 ffffffff 434f4164 17085576
ffff8e2301f33740 2183185339 C Bo:2:011:2 0 32 >
ffff8e2301f33740 2183185340 S Bo:2:011:2 -115 32 = 110b200f 006a7222 006a7222 00007534 00000073 ffffffff 0e1c4917 7b7bffff
ffff8e2301f32240 2183188166 C Bo:2:011:2 0 32 >
ffff8e2301f32240 2183188168 S Bo:2:011:2 -115 4 = ffffffff
ffff8e2301f33740 2183190875 C Bo:2:011:2 0 32 >
ffff8e2301f32240 2183193726 C Bo:2:011:2 0 4 >
ffff8e2301f32e40 2183199156 C Bi:2:011:2 0 1 = 06
ffff8e2301f32e40 2183199158 S Bi:2:011:2 -115 32 <
ffff8e2301f32240 2183199481 S Bo:2:011:2 -115 32 = 571f0080 003a7222 003a7222 00007534 00000073 ffffffff 0e1c4917 7b7affff
ffff8e2301f33740 2183199484 S Bo:2:011:2 -115 32 = ffffffff 003a1921 003a1921 00007534 00000073 ffffffff 02065317 726f3837
ffff8e2301f32240 2183199541 C Bo:2:011:2 0 32 >
ffff8e2301f32240 2183199542 S Bo:2:011:2 -115 32 = ffffffff 006a2021 006a2021 00007534 00000073 ffffffff 02065317 716f380f
ffff8e2301f33740 2183199589 C Bo:2:011:2 0 32 >
ffff8e2301f33740 2183199590 S Bo:2:011:2 -115 32 = ffffffff 001f7822 001f2421 00007534 00000073 ffffffff 0b1a4d75 061d2061
ffff8e2301f32240 2183202377 C Bo:2:011:2 0 32 >
ffff8e2301f32240 2183202379 S Bo:2:011:2 -115 4 = 171c200e
ffff8e2301f33740 2183205165 C Bo:2:011:2 0 32 >
ffff8e2301f32240 2183207874 C Bo:2:011:2 0 4 >
ffff8e2301f326c0 2183213336 C Bi:2:011:2 0 1 = 06
ffff8e2301f326c0 2183213338 S Bi:2:011:2 -115 32 <
ffff8e2301f32240 2183213748 S Bo:2:011:2 -115 32 = 571f8080 00005522 00005522 00007534 00000073 ffffffff 0f0a4964 161d4517
ffff8e2301f33740 2183213752 S Bo:2:011:2 -115 32 = 0f7effff 006a5522 006a5522 00007534 00000073 ffffffff 0f0a4964 161d4517
ffff8e2301f32240 2183213809 C Bo:2:011:2 0 32 >
ffff8e2301f32240 2183213813 S Bo:2:011:2 -115 32 = 0f7dffff 001f5622 001f5622 00007534 00000073 ffffffff 0f0a4964 161d4517
ffff8e2301f33740 2183213857 C Bo:2:011:2 0 32 >
ffff8e2301f33740 2183213859 S Bo:2:011:2 -115 32 = 0f7cffff 006a6022 006a0621 00007534 00000073 ffffffff 134f5263 634f5064
ffff8e2301f32240 2183216626 C Bo:2:011:2 0 32 >
ffff8e2301f32240 2183216627 S Bo:2:011:2 -115 4 = 637930ff
ffff8e2301f33740 2183219449 C Bo:2:011:2 0 32 >
ffff8e2301f32240 2183222170 C Bo:2:011:2 0 4 >
ffff8e2301f32e40 2183227722 C Bi:2:011:2 0 1 = 06
ffff8e2301f32e40 2183227724 S Bi:2:011:2 -115 32 <
ffff8e2301f32240 2183228084 S Bo:2:011:2 -115 32 = 57200080 003a6022 003a6022 00007534 00000073 ffffffff 100e5217 757effff
ffff8e2301f33740 2183228088 S Bo:2:011:2 -115 32 = ffffffff 006a6322 006a6322 00007534 00000073 ffffffff 0d0c4917 7579ffff
ffff8e2301f32240 2183228143 C Bo:2:011:2 0 32 >
ffff8e2301f32240 2183228144 S Bo:2:011:2 -115 32 = ffffffff 003a6622 003a6622 00007534 00000073 ffffffff 100e5217 0c012d64
ffff8e2301f33740 2183228199 C Bo:2:011:2 0 32 >
ffff8e2301f33740 2183228200 S Bo:2:011:2 -115 32 = 430a4e72 006a6822 006a6822 00007534 00000073 ffffffff 0f0a4964 161d4517
ffff8e2301f32240 2183230957 C Bo:2:011:2 0 32 >
ffff8e2301f32240 2183230959 S Bo:2:011:2 -115 4 = 7479ffff
ffff8e2301f33740 2183233734 C Bo:2:011:2 0 32 >
ffff8e2301f32240 2183236464 C Bo:2:011:2 0 4 >
ffff8e2301f326c0 2183244179 C Bi:2:011:2 0 1 = 06
ffff8e2301f326c0 2183244182 S Bi:2:011:2 -115 32 <
ffff8e2301f32240 2183244499 S Bo:2:011:2 -115 32 = 57208080 001f7122 001f7122 00007534 00000073 ffffffff 0f0a4964 161d4517
ffff8e2301f33740 2183244503 S Bo:2:011:2 -115 32 = 7a7effff 003a7122 003a7122 00007534 00000073 ffffffff 0f0a4964 161d4517
ffff8e2301f32240 2183244560 C Bo:2:011:2 0 32 >
ffff8e2301f32240 2183244561 S Bo:2:011:2 -115 32 = 7a7bffff ffffffff ffffffff ffffffff ffffffff ffffffff ffffffff ffffffff
ffff8e2301f33740 2183244609 C Bo:2:011:2 0 32 >
ffff8e2301f33740 2183244609 S Bo:2:011:2 -115 32 = ffffffff ffffffff ffffffff ffffffff ffffffff ffffffff ffffffff ffffffff
ffff8e2301f32240 2183247379 C Bo:2:011:2 0 32 >
ffff8e2301f32240 2183247381 S Bo:2:011:2 -115 4 = ffffffff
ffff8e2301f33740 2183250170 C Bo:2:011:2 0 32 >
ffff8e2301f32240 2183252898 C Bo:2:011:2 0 4 >
ffff8e2301f32e40 2183258317 C Bi:2:011:2 0 1 = 06
ffff8e2301f32e40 2183258318 S Bi:2:011:2 -115 32 <
ffff8e2301f32240 2183258647 S Bo:2:011:2 -115 32 = 57210080 ffffffff ffffffff ffffffff ffffffff ffffffff ffffffff ffffffff
ffff8e2301f33740 2183258651 S Bo:2:011:2 -115 32 = ffffffff ffffffff ffffffff ffffffff ffffffff ffffffff ffffffff ffffffff
ffff8e2301f32240 2183258730 C Bo:2:011:2 0 32 >
ffff8e2301f32240 2183258732 S Bo:2:011:2 -115 32 = ffffffff ffffffff ffffffff ffffffff ffffffff ffffffff ffffffff ffffffff
ffff8e2301f33740 2183258779 C Bo:2:011:2 0 32 >
ffff8e2301f33740 2183258780 S Bo:2:011:2 -115 32 = ffffffff ffffffff ffffffff ffffffff ffffffff ffffffff ffffffff ffffffff
ffff8e2301f32240 2183261592 C Bo:2:011:2 0 32 >
ffff8e2301f32240 2183261593 S Bo:2:011:2 -115 4 = ffffffff
ffff8e2301f33740 2183264359 C Bo:2:011:2 0 32 >
ffff8e2301f32240 2183267090 C Bo:2:011:2 0 4 >
ffff8e2301f326c0 2183272454 C Bi:2:011:2 0 1 = 06
ffff8e2301f326c0 2183272456 S Bi:2:011:2 -115 32 <
ffff8e2301f32240 2183272848 S Bo:2:011:2 -115 32 = 57218080 ffffffff ffffffff ffffffff ffffffff ffffffff ffffffff ffffffff
ffff8e2301f33740 2183272851 S Bo:2:011:2 -115 32 = ffffffff ffffffff ffffffff ffffffff ffffffff ffffffff ffffffff ffffffff
ffff8e2301f32240 2183272908 C Bo:2:011:2 0 32 >
ffff8e2301f32240 2183272909 S Bo:2:011:2 -115 32 = ffffffff ffffffff ffffffff ffffffff ffffffff ffffffff ffffffff ffffffff
ffff8e2301f33740 2183272956 C Bo:2:011:2 0 32 >
ffff8e2301f33740 2183272957 S Bo:2:011:2 -115 32 = ffffffff ffffffff ffffffff ffffffff ffffffff ffffffff ffffffff ffffffff
ffff8e2301f32240 2183275736 C Bo:2:011:2 0 32 >
ffff8e2301f32240 2183275738 S Bo:2:011:2 -115 4 = ffffffff
ffff8e2301f33740 2183278520 C Bo:2:011:2 0 32 >
ffff8e2301f32240 2183281249 C Bo:2:011:2 0 4 >
ffff8e2301f32e40 2183286722 C Bi:2:011:2 0 1 = 06
ffff8e2301f32e40 2183286724 S Bi:2:011:2 -115 32 <
ffff8e2301f32240 2183287108 S Bo:2:011:2 -115 32 = 57220080 ffffffff ffffffff ffffffff ffffffff ffffffff ffffffff ffffffff
ffff8e2301f33740 2183287112 S Bo:2:011:2 -115 32 = ffffffff ffffffff ffffffff ffffffff ffffffff ffffffff ffffffff ffffffff
ffff8e2301f32240 2183287169 C Bo:2:011:2 0 32 >
ffff8e2301f32240 2183287170 S Bo:2:011:2 -115 32 = ffffffff ffffffff ffffffff ffffffff ffffffff ffffffff ffffffff ffffffff
ffff8e2301f33740 2183287222 C Bo:2:011:2 0 32 >
ffff8e2301f33740 2183287223 S Bo:2:011:2 -115 32 = ffffffff ffffffff ffffffff ffffffff ffffffff ffffffff ffffffff ffffffff
ffff8e2301f32240 2183290024 C Bo:2:011:2 0 32 >
ffff8e2301f32240 2183290026 S Bo:2:011:2 -115 4 = ffffffff
ffff8e2301f33740 2183292744 C Bo:2:011:2 0 32 >
ffff8e2301f32240 2183295496 C Bo:2:011:2 0 4 >
ffff8e2301f326c0 2183300928 C Bi:2:011:2 0 1 = 06
ffff8e2301f326c0 2183300931 S Bi:2:011:2 -115 32 <
ffff8e2301f32240 2183301220 S Bo:2:011:2 -115 32 = 57228080 ffffffff ffffffff ffffffff ffffffff ffffffff ffffffff ffffffff
ffff8e2301f33740 2183301223 S Bo:2:011:2 -115 32 = ffffffff ffffffff ffffffff ffffffff ffffffff ffffffff ffffffff ffffffff
ffff8e2301f32240 2183301281 C Bo:2:011:2 0 32 >
ffff8e2301f32240 2183301282 S Bo:2:011:2 -115 32 = ffffffff ffffffff ffffffff ffffffff ffffffff ffffffff ffffffff ffffffff
ffff8e2301f33740 2183301329 C Bo:2:011:2 0 32 >
ffff8e2301f33740 2183301330 S Bo:2:011:2 -115 32 = ffffffff ffffffff ffffffff ffffffff ffffffff ffffffff ffffffff ffffffff
ffff8e2301f32240 2183304127 C Bo:2:011:2 0 32 >
ffff8e2301f32240 2183304128 S Bo:2:011:2 -115 4 = ffffffff
ffff8e2301f33740 2183306885 C Bo:2:011:2 0 32 >
ffff8e2301f32240 2183309727 C Bo:2:011:2 0 4 >
ffff8e2301f32e40 2183315068 C Bi:2:011:2 0 1 = 06
ffff8e2301f32e40 2183315070 S Bi:2:011:2 -115 32 <
ffff8e2301f32240 2183315374 S Bo:2:011:2 -115 32 = 57230080 ffffffff ffffffff ffffffff ffffffff ffffffff ffffffff ffffffff
ffff8e2301f33740 2183315378 S Bo:2:011:2 -115 32 = ffffffff ffffffff ffffffff ffffffff ffffffff ffffffff ffffffff ffffffff
ffff8e2301f32240 2183315434 C Bo:2:011:2 0 32 >
ffff8e2301f32240 2183315436 S Bo:2:011:2 -115 32 = ffffffff ffffffff ffffffff ffffffff ffffffff ffffffff ffffffff ffffffff
ffff8e2301f33740 2183315484 C Bo:2:011:2 0 32 >
ffff8e2301f33740 2183315484 S Bo:2:011:2 -115 32 = ffffffff ffffffff ffffffff ffffffff ffffffff ffffffff ffffffff ffffffff
ffff8e2301f32240 2183318272 C Bo:2:011:2 0 32 >
ffff8e2301f32240 2183318274 S Bo:2:011:2 -115 4 = ffffffff
ffff8e2301f33740 2183321025 C Bo:2:011:2 0 32 >
ffff8e2301f32240 2183323774 C Bo:2:011:2 0 4 >
ffff8e2301f326c0 2183329212 C Bi:2:011:2 0 1 = 06
ffff8e2301f326c0 2183329214 S Bi:2:011:2 -115 32 <
ffff8e2301f32240 2183329577 S Bo:2:011:2 -115 32 = 57238080 ffffffff ffffffff ffffffff ffffffff ffffffff ffffffff ffffffff
ffff8e2301f33740 2183329581 S Bo:2:011:2 -115 32 = ffffffff ffffffff ffffffff ffffffff ffffffff ffffffff ffffffff ffffffff
ffff8e2301f32240 2183329637 C Bo:2:011:2 0 32 >
ffff8e2301f32240 2183329638 S Bo:2:011:2 -115 32 = ffffffff ffffffff ffffffff ffffffff ffffffff ffffffff ffffffff ffffffff
ffff8e2301f33740 2183329753 C Bo:2:011:2 0 32 >
ffff8e2301f33740 2183329755 S Bo:2:011:2 -115 32 = ffffffff ffffffff ffffffff ffffffff ffffffff ffffffff ffffffff ffffffff
ffff8e2301f32240 2183332451 C Bo:2:011:2 0 32 >
ffff8e2301f32240 2183332453 S Bo:2:011:2 -115 4 = ffffffff
ffff8e2301f33740 2183335250 C Bo:2:011:2 0 32 >
ffff8e2301f32240 2183337957 C Bo:2:011:2 0 4 >
ffff8e2301f32e40 2183343381 C Bi:2:011:2 0 1 = 06
ffff8e2301f32e40 2183343383 S Bi:2:011:2 -115 32 <
ffff8e2301f32240 2183343728 S Bo:2:011:2 -115 32 = 57240080 ffffffff ffffffff ffffffff ffffffff ffffffff ffffffff ffffffff
ffff8e2301f33740 2183343732 S Bo:2:011:2 -115 32 = ffffffff ffffffff ffffffff ffffffff ffffffff ffffffff ffffffff ffffffff
ffff8e2301f32240 2183343788 C Bo:2:011:2 0 32 >
ffff8e2301f32240 2183343789 S Bo:2:011:2 -115 32 = ffffffff ffffffff ffffffff ffffffff ffffffff ffffffff ffffffff ffffffff
ffff8e2301f33740 2183343837 C Bo:2:011:2 0 32 >
ffff8e2301f33740 2183343837 S Bo:2:011:2 -115 32 = ffffffff ffffffff ffffffff ffffffff ffffffff ffffffff ffffffff ffffffff
ffff8e2301f32240 2183346602 C Bo:2:011:2 0 32 >
ffff8e2301f32240 2183346604 S Bo:2:011:2 -115 4 = ffffffff
ffff8e2301f33740 2183349378 C Bo:2:011:2 0 32 >
ffff8e2301f32240 2183352123 C Bo:2:011:2 0 4 >
ffff8e2301f326c0 2183357546 C Bi:2:011:2 0 1 = 06
ffff8e2301f326c0 2183357548 S Bi:2:011:2 -115 32 <
ffff8e2301f32240 2183357950 S Bo:2:011:2 -115 32 = 57248080 ffffffff ffffffff ffffffff ffffffff ffffffff ffffffff ffffffff
ffff8e2301f33740 2183357954 S Bo:2:011:2 -115 32 = ffffffff ffffffff ffffffff ffffffff ffffffff ffffffff ffffffff ffffffff
ffff8e2301f32240 2183358011 C Bo:2:011:2 0 32 >
ffff8e2301f32240 2183358012 S Bo:2:011:2 -115 32 = ffffffff ffffffff ffffffff ffffffff ffffffff ffffffff ffffffff ffffffff
ffff8e2301f33740 2183358059 C Bo:2:011:2 0 32 >
ffff8e2301f33740 2183358060 S Bo:2:011:2 -115 32 = ffffffff ffffffff ffffffff ffffffff ffffffff ffffffff ffffffff ffffffff
ffff8e2301f32240 2183360816 C Bo:2:011:2 0 32 >
ffff8e2301f32240 2183360818 S Bo:2:011:2 -115 4 = ffffffff
ffff8e2301f33740 2183363590 C Bo:2:011:2 0 32 >
ffff8e2301f32240 2183366362 C Bo:2:011:2 0 4 >
ffff8e2301f32e40 2183371858 C Bi:2:011:2 0 1 = 06
ffff8e2301f32e40 2183371860 S Bi:2:011:2 -115 32 <
ffff8e2301f32240 2183372154 S Bo:2:011:2 -115 32 = 57250080 ffffffff ffffffff ffffffff ffffffff ffffffff ffffffff ffffffff
ffff8e2301f33740 2183372158 S Bo:2:011:2 -115 32 = ffffffff 66496073 66496073 00000000 00000073 ffffffff 13025217 737e2003
ffff8e2301f32240 2183372215 C Bo:2:011:2 0 32 >
ffff8e2301f32240 2183372215 S Bo:2:011:2 -115 32 = 77792e07 36576073 36576073 00000000 00000073 ffffffff 13025217 737d2003
ffff8e2301f33740 2183372264 C Bo:2:011:2 0 32 >
ffff8e2301f33740 2183372265 S Bo:2:011:2 -115 32 = 77792e07 667e6073 667e6073 00000000 00000073 ffffffff 13025217 737c2003
ffff8e2301f32240 2183375028 C Bo:2:011:2 0 32 >
ffff8e2301f32240 2183375030 S Bo:2:011:2 -115 4 = 77792e07
ffff8e2301f33740 2183377837 C Bo:2:011:2 0 32 >
ffff8e2301f32240 2183380559 C Bo:2:011:2 0 4 >
ffff8e2301f326c0 2183385999 C Bi:2:011:2 0 1 = 06
ffff8e2301f326c0 2183386001 S Bi:2:011:2 -115 32 <
ffff8e2301f32240 2183386327 S Bo:2:011:2 -115 32 = 57258080 360c6073 360c6073 00000000 00000073 ffffffff 13025217 737b2003
ffff8e2301f33740 2183386331 S Bo:2:011:2 -115 32 = 77792e07 66196073 66196073 00000000 00000073 ffffffff 13025217 737a2003
ffff8e2301f32240 2183386387 C Bo:2:011:2 0 32 >
ffff8e2301f32240 2183386388 S Bo:2:011:2 -115 32 = 77792e07 36276073 36276073 00000000 00000073 ffffffff 13025217 73792003
ffff8e2301f33740 2183386436 C Bo:2:011:2 0 32 >
ffff8e2301f33740 2183386437 S Bo:2:011:2 -115 32 = 77792e07 66ce6073 66ce6073 00000000 00000073 ffffffff 13025217 73782003
ffff8e2301f32240 2183389240 C Bo:2:011:2 0 32 >
ffff8e2301f32240 2183389241 S Bo:2:011:2 -115 4 = 77792e07
ffff8e2301f33740 2183391998 C Bo:2:011:2 0 32 >
ffff8e2301f32240 2183394722 C Bo:2:011:2 0 4 >
ffff8e2301f32e40 2183400134 C Bi:2:011:2 0 1 = 06
ffff8e2301f32e40 2183400136 S Bi:2:011:2 -115 32 <
ffff8e2301f32240 2183400474 S Bo:2:011:2 -115 32 = 57260080 36dc6073 36dc6073 00000000 00000073 ffffffff 13025217 73772003
ffff8e2301f33740 2183400478 S Bo:2:011:2 -115 32 = 77792e07 66496173 66496173 00000000 00000073 ffffffff 13025217 73762003
ffff8e2301f32240 2183400534 C Bo:2:011:2 0 32 >
ffff8e2301f32240 2183400535 S Bo:2:011:2 -115 32 = 77792e06 36576173 36576173 00000000 00000073 ffffffff 13025217 727f2003
ffff8e2301f33740 2183400582 C Bo:2:011:2 0 32 >
ffff8e2301f33740 2183400583 S Bo:2:011:2 -115 32 = 77792e06 667e6173 667e6173 00000000 00000073 ffffffff 13025217 727e2003
ffff8e2301f32240 2183403381 C Bo:2:011:2 0 32 >
ffff8e2301f32240 2183403382 S Bo:2:011:2 -115 4 = 77792e06
ffff8e2301f33740 2183406171 C Bo:2:011:2 0 32 >
ffff8e2301f32240 2183408887 C Bo:2:011:2 0 4 >
ffff8e2301f326c0 2183414319 C Bi:2:011:2 0 1 = 06
ffff8e2301f326c0 2183414321 S Bi:2:011:2 -115 32 <
ffff8e2301f32240 2183414674 S Bo:2:011:2 -115 32 = 57268080 360c6173 360c6173 00000000 00000073 ffffffff 13025217 727d2003
ffff8e2301f33740 2183414677 S Bo:2:011:2 -115 32 = 77792e06 66196173 66196173 00000000 00000073 ffffffff 13025217 727c2003
ffff8e2301f32240 2183414734 C Bo:2:011:2 0 32 >
ffff8e2301f32240 2183414735 S Bo:2:011:2 -115 32 = 77792e06 36276173 36276173 00000000 00000073 ffffffff 13025217 727b2003
ffff8e2301f33740 2183414783 C Bo:2:011:2 0 32 >
ffff8e2301f33740 2183414784 S Bo:2:011:2 -115 32 = 77792e06 66ce6173 66ce6173 00000000 00000073 ffffffff 13025217 727a2003
ffff8e2301f32240 2183417603 C Bo:2:011:2 0 32 >
ffff8e2301f32240 2183417605 S Bo:2:011:2 -115 4 = 77792e06
ffff8e2301f33740 2183420318 C Bo:2:011:2 0 32 >
ffff8e2301f32240 2183423092 C Bo:2:011:2 0 4 >
ffff8e2301f32e40 2183428634 C Bi:2:011:2 0 1 = 06
ffff8e2301f32e40 2183428636 S Bi:2:011:2 -115 32 <
ffff8e2301f32240 2183428941 S Bo:2:011:2 -115 32 = 57270080 36dc6173 36dc6173 00000000 00000073 ffffffff 13025217 72792003
ffff8e2301f33740 2183428945 S Bo:2:011:2 -115 32 = 77792e06 001f5512 001f5512 00000000 00000073 ffffffff 102e7454 2c222006
ffff8e2301f32240 2183429002 C Bo:2:011:2 0 32 >
ffff8e2301f32240 2183429004 S Bo:2:011:2 -115 32 = ffffffff 001f5412 001f5412 00000000 00000073 ffffffff 102e7454 2c222005
ffff8e2301f33740 2183429054 C Bo:2:011:2 0 32 >
ffff8e2301f33740 2183429055 S Bo:2:011:2 -115 32 = ffffffff 000f7012 000f7012 00000000 00000073 ffffffff 102e7454 2c222004
ffff8e2301f32240 2183431816 C Bo:2:011:2 0 32 >
ffff8e2301f32240 2183431817 S Bo:2:011:2 -115 4 = ffffffff
ffff8e2301f33740 2183434625 C Bo:2:011:2 0 32 >
ffff8e2301f32240 2183437351 C Bo:2:011:2 0 4 >
ffff8e2301f326c0 2183442791 C Bi:2:011:2 0 1 = 06
ffff8e2301f326c0 2183442795 S Bi:2:011:2 -115 32 <
ffff8e2301f32240 2183443147 S Bo:2:011:2 -115 32 = 57278080 002f5512 002f5512 00000000 00000073 ffffffff 102e7454 2c222003
ffff8e2301f33740 2183443151 S Bo:2:011:2 -115 32 = ffffffff 00006612 00006612 00000000 00000073 ffffffff 102e7454 2c222002
ffff8e2301f32240 2183443210 C Bo:2:011:2 0 32 >
ffff8e2301f32240 2183443211 S Bo:2:011:2 -115 32 = ffffffff 00008512 00008512 00000000 00000073 ffffffff 102e7454 2c222001
ffff8e2301f33740 2183443257 C Bo:2:011:2 0 32 >
ffff8e2301f33740 2183443261 S Bo:2:011:2 -115 32 = ffffffff 135d1572 135d1572 00000000 00000073 ffffffff 10064d67 631c4963
ffff8e2301f32240 2183446023 C Bo:2:011:2 0 32 >
ffff8e2301f32240 2183446028 S Bo:2:011:2 -115 4 = 066f3006
ffff8e2301f33740 2183448814 C Bo:2:011:2 0 32 >
ffff8e2301f32240 2183451545 C Bo:2:011:2 0 4 >
ffff8e2301f32e40 2183457078 C Bi:2:011:2 0 1 = 06
ffff8e2301f32e40 2183457083 S Bi:2:011:2 -115 32 <
ffff8e2301f32240 2183457401 S Bo:2:011:2 -115 32 = 57280080 006a1572 006a1572 00000000 00000073 ffffffff 10064d67 631c4963
ffff8e2301f33740 2183457405 S Bo:2:011:2 -115 32 = 066f3005 13781572 13781572 00000000 00000073 ffffffff 10064d67 631c4963
ffff8e2301f32240 2183457464 C Bo:2:011:2 0 32 >
ffff8e2301f32240 2183457467 S Bo:2:011:2 -115 32 = 066f3004 001f1572 001f1572 00000000 00000073 ffffffff 10064d67 631c4963
ffff8e2301f33740 2183457511 C Bo:2:011:2 0 32 >
ffff8e2301f33740 2183457513 S Bo:2:011:2 -115 32 = 066f3003 132d1572 132d1572 00000000 00000073 ffffffff 10064d67 631c4963
ffff8e2301f32240 2183460308 C Bo:2:011:2 0 32 >
ffff8e2301f32240 2183460313 S Bo:2:011:2 -115 4 = 066f3002
ffff8e2301f33740 2183463092 C Bo:2:011:2 0 32 >
ffff8e2301f32240 2183465830 C Bo:2:011:2 0 4 >
ffff8e2301f326c0 2183471249 C Bi:2:011:2 0 1 = 06
ffff8e2301f326c0 2183471253 S Bi:2:011:2 -115 32 <
ffff8e2301f32240 2183471580 S Bo:2:011:2 -115 32 = 57288080 003a1772 003a1772 00000000 00000073 ffffffff 10064d67 631c4963
ffff8e2301f33740 2183471585 S Bo:2:011:2 -115 32 = 066f3001 001f9072 001f9072 00000000 00000073 ffffffff 10064d67 631c4963
ffff8e2301f32240 2183471642 C Bo:2:011:2 0 32 >
ffff8e2301f32240 2183471645 S Bo:2:011:2 -115 32 = 066f3037 00009172 00009172 00000000 00000073 ffffffff 10064d67 631c4963
ffff8e2301f33740 2183471780 C Bo:2:011:2 0 32 >
ffff8e2301f33740 2183471784 S Bo:2:011:2 -115 32 = 066f300f 006a9172 006a9172 00000000 00000073 ffffffff 10064d67 631c4963
ffff8e2301f32240 2183474459 C Bo:2:011:2 0 32 >
ffff8e2301f32240 2183474465 S Bo:2:011:2 -115 4 = 066f300e
ffff8e2301f33740 2183477249 C Bo:2:011:2 0 32 >
ffff8e2301f32240 2183479978 C Bo:2:011:2 0 4 >
ffff8e2301f32e40 2183485383 C Bi:2:011:2 0 1 = 06
ffff8e2301f32e40 2183485387 S Bi:2:011:2 -115 32 <
ffff8e2301f32240 2183485803 S Bo:2:011:2 -115 32 = 57290080 001f9172 001f9172 00000000 00000073 ffffffff 10064d67 631c4963
ffff8e2301f33740 2183485807 S Bo:2:011:2 -115 32 = 066f3107 003a9172 003a9172 00000000 00000073 ffffffff 10064d67 631c4963
ffff8e2301f32240 2183485866 C Bo:2:011:2 0 32 >
ffff8e2301f32240 2183485869 S Bo:2:011:2 -115 32 = 066f3106 00009272 00009272 00000000 00000073 ffffffff 10064d67 631c4963
ffff8e2301f33740 2183485914 C Bo:2:011:2 0 32 >
ffff8e2301f33740 2183485916 S Bo:2:011:2 -115 32 = 066f3105 006a9272 006a9272 00000000 00000073 ffffffff 10064d67 631c4963
ffff8e2301f32240 2183488739 C Bo:2:011:2 0 32 >
ffff8e2301f32240 2183488744 S Bo:2:011:2 -115 4 = 066f3104
ffff8e2301f33740 2183491458 C Bo:2:011:2 0 32 >
ffff8e2301f32240 2183494224 C Bo:2:011:2 0 4 >
ffff8e2301f326c0 2183499724 C Bi:2:011:2 0 1 = 06
ffff8e2301f326c0 2183499729 S Bi:2:011:2 -115 32 <
ffff8e2301f32240 2183500065 S Bo:2:011:2 -115 32 = 57298080 001f9272 001f9272 00000000 00000073 ffffffff 10064d67 631c4963
ffff8e2301f33740 2183500069 S Bo:2:011:2 -115 32 = 066f3103 003a9272 003a9272 00000000 00000073 ffffffff 10064d67 631c4963
ffff8e2301f32240 2183500130 C Bo:2:011:2 0 32 >
ffff8e2301f32240 2183500133 S Bo:2:011:2 -115 32 = 066f3102 00009372 00009372 00000000 00000073 ffffffff 10064d67 631c4963
ffff8e2301f33740 2183500180 C Bo:2:011:2 0 32 >
ffff8e2301f33740 2183500182 S Bo:2:011:2 -115 32 = 066f3101 006a9372 006a9372 00000000 00000073 ffffffff 10064d67 631c4963
ffff8e2301f32240 2183502953 C Bo:2:011:2 0 32 >
ffff8e2301f32240 2183502958 S Bo:2:011:2 -115 4 = 066f3137
ffff8e2301f33740 2183505746 C Bo:2:011:2 0 32 >
ffff8e2301f32240 2183508467 C Bo:2:011:2 0 4 >
ffff8e2301f32e40 2183514043 C Bi:2:011:2 0 1 = 06
ffff8e2301f32e40 2183514047 S Bi:2:011:2 -115 32 <
ffff8e2301f32240 2183514379 S Bo:2:011:2 -115 32 = 572a0080 001f9372 001f9372 00000000 00000073 ffffffff 10064d67 631c4963
ffff8e2301f33740 2183514383 S Bo:2:011:2 -115 32 = 066f310f 003a9372 003a9372 00000000 00000073 ffffffff 10064d67 631c4963
ffff8e2301f32240 2183514441 C Bo:2:011:2 0 32 >
ffff8e2301f32240 2183514444 S Bo:2:011:2 -115 32 = 066f310e 00009472 00009472 00000000 00000073 ffffffff 10064d67 631c4963
ffff8e2301f33740 2183514489 C Bo:2:011:2 0 32 >
ffff8e2301f33740 2183514492 S Bo:2:011:2 -115 32 = 066f3207 006a9472 006a9472 00000000 00000073 ffffffff 10064d67 631c4963
ffff8e2301f32240 2183517311 C Bo:2:011:2 0 32 >
ffff8e2301f32240 2183517316 S Bo:2:011:2 -115 4 = 066f3206
ffff8e2301f33740 2183520077 C Bo:2:011:2 0 32 >
ffff8e2301f32240 2183522796 C Bo:2:011:2 0 4 >
ffff8e2301f326c0 2183528373 C Bi:2:011:2 0 1 = 06
ffff8e2301f326c0 2183528377 S Bi:2:011:2 -115 32 <
ffff8e2301f32240 2183528735 S Bo:2:011:2 -115 32 = 572a8080 001f9472 001f9472 00000000 00000073 ffffffff 10064d67 631c4963
ffff8e2301f33740 2183528739 S Bo:2:011:2 -115 32 = 066f3205 003a9472 003a9472 00000000 00000073 ffffffff 10064d67 631c4963
ffff8e2301f32240 2183528795 C Bo:2:011:2 0 32 >
ffff8e2301f32240 2183528798 S Bo:2:011:2 -115 32 = 066f3204 13789622 13789622 00000000 00000073 ffffffff 10064d67 631c4963
ffff8e2301f33740 2183528857 C Bo:2:011:2 0 32 >
ffff8e2301f33740 2183528860 S Bo:2:011:2 -115 32 = 066f3203 001f9622 001f9622 00000000 00000073 ffffffff 10064d67 631c4963
ffff8e2301f32240 2183531598 C Bo:2:011:2 0 32 >
ffff8e2301f32240 2183531601 S Bo:2:011:2 -115 4 = 066f3202
ffff8e2301f33740 2183534377 C Bo:2:011:2 0 32 >
ffff8e2301f32240 2183537123 C Bo:2:011:2 0 4 >
ffff8e2301f32e40 2183542716 C Bi:2:011:2 0 1 = 06
ffff8e2301f32e40 2183542718 S Bi:2:011:2 -115 32 <
ffff8e2301f32240 2183543112 S Bo:2:011:2 -115 32 = 572b0080 132d9622 132d9622 00000000 00000073 ffffffff 10064d67 631c4963
ffff8e2301f33740 2183543116 S Bo:2:011:2 -115 32 = 066f3201 003a9622 003a9622 00000000 00000073 ffffffff 10064d67 631c4963
ffff8e2301f32240 2183543179 C Bo:2:011:2 0 32 >
ffff8e2301f32240 2183543181 S Bo:2:011:2 -115 32 = 066f3237 00009722 00009722 00000000 00000073 ffffffff 10064d67 631c4963
ffff8e2301f33740 2183543228 C Bo:2:011:2 0 32 >
ffff8e2301f33740 2183543229 S Bo:2:011:2 -115 32 = 066f320f 00001021 00001021 00000000 00000073 ffffffff 10064d67 631c4963
ffff8e2301f32240 2183546022 C Bo:2:011:2 0 32 >
ffff8e2301f32240 2183546024 S Bo:2:011:2 -115 4 = 066f320e
ffff8e2301f33740 2183548734 C Bo:2:011:2 0 32 >
ffff8e2301f32240 2183551498 C Bo:2:011:2 0 4 >
ffff8e2301f326c0 2183556979 C Bi:2:011:2 0 1 = 06
ffff8e2301f326c0 2183556981 S Bi:2:011:2 -115 32 <
ffff8e2301f32240 2183557295 S Bo:2:011:2 -115 32 = 572b8080 135d1021 135d1021 00000000 00000073 ffffffff 10064d67 631c4963
ffff8e2301f33740 2183557298 S Bo:2:011:2 -115 32 = 066f3307 006a1021 006a1021 00000000 00000073 ffffffff 10064d67 631c4963
ffff8e2301f32240 2183557355 C Bo:2:011:2 0 32 >
ffff8e2301f32240 2183557356 S Bo:2:011:2 -115 32 = 066f3306 13781021 13781021 00000000 00000073 ffffffff 10064d67 631c4963
ffff8e2301f33740 2183557403 C Bo:2:011:2 0 32 >
ffff8e2301f33740 2183557403 S Bo:2:011:2 -115 32 = 066f3305 001f1021 001f1021 00000000 00000073 ffffffff 10064d67 631c4963
ffff8e2301f32240 2183560173 C Bo:2:011:2 0 32 >
ffff8e2301f32240 2183560175 S Bo:2:011:2 -115 4 = 066f3304
ffff8e2301f33740 2183562951 C Bo:2:011:2 0 32 >
ffff8e2301f32240 2183565727 C Bo:2:011:2 0 4 >
ffff8e2301f32e40 2183571122 C Bi:2:011:2 0 1 = 06
ffff8e2301f32e40 2183571124 S Bi:2:011:2 -115 32 <
ffff8e2301f32240 2183571457 S Bo:2:011:2 -115 32 = 572c0080 132d1021 132d1021 00000000 00000073 ffffffff 10064d67 631c4963
ffff8e2301f33740 2183571461 S Bo:2:011:2 -115 32 = 066f3303 003a1021 003a1021 00000000 00000073 ffffffff 10064d67 631c4963
ffff8e2301f32240 2183571517 C Bo:2:011:2 0 32 >
ffff8e2301f32240 2183571518 S Bo:2:011:2 -115 32 = 066f3302 13c81021 13c81021 00000000 00000073 ffffffff 10064d67 631c4963
ffff8e2301f33740 2183571565 C Bo:2:011:2 0 32 >
ffff8e2301f33740 2183571566 S Bo:2:011:2 -115 32 = 066f3301 00001121 00001121 00000000 00000073 ffffffff 10064d67 631c4963
ffff8e2301f32240 2183574344 C Bo:2:011:2 0 32 >
ffff8e2301f32240 2183574346 S Bo:2:011:2 -115 4 = 066f3337
ffff8e2301f33740 2183577099 C Bo:2:011:2 0 32 >
ffff8e2301f32240 2183579876 C Bo:2:011:2 0 4 >
ffff8e2301f326c0 2183585293 C Bi:2:011:2 0 1 = 06
ffff8e2301f326c0 2183585294 S Bi:2:011:2 -115 32 <
ffff8e2301f32240 2183585652 S Bo:2:011:2 -115 32 = 572c8080 135d1121 135d1121 00000000 00000073 ffffffff 10064d67 631c4963
ffff8e2301f33740 2183585656 S Bo:2:011:2 -115 32 = 066f330f 00004221 00004221 00000000 00000073 ffffffff 10064d67 631c4963
ffff8e2301f32240 2183585756 C Bo:2:011:2 0 32 >
ffff8e2301f32240 2183585757 S Bo:2:011:2 -115 32 = 066f330e 135d8572 135d8572 00000000 00000073 ffffffff 10064d67 631c4963
ffff8e2301f33740 2183585809 C Bo:2:011:2 0 32 >
ffff8e2301f33740 2183585810 S Bo:2:011:2 -115 32 = 066f3407 006a8572 006a8572 00000000 00000073 ffffffff 10064d67 631c4963
ffff8e2301f32240 2183588558 C Bo:2:011:2 0 32 >
ffff8e2301f32240 2183588560 S Bo:2:011:2 -115 4 = 066f3406
ffff8e2301f33740 2183591379 C Bo:2:011:2 0 32 >
ffff8e2301f32240 2183594077 C Bo:2:011:2 0 4 >
ffff8e2301f32e40 2183599579 C Bi:2:011:2 0 1 = 06
ffff8e2301f32e40 2183599581 S Bi:2:011:2 -115 32 <
ffff8e2301f32240 2183600013 S Bo:2:011:2 -115 32 = 572d0080 13788572 13788572 00000000 00000073 ffffffff 10064d67 631c4963
ffff8e2301f33740 2183600017 S Bo:2:011:2 -115 32 = 066f3405 001f8572 001f8572 00000000 00000073 ffffffff 10064d67 631c4963
ffff8e2301f32240 2183600076 C Bo:2:011:2 0 32 >
ffff8e2301f32240 2183600082 S Bo:2:011:2 -115 32 = 066f3404 132d8572 132d8572 00000000 00000073 ffffffff 10064d67 631c4963
ffff8e2301f33740 2183600124 C Bo:2:011:2 0 32 >
ffff8e2301f33740 2183600125 S Bo:2:011:2 -115 32 = 066f3403 003a8772 003a8772 00000000 00000073 ffffffff 10064d67 631c4963
ffff8e2301f32240 2183602888 C Bo:2:011:2 0 32 >
ffff8e2301f32240 2183602890 S Bo:2:011:2 -115 4 = 066f3402
ffff8e2301f33740 2183605736 C Bo:2:011:2 0 32 >
ffff8e2301f32240 2183608398 C Bo:2:011:2 0 4 >
ffff8e2301f326c0 2183613904 C Bi:2:011:2 0 1 = 06
ffff8e2301f326c0 2183613906 S Bi:2:011:2 -115 32 <
ffff8e2301f32240 2183614260 S Bo:2:011:2 -115 32 = 572d8080 001f4021 001f4021 00000000 00000073 ffffffff 16042064 0a025017
ffff8e2301f33740 2183614264 S Bo:2:011:2 -115 32 = 737effff 132d4021 132d4021 00000000 00000073 ffffffff 16042064 0a025017
ffff8e2301f32240 2183614326 C Bo:2:011:2 0 32 >
ffff8e2301f32240 2183614327 S Bo:2:011:2 -115 32 = 737dffff 13c89021 13c89021 00000000 00000073 ffffffff 16042064 0a025017
ffff8e2301f33740 2183614374 C Bo:2:011:2 0 32 >
ffff8e2301f33740 2183614375 S Bo:2:011:2 -115 32 = 737cffff 135d9321 135d9321 00000000 00000073 ffffffff 16042064 0a025017
ffff8e2301f32240 2183617171 C Bo:2:011:2 0 32 >
ffff8e2301f32240 2183617173 S Bo:2:011:2 -115 4 = 737bffff
ffff8e2301f33740 2183619952 C Bo:2:011:2 0 32 >
ffff8e2301f32240 2183622723 C Bo:2:011:2 0 4 >
ffff8e2301f32e40 2183628229 C Bi:2:011:2 0 1 = 06
ffff8e2301f32e40 2183628231 S Bi:2:011:2 -115 32 <
ffff8e2301f32240 2183628562 S Bo:2:011:2 -115 32 = 572e0080 001f3020 001f3020 00000000 00000073 ffffffff 16042064 0a025017
ffff8e2301f33740 2183628566 S Bo:2:011:2 -115 32 = 737affff 132d3020 132d3020 00000000 00000073 ffffffff 16042064 0a025017
ffff8e2301f32240 2183628622 C Bo:2:011:2 0 32 >
ffff8e2301f32240 2183628623 S Bo:2:011:2 -115 32 = 7379ffff 13c83020 13c83020 00000000 00000073 ffffffff 16042064 0a025017
ffff8e2301f33740 2183628739 C Bo:2:011:2 0 32 >
ffff8e2301f33740 2183628741 S Bo:2:011:2 -115 32 = 7378ffff 135d9373 135d9373 00000000 00000073 ffffffff 16042064 0a025017
ffff8e2301f32240 2183631460 C Bo:2:011:2 0 32 >
ffff8e2301f32240 2183631461 S Bo:2:011:2 -115 4 = 7377ffff
ffff8e2301f33740 2183634236 C Bo:2:011:2 0 32 >
ffff8e2301f32240 2183636951 C Bo:2:011:2 0 4 >
ffff8e2301f326c0 2183642361 C Bi:2:011:2 0 1 = 06
ffff8e2301f326c0 2183642363 S Bi:2:011:2 -115 32 <
ffff8e2301f32240 2183642722 S Bo:2:011:2 -115 32 = 572e8080 00009473 00009473 00000000 00000073 ffffffff 16042064 0a025017
ffff8e2301f33740 2183642726 S Bo:2:011:2 -115 32 = 7376ffff 003a9473 003a9473 00000000 00000073 ffffffff 16042064 0a025017
ffff8e2301f32240 2183642782 C Bo:2:011:2 0 32 >
ffff8e2301f32240 2183642783 S Bo:2:011:2 -115 32 = 727fffff 13c88772 13c88772 00000000 00000073 ffffffff 16042064 0a025017
ffff8e2301f33740 2183642831 C Bo:2:011:2 0 32 >
ffff8e2301f33740 2183642831 S Bo:2:011:2 -115 32 = 727effff 00008872 00008872 00000000 00000073 ffffffff 16042064 0a025017
ffff8e2301f32240 2183645604 C Bo:2:011:2 0 32 >
ffff8e2301f32240 2183645606 S Bo:2:011:2 -115 4 = 727dffff
ffff8e2301f33740 2183648362 C Bo:2:011:2 0 32 >
ffff8e2301f32240 2183651104 C Bo:2:011:2 0 4 >
ffff8e2301f32e40 2183656725 C Bi:2:011:2 0 1 = 06
ffff8e2301f32e40 2183656727 S Bi:2:011:2 -115 32 <
ffff8e2301f32240 2183657133 S Bo:2:011:2 -115 32 = 572f0080 135d8872 135d8872 00000000 00000073 ffffffff 16042064 0a025017
ffff8e2301f33740 2183657137 S Bo:2:011:2 -115 32 = 727cffff 006a8872 006a8872 00000000 00000073 ffffffff 16042064 0a025017
ffff8e2301f32240 2183657193 C Bo:2:011:2 0 32 >
ffff8e2301f32240 2183657194 S Bo:2:011:2 -115 32 = 727bffff 13c87630 13c87630 00000000 00000073 ffffffff 16044c17 0f4f5717
ffff8e2301f33740 2183657241 C Bo:2:011:2 0 32 >
ffff8e2301f33740 2183657242 S Bo:2:011:2 -115 32 = 72ffffff 1378633f 1378633f 00000000 00000073 ffffffff 16044c17 0f4f5717
ffff8e2301f32240 2183660023 C Bo:2:011:2 0 32 >
ffff8e2301f32240 2183660025 S Bo:2:011:2 -115 4 = 71ffffff
ffff8e2301f33740 2183662813 C Bo:2:011:2 0 32 >
ffff8e2301f32240 2183665544 C Bo:2:011:2 0 4 >
ffff8e2301f326c0 2183671025 C Bi:2:011:2 0 1 = 06
ffff8e2301f326c0 2183671027 S Bi:2:011:2 -115 32 <
ffff8e2301f32240 2183671289 S Bo:2:011:2 -115 32 = 572f8080 001f633f 001f633f 00000000 00000073 ffffffff 16044c17 0f4f5717
ffff8e2301f33740 2183671293 S Bo:2:011:2 -115 32 = 70ffffff 132d633f 132d633f 00000000 00000073 ffffffff 16044c17 0f4f5717
ffff8e2301f32240 2183671352 C Bo:2:011:2 0 32 >
ffff8e2301f32240 2183671353 S Bo:2:011:2 -115 32 = 77ffffff 003a633f 003a633f 00000000 00000073 ffffffff 16044c17 0f4f5717
ffff8e2301f33740 2183671401 C Bo:2:011:2 0 32 >
ffff8e2301f33740 2183671402 S Bo:2:011:2 -115 32 = 76ffffff 001f4021 001f4021 00000000 00000073 ffffffff 16044c17 0e064417
ffff8e2301f32240 2183674203 C Bo:2:011:2 0 32 >
ffff8e2301f32240 2183674205 S Bo:2:011:2 -115 4 = 72ffffff
ffff8e2301f33740 2183676957 C Bo:2:011:2 0 32 >
ffff8e2301f32240 2183679773 C Bo:2:011:2 0 4 >
ffff8e2301f32e40 2183685158 C Bi:2:011:2 0 1 = 06
ffff8e2301f32e40 2183685160 S Bi:2:011:2 -115 32 <
ffff8e2301f32240 2183685483 S Bo:2:011:2 -115 32 = 57300080 132d4021 132d4021 00000000 00000073 ffffffff 16044c17 0e064417
ffff8e2301f33740 2183685487 S Bo:2:011:2 -115 32 = 71ffffff 13c89021 13c89021 00000000 00000073 ffffffff 16044c17 0b06477f
ffff8e2301f32240 2183685543 C Bo:2:011:2 0 32 >
ffff8e2301f32240 2183685544 S Bo:2:011:2 -115 32 = 637effff 135d9321 135d9321 00000000 00000073 ffffffff 16044c17 0b06477f
ffff8e2301f33740 2183685601 C Bo:2:011:2 0 32 >
ffff8e2301f33740 2183685602 S Bo:2:011:2 -115 32 = 637dffff 001f3020 001f3020 00000000 00000073 ffffffff 16044c17 0b06477f
ffff8e2301f32240 2183688378 C Bo:2:011:2 0 32 >
ffff8e2301f32240 2183688380 S Bo:2:011:2 -115 4 = 637cffff
ffff8e2301f33740 2183691167 C Bo:2:011:2 0 32 >
ffff8e2301f32240 2183693876 C Bo:2:011:2 0 4 >
ffff8e2301f326c0 2183702882 C Bi:2:011:2 0 1 = 06
ffff8e2301f326c0 2183702884 S Bi:2:011:2 -115 32 <
ffff8e2301f32240 2183703261 S Bo:2:011:2 -115 32 = 57308080 132d3020 132d3020 00000000 00000073 ffffffff 16044c17 0b06477f
ffff8e2301f33740 2183703265 S Bo:2:011:2 -115 32 = 637bffff 13c83020 13c83020 00000000 00000073 ffffffff 16044c17 0b06477f
ffff8e2301f32240 2183703328 C Bo:2:011:2 0 32 >
ffff8e2301f32240 2183703329 S Bo:2:011:2 -115 32 = 637affff 135d9373 135d9373 00000000 00000073 ffffffff 16044c17 16074617
ffff8e2301f33740 2183703377 C Bo:2:011:2 0 32 >
ffff8e2301f33740 2183703378 S Bo:2:011:2 -115 32 = 72ffffff 00009473 00009473 00000000 00000073 ffffffff 16044c17 16074617
ffff8e2301f32240 2183706168 C Bo:2:011:2 0 32 >
ffff8e2301f32240 2183706170 S Bo:2:011:2 -115 4 = 71ffffff
ffff8e2301f33740 2183708951 C Bo:2:011:2 0 32 >
ffff8e2301f32240 2183711773 C Bo:2:011:2 0 4 >
ffff8e2301f32e40 2183717203 C Bi:2:011:2 0 1 = 06
ffff8e2301f32e40 2183717205 S Bi:2:011:2 -115 32 <
ffff8e2301f32240 2183717557 S Bo:2:011:2 -115 32 = 57310080 003a9473 003a9473 00000000 00000073 ffffffff 16044c17 16074617
ffff8e2301f33740 2183717560 S Bo:2:011:2 -115 32 = 70ffffff 13c88772 13c88772 00000000 00000073 ffffffff 16044c17 16074617
ffff8e2301f32240 2183717616 C Bo:2:011:2 0 32 >
ffff8e2301f32240 2183717618 S Bo:2:011:2 -115 32 = 77ffffff 00008872 00008872 00000000 00000073 ffffffff 16044c17 16074617
ffff8e2301f33740 2183717755 C Bo:2:011:2 0 32 >
ffff8e2301f33740 2183717757 S Bo:2:011:2 -115 32 = 76ffffff 135d8872 135d8872 00000000 00000073 ffffffff 16044c17 16074617
ffff8e2301f32240 2183720453 C Bo:2:011:2 0 32 >
ffff8e2301f32240 2183720455 S Bo:2:011:2 -115 4 = 75ffffff
ffff8e2301f33740 2183723238 C Bo:2:011:2 0 32 >
ffff8e2301f32240 2183725978 C Bo:2:011:2 0 4 >
ffff8e2301f326c0 2183731545 C Bi:2:011:2 0 1 = 06
ffff8e2301f326c0 2183731547 S Bi:2:011:2 -115 32 <
ffff8e2301f32240 2183731957 S Bo:2:011:2 -115 32 = 57318080 ffffffff ffffffff ffffffff ffffffff ffffffff ffffffff ffffffff
ffff8e2301f33740 2183731961 S Bo:2:011:2 -115 32 = ffffffff ffffffff ffffffff ffffffff ffffffff ffffffff ffffffff ffffffff
ffff8e2301f32240 2183732017 C Bo:2:011:2 0 32 >
ffff8e2301f32240 2183732018 S Bo:2:011:2 -115 32 = ffffffff ffffffff ffffffff ffffffff ffffffff ffffffff ffffffff ffffffff
ffff8e2301f33740 2183732066 C Bo:2:011:2 0 32 >
ffff8e2301f33740 2183732067 S Bo:2:011:2 -115 32 = ffffffff ffffffff ffffffff ffffffff ffffffff ffffffff ffffffff ffffffff
ffff8e2301f32240 2183734888 C Bo:2:011:2 0 32 >
ffff8e2301f32240 2183734890 S Bo:2:011:2 -115 4 = ffffffff
ffff8e2301f33740 2183737593 C Bo:2:011:2 0 32 >
ffff8e2301f32240 2183740372 C Bo:2:011:2 0 4 >
ffff8e2301f32e40 2183745859 C Bi:2:011:2 0 1 = 06
ffff8e2301f32e40 2183745861 S Bi:2:011:2 -115 32 <
ffff8e2301f32240 2183746210 S Bo:2:011:2 -115 32 = 57320080 ffffffff ffffffff ffffffff ffffffff ffffffff ffffffff ffffffff
ffff8e2301f33740 2183746214 S Bo:2:011:2 -115 32 = ffffffff ffffffff ffffffff ffffffff ffffffff ffffffff ffffffff ffffffff
ffff8e2301f32240 2183746270 C Bo:2:011:2 0 32 >
ffff8e2301f32240 2183746271 S Bo:2:011:2 -115 32 = ffffffff ffffffff ffffffff ffffffff ffffffff ffffffff ffffffff ffffffff
ffff8e2301f33740 2183746326 C Bo:2:011:2 0 32 >
ffff8e2301f33740 2183746328 S Bo:2:011:2 -115 32 = ffffffff ffffffff ffffffff ffffffff ffffffff ffffffff ffffffff ffffffff
ffff8e2301f32240 2183749102 C Bo:2:011:2 0 32 >
ffff8e2301f32240 2183749104 S Bo:2:011:2 -115 4 = ffffffff
ffff8e2301f33740 2183751884 C Bo:2:011:2 0 32 >
ffff8e2301f32240 2183754608 C Bo:2:011:2 0 4 >
ffff8e2301f326c0 2183759999 C Bi:2:011:2 0 1 = 06
ffff8e2301f326c0 2183760001 S Bi:2:011:2 -115 32 <
ffff8e2301f32240 2183760348 S Bo:2:011:2 -115 32 = 57328080 ffffffff ffffffff ffffffff ffffffff ffffffff ffffffff ffffffff
ffff8e2301f33740 2183760352 S Bo:2:011:2 -115 32 = ffffffff ffffffff ffffffff ffffffff ffffffff ffffffff ffffffff ffffffff
ffff8e2301f32240 2183760408 C Bo:2:011:2 0 32 >
ffff8e2301f32240 2183760409 S Bo:2:011:2 -115 32 = ffffffff ffffffff ffffffff ffffffff ffffffff ffffffff ffffffff ffffffff
ffff8e2301f33740 2183760457 C Bo:2:011:2 0 32 >
ffff8e2301f33740 2183760464 S Bo:2:011:2 -115 32 = ffffffff ffffffff ffffffff ffffffff ffffffff ffffffff ffffffff ffffffff
ffff8e2301f32240 2183763241 C Bo:2:011:2 0 32 >
ffff8e2301f32240 2183763243 S Bo:2:011:2 -115 4 = ffffffff
ffff8e2301f33740 2183766022 C Bo:2:011:2 0 32 >
ffff8e2301f32240 2183768770 C Bo:2:011:2 0 4 >
ffff8e2301f32e40 2183774133 C Bi:2:011:2 0 1 = 06
ffff8e2301f32e40 2183774135 S Bi:2:011:2 -115 32 <
ffff8e2301f32240 2183774465 S Bo:2:011:2 -115 32 = 57330080 ffffffff ffffffff ffffffff ffffffff ffffffff ffffffff ffffffff
ffff8e2301f33740 2183774468 S Bo:2:011:2 -115 32 = ffffffff ffffffff ffffffff ffffffff ffffffff ffffffff ffffffff ffffffff
ffff8e2301f32240 2183774525 C Bo:2:011:2 0 32 >
ffff8e2301f32240 2183774526 S Bo:2:011:2 -115 32 = ffffffff ffffffff ffffffff ffffffff ffffffff ffffffff ffffffff ffffffff
ffff8e2301f33740 2183774578 C Bo:2:011:2 0 32 >
ffff8e2301f33740 2183774579 S Bo:2:011:2 -115 32 = ffffffff ffffffff ffffffff ffffffff ffffffff ffffffff ffffffff ffffffff
ffff8e2301f32240 2183777399 C Bo:2:011:2 0 32 >
ffff8e2301f32240 2183777401 S Bo:2:011:2 -115 4 = ffffffff
ffff8e2301f33740 2183780101 C Bo:2:011:2 0 32 >
ffff8e2301f32240 2183782852 C Bo:2:011:2 0 4 >
ffff8e2301f326c0 2183788278 C Bi:2:011:2 0 1 = 06
ffff8e2301f326c0 2183788280 S Bi:2:011:2 -115 32 <
ffff8e2301f32240 2183788658 S Bo:2:011:2 -115 32 = 57338080 ffffffff ffffffff ffffffff ffffffff ffffffff ffffffff ffffffff
ffff8e2301f33740 2183788662 S Bo:2:011:2 -115 32 = ffffffff ffffffff ffffffff ffffffff ffffffff ffffffff ffffffff ffffffff
ffff8e2301f32240 2183788747 C Bo:2:011:2 0 32 >
ffff8e2301f32240 2183788748 S Bo:2:011:2 -115 32 = ffffffff ffffffff ffffffff ffffffff ffffffff ffffffff ffffffff ffffffff
ffff8e2301f33740 2183788797 C Bo:2:011:2 0 32 >
ffff8e2301f33740 2183788798 S Bo:2:011:2 -115 32 = ffffffff ffffffff ffffffff ffffffff ffffffff ffffffff ffffffff ffffffff
ffff8e2301f32240 2183791593 C Bo:2:011:2 0 32 >
ffff8e2301f32240 2183791595 S Bo:2:011:2 -115 4 = ffffffff
ffff8e2301f33740 2183794362 C Bo:2:011:2 0 32 >
ffff8e2301f32240 2183797093 C Bo:2:011:2 0 4 >
ffff8e2301f32e40 2183802455 C Bi:2:011:2 0 1 = 06
ffff8e2301f32e40 2183802457 S Bi:2:011:2 -115 32 <
ffff8e2301f32240 2183802844 S Bo:2:011:2 -115 32 = 57340080 ffffffff ffffffff ffffffff ffffffff ffffffff ffffffff ffffffff
ffff8e2301f33740 2183802848 S Bo:2:011:2 -115 32 = ffffffff ffffffff ffffffff ffffffff ffffffff ffffffff ffffffff ffffffff
ffff8e2301f32240 2183802904 C Bo:2:011:2 0 32 >
ffff8e2301f32240 2183802905 S Bo:2:011:2 -115 32 = ffffffff ffffffff ffffffff ffffffff ffffffff ffffffff ffffffff ffffffff
ffff8e2301f33740 2183802953 C Bo:2:011:2 0 32 >
ffff8e2301f33740 2183802955 S Bo:2:011:2 -115 32 = ffffffff ffffffff ffffffff ffffffff ffffffff ffffffff ffffffff ffffffff
ffff8e2301f32240 2183805741 C Bo:2:011:2 0 32 >
ffff8e2301f32240 2183805743 S Bo:2:011:2 -115 4 = ffffffff
ffff8e2301f33740 2183808502 C Bo:2:011:2 0 32 >
ffff8e2301f32240 2183811234 C Bo:2:011:2 0 4 >
ffff8e2301f326c0 2183816763 C Bi:2:011:2 0 1 = 06
ffff8e2301f326c0 2183816765 S Bi:2:011:2 -115 32 <
ffff8e2301f32240 2183817098 S Bo:2:011:2 -115 32 = 57348080 ffffffff ffffffff ffffffff ffffffff ffffffff ffffffff ffffffff
ffff8e2301f33740 2183817101 S Bo:2:011:2 -115 32 = ffffffff ffffffff ffffffff ffffffff ffffffff ffffffff ffffffff ffffffff
ffff8e2301f32240 2183817158 C Bo:2:011:2 0 32 >
ffff8e2301f32240 2183817159 S Bo:2:011:2 -115 32 = ffffffff ffffffff ffffffff ffffffff ffffffff ffffffff ffffffff ffffffff
ffff8e2301f33740 2183817206 C Bo:2:011:2 0 32 >
ffff8e2301f33740 2183817207 S Bo:2:011:2 -115 32 = ffffffff ffffffff ffffffff ffffffff ffffffff ffffffff ffffffff ffffffff
ffff8e2301f32240 2183820024 C Bo:2:011:2 0 32 >
ffff8e2301f32240 2183820025 S Bo:2:011:2 -115 4 = ffffffff
ffff8e2301f33740 2183822735 C Bo:2:011:2 0 32 >
ffff8e2301f32240 2183825500 C Bo:2:011:2 0 4 >
ffff8e2301f32e40 2183830882 C Bi:2:011:2 0 1 = 06
ffff8e2301f32e40 2183830884 S Bi:2:011:2 -115 32 <
ffff8e2301f32240 2183831218 S Bo:2:011:2 -115 32 = 57350080 ffffffff ffffffff ffffffff ffffffff ffffffff ffffffff ffffffff
ffff8e2301f33740 2183831222 S Bo:2:011:2 -115 32 = ffffffff ffffffff ffffffff ffffffff ffffffff ffffffff ffffffff ffffffff
ffff8e2301f32240 2183831278 C Bo:2:011:2 0 32 >
ffff8e2301f32240 2183831279 S Bo:2:011:2 -115 32 = ffffffff ffffffff ffffffff ffffffff ffffffff ffffffff ffffffff ffffffff
ffff8e2301f33740 2183831328 C Bo:2:011:2 0 32 >
ffff8e2301f33740 2183831329 S Bo:2:011:2 -115 32 = ffffffff ffffffff ffffffff ffffffff ffffffff ffffffff ffffffff ffffffff
ffff8e2301f32240 2183834094 C Bo:2:011:2 0 32 >
ffff8e2301f32240 2183834095 S Bo:2:011:2 -115 4 = ffffffff
ffff8e2301f33740 2183836878 C Bo:2:011:2 0 32 >
ffff8e2301f32240 2183839773 C Bo:2:011:2 0 4 >
ffff8e2301f326c0 2183845070 C Bi:2:011:2 0 1 = 06
ffff8e2301f326c0 2183845072 S Bi:2:011:2 -115 32 <
ffff8e2301f32240 2183845348 S Bo:2:011:2 -115 32 = 57358080 ffffffff ffffffff ffffffff ffffffff ffffffff ffffffff ffffffff
ffff8e2301f33740 2183845351 S Bo:2:011:2 -115 32 = ffffffff ffffffff ffffffff ffffffff ffffffff ffffffff ffffffff ffffffff
ffff8e2301f32240 2183845408 C Bo:2:011:2 0 32 >
ffff8e2301f32240 2183845409 S Bo:2:011:2 -115 32 = ffffffff ffffffff ffffffff ffffffff ffffffff ffffffff ffffffff ffffffff
ffff8e2301f33740 2183845457 C Bo:2:011:2 0 32 >
ffff8e2301f33740 2183845458 S Bo:2:011:2 -115 32 = ffffffff ffffffff ffffffff ffffffff ffffffff ffffffff ffffffff ffffffff
ffff8e2301f32240 2183848239 C Bo:2:011:2 0 32 >
ffff8e2301f32240 2183848241 S Bo:2:011:2 -115 4 = ffffffff
ffff8e2301f33740 2183851024 C Bo:2:011:2 0 32 >
ffff8e2301f32240 2183853763 C Bo:2:011:2 0 4 >
ffff8e2301f32e40 2183859204 C Bi:2:011:2 0 1 = 06
ffff8e2301f32e40 2183859206 S Bi:2:011:2 -115 32 <
ffff8e2301f32240 2183859478 S Bo:2:011:2 -115 32 = 57360080 ffffffff ffffffff ffffffff ffffffff ffffffff ffffffff ffffffff
ffff8e2301f33740 2183859481 S Bo:2:011:2 -115 32 = ffffffff ffffffff ffffffff ffffffff ffffffff ffffffff ffffffff ffffffff
ffff8e2301f32240 2183859537 C Bo:2:011:2 0 32 >
ffff8e2301f32240 2183859538 S Bo:2:011:2 -115 32 = ffffffff ffffffff ffffffff ffffffff ffffffff ffffffff ffffffff ffffffff
ffff8e2301f33740 2183859586 C Bo:2:011:2 0 32 >
ffff8e2301f33740 2183859587 S Bo:2:011:2 -115 32 = ffffffff ffffffff ffffffff ffffffff ffffffff ffffffff ffffffff ffffffff
ffff8e2301f32240 2183862390 C Bo:2:011:2 0 32 >
ffff8e2301f32240 2183862392 S Bo:2:011:2 -115 4 = ffffffff
ffff8e2301f33740 2183865167 C Bo:2:011:2 0 32 >
ffff8e2301f32240 2183867877 C Bo:2:011:2 0 4 >
ffff8e2301f326c0 2183873340 C Bi:2:011:2 0 1 = 06
ffff8e2301f326c0 2183873342 S Bi:2:011:2 -115 32 <
ffff8e2301f32240 2183873641 S Bo:2:011:2 -115 32 = 57368080 ffffffff ffffffff ffffffff ffffffff ffffffff ffffffff ffffffff
ffff8e2301f33740 2183873644 S Bo:2:011:2 -115 32 = ffffffff ffffffff ffffffff ffffffff ffffffff ffffffff ffffffff ffffffff
ffff8e2301f32240 2183873747 C Bo:2:011:2 0 32 >
ffff8e2301f32240 2183873748 S Bo:2:011:2 -115 32 = ffffffff ffffffff ffffffff ffffffff ffffffff ffffffff ffffffff ffffffff
ffff8e2301f33740 2183873797 C Bo:2:011:2 0 32 >
ffff8e2301f33740 2183873798 S Bo:2:011:2 -115 32 = ffffffff ffffffff ffffffff ffffffff ffffffff ffffffff ffffffff ffffffff
ffff8e2301f32240 2183876629 C Bo:2:011:2 0 32 >
ffff8e2301f32240 2183876631 S Bo:2:011:2 -115 4 = ffffffff
ffff8e2301f33740 2183879377 C Bo:2:011:2 0 32 >
ffff8e2301f32240 2183882077 C Bo:2:011:2 0 4 >
ffff8e2301f32e40 2183887502 C Bi:2:011:2 0 1 = 06
ffff8e2301f32e40 2183887504 S Bi:2:011:2 -115 32 <
ffff8e2301f32240 2183887802 S Bo:2:011:2 -115 32 = 57370080 ffffffff ffffffff ffffffff ffffffff ffffffff ffffffff ffffffff
ffff8e2301f33740 2183887805 S Bo:2:011:2 -115 32 = ffffffff ffffffff ffffffff ffffffff ffffffff ffffffff ffffffff ffffffff
ffff8e2301f32240 2183887862 C Bo:2:011:2 0 32 >
ffff8e2301f32240 2183887862 S Bo:2:011:2 -115 32 = ffffffff ffffffff ffffffff ffffffff ffffffff ffffffff ffffffff ffffffff
ffff8e2301f33740 2183887910 C Bo:2:011:2 0 32 >
ffff8e2301f33740 2183887911 S Bo:2:011:2 -115 32 = ffffffff ffffffff ffffffff ffffffff ffffffff ffffffff ffffffff ffffffff
ffff8e2301f32240 2183890749 C Bo:2:011:2 0 32 >
ffff8e2301f32240 2183890751 S Bo:2:011:2 -115 4 = ffffffff
ffff8e2301f33740 2183893459 C Bo:2:011:2 0 32 >
ffff8e2301f32240 2183896225 C Bo:2:011:2 0 4 >
ffff8e2301f326c0 2183901725 C Bi:2:011:2 0 1 = 06
ffff8e2301f326c0 2183901727 S Bi:2:011:2 -115 32 <
ffff8e2301f32240 2183902076 S Bo:2:011:2 -115 32 = 57378080 ffffffff ffffffff ffffffff ffffffff ffffffff ffffffff ffffffff
ffff8e2301f33740 2183902080 S Bo:2:011:2 -115 32 = ffffffff ffffffff ffffffff ffffffff ffffffff ffffffff ffffffff ffffffff
ffff8e2301f32240 2183902137 C Bo:2:011:2 0 32 >
ffff8e2301f32240 2183902143 S Bo:2:011:2 -115 32 = ffffffff ffffffff ffffffff ffffffff ffffffff ffffffff ffffffff ffffffff
ffff8e2301f33740 2183902184 C Bo:2:011:2 0 32 >
ffff8e2301f33740 2183902185 S Bo:2:011:2 -115 32 = ffffffff ffffffff ffffffff ffffffff ffffffff ffffffff ffffffff ffffffff
ffff8e2301f32240 2183904959 C Bo:2:011:2 0 32 >
ffff8e2301f32240 2183904960 S Bo:2:011:2 -115 4 = ffffffff
ffff8e2301f33740 2183907737 C Bo:2:011:2 0 32 >
ffff8e2301f32240 2183910500 C Bo:2:011:2 0 4 >
ffff8e2301f32e40 2183915955 C Bi:2:011:2 0 1 = 06
ffff8e2301f32e40 2183915957 S Bi:2:011:2 -115 32 <
ffff8e2301f32240 2183916314 S Bo:2:011:2 -115 32 = 57380080 ffffffff ffffffff ffffffff ffffffff ffffffff ffffffff ffffffff
ffff8e2301f33740 2183916318 S Bo:2:011:2 -115 32 = ffffffff ffffffff ffffffff ffffffff ffffffff ffffffff ffffffff ffffffff
ffff8e2301f32240 2183916374 C Bo:2:011:2 0 32 >
ffff8e2301f32240 2183916375 S Bo:2:011:2 -115 32 = ffffffff ffffffff ffffffff ffffffff ffffffff ffffffff ffffffff ffffffff
ffff8e2301f33740 2183916429 C Bo:2:011:2 0 32 >
ffff8e2301f33740 2183916434 S Bo:2:011:2 -115 32 = ffffffff ffffffff ffffffff ffffffff ffffffff ffffffff ffffffff ffffffff
ffff8e2301f32240 2183919251 C Bo:2:011:2 0 32 >
ffff8e2301f32240 2183919253 S Bo:2:011:2 -115 4 = ffffffff
ffff8e2301f33740 2183921953 C Bo:2:011:2 0 32 >
ffff8e2301f32240 2183924725 C Bo:2:011:2 0 4 >
ffff8e2301f326c0 2183930138 C Bi:2:011:2 0 1 = 06
ffff8e2301f326c0 2183930140 S Bi:2:011:2 -115 32 <
ffff8e2301f32240 2183930485 S Bo:2:011:2 -115 32 = 57388080 ffffffff ffffffff ffffffff ffffffff ffffffff ffffffff ffffffff
ffff8e2301f33740 2183930489 S Bo:2:011:2 -115 32 = ffffffff ffffffff ffffffff ffffffff ffffffff ffffffff ffffffff ffffffff
ffff8e2301f32240 2183930545 C Bo:2:011:2 0 32 >
ffff8e2301f32240 2183930546 S Bo:2:011:2 -115 32 = ffffffff ffffffff ffffffff ffffffff ffffffff ffffffff ffffffff ffffffff
ffff8e2301f33740 2183930602 C Bo:2:011:2 0 32 >
ffff8e2301f33740 2183930603 S Bo:2:011:2 -115 32 = ffffffff ffffffff ffffffff ffffffff ffffffff ffffffff ffffffff ffffffff
ffff8e2301f32240 2183933382 C Bo:2:011:2 0 32 >
ffff8e2301f32240 2183933384 S Bo:2:011:2 -115 4 = ffffffff
ffff8e2301f33740 2183936147 C Bo:2:011:2 0 32 >
ffff8e2301f32240 2183938900 C Bo:2:011:2 0 4 >
ffff8e2301f32e40 2183944273 C Bi:2:011:2 0 1 = 06
ffff8e2301f32e40 2183944274 S Bi:2:011:2 -115 32 <
ffff8e2301f32240 2183944554 S Bo:2:011:2 -115 32 = 57390080 ffffffff ffffffff ffffffff ffffffff ffffffff ffffffff ffffffff
ffff8e2301f33740 2183944558 S Bo:2:011:2 -115 32 = ffffffff ffffffff ffffffff ffffffff ffffffff ffffffff ffffffff ffffffff
ffff8e2301f32240 2183944614 C Bo:2:011:2 0 32 >
ffff8e2301f32240 2183944615 S Bo:2:011:2 -115 32 = ffffffff ffffffff ffffffff ffffffff ffffffff ffffffff ffffffff ffffffff
ffff8e2301f33740 2183944729 C Bo:2:011:2 0 32 >
ffff8e2301f33740 2183944731 S Bo:2:011:2 -115 32 = ffffffff ffffffff ffffffff ffffffff ffffffff ffffffff ffffffff ffffffff
ffff8e2301f32240 2183947461 C Bo:2:011:2 0 32 >
ffff8e2301f32240 2183947463 S Bo:2:011:2 -115 4 = ffffffff
ffff8e2301f33740 2183950238 C Bo:2:011:2 0 32 >
ffff8e2301f32240 2183952959 C Bo:2:011:2 0 4 >
ffff8e2301f326c0 2183958406 C Bi:2:011:2 0 1 = 06
ffff8e2301f326c0 2183958407 S Bi:2:011:2 -115 32 <
ffff8e2301f32240 2183958805 S Bo:2:011:2 -115 32 = 57398080 ffffffff ffffffff ffffffff ffffffff ffffffff ffffffff ffffffff
ffff8e2301f33740 2183958809 S Bo:2:011:2 -115 32 = ffffffff ffffffff ffffffff ffffffff ffffffff ffffffff ffffffff ffffffff
ffff8e2301f32240 2183958866 C Bo:2:011:2 0 32 >
ffff8e2301f32240 2183958871 S Bo:2:011:2 -115 32 = ffffffff ffffffff ffffffff ffffffff ffffffff ffffffff ffffffff ffffffff
ffff8e2301f33740 2183958913 C Bo:2:011:2 0 32 >
ffff8e2301f33740 2183958915 S Bo:2:011:2 -115 32 = ffffffff ffffffff ffffffff ffffffff ffffffff ffffffff ffffffff ffffffff
ffff8e2301f32240 2183961738 C Bo:2:011:2 0 32 >
ffff8e2301f32240 2183961739 S Bo:2:011:2 -115 4 = ffffffff
ffff8e2301f33740 2183964453 C Bo:2:011:2 0 32 >
ffff8e2301f32240 2183967187 C Bo:2:011:2 0 4 >
ffff8e2301f32e40 2183972547 C Bi:2:011:2 0 1 = 06
ffff8e2301f32e40 2183972548 S Bi:2:011:2 -115 32 <
ffff8e2301f32240 2183972941 S Bo:2:011:2 -115 32 = 573a0080 ffffffff ffffffff ffffffff ffffffff ffffffff ffffffff ffffffff
ffff8e2301f33740 2183972944 S Bo:2:011:2 -115 32 = ffffffff ffffffff ffffffff ffffffff ffffffff ffffffff ffffffff ffffffff
ffff8e2301f32240 2183973000 C Bo:2:011:2 0 32 >
ffff8e2301f32240 2183973001 S Bo:2:011:2 -115 32 = ffffffff ffffffff ffffffff ffffffff ffffffff ffffffff ffffffff ffffffff
ffff8e2301f33740 2183973055 C Bo:2:011:2 0 32 >
ffff8e2301f33740 2183973057 S Bo:2:011:2 -115 32 = ffffffff ffffffff ffffffff ffffffff ffffffff ffffffff ffffffff ffffffff
ffff8e2301f32240 2183975819 C Bo:2:011:2 0 32 >
ffff8e2301f32240 2183975821 S Bo:2:011:2 -115 4 = ffffffff
ffff8e2301f33740 2183978592 C Bo:2:011:2 0 32 >
ffff8e2301f32240 2183981352 C Bo:2:011:2 0 4 >
ffff8e2301f326c0 2183986725 C Bi:2:011:2 0 1 = 06
ffff8e2301f326c0 2183986727 S Bi:2:011:2 -115 32 <
ffff8e2301f32240 2183987099 S Bo:2:011:2 -115 32 = 573a8080 ffffffff ffffffff ffffffff ffffffff ffffffff ffffffff ffffffff
ffff8e2301f33740 2183987103 S Bo:2:011:2 -115 32 = ffffffff ffffffff ffffffff ffffffff ffffffff ffffffff ffffffff ffffffff
ffff8e2301f32240 2183987158 C Bo:2:011:2 0 32 >
ffff8e2301f32240 2183987159 S Bo:2:011:2 -115 32 = ffffffff ffffffff ffffffff ffffffff ffffffff ffffffff ffffffff ffffffff
ffff8e2301f33740 2183987207 C Bo:2:011:2 0 32 >
ffff8e2301f33740 2183987208 S Bo:2:011:2 -115 32 = ffffffff ffffffff ffffffff ffffffff ffffffff ffffffff ffffffff ffffffff
ffff8e2301f32240 2183990029 C Bo:2:011:2 0 32 >
ffff8e2301f32240 2183990031 S Bo:2:011:2 -115 4 = ffffffff
ffff8e2301f33740 2183992747 C Bo:2:011:2 0 32 >
ffff8e2301f32240 2183995500 C Bo:2:011:2 0 4 >
ffff8e2301f32e40 2184000884 C Bi:2:011:2 0 1 = 06
ffff8e2301f32e40 2184000888 S Bi:2:011:2 -115 32 <
ffff8e2301f32240 2184001299 S Bo:2:011:2 -115 32 = 573b0080 ffffffff ffffffff ffffffff ffffffff ffffffff ffffffff ffffffff
ffff8e2301f33740 2184001302 S Bo:2:011:2 -115 32 = ffffffff ffffffff ffffffff ffffffff ffffffff ffffffff ffffffff ffffffff
ffff8e2301f32240 2184001360 C Bo:2:011:2 0 32 >
ffff8e2301f32240 2184001363 S Bo:2:011:2 -115 32 = ffffffff ffffffff ffffffff ffffffff ffffffff ffffffff ffffffff ffffffff
ffff8e2301f33740 2184001409 C Bo:2:011:2 0 32 >
ffff8e2301f33740 2184001411 S Bo:2:011:2 -115 32 = ffffffff ffffffff ffffffff ffffffff ffffffff ffffffff ffffffff ffffffff
ffff8e2301f32240 2184004170 C Bo:2:011:2 0 32 >
ffff8e2301f32240 2184004175 S Bo:2:011:2 -115 4 = ffffffff
ffff8e2301f33740 2184006954 C Bo:2:011:2 0 32 >
ffff8e2301f32240 2184009731 C Bo:2:011:2 0 4 >
ffff8e2301f326c0 2184015160 C Bi:2:011:2 0 1 = 06
ffff8e2301f326c0 2184015164 S Bi:2:011:2 -115 32 <
ffff8e2301f32240 2184015523 S Bo:2:011:2 -115 32 = 573b8080 ffffffff ffffffff ffffffff ffffffff ffffffff ffffffff ffffffff
ffff8e2301f33740 2184015527 S Bo:2:011:2 -115 32 = ffffffff ffffffff ffffffff ffffffff ffffffff ffffffff ffffffff ffffffff
ffff8e2301f32240 2184015584 C Bo:2:011:2 0 32 >
ffff8e2301f32240 2184015587 S Bo:2:011:2 -115 32 = ffffffff ffffffff ffffffff ffffffff ffffffff ffffffff ffffffff ffffffff
ffff8e2301f33740 2184015632 C Bo:2:011:2 0 32 >
ffff8e2301f33740 2184015635 S Bo:2:011:2 -115 32 = ffffffff ffffffff ffffffff ffffffff ffffffff ffffffff ffffffff ffffffff
ffff8e2301f32240 2184018406 C Bo:2:011:2 0 32 >
ffff8e2301f32240 2184018410 S Bo:2:011:2 -115 4 = ffffffff
ffff8e2301f33740 2184021175 C Bo:2:011:2 0 32 >
ffff8e2301f32240 2184023931 C Bo:2:011:2 0 4 >
ffff8e2301f32e40 2184029341 C Bi:2:011:2 0 1 = 06
ffff8e2301f32e40 2184029346 S Bi:2:011:2 -115 32 <
ffff8e2301f32240 2184029733 S Bo:2:011:2 -115 32 = 573c0080 ffffffff ffffffff ffffffff ffffffff ffffffff ffffffff ffffffff
ffff8e2301f33740 2184029737 S Bo:2:011:2 -115 32 = ffffffff ffffffff ffffffff ffffffff ffffffff ffffffff ffffffff ffffffff
ffff8e2301f32240 2184029795 C Bo:2:011:2 0 32 >
ffff8e2301f32240 2184029797 S Bo:2:011:2 -115 32 = ffffffff ffffffff ffffffff ffffffff ffffffff ffffffff ffffffff ffffffff
ffff8e2301f33740 2184029843 C Bo:2:011:2 0 32 >
ffff8e2301f33740 2184029846 S Bo:2:011:2 -115 32 = ffffffff ffffffff ffffffff ffffffff ffffffff ffffffff ffffffff ffffffff
ffff8e2301f32240 2184032630 C Bo:2:011:2 0 32 >
ffff8e2301f32240 2184032635 S Bo:2:011:2 -115 4 = ffffffff
ffff8e2301f33740 2184035380 C Bo:2:011:2 0 32 >
ffff8e2301f32240 2184038126 C Bo:2:011:2 0 4 >
ffff8e2301f326c0 2184043460 C Bi:2:011:2 0 1 = 06
ffff8e2301f326c0 2184043464 S Bi:2:011:2 -115 32 <
ffff8e2301f32240 2184043861 S Bo:2:011:2 -115 32 = 573c8080 ffffffff ffffffff ffffffff ffffffff ffffffff ffffffff ffffffff
ffff8e2301f33740 2184043864 S Bo:2:011:2 -115 32 = ffffffff ffffffff ffffffff ffffffff ffffffff ffffffff ffffffff ffffffff
ffff8e2301f32240 2184043921 C Bo:2:011:2 0 32 >
ffff8e2301f32240 2184043924 S Bo:2:011:2 -115 32 = ffffffff ffffffff ffffffff ffffffff ffffffff ffffffff ffffffff ffffffff
ffff8e2301f33740 2184043977 C Bo:2:011:2 0 32 >
ffff8e2301f33740 2184043980 S Bo:2:011:2 -115 32 = ffffffff ffffffff ffffffff ffffffff ffffffff ffffffff ffffffff ffffffff
ffff8e2301f32240 2184046750 C Bo:2:011:2 0 32 >
ffff8e2301f32240 2184046754 S Bo:2:011:2 -115 4 = ffffffff
ffff8e2301f33740 2184049545 C Bo:2:011:2 0 32 >
ffff8e2301f32240 2184052253 C Bo:2:011:2 0 4 >
ffff8e2301f32e40 2184057727 C Bi:2:011:2 0 1 = 06
ffff8e2301f32e40 2184057731 S Bi:2:011:2 -115 32 <
ffff8e2301f32240 2184058170 S Bo:2:011:2 -115 32 = 573d0080 ffffffff ffffffff ffffffff ffffffff ffffffff ffffffff ffffffff
ffff8e2301f33740 2184058173 S Bo:2:011:2 -115 32 = ffffffff ffffffff ffffffff ffffffff ffffffff ffffffff ffffffff ffffffff
ffff8e2301f32240 2184058230 C Bo:2:011:2 0 32 >
ffff8e2301f32240 2184058233 S Bo:2:011:2 -115 32 = ffffffff ffffffff ffffffff ffffffff ffffffff ffffffff ffffffff ffffffff
ffff8e2301f33740 2184058279 C Bo:2:011:2 0 32 >
ffff8e2301f33740 2184058281 S Bo:2:011:2 -115 32 = ffffffff ffffffff ffffffff ffffffff ffffffff ffffffff ffffffff ffffffff
ffff8e2301f32240 2184061104 C Bo:2:011:2 0 32 >
ffff8e2301f32240 2184061109 S Bo:2:011:2 -115 4 = ffffffff
ffff8e2301f33740 2184063858 C Bo:2:011:2 0 32 >
ffff8e2301f32240 2184066561 C Bo:2:011:2 0 4 >
ffff8e2301f326c0 2184071955 C Bi:2:011:2 0 1 = 06
ffff8e2301f326c0 2184071959 S Bi:2:011:2 -115 32 <
ffff8e2301f32240 2184072279 S Bo:2:011:2 -115 32 = 573d8080 ffffffff ffffffff ffffffff ffffffff ffffffff ffffffff ffffffff
ffff8e2301f33740 2184072282 S Bo:2:011:2 -115 32 = ffffffff ffffffff ffffffff ffffffff ffffffff ffffffff ffffffff ffffffff
ffff8e2301f32240 2184072340 C Bo:2:011:2 0 32 >
ffff8e2301f32240 2184072343 S Bo:2:011:2 -115 32 = ffffffff ffffffff ffffffff ffffffff ffffffff ffffffff ffffffff ffffffff
ffff8e2301f33740 2184072389 C Bo:2:011:2 0 32 >
ffff8e2301f33740 2184072392 S Bo:2:011:2 -115 32 = ffffffff ffffffff ffffffff ffffffff ffffffff ffffffff ffffffff ffffffff
ffff8e2301f32240 2184075173 C Bo:2:011:2 0 32 >
ffff8e2301f32240 2184075177 S Bo:2:011:2 -115 4 = ffffffff
ffff8e2301f33740 2184077955 C Bo:2:011:2 0 32 >
ffff8e2301f32240 2184080728 C Bo:2:011:2 0 4 >
ffff8e2301f32e40 2184086093 C Bi:2:011:2 0 1 = 06
ffff8e2301f32e40 2184086097 S Bi:2:011:2 -115 32 <
ffff8e2301f32240 2184086425 S Bo:2:011:2 -115 32 = 573e0080 ffffffff ffffffff ffffffff ffffffff ffffffff ffffffff ffffffff
ffff8e2301f33740 2184086428 S Bo:2:011:2 -115 32 = ffffffff ffffffff ffffffff ffffffff ffffffff ffffffff ffffffff ffffffff
ffff8e2301f32240 2184086485 C Bo:2:011:2 0 32 >
ffff8e2301f32240 2184086488 S Bo:2:011:2 -115 32 = ffffffff ffffffff ffffffff ffffffff ffffffff ffffffff ffffffff ffffffff
ffff8e2301f33740 2184086535 C Bo:2:011:2 0 32 >
ffff8e2301f33740 2184086537 S Bo:2:011:2 -115 32 = ffffffff ffffffff ffffffff ffffffff ffffffff ffffffff ffffffff ffffffff
ffff8e2301f32240 2184089314 C Bo:2:011:2 0 32 >
ffff8e2301f32240 2184089318 S Bo:2:011:2 -115 4 = ffffffff
ffff8e2301f33740 2184092094 C Bo:2:011:2 0 32 >
ffff8e2301f32240 2184094820 C Bo:2:011:2 0 4 >
ffff8e2301f326c0 2184100275 C Bi:2:011:2 0 1 = 06
ffff8e2301f326c0 2184100279 S Bi:2:011:2 -115 32 <
ffff8e2301f32240 2184100659 S Bo:2:011:2 -115 32 = 573e8080 ffffffff ffffffff ffffffff ffffffff ffffffff ffffffff ffffffff
ffff8e2301f33740 2184100662 S Bo:2:011:2 -115 32 = ffffffff ffffffff ffffffff ffffffff ffffffff ffffffff ffffffff ffffffff
ffff8e2301f32240 2184100741 C Bo:2:011:2 0 32 >
ffff8e2301f32240 2184100744 S Bo:2:011:2 -115 32 = ffffffff ffffffff ffffffff ffffffff ffffffff ffffffff ffffffff ffffffff
ffff8e2301f33740 2184100793 C Bo:2:011:2 0 32 >
ffff8e2301f33740 2184100795 S Bo:2:011:2 -115 32 = ffffffff ffffffff ffffffff ffffffff ffffffff ffffffff ffffffff ffffffff
ffff8e2301f32240 2184103596 C Bo:2:011:2 0 32 >
ffff8e2301f32240 2184103601 S Bo:2:011:2 -115 4 = ffffffff
ffff8e2301f33740 2184106391 C Bo:2:011:2 0 32 >
ffff8e2301f32240 2184109079 C Bo:2:011:2 0 4 >
ffff8e2301f32e40 2184114594 C Bi:2:011:2 0 1 = 06
ffff8e2301f32e40 2184114598 S Bi:2:011:2 -115 32 <
ffff8e2301f32240 2184114915 S Bo:2:011:2 -115 32 = 573f0080 ffffffff ffffffff ffffffff ffffffff ffffffff ffffffff ffffffff
ffff8e2301f33740 2184114919 S Bo:2:011:2 -115 32 = ffffffff ffffffff ffffffff ffffffff ffffffff ffffffff ffffffff ffffffff
ffff8e2301f32240 2184114980 C Bo:2:011:2 0 32 >
ffff8e2301f32240 2184114982 S Bo:2:011:2 -115 32 = ffffffff ffffffff ffffffff ffffffff ffffffff ffffffff ffffffff ffffffff
ffff8e2301f33740 2184115032 C Bo:2:011:2 0 32 >
ffff8e2301f33740 2184115035 S Bo:2:011:2 -115 32 = ffffffff ffffffff ffffffff ffffffff ffffffff ffffffff ffffffff ffffffff
ffff8e2301f32240 2184117813 C Bo:2:011:2 0 32 >
ffff8e2301f32240 2184117818 S Bo:2:011:2 -115 4 = ffffffff
ffff8e2301f33740 2184120595 C Bo:2:011:2 0 32 >
ffff8e2301f32240 2184123354 C Bo:2:011:2 0 4 >
ffff8e2301f326c0 2184128727 C Bi:2:011:2 0 1 = 06
ffff8e2301f326c0 2184128731 S Bi:2:011:2 -115 32 <
ffff8e2301f32240 2184129090 S Bo:2:011:2 -115 32 = 573f8080 ffffffff ffffffff ffffffff ffffffff ffffffff ffffffff ffffffff
ffff8e2301f33740 2184129093 S Bo:2:011:2 -115 32 = ffffffff ffffffff ffffffff ffffffff ffffffff ffffffff ffffffff ffffffff
ffff8e2301f32240 2184129151 C Bo:2:011:2 0 32 >
ffff8e2301f32240 2184129154 S Bo:2:011:2 -115 32 = ffffffff ffffffff ffffffff ffffffff ffffffff ffffffff ffffffff ffffffff
ffff8e2301f33740 2184129204 C Bo:2:011:2 0 32 >
ffff8e2301f33740 2184129207 S Bo:2:011:2 -115 32 = ffffffff ffffffff ffffffff ffffffff ffffffff ffffffff ffffffff ffffffff
ffff8e2301f32240 2184131956 C Bo:2:011:2 0 32 >
ffff8e2301f32240 2184131960 S Bo:2:011:2 -115 4 = ffffffff
ffff8e2301f33740 2184134738 C Bo:2:011:2 0 32 >
ffff8e2301f32240 2184137505 C Bo:2:011:2 0 4 >
ffff8e2301f32e40 2184142886 C Bi:2:011:2 0 1 = 06
ffff8e2301f32e40 2184142891 S Bi:2:011:2 -115 32 <
ffff8e2301f32240 2184143216 S Bo:2:011:2 -115 32 = 57400080 ffffffff ffffffff ffffffff ffffffff ffffffff ffffffff ffffffff
ffff8e2301f33740 2184143219 S Bo:2:011:2 -115 32 = ffffffff ffffffff ffffffff ffffffff ffffffff ffffffff ffffffff ffffffff
ffff8e2301f32240 2184143277 C Bo:2:011:2 0 32 >
ffff8e2301f32240 2184143279 S Bo:2:011:2 -115 32 = ffffffff ffffffff ffffffff ffffffff ffffffff ffffffff ffffffff ffffffff
ffff8e2301f33740 2184143328 C Bo:2:011:2 0 32 >
ffff8e2301f33740 2184143331 S Bo:2:011:2 -115 32 = ffffffff ffffffff ffffffff ffffffff ffffffff ffffffff ffffffff ffffffff
ffff8e2301f32240 2184146095 C Bo:2:011:2 0 32 >
ffff8e2301f32240 2184146100 S Bo:2:011:2 -115 4 = ffffffff
ffff8e2301f33740 2184148883 C Bo:2:011:2 0 32 >
ffff8e2301f32240 2184151594 C Bo:2:011:2 0 4 >
ffff8e2301f326c0 2184160592 C Bi:2:011:2 0 1 = 06
ffff8e2301f326c0 2184160594 S Bi:2:011:2 -115 32 <
ffff8e2301f32240 2184161061 S Bo:2:011:2 -115 32 = 57408080 ffffffff ffffffff ffffffff ffffffff ffffffff ffffffff ffffffff
ffff8e2301f33740 2184161064 S Bo:2:011:2 -115 32 = ffffffff ffffffff ffffffff ffffffff ffffffff ffffffff ffffffff ffffffff
ffff8e2301f32240 2184161121 C Bo:2:011:2 0 32 >
ffff8e2301f32240 2184161122 S Bo:2:011:2 -115 32 = ffffffff ffffffff ffffffff ffffffff ffffffff ffffffff ffffffff ffffffff
ffff8e2301f33740 2184161169 C Bo:2:011:2 0 32 >
ffff8e2301f33740 2184161170 S Bo:2:011:2 -115 32 = ffffffff ffffffff ffffffff ffffffff ffffffff ffffffff ffffffff ffffffff
ffff8e2301f32240 2184163957 C Bo:2:011:2 0 32 >
ffff8e2301f32240 2184163959 S Bo:2:011:2 -115 4 = ffffffff
ffff8e2301f33740 2184166748 C Bo:2:011:2 0 32 >
ffff8e2301f32240 2184169453 C Bo:2:011:2 0 4 >
ffff8e2301f32e40 2184174933 C Bi:2:011:2 0 1 = 06
ffff8e2301f32e40 2184174935 S Bi:2:011:2 -115 32 <
ffff8e2301f32240 2184175253 S Bo:2:011:2 -115 32 = 57410080 ffffffff ffffffff ffffffff ffffffff ffffffff ffffffff ffffffff
ffff8e2301f33740 2184175257 S Bo:2:011:2 -115 32 = ffffffff ffffffff ffffffff ffffffff ffffffff ffffffff ffffffff ffffffff
ffff8e2301f32240 2184175313 C Bo:2:011:2 0 32 >
ffff8e2301f32240 2184175314 S Bo:2:011:2 -115 32 = ffffffff ffffffff ffffffff ffffffff ffffffff ffffffff ffffffff ffffffff
ffff8e2301f33740 2184175362 C Bo:2:011:2 0 32 >
ffff8e2301f33740 2184175369 S Bo:2:011:2 -115 32 = ffffffff ffffffff ffffffff ffffffff ffffffff ffffffff ffffffff ffffffff
ffff8e2301f32240 2184178170 C Bo:2:011:2 0 32 >
ffff8e2301f32240 2184178172 S Bo:2:011:2 -115 4 = ffffffff
ffff8e2301f33740 2184180953 C Bo:2:011:2 0 32 >
ffff8e2301f32240 2184183730 C Bo:2:011:2 0 4 >
ffff8e2301f326c0 2184189071 C Bi:2:011:2 0 1 = 06
ffff8e2301f326c0 2184189073 S Bi:2:011:2 -115 32 <
ffff8e2301f32240 2184189391 S Bo:2:011:2 -115 32 = 57418080 ffffffff ffffffff ffffffff ffffffff ffffffff ffffffff ffffffff
ffff8e2301f33740 2184189394 S Bo:2:011:2 -115 32 = ffffffff ffffffff ffffffff ffffffff ffffffff ffffffff ffffffff ffffffff
ffff8e2301f32240 2184189453 C Bo:2:011:2 0 32 >
ffff8e2301f32240 2184189454 S Bo:2:011:2 -115 32 = ffffffff ffffffff ffffffff ffffffff ffffffff ffffffff ffffffff ffffffff
ffff8e2301f33740 2184189503 C Bo:2:011:2 0 32 >
ffff8e2301f33740 2184189509 S Bo:2:011:2 -115 32 = ffffffff ffffffff ffffffff ffffffff ffffffff ffffffff ffffffff ffffffff
ffff8e2301f32240 2184192267 C Bo:2:011:2 0 32 >
ffff8e2301f32240 2184192269 S Bo:2:011:2 -115 4 = ffffffff
ffff8e2301f33740 2184195093 C Bo:2:011:2 0 32 >
ffff8e2301f32240 2184197777 C Bo:2:011:2 0 4 >
ffff8e2301f32e40 2184203251 C Bi:2:011:2 0 1 = 06
ffff8e2301f32e40 2184203253 S Bi:2:011:2 -115 32 <
ffff8e2301f32240 2184203556 S Bo:2:011:2 -115 32 = 57420080 ffffffff ffffffff ffffffff ffffffff ffffffff ffffffff ffffffff
ffff8e2301f33740 2184203559 S Bo:2:011:2 -115 32 = ffffffff ffffffff ffffffff ffffffff ffffffff ffffffff ffffffff ffffffff
ffff8e2301f32240 2184203615 C Bo:2:011:2 0 32 >
ffff8e2301f32240 2184203616 S Bo:2:011:2 -115 32 = ffffffff ffffffff ffffffff ffffffff ffffffff ffffffff ffffffff ffffffff
ffff8e2301f33740 2184203755 C Bo:2:011:2 0 32 >
ffff8e2301f33740 2184203760 S Bo:2:011:2 -115 32 = ffffffff ffffffff ffffffff ffffffff ffffffff ffffffff ffffffff ffffffff
ffff8e2301f32240 2184206422 C Bo:2:011:2 0 32 >
ffff8e2301f32240 2184206426 S Bo:2:011:2 -115 4 = ffffffff
ffff8e2301f33740 2184209243 C Bo:2:011:2 0 32 >
ffff8e2301f32240 2184211981 C Bo:2:011:2 0 4 >
ffff8e2301f326c0 2184217387 C Bi:2:011:2 0 1 = 06
ffff8e2301f326c0 2184217391 S Bi:2:011:2 -115 32 <
ffff8e2301f32240 2184217822 S Bo:2:011:2 -115 32 = 57428080 ffffffff ffffffff ffffffff ffffffff ffffffff ffffffff ffffffff
ffff8e2301f33740 2184217826 S Bo:2:011:2 -115 32 = ffffffff ffffffff ffffffff ffffffff ffffffff ffffffff ffffffff ffffffff
ffff8e2301f32240 2184217884 C Bo:2:011:2 0 32 >
ffff8e2301f32240 2184217887 S Bo:2:011:2 -115 32 = ffffffff ffffffff ffffffff ffffffff ffffffff ffffffff ffffffff ffffffff
ffff8e2301f33740 2184217933 C Bo:2:011:2 0 32 >
ffff8e2301f33740 2184217936 S Bo:2:011:2 -115 32 = ffffffff ffffffff ffffffff ffffffff ffffffff ffffffff ffffffff ffffffff
ffff8e2301f32240 2184220751 C Bo:2:011:2 0 32 >
ffff8e2301f32240 2184220756 S Bo:2:011:2 -115 4 = ffffffff
ffff8e2301f33740 2184223462 C Bo:2:011:2 0 32 >
ffff8e2301f32240 2184226205 C Bo:2:011:2 0 4 >
ffff8e2301f32e40 2184231727 C Bi:2:011:2 0 1 = 06
ffff8e2301f32e40 2184231732 S Bi:2:011:2 -115 32 <
ffff8e2301f32240 2184232055 S Bo:2:011:2 -115 32 = 57430080 ffffffff ffffffff ffffffff ffffffff ffffffff ffffffff ffffffff
ffff8e2301f33740 2184232059 S Bo:2:011:2 -115 32 = ffffffff ffffffff ffffffff ffffffff ffffffff ffffffff ffffffff ffffffff
ffff8e2301f32240 2184232116 C Bo:2:011:2 0 32 >
ffff8e2301f32240 2184232119 S Bo:2:011:2 -115 32 = ffffffff ffffffff ffffffff ffffffff ffffffff ffffffff ffffffff ffffffff
ffff8e2301f33740 2184232165 C Bo:2:011:2 0 32 >
ffff8e2301f33740 2184232168 S Bo:2:011:2 -115 32 = ffffffff ffffffff ffffffff ffffffff ffffffff ffffffff ffffffff ffffffff
ffff8e2301f32240 2184234956 C Bo:2:011:2 0 32 >
ffff8e2301f32240 2184234961 S Bo:2:011:2 -115 4 = ffffffff
ffff8e2301f33740 2184237740 C Bo:2:011:2 0 32 >
ffff8e2301f32240 2184240469 C Bo:2:011:2 0 4 >
ffff8e2301f326c0 2184245863 C Bi:2:011:2 0 1 = 06
ffff8e2301f326c0 2184245867 S Bi:2:011:2 -115 32 <
ffff8e2301f32240 2184246291 S Bo:2:011:2 -115 32 = 57438080 ffffffff ffffffff ffffffff ffffffff ffffffff ffffffff ffffffff
ffff8e2301f33740 2184246294 S Bo:2:011:2 -115 32 = ffffffff ffffffff ffffffff ffffffff ffffffff ffffffff ffffffff ffffffff
ffff8e2301f32240 2184246355 C Bo:2:011:2 0 32 >
ffff8e2301f32240 2184246358 S Bo:2:011:2 -115 32 = ffffffff ffffffff ffffffff ffffffff ffffffff ffffffff ffffffff ffffffff
ffff8e2301f33740 2184246404 C Bo:2:011:2 0 32 >
ffff8e2301f33740 2184246407 S Bo:2:011:2 -115 32 = ffffffff ffffffff ffffffff ffffffff ffffffff ffffffff ffffffff ffffffff
ffff8e2301f32240 2184249171 C Bo:2:011:2 0 32 >
ffff8e2301f32240 2184249176 S Bo:2:011:2 -115 4 = ffffffff
ffff8e2301f33740 2184251956 C Bo:2:011:2 0 32 >
ffff8e2301f32240 2184254727 C Bo:2:011:2 0 4 >
ffff8e2301f32e40 2184260186 C Bi:2:011:2 0 1 = 06
ffff8e2301f32e40 2184260190 S Bi:2:011:2 -115 32 <
ffff8e2301f32240 2184260466 S Bo:2:011:2 -115 32 = 57440080 ffffffff ffffffff ffffffff ffffffff ffffffff ffffffff ffffffff
ffff8e2301f33740 2184260469 S Bo:2:011:2 -115 32 = ffffffff ffffffff ffffffff ffffffff ffffffff ffffffff ffffffff ffffffff
ffff8e2301f32240 2184260527 C Bo:2:011:2 0 32 >
ffff8e2301f32240 2184260529 S Bo:2:011:2 -115 32 = ffffffff ffffffff ffffffff ffffffff ffffffff ffffffff ffffffff ffffffff
ffff8e2301f33740 2184260581 C Bo:2:011:2 0 32 >
ffff8e2301f33740 2184260584 S Bo:2:011:2 -115 32 = ffffffff ffffffff ffffffff ffffffff ffffffff ffffffff ffffffff ffffffff
ffff8e2301f32240 2184263381 C Bo:2:011:2 0 32 >
ffff8e2301f32240 2184263385 S Bo:2:011:2 -115 4 = ffffffff
ffff8e2301f33740 2184266103 C Bo:2:011:2 0 32 >
ffff8e2301f32240 2184268856 C Bo:2:011:2 0 4 >
ffff8e2301f326c0 2184274319 C Bi:2:011:2 0 1 = 06
ffff8e2301f326c0 2184274324 S Bi:2:011:2 -115 32 <
ffff8e2301f32240 2184274872 S Bo:2:011:2 -115 32 = 57448080 ffffffff ffffffff ffffffff ffffffff ffffffff ffffffff ffffffff
ffff8e2301f33740 2184274876 S Bo:2:011:2 -115 32 = ffffffff ffffffff ffffffff ffffffff ffffffff ffffffff ffffffff ffffffff
ffff8e2301f32240 2184274940 C Bo:2:011:2 0 32 >
ffff8e2301f32240 2184274943 S Bo:2:011:2 -115 32 = ffffffff ffffffff ffffffff ffffffff ffffffff ffffffff ffffffff ffffffff
ffff8e2301f33740 2184274985 C Bo:2:011:2 0 32 >
ffff8e2301f33740 2184274987 S Bo:2:011:2 -115 32 = ffffffff ffffffff ffffffff ffffffff ffffffff ffffffff ffffffff ffffffff
ffff8e2301f32240 2184277742 C Bo:2:011:2 0 32 >
ffff8e2301f32240 2184277747 S Bo:2:011:2 -115 4 = ffffffff
ffff8e2301f33740 2184280525 C Bo:2:011:2 0 32 >
ffff8e2301f32240 2184283253 C Bo:2:011:2 0 4 >
ffff8e2301f32e40 2184288727 C Bi:2:011:2 0 1 = 06
ffff8e2301f32e40 2184288732 S Bi:2:011:2 -115 32 <
ffff8e2301f32240 2184289037 S Bo:2:011:2 -115 32 = 57450080 ffffffff ffffffff ffffffff ffffffff ffffffff ffffffff ffffffff
ffff8e2301f33740 2184289040 S Bo:2:011:2 -115 32 = ffffffff ffffffff ffffffff ffffffff ffffffff ffffffff ffffffff ffffffff
ffff8e2301f32240 2184289103 C Bo:2:011:2 0 32 >
ffff8e2301f32240 2184289106 S Bo:2:011:2 -115 32 = ffffffff ffffffff ffffffff ffffffff ffffffff ffffffff ffffffff ffffffff
ffff8e2301f33740 2184289152 C Bo:2:011:2 0 32 >
ffff8e2301f33740 2184289155 S Bo:2:011:2 -115 32 = ffffffff ffffffff ffffffff ffffffff ffffffff ffffffff ffffffff ffffffff
ffff8e2301f32240 2184291958 C Bo:2:011:2 0 32 >
ffff8e2301f32240 2184291962 S Bo:2:011:2 -115 4 = ffffffff
ffff8e2301f33740 2184294751 C Bo:2:011:2 0 32 >
ffff8e2301f32240 2184297455 C Bo:2:011:2 0 4 >
ffff8e2301f326c0 2184302796 C Bi:2:011:2 0 1 = 06
ffff8e2301f326c0 2184302801 S Bi:2:011:2 -115 32 <
ffff8e2301f32240 2184303119 S Bo:2:011:2 -115 32 = 57458080 ffffffff ffffffff ffffffff ffffffff ffffffff ffffffff ffffffff
ffff8e2301f33740 2184303123 S Bo:2:011:2 -115 32 = ffffffff ffffffff ffffffff ffffffff ffffffff ffffffff ffffffff ffffffff
ffff8e2301f32240 2184303185 C Bo:2:011:2 0 32 >
ffff8e2301f32240 2184303188 S Bo:2:011:2 -115 32 = ffffffff ffffffff ffffffff ffffffff ffffffff ffffffff ffffffff ffffffff
ffff8e2301f33740 2184303233 C Bo:2:011:2 0 32 >
ffff8e2301f33740 2184303236 S Bo:2:011:2 -115 32 = ffffffff ffffffff ffffffff ffffffff ffffffff ffffffff ffffffff ffffffff
ffff8e2301f32240 2184306051 C Bo:2:011:2 0 32 >
ffff8e2301f32240 2184306056 S Bo:2:011:2 -115 4 = ffffffff
ffff8e2301f33740 2184308817 C Bo:2:011:2 0 32 >
ffff8e2301f32240 2184311548 C Bo:2:011:2 0 4 >
ffff8e2301f32e40 2184316934 C Bi:2:011:2 0 1 = 06
ffff8e2301f32e40 2184316939 S Bi:2:011:2 -115 32 <
ffff8e2301f32240 2184317252 S Bo:2:011:2 -115 32 = 57460080 ffffffff ffffffff ffffffff ffffffff ffffffff ffffffff ffffffff
ffff8e2301f33740 2184317256 S Bo:2:011:2 -115 32 = ffffffff ffffffff ffffffff ffffffff ffffffff ffffffff ffffffff ffffffff
ffff8e2301f32240 2184317313 C Bo:2:011:2 0 32 >
ffff8e2301f32240 2184317316 S Bo:2:011:2 -115 32 = ffffffff ffffffff ffffffff ffffffff ffffffff ffffffff ffffffff ffffffff
ffff8e2301f33740 2184317361 C Bo:2:011:2 0 32 >
ffff8e2301f33740 2184317363 S Bo:2:011:2 -115 32 = ffffffff ffffffff ffffffff ffffffff ffffffff ffffffff ffffffff ffffffff
ffff8e2301f32240 2184320152 C Bo:2:011:2 0 32 >
ffff8e2301f32240 2184320155 S Bo:2:011:2 -115 4 = ffffffff
ffff8e2301f33740 2184322956 C Bo:2:011:2 0 32 >
ffff8e2301f32240 2184325731 C Bo:2:011:2 0 4 >
ffff8e2301f326c0 2184331072 C Bi:2:011:2 0 1 = 06
ffff8e2301f326c0 2184331074 S Bi:2:011:2 -115 32 <
ffff8e2301f32240 2184331412 S Bo:2:011:2 -115 32 = 57468080 ffffffff ffffffff ffffffff ffffffff ffffffff ffffffff ffffffff
ffff8e2301f33740 2184331415 S Bo:2:011:2 -115 32 = ffffffff ffffffff ffffffff ffffffff ffffffff ffffffff ffffffff ffffffff
ffff8e2301f32240 2184331477 C Bo:2:011:2 0 32 >
ffff8e2301f32240 2184331479 S Bo:2:011:2 -115 32 = ffffffff ffffffff ffffffff ffffffff ffffffff ffffffff ffffffff ffffffff
ffff8e2301f33740 2184331527 C Bo:2:011:2 0 32 >
ffff8e2301f33740 2184331528 S Bo:2:011:2 -115 32 = ffffffff ffffffff ffffffff ffffffff ffffffff ffffffff ffffffff ffffffff
ffff8e2301f32240 2184334322 C Bo:2:011:2 0 32 >
ffff8e2301f32240 2184334324 S Bo:2:011:2 -115 4 = ffffffff
ffff8e2301f33740 2184337103 C Bo:2:011:2 0 32 >
ffff8e2301f32240 2184339834 C Bo:2:011:2 0 4 >
ffff8e2301f32e40 2184345252 C Bi:2:011:2 0 1 = 06
ffff8e2301f32e40 2184345254 S Bi:2:011:2 -115 32 <
ffff8e2301f32240 2184345627 S Bo:2:011:2 -115 32 = 57470080 ffffffff ffffffff ffffffff ffffffff ffffffff ffffffff ffffffff
ffff8e2301f33740 2184345630 S Bo:2:011:2 -115 32 = ffffffff ffffffff ffffffff ffffffff ffffffff ffffffff ffffffff ffffffff
ffff8e2301f32240 2184345752 C Bo:2:011:2 0 32 >
ffff8e2301f32240 2184345753 S Bo:2:011:2 -115 32 = ffffffff ffffffff ffffffff ffffffff ffffffff ffffffff ffffffff ffffffff
ffff8e2301f33740 2184345811 C Bo:2:011:2 0 32 >
ffff8e2301f33740 2184345813 S Bo:2:011:2 -115 32 = ffffffff ffffffff ffffffff ffffffff ffffffff ffffffff ffffffff ffffffff
ffff8e2301f32240 2184348582 C Bo:2:011:2 0 32 >
ffff8e2301f32240 2184348584 S Bo:2:011:2 -115 4 = ffffffff
ffff8e2301f33740 2184351380 C Bo:2:011:2 0 32 >
ffff8e2301f32240 2184354107 C Bo:2:011:2 0 4 >
ffff8e2301f326c0 2184359549 C Bi:2:011:2 0 1 = 06
ffff8e2301f326c0 2184359551 S Bi:2:011:2 -115 32 <
ffff8e2301f32240 2184359822 S Bo:2:011:2 -115 32 = 57478080 ffffffff ffffffff ffffffff ffffffff ffffffff ffffffff ffffffff
ffff8e2301f33740 2184359825 S Bo:2:011:2 -115 32 = ffffffff ffffffff ffffffff ffffffff ffffffff ffffffff ffffffff ffffffff
ffff8e2301f32240 2184359881 C Bo:2:011:2 0 32 >
ffff8e2301f32240 2184359883 S Bo:2:011:2 -115 32 = ffffffff ffffffff ffffffff ffffffff ffffffff ffffffff ffffffff ffffffff
ffff8e2301f33740 2184359933 C Bo:2:011:2 0 32 >
ffff8e2301f33740 2184359934 S Bo:2:011:2 -115 32 = ffffffff ffffffff ffffffff ffffffff ffffffff ffffffff ffffffff ffffffff
ffff8e2301f32240 2184362750 C Bo:2:011:2 0 32 >
ffff8e2301f32240 2184362752 S Bo:2:011:2 -115 4 = ffffffff
ffff8e2301f33740 2184365461 C Bo:2:011:2 0 32 >
ffff8e2301f32240 2184368227 C Bo:2:011:2 0 4 >
ffff8e2301f32e40 2184373727 C Bi:2:011:2 0 1 = 06
ffff8e2301f32e40 2184373729 S Bi:2:011:2 -115 32 <
ffff8e2301f32240 2184374085 S Bo:2:011:2 -115 32 = 57480080 ffffffff ffffffff ffffffff ffffffff ffffffff ffffffff ffffffff
ffff8e2301f33740 2184374089 S Bo:2:011:2 -115 32 = ffffffff ffffffff ffffffff ffffffff ffffffff ffffffff ffffffff ffffffff
ffff8e2301f32240 2184374145 C Bo:2:011:2 0 32 >
ffff8e2301f32240 2184374147 S Bo:2:011:2 -115 32 = ffffffff ffffffff ffffffff ffffffff ffffffff ffffffff ffffffff ffffffff
ffff8e2301f33740 2184374193 C Bo:2:011:2 0 32 >
ffff8e2301f33740 2184374194 S Bo:2:011:2 -115 32 = ffffffff ffffffff ffffffff ffffffff ffffffff ffffffff ffffffff ffffffff
ffff8e2301f32240 2184376957 C Bo:2:011:2 0 32 >
ffff8e2301f32240 2184376959 S Bo:2:011:2 -115 4 = ffffffff
ffff8e2301f33740 2184379739 C Bo:2:011:2 0 32 >
ffff8e2301f32240 2184382501 C Bo:2:011:2 0 4 >
ffff8e2301f326c0 2184387862 C Bi:2:011:2 0 1 = 06
ffff8e2301f326c0 2184387867 S Bi:2:011:2 -115 32 <
ffff8e2301f32240 2184388256 S Bo:2:011:2 -115 32 = 57488080 ffffffff ffffffff ffffffff ffffffff ffffffff ffffffff ffffffff
ffff8e2301f33740 2184388259 S Bo:2:011:2 -115 32 = ffffffff ffffffff ffffffff ffffffff ffffffff ffffffff ffffffff ffffffff
ffff8e2301f32240 2184388320 C Bo:2:011:2 0 32 >
ffff8e2301f32240 2184388323 S Bo:2:011:2 -115 32 = ffffffff ffffffff ffffffff ffffffff ffffffff ffffffff ffffffff ffffffff
ffff8e2301f33740 2184388367 C Bo:2:011:2 0 32 >
ffff8e2301f33740 2184388370 S Bo:2:011:2 -115 32 = ffffffff ffffffff ffffffff ffffffff ffffffff ffffffff ffffffff ffffffff
ffff8e2301f32240 2184391174 C Bo:2:011:2 0 32 >
ffff8e2301f32240 2184391178 S Bo:2:011:2 -115 4 = ffffffff
ffff8e2301f33740 2184393955 C Bo:2:011:2 0 32 >
ffff8e2301f32240 2184396727 C Bo:2:011:2 0 4 >
ffff8e2301f32e40 2184402004 C Bi:2:011:2 0 1 = 06
ffff8e2301f32e40 2184402009 S Bi:2:011:2 -115 32 <
ffff8e2301f32240 2184402361 S Bo:2:011:2 -115 32 = 57490080 ffffffff ffffffff ffffffff ffffffff ffffffff ffffffff ffffffff
ffff8e2301f33740 2184402364 S Bo:2:011:2 -115 32 = ffffffff ffffffff ffffffff ffffffff ffffffff ffffffff ffffffff ffffffff
ffff8e2301f32240 2184402421 C Bo:2:011:2 0 32 >
ffff8e2301f32240 2184402425 S Bo:2:011:2 -115 32 = ffffffff ffffffff ffffffff ffffffff ffffffff ffffffff ffffffff ffffffff
ffff8e2301f33740 2184402470 C Bo:2:011:2 0 32 >
ffff8e2301f33740 2184402473 S Bo:2:011:2 -115 32 = ffffffff ffffffff ffffffff ffffffff ffffffff ffffffff ffffffff ffffffff
ffff8e2301f32240 2184405253 C Bo:2:011:2 0 32 >
ffff8e2301f32240 2184405257 S Bo:2:011:2 -115 4 = ffffffff
ffff8e2301f33740 2184408036 C Bo:2:011:2 0 32 >
ffff8e2301f32240 2184410755 C Bo:2:011:2 0 4 >
ffff8e2301f326c0 2184416136 C Bi:2:011:2 0 1 = 06
ffff8e2301f326c0 2184416142 S Bi:2:011:2 -115 32 <
ffff8e2301f32240 2184416472 S Bo:2:011:2 -115 32 = 57498080 ffffffff ffffffff ffffffff ffffffff ffffffff ffffffff ffffffff
ffff8e2301f33740 2184416475 S Bo:2:011:2 -115 32 = ffffffff ffffffff ffffffff ffffffff ffffffff ffffffff ffffffff ffffffff
ffff8e2301f32240 2184416533 C Bo:2:011:2 0 32 >
ffff8e2301f32240 2184416536 S Bo:2:011:2 -115 32 = ffffffff ffffffff ffffffff ffffffff ffffffff ffffffff ffffffff ffffffff
ffff8e2301f33740 2184416583 C Bo:2:011:2 0 32 >
ffff8e2301f33740 2184416585 S Bo:2:011:2 -115 32 = ffffffff ffffffff ffffffff ffffffff ffffffff ffffffff ffffffff ffffffff
ffff8e2301f32240 2184419385 C Bo:2:011:2 0 32 >
ffff8e2301f32240 2184419390 S Bo:2:011:2 -115 4 = ffffffff
ffff8e2301f33740 2184422104 C Bo:2:011:2 0 32 >
ffff8e2301f32240 2184424867 C Bo:2:011:2 0 4 >
ffff8e2301f32e40 2184430324 C Bi:2:011:2 0 1 = 06
ffff8e2301f32e40 2184430329 S Bi:2:011:2 -115 32 <
ffff8e2301f32240 2184430663 S Bo:2:011:2 -115 32 = 574a0080 ffffffff ffffffff ffffffff ffffffff ffffffff ffffffff ffffffff
ffff8e2301f33740 2184430666 S Bo:2:011:2 -115 32 = ffffffff ffffffff ffffffff ffffffff ffffffff ffffffff ffffffff ffffffff
ffff8e2301f32240 2184430751 C Bo:2:011:2 0 32 >
ffff8e2301f32240 2184430755 S Bo:2:011:2 -115 32 = ffffffff ffffffff ffffffff ffffffff ffffffff ffffffff ffffffff ffffffff
ffff8e2301f33740 2184430804 C Bo:2:011:2 0 32 >
ffff8e2301f33740 2184430807 S Bo:2:011:2 -115 32 = ffffffff ffffffff ffffffff ffffffff ffffffff ffffffff ffffffff ffffffff
ffff8e2301f32240 2184433617 C Bo:2:011:2 0 32 >
ffff8e2301f32240 2184433620 S Bo:2:011:2 -115 4 = ffffffff
ffff8e2301f33740 2184436322 C Bo:2:011:2 0 32 >
ffff8e2301f32240 2184439096 C Bo:2:011:2 0 4 >
ffff8e2301f326c0 2184444459 C Bi:2:011:2 0 1 = 06
ffff8e2301f326c0 2184444464 S Bi:2:011:2 -115 32 <
ffff8e2301f32240 2184444831 S Bo:2:011:2 -115 32 = 574a8080 ffffffff ffffffff ffffffff ffffffff ffffffff ffffffff ffffffff
ffff8e2301f33740 2184444834 S Bo:2:011:2 -115 32 = ffffffff ffffffff ffffffff ffffffff ffffffff ffffffff ffffffff ffffffff
ffff8e2301f32240 2184444892 C Bo:2:011:2 0 32 >
ffff8e2301f32240 2184444895 S Bo:2:011:2 -115 32 = ffffffff ffffffff ffffffff ffffffff ffffffff ffffffff ffffffff ffffffff
ffff8e2301f33740 2184444940 C Bo:2:011:2 0 32 >
ffff8e2301f33740 2184444943 S Bo:2:011:2 -115 32 = ffffffff ffffffff ffffffff ffffffff ffffffff ffffffff ffffffff ffffffff
ffff8e2301f32240 2184447785 C Bo:2:011:2 0 32 >
ffff8e2301f32240 2184447790 S Bo:2:011:2 -115 4 = ffffffff
ffff8e2301f33740 2184450507 C Bo:2:011:2 0 32 >
ffff8e2301f32240 2184453254 C Bo:2:011:2 0 4 >
ffff8e2301f32e40 2184458604 C Bi:2:011:2 0 1 = 06
ffff8e2301f32e40 2184458609 S Bi:2:011:2 -115 32 <
ffff8e2301f32240 2184458994 S Bo:2:011:2 -115 32 = 574b0080 ffffffff ffffffff ffffffff ffffffff ffffffff ffffffff ffffffff
ffff8e2301f33740 2184458998 S Bo:2:011:2 -115 32 = ffffffff ffffffff ffffffff ffffffff ffffffff ffffffff ffffffff ffffffff
ffff8e2301f32240 2184459060 C Bo:2:011:2 0 32 >
ffff8e2301f32240 2184459064 S Bo:2:011:2 -115 32 = ffffffff ffffffff ffffffff ffffffff ffffffff ffffffff ffffffff ffffffff
ffff8e2301f33740 2184459110 C Bo:2:011:2 0 32 >
ffff8e2301f33740 2184459112 S Bo:2:011:2 -115 32 = ffffffff ffffffff ffffffff ffffffff ffffffff ffffffff ffffffff ffffffff
ffff8e2301f32240 2184461889 C Bo:2:011:2 0 32 >
ffff8e2301f32240 2184461894 S Bo:2:011:2 -115 4 = ffffffff
ffff8e2301f33740 2184464631 C Bo:2:011:2 0 32 >
ffff8e2301f32240 2184467402 C Bo:2:011:2 0 4 >
ffff8e2301f326c0 2184472752 C Bi:2:011:2 0 1 = 06
ffff8e2301f326c0 2184472756 S Bi:2:011:2 -115 32 <
ffff8e2301f32240 2184473147 S Bo:2:011:2 -115 32 = 574b8080 ffffffff ffffffff ffffffff ffffffff ffffffff ffffffff ffffffff
ffff8e2301f33740 2184473151 S Bo:2:011:2 -115 32 = ffffffff ffffffff ffffffff ffffffff ffffffff ffffffff ffffffff ffffffff
ffff8e2301f32240 2184473208 C Bo:2:011:2 0 32 >
ffff8e2301f32240 2184473211 S Bo:2:011:2 -115 32 = ffffffff ffffffff ffffffff ffffffff ffffffff ffffffff ffffffff ffffffff
ffff8e2301f33740 2184473256 C Bo:2:011:2 0 32 >
ffff8e2301f33740 2184473259 S Bo:2:011:2 -115 32 = ffffffff ffffffff ffffffff ffffffff ffffffff ffffffff ffffffff ffffffff
ffff8e2301f32240 2184476027 C Bo:2:011:2 0 32 >
ffff8e2301f32240 2184476033 S Bo:2:011:2 -115 4 = ffffffff
ffff8e2301f33740 2184478812 C Bo:2:011:2 0 32 >
ffff8e2301f32240 2184481564 C Bo:2:011:2 0 4 >
ffff8e2301f32e40 2184486885 C Bi:2:011:2 0 1 = 06
ffff8e2301f32e40 2184486891 S Bi:2:011:2 -115 32 <
ffff8e2301f32240 2184487276 S Bo:2:011:2 -115 32 = 574c0080 ffffffff ffffffff ffffffff ffffffff ffffffff ffffffff ffffffff
ffff8e2301f33740 2184487279 S Bo:2:011:2 -115 32 = ffffffff ffffffff ffffffff ffffffff ffffffff ffffffff ffffffff ffffffff
ffff8e2301f32240 2184487337 C Bo:2:011:2 0 32 >
ffff8e2301f32240 2184487340 S Bo:2:011:2 -115 32 = ffffffff ffffffff ffffffff ffffffff ffffffff ffffffff ffffffff ffffffff
ffff8e2301f33740 2184487386 C Bo:2:011:2 0 32 >
ffff8e2301f33740 2184487388 S Bo:2:011:2 -115 32 = ffffffff ffffffff ffffffff ffffffff ffffffff ffffffff ffffffff ffffffff
ffff8e2301f32240 2184490172 C Bo:2:011:2 0 32 >
ffff8e2301f32240 2184490175 S Bo:2:011:2 -115 4 = ffffffff
ffff8e2301f33740 2184492956 C Bo:2:011:2 0 32 >
ffff8e2301f32240 2184495776 C Bo:2:011:2 0 4 >
ffff8e2301f326c0 2184501072 C Bi:2:011:2 0 1 = 06
ffff8e2301f326c0 2184501074 S Bi:2:011:2 -115 32 <
ffff8e2301f32240 2184501435 S Bo:2:011:2 -115 32 = 574c8080 ffffffff ffffffff ffffffff ffffffff ffffffff ffffffff ffffffff
ffff8e2301f33740 2184501438 S Bo:2:011:2 -115 32 = ffffffff ffffffff ffffffff ffffffff ffffffff ffffffff ffffffff ffffffff
ffff8e2301f32240 2184501495 C Bo:2:011:2 0 32 >
ffff8e2301f32240 2184501496 S Bo:2:011:2 -115 32 = ffffffff ffffffff ffffffff ffffffff ffffffff ffffffff ffffffff ffffffff
ffff8e2301f33740 2184501543 C Bo:2:011:2 0 32 >
ffff8e2301f33740 2184501544 S Bo:2:011:2 -115 32 = ffffffff ffffffff ffffffff ffffffff ffffffff ffffffff ffffffff ffffffff
ffff8e2301f32240 2184504296 C Bo:2:011:2 0 32 >
ffff8e2301f32240 2184504298 S Bo:2:011:2 -115 4 = ffffffff
ffff8e2301f33740 2184507096 C Bo:2:011:2 0 32 >
ffff8e2301f32240 2184509812 C Bo:2:011:2 0 4 >
ffff8e2301f32e40 2184515208 C Bi:2:011:2 0 1 = 06
ffff8e2301f32e40 2184515210 S Bi:2:011:2 -115 32 <
ffff8e2301f32240 2184515588 S Bo:2:011:2 -115 32 = 574d0080 ffffffff ffffffff ffffffff ffffffff ffffffff ffffffff ffffffff
ffff8e2301f33740 2184515591 S Bo:2:011:2 -115 32 = ffffffff ffffffff ffffffff ffffffff ffffffff ffffffff ffffffff ffffffff
ffff8e2301f32240 2184515647 C Bo:2:011:2 0 32 >
ffff8e2301f32240 2184515648 S Bo:2:011:2 -115 32 = ffffffff ffffffff ffffffff ffffffff ffffffff ffffffff ffffffff ffffffff
ffff8e2301f33740 2184515765 C Bo:2:011:2 0 32 >
ffff8e2301f33740 2184515766 S Bo:2:011:2 -115 32 = ffffffff ffffffff ffffffff ffffffff ffffffff ffffffff ffffffff ffffffff
ffff8e2301f32240 2184518456 C Bo:2:011:2 0 32 >
ffff8e2301f32240 2184518459 S Bo:2:011:2 -115 4 = ffffffff
ffff8e2301f33740 2184521240 C Bo:2:011:2 0 32 >
ffff8e2301f32240 2184523981 C Bo:2:011:2 0 4 >
ffff8e2301f326c0 2184529340 C Bi:2:011:2 0 1 = 06
ffff8e2301f326c0 2184529342 S Bi:2:011:2 -115 32 <
ffff8e2301f32240 2184529706 S Bo:2:011:2 -115 32 = 574d8080 ffffffff ffffffff ffffffff ffffffff ffffffff ffffffff ffffffff
ffff8e2301f33740 2184529709 S Bo:2:011:2 -115 32 = ffffffff ffffffff ffffffff ffffffff ffffffff ffffffff ffffffff ffffffff
ffff8e2301f32240 2184529765 C Bo:2:011:2 0 32 >
ffff8e2301f32240 2184529769 S Bo:2:011:2 -115 32 = ffffffff ffffffff ffffffff ffffffff ffffffff ffffffff ffffffff ffffffff
ffff8e2301f33740 2184529814 C Bo:2:011:2 0 32 >
ffff8e2301f33740 2184529815 S Bo:2:011:2 -115 32 = ffffffff ffffffff ffffffff ffffffff ffffffff ffffffff ffffffff ffffffff
ffff8e2301f32240 2184532597 C Bo:2:011:2 0 32 >
ffff8e2301f32240 2184532598 S Bo:2:011:2 -115 4 = ffffffff
ffff8e2301f33740 2184535383 C Bo:2:011:2 0 32 >
ffff8e2301f32240 2184538126 C Bo:2:011:2 0 4 >
ffff8e2301f32e40 2184543505 C Bi:2:011:2 0 1 = 06
ffff8e2301f32e40 2184543507 S Bi:2:011:2 -115 32 <
ffff8e2301f32240 2184543920 S Bo:2:011:2 -115 32 = 574e0080 ffffffff ffffffff ffffffff ffffffff ffffffff ffffffff ffffffff
ffff8e2301f33740 2184543923 S Bo:2:011:2 -115 32 = ffffffff ffffffff ffffffff ffffffff ffffffff ffffffff ffffffff ffffffff
ffff8e2301f32240 2184543980 C Bo:2:011:2 0 32 >
ffff8e2301f32240 2184543981 S Bo:2:011:2 -115 32 = ffffffff ffffffff ffffffff ffffffff ffffffff ffffffff ffffffff ffffffff
ffff8e2301f33740 2184544029 C Bo:2:011:2 0 32 >
ffff8e2301f33740 2184544030 S Bo:2:011:2 -115 32 = ffffffff ffffffff ffffffff ffffffff ffffffff ffffffff ffffffff ffffffff
ffff8e2301f32240 2184546813 C Bo:2:011:2 0 32 >
ffff8e2301f32240 2184546815 S Bo:2:011:2 -115 4 = ffffffff
ffff8e2301f33740 2184549595 C Bo:2:011:2 0 32 >
ffff8e2301f32240 2184552321 C Bo:2:011:2 0 4 >
ffff8e2301f326c0 2184557817 C Bi:2:011:2 0 1 = 06
ffff8e2301f326c0 2184557819 S Bi:2:011:2 -115 32 <
ffff8e2301f32240 2184558279 S Bo:2:011:2 -115 32 = 574e8080 ffffffff ffffffff ffffffff ffffffff ffffffff ffffffff ffffffff
ffff8e2301f33740 2184558282 S Bo:2:011:2 -115 32 = ffffffff ffffffff ffffffff ffffffff ffffffff ffffffff ffffffff ffffffff
ffff8e2301f32240 2184558338 C Bo:2:011:2 0 32 >
ffff8e2301f32240 2184558339 S Bo:2:011:2 -115 32 = ffffffff ffffffff ffffffff ffffffff ffffffff ffffffff ffffffff ffffffff
ffff8e2301f33740 2184558387 C Bo:2:011:2 0 32 >
ffff8e2301f33740 2184558388 S Bo:2:011:2 -115 32 = ffffffff ffffffff ffffffff ffffffff ffffffff ffffffff ffffffff ffffffff
ffff8e2301f32240 2184561185 C Bo:2:011:2 0 32 >
ffff8e2301f32240 2184561187 S Bo:2:011:2 -115 4 = ffffffff
ffff8e2301f33740 2184563957 C Bo:2:011:2 0 32 >
ffff8e2301f32240 2184566710 C Bo:2:011:2 0 4 >
ffff8e2301f32e40 2184572140 C Bi:2:011:2 0 1 = 06
ffff8e2301f32e40 2184572142 S Bi:2:011:2 -115 32 <
ffff8e2301f32240 2184572492 S Bo:2:011:2 -115 32 = 574f0080 ffffffff ffffffff ffffffff ffffffff ffffffff ffffffff ffffffff
ffff8e2301f33740 2184572495 S Bo:2:011:2 -115 32 = ffffffff ffffffff ffffffff ffffffff ffffffff ffffffff ffffffff ffffffff
ffff8e2301f32240 2184572559 C Bo:2:011:2 0 32 >
ffff8e2301f32240 2184572560 S Bo:2:011:2 -115 32 = ffffffff ffffffff ffffffff ffffffff ffffffff ffffffff ffffffff ffffffff
ffff8e2301f33740 2184572608 C Bo:2:011:2 0 32 >
ffff8e2301f33740 2184572609 S Bo:2:011:2 -115 32 = ffffffff ffffffff ffffffff ffffffff ffffffff ffffffff ffffffff ffffffff
ffff8e2301f32240 2184575386 C Bo:2:011:2 0 32 >
ffff8e2301f32240 2184575387 S Bo:2:011:2 -115 4 = ffffffff
ffff8e2301f33740 2184578175 C Bo:2:011:2 0 32 >
ffff8e2301f32240 2184580902 C Bo:2:011:2 0 4 >
ffff8e2301f326c0 2184586274 C Bi:2:011:2 0 1 = 06
ffff8e2301f326c0 2184586276 S Bi:2:011:2 -115 32 <
ffff8e2301f32240 2184586619 S Bo:2:011:2 -115 32 = 574f8080 ffffffff ffffffff ffffffff ffffffff ffffffff ffffffff ffffffff
ffff8e2301f33740 2184586623 S Bo:2:011:2 -115 32 = ffffffff ffffffff ffffffff ffffffff ffffffff ffffffff ffffffff ffffffff
ffff8e2301f32240 2184586750 C Bo:2:011:2 0 32 >
ffff8e2301f32240 2184586751 S Bo:2:011:2 -115 32 = ffffffff ffffffff ffffffff ffffffff ffffffff ffffffff ffffffff ffffffff
ffff8e2301f33740 2184586798 C Bo:2:011:2 0 32 >
ffff8e2301f33740 2184586799 S Bo:2:011:2 -115 32 = ffffffff ffffffff ffffffff ffffffff ffffffff ffffffff ffffffff ffffffff
ffff8e2301f32240 2184589597 C Bo:2:011:2 0 32 >
ffff8e2301f32240 2184589599 S Bo:2:011:2 -115 4 = ffffffff
ffff8e2301f33740 2184592365 C Bo:2:011:2 0 32 >
ffff8e2301f32240 2184595096 C Bo:2:011:2 0 4 >
ffff8e2301f32e40 2184600414 C Bi:2:011:2 0 1 = 06
ffff8e2301f32e40 2184600416 S Bi:2:011:2 -115 32 <
ffff8e2301f32240 2184600758 S Bo:2:011:2 -115 32 = 57500080 ffffffff ffffffff ffffffff ffffffff ffffffff ffffffff ffffffff
ffff8e2301f33740 2184600761 S Bo:2:011:2 -115 32 = ffffffff ffffffff ffffffff ffffffff ffffffff ffffffff ffffffff ffffffff
ffff8e2301f32240 2184600818 C Bo:2:011:2 0 32 >
ffff8e2301f32240 2184600819 S Bo:2:011:2 -115 32 = ffffffff ffffffff ffffffff ffffffff ffffffff ffffffff ffffffff ffffffff
ffff8e2301f33740 2184600866 C Bo:2:011:2 0 32 >
ffff8e2301f33740 2184600867 S Bo:2:011:2 -115 32 = ffffffff ffffffff ffffffff ffffffff ffffffff ffffffff ffffffff ffffffff
ffff8e2301f32240 2184603744 C Bo:2:011:2 0 32 >
ffff8e2301f32240 2184603746 S Bo:2:011:2 -115 4 = ffffffff
ffff8e2301f33740 2184606421 C Bo:2:011:2 0 32 >
ffff8e2301f32240 2184609155 C Bo:2:011:2 0 4 >
ffff8e2301f326c0 2184615435 C Bi:2:011:2 0 1 = 06
ffff8e2301f326c0 2184615436 S Bi:2:011:2 -115 32 <
ffff8e2301f32240 2184615780 S Bo:2:011:2 -115 32 = 57508080 ffffffff ffffffff ffffffff ffffffff ffffffff ffffffff ffffffff
ffff8e2301f33740 2184615783 S Bo:2:011:2 -115 32 = ffffffff ffffffff ffffffff ffffffff ffffffff ffffffff ffffffff ffffffff
ffff8e2301f32240 2184615839 C Bo:2:011:2 0 32 >
ffff8e2301f32240 2184615840 S Bo:2:011:2 -115 32 = ffffffff ffffffff ffffffff ffffffff ffffffff ffffffff ffffffff ffffffff
ffff8e2301f33740 2184615887 C Bo:2:011:2 0 32 >
ffff8e2301f33740 2184615888 S Bo:2:011:2 -115 32 = ffffffff ffffffff ffffffff ffffffff ffffffff ffffffff ffffffff ffffffff
ffff8e2301f32240 2184618753 C Bo:2:011:2 0 32 >
ffff8e2301f32240 2184618755 S Bo:2:011:2 -115 4 = ffffffff
ffff8e2301f33740 2184621462 C Bo:2:011:2 0 32 >
ffff8e2301f32240 2184624176 C Bo:2:011:2 0 4 >
ffff8e2301f32e40 2184629595 C Bi:2:011:2 0 1 = 06
ffff8e2301f32e40 2184629597 S Bi:2:011:2 -115 32 <
ffff8e2301f32240 2184630025 S Bo:2:011:2 -115 32 = 57510080 ffffffff ffffffff ffffffff ffffffff ffffffff ffffffff ffffffff
ffff8e2301f33740 2184630029 S Bo:2:011:2 -115 32 = ffffffff ffffffff ffffffff ffffffff ffffffff ffffffff ffffffff ffffffff
ffff8e2301f32240 2184630085 C Bo:2:011:2 0 32 >
ffff8e2301f32240 2184630086 S Bo:2:011:2 -115 32 = ffffffff ffffffff ffffffff ffffffff ffffffff ffffffff ffffffff ffffffff
ffff8e2301f33740 2184630134 C Bo:2:011:2 0 32 >
ffff8e2301f33740 2184630135 S Bo:2:011:2 -115 32 = ffffffff ffffffff ffffffff ffffffff ffffffff ffffffff ffffffff ffffffff
ffff8e2301f32240 2184632892 C Bo:2:011:2 0 32 >
ffff8e2301f32240 2184632894 S Bo:2:011:2 -115 4 = ffffffff
ffff8e2301f33740 2184635742 C Bo:2:011:2 0 32 >
ffff8e2301f32240 2184638422 C Bo:2:011:2 0 4 >
ffff8e2301f326c0 2184643908 C Bi:2:011:2 0 1 = 06
ffff8e2301f326c0 2184643910 S Bi:2:011:2 -115 32 <
ffff8e2301f32240 2184644321 S Bo:2:011:2 -115 32 = 57518080 ffffffff ffffffff ffffffff ffffffff ffffffff ffffffff ffffffff
ffff8e2301f33740 2184644324 S Bo:2:011:2 -115 32 = ffffffff ffffffff ffffffff ffffffff ffffffff ffffffff ffffffff ffffffff
ffff8e2301f32240 2184644380 C Bo:2:011:2 0 32 >
ffff8e2301f32240 2184644381 S Bo:2:011:2 -115 32 = ffffffff ffffffff ffffffff ffffffff ffffffff ffffffff ffffffff ffffffff
ffff8e2301f33740 2184644432 C Bo:2:011:2 0 32 >
ffff8e2301f33740 2184644433 S Bo:2:011:2 -115 32 = ffffffff ffffffff ffffffff ffffffff ffffffff ffffffff ffffffff ffffffff
ffff8e2301f32240 2184647253 C Bo:2:011:2 0 32 >
ffff8e2301f32240 2184647255 S Bo:2:011:2 -115 4 = ffffffff
ffff8e2301f33740 2184650004 C Bo:2:011:2 0 32 >
ffff8e2301f32240 2184652728 C Bo:2:011:2 0 4 >
ffff8e2301f32e40 2184658234 C Bi:2:011:2 0 1 = 06
ffff8e2301f32e40 2184658236 S Bi:2:011:2 -115 32 <
ffff8e2301f32240 2184658544 S Bo:2:011:2 -115 32 = 57520080 ffffffff ffffffff ffffffff ffffffff ffffffff ffffffff ffffffff
ffff8e2301f33740 2184658548 S Bo:2:011:2 -115 32 = ffffffff ffffffff ffffffff ffffffff ffffffff ffffffff ffffffff ffffffff
ffff8e2301f32240 2184658606 C Bo:2:011:2 0 32 >
ffff8e2301f32240 2184658607 S Bo:2:011:2 -115 32 = ffffffff ffffffff ffffffff ffffffff ffffffff ffffffff ffffffff ffffffff
ffff8e2301f33740 2184658654 C Bo:2:011:2 0 32 >
ffff8e2301f33740 2184658656 S Bo:2:011:2 -115 32 = ffffffff ffffffff ffffffff ffffffff ffffffff ffffffff ffffffff ffffffff
ffff8e2301f32240 2184661457 C Bo:2:011:2 0 32 >
ffff8e2301f32240 2184661459 S Bo:2:011:2 -115 4 = ffffffff
ffff8e2301f33740 2184664240 C Bo:2:011:2 0 32 >
ffff8e2301f32240 2184666956 C Bo:2:011:2 0 4 >
ffff8e2301f326c0 2184672368 C Bi:2:011:2 0 1 = 06
ffff8e2301f326c0 2184672370 S Bi:2:011:2 -115 32 <
ffff8e2301f32240 2184672764 S Bo:2:011:2 -115 32 = 57528080 ffffffff ffffffff ffffffff ffffffff ffffffff ffffffff ffffffff
ffff8e2301f33740 2184672768 S Bo:2:011:2 -115 32 = ffffffff ffffffff ffffffff ffffffff ffffffff ffffffff ffffffff ffffffff
ffff8e2301f32240 2184672833 C Bo:2:011:2 0 32 >
ffff8e2301f32240 2184672834 S Bo:2:011:2 -115 32 = ffffffff ffffffff ffffffff ffffffff ffffffff ffffffff ffffffff ffffffff
ffff8e2301f33740 2184672882 C Bo:2:011:2 0 32 >
ffff8e2301f33740 2184672883 S Bo:2:011:2 -115 32 = ffffffff ffffffff ffffffff ffffffff ffffffff ffffffff ffffffff ffffffff
ffff8e2301f32240 2184675742 C Bo:2:011:2 0 32 >
ffff8e2301f32240 2184675744 S Bo:2:011:2 -115 4 = ffffffff
ffff8e2301f33740 2184678456 C Bo:2:011:2 0 32 >
ffff8e2301f32240 2184681155 C Bo:2:011:2 0 4 >
ffff8e2301f32e40 2184686505 C Bi:2:011:2 0 1 = 06
ffff8e2301f32e40 2184686507 S Bi:2:011:2 -115 32 <
ffff8e2301f32240 2184686853 S Bo:2:011:2 -115 32 = 57530080 ffffffff ffffffff ffffffff ffffffff ffffffff ffffffff ffffffff
ffff8e2301f33740 2184686856 S Bo:2:011:2 -115 32 = ffffffff ffffffff ffffffff ffffffff ffffffff ffffffff ffffffff ffffffff
ffff8e2301f32240 2184686912 C Bo:2:011:2 0 32 >
ffff8e2301f32240 2184686914 S Bo:2:011:2 -115 32 = ffffffff ffffffff ffffffff ffffffff ffffffff ffffffff ffffffff ffffffff
ffff8e2301f33740 2184686961 C Bo:2:011:2 0 32 >
ffff8e2301f33740 2184686962 S Bo:2:011:2 -115 32 = ffffffff ffffffff ffffffff ffffffff ffffffff ffffffff ffffffff ffffffff
ffff8e2301f32240 2184689743 C Bo:2:011:2 0 32 >
ffff8e2301f32240 2184689745 S Bo:2:011:2 -115 4 = ffffffff
ffff8e2301f33740 2184692526 C Bo:2:011:2 0 32 >
ffff8e2301f32240 2184695254 C Bo:2:011:2 0 4 >
ffff8e2301f326c0 2184700728 C Bi:2:011:2 0 1 = 06
ffff8e2301f326c0 2184700730 S Bi:2:011:2 -115 32 <
ffff8e2301f32240 2184701054 S Bo:2:011:2 -115 32 = 57538080 ffffffff ffffffff ffffffff ffffffff ffffffff ffffffff ffffffff
ffff8e2301f33740 2184701057 S Bo:2:011:2 -115 32 = ffffffff ffffffff ffffffff ffffffff ffffffff ffffffff ffffffff ffffffff
ffff8e2301f32240 2184701114 C Bo:2:011:2 0 32 >
ffff8e2301f32240 2184701116 S Bo:2:011:2 -115 32 = ffffffff ffffffff ffffffff ffffffff ffffffff ffffffff ffffffff ffffffff
ffff8e2301f33740 2184701163 C Bo:2:011:2 0 32 >
ffff8e2301f33740 2184701164 S Bo:2:011:2 -115 32 = ffffffff ffffffff ffffffff ffffffff ffffffff ffffffff ffffffff ffffffff
ffff8e2301f32240 2184703983 C Bo:2:011:2 0 32 >
ffff8e2301f32240 2184703984 S Bo:2:011:2 -115 4 = ffffffff
ffff8e2301f33740 2184706742 C Bo:2:011:2 0 32 >
ffff8e2301f32240 2184709455 C Bo:2:011:2 0 4 >
ffff8e2301f32e40 2184714796 C Bi:2:011:2 0 1 = 06
ffff8e2301f32e40 2184714798 S Bi:2:011:2 -115 32 <
ffff8e2301f32240 2184715138 S Bo:2:011:2 -115 32 = 57540080 ffffffff ffffffff ffffffff ffffffff ffffffff ffffffff ffffffff
ffff8e2301f33740 2184715142 S Bo:2:011:2 -115 32 = ffffffff ffffffff ffffffff ffffffff ffffffff ffffffff ffffffff ffffffff
ffff8e2301f32240 2184715198 C Bo:2:011:2 0 32 >
ffff8e2301f32240 2184715200 S Bo:2:011:2 -115 32 = ffffffff ffffffff ffffffff ffffffff ffffffff ffffffff ffffffff ffffffff
ffff8e2301f33740 2184715246 C Bo:2:011:2 0 32 >
ffff8e2301f33740 2184715248 S Bo:2:011:2 -115 32 = ffffffff ffffffff ffffffff ffffffff ffffffff ffffffff ffffffff ffffffff
ffff8e2301f32240 2184718007 C Bo:2:011:2 0 32 >
ffff8e2301f32240 2184718009 S Bo:2:011:2 -115 4 = ffffffff
ffff8e2301f33740 2184720818 C Bo:2:011:2 0 32 >
ffff8e2301f32240 2184723549 C Bo:2:011:2 0 4 >
ffff8e2301f326c0 2184728982 C Bi:2:011:2 0 1 = 06
ffff8e2301f326c0 2184728984 S Bi:2:011:2 -115 32 <
ffff8e2301f32240 2184729310 S Bo:2:011:2 -115 32 = 57548080 ffffffff ffffffff ffffffff ffffffff ffffffff ffffffff ffffffff
ffff8e2301f33740 2184729314 S Bo:2:011:2 -115 32 = ffffffff ffffffff ffffffff ffffffff ffffffff ffffffff ffffffff ffffffff
ffff8e2301f32240 2184729370 C Bo:2:011:2 0 32 >
ffff8e2301f32240 2184729371 S Bo:2:011:2 -115 32 = ffffffff ffffffff ffffffff ffffffff ffffffff ffffffff ffffffff ffffffff
ffff8e2301f33740 2184729418 C Bo:2:011:2 0 32 >
ffff8e2301f33740 2184729419 S Bo:2:011:2 -115 32 = ffffffff ffffffff ffffffff ffffffff ffffffff ffffffff ffffffff ffffffff
ffff8e2301f32240 2184732178 C Bo:2:011:2 0 32 >
ffff8e2301f32240 2184732180 S Bo:2:011:2 -115 4 = ffffffff
ffff8e2301f33740 2184734958 C Bo:2:011:2 0 32 >
ffff8e2301f32240 2184737728 C Bo:2:011:2 0 4 >
ffff8e2301f32e40 2184743128 C Bi:2:011:2 0 1 = 06
ffff8e2301f32e40 2184743133 S Bi:2:011:2 -115 32 <
ffff8e2301f32240 2184743448 S Bo:2:011:2 -115 32 = 57550080 ffffffff ffffffff ffffffff ffffffff ffffffff ffffffff ffffffff
ffff8e2301f33740 2184743451 S Bo:2:011:2 -115 32 = ffffffff ffffffff ffffffff ffffffff ffffffff ffffffff ffffffff ffffffff
ffff8e2301f32240 2184743509 C Bo:2:011:2 0 32 >
ffff8e2301f32240 2184743512 S Bo:2:011:2 -115 32 = ffffffff ffffffff ffffffff ffffffff ffffffff ffffffff ffffffff ffffffff
ffff8e2301f33740 2184743562 C Bo:2:011:2 0 32 >
ffff8e2301f33740 2184743566 S Bo:2:011:2 -115 32 = ffffffff ffffffff ffffffff ffffffff ffffffff ffffffff ffffffff ffffffff
ffff8e2301f32240 2184746324 C Bo:2:011:2 0 32 >
ffff8e2301f32240 2184746328 S Bo:2:011:2 -115 4 = ffffffff
ffff8e2301f33740 2184749105 C Bo:2:011:2 0 32 >
ffff8e2301f32240 2184751867 C Bo:2:011:2 0 4 >
ffff8e2301f326c0 2184757255 C Bi:2:011:2 0 1 = 06
ffff8e2301f326c0 2184757259 S Bi:2:011:2 -115 32 <
ffff8e2301f32240 2184757598 S Bo:2:011:2 -115 32 = 57558080 ffffffff ffffffff ffffffff ffffffff ffffffff ffffffff ffffffff
ffff8e2301f33740 2184757602 S Bo:2:011:2 -115 32 = ffffffff ffffffff ffffffff ffffffff ffffffff ffffffff ffffffff ffffffff
ffff8e2301f32240 2184757660 C Bo:2:011:2 0 32 >
ffff8e2301f32240 2184757663 S Bo:2:011:2 -115 32 = ffffffff ffffffff ffffffff ffffffff ffffffff ffffffff ffffffff ffffffff
ffff8e2301f33740 2184757754 C Bo:2:011:2 0 32 >
ffff8e2301f33740 2184757757 S Bo:2:011:2 -115 32 = ffffffff ffffffff ffffffff ffffffff ffffffff ffffffff ffffffff ffffffff
ffff8e2301f32240 2184760528 C Bo:2:011:2 0 32 >
ffff8e2301f32240 2184760532 S Bo:2:011:2 -115 4 = ffffffff
ffff8e2301f33740 2184763246 C Bo:2:011:2 0 32 >
ffff8e2301f32240 2184765983 C Bo:2:011:2 0 4 >
ffff8e2301f32e40 2184771388 C Bi:2:011:2 0 1 = 06
ffff8e2301f32e40 2184771393 S Bi:2:011:2 -115 32 <
ffff8e2301f32240 2184771744 S Bo:2:011:2 -115 32 = 57560080 ffffffff ffffffff ffffffff ffffffff ffffffff ffffffff ffffffff
ffff8e2301f33740 2184771747 S Bo:2:011:2 -115 32 = ffffffff ffffffff ffffffff ffffffff ffffffff ffffffff ffffffff ffffffff
ffff8e2301f32240 2184771814 C Bo:2:011:2 0 32 >
ffff8e2301f32240 2184771816 S Bo:2:011:2 -115 32 = ffffffff ffffffff ffffffff ffffffff ffffffff ffffffff ffffffff ffffffff
ffff8e2301f33740 2184771863 C Bo:2:011:2 0 32 >
ffff8e2301f33740 2184771866 S Bo:2:011:2 -115 32 = ffffffff ffffffff ffffffff ffffffff ffffffff ffffffff ffffffff ffffffff
ffff8e2301f32240 2184774741 C Bo:2:011:2 0 32 >
ffff8e2301f32240 2184774746 S Bo:2:011:2 -115 4 = ffffffff
ffff8e2301f33740 2184777385 C Bo:2:011:2 0 32 >
ffff8e2301f32240 2184780129 C Bo:2:011:2 0 4 >
ffff8e2301f326c0 2184785552 C Bi:2:011:2 0 1 = 06
ffff8e2301f326c0 2184785557 S Bi:2:011:2 -115 32 <
ffff8e2301f32240 2184785936 S Bo:2:011:2 -115 32 = 57568080 ffffffff ffffffff ffffffff ffffffff ffffffff ffffffff ffffffff
ffff8e2301f33740 2184785939 S Bo:2:011:2 -115 32 = ffffffff ffffffff ffffffff ffffffff ffffffff ffffffff ffffffff ffffffff
ffff8e2301f32240 2184785997 C Bo:2:011:2 0 32 >
ffff8e2301f32240 2184785999 S Bo:2:011:2 -115 32 = ffffffff ffffffff ffffffff ffffffff ffffffff ffffffff ffffffff ffffffff
ffff8e2301f33740 2184786049 C Bo:2:011:2 0 32 >
ffff8e2301f33740 2184786052 S Bo:2:011:2 -115 32 = ffffffff ffffffff ffffffff ffffffff ffffffff ffffffff ffffffff ffffffff
ffff8e2301f32240 2184788814 C Bo:2:011:2 0 32 >
ffff8e2301f32240 2184788819 S Bo:2:011:2 -115 4 = ffffffff
ffff8e2301f33740 2184791597 C Bo:2:011:2 0 32 >
ffff8e2301f32240 2184794368 C Bo:2:011:2 0 4 >
ffff8e2301f32e40 2184799774 C Bi:2:011:2 0 1 = 06
ffff8e2301f32e40 2184799778 S Bi:2:011:2 -115 32 <
ffff8e2301f32240 2184800139 S Bo:2:011:2 -115 32 = 57570080 ffffffff ffffffff ffffffff ffffffff ffffffff ffffffff ffffffff
ffff8e2301f33740 2184800142 S Bo:2:011:2 -115 32 = ffffffff ffffffff ffffffff ffffffff ffffffff ffffffff ffffffff ffffffff
ffff8e2301f32240 2184800199 C Bo:2:011:2 0 32 >
ffff8e2301f32240 2184800202 S Bo:2:011:2 -115 32 = ffffffff ffffffff ffffffff ffffffff ffffffff ffffffff ffffffff ffffffff
ffff8e2301f33740 2184800248 C Bo:2:011:2 0 32 >
ffff8e2301f33740 2184800251 S Bo:2:011:2 -115 32 = ffffffff ffffffff ffffffff ffffffff ffffffff ffffffff ffffffff ffffffff
ffff8e2301f32240 2184803029 C Bo:2:011:2 0 32 >
ffff8e2301f32240 2184803033 S Bo:2:011:2 -115 4 = ffffffff
ffff8e2301f33740 2184805814 C Bo:2:011:2 0 32 >
ffff8e2301f32240 2184808517 C Bo:2:011:2 0 4 >
ffff8e2301f326c0 2184814052 C Bi:2:011:2 0 1 = 06
ffff8e2301f326c0 2184814057 S Bi:2:011:2 -115 32 <
ffff8e2301f32240 2184814340 S Bo:2:011:2 -115 32 = 57578080 ffffffff ffffffff ffffffff ffffffff ffffffff ffffffff ffffffff
ffff8e2301f33740 2184814343 S Bo:2:011:2 -115 32 = ffffffff ffffffff ffffffff ffffffff ffffffff ffffffff ffffffff ffffffff
ffff8e2301f32240 2184814401 C Bo:2:011:2 0 32 >
ffff8e2301f32240 2184814404 S Bo:2:011:2 -115 32 = ffffffff ffffffff ffffffff ffffffff ffffffff ffffffff ffffffff ffffffff
ffff8e2301f33740 2184814457 C Bo:2:011:2 0 32 >
ffff8e2301f33740 2184814459 S Bo:2:011:2 -115 32 = ffffffff ffffffff ffffffff ffffffff ffffffff ffffffff ffffffff ffffffff
ffff8e2301f32240 2184817258 C Bo:2:011:2 0 32 >
ffff8e2301f32240 2184817263 S Bo:2:011:2 -115 4 = ffffffff
ffff8e2301f33740 2184820029 C Bo:2:011:2 0 32 >
ffff8e2301f32240 2184822756 C Bo:2:011:2 0 4 >
ffff8e2301f32e40 2184828186 C Bi:2:011:2 0 1 = 06
ffff8e2301f32e40 2184828191 S Bi:2:011:2 -115 32 <
ffff8e2301f32240 2184828534 S Bo:2:011:2 -115 32 = 57580080 ffffffff ffffffff ffffffff ffffffff ffffffff ffffffff ffffffff
ffff8e2301f33740 2184828537 S Bo:2:011:2 -115 32 = ffffffff ffffffff ffffffff ffffffff ffffffff ffffffff ffffffff ffffffff
ffff8e2301f32240 2184828595 C Bo:2:011:2 0 32 >
ffff8e2301f32240 2184828598 S Bo:2:011:2 -115 32 = ffffffff ffffffff ffffffff ffffffff ffffffff ffffffff ffffffff ffffffff
ffff8e2301f33740 2184828643 C Bo:2:011:2 0 32 >
ffff8e2301f33740 2184828646 S Bo:2:011:2 -115 32 = ffffffff ffffffff ffffffff ffffffff ffffffff ffffffff ffffffff ffffffff
ffff8e2301f32240 2184831459 C Bo:2:011:2 0 32 >
ffff8e2301f32240 2184831464 S Bo:2:011:2 -115 4 = ffffffff
ffff8e2301f33740 2184834173 C Bo:2:011:2 0 32 >
ffff8e2301f32240 2184836957 C Bo:2:011:2 0 4 >
ffff8e2301f326c0 2184842321 C Bi:2:011:2 0 1 = 06
ffff8e2301f326c0 2184842326 S Bi:2:011:2 -115 32 <
ffff8e2301f32240 2184842682 S Bo:2:011:2 -115 32 = 57588080 ffffffff ffffffff ffffffff ffffffff ffffffff ffffffff ffffffff
ffff8e2301f33740 2184842686 S Bo:2:011:2 -115 32 = ffffffff ffffffff ffffffff ffffffff ffffffff ffffffff ffffffff ffffffff
ffff8e2301f32240 2184842743 C Bo:2:011:2 0 32 >
ffff8e2301f32240 2184842746 S Bo:2:011:2 -115 32 = ffffffff ffffffff ffffffff ffffffff ffffffff ffffffff ffffffff ffffffff
ffff8e2301f33740 2184842792 C Bo:2:011:2 0 32 >
ffff8e2301f33740 2184842795 S Bo:2:011:2 -115 32 = ffffffff ffffffff ffffffff ffffffff ffffffff ffffffff ffffffff ffffffff
ffff8e2301f32240 2184845598 C Bo:2:011:2 0 32 >
ffff8e2301f32240 2184845603 S Bo:2:011:2 -115 4 = ffffffff
ffff8e2301f33740 2184848368 C Bo:2:011:2 0 32 >
ffff8e2301f32240 2184851099 C Bo:2:011:2 0 4 >
ffff8e2301f32e40 2184856462 C Bi:2:011:2 0 1 = 06
ffff8e2301f32e40 2184856466 S Bi:2:011:2 -115 32 <
ffff8e2301f32240 2184856815 S Bo:2:011:2 -115 32 = 57590080 ffffffff ffffffff ffffffff ffffffff ffffffff ffffffff ffffffff
ffff8e2301f33740 2184856818 S Bo:2:011:2 -115 32 = ffffffff ffffffff ffffffff ffffffff ffffffff ffffffff ffffffff ffffffff
ffff8e2301f32240 2184856876 C Bo:2:011:2 0 32 >
ffff8e2301f32240 2184856878 S Bo:2:011:2 -115 32 = ffffffff ffffffff ffffffff ffffffff ffffffff ffffffff ffffffff ffffffff
ffff8e2301f33740 2184856925 C Bo:2:011:2 0 32 >
ffff8e2301f33740 2184856927 S Bo:2:011:2 -115 32 = ffffffff ffffffff ffffffff ffffffff ffffffff ffffffff ffffffff ffffffff
ffff8e2301f32240 2184859742 C Bo:2:011:2 0 32 >
ffff8e2301f32240 2184859747 S Bo:2:011:2 -115 4 = ffffffff
ffff8e2301f33740 2184862484 C Bo:2:011:2 0 32 >
ffff8e2301f32240 2184865229 C Bo:2:011:2 0 4 >
ffff8e2301f326c0 2184870731 C Bi:2:011:2 0 1 = 06
ffff8e2301f326c0 2184870735 S Bi:2:011:2 -115 32 <
ffff8e2301f32240 2184871091 S Bo:2:011:2 -115 32 = 57598080 ffffffff ffffffff ffffffff ffffffff ffffffff ffffffff ffffffff
ffff8e2301f33740 2184871095 S Bo:2:011:2 -115 32 = ffffffff ffffffff ffffffff ffffffff ffffffff ffffffff ffffffff ffffffff
ffff8e2301f32240 2184871153 C Bo:2:011:2 0 32 >
ffff8e2301f32240 2184871156 S Bo:2:011:2 -115 32 = ffffffff ffffffff ffffffff ffffffff ffffffff ffffffff ffffffff ffffffff
ffff8e2301f33740 2184871207 C Bo:2:011:2 0 32 >
ffff8e2301f33740 2184871210 S Bo:2:011:2 -115 32 = ffffffff ffffffff ffffffff ffffffff ffffffff ffffffff ffffffff ffffffff
ffff8e2301f32240 2184874009 C Bo:2:011:2 0 32 >
ffff8e2301f32240 2184874014 S Bo:2:011:2 -115 4 = ffffffff
ffff8e2301f33740 2184876740 C Bo:2:011:2 0 32 >
ffff8e2301f32240 2184879503 C Bo:2:011:2 0 4 >
ffff8e2301f32e40 2184884937 C Bi:2:011:2 0 1 = 06
ffff8e2301f32e40 2184884941 S Bi:2:011:2 -115 32 <
ffff8e2301f32240 2184885229 S Bo:2:011:2 -115 32 = 575a0080 ffffffff ffffffff ffffffff ffffffff ffffffff ffffffff ffffffff
ffff8e2301f33740 2184885232 S Bo:2:011:2 -115 32 = ffffffff ffffffff ffffffff ffffffff ffffffff ffffffff ffffffff ffffffff
ffff8e2301f32240 2184885291 C Bo:2:011:2 0 32 >
ffff8e2301f32240 2184885294 S Bo:2:011:2 -115 32 = ffffffff ffffffff ffffffff ffffffff ffffffff ffffffff ffffffff ffffffff
ffff8e2301f33740 2184885340 C Bo:2:011:2 0 32 >
ffff8e2301f33740 2184885342 S Bo:2:011:2 -115 32 = ffffffff ffffffff ffffffff ffffffff ffffffff ffffffff ffffffff ffffffff
ffff8e2301f32240 2184888098 C Bo:2:011:2 0 32 >
ffff8e2301f32240 2184888103 S Bo:2:011:2 -115 4 = ffffffff
ffff8e2301f33740 2184890883 C Bo:2:011:2 0 32 >
ffff8e2301f32240 2184893734 C Bo:2:011:2 0 4 >
ffff8e2301f326c0 2184899121 C Bi:2:011:2 0 1 = 06
ffff8e2301f326c0 2184899126 S Bi:2:011:2 -115 32 <
ffff8e2301f32240 2184899434 S Bo:2:011:2 -115 32 = 575a8080 ffffffff ffffffff ffffffff ffffffff ffffffff ffffffff ffffffff
ffff8e2301f33740 2184899437 S Bo:2:011:2 -115 32 = ffffffff ffffffff ffffffff ffffffff ffffffff ffffffff ffffffff ffffffff
ffff8e2301f32240 2184899494 C Bo:2:011:2 0 32 >
ffff8e2301f32240 2184899497 S Bo:2:011:2 -115 32 = ffffffff ffffffff ffffffff ffffffff ffffffff ffffffff ffffffff ffffffff
ffff8e2301f33740 2184899544 C Bo:2:011:2 0 32 >
ffff8e2301f33740 2184899547 S Bo:2:011:2 -115 32 = ffffffff ffffffff ffffffff ffffffff ffffffff ffffffff ffffffff ffffffff
ffff8e2301f32240 2184902314 C Bo:2:011:2 0 32 >
ffff8e2301f32240 2184902318 S Bo:2:011:2 -115 4 = ffffffff
ffff8e2301f33740 2184905106 C Bo:2:011:2 0 32 >
ffff8e2302151980 2184906040 S Bo:2:002:2 -115 31 = 55534243 8e050000 00000000 00000600 00000000 00000000 00000000 000000
ffff8e2302151980 2184906060 C Bo:2:002:2 0 31 >
ffff8e2302151980 2184906064 S Bi:2:002:1 -115 13 <
ffff8e2302151980 2184906144 C Bi:2:002:1 0 13 = 55534253 8e050000 00000000 00
ffff8e2301f32240 2184907822 C Bo:2:011:2 0 4 >
ffff8e2301f32e40 2184913263 C Bi:2:011:2 0 1 = 06
ffff8e2301f32e40 2184913268 S Bi:2:011:2 -115 32 <
ffff8e2301f32240 2184913662 S Bo:2:011:2 -115 32 = 575b0080 ffffffff ffffffff ffffffff ffffffff ffffffff ffffffff ffffffff
ffff8e2301f33740 2184913665 S Bo:2:011:2 -115 32 = ffffffff ffffffff ffffffff ffffffff ffffffff ffffffff ffffffff ffffffff
ffff8e2301f32240 2184913745 C Bo:2:011:2 0 32 >
ffff8e2301f32240 2184913748 S Bo:2:011:2 -115 32 = ffffffff ffffffff ffffffff ffffffff ffffffff ffffffff ffffffff ffffffff
ffff8e2301f33740 2184913795 C Bo:2:011:2 0 32 >
ffff8e2301f33740 2184913798 S Bo:2:011:2 -115 32 = ffffffff ffffffff ffffffff ffffffff ffffffff ffffffff ffffffff ffffffff
ffff8e2301f32240 2184916598 C Bo:2:011:2 0 32 >
ffff8e2301f32240 2184916602 S Bo:2:011:2 -115 4 = ffffffff
ffff8e2301f33740 2184919386 C Bo:2:011:2 0 32 >
ffff8e2301f32240 2184922083 C Bo:2:011:2 0 4 >
ffff8e2301f326c0 2184927599 C Bi:2:011:2 0 1 = 06
ffff8e2301f326c0 2184927603 S Bi:2:011:2 -115 32 <
ffff8e2301f32240 2184927919 S Bo:2:011:2 -115 32 = 575b8080 ffffffff ffffffff ffffffff ffffffff ffffffff ffffffff ffffffff
ffff8e2301f33740 2184927922 S Bo:2:011:2 -115 32 = ffffffff ffffffff ffffffff ffffffff ffffffff ffffffff ffffffff ffffffff
ffff8e2301f32240 2184927984 C Bo:2:011:2 0 32 >
ffff8e2301f32240 2184927987 S Bo:2:011:2 -115 32 = ffffffff ffffffff ffffffff ffffffff ffffffff ffffffff ffffffff ffffffff
ffff8e2301f33740 2184928036 C Bo:2:011:2 0 32 >
ffff8e2301f33740 2184928039 S Bo:2:011:2 -115 32 = ffffffff ffffffff ffffffff ffffffff ffffffff ffffffff ffffffff ffffffff
ffff8e2301f32240 2184930814 C Bo:2:011:2 0 32 >
ffff8e2301f32240 2184930819 S Bo:2:011:2 -115 4 = ffffffff
ffff8e2301f33740 2184933608 C Bo:2:011:2 0 32 >
ffff8e2301f32240 2184936324 C Bo:2:011:2 0 4 >
ffff8e2301f32e40 2184941730 C Bi:2:011:2 0 1 = 06
ffff8e2301f32e40 2184941734 S Bi:2:011:2 -115 32 <
ffff8e2301f32240 2184942171 S Bo:2:011:2 -115 32 = 575c0080 ffffffff ffffffff ffffffff ffffffff ffffffff ffffffff ffffffff
ffff8e2301f33740 2184942174 S Bo:2:011:2 -115 32 = ffffffff ffffffff ffffffff ffffffff ffffffff ffffffff ffffffff ffffffff
ffff8e2301f32240 2184942233 C Bo:2:011:2 0 32 >
ffff8e2301f32240 2184942236 S Bo:2:011:2 -115 32 = ffffffff ffffffff ffffffff ffffffff ffffffff ffffffff ffffffff ffffffff
ffff8e2301f33740 2184942282 C Bo:2:011:2 0 32 >
ffff8e2301f33740 2184942284 S Bo:2:011:2 -115 32 = ffffffff ffffffff ffffffff ffffffff ffffffff ffffffff ffffffff ffffffff
ffff8e2301f32240 2184945034 C Bo:2:011:2 0 32 >
ffff8e2301f32240 2184945038 S Bo:2:011:2 -115 4 = ffffffff
ffff8e2301f33740 2184947815 C Bo:2:011:2 0 32 >
ffff8e2301f32240 2184950565 C Bo:2:011:2 0 4 >
ffff8e2301f326c0 2184956052 C Bi:2:011:2 0 1 = 06
ffff8e2301f326c0 2184956057 S Bi:2:011:2 -115 32 <
ffff8e2301f32240 2184956387 S Bo:2:011:2 -115 32 = 575c8080 ffffffff ffffffff ffffffff ffffffff ffffffff ffffffff ffffffff
ffff8e2301f33740 2184956390 S Bo:2:011:2 -115 32 = ffffffff ffffffff ffffffff ffffffff ffffffff ffffffff ffffffff ffffffff
ffff8e2301f32240 2184956448 C Bo:2:011:2 0 32 >
ffff8e2301f32240 2184956451 S Bo:2:011:2 -115 32 = ffffffff ffffffff ffffffff ffffffff ffffffff ffffffff ffffffff ffffffff
ffff8e2301f33740 2184956498 C Bo:2:011:2 0 32 >
ffff8e2301f33740 2184956500 S Bo:2:011:2 -115 32 = ffffffff ffffffff ffffffff ffffffff ffffffff ffffffff ffffffff ffffffff
ffff8e2301f32240 2184959256 C Bo:2:011:2 0 32 >
ffff8e2301f32240 2184959262 S Bo:2:011:2 -115 4 = ffffffff
ffff8e2301f33740 2184962053 C Bo:2:011:2 0 32 >
ffff8e2301f32240 2184964802 C Bo:2:011:2 0 4 >
ffff8e2301f32e40 2184970237 C Bi:2:011:2 0 1 = 06
ffff8e2301f32e40 2184970242 S Bi:2:011:2 -115 32 <
ffff8e2301f32240 2184970566 S Bo:2:011:2 -115 32 = 575d0080 ffffffff ffffffff ffffffff ffffffff ffffffff ffffffff ffffffff
ffff8e2301f33740 2184970570 S Bo:2:011:2 -115 32 = ffffffff ffffffff ffffffff ffffffff ffffffff ffffffff ffffffff ffffffff
ffff8e2301f32240 2184970628 C Bo:2:011:2 0 32 >
ffff8e2301f32240 2184970631 S Bo:2:011:2 -115 32 = ffffffff ffffffff ffffffff ffffffff ffffffff ffffffff ffffffff ffffffff
ffff8e2301f33740 2184970744 C Bo:2:011:2 0 32 >
ffff8e2301f33740 2184970749 S Bo:2:011:2 -115 32 = ffffffff ffffffff ffffffff ffffffff ffffffff ffffffff ffffffff ffffffff
ffff8e2301f32240 2184973459 C Bo:2:011:2 0 32 >
ffff8e2301f32240 2184973463 S Bo:2:011:2 -115 4 = ffffffff
ffff8e2301f33740 2184976224 C Bo:2:011:2 0 32 >
ffff8e2301f32240 2184978958 C Bo:2:011:2 0 4 >
ffff8e2301f326c0 2184984367 C Bi:2:011:2 0 1 = 06
ffff8e2301f326c0 2184984371 S Bi:2:011:2 -115 32 <
ffff8e2301f32240 2184984722 S Bo:2:011:2 -115 32 = 575d8080 ffffffff ffffffff ffffffff ffffffff ffffffff ffffffff ffffffff
ffff8e2301f33740 2184984725 S Bo:2:011:2 -115 32 = ffffffff ffffffff ffffffff ffffffff ffffffff ffffffff ffffffff ffffffff
ffff8e2301f32240 2184984783 C Bo:2:011:2 0 32 >
ffff8e2301f32240 2184984786 S Bo:2:011:2 -115 32 = ffffffff ffffffff ffffffff ffffffff ffffffff ffffffff ffffffff ffffffff
ffff8e2301f33740 2184984835 C Bo:2:011:2 0 32 >
ffff8e2301f33740 2184984837 S Bo:2:011:2 -115 32 = ffffffff ffffffff ffffffff ffffffff ffffffff ffffffff ffffffff ffffffff
ffff8e2301f32240 2184987620 C Bo:2:011:2 0 32 >
ffff8e2301f32240 2184987624 S Bo:2:011:2 -115 4 = ffffffff
ffff8e2301f33740 2184990395 C Bo:2:011:2 0 32 >
ffff8e2301f32240 2184993110 C Bo:2:011:2 0 4 >
ffff8e2301f32e40 2184998507 C Bi:2:011:2 0 1 = 06
ffff8e2301f32e40 2184998511 S Bi:2:011:2 -115 32 <
ffff8e2301f32240 2184998938 S Bo:2:011:2 -115 32 = 575e0080 ffffffff ffffffff ffffffff ffffffff ffffffff ffffffff ffffffff
ffff8e2301f33740 2184998941 S Bo:2:011:2 -115 32 = ffffffff ffffffff ffffffff ffffffff ffffffff ffffffff ffffffff ffffffff
ffff8e2301f32240 2184998999 C Bo:2:011:2 0 32 >
ffff8e2301f32240 2184999002 S Bo:2:011:2 -115 32 = ffffffff ffffffff ffffffff ffffffff ffffffff ffffffff ffffffff ffffffff
ffff8e2301f33740 2184999051 C Bo:2:011:2 0 32 >
ffff8e2301f33740 2184999055 S Bo:2:011:2 -115 32 = ffffffff ffffffff ffffffff ffffffff ffffffff ffffffff ffffffff ffffffff
ffff8e2301f32240 2185001816 C Bo:2:011:2 0 32 >
ffff8e2301f32240 2185001821 S Bo:2:011:2 -115 4 = ffffffff
ffff8e2301f33740 2185004608 C Bo:2:011:2 0 32 >
ffff8e2301f32240 2185007357 C Bo:2:011:2 0 4 >
ffff8e2301f326c0 2185012842 C Bi:2:011:2 0 1 = 06
ffff8e2301f326c0 2185012847 S Bi:2:011:2 -115 32 <
ffff8e2301f32240 2185013208 S Bo:2:011:2 -115 32 = 575e8080 ffffffff ffffffff ffffffff ffffffff ffffffff ffffffff ffffffff
ffff8e2301f33740 2185013211 S Bo:2:011:2 -115 32 = ffffffff ffffffff ffffffff ffffffff ffffffff ffffffff ffffffff ffffffff
ffff8e2301f32240 2185013269 C Bo:2:011:2 0 32 >
ffff8e2301f32240 2185013272 S Bo:2:011:2 -115 32 = ffffffff ffffffff ffffffff ffffffff ffffffff ffffffff ffffffff ffffffff
ffff8e2301f33740 2185013318 C Bo:2:011:2 0 32 >
ffff8e2301f33740 2185013320 S Bo:2:011:2 -115 32 = ffffffff ffffffff ffffffff ffffffff ffffffff ffffffff ffffffff ffffffff
ffff8e2301f32240 2185016099 C Bo:2:011:2 0 32 >
ffff8e2301f32240 2185016104 S Bo:2:011:2 -115 4 = ffffffff
ffff8e2301f33740 2185018883 C Bo:2:011:2 0 32 >
ffff8e2301f32240 2185021598 C Bo:2:011:2 0 4 >
ffff8e2301f32e40 2185026986 C Bi:2:011:2 0 1 = 06
ffff8e2301f32e40 2185026991 S Bi:2:011:2 -115 32 <
ffff8e2301f32240 2185027305 S Bo:2:011:2 -115 32 = 575f0080 ffffffff ffffffff ffffffff ffffffff ffffffff ffffffff ffffffff
ffff8e2301f33740 2185027309 S Bo:2:011:2 -115 32 = ffffffff ffffffff ffffffff ffffffff ffffffff ffffffff ffffffff ffffffff
ffff8e2301f32240 2185027366 C Bo:2:011:2 0 32 >
ffff8e2301f32240 2185027370 S Bo:2:011:2 -115 32 = ffffffff ffffffff ffffffff ffffffff ffffffff ffffffff ffffffff ffffffff
ffff8e2301f33740 2185027416 C Bo:2:011:2 0 32 >
ffff8e2301f33740 2185027419 S Bo:2:011:2 -115 32 = ffffffff ffffffff ffffffff ffffffff ffffffff ffffffff ffffffff ffffffff
ffff8e2301f32240 2185030180 C Bo:2:011:2 0 32 >
ffff8e2301f32240 2185030184 S Bo:2:011:2 -115 4 = ffffffff
ffff8e2301f33740 2185032960 C Bo:2:011:2 0 32 >
ffff8e2301f32240 2185035735 C Bo:2:011:2 0 4 >
ffff8e2301f326c0 2185041120 C Bi:2:011:2 0 1 = 06
ffff8e2301f326c0 2185041125 S Bi:2:011:2 -115 32 <
ffff8e2301f32240 2185041460 S Bo:2:011:2 -115 32 = 575f8080 ffffffff ffffffff ffffffff ffffffff ffffffff ffffffff ffffffff
ffff8e2301f33740 2185041463 S Bo:2:011:2 -115 32 = ffffffff ffffffff ffffffff ffffffff ffffffff ffffffff ffffffff ffffffff
ffff8e2301f32240 2185041521 C Bo:2:011:2 0 32 >
ffff8e2301f32240 2185041524 S Bo:2:011:2 -115 32 = ffffffff ffffffff ffffffff ffffffff ffffffff ffffffff ffffffff ffffffff
ffff8e2301f33740 2185041570 C Bo:2:011:2 0 32 >
ffff8e2301f33740 2185041572 S Bo:2:011:2 -115 32 = ffffffff ffffffff ffffffff ffffffff ffffffff ffffffff ffffffff ffffffff
ffff8e2301f32240 2185044385 C Bo:2:011:2 0 32 >
ffff8e2301f32240 2185044390 S Bo:2:011:2 -115 4 = ffffffff
ffff8e2301f33740 2185047098 C Bo:2:011:2 0 32 >
ffff8e2301f32240 2185049883 C Bo:2:011:2 0 4 >
ffff8e2301f32e40 2185055300 C Bi:2:011:2 0 1 = 06
ffff8e2301f32e40 2185055305 S Bi:2:011:2 -115 32 <
ffff8e2301f32240 2185055643 S Bo:2:011:2 -115 32 = 57600080 ffffffff ffffffff ffffffff ffffffff ffffffff ffffffff ffffffff
ffff8e2301f33740 2185055647 S Bo:2:011:2 -115 32 = ffffffff ffffffff ffffffff ffffffff ffffffff ffffffff ffffffff ffffffff
ffff8e2301f32240 2185055797 C Bo:2:011:2 0 32 >
ffff8e2301f32240 2185055801 S Bo:2:011:2 -115 32 = ffffffff ffffffff ffffffff ffffffff ffffffff ffffffff ffffffff ffffffff
ffff8e2301f33740 2185055845 C Bo:2:011:2 0 32 >
ffff8e2301f33740 2185055846 S Bo:2:011:2 -115 32 = ffffffff ffffffff ffffffff ffffffff ffffffff ffffffff ffffffff ffffffff
ffff8e2301f32240 2185058742 C Bo:2:011:2 0 32 >
ffff8e2301f32240 2185058747 S Bo:2:011:2 -115 4 = ffffffff
ffff8e2301f33740 2185061387 C Bo:2:011:2 0 32 >
ffff8e2301f32240 2185064131 C Bo:2:011:2 0 4 >
ffff8e2301f326c0 2185072188 C Bi:2:011:2 0 1 = 06
ffff8e2301f326c0 2185072193 S Bi:2:011:2 -115 32 <
ffff8e2301f32240 2185072540 S Bo:2:011:2 -115 32 = 57608080 ffffffff ffffffff ffffffff ffffffff ffffffff ffffffff ffffffff
ffff8e2301f33740 2185072543 S Bo:2:011:2 -115 32 = ffffffff ffffffff ffffffff ffffffff ffffffff ffffffff ffffffff ffffffff
ffff8e2301f32240 2185072608 C Bo:2:011:2 0 32 >
ffff8e2301f32240 2185072611 S Bo:2:011:2 -115 32 = ffffffff ffffffff ffffffff ffffffff ffffffff ffffffff ffffffff ffffffff
ffff8e2301f33740 2185072656 C Bo:2:011:2 0 32 >
ffff8e2301f33740 2185072659 S Bo:2:011:2 -115 32 = ffffffff ffffffff ffffffff ffffffff ffffffff ffffffff ffffffff ffffffff
ffff8e2301f32240 2185075459 C Bo:2:011:2 0 32 >
ffff8e2301f32240 2185075464 S Bo:2:011:2 -115 4 = ffffffff
ffff8e2301f33740 2185078245 C Bo:2:011:2 0 32 >
ffff8e2301f32240 2185080965 C Bo:2:011:2 0 4 >
ffff8e2301f32e40 2185086323 C Bi:2:011:2 0 1 = 06
ffff8e2301f32e40 2185086328 S Bi:2:011:2 -115 32 <
ffff8e2301f32240 2185086648 S Bo:2:011:2 -115 32 = 57610080 ffffffff ffffffff ffffffff ffffffff ffffffff ffffffff ffffffff
ffff8e2301f33740 2185086651 S Bo:2:011:2 -115 32 = ffffffff ffffffff ffffffff ffffffff ffffffff ffffffff ffffffff ffffffff
ffff8e2301f32240 2185086754 C Bo:2:011:2 0 32 >
ffff8e2301f32240 2185086757 S Bo:2:011:2 -115 32 = ffffffff ffffffff ffffffff ffffffff ffffffff ffffffff ffffffff ffffffff
ffff8e2301f33740 2185086805 C Bo:2:011:2 0 32 >
ffff8e2301f33740 2185086809 S Bo:2:011:2 -115 32 = ffffffff ffffffff ffffffff ffffffff ffffffff ffffffff ffffffff ffffffff
ffff8e2301f32240 2185089599 C Bo:2:011:2 0 32 >
ffff8e2301f32240 2185089604 S Bo:2:011:2 -115 4 = ffffffff
ffff8e2301f33740 2185092340 C Bo:2:011:2 0 32 >
ffff8e2301f32240 2185095110 C Bo:2:011:2 0 4 >
ffff8e2301f326c0 2185100463 C Bi:2:011:2 0 1 = 06
ffff8e2301f326c0 2185100467 S Bi:2:011:2 -115 32 <
ffff8e2301f32240 2185100804 S Bo:2:011:2 -115 32 = 57618080 ffffffff ffffffff ffffffff ffffffff ffffffff ffffffff ffffffff
ffff8e2301f33740 2185100807 S Bo:2:011:2 -115 32 = ffffffff ffffffff ffffffff ffffffff ffffffff ffffffff ffffffff ffffffff
ffff8e2301f32240 2185100864 C Bo:2:011:2 0 32 >
ffff8e2301f32240 2185100867 S Bo:2:011:2 -115 32 = ffffffff ffffffff ffffffff ffffffff ffffffff ffffffff ffffffff ffffffff
ffff8e2301f33740 2185100912 C Bo:2:011:2 0 32 >
ffff8e2301f33740 2185100915 S Bo:2:011:2 -115 32 = ffffffff ffffffff ffffffff ffffffff ffffffff ffffffff ffffffff ffffffff
ffff8e2301f32240 2185103799 C Bo:2:011:2 0 32 >
ffff8e2301f32240 2185103802 S Bo:2:011:2 -115 4 = ffffffff
ffff8e2301f33740 2185106459 C Bo:2:011:2 0 32 >
ffff8e2301f32240 2185109193 C Bo:2:011:2 0 4 >
ffff8e2301f32e40 2185114731 C Bi:2:011:2 0 1 = 06
ffff8e2301f32e40 2185114736 S Bi:2:011:2 -115 32 <
ffff8e2301f32240 2185115063 S Bo:2:011:2 -115 32 = 57620080 ffffffff ffffffff ffffffff ffffffff ffffffff ffffffff ffffffff
ffff8e2301f33740 2185115066 S Bo:2:011:2 -115 32 = ffffffff ffffffff ffffffff ffffffff ffffffff ffffffff ffffffff ffffffff
ffff8e2301f32240 2185115124 C Bo:2:011:2 0 32 >
ffff8e2301f32240 2185115127 S Bo:2:011:2 -115 32 = ffffffff ffffffff ffffffff ffffffff ffffffff ffffffff ffffffff ffffffff
ffff8e2301f33740 2185115171 C Bo:2:011:2 0 32 >
ffff8e2301f33740 2185115174 S Bo:2:011:2 -115 32 = ffffffff ffffffff ffffffff ffffffff ffffffff ffffffff ffffffff ffffffff
ffff8e2301f32240 2185117937 C Bo:2:011:2 0 32 >
ffff8e2301f32240 2185117942 S Bo:2:011:2 -115 4 = ffffffff
ffff8e2301f33740 2185120745 C Bo:2:011:2 0 32 >
ffff8e2301f32240 2185123458 C Bo:2:011:2 0 4 >
ffff8e2301f326c0 2185128938 C Bi:2:011:2 0 1 = 06
ffff8e2301f326c0 2185128942 S Bi:2:011:2 -115 32 <
ffff8e2301f32240 2185129252 S Bo:2:011:2 -115 32 = 57628080 ffffffff ffffffff ffffffff ffffffff ffffffff ffffffff ffffffff
ffff8e2301f33740 2185129256 S Bo:2:011:2 -115 32 = ffffffff ffffffff ffffffff ffffffff ffffffff ffffffff ffffffff ffffffff
ffff8e2301f32240 2185129314 C Bo:2:011:2 0 32 >
ffff8e2301f32240 2185129317 S Bo:2:011:2 -115 32 = ffffffff ffffffff ffffffff ffffffff ffffffff ffffffff ffffffff ffffffff
ffff8e2301f33740 2185129362 C Bo:2:011:2 0 32 >
ffff8e2301f33740 2185129365 S Bo:2:011:2 -115 32 = ffffffff ffffffff ffffffff ffffffff ffffffff ffffffff ffffffff ffffffff
ffff8e2301f32240 2185132176 C Bo:2:011:2 0 32 >
ffff8e2301f32240 2185132180 S Bo:2:011:2 -115 4 = ffffffff
ffff8e2301f33740 2185134959 C Bo:2:011:2 0 32 >
ffff8e2301f32240 2185137730 C Bo:2:011:2 0 4 >
ffff8e2301f32e40 2185143076 C Bi:2:011:2 0 1 = 06
ffff8e2301f32e40 2185143080 S Bi:2:011:2 -115 32 <
ffff8e2301f32240 2185143450 S Bo:2:011:2 -115 32 = 57630080 003f5823 006f5474 00000000 00000033 ffffffff 024f2d05 746f2b05
ffff8e2301f33740 2185143454 S Bo:2:011:2 -115 32 = ffffffff 002f5823 005f5474 00000000 00000033 ffffffff 024f2d05 746f2b06
ffff8e2301f32240 2185143511 C Bo:2:011:2 0 32 >
ffff8e2301f32240 2185143514 S Bo:2:011:2 -115 32 = ffffffff 001f5823 00005474 00000000 00000033 ffffffff 024f2d05 74ffffff
ffff8e2301f33740 2185143563 C Bo:2:011:2 0 32 >
ffff8e2301f33740 2185143565 S Bo:2:011:2 -115 32 = ffffffff 000f5823 00df5374 00000000 00000033 ffffffff 024f2d05 746f2d06
ffff8e2301f32240 2185146314 C Bo:2:011:2 0 32 >
ffff8e2301f32240 2185146319 S Bo:2:011:2 -115 4 = ffffffff
ffff8e2301f33740 2185149098 C Bo:2:011:2 0 32 >
ffff8e2301f32240 2185151838 C Bo:2:011:2 0 4 >
ffff8e2301f326c0 2185157438 C Bi:2:011:2 0 1 = 06
ffff8e2301f326c0 2185157443 S Bi:2:011:2 -115 32 <
ffff8e2301f32240 2185157780 S Bo:2:011:2 -115 32 = 57638080 007f5823 00cf5374 00000000 00000033 ffffffff 024f2d05 746f2d05
ffff8e2301f33740 2185157783 S Bo:2:011:2 -115 32 = ffffffff 00005923 003f5274 00000000 00000033 ffffffff 024f2d0e 726f2b05
ffff8e2301f32240 2185157840 C Bo:2:011:2 0 32 >
ffff8e2301f32240 2185157843 S Bo:2:011:2 -115 32 = ffffffff 00df5823 002f5274 00000000 00000033 ffffffff 024f2d0e 726f2b06
ffff8e2301f33740 2185157889 C Bo:2:011:2 0 32 >
ffff8e2301f33740 2185157891 S Bo:2:011:2 -115 32 = ffffffff 00cf5823 001f5274 00000000 00000033 ffffffff 024f2d0e 72ffffff
ffff8e2301f32240 2185160743 C Bo:2:011:2 0 32 >
ffff8e2301f32240 2185160747 S Bo:2:011:2 -115 4 = ffffffff
ffff8e2301f33740 2185163465 C Bo:2:011:2 0 32 >
ffff8e2301f32240 2185166210 C Bo:2:011:2 0 4 >
ffff8e2301f32e40 2185171732 C Bi:2:011:2 0 1 = 06
ffff8e2301f32e40 2185171735 S Bi:2:011:2 -115 32 <
ffff8e2301f32240 2185172174 S Bo:2:011:2 -115 32 = 57640080 003f5823 000f5274 00000000 00000033 ffffffff 024f2d0e 726f2d06
ffff8e2301f33740 2185172178 S Bo:2:011:2 -115 32 = ffffffff 002f5823 007f5274 00000000 00000033 ffffffff 024f2d0e 726f2d05
ffff8e2301f32240 2185172235 C Bo:2:011:2 0 32 >
ffff8e2301f32240 2185172238 S Bo:2:011:2 -115 32 = ffffffff 00005923 003f5274 00000000 00000033 ffffffff 024f2d0e 716f2b05
ffff8e2301f33740 2185172285 C Bo:2:011:2 0 32 >
ffff8e2301f33740 2185172288 S Bo:2:011:2 -115 32 = ffffffff 00df5823 002f5274 00000000 00000033 ffffffff 024f2d0e 716f2b06
ffff8e2301f32240 2185175107 C Bo:2:011:2 0 32 >
ffff8e2301f32240 2185175111 S Bo:2:011:2 -115 4 = ffffffff
ffff8e2301f33740 2185177816 C Bo:2:011:2 0 32 >
ffff8e2301f32240 2185180571 C Bo:2:011:2 0 4 >
ffff8e2301f326c0 2185186050 C Bi:2:011:2 0 1 = 06
ffff8e2301f326c0 2185186055 S Bi:2:011:2 -115 32 <
ffff8e2301f32240 2185186391 S Bo:2:011:2 -115 32 = 57648080 00cf5823 001f5274 00000000 00000033 ffffffff 024f2d0e 71ffffff
ffff8e2301f33740 2185186395 S Bo:2:011:2 -115 32 = ffffffff 003f5823 000f5274 00000000 00000033 ffffffff 024f2d0e 716f2d06
ffff8e2301f32240 2185186459 C Bo:2:011:2 0 32 >
ffff8e2301f32240 2185186462 S Bo:2:011:2 -115 32 = ffffffff 002f5823 007f5274 00000000 00000033 ffffffff 024f2d0e 716f2d05
ffff8e2301f33740 2185186508 C Bo:2:011:2 0 32 >
ffff8e2301f33740 2185186510 S Bo:2:011:2 -115 32 = ffffffff 003f5823 006f5974 00000000 00000033 ffffffff 054f2d06 7277201c
ffff8e2301f32240 2185189315 C Bo:2:011:2 0 32 >
ffff8e2301f32240 2185189320 S Bo:2:011:2 -115 4 = 71ffffff
ffff8e2301f33740 2185192031 C Bo:2:011:2 0 32 >
ffff8e2301f32240 2185194803 C Bo:2:011:2 0 4 >
ffff8e2301f32e40 2185200188 C Bi:2:011:2 0 1 = 06
ffff8e2301f32e40 2185200192 S Bi:2:011:2 -115 32 <
ffff8e2301f32240 2185200584 S Bo:2:011:2 -115 32 = 57650080 002f5823 005f5974 00000000 00000033 ffffffff 054f2d06 7277201c
ffff8e2301f33740 2185200587 S Bo:2:011:2 -115 32 = 72ffffff 001f5823 00005974 00000000 00000033 ffffffff 054f2d06 7277ffff
ffff8e2301f32240 2185200644 C Bo:2:011:2 0 32 >
ffff8e2301f32240 2185200647 S Bo:2:011:2 -115 32 = ffffffff 000f5823 00df5874 00000000 00000033 ffffffff 054f2d06 7277201a
ffff8e2301f33740 2185200760 C Bo:2:011:2 0 32 >
ffff8e2301f33740 2185200763 S Bo:2:011:2 -115 32 = 72ffffff 007f5823 00cf5874 00000000 00000033 ffffffff 054f2d06 7277201a
ffff8e2301f32240 2185203460 C Bo:2:011:2 0 32 >
ffff8e2301f32240 2185203464 S Bo:2:011:2 -115 4 = 71ffffff
ffff8e2301f33740 2185206244 C Bo:2:011:2 0 32 >
ffff8e2301f32240 2185208965 C Bo:2:011:2 0 4 >
ffff8e2301f326c0 2185214507 C Bi:2:011:2 0 1 = 06
ffff8e2301f326c0 2185214511 S Bi:2:011:2 -115 32 <
ffff8e2301f32240 2185214931 S Bo:2:011:2 -115 32 = 57658080 00c96674 00da5823 00000000 00000033 ffffffff 0b0e4472 10624974
ffff8e2301f33740 2185214935 S Bo:2:011:2 -115 32 = 0e6f2b05 00396674 00ca5823 00000000 00000033 ffffffff 0b0e4472 10624974
ffff8e2301f32240 2185214992 C Bo:2:011:2 0 32 >
ffff8e2301f32240 2185214995 S Bo:2:011:2 -115 32 = 0e6f2b06 00296674 003a5823 00000000 00000033 ffffffff 0b0e4472 10624974
ffff8e2301f33740 2185215041 C Bo:2:011:2 0 32 >
ffff8e2301f33740 2185215044 S Bo:2:011:2 -115 32 = 0effffff 00196674 002a5823 00000000 00000033 ffffffff 0b0e4472 10624974
ffff8e2301f32240 2185217816 C Bo:2:011:2 0 32 >
ffff8e2301f32240 2185217819 S Bo:2:011:2 -115 4 = 0e6f2d06
ffff8e2301f33740 2185220564 C Bo:2:011:2 0 32 >
ffff8e2301f32240 2185223334 C Bo:2:011:2 0 4 >
ffff8e2301f32e40 2185228844 C Bi:2:011:2 0 1 = 06
ffff8e2301f32e40 2185228847 S Bi:2:011:2 -115 32 <
ffff8e2301f32240 2185229191 S Bo:2:011:2 -115 32 = 57660080 00096674 001a5823 00000000 00000033 ffffffff 0b0e4472 10624974
ffff8e2301f33740 2185229195 S Bo:2:011:2 -115 32 = 0e6f2d05 004a6974 000a5923 00000000 00000033 ffffffff 0b0e4472 10625217
ffff8e2301f32240 2185229252 C Bo:2:011:2 0 32 >
ffff8e2301f32240 2185229253 S Bo:2:011:2 -115 32 = 687dffff 00da6874 007a5923 00000000 00000033 ffffffff 0b0e4472 10625217
ffff8e2301f33740 2185229300 C Bo:2:011:2 0 32 >
ffff8e2301f33740 2185229301 S Bo:2:011:2 -115 32 = 687effff 00ca6874 006a5923 00000000 00000033 ffffffff 0b0e4472 106252ff
ffff8e2301f32240 2185232084 C Bo:2:011:2 0 32 >
ffff8e2301f32240 2185232086 S Bo:2:011:2 -115 4 = ffffffff
ffff8e2301f33740 2185234823 C Bo:2:011:2 0 32 >
ffff8e2301f32240 2185237598 C Bo:2:011:2 0 4 >
ffff8e2301f326c0 2185243163 C Bi:2:011:2 0 1 = 06
ffff8e2301f326c0 2185243165 S Bi:2:011:2 -115 32 <
ffff8e2301f32240 2185243539 S Bo:2:011:2 -115 32 = 57668080 003a6874 005a5923 00000000 00000033 ffffffff 0b0e4472 10625217
ffff8e2301f33740 2185243543 S Bo:2:011:2 -115 32 = 6e7effff 002a6874 004a5923 00000000 00000033 ffffffff 0b0e4472 10625217
ffff8e2301f32240 2185243608 C Bo:2:011:2 0 32 >
ffff8e2301f32240 2185243608 S Bo:2:011:2 -115 32 = 6e7dffff 007a5923 00da7774 00000000 00000033 ffffffff 0f064c76 431c4163
ffff8e2301f33740 2185243656 C Bo:2:011:2 0 32 >
ffff8e2301f33740 2185243657 S Bo:2:011:2 -115 32 = 716f2b05 006a5923 00ca7774 00000000 00000033 ffffffff 0f064c76 431c4163
ffff8e2301f32240 2185246459 C Bo:2:011:2 0 32 >
ffff8e2301f32240 2185246461 S Bo:2:011:2 -115 4 = 716f2b06
ffff8e2301f33740 2185249208 C Bo:2:011:2 0 32 >
ffff8e2301f32240 2185251935 C Bo:2:011:2 0 4 >
ffff8e2301f32e40 2185257462 C Bi:2:011:2 0 1 = 06
ffff8e2301f32e40 2185257464 S Bi:2:011:2 -115 32 <
ffff8e2301f32240 2185257837 S Bo:2:011:2 -115 32 = 57670080 005a5923 003a7774 00000000 00000033 ffffffff 0f064c76 431c4163
ffff8e2301f33740 2185257841 S Bo:2:011:2 -115 32 = 71ffffff 004a5923 002a7774 00000000 00000033 ffffffff 0f064c76 431c4163
ffff8e2301f32240 2185257897 C Bo:2:011:2 0 32 >
ffff8e2301f32240 2185257897 S Bo:2:011:2 -115 32 = 716f2d06 00da5823 001a7774 00000000 00000033 ffffffff 0f064c76 431c4163
ffff8e2301f33740 2185257945 C Bo:2:011:2 0 32 >
ffff8e2301f33740 2185257945 S Bo:2:011:2 -115 32 = 716f2d05 006f5923 006f7574 00008532 00000033 ffffffff 134f2d06 737e201c
ffff8e2301f32240 2185260746 C Bo:2:011:2 0 32 >
ffff8e2301f32240 2185260748 S Bo:2:011:2 -115 4 = 71ffffff
ffff8e2301f33740 2185263528 C Bo:2:011:2 0 32 >
ffff8e2301f32240 2185266224 C Bo:2:011:2 0 4 >
ffff8e2301f326c0 2185271820 C Bi:2:011:2 0 1 = 06
ffff8e2301f326c0 2185271822 S Bi:2:011:2 -115 32 <
ffff8e2301f32240 2185272201 S Bo:2:011:2 -115 32 = 57678080 005f5923 005f7574 00008532 00000033 ffffffff 134f2d06 737e201c
ffff8e2301f33740 2185272205 S Bo:2:011:2 -115 32 = 72ffffff 00005923 00007574 00008532 00000033 ffffffff 134f2d06 737effff
ffff8e2301f32240 2185272261 C Bo:2:011:2 0 32 >
ffff8e2301f32240 2185272262 S Bo:2:011:2 -115 32 = ffffffff 00df5823 00df7474 00008532 00000033 ffffffff 134f2d06 737e201a
ffff8e2301f33740 2185272310 C Bo:2:011:2 0 32 >
ffff8e2301f33740 2185272311 S Bo:2:011:2 -115 32 = 72ffffff 00cf5823 00cf7474 00008532 00000033 ffffffff 134f2d06 737e201a
ffff8e2301f32240 2185275110 C Bo:2:011:2 0 32 >
ffff8e2301f32240 2185275111 S Bo:2:011:2 -115 4 = 71ffffff
ffff8e2301f33740 2185277886 C Bo:2:011:2 0 32 >
ffff8e2301f32240 2185280612 C Bo:2:011:2 0 4 >
ffff8e2301f32e40 2185286098 C Bi:2:011:2 0 1 = 06
ffff8e2301f32e40 2185286100 S Bi:2:011:2 -115 32 <
ffff8e2301f32240 2185286409 S Bo:2:011:2 -115 32 = 57680080 003f5823 006f6874 00009e35 00000033 ffffffff 104f2d02 736f2b05
ffff8e2301f33740 2185286412 S Bo:2:011:2 -115 32 = ffffffff 002f5823 005f6874 00009e35 00000033 ffffffff 104f2d02 736f2b06
ffff8e2301f32240 2185286469 C Bo:2:011:2 0 32 >
ffff8e2301f32240 2185286470 S Bo:2:011:2 -115 32 = ffffffff 001f5823 00006874 00009e35 00000033 ffffffff 104f2d02 73ffffff
ffff8e2301f33740 2185286518 C Bo:2:011:2 0 32 >
ffff8e2301f33740 2185286519 S Bo:2:011:2 -115 32 = ffffffff 000f5823 00df6774 00009e35 00000033 ffffffff 104f2d02 736f2d06
ffff8e2301f32240 2185289318 C Bo:2:011:2 0 32 >
ffff8e2301f32240 2185289319 S Bo:2:011:2 -115 4 = ffffffff
ffff8e2301f33740 2185292100 C Bo:2:011:2 0 32 >
ffff8e2301f32240 2185294824 C Bo:2:011:2 0 4 >
ffff8e2301f326c0 2185300278 C Bi:2:011:2 0 1 = 06
ffff8e2301f326c0 2185300280 S Bi:2:011:2 -115 32 <
ffff8e2301f32240 2185300611 S Bo:2:011:2 -115 32 = 57688080 007f5823 00cf6774 00009e35 00000033 ffffffff 104f2d02 736f2d05
ffff8e2301f33740 2185300614 S Bo:2:011:2 -115 32 = ffffffff 000a5923 000a7074 00000000 00000033 ffffffff 16195366 6e1c4163
ffff8e2301f32240 2185300738 C Bo:2:011:2 0 32 >
ffff8e2301f32240 2185300739 S Bo:2:011:2 -115 32 = 636432ff 007a5923 007a7074 00000000 00000033 ffffffff 16195366 6e1c4163
ffff8e2301f33740 2185300786 C Bo:2:011:2 0 32 >
ffff8e2301f33740 2185300787 S Bo:2:011:2 -115 32 = 636431ff 006a5923 006a7074 00000000 00000033 ffffffff 16195366 6e1c4163
ffff8e2301f32240 2185303610 C Bo:2:011:2 0 32 >
ffff8e2301f32240 2185303611 S Bo:2:011:2 -115 4 = ffffffff
ffff8e2301f33740 2185306313 C Bo:2:011:2 0 32 >
ffff8e2301f32240 2185309098 C Bo:2:011:2 0 4 >
ffff8e2301f32e40 2185314597 C Bi:2:011:2 0 1 = 06
ffff8e2301f32e40 2185314599 S Bi:2:011:2 -115 32 <
ffff8e2301f32240 2185314942 S Bo:2:011:2 -115 32 = 57690080 005a5923 005a7074 00000000 00000033 ffffffff 16195366 6e1c4163
ffff8e2301f33740 2185314946 S Bo:2:011:2 -115 32 = 636231ff 004a5923 004a7074 00000000 00000033 ffffffff 16195366 6e1c4163
ffff8e2301f32240 2185315002 C Bo:2:011:2 0 32 >
ffff8e2301f32240 2185315004 S Bo:2:011:2 -115 32 = 636232ff ffffffff ffffffff ffffffff ffffffff ffffffff ffffffff ffffffff
ffff8e2301f33740 2185315051 C Bo:2:011:2 0 32 >
ffff8e2301f33740 2185315052 S Bo:2:011:2 -115 32 = ffffffff ffffffff ffffffff ffffffff ffffffff ffffffff ffffffff ffffffff
ffff8e2301f32240 2185317816 C Bo:2:011:2 0 32 >
ffff8e2301f32240 2185317818 S Bo:2:011:2 -115 4 = ffffffff
ffff8e2301f33740 2185320633 C Bo:2:011:2 0 32 >
ffff8e2301f32240 2185323334 C Bo:2:011:2 0 4 >
ffff8e2301f326c0 2185328730 C Bi:2:011:2 0 1 = 06
ffff8e2301f326c0 2185328732 S Bi:2:011:2 -115 32 <
ffff8e2301f32240 2185329162 S Bo:2:011:2 -115 32 = 57698080 ffffffff ffffffff ffffffff ffffffff ffffffff ffffffff ffffffff
ffff8e2301f33740 2185329165 S Bo:2:011:2 -115 32 = ffffffff ffffffff ffffffff ffffffff ffffffff ffffffff ffffffff ffffffff
ffff8e2301f32240 2185329222 C Bo:2:011:2 0 32 >
ffff8e2301f32240 2185329223 S Bo:2:011:2 -115 32 = ffffffff ffffffff ffffffff ffffffff ffffffff ffffffff ffffffff ffffffff
ffff8e2301f33740 2185329269 C Bo:2:011:2 0 32 >
ffff8e2301f33740 2185329270 S Bo:2:011:2 -115 32 = ffffffff ffffffff ffffffff ffffffff ffffffff ffffffff ffffffff ffffffff
ffff8e2301f32240 2185332063 C Bo:2:011:2 0 32 >
ffff8e2301f32240 2185332065 S Bo:2:011:2 -115 4 = ffffffff
ffff8e2301f33740 2185334814 C Bo:2:011:2 0 32 >
ffff8e2301f32240 2185337551 C Bo:2:011:2 0 4 >
ffff8e2301f32e40 2185343077 C Bi:2:011:2 0 1 = 06
ffff8e2301f32e40 2185343079 S Bi:2:011:2 -115 32 <
ffff8e2301f32240 2185343448 S Bo:2:011:2 -115 32 = 576a0080 ffffffff ffffffff ffffffff ffffffff ffffffff ffffffff ffffffff
ffff8e2301f33740 2185343452 S Bo:2:011:2 -115 32 = ffffffff ffffffff ffffffff ffffffff ffffffff ffffffff ffffffff ffffffff
ffff8e2301f32240 2185343508 C Bo:2:011:2 0 32 >
ffff8e2301f32240 2185343509 S Bo:2:011:2 -115 32 = ffffffff ffffffff ffffffff ffffffff ffffffff ffffffff ffffffff ffffffff
ffff8e2301f33740 2185343564 C Bo:2:011:2 0 32 >
ffff8e2301f33740 2185343564 S Bo:2:011:2 -115 32 = ffffffff ffffffff ffffffff ffffffff ffffffff ffffffff ffffffff ffffffff
ffff8e2301f32240 2185346316 C Bo:2:011:2 0 32 >
ffff8e2301f32240 2185346318 S Bo:2:011:2 -115 4 = ffffffff
ffff8e2301f33740 2185349099 C Bo:2:011:2 0 32 >
ffff8e2301f32240 2185351837 C Bo:2:011:2 0 4 >
ffff8e2301f326c0 2185357210 C Bi:2:011:2 0 1 = 06
ffff8e2301f326c0 2185357213 S Bi:2:011:2 -115 32 <
ffff8e2301f32240 2185357606 S Bo:2:011:2 -115 32 = 576a8080 ffffffff ffffffff ffffffff ffffffff ffffffff ffffffff ffffffff
ffff8e2301f33740 2185357609 S Bo:2:011:2 -115 32 = ffffffff ffffffff ffffffff ffffffff ffffffff ffffffff ffffffff ffffffff
ffff8e2301f32240 2185357755 C Bo:2:011:2 0 32 >
ffff8e2301f32240 2185357757 S Bo:2:011:2 -115 32 = ffffffff ffffffff ffffffff ffffffff ffffffff ffffffff ffffffff ffffffff
ffff8e2301f33740 2185357805 C Bo:2:011:2 0 32 >
ffff8e2301f33740 2185357806 S Bo:2:011:2 -115 32 = ffffffff ffffffff ffffffff ffffffff ffffffff ffffffff ffffffff ffffffff
ffff8e2301f32240 2185360587 C Bo:2:011:2 0 32 >
ffff8e2301f32240 2185360589 S Bo:2:011:2 -115 4 = ffffffff
ffff8e2301f33740 2185363333 C Bo:2:011:2 0 32 >
ffff8e2301f32240 2185366083 C Bo:2:011:2 0 4 >
ffff8e2301f32e40 2185371507 C Bi:2:011:2 0 1 = 06
ffff8e2301f32e40 2185371509 S Bi:2:011:2 -115 32 <
ffff8e2301f32240 2185371849 S Bo:2:011:2 -115 32 = 576b0080 ffffffff ffffffff ffffffff ffffffff ffffffff ffffffff ffffffff
ffff8e2301f33740 2185371852 S Bo:2:011:2 -115 32 = ffffffff ffffffff ffffffff ffffffff ffffffff ffffffff ffffffff ffffffff
ffff8e2301f32240 2185371909 C Bo:2:011:2 0 32 >
ffff8e2301f32240 2185371910 S Bo:2:011:2 -115 32 = ffffffff ffffffff ffffffff ffffffff ffffffff ffffffff ffffffff ffffffff
ffff8e2301f33740 2185371958 C Bo:2:011:2 0 32 >
ffff8e2301f33740 2185371959 S Bo:2:011:2 -115 32 = ffffffff ffffffff ffffffff ffffffff ffffffff ffffffff ffffffff ffffffff
ffff8e2301f32240 2185374744 C Bo:2:011:2 0 32 >
ffff8e2301f32240 2185374746 S Bo:2:011:2 -115 4 = ffffffff
ffff8e2301f33740 2185377549 C Bo:2:011:2 0 32 >
ffff8e2301f32240 2185380270 C Bo:2:011:2 0 4 >
ffff8e2301f326c0 2185385730 C Bi:2:011:2 0 1 = 06
ffff8e2301f326c0 2185385732 S Bi:2:011:2 -115 32 <
ffff8e2301f32240 2185386087 S Bo:2:011:2 -115 32 = 576b8080 ffffffff ffffffff ffffffff ffffffff ffffffff ffffffff ffffffff
ffff8e2301f33740 2185386090 S Bo:2:011:2 -115 32 = ffffffff ffffffff ffffffff ffffffff ffffffff ffffffff ffffffff ffffffff
ffff8e2301f32240 2185386146 C Bo:2:011:2 0 32 >
ffff8e2301f32240 2185386147 S Bo:2:011:2 -115 32 = ffffffff ffffffff ffffffff ffffffff ffffffff ffffffff ffffffff ffffffff
ffff8e2301f33740 2185386195 C Bo:2:011:2 0 32 >
ffff8e2301f33740 2185386196 S Bo:2:011:2 -115 32 = ffffffff ffffffff ffffffff ffffffff ffffffff ffffffff ffffffff ffffffff
ffff8e2301f32240 2185388960 C Bo:2:011:2 0 32 >
ffff8e2301f32240 2185388962 S Bo:2:011:2 -115 4 = ffffffff
ffff8e2301f33740 2185391788 C Bo:2:011:2 0 32 >
ffff8e2301f32240 2185394505 C Bo:2:011:2 0 4 >
ffff8e2301f32e40 2185400009 C Bi:2:011:2 0 1 = 06
ffff8e2301f32e40 2185400011 S Bi:2:011:2 -115 32 <
ffff8e2301f32240 2185400355 S Bo:2:011:2 -115 32 = 576c0080 ffffffff ffffffff ffffffff ffffffff ffffffff ffffffff ffffffff
ffff8e2301f33740 2185400358 S Bo:2:011:2 -115 32 = ffffffff ffffffff ffffffff ffffffff ffffffff ffffffff ffffffff ffffffff
ffff8e2301f32240 2185400415 C Bo:2:011:2 0 32 >
ffff8e2301f32240 2185400416 S Bo:2:011:2 -115 32 = ffffffff ffffffff ffffffff ffffffff ffffffff ffffffff ffffffff ffffffff
ffff8e2301f33740 2185400463 C Bo:2:011:2 0 32 >
ffff8e2301f33740 2185400464 S Bo:2:011:2 -115 32 = ffffffff ffffffff ffffffff ffffffff ffffffff ffffffff ffffffff ffffffff
ffff8e2301f32240 2185403258 C Bo:2:011:2 0 32 >
ffff8e2301f32240 2185403259 S Bo:2:011:2 -115 4 = ffffffff
ffff8e2301f33740 2185406029 C Bo:2:011:2 0 32 >
ffff8e2301f32240 2185408778 C Bo:2:011:2 0 4 >
ffff8e2301f326c0 2185414142 C Bi:2:011:2 0 1 = 06
ffff8e2301f326c0 2185414144 S Bi:2:011:2 -115 32 <
ffff8e2301f32240 2185414446 S Bo:2:011:2 -115 32 = 576c8080 ffffffff ffffffff ffffffff ffffffff ffffffff ffffffff ffffffff
ffff8e2301f33740 2185414449 S Bo:2:011:2 -115 32 = ffffffff ffffffff ffffffff ffffffff ffffffff ffffffff ffffffff ffffffff
ffff8e2301f32240 2185414505 C Bo:2:011:2 0 32 >
ffff8e2301f32240 2185414507 S Bo:2:011:2 -115 32 = ffffffff ffffffff ffffffff ffffffff ffffffff ffffffff ffffffff ffffffff
ffff8e2301f33740 2185414562 C Bo:2:011:2 0 32 >
ffff8e2301f33740 2185414563 S Bo:2:011:2 -115 32 = ffffffff ffffffff ffffffff ffffffff ffffffff ffffffff ffffffff ffffffff
ffff8e2301f32240 2185417326 C Bo:2:011:2 0 32 >
ffff8e2301f32240 2185417328 S Bo:2:011:2 -115 4 = ffffffff
ffff8e2301f33740 2185420155 C Bo:2:011:2 0 32 >
ffff8e2301f32240 2185422871 C Bo:2:011:2 0 4 >
ffff8e2301f32e40 2185428285 C Bi:2:011:2 0 1 = 06
ffff8e2301f32e40 2185428288 S Bi:2:011:2 -115 32 <
ffff8e2301f32240 2185428594 S Bo:2:011:2 -115 32 = 576d0080 ffffffff ffffffff ffffffff ffffffff ffffffff ffffffff ffffffff
ffff8e2301f33740 2185428597 S Bo:2:011:2 -115 32 = ffffffff ffffffff ffffffff ffffffff ffffffff ffffffff ffffffff ffffffff
ffff8e2301f32240 2185428654 C Bo:2:011:2 0 32 >
ffff8e2301f32240 2185428655 S Bo:2:011:2 -115 32 = ffffffff ffffffff ffffffff ffffffff ffffffff ffffffff ffffffff ffffffff
ffff8e2301f33740 2185428755 C Bo:2:011:2 0 32 >
ffff8e2301f33740 2185428756 S Bo:2:011:2 -115 32 = ffffffff ffffffff ffffffff ffffffff ffffffff ffffffff ffffffff ffffffff
ffff8e2301f32240 2185431467 C Bo:2:011:2 0 32 >
ffff8e2301f32240 2185431469 S Bo:2:011:2 -115 4 = ffffffff
ffff8e2301f33740 2185434244 C Bo:2:011:2 0 32 >
ffff8e2301f32240 2185437012 C Bo:2:011:2 0 4 >
ffff8e2301f326c0 2185442463 C Bi:2:011:2 0 1 = 06
ffff8e2301f326c0 2185442465 S Bi:2:011:2 -115 32 <
ffff8e2301f32240 2185442791 S Bo:2:011:2 -115 32 = 576d8080 ffffffff ffffffff ffffffff ffffffff ffffffff ffffffff ffffffff
ffff8e2301f33740 2185442795 S Bo:2:011:2 -115 32 = ffffffff ffffffff ffffffff ffffffff ffffffff ffffffff ffffffff ffffffff
ffff8e2301f32240 2185442859 C Bo:2:011:2 0 32 >
ffff8e2301f32240 2185442860 S Bo:2:011:2 -115 32 = ffffffff ffffffff ffffffff ffffffff ffffffff ffffffff ffffffff ffffffff
ffff8e2301f33740 2185442908 C Bo:2:011:2 0 32 >
ffff8e2301f33740 2185442909 S Bo:2:011:2 -115 32 = ffffffff ffffffff ffffffff ffffffff ffffffff ffffffff ffffffff ffffffff
ffff8e2301f32240 2185445744 C Bo:2:011:2 0 32 >
ffff8e2301f32240 2185445746 S Bo:2:011:2 -115 4 = ffffffff
ffff8e2301f33740 2185448459 C Bo:2:011:2 0 32 >
ffff8e2301f32240 2185451193 C Bo:2:011:2 0 4 >
ffff8e2301f32e40 2185456597 C Bi:2:011:2 0 1 = 06
ffff8e2301f32e40 2185456599 S Bi:2:011:2 -115 32 <
ffff8e2301f32240 2185456973 S Bo:2:011:2 -115 32 = 576e0080 ffffffff ffffffff ffffffff ffffffff ffffffff ffffffff ffffffff
ffff8e2301f33740 2185456976 S Bo:2:011:2 -115 32 = ffffffff ffffffff ffffffff ffffffff ffffffff ffffffff ffffffff ffffffff
ffff8e2301f32240 2185457034 C Bo:2:011:2 0 32 >
ffff8e2301f32240 2185457035 S Bo:2:011:2 -115 32 = ffffffff ffffffff ffffffff ffffffff ffffffff ffffffff ffffffff ffffffff
ffff8e2301f33740 2185457084 C Bo:2:011:2 0 32 >
ffff8e2301f33740 2185457085 S Bo:2:011:2 -115 32 = ffffffff ffffffff ffffffff ffffffff ffffffff ffffffff ffffffff ffffffff
ffff8e2301f32240 2185459890 C Bo:2:011:2 0 32 >
ffff8e2301f32240 2185459892 S Bo:2:011:2 -115 4 = ffffffff
ffff8e2301f33740 2185462610 C Bo:2:011:2 0 32 >
ffff8e2301f32240 2185465380 C Bo:2:011:2 0 4 >
ffff8e2301f326c0 2185470723 C Bi:2:011:2 0 1 = 06
ffff8e2301f326c0 2185470725 S Bi:2:011:2 -115 32 <
ffff8e2301f32240 2185471083 S Bo:2:011:2 -115 32 = 576e8080 ffffffff ffffffff ffffffff ffffffff ffffffff ffffffff ffffffff
ffff8e2301f33740 2185471087 S Bo:2:011:2 -115 32 = ffffffff ffffffff ffffffff ffffffff ffffffff ffffffff ffffffff ffffffff
ffff8e2301f32240 2185471143 C Bo:2:011:2 0 32 >
ffff8e2301f32240 2185471145 S Bo:2:011:2 -115 32 = ffffffff ffffffff ffffffff ffffffff ffffffff ffffffff ffffffff ffffffff
ffff8e2301f33740 2185471192 C Bo:2:011:2 0 32 >
ffff8e2301f33740 2185471193 S Bo:2:011:2 -115 32 = ffffffff ffffffff ffffffff ffffffff ffffffff ffffffff ffffffff ffffffff
ffff8e2301f32240 2185473983 C Bo:2:011:2 0 32 >
ffff8e2301f32240 2185473985 S Bo:2:011:2 -115 4 = ffffffff
ffff8e2301f33740 2185476746 C Bo:2:011:2 0 32 >
ffff8e2301f32240 2185479459 C Bo:2:011:2 0 4 >
ffff8e2301f32e40 2185484890 C Bi:2:011:2 0 1 = 06
ffff8e2301f32e40 2185484892 S Bi:2:011:2 -115 32 <
ffff8e2301f32240 2185485273 S Bo:2:011:2 -115 32 = 576f0080 ffffffff ffffffff ffffffff ffffffff ffffffff ffffffff ffffffff
ffff8e2301f33740 2185485277 S Bo:2:011:2 -115 32 = ffffffff ffffffff ffffffff ffffffff ffffffff ffffffff ffffffff ffffffff
ffff8e2301f32240 2185485335 C Bo:2:011:2 0 32 >
ffff8e2301f32240 2185485337 S Bo:2:011:2 -115 32 = ffffffff ffffffff ffffffff ffffffff ffffffff ffffffff ffffffff ffffffff
ffff8e2301f33740 2185485384 C Bo:2:011:2 0 32 >
ffff8e2301f33740 2185485385 S Bo:2:011:2 -115 32 = ffffffff 664e7635 664e7635 00000000 00000033 ffffffff 430d2007 72ffffff
ffff8e2301f32240 2185488156 C Bo:2:011:2 0 32 >
ffff8e2301f32240 2185488158 S Bo:2:011:2 -115 4 = ffffffff
ffff8e2301f33740 2185490959 C Bo:2:011:2 0 32 >
ffff8e2301f32240 2185493731 C Bo:2:011:2 0 4 >
ffff8e2301f326c0 2185499211 C Bi:2:011:2 0 1 = 06
ffff8e2301f326c0 2185499213 S Bi:2:011:2 -115 32 <
ffff8e2301f32240 2185499578 S Bo:2:011:2 -115 32 = 576f8080 665e7635 665e7635 00000000 00000033 ffffffff 430d2007 71ffffff
ffff8e2301f33740 2185499581 S Bo:2:011:2 -115 32 = ffffffff 666e7635 666e7635 00000000 00000033 ffffffff 430d2007 70ffffff
ffff8e2301f32240 2185499637 C Bo:2:011:2 0 32 >
ffff8e2301f32240 2185499638 S Bo:2:011:2 -115 32 = ffffffff 667e7635 667e7635 00000000 00000033 ffffffff 430d2007 77ffffff
ffff8e2301f33740 2185499754 C Bo:2:011:2 0 32 >
ffff8e2301f33740 2185499755 S Bo:2:011:2 -115 32 = ffffffff 660e7635 660e7635 00000000 00000033 ffffffff 430d2007 76ffffff
ffff8e2301f32240 2185502461 C Bo:2:011:2 0 32 >
ffff8e2301f32240 2185502462 S Bo:2:011:2 -115 4 = ffffffff
ffff8e2301f33740 2185505247 C Bo:2:011:2 0 32 >
ffff8e2301f32240 2185507985 C Bo:2:011:2 0 4 >
ffff8e2301f32e40 2185513553 C Bi:2:011:2 0 1 = 06
ffff8e2301f32e40 2185513554 S Bi:2:011:2 -115 32 <
ffff8e2301f32240 2185513968 S Bo:2:011:2 -115 32 = 57700080 661e7635 661e7635 00000000 00000033 ffffffff 430d2007 75ffffff
ffff8e2301f33740 2185513972 S Bo:2:011:2 -115 32 = ffffffff 662e7635 662e7635 00000000 00000033 ffffffff 430d2007 74ffffff
ffff8e2301f32240 2185514028 C Bo:2:011:2 0 32 >
ffff8e2301f32240 2185514029 S Bo:2:011:2 -115 32 = ffffffff 663e7635 663e7635 00000000 00000033 ffffffff 430b2007 7bffffff
ffff8e2301f33740 2185514083 C Bo:2:011:2 0 32 >
ffff8e2301f33740 2185514084 S Bo:2:011:2 -115 32 = ffffffff 66ce7635 66ce7635 00000000 00000033 ffffffff 430d2007 7affffff
ffff8e2301f32240 2185516887 C Bo:2:011:2 0 32 >
ffff8e2301f32240 2185516889 S Bo:2:011:2 -115 4 = ffffffff
ffff8e2301f33740 2185519610 C Bo:2:011:2 0 32 >
ffff8e2301f32240 2185522380 C Bo:2:011:2 0 4 >
ffff8e2301f326c0 2185530233 C Bi:2:011:2 0 1 = 06
ffff8e2301f326c0 2185530235 S Bi:2:011:2 -115 32 <
ffff8e2301f32240 2185530569 S Bo:2:011:2 -115 32 = 57708080 66de7635 66de7635 00000000 00000033 ffffffff 430d2006 73ffffff
ffff8e2301f33740 2185530573 S Bo:2:011:2 -115 32 = ffffffff 664e7735 664e7735 00000000 00000033 ffffffff 430d2006 72ffffff
ffff8e2301f32240 2185530629 C Bo:2:011:2 0 32 >
ffff8e2301f32240 2185530630 S Bo:2:011:2 -115 32 = ffffffff 665e7735 665e7735 00000000 00000033 ffffffff 430d2006 71ffffff
ffff8e2301f33740 2185530746 C Bo:2:011:2 0 32 >
ffff8e2301f33740 2185530748 S Bo:2:011:2 -115 32 = ffffffff 666e7735 666e7735 00000000 00000033 ffffffff 430d2006 70ffffff
ffff8e2301f32240 2185533461 C Bo:2:011:2 0 32 >
ffff8e2301f32240 2185533462 S Bo:2:011:2 -115 4 = ffffffff
ffff8e2301f33740 2185536224 C Bo:2:011:2 0 32 >
ffff8e2301f32240 2185538959 C Bo:2:011:2 0 4 >
ffff8e2301f32e40 2185544382 C Bi:2:011:2 0 1 = 06
ffff8e2301f32e40 2185544384 S Bi:2:011:2 -115 32 <
ffff8e2301f32240 2185544822 S Bo:2:011:2 -115 32 = 57710080 667e7735 667e7735 00000000 00000033 ffffffff 430d2006 77ffffff
ffff8e2301f33740 2185544825 S Bo:2:011:2 -115 32 = ffffffff 660e7735 660e7735 00000000 00000033 ffffffff 430d2006 76ffffff
ffff8e2301f32240 2185544881 C Bo:2:011:2 0 32 >
ffff8e2301f32240 2185544882 S Bo:2:011:2 -115 32 = ffffffff 661e7735 661e7735 00000000 00000033 ffffffff 430d2006 75ffffff
ffff8e2301f33740 2185544929 C Bo:2:011:2 0 32 >
ffff8e2301f33740 2185544930 S Bo:2:011:2 -115 32 = ffffffff 662e7735 662e7735 00000000 00000033 ffffffff 430d2006 74ffffff
ffff8e2301f32240 2185547745 C Bo:2:011:2 0 32 >
ffff8e2301f32240 2185547747 S Bo:2:011:2 -115 4 = ffffffff
ffff8e2301f33740 2185550486 C Bo:2:011:2 0 32 >
ffff8e2301f32240 2185553209 C Bo:2:011:2 0 4 >
ffff8e2301f326c0 2185558733 C Bi:2:011:2 0 1 = 06
ffff8e2301f326c0 2185558734 S Bi:2:011:2 -115 32 <
ffff8e2301f32240 2185559188 S Bo:2:011:2 -115 32 = 57718080 663e7735 663e7735 00000000 00000033 ffffffff 430d2006 7bffffff
ffff8e2301f33740 2185559192 S Bo:2:011:2 -115 32 = ffffffff 66ce7735 66ce7735 00000000 00000033 ffffffff 430d2006 7affffff
ffff8e2301f32240 2185559247 C Bo:2:011:2 0 32 >
ffff8e2301f32240 2185559249 S Bo:2:011:2 -115 32 = ffffffff 66de7735 66de7735 00000000 00000033 ffffffff 430d2005 73ffffff
ffff8e2301f33740 2185559297 C Bo:2:011:2 0 32 >
ffff8e2301f33740 2185559298 S Bo:2:011:2 -115 32 = ffffffff 664e7835 664e7835 00000000 00000033 ffffffff 430d2005 72ffffff
ffff8e2301f32240 2185562109 C Bo:2:011:2 0 32 >
ffff8e2301f32240 2185562111 S Bo:2:011:2 -115 4 = ffffffff
ffff8e2301f33740 2185564821 C Bo:2:011:2 0 32 >
ffff8e2301f32240 2185567611 C Bo:2:011:2 0 4 >
ffff8e2301f32e40 2185573032 C Bi:2:011:2 0 1 = 06
ffff8e2301f32e40 2185573034 S Bi:2:011:2 -115 32 <
ffff8e2301f32240 2185573394 S Bo:2:011:2 -115 32 = 57720080 665e7835 665e7835 00000000 00000033 ffffffff 430d2005 71ffffff
ffff8e2301f33740 2185573398 S Bo:2:011:2 -115 32 = ffffffff 666e7835 666e7835 00000000 00000033 ffffffff 430d2005 70ffffff
ffff8e2301f32240 2185573459 C Bo:2:011:2 0 32 >
ffff8e2301f32240 2185573460 S Bo:2:011:2 -115 32 = ffffffff 667e7835 667e7835 00000000 00000033 ffffffff 430d2005 77ffffff
ffff8e2301f33740 2185573508 C Bo:2:011:2 0 32 >
ffff8e2301f33740 2185573510 S Bo:2:011:2 -115 32 = ffffffff 660e7835 660e7835 00000000 00000033 ffffffff 430d2005 76ffffff
ffff8e2301f32240 2185576316 C Bo:2:011:2 0 32 >
ffff8e2301f32240 2185576318 S Bo:2:011:2 -115 4 = ffffffff
ffff8e2301f33740 2185579030 C Bo:2:011:2 0 32 >
ffff8e2301f32240 2185581782 C Bo:2:011:2 0 4 >
ffff8e2301f326c0 2185587345 C Bi:2:011:2 0 1 = 06
ffff8e2301f326c0 2185587347 S Bi:2:011:2 -115 32 <
ffff8e2301f32240 2185587719 S Bo:2:011:2 -115 32 = 57728080 661e7835 661e7835 00000000 00000033 ffffffff 430d2005 75ffffff
ffff8e2301f33740 2185587722 S Bo:2:011:2 -115 32 = ffffffff 662e7835 662e7835 00000000 00000033 ffffffff 430d2005 74ffffff
ffff8e2301f32240 2185587778 C Bo:2:011:2 0 32 >
ffff8e2301f32240 2185587779 S Bo:2:011:2 -115 32 = ffffffff 663e7835 663e7835 00000000 00000033 ffffffff 430d2005 7bffffff
ffff8e2301f33740 2185587822 C Bo:2:011:2 0 32 >
ffff8e2301f33740 2185587823 S Bo:2:011:2 -115 32 = ffffffff 66ce7835 66ce7835 00000000 00000033 ffffffff 430d2005 7affffff
ffff8e2301f32240 2185590636 C Bo:2:011:2 0 32 >
ffff8e2301f32240 2185590638 S Bo:2:011:2 -115 4 = ffffffff
ffff8e2301f33740 2185593386 C Bo:2:011:2 0 32 >
ffff8e2301f32240 2185596132 C Bo:2:011:2 0 4 >
ffff8e2301f32e40 2185601733 C Bi:2:011:2 0 1 = 06
ffff8e2301f32e40 2185601735 S Bi:2:011:2 -115 32 <
ffff8e2301f32240 2185602095 S Bo:2:011:2 -115 32 = 57730080 66de7835 66de7835 00000000 00000033 ffffffff 430d2004 73ffffff
ffff8e2301f33740 2185602099 S Bo:2:011:2 -115 32 = ffffffff 664e7935 664e7935 00000000 00000033 ffffffff 430d2004 72ffffff
ffff8e2301f32240 2185602155 C Bo:2:011:2 0 32 >
ffff8e2301f32240 2185602156 S Bo:2:011:2 -115 32 = ffffffff 665e7935 665e7935 00000000 00000033 ffffffff 430d2004 71ffffff
ffff8e2301f33740 2185602209 C Bo:2:011:2 0 32 >
ffff8e2301f33740 2185602210 S Bo:2:011:2 -115 32 = ffffffff 666e7935 666e7935 00000000 00000033 ffffffff 430d2004 70ffffff
ffff8e2301f32240 2185604966 C Bo:2:011:2 0 32 >
ffff8e2301f32240 2185604968 S Bo:2:011:2 -115 4 = ffffffff
ffff8e2301f33740 2185607744 C Bo:2:011:2 0 32 >
ffff8e2301f32240 2185610505 C Bo:2:011:2 0 4 >
ffff8e2301f326c0 2185616007 C Bi:2:011:2 0 1 = 06
ffff8e2301f326c0 2185616009 S Bi:2:011:2 -115 32 <
ffff8e2301f32240 2185616352 S Bo:2:011:2 -115 32 = 57738080 667e7935 667e7935 00000000 00000033 ffffffff 430d2004 77ffffff
ffff8e2301f33740 2185616356 S Bo:2:011:2 -115 32 = ffffffff 660e7935 660e7935 00000000 00000033 ffffffff 430d2004 76ffffff
ffff8e2301f32240 2185616412 C Bo:2:011:2 0 32 >
ffff8e2301f32240 2185616413 S Bo:2:011:2 -115 32 = ffffffff 661e7935 661e7935 00000000 00000033 ffffffff 430d2004 75ffffff
ffff8e2301f33740 2185616461 C Bo:2:011:2 0 32 >
ffff8e2301f33740 2185616465 S Bo:2:011:2 -115 32 = ffffffff 662e7935 662e7935 00000000 00000033 ffffffff 430d2004 74ffffff
ffff8e2301f32240 2185619249 C Bo:2:011:2 0 32 >
ffff8e2301f32240 2185619251 S Bo:2:011:2 -115 4 = ffffffff
ffff8e2301f33740 2185622029 C Bo:2:011:2 0 32 >
ffff8e2301f32240 2185624758 C Bo:2:011:2 0 4 >
ffff8e2301f32e40 2185630321 C Bi:2:011:2 0 1 = 06
ffff8e2301f32e40 2185630323 S Bi:2:011:2 -115 32 <
ffff8e2301f32240 2185630718 S Bo:2:011:2 -115 32 = 57740080 663e7935 663e7935 00000000 00000033 ffffffff 430d2004 7bffffff
ffff8e2301f33740 2185630722 S Bo:2:011:2 -115 32 = ffffffff 66ce7935 66ce7935 00000000 00000033 ffffffff 430d2004 7affffff
ffff8e2301f32240 2185630778 C Bo:2:011:2 0 32 >
ffff8e2301f32240 2185630779 S Bo:2:011:2 -115 32 = ffffffff 66de7935 66de7935 00000000 00000033 ffffffff 430d2003 73ffffff
ffff8e2301f33740 2185630836 C Bo:2:011:2 0 32 >
ffff8e2301f33740 2185630837 S Bo:2:011:2 -115 32 = ffffffff 002a6935 002a6935 00000000 00000033 ffffffff 430a5063 637f31ff
ffff8e2301f32240 2185633636 C Bo:2:011:2 0 32 >
ffff8e2301f32240 2185633638 S Bo:2:011:2 -115 4 = ffffffff
ffff8e2301f33740 2185636384 C Bo:2:011:2 0 32 >
ffff8e2301f32240 2185639112 C Bo:2:011:2 0 4 >
ffff8e2301f326c0 2185644733 C Bi:2:011:2 0 1 = 06
ffff8e2301f326c0 2185644735 S Bi:2:011:2 -115 32 <
ffff8e2301f32240 2185645130 S Bo:2:011:2 -115 32 = 57748080 003a6935 003a6935 00000000 00000033 ffffffff 430a5063 637f32ff
ffff8e2301f33740 2185645133 S Bo:2:011:2 -115 32 = ffffffff 00ca6935 00ca6935 00000000 00000033 ffffffff 430a5063 637f33ff
ffff8e2301f32240 2185645190 C Bo:2:011:2 0 32 >
ffff8e2301f32240 2185645191 S Bo:2:011:2 -115 32 = ffffffff 004a7035 004a7035 00000000 00000033 ffffffff 430a5063 637f34ff
ffff8e2301f33740 2185645238 C Bo:2:011:2 0 32 >
ffff8e2301f33740 2185645239 S Bo:2:011:2 -115 32 = ffffffff 005a7035 005a7035 00000000 00000033 ffffffff 430a5063 637f35ff
ffff8e2301f32240 2185648013 C Bo:2:011:2 0 32 >
ffff8e2301f32240 2185648015 S Bo:2:011:2 -115 4 = ffffffff
ffff8e2301f33740 2185650816 C Bo:2:011:2 0 32 >
ffff8e2301f32240 2185653506 C Bo:2:011:2 0 4 >
ffff8e2301f32e40 2185658938 C Bi:2:011:2 0 1 = 06
ffff8e2301f32e40 2185658940 S Bi:2:011:2 -115 32 <
ffff8e2301f32240 2185659310 S Bo:2:011:2 -115 32 = 57750080 006a7035 006a7035 00000000 00000033 ffffffff 430a5063 637f36ff
ffff8e2301f33740 2185659314 S Bo:2:011:2 -115 32 = ffffffff 007a7035 007a7035 00000000 00000033 ffffffff 430a5063 637f37ff
ffff8e2301f32240 2185659372 C Bo:2:011:2 0 32 >
ffff8e2301f32240 2185659373 S Bo:2:011:2 -115 32 = ffffffff 001a7035 001a7035 00000000 00000033 ffffffff 430a5063 637f38ff
ffff8e2301f33740 2185659419 C Bo:2:011:2 0 32 >
ffff8e2301f33740 2185659420 S Bo:2:011:2 -115 32 = ffffffff 002a7035 002a7035 00000000 00000033 ffffffff 430a5063 637f39ff
ffff8e2301f32240 2185662181 C Bo:2:011:2 0 32 >
ffff8e2301f32240 2185662183 S Bo:2:011:2 -115 4 = ffffffff
ffff8e2301f33740 2185664983 C Bo:2:011:2 0 32 >
ffff8e2301f32240 2185667736 C Bo:2:011:2 0 4 >
ffff8e2301f326c0 2185673257 C Bi:2:011:2 0 1 = 06
ffff8e2301f326c0 2185673259 S Bi:2:011:2 -115 32 <
ffff8e2301f32240 2185673655 S Bo:2:011:2 -115 32 = 57758080 003a7035 003a7035 00000000 00000033 ffffffff 430a5063 637e30ff
ffff8e2301f33740 2185673658 S Bo:2:011:2 -115 32 = ffffffff 00ca7035 00ca7035 00000000 00000033 ffffffff 430a5063 637e31ff
ffff8e2301f32240 2185673758 C Bo:2:011:2 0 32 >
ffff8e2301f32240 2185673759 S Bo:2:011:2 -115 32 = ffffffff 004a7135 004a7135 00000000 00000033 ffffffff 430a5063 637e32ff
ffff8e2301f33740 2185673818 C Bo:2:011:2 0 32 >
ffff8e2301f33740 2185673819 S Bo:2:011:2 -115 32 = ffffffff 005a7135 005a7135 00000000 00000033 ffffffff 430a5063 637e33ff
ffff8e2301f32240 2185676611 C Bo:2:011:2 0 32 >
ffff8e2301f32240 2185676613 S Bo:2:011:2 -115 4 = ffffffff
ffff8e2301f33740 2185679396 C Bo:2:011:2 0 32 >
ffff8e2301f32240 2185682113 C Bo:2:011:2 0 4 >
ffff8e2301f32e40 2185687601 C Bi:2:011:2 0 1 = 06
ffff8e2301f32e40 2185687605 S Bi:2:011:2 -115 32 <
ffff8e2301f32240 2185687975 S Bo:2:011:2 -115 32 = 57760080 006a7135 006a7135 00000000 00000033 ffffffff 430a5063 637e34ff
ffff8e2301f33740 2185687979 S Bo:2:011:2 -115 32 = ffffffff 007a7135 007a7135 00000000 00000033 ffffffff 430a5063 637e35ff
ffff8e2301f32240 2185688037 C Bo:2:011:2 0 32 >
ffff8e2301f32240 2185688040 S Bo:2:011:2 -115 32 = ffffffff 001a7135 001a7135 00000000 00000033 ffffffff 430a5063 637e36ff
ffff8e2301f33740 2185688087 C Bo:2:011:2 0 32 >
ffff8e2301f33740 2185688090 S Bo:2:011:2 -115 32 = ffffffff 002a7135 002a7135 00000000 00000033 ffffffff 430a5063 637e37ff
ffff8e2301f32240 2185690887 C Bo:2:011:2 0 32 >
ffff8e2301f32240 2185690892 S Bo:2:011:2 -115 4 = ffffffff
ffff8e2301f33740 2185693745 C Bo:2:011:2 0 32 >
ffff8e2301f32240 2185696380 C Bo:2:011:2 0 4 >
ffff8e2301f326c0 2185701913 C Bi:2:011:2 0 1 = 06
ffff8e2301f326c0 2185701918 S Bi:2:011:2 -115 32 <
ffff8e2301f32240 2185702456 S Bo:2:011:2 -115 32 = 57768080 003a7135 003a7135 00000000 00000033 ffffffff 430a5063 637e38ff
ffff8e2301f33740 2185702460 S Bo:2:011:2 -115 32 = ffffffff 00ca7135 00ca7135 00000000 00000033 ffffffff 430a5063 637e39ff
ffff8e2301f32240 2185702518 C Bo:2:011:2 0 32 >
ffff8e2301f32240 2185702521 S Bo:2:011:2 -115 32 = ffffffff 004a7235 004a7235 00000000 00000033 ffffffff 430a5063 637d30ff
ffff8e2301f33740 2185702569 C Bo:2:011:2 0 32 >
ffff8e2301f33740 2185702572 S Bo:2:011:2 -115 32 = ffffffff 005a7235 005a7235 00000000 00000033 ffffffff 430a5063 637d31ff
ffff8e2301f32240 2185705317 C Bo:2:011:2 0 32 >
ffff8e2301f32240 2185705322 S Bo:2:011:2 -115 4 = ffffffff
ffff8e2301f33740 2185708101 C Bo:2:011:2 0 32 >
ffff8e2301f32240 2185710873 C Bo:2:011:2 0 4 >
ffff8e2301f32e40 2185716383 C Bi:2:011:2 0 1 = 06
ffff8e2301f32e40 2185716387 S Bi:2:011:2 -115 32 <
ffff8e2301f32240 2185716823 S Bo:2:011:2 -115 32 = 57770080 006a7235 006a7235 00000000 00000033 ffffffff 430a5063 637d32ff
ffff8e2301f33740 2185716826 S Bo:2:011:2 -115 32 = ffffffff 001a7235 001a7235 00000000 00000033 ffffffff 430a5063 637d33ff
ffff8e2301f32240 2185716884 C Bo:2:011:2 0 32 >
ffff8e2301f32240 2185716887 S Bo:2:011:2 -115 32 = ffffffff 007a7235 007a7235 00000000 00000033 ffffffff 430a5063 637d34ff
ffff8e2301f33740 2185716938 C Bo:2:011:2 0 32 >
ffff8e2301f33740 2185716941 S Bo:2:011:2 -115 32 = ffffffff ffffffff ffffffff ffffffff ffffffff ffffffff ffffffff ffffffff
ffff8e2301f32240 2185719746 C Bo:2:011:2 0 32 >
ffff8e2301f32240 2185719751 S Bo:2:011:2 -115 4 = ffffffff
ffff8e2301f33740 2185722488 C Bo:2:011:2 0 32 >
ffff8e2301f32240 2185725211 C Bo:2:011:2 0 4 >
ffff8e2301f326c0 2185730733 C Bi:2:011:2 0 1 = 06
ffff8e2301f326c0 2185730738 S Bi:2:011:2 -115 32 <
ffff8e2301f32240 2185731112 S Bo:2:011:2 -115 32 = 57778080 ffffffff ffffffff ffffffff ffffffff ffffffff ffffffff ffffffff
ffff8e2301f33740 2185731115 S Bo:2:011:2 -115 32 = ffffffff ffffffff ffffffff ffffffff ffffffff ffffffff ffffffff ffffffff
ffff8e2301f32240 2185731173 C Bo:2:011:2 0 32 >
ffff8e2301f32240 2185731176 S Bo:2:011:2 -115 32 = ffffffff ffffffff ffffffff ffffffff ffffffff ffffffff ffffffff ffffffff
ffff8e2301f33740 2185731222 C Bo:2:011:2 0 32 >
ffff8e2301f33740 2185731224 S Bo:2:011:2 -115 32 = ffffffff ffffffff ffffffff ffffffff ffffffff ffffffff ffffffff ffffffff
ffff8e2301f32240 2185734032 C Bo:2:011:2 0 32 >
ffff8e2301f32240 2185734038 S Bo:2:011:2 -115 4 = ffffffff
ffff8e2301f33740 2185736817 C Bo:2:011:2 0 32 >
ffff8e2301f32240 2185739507 C Bo:2:011:2 0 4 >
ffff8e2301f32e40 2185745035 C Bi:2:011:2 0 1 = 06
ffff8e2301f32e40 2185745039 S Bi:2:011:2 -115 32 <
ffff8e2301f32240 2185745411 S Bo:2:011:2 -115 32 = 57780080 ffffffff ffffffff ffffffff ffffffff ffffffff ffffffff ffffffff
ffff8e2301f33740 2185745414 S Bo:2:011:2 -115 32 = ffffffff ffffffff ffffffff ffffffff ffffffff ffffffff ffffffff ffffffff
ffff8e2301f32240 2185745472 C Bo:2:011:2 0 32 >
ffff8e2301f32240 2185745475 S Bo:2:011:2 -115 32 = ffffffff ffffffff ffffffff ffffffff ffffffff ffffffff ffffffff ffffffff
ffff8e2301f33740 2185745521 C Bo:2:011:2 0 32 >
ffff8e2301f33740 2185745523 S Bo:2:011:2 -115 32 = ffffffff ffffffff ffffffff ffffffff ffffffff ffffffff ffffffff ffffffff
ffff8e2301f32240 2185748328 C Bo:2:011:2 0 32 >
ffff8e2301f32240 2185748333 S Bo:2:011:2 -115 4 = ffffffff
ffff8e2301f33740 2185751111 C Bo:2:011:2 0 32 >
ffff8e2301f32240 2185753839 C Bo:2:011:2 0 4 >
ffff8e2301f326c0 2185759169 C Bi:2:011:2 0 1 = 06
ffff8e2301f326c0 2185759174 S Bi:2:011:2 -115 32 <
ffff8e2301f32240 2185759563 S Bo:2:011:2 -115 32 = 57788080 ffffffff ffffffff ffffffff ffffffff ffffffff ffffffff ffffffff
ffff8e2301f33740 2185759567 S Bo:2:011:2 -115 32 = ffffffff ffffffff ffffffff ffffffff ffffffff ffffffff ffffffff ffffffff
ffff8e2301f32240 2185759624 C Bo:2:011:2 0 32 >
ffff8e2301f32240 2185759627 S Bo:2:011:2 -115 32 = ffffffff ffffffff ffffffff ffffffff ffffffff ffffffff ffffffff ffffffff
ffff8e2301f33740 2185759784 C Bo:2:011:2 0 32 >
ffff8e2301f33740 2185759787 S Bo:2:011:2 -115 32 = ffffffff ffffffff ffffffff ffffffff ffffffff ffffffff ffffffff ffffffff
ffff8e2301f32240 2185762462 C Bo:2:011:2 0 32 >
ffff8e2301f32240 2185762465 S Bo:2:011:2 -115 4 = ffffffff
ffff8e2301f33740 2185765246 C Bo:2:011:2 0 32 >
ffff8e2301f32240 2185767986 C Bo:2:011:2 0 4 >
ffff8e2301f32e40 2185773303 C Bi:2:011:2 0 1 = 06
ffff8e2301f32e40 2185773305 S Bi:2:011:2 -115 32 <
ffff8e2301f32240 2185773722 S Bo:2:011:2 -115 32 = 57790080 ffffffff ffffffff ffffffff ffffffff ffffffff ffffffff ffffffff
ffff8e2301f33740 2185773725 S Bo:2:011:2 -115 32 = ffffffff ffffffff ffffffff ffffffff ffffffff ffffffff ffffffff ffffffff
ffff8e2301f32240 2185773781 C Bo:2:011:2 0 32 >
ffff8e2301f32240 2185773783 S Bo:2:011:2 -115 32 = ffffffff ffffffff ffffffff ffffffff ffffffff ffffffff ffffffff ffffffff
ffff8e2301f33740 2185773839 C Bo:2:011:2 0 32 >
ffff8e2301f33740 2185773840 S Bo:2:011:2 -115 32 = ffffffff ffffffff ffffffff ffffffff ffffffff ffffffff ffffffff ffffffff
ffff8e2301f32240 2185776658 C Bo:2:011:2 0 32 >
ffff8e2301f32240 2185776659 S Bo:2:011:2 -115 4 = ffffffff
ffff8e2301f33740 2185779389 C Bo:2:011:2 0 32 >
ffff8e2301f32240 2185782132 C Bo:2:011:2 0 4 >
ffff8e2301f326c0 2185787466 C Bi:2:011:2 0 1 = 06
ffff8e2301f326c0 2185787468 S Bi:2:011:2 -115 32 <
ffff8e2301f32240 2185787890 S Bo:2:011:2 -115 32 = 57798080 ffffffff ffffffff ffffffff ffffffff ffffffff ffffffff ffffffff
ffff8e2301f33740 2185787893 S Bo:2:011:2 -115 32 = ffffffff ffffffff ffffffff ffffffff ffffffff ffffffff ffffffff ffffffff
ffff8e2301f32240 2185787948 C Bo:2:011:2 0 32 >
ffff8e2301f32240 2185787950 S Bo:2:011:2 -115 32 = ffffffff ffffffff ffffffff ffffffff ffffffff ffffffff ffffffff ffffffff
ffff8e2301f33740 2185787998 C Bo:2:011:2 0 32 >
ffff8e2301f33740 2185787999 S Bo:2:011:2 -115 32 = ffffffff ffffffff ffffffff ffffffff ffffffff ffffffff ffffffff ffffffff
ffff8e2301f32240 2185790824 C Bo:2:011:2 0 32 >
ffff8e2301f32240 2185790826 S Bo:2:011:2 -115 4 = ffffffff
ffff8e2301f33740 2185793530 C Bo:2:011:2 0 32 >
ffff8e2301f32240 2185796279 C Bo:2:011:2 0 4 >
ffff8e2301f32e40 2185801777 C Bi:2:011:2 0 1 = 06
ffff8e2301f32e40 2185801779 S Bi:2:011:2 -115 32 <
ffff8e2301f32240 2185802138 S Bo:2:011:2 -115 32 = 577a0080 ffffffff ffffffff ffffffff ffffffff ffffffff ffffffff ffffffff
ffff8e2301f33740 2185802141 S Bo:2:011:2 -115 32 = ffffffff ffffffff ffffffff ffffffff ffffffff ffffffff ffffffff ffffffff
ffff8e2301f32240 2185802198 C Bo:2:011:2 0 32 >
ffff8e2301f32240 2185802199 S Bo:2:011:2 -115 32 = ffffffff ffffffff ffffffff ffffffff ffffffff ffffffff ffffffff ffffffff
ffff8e2301f33740 2185802247 C Bo:2:011:2 0 32 >
ffff8e2301f33740 2185802248 S Bo:2:011:2 -115 32 = ffffffff ffffffff ffffffff ffffffff ffffffff ffffffff ffffffff ffffffff
ffff8e2301f32240 2185805034 C Bo:2:011:2 0 32 >
ffff8e2301f32240 2185805035 S Bo:2:011:2 -115 4 = ffffffff
ffff8e2301f33740 2185807789 C Bo:2:011:2 0 32 >
ffff8e2301f32240 2185810523 C Bo:2:011:2 0 4 >
ffff8e2301f326c0 2185815962 C Bi:2:011:2 0 1 = 06
ffff8e2301f326c0 2185815964 S Bi:2:011:2 -115 32 <
ffff8e2301f32240 2185816328 S Bo:2:011:2 -115 32 = 577a8080 ffffffff ffffffff ffffffff ffffffff ffffffff ffffffff ffffffff
ffff8e2301f33740 2185816332 S Bo:2:011:2 -115 32 = ffffffff ffffffff ffffffff ffffffff ffffffff ffffffff ffffffff ffffffff
ffff8e2301f32240 2185816388 C Bo:2:011:2 0 32 >
ffff8e2301f32240 2185816390 S Bo:2:011:2 -115 32 = ffffffff ffffffff ffffffff ffffffff ffffffff ffffffff ffffffff ffffffff
ffff8e2301f33740 2185816439 C Bo:2:011:2 0 32 >
ffff8e2301f33740 2185816440 S Bo:2:011:2 -115 32 = ffffffff ffffffff ffffffff ffffffff ffffffff ffffffff ffffffff ffffffff
ffff8e2301f32240 2185819248 C Bo:2:011:2 0 32 >
ffff8e2301f32240 2185819250 S Bo:2:011:2 -115 4 = ffffffff
ffff8e2301f33740 2185821960 C Bo:2:011:2 0 32 >
ffff8e2301f32240 2185824732 C Bo:2:011:2 0 4 >
ffff8e2301f32e40 2185830098 C Bi:2:011:2 0 1 = 06
ffff8e2301f32e40 2185830100 S Bi:2:011:2 -115 32 <
ffff8e2301f32240 2185830448 S Bo:2:011:2 -115 32 = 577b0080 ffffffff ffffffff ffffffff ffffffff ffffffff ffffffff ffffffff
ffff8e2301f33740 2185830452 S Bo:2:011:2 -115 32 = ffffffff ffffffff ffffffff ffffffff ffffffff ffffffff ffffffff ffffffff
ffff8e2301f32240 2185830508 C Bo:2:011:2 0 32 >
ffff8e2301f32240 2185830509 S Bo:2:011:2 -115 32 = ffffffff ffffffff ffffffff ffffffff ffffffff ffffffff ffffffff ffffffff
ffff8e2301f33740 2185830563 C Bo:2:011:2 0 32 >
ffff8e2301f33740 2185830564 S Bo:2:011:2 -115 32 = ffffffff ffffffff ffffffff ffffffff ffffffff ffffffff ffffffff ffffffff
ffff8e2301f32240 2185833320 C Bo:2:011:2 0 32 >
ffff8e2301f32240 2185833322 S Bo:2:011:2 -115 4 = ffffffff
ffff8e2301f33740 2185836100 C Bo:2:011:2 0 32 >
ffff8e2301f32240 2185838826 C Bo:2:011:2 0 4 >
ffff8e2301f326c0 2185844234 C Bi:2:011:2 0 1 = 06
ffff8e2301f326c0 2185844236 S Bi:2:011:2 -115 32 <
ffff8e2301f32240 2185844645 S Bo:2:011:2 -115 32 = 577b8080 ffffffff ffffffff ffffffff ffffffff ffffffff ffffffff ffffffff
ffff8e2301f33740 2185844648 S Bo:2:011:2 -115 32 = ffffffff ffffffff ffffffff ffffffff ffffffff ffffffff ffffffff ffffffff
ffff8e2301f32240 2185844755 C Bo:2:011:2 0 32 >
ffff8e2301f32240 2185844756 S Bo:2:011:2 -115 32 = ffffffff ffffffff ffffffff ffffffff ffffffff ffffffff ffffffff ffffffff
ffff8e2301f33740 2185844805 C Bo:2:011:2 0 32 >
ffff8e2301f33740 2185844806 S Bo:2:011:2 -115 32 = ffffffff ffffffff ffffffff ffffffff ffffffff ffffffff ffffffff ffffffff
ffff8e2301f32240 2185847602 C Bo:2:011:2 0 32 >
ffff8e2301f32240 2185847604 S Bo:2:011:2 -115 4 = ffffffff
ffff8e2301f33740 2185850350 C Bo:2:011:2 0 32 >
ffff8e2301f32240 2185853113 C Bo:2:011:2 0 4 >
ffff8e2301f32e40 2185858553 C Bi:2:011:2 0 1 = 06
ffff8e2301f32e40 2185858555 S Bi:2:011:2 -115 32 <
ffff8e2301f32240 2185858927 S Bo:2:011:2 -115 32 = 577c0080 ffffffff ffffffff ffffffff ffffffff ffffffff ffffffff ffffffff
ffff8e2301f33740 2185858930 S Bo:2:011:2 -115 32 = ffffffff ffffffff ffffffff ffffffff ffffffff ffffffff ffffffff ffffffff
ffff8e2301f32240 2185858986 C Bo:2:011:2 0 32 >
ffff8e2301f32240 2185858987 S Bo:2:011:2 -115 32 = ffffffff ffffffff ffffffff ffffffff ffffffff ffffffff ffffffff ffffffff
ffff8e2301f33740 2185859035 C Bo:2:011:2 0 32 >
ffff8e2301f33740 2185859036 S Bo:2:011:2 -115 32 = ffffffff ffffffff ffffffff ffffffff ffffffff ffffffff ffffffff ffffffff
ffff8e2301f32240 2185861819 C Bo:2:011:2 0 32 >
ffff8e2301f32240 2185861820 S Bo:2:011:2 -115 4 = ffffffff
ffff8e2301f33740 2185864635 C Bo:2:011:2 0 32 >
ffff8e2301f32240 2185867362 C Bo:2:011:2 0 4 >
ffff8e2301f326c0 2185872734 C Bi:2:011:2 0 1 = 06
ffff8e2301f326c0 2185872736 S Bi:2:011:2 -115 32 <
ffff8e2301f32240 2185873199 S Bo:2:011:2 -115 32 = 577c8080 ffffffff ffffffff ffffffff ffffffff ffffffff ffffffff ffffffff
ffff8e2301f33740 2185873202 S Bo:2:011:2 -115 32 = ffffffff ffffffff ffffffff ffffffff ffffffff ffffffff ffffffff ffffffff
ffff8e2301f32240 2185873259 C Bo:2:011:2 0 32 >
ffff8e2301f32240 2185873260 S Bo:2:011:2 -115 32 = ffffffff ffffffff ffffffff ffffffff ffffffff ffffffff ffffffff ffffffff
ffff8e2301f33740 2185873312 C Bo:2:011:2 0 32 >
ffff8e2301f33740 2185873313 S Bo:2:011:2 -115 32 = ffffffff ffffffff ffffffff ffffffff ffffffff ffffffff ffffffff ffffffff
ffff8e2301f32240 2185876102 C Bo:2:011:2 0 32 >
ffff8e2301f32240 2185876104 S Bo:2:011:2 -115 4 = ffffffff
ffff8e2301f33740 2185878886 C Bo:2:011:2 0 32 >
ffff8e2301f32240 2185881601 C Bo:2:011:2 0 4 >
ffff8e2301f32e40 2185887034 C Bi:2:011:2 0 1 = 06
ffff8e2301f32e40 2185887036 S Bi:2:011:2 -115 32 <
ffff8e2301f32240 2185887354 S Bo:2:011:2 -115 32 = 577d0080 ffffffff ffffffff ffffffff ffffffff ffffffff ffffffff ffffffff
ffff8e2301f33740 2185887357 S Bo:2:011:2 -115 32 = ffffffff ffffffff ffffffff ffffffff ffffffff ffffffff ffffffff ffffffff
ffff8e2301f32240 2185887413 C Bo:2:011:2 0 32 >
ffff8e2301f32240 2185887415 S Bo:2:011:2 -115 32 = ffffffff ffffffff ffffffff ffffffff ffffffff ffffffff ffffffff ffffffff
ffff8e2301f33740 2185887462 C Bo:2:011:2 0 32 >
ffff8e2301f33740 2185887463 S Bo:2:011:2 -115 32 = ffffffff ffffffff ffffffff ffffffff ffffffff ffffffff ffffffff ffffffff
ffff8e2301f32240 2185890273 C Bo:2:011:2 0 32 >
ffff8e2301f32240 2185890274 S Bo:2:011:2 -115 4 = ffffffff
ffff8e2301f33740 2185893030 C Bo:2:011:2 0 32 >
ffff8e2301f32240 2185895784 C Bo:2:011:2 0 4 >
ffff8e2301f326c0 2185901168 C Bi:2:011:2 0 1 = 06
ffff8e2301f326c0 2185901171 S Bi:2:011:2 -115 32 <
ffff8e2301f32240 2185901510 S Bo:2:011:2 -115 32 = 577d8080 ffffffff ffffffff ffffffff ffffffff ffffffff ffffffff ffffffff
ffff8e2301f33740 2185901514 S Bo:2:011:2 -115 32 = ffffffff ffffffff ffffffff ffffffff ffffffff ffffffff ffffffff ffffffff
ffff8e2301f32240 2185901570 C Bo:2:011:2 0 32 >
ffff8e2301f32240 2185901571 S Bo:2:011:2 -115 32 = ffffffff ffffffff ffffffff ffffffff ffffffff ffffffff ffffffff ffffffff
ffff8e2301f33740 2185901619 C Bo:2:011:2 0 32 >
ffff8e2301f33740 2185901620 S Bo:2:011:2 -115 32 = ffffffff ffffffff ffffffff ffffffff ffffffff ffffffff ffffffff ffffffff
ffff8e2301f32240 2185904372 C Bo:2:011:2 0 32 >
ffff8e2301f32240 2185904374 S Bo:2:011:2 -115 4 = ffffffff
ffff8e2301f33740 2185907176 C Bo:2:011:2 0 32 >
ffff8e2301f32240 2185909938 C Bo:2:011:2 0 4 >
ffff8e2301f32e40 2185915303 C Bi:2:011:2 0 1 = 06
ffff8e2301f32e40 2185915304 S Bi:2:011:2 -115 32 <
ffff8e2301f32240 2185915710 S Bo:2:011:2 -115 32 = 577e0080 ffffffff ffffffff ffffffff ffffffff ffffffff ffffffff ffffffff
ffff8e2301f33740 2185915713 S Bo:2:011:2 -115 32 = ffffffff ffffffff ffffffff ffffffff ffffffff ffffffff ffffffff ffffffff
ffff8e2301f32240 2185915769 C Bo:2:011:2 0 32 >
ffff8e2301f32240 2185915770 S Bo:2:011:2 -115 32 = ffffffff ffffffff ffffffff ffffffff ffffffff ffffffff ffffffff ffffffff
ffff8e2301f33740 2185915819 C Bo:2:011:2 0 32 >
ffff8e2301f33740 2185915819 S Bo:2:011:2 -115 32 = ffffffff ffffffff ffffffff ffffffff ffffffff ffffffff ffffffff ffffffff
ffff8e2301f32240 2185918638 C Bo:2:011:2 0 32 >
ffff8e2301f32240 2185918640 S Bo:2:011:2 -115 4 = ffffffff
ffff8e2301f33740 2185921389 C Bo:2:011:2 0 32 >
ffff8e2301f32240 2185924133 C Bo:2:011:2 0 4 >
ffff8e2301f326c0 2185929467 C Bi:2:011:2 0 1 = 06
ffff8e2301f326c0 2185929469 S Bi:2:011:2 -115 32 <
ffff8e2301f32240 2185929926 S Bo:2:011:2 -115 32 = 577e8080 ffffffff ffffffff ffffffff ffffffff ffffffff ffffffff ffffffff
ffff8e2301f33740 2185929929 S Bo:2:011:2 -115 32 = ffffffff ffffffff ffffffff ffffffff ffffffff ffffffff ffffffff ffffffff
ffff8e2301f32240 2185929986 C Bo:2:011:2 0 32 >
ffff8e2301f32240 2185929987 S Bo:2:011:2 -115 32 = ffffffff ffffffff ffffffff ffffffff ffffffff ffffffff ffffffff ffffffff
ffff8e2301f33740 2185930035 C Bo:2:011:2 0 32 >
ffff8e2301f33740 2185930036 S Bo:2:011:2 -115 32 = ffffffff ffffffff ffffffff ffffffff ffffffff ffffffff ffffffff ffffffff
ffff8e2301f32240 2185932828 C Bo:2:011:2 0 32 >
ffff8e2301f32240 2185932829 S Bo:2:011:2 -115 4 = ffffffff
ffff8e2301f33740 2185935612 C Bo:2:011:2 0 32 >
ffff8e2301f32240 2185938327 C Bo:2:011:2 0 4 >
ffff8e2301f32e40 2185943778 C Bi:2:011:2 0 1 = 06
ffff8e2301f32e40 2185943780 S Bi:2:011:2 -115 32 <
ffff8e2301f32240 2185944181 S Bo:2:011:2 -115 32 = 577f0080 ffffffff ffffffff ffffffff ffffffff ffffffff ffffffff ffffffff
ffff8e2301f33740 2185944184 S Bo:2:011:2 -115 32 = ffffffff ffffffff ffffffff ffffffff ffffffff ffffffff ffffffff ffffffff
ffff8e2301f32240 2185944240 C Bo:2:011:2 0 32 >
ffff8e2301f32240 2185944241 S Bo:2:011:2 -115 32 = ffffffff ffffffff ffffffff ffffffff ffffffff ffffffff ffffffff ffffffff
ffff8e2301f33740 2185944289 C Bo:2:011:2 0 32 >
ffff8e2301f33740 2185944289 S Bo:2:011:2 -115 32 = ffffffff ffffffff ffffffff ffffffff ffffffff ffffffff ffffffff ffffffff
ffff8e2301f32240 2185947103 C Bo:2:011:2 0 32 >
ffff8e2301f32240 2185947105 S Bo:2:011:2 -115 4 = ffffffff
ffff8e2301f33740 2185949818 C Bo:2:011:2 0 32 >
ffff8e2301f32240 2185952587 C Bo:2:011:2 0 4 >
ffff8e2301f326c0 2185957914 C Bi:2:011:2 0 1 = 06
ffff8e2301f326c0 2185957916 S Bi:2:011:2 -115 32 <
ffff8e2301f32240 2185958289 S Bo:2:011:2 -115 32 = 577f8080 ffffffff ffffffff ffffffff ffffffff ffffffff ffffffff ffffffff
ffff8e2301f33740 2185958292 S Bo:2:011:2 -115 32 = ffffffff ffffffff ffffffff ffffffff ffffffff ffffffff ffffffff ffffffff
ffff8e2301f32240 2185958348 C Bo:2:011:2 0 32 >
ffff8e2301f32240 2185958350 S Bo:2:011:2 -115 32 = ffffffff ffffffff ffffffff ffffffff ffffffff ffffffff ffffffff ffffffff
ffff8e2301f33740 2185958396 C Bo:2:011:2 0 32 >
ffff8e2301f33740 2185958398 S Bo:2:011:2 -115 32 = ffffffff ffffffff ffffffff ffffffff ffffffff ffffffff ffffffff ffffffff
ffff8e2301f32240 2185961181 C Bo:2:011:2 0 32 >
ffff8e2301f32240 2185961182 S Bo:2:011:2 -115 4 = ffffffff
ffff8e2301f33740 2185963961 C Bo:2:011:2 0 32 >
ffff8e2301f32240 2185966732 C Bo:2:011:2 0 4 >
ffff8e2301f32e40 2185972101 C Bi:2:011:2 0 1 = 06
ffff8e2301f32e40 2185972103 S Bi:2:011:2 -115 32 <
ffff8e2301f32240 2185972432 S Bo:2:011:2 -115 32 = 57800080 47000036 414a0000 00000000 ff4e00ff 00000100 00000000 000000ff
ffff8e2301f33740 2185972436 S Bo:2:011:2 -115 32 = ffffffff 474c0536 414a0000 00000000 ff4e00ff 00000100 00000000 000000ff
ffff8e2301f32240 2185972492 C Bo:2:011:2 0 32 >
ffff8e2301f32240 2185972494 S Bo:2:011:2 -115 32 = ffffffff 4749093e 444a0000 00000000 ff4e00ff 00000100 00000000 000000ff
ffff8e2301f33740 2185972542 C Bo:2:011:2 0 32 >
ffff8e2301f33740 2185972543 S Bo:2:011:2 -115 32 = ffffffff ffffffff ffffffff ffffffff ffffffff ffffffff ffffffff ffffffff
ffff8e2301f32240 2185975328 C Bo:2:011:2 0 32 >
ffff8e2301f32240 2185975330 S Bo:2:011:2 -115 4 = ffffffff
ffff8e2301f33740 2185978101 C Bo:2:011:2 0 32 >
ffff8e2301f32240 2185980826 C Bo:2:011:2 0 4 >
ffff8e2301f326c0 2185986414 C Bi:2:011:2 0 1 = 06
ffff8e2301f326c0 2185986416 S Bi:2:011:2 -115 32 <
ffff8e2301f32240 2185986767 S Bo:2:011:2 -115 32 = 57900080 424e0232 42000000 00000100 47000000 000001ff 42000000 00001500
ffff8e2301f33740 2185986771 S Bo:2:011:2 -115 32 = 000002ff 4600ffff 00000000 00000135 45000134 ffffffff ffffffff ff00003c
ffff8e2301f32240 2185986826 C Bo:2:011:2 0 32 >
ffff8e2301f32240 2185986830 S Bo:2:011:2 -115 32 = 53470333 4543073d 4a000000 00000000 00ffffff ffffffff ffffffff ffffffff
ffff8e2301f33740 2185986876 C Bo:2:011:2 0 32 >
ffff8e2301f33740 2185986877 S Bo:2:011:2 -115 32 = ffffffff ffffffff ffffffff ffffffff ffffffff ffffffff ffffffff ffffffff
ffff8e2301f32240 2185989638 C Bo:2:011:2 0 32 >
ffff8e2301f32240 2185989640 S Bo:2:011:2 -115 4 = ffffffff
ffff8e2301f33740 2185992462 C Bo:2:011:2 0 32 >
ffff8e2301f32240 2185995161 C Bo:2:011:2 0 4 >
ffff8e2301f32e40 2186000724 C Bi:2:011:2 0 1 = 06
ffff8e2301f32e40 2186000726 S Bi:2:011:2 -115 32 <
ffff8e2301f32240 2186001177 S Bo:2:011:2 -115 32 = 57a00080 424d0333 46ff0036 42ffffff ffffffff ffffffff ffffffff ffffffff
ffff8e2301f33740 2186001180 S Bo:2:011:2 -115 32 = ffffffff 42000100 4200ffff ffffffff ffffffff ffffffff ffffffff ffffffff
ffff8e2301f32240 2186001237 C Bo:2:011:2 0 32 >
ffff8e2301f32240 2186001238 S Bo:2:011:2 -115 32 = ffffffff ffffffff ffffffff ffffffff ffffffff ffffffff ffffffff ffffffff
ffff8e2301f33740 2186001284 C Bo:2:011:2 0 32 >
ffff8e2301f33740 2186001286 S Bo:2:011:2 -115 32 = ffffffff ffffffff ffffffff ffffffff ffffffff ffffffff ffffffff ffffffff
ffff8e2301f32240 2186004103 C Bo:2:011:2 0 32 >
ffff8e2301f32240 2186004105 S Bo:2:011:2 -115 4 = ffffffff
ffff8e2301f33740 2186006824 C Bo:2:011:2 0 32 >
ffff8e2301f32240 2186009601 C Bo:2:011:2 0 4 >
ffff8e2301f326c0 2186020326 C Bi:2:011:2 0 1 = 06
ffff8e2301f326c0 2186020328 S Bi:2:011:2 -115 32 <
ffff8e2301f32240 2186020683 S Bo:2:011:2 -115 32 = 57a08080 ffffffff ffffffff ffffffff ffffffff ffffffff ffffffff ffffffff
ffff8e2301f33740 2186020686 S Bo:2:011:2 -115 32 = ffffffff ffffffff ffffffff ffffffff ffffffff ffffffff ffffffff ffffffff
ffff8e2301f32240 2186020743 C Bo:2:011:2 0 32 >
ffff8e2301f32240 2186020744 S Bo:2:011:2 -115 32 = ffffffff ffffffff ffffffff ffffffff ffffffff ffffffff ffffffff ffffffff
ffff8e2301f33740 2186020791 C Bo:2:011:2 0 32 >
ffff8e2301f33740 2186020792 S Bo:2:011:2 -115 32 = ffffffff ffffffff ffffffff ffffffff ffffffff ffffffff ffffffff ffffffff
ffff8e2301f32240 2186023603 C Bo:2:011:2 0 32 >
ffff8e2301f32240 2186023605 S Bo:2:011:2 -115 4 = ffffffff
ffff8e2301f33740 2186026387 C Bo:2:011:2 0 32 >
ffff8e2301f32240 2186029114 C Bo:2:011:2 0 4 >
ffff8e2301f32e40 2186034465 C Bi:2:011:2 0 1 = 06
ffff8e2301f32e40 2186034467 S Bi:2:011:2 -115 32 <
ffff8e2301f32240 2186034865 S Bo:2:011:2 -115 32 = 57a10080 ffffffff ffffffff ffffffff ffffffff ffffffff ffffffff ffffffff
ffff8e2301f33740 2186034868 S Bo:2:011:2 -115 32 = ffffffff ffffffff ffffffff ffffffff ffffffff ffffffff ffffffff ffffffff
ffff8e2301f32240 2186034925 C Bo:2:011:2 0 32 >
ffff8e2301f32240 2186034926 S Bo:2:011:2 -115 32 = ffffffff ffffffff ffffffff ffffffff ffffffff ffffffff ffffffff ffffffff
ffff8e2301f33740 2186034974 C Bo:2:011:2 0 32 >
ffff8e2301f33740 2186034974 S Bo:2:011:2 -115 32 = ffffffff ffffffff ffffffff ffffffff ffffffff ffffffff ffffffff ffffffff
ffff8e2301f32240 2186037747 C Bo:2:011:2 0 32 >
ffff8e2301f32240 2186037749 S Bo:2:011:2 -115 4 = ffffffff
ffff8e2301f33740 2186040511 C Bo:2:011:2 0 32 >
ffff8e2301f32240 2186043291 C Bo:2:011:2 0 4 >
ffff8e2301f326c0 2186048602 C Bi:2:011:2 0 1 = 06
ffff8e2301f326c0 2186048615 S Bi:2:011:2 -115 32 <
ffff8e2301f32240 2186049032 S Bo:2:011:2 -115 32 = 57b00080 0056e215 fd6ca211 3d68d810 5d67541e 95660000 00000000 00000000
ffff8e2301f33740 2186049036 S Bo:2:011:2 -115 32 = 00000000 4000fc3f 41692011 59743f18 70574820 36587f2b 0b69dc0b 3369e834
ffff8e2301f32240 2186049092 C Bo:2:011:2 0 32 >
ffff8e2301f32240 2186049094 S Bo:2:011:2 -115 32 = e951702b 525d0336 004b3833 0000383c 47000064 484b0000 d1440400 001a0d33
ffff8e2301f33740 2186049141 C Bo:2:011:2 0 32 >
ffff8e2301f33740 2186049143 S Bo:2:011:2 -115 32 = 00004a22 470000b6 564b0000 b35a0400 005e1633 0000de2e 4700004e 614b0000
ffff8e2301f32240 2186051963 C Bo:2:011:2 0 32 >
ffff8e2301f32240 2186051965 S Bo:2:011:2 -115 4 = e36d0400
ffff8e2301f33740 2186054756 C Bo:2:011:2 0 32 >
ffff8e2301f32240 2186057461 C Bo:2:011:2 0 4 >
ffff8e2301f32e40 2186062602 C Bi:2:011:2 0 1 = 06
ffff8e2301f32e40 2186062604 S Bi:2:011:2 -115 32 <
ffff8e2301f32240 2186062984 S Bo:2:011:2 -115 32 = 57b08080 005c2333 0000fd15 470000b3 6f4b0000 b97c0400 00470000 00ffffff
ffff8e2301f33740 2186062988 S Bo:2:011:2 -115 32 = ffffffff ffffffff ffffffff ffffffff ffffffff ffffffff ffffffff ffffffff
ffff8e2301f32240 2186063044 C Bo:2:011:2 0 32 >
ffff8e2301f32240 2186063045 S Bo:2:011:2 -115 32 = ffffffff ffffffff ffffffff ffffffff ffffffff ffffffff ffffffff ffffffff
ffff8e2301f33740 2186063093 C Bo:2:011:2 0 32 >
ffff8e2301f33740 2186063096 S Bo:2:011:2 -115 32 = ffffffff ffffffff ffffffff ffffffff ffffffff ffffffff ffffffff ffffffff
ffff8e2301f32240 2186065910 C Bo:2:011:2 0 32 >
ffff8e2301f32240 2186065912 S Bo:2:011:2 -115 4 = ffffffff
ffff8e2301f33740 2186068744 C Bo:2:011:2 0 32 >
ffff8e2301f32240 2186071362 C Bo:2:011:2 0 4 >
ffff8e2301f326c0 2186077077 C Bi:2:011:2 0 1 = 06
ffff8e2301f326c0 2186077079 S Bi:2:011:2 -115 32 <
ffff8e2301f32240 2186077442 S Bo:2:011:2 -115 32 = 57c00080 0b2e6d17 012e6e53 30ffffff ffffffff 02267255 222164ff ffffffff
ffff8e2301f33740 2186077445 S Bo:2:011:2 -115 32 = ffffffff 0e2e725e 2d2affff ffffffff ffffffff 130252ff ffffffff ffffffff
ffff8e2301f32240 2186077503 C Bo:2:011:2 0 32 >
ffff8e2301f32240 2186077504 S Bo:2:011:2 -115 32 = ffffffff 766f455a 333b79ff ffffffff ffffffff 756f455a 333b79ff ffffffff
ffff8e2301f33740 2186077549 C Bo:2:011:2 0 32 >
ffff8e2301f33740 2186077550 S Bo:2:011:2 -115 32 = ffffffff 746f455a 333b79ff ffffffff ffffffff 7b6f455a 333b79ff ffffffff
ffff8e2301f32240 2186080303 C Bo:2:011:2 0 32 >
ffff8e2301f32240 2186080305 S Bo:2:011:2 -115 4 = ffffffff
ffff8e2301f33740 2186083101 C Bo:2:011:2 0 32 >
ffff8e2301f32240 2186085840 C Bo:2:011:2 0 4 >
ffff8e2301f32e40 2186093441 C Bi:2:011:2 0 1 = 06
ffff8e2301f32e40 2186093443 S Bi:2:011:2 -115 32 <
ffff8e2301f32240 2186093776 S Bo:2:011:2 -115 32 = 57c08080 152e725e 2c3a73ff ffffffff ffffffff 430dffff ffffffff ffffffff
ffff8e2301f33740 2186093779 S Bo:2:011:2 -115 32 = ffffffff 19206e52 06236541 2621ffff ffffffff 19206e52 1738655b 352affff
ffff8e2301f32240 2186093840 C Bo:2:011:2 0 32 >
ffff8e2301f32240 2186093841 S Bo:2:011:2 -115 32 = ffffffff 19206e52 17276945 372a6559 ffffffff 19206e52 05207545 372a6559
ffff8e2301f33740 2186093888 C Bo:2:011:2 0 32 >
ffff8e2301f33740 2186093890 S Bo:2:011:2 -115 32 = ffffffff 19206e52 05266643 262a6eff ffffffff ffffffff ffffffff ffffffff
ffff8e2301f32240 2186096659 C Bo:2:011:2 0 32 >
ffff8e2301f32240 2186096661 S Bo:2:011:2 -115 4 = ffffffff
ffff8e2301f33740 2186099462 C Bo:2:011:2 0 32 >
ffff8e2301f32240 2186102180 C Bo:2:011:2 0 4 >
ffff8e2301f326c0 2186107602 C Bi:2:011:2 0 1 = 06
ffff8e2301f326c0 2186107604 S Bi:2:011:2 -115 32 <
ffff8e2301f32240 2186107999 S Bo:2:011:2 -115 32 = 57d00080 ffffffff ffffffff ffffffff ffffffff 041d4576 170a5363 63074963
ffff8e2301f33740 2186108007 S Bo:2:011:2 -115 32 = ffffffff 010d4303 ffffffff ffffffff ffffffff 430e507e 170e4cff ffffffff
ffff8e2301f32240 2186108064 C Bo:2:011:2 0 32 >
ffff8e2301f32240 2186108065 S Bo:2:011:2 -115 32 = ffffffff 43034164 10064317 0502ffff ffffffff 131a4c64 06ffffff ffffffff
ffff8e2301f33740 2186108112 C Bo:2:011:2 0 32 >
ffff8e2301f33740 2186108113 S Bo:2:011:2 -115 32 = ffffffff 0b0a4165 176f5978 1104537f ffffffff 430e507e 170e4c17 1a4f527c
ffff8e2301f32240 2186110896 C Bo:2:011:2 0 32 >
ffff8e2301f32240 2186110898 S Bo:2:011:2 -115 4 = ffffffff
ffff8e2301f33740 2186113637 C Bo:2:011:2 0 32 >
ffff8e2301f32240 2186116381 C Bo:2:011:2 0 4 >
ffff8e2301f32e40 2186123965 C Bi:2:011:2 0 1 = 06
ffff8e2301f32e40 2186123967 S Bi:2:011:2 -115 32 <
ffff8e2301f32240 2186124327 S Bo:2:011:2 -115 32 = 57d08080 010d4317 1a4f527c ffffffff ffffffff ffffffff ffffffff ffffffff
ffff8e2301f33740 2186124330 S Bo:2:011:2 -115 32 = ffffffff ffffffff ffffffff ffffffff ffffffff ffffffff ffffffff ffffffff
ffff8e2301f32240 2186124388 C Bo:2:011:2 0 32 >
ffff8e2301f32240 2186124389 S Bo:2:011:2 -115 32 = ffffffff ffffffff ffffffff ffffffff ffffffff ffffffff ffffffff ffffffff
ffff8e2301f33740 2186124440 C Bo:2:011:2 0 32 >
ffff8e2301f33740 2186124441 S Bo:2:011:2 -115 32 = ffffffff ffffffff ffffffff ffffffff ffffffff ffffffff ffffffff ffffffff
ffff8e2301f32240 2186127248 C Bo:2:011:2 0 32 >
ffff8e2301f32240 2186127250 S Bo:2:011:2 -115 4 = ffffffff
ffff8e2301f33740 2186129963 C Bo:2:011:2 0 32 >
ffff8e2301f32240 2186132733 C Bo:2:011:2 0 4 >
ffff8e2301f326c0 2186138099 C Bi:2:011:2 0 1 = 06
ffff8e2301f326c0 2186138102 S Bi:2:011:2 -115 32 <
ffff8e2301f32240 2186138467 S Bo:2:011:2 -115 32 = 57d10080 ffffffff ffffffff ffffffff ffffffff 114f4d76 0d064117 0a0154ff
ffff8e2301f33740 2186138470 S Bo:2:011:2 -115 32 = ffffffff 114f4d76 0d064117 0a0154ff ffffffff 114f4d76 0d064117 0a0154ff
ffff8e2301f32240 2186138526 C Bo:2:011:2 0 32 >
ffff8e2301f32240 2186138527 S Bo:2:011:2 -115 32 = ffffffff 010d4317 100a5261 0a0c45ff ffffffff 010d4317 100a5261 0a0c45ff
ffff8e2301f33740 2186138576 C Bo:2:011:2 0 32 >
ffff8e2301f33740 2186138576 S Bo:2:011:2 -115 32 = ffffffff 154f2063 161d4b72 1affffff ffffffff 43074979 026f527e ffffffff
ffff8e2301f32240 2186141388 C Bo:2:011:2 0 32 >
ffff8e2301f32240 2186141390 S Bo:2:011:2 -115 4 = ffffffff
ffff8e2301f33740 2186144157 C Bo:2:011:2 0 32 >
ffff8e2301f32240 2186146862 C Bo:2:011:2 0 4 >
ffff8e2301f32e40 2186152415 C Bi:2:011:2 0 1 = 06
ffff8e2301f32e40 2186152417 S Bi:2:011:2 -115 32 <
ffff8e2301f32240 2186152847 S Bo:2:011:2 -115 32 = 57d18080 43074979 026f527e ffffffff ffffffff 154f2076 0e0a527e 430effff
ffff8e2301f33740 2186152850 S Bo:2:011:2 -115 32 = ffffffff 154f2076 0e0a527e 430effff ffffffff 0d074b17 090e5076 0dffffff
ffff8e2301f32240 2186152907 C Bo:2:011:2 0 32 >
ffff8e2301f32240 2186152909 S Bo:2:011:2 -115 32 = ffffffff 14185617 17064d72 631c4970 ffffffff 43075517 17064d72 631c4970
ffff8e2301f33740 2186152961 C Bo:2:011:2 0 32 >
ffff8e2301f33740 2186152963 S Bo:2:011:2 -115 32 = ffffffff 154f2061 0a0a5479 0202ffff ffffffff 011a5a6d 061dffff ffffffff
ffff8e2301f32240 2186155747 C Bo:2:011:2 0 32 >
ffff8e2301f32240 2186155749 S Bo:2:011:2 -115 4 = ffffffff
ffff8e2301f33740 2186158496 C Bo:2:011:2 0 32 >
ffff8e2301f32240 2186161235 C Bo:2:011:2 0 4 >
ffff8e2301f326c0 2186166736 C Bi:2:011:2 0 1 = 06
ffff8e2301f326c0 2186166737 S Bi:2:011:2 -115 32 <
ffff8e2301f32240 2186167115 S Bo:2:011:2 -115 32 = 57d20080 ffffffff ffffffff ffffffff ffffffff 10074179 1406437c ffffffff
ffff8e2301f33740 2186167118 S Bo:2:011:2 -115 32 = ffffffff 040e4e73 061dffff ffffffff ffffffff 0d0a5717 1a4f527c ffffffff
ffff8e2301f32240 2186167174 C Bo:2:011:2 0 32 >
ffff8e2301f32240 2186167176 S Bo:2:011:2 -115 32 = ffffffff 10074179 0d4f4e17 154f4c7a ffffffff 110e4617 154f4c7a 061bffff
ffff8e2301f33740 2186167223 C Bo:2:011:2 0 32 >
ffff8e2301f33740 2186167227 S Bo:2:011:2 -115 32 = ffffffff 10074179 0d4f4e17 154f4c7a ffffffff 040e4e73 061dffff ffffffff
ffff8e2301f32240 2186170033 C Bo:2:011:2 0 32 >
ffff8e2301f32240 2186170035 S Bo:2:011:2 -115 4 = ffffffff
ffff8e2301f33740 2186172744 C Bo:2:011:2 0 32 >
ffff8e2301f32240 2186175508 C Bo:2:011:2 0 4 >
ffff8e2301f32e40 2186181035 C Bi:2:011:2 0 1 = 06
ffff8e2301f32e40 2186181037 S Bi:2:011:2 -115 32 <
ffff8e2301f32240 2186181390 S Bo:2:011:2 -115 32 = 57d28080 10074179 1406437c ffffffff ffffffff 0d0a5717 1a4f527c ffffffff
ffff8e2301f33740 2186181394 S Bo:2:011:2 -115 32 = ffffffff 0d0a5717 1a4f527c ffffffff ffffffff 040e4e73 061dffff ffffffff
ffff8e2301f32240 2186181450 C Bo:2:011:2 0 32 >
ffff8e2301f32240 2186181451 S Bo:2:011:2 -115 32 = ffffffff 10074179 1406437c ffffffff ffffffff 10074179 0d4f4e17 154f4c7a
ffff8e2301f33740 2186181499 C Bo:2:011:2 0 32 >
ffff8e2301f33740 2186181500 S Bo:2:011:2 -115 32 = ffffffff 0d0a5717 1a4f527c ffffffff ffffffff 10074179 1406437c ffffffff
ffff8e2301f32240 2186184249 C Bo:2:011:2 0 32 >
ffff8e2301f32240 2186184250 S Bo:2:011:2 -115 4 = ffffffff
ffff8e2301f33740 2186187034 C Bo:2:011:2 0 32 >
ffff8e2301f32240 2186189785 C Bo:2:011:2 0 4 >
ffff8e2301f326c0 2186195214 C Bi:2:011:2 0 1 = 06
ffff8e2301f326c0 2186195215 S Bi:2:011:2 -115 32 <
ffff8e2301f32240 2186195592 S Bo:2:011:2 -115 32 = 58000080 424e0035 41000d79 00000060 00000000 00014f74 02034c32 4000003a
ffff8e2301f33740 2186195596 S Bo:2:011:2 -115 32 = 00000700 424e00ff 00ff0000 414c007e 11065364 ff4a4965 0a1c53ff 46ffffff
ffff8e2301f32240 2186195652 C Bo:2:011:2 0 32 >
ffff8e2301f32240 2186195653 S Bo:2:011:2 -115 32 = ffffffff ffffffff ffffffff ffffffff ffff0079 0c024564 100e4772 10ffffff
ffff8e2301f33740 2186195768 C Bo:2:011:2 0 32 >
ffff8e2301f33740 2186195769 S Bo:2:011:2 -115 32 = ffffffff ffffffff ffffffff ffffffff ffffffff ffffffff ffffff00 00ffffff
ffff8e2301f32240 2186198498 C Bo:2:011:2 0 32 >
ffff8e2301f32240 2186198500 S Bo:2:011:2 -115 4 = ffffffff
ffff8e2301f33740 2186201247 C Bo:2:011:2 0 32 >
ffff8e2301f32240 2186203988 C Bo:2:011:2 0 4 >
ffff8e2301f32e40 2186209724 C Bi:2:011:2 0 1 = 06
ffff8e2301f32e40 2186209726 S Bi:2:011:2 -115 32 <
ffff8e2301f32240 2186210110 S Bo:2:011:2 -115 1 = 45
ffff8e2301f32240 2186210147 C Bo:2:011:2 0 1 >
ffff8e23021506c0 2186210278 S Co:2:011:0 s 40 a4 ffff 0000 0000 0
ffff8e23021506c0 2186210343 C Co:2:011:0 0 0
ffff8e2301f326c0 2186212483 C Bi:2:011:2 -2 0
ffff8e2301f32e40 2186212524 C Bi:2:011:2 -2 1 = 06
ffff8e2301f33b00 2186216513 C Ii:2:011:1 -2:1 0
ffff8e2303c4c540 2186873870 C Ii:2:008:1 0:1 7 = 020000c0 ff0000
ffff8e2303c4c540 2186873905 S Ii:2:008:1 -115:1 8 <
ffff8e2303c4c540 2186881860 C Ii:2:008:1 0:1 7 = 0200ff7f ff0000
ffff8e2303c4c540 2186881885 S Ii:2:008:1 -115:1 8 <
ffff8e2303c4c540 2186889861 C Ii:2:008:1 0:1 7 = 0200fe4f ff0000
ffff8e2303c4c540 2186889888 S Ii:2:008:1 -115:1 8 <
ffff8e2303c4c540 2186897854 C Ii:2:008:1 0:1 7 = 0200fb1f ff0000
ffff8e2303c4c540 2186897882 S Ii:2:008:1 -115:1 8 <
ffff8e2303c4c540 2186905864 C Ii:2:008:1 0:1 7 = 0200f80f ff0000
ffff8e2303c4c540 2186905890 S Ii:2:008:1 -115:1 8 <
ffff8e2303c4c540 2186913863 C Ii:2:008:1 0:1 7 = 0200f62f ff0000
ffff8e2303c4c540 2186913889 S Ii:2:008:1 -115:1 8 <
ffff8e2303c4c540 2186921862 C Ii:2:008:1 0:1 7 = 0200f4ff fe0000
ffff8e2303c4c540 2186921888 S Ii:2:008:1 -115:1 8 <
ffff8e2303c4c540 2186929862 C Ii:2:008:1 0:1 7 = 0200f1ef fe0000
ffff8e2303c4c540 2186929889 S Ii:2:008:1 -115:1 8 <
ffff8e2303c4c540 2186937856 C Ii:2:008:1 0:1 7 = 0200edcf fe0000
ffff8e2303c4c540 2186937884 S Ii:2:008:1 -115:1 8 <
ffff8e2303c4c540 2186945855 C Ii:2:008:1 0:1 7 = 0200e99f fe0000
ffff8e2303c4c540 2186945882 S Ii:2:008:1 -115:1 8 <
ffff8e2303c4c540 2186953863 C Ii:2:008:1 0:1 7 = 0200e66f fe0000
ffff8e2303c4c540 2186953890 S Ii:2:008:1 -115:1 8 <
ffff8e2302151980 2186954120 S Bo:2:002:2 -115 31 = 55534243 8f050000 00000000 00000600 00000000 00000000 00000000 000000
ffff8e2302151980 2186954151 C Bo:2:002:2 0 31 >
ffff8e2302151980 2186954158 S Bi:2:002:1 -115 13 <
ffff8e2302151980 2186954201 C Bi:2:002:1 0 13 = 55534253 8f050000 00000000 00
ffff8e2303c4c540 2186961863 C Ii:2:008:1 0:1 7 = 0200e57f fe0000
ffff8e2303c4c540 2186961887 S Ii:2:008:1 -115:1 8 <
ffff8e2303c4c540 2186969861 C Ii:2:008:1 0:1 7 = 0200e58f fe0000
ffff8e2303c4c540 2186969887 S Ii:2:008:1 -115:1 8 <
ffff8e2303c4c540 2186977855 C Ii:2:008:1 0:1 7 = 0200e58f fe0000
ffff8e2303c4c540 2186977883 S Ii:2:008:1 -115:1 8 <
ffff8e2303c4c540 2186985860 C Ii:2:008:1 0:1 7 = 0200e59f fe0000
ffff8e2303c4c540 2186985888 S Ii:2:008:1 -115:1 8 <
ffff8e2303c4c540 2186993865 C Ii:2:008:1 0:1 7 = 0200e6cf fe0000
ffff8e2303c4c540 2186993892 S Ii:2:008:1 -115:1 8 <
ffff8e2303c4c540 2187001832 C Ii:2:008:1 0:1 7 = 0200e8cf fe0000
ffff8e2303c4c540 2187001866 S Ii:2:008:1 -115:1 8 <
ffff8e2303c4c540 2187009855 C Ii:2:008:1 0:1 7 = 0200eaff fe0000
ffff8e2303c4c540 2187009883 S Ii:2:008:1 -115:1 8 <
ffff8e2303c4c540 2187017864 C Ii:2:008:1 0:1 7 = 0200eb1f ff0000
ffff8e2303c4c540 2187017890 S Ii:2:008:1 -115:1 8 <
ffff8e2303c4c540 2187025861 C Ii:2:008:1 0:1 7 = 0200eb1f ff0000
ffff8e2303c4c540 2187025888 S Ii:2:008:1 -115:1 8 <
ffff8e2303c4c540 2187033861 C Ii:2:008:1 0:1 7 = 0200eb1f ff0000
ffff8e2303c4c540 2187033888 S Ii:2:008:1 -115:1 8 <
ffff8e2303c4c540 2187041854 C Ii:2:008:1 0:1 7 = 0200ea1f ff0000
ffff8e2303c4c540 2187041881 S Ii:2:008:1 -115:1 8 <
ffff8e2303c4c540 2187049861 C Ii:2:008:1 0:1 7 = 0200e80f ff0000
ffff8e2303c4c540 2187049889 S Ii:2:008:1 -115:1 8 <
ffff8e2303c4c540 2187057865 C Ii:2:008:1 0:1 7 = 0200e7ef fe0000
ffff8e2303c4c540 2187057891 S Ii:2:008:1 -115:1 8 <
ffff8e2303c4c540 2187065863 C Ii:2:008:1 0:1 7 = 0200e70f ff0000
ffff8e2303c4c540 2187065889 S Ii:2:008:1 -115:1 8 <
ffff8e2303c4c540 2187073864 C Ii:2:008:1 0:1 7 = 0200e7ff fe0000
ffff8e2303c4c540 2187073890 S Ii:2:008:1 -115:1 8 <
ffff8e2303c4c540 2187081855 C Ii:2:008:1 0:1 7 = 0200e8ff fe0000
ffff8e2303c4c540 2187081882 S Ii:2:008:1 -115:1 8 <
ffff8e2303c4c540 2187089861 C Ii:2:008:1 0:1 7 = 0200ea0f ff0000
ffff8e2303c4c540 2187089888 S Ii:2:008:1 -115:1 8 <
ffff8e2303c4c540 2187097864 C Ii:2:008:1 0:1 7 = 0200ecff fe0000
ffff8e2303c4c540 2187097890 S Ii:2:008:1 -115:1 8 <
ffff8e2303c4c540 2187105865 C Ii:2:008:1 0:1 7 = 0200ec0f ff0000
ffff8e2303c4c540 2187105891 S Ii:2:008:1 -115:1 8 <
ffff8e2303c4c540 2187113861 C Ii:2:008:1 0:1 7 = 0200ed1f ff0000
ffff8e2303c4c540 2187113888 S Ii:2:008:1 -115:1 8 <
ffff8e2303c4c540 2187121859 C Ii:2:008:1 0:1 7 = 0200ed2f ff0000
ffff8e2303c4c540 2187121886 S Ii:2:008:1 -115:1 8 <
ffff8e2303c4c540 2187129856 C Ii:2:008:1 0:1 7 = 0200ef6f ff0000
ffff8e2303c4c540 2187129884 S Ii:2:008:1 -115:1 8 <
ffff8e2303c4c540 2187137868 C Ii:2:008:1 0:1 7 = 0200f17f ff0000
ffff8e2303c4c540 2187137895 S Ii:2:008:1 -115:1 8 <
ffff8e2303c4c540 2187145867 C Ii:2:008:1 0:1 7 = 0200f39f ff0000
ffff8e2303c4c540 2187145893 S Ii:2:008:1 -115:1 8 <
ffff8e2303c4c540 2187153857 C Ii:2:008:1 0:1 7 = 0200f49f ff0000
ffff8e2303c4c540 2187153885 S Ii:2:008:1 -115:1 8 <
ffff8e2303c4c540 2187161856 C Ii:2:008:1 0:1 7 = 0200f4af ff0000
ffff8e2303c4c540 2187161882 S Ii:2:008:1 -115:1 8 <
ffff8e2303c4c540 2187169863 C Ii:2:008:1 0:1 7 = 0200f5af ff0000
ffff8e2303c4c540 2187169889 S Ii:2:008:1 -115:1 8 <
ffff8e2303c4c540 2187177865 C Ii:2:008:1 0:1 7 = 0200f5af ff0000
ffff8e2303c4c540 2187177891 S Ii:2:008:1 -115:1 8 <
ffff8e2303c4c540 2187185855 C Ii:2:008:1 0:1 7 = 0200f4af ff0000
ffff8e2303c4c540 2187185882 S Ii:2:008:1 -115:1 8 <
ffff8e2303c4c540 2187193856 C Ii:2:008:1 0:1 7 = 0200f5af ff0000
ffff8e2303c4c540 2187193883 S Ii:2:008:1 -115:1 8 <
ffff8e2303c4c540 2187201866 C Ii:2:008:1 0:1 7 = 0200f4af ff0000
ffff8e2303c4c540 2187201893 S Ii:2:008:1 -115:1 8 <
ffff8e2303c4c540 2187209865 C Ii:2:008:1 0:1 7 = 0200f5af ff0000
ffff8e2303c4c540 2187209891 S Ii:2:008:1 -115:1 8 <
ffff8e2303c4c540 2187217861 C Ii:2:008:1 0:1 7 = 0200f6bf ff0000
ffff8e2303c4c540 2187217888 S Ii:2:008:1 -115:1 8 <
ffff8e2303c4c540 2187225864 C Ii:2:008:1 0:1 7 = 0200f8bf ff0000
ffff8e2303c4c540 2187225890 S Ii:2:008:1 -115:1 8 <
ffff8e2303c4c540 2187233827 C Ii:2:008:1 0:1 7 = 0200f8af ff0000
ffff8e2303c4c540 2187233849 S Ii:2:008:1 -115:1 8 <
ffff8e2303c4c540 2187241866 C Ii:2:008:1 0:1 7 = 0200f7bf ff0000
ffff8e2303c4c540 2187241893 S Ii:2:008:1 -115:1 8 <
ffff8e2303c4c540 2187249864 C Ii:2:008:1 0:1 7 = 0200f5af ff0000
ffff8e2303c4c540 2187249890 S Ii:2:008:1 -115:1 8 <
ffff8e2303c4c540 2187257865 C Ii:2:008:1 0:1 7 = 0200f4af ff0000
ffff8e2303c4c540 2187257891 S Ii:2:008:1 -115:1 8 <
ffff8e2303c4c540 2187265864 C Ii:2:008:1 0:1 7 = 0200f3af ff0000
ffff8e2303c4c540 2187265891 S Ii:2:008:1 -115:1 8 <
ffff8e2303c4c540 2187273856 C Ii:2:008:1 0:1 7 = 0200f5bf ff0000
ffff8e2303c4c540 2187273883 S Ii:2:008:1 -115:1 8 <
ffff8e2303c4c540 2187281856 C Ii:2:008:1 0:1 7 = 0200f6bf ff0000
ffff8e2303c4c540 2187281883 S Ii:2:008:1 -115:1 8 <
ffff8e2303c4c540 2187289865 C Ii:2:008:1 0:1 7 = 0200f4df ff0000
ffff8e2303c4c540 2187289891 S Ii:2:008:1 -115:1 8 <
ffff8e2303c4c540 2187297862 C Ii:2:008:1 0:1 7 = 0200f8ef ff0000
ffff8e2303c4c540 2187297888 S Ii:2:008:1 -115:1 8 <
ffff8e2303c4c540 2187305862 C Ii:2:008:1 0:1 7 = 0200f7df ff0000
ffff8e2303c4c540 2187305888 S Ii:2:008:1 -115:1 8 <
ffff8e2303c4c540 2187313856 C Ii:2:008:1 0:1 7 = 0200f8ef ff0000
ffff8e2303c4c540 2187313882 S Ii:2:008:1 -115:1 8 <
ffff8e2303c4c540 2187321856 C Ii:2:008:1 0:1 7 = 0200fbcf ff0000
ffff8e2303c4c540 2187321882 S Ii:2:008:1 -115:1 8 <
ffff8e2303c4c540 2187329864 C Ii:2:008:1 0:1 7 = 0200fbdf ff0000
ffff8e2303c4c540 2187329891 S Ii:2:008:1 -115:1 8 <
ffff8e2303c4c540 2187337865 C Ii:2:008:1 0:1 7 = 0200fdef ff0000
ffff8e2303c4c540 2187337891 S Ii:2:008:1 -115:1 8 <
ffff8e2303c4c540 2187345856 C Ii:2:008:1 0:1 7 = 0200fedf ff0000
ffff8e2303c4c540 2187345883 S Ii:2:008:1 -115:1 8 <
ffff8e2303c4c540 2187353856 C Ii:2:008:1 0:1 7 = 0200feef ff0000
ffff8e2303c4c540 2187353884 S Ii:2:008:1 -115:1 8 <
ffff8e2303c4c540 2187361862 C Ii:2:008:1 0:1 7 = 0200fccf ff0000
ffff8e2303c4c540 2187361888 S Ii:2:008:1 -115:1 8 <
ffff8e2303c4c540 2187369857 C Ii:2:008:1 0:1 7 = 0200fcdf ff0000
ffff8e2303c4c540 2187369884 S Ii:2:008:1 -115:1 8 <
ffff8e2303c4c540 2187377857 C Ii:2:008:1 0:1 7 = 0200fcef ff0000
ffff8e2303c4c540 2187377884 S Ii:2:008:1 -115:1 8 <
ffff8e2303c4c540 2187385834 C Ii:2:008:1 0:1 7 = 0200fcdf ff0000
ffff8e2303c4c540 2187385869 S Ii:2:008:1 -115:1 8 <
ffff8e2303c4c540 2187393855 C Ii:2:008:1 0:1 7 = 0200fcdf ff0000
ffff8e2303c4c540 2187393882 S Ii:2:008:1 -115:1 8 <
ffff8e2303c4c540 2187401856 C Ii:2:008:1 0:1 7 = 0200fbdf ff0000
ffff8e2303c4c540 2187401882 S Ii:2:008:1 -115:1 8 <
ffff8e2303c4c540 2187409864 C Ii:2:008:1 0:1 7 = 0200fbdf ff0000
ffff8e2303c4c540 2187409891 S Ii:2:008:1 -115:1 8 <
ffff8e2303c4c540 2187417862 C Ii:2:008:1 0:1 7 = 0200fadf ff0000
ffff8e2303c4c540 2187417888 S Ii:2:008:1 -115:1 8 <
ffff8e2303c4c540 2187425863 C Ii:2:008:1 0:1 7 = 0200fadf ff0000
ffff8e2303c4c540 2187425889 S Ii:2:008:1 -115:1 8 <
ffff8e2303c4c540 2187433857 C Ii:2:008:1 0:1 7 = 0200fcdf ff0000
ffff8e2303c4c540 2187433885 S Ii:2:008:1 -115:1 8 <
ffff8e2303c4c540 2187441863 C Ii:2:008:1 0:1 7 = 0200facf ff0000
ffff8e2303c4c540 2187441889 S Ii:2:008:1 -115:1 8 <
ffff8e2303c4c540 2187449862 C Ii:2:008:1 0:1 7 = 0200fcbf ff0000
ffff8e2303c4c540 2187449888 S Ii:2:008:1 -115:1 8 <
ffff8e2303c4c540 2187457862 C Ii:2:008:1 0:1 7 = 0200fcdf ff0000
ffff8e2303c4c540 2187457889 S Ii:2:008:1 -115:1 8 <
ffff8e2303c4c540 2187465829 C Ii:2:008:1 0:1 7 = 0200fdcf ff0000
ffff8e2303c4c540 2187465850 S Ii:2:008:1 -115:1 8 <
ffff8e2303c4c540 2187473857 C Ii:2:008:1 0:1 7 = 0200fccf ff0000
ffff8e2303c4c540 2187473885 S Ii:2:008:1 -115:1 8 <
ffff8e2303c4c540 2187481835 C Ii:2:008:1 0:1 7 = 0200fdef ff0000
ffff8e2303c4c540 2187481859 S Ii:2:008:1 -115:1 8 <
ffff8e2303c4c540 2187489862 C Ii:2:008:1 0:1 7 = 0200fdcf ff0000
ffff8e2303c4c540 2187489888 S Ii:2:008:1 -115:1 8 <
ffff8e2303c4c540 2187497833 C Ii:2:008:1 0:1 7 = 0200fedf ff0000
ffff8e2303c4c540 2187497869 S Ii:2:008:1 -115:1 8 <
ffff8e2303c4c540 2187505857 C Ii:2:008:1 0:1 7 = 0200feef ff0000
ffff8e2303c4c540 2187505884 S Ii:2:008:1 -115:1 8 <
ffff8e2303c4c540 2187513856 C Ii:2:008:1 0:1 7 = 0200fddf ff0000
ffff8e2303c4c540 2187513883 S Ii:2:008:1 -115:1 8 <
ffff8e2303c4c540 2187521864 C Ii:2:008:1 0:1 7 = 0200feef ff0000
ffff8e2303c4c540 2187521888 S Ii:2:008:1 -115:1 8 <
ffff8e2303c4c540 2187529863 C Ii:2:008:1 0:1 7 = 0200feff ff0000
ffff8e2303c4c540 2187529889 S Ii:2:008:1 -115:1 8 <
ffff8e2303c4c540 2187537867 C Ii:2:008:1 0:1 7 = 0200feff ff0000
ffff8e2303c4c540 2187537894 S Ii:2:008:1 -115:1 8 <
ffff8e2303c4c540 2187545867 C Ii:2:008:1 0:1 7 = 0200ffff ff0000
ffff8e2303c4c540 2187545893 S Ii:2:008:1 -115:1 8 <
ffff8e2303c4c540 2187561859 C Ii:2:008:1 0:1 7 = 0200ffff ff0000
ffff8e2303c4c540 2187561885 S Ii:2:008:1 -115:1 8 <
ffff8e2303c4c540 2187569866 C Ii:2:008:1 0:1 7 = 0200ffff ff0000
ffff8e2303c4c540 2187569893 S Ii:2:008:1 -115:1 8 <
ffff8e2303c4c540 2187625867 C Ii:2:008:1 0:1 7 = 020000f0 ff0000
ffff8e2303c4c540 2187625893 S Ii:2:008:1 -115:1 8 <
ffff8e2303c4c540 2187641867 C Ii:2:008:1 0:1 7 = 020000e0 ff0000
ffff8e2303c4c540 2187641893 S Ii:2:008:1 -115:1 8 <
ffff8e2303c4c540 2187649863 C Ii:2:008:1 0:1 7 = 020000f0 ff0000
ffff8e2303c4c540 2187649889 S Ii:2:008:1 -115:1 8 <
ffff8e2303c4c540 2187657863 C Ii:2:008:1 0:1 7 = 020000e0 ff0000
ffff8e2303c4c540 2187657889 S Ii:2:008:1 -115:1 8 <
ffff8e2303c4c540 2187665863 C Ii:2:008:1 0:1 7 = 020000f0 ff0000
ffff8e2303c4c540 2187665890 S Ii:2:008:1 -115:1 8 <
ffff8e2303c4c540 2187673858 C Ii:2:008:1 0:1 7 = 020000e0 ff0000
ffff8e2303c4c540 2187673885 S Ii:2:008:1 -115:1 8 <
ffff8e2303c4c540 2187681869 C Ii:2:008:1 0:1 7 = 0200ffef ff0000
ffff8e2303c4c540 2187681895 S Ii:2:008:1 -115:1 8 <
ffff8e2303c4c540 2187689863 C Ii:2:008:1 0:1 7 = 0200feef ff0000
ffff8e2303c4c540 2187689890 S Ii:2:008:1 -115:1 8 <
ffff8e2303c4c540 2187697865 C Ii:2:008:1 0:1 7 = 0200feef ff0000
ffff8e2303c4c540 2187697891 S Ii:2:008:1 -115:1 8 <
ffff8e2303c4c540 2187705858 C Ii:2:008:1 0:1 7 = 0200feff ff0000
ffff8e2303c4c540 2187705885 S Ii:2:008:1 -115:1 8 <
ffff8e2303c4c540 2187713863 C Ii:2:008:1 0:1 7 = 0200ffff ff0000
ffff8e2303c4c540 2187713890 S Ii:2:008:1 -115:1 8 <
ffff8e2303c4c540 2187721864 C Ii:2:008:1 0:1 7 = 0200ffff ff0000
ffff8e2303c4c540 2187721890 S Ii:2:008:1 -115:1 8 <
ffff8e2303c4c540 2187761865 C Ii:2:008:1 0:1 7 = 0200ffff ff0000
ffff8e2303c4c540 2187761889 S Ii:2:008:1 -115:1 8 <
ffff8e2303c4c540 2187777865 C Ii:2:008:1 0:1 7 = 0200ffff ff0000
ffff8e2303c4c540 2187777890 S Ii:2:008:1 -115:1 8 <
ffff8e2303c4c540 2187785858 C Ii:2:008:1 0:1 7 = 0200ffff ff0000
ffff8e2303c4c540 2187785885 S Ii:2:008:1 -115:1 8 <
ffff8e2303c4c540 2187825864 C Ii:2:008:1 0:1 7 = 0200ffff ff0000
ffff8e2303c4c540 2187825890 S Ii:2:008:1 -115:1 8 <
ffff8e2303c4c540 2187833868 C Ii:2:008:1 0:1 7 = 020000e0 ff0000
ffff8e2303c4c540 2187833893 S Ii:2:008:1 -115:1 8 <
ffff8e2303c4c540 2187841865 C Ii:2:008:1 0:1 7 = 0200feef ff0000
ffff8e2303c4c540 2187841891 S Ii:2:008:1 -115:1 8 <
ffff8e2303c4c540 2187849869 C Ii:2:008:1 0:1 7 = 0200ffef ff0000
ffff8e2303c4c540 2187849895 S Ii:2:008:1 -115:1 8 <
ffff8e2303c4c540 2187857868 C Ii:2:008:1 0:1 7 = 0200ffff ff0000
ffff8e2303c4c540 2187857894 S Ii:2:008:1 -115:1 8 <
ffff8e2303c4c540 2187865857 C Ii:2:008:1 0:1 7 = 0200feef ff0000
ffff8e2303c4c540 2187865884 S Ii:2:008:1 -115:1 8 <
ffff8e2303c4c540 2187881858 C Ii:2:008:1 0:1 7 = 0200feef ff0000
ffff8e2303c4c540 2187881885 S Ii:2:008:1 -115:1 8 <
ffff8e2303c4c540 2187889858 C Ii:2:008:1 0:1 7 = 0200ffff ff0000
ffff8e2303c4c540 2187889886 S Ii:2:008:1 -115:1 8 <
ffff8e2303c4c540 2187897859 C Ii:2:008:1 0:1 7 = 0200feef ff0000
ffff8e2303c4c540 2187897885 S Ii:2:008:1 -115:1 8 <
ffff8e2303c4c540 2187905859 C Ii:2:008:1 0:1 7 = 0200ffff ff0000
ffff8e2303c4c540 2187905885 S Ii:2:008:1 -115:1 8 <
ffff8e2303c4c540 2187913830 C Ii:2:008:1 0:1 7 = 0200ffff ff0000
ffff8e2303c4c540 2187913852 S Ii:2:008:1 -115:1 8 <
ffff8e2303c4c540 2187921864 C Ii:2:008:1 0:1 7 = 0200ffff ff0000
ffff8e2303c4c540 2187921890 S Ii:2:008:1 -115:1 8 <
ffff8e2303c4c540 2188017861 C Ii:2:008:1 0:1 7 = 0200ffff ff0000
ffff8e2303c4c540 2188017889 S Ii:2:008:1 -115:1 8 <
ffff8e2303c4c540 2188033860 C Ii:2:008:1 0:1 7 = 0200feef ff0000
ffff8e2303c4c540 2188033887 S Ii:2:008:1 -115:1 8 <
ffff8e2303c4c540 2188041867 C Ii:2:008:1 0:1 7 = 0200fedf ff0000
ffff8e2303c4c540 2188041893 S Ii:2:008:1 -115:1 8 <
ffff8e2303c4c540 2188049859 C Ii:2:008:1 0:1 7 = 0200feef ff0000
ffff8e2303c4c540 2188049887 S Ii:2:008:1 -115:1 8 <
ffff8e2303c4c540 2188057868 C Ii:2:008:1 0:1 7 = 0200fdcf ff0000
ffff8e2303c4c540 2188057894 S Ii:2:008:1 -115:1 8 <
ffff8e2303c4c540 2188065860 C Ii:2:008:1 0:1 7 = 0200fddf ff0000
ffff8e2303c4c540 2188065887 S Ii:2:008:1 -115:1 8 <
ffff8e2303c4c540 2188073860 C Ii:2:008:1 0:1 7 = 0200fddf ff0000
ffff8e2303c4c540 2188073887 S Ii:2:008:1 -115:1 8 <
ffff8e2303c4c540 2188081865 C Ii:2:008:1 0:1 7 = 0200facf ff0000
ffff8e2303c4c540 2188081892 S Ii:2:008:1 -115:1 8 <
ffff8e2303c4c540 2188089859 C Ii:2:008:1 0:1 7 = 0200fbdf ff0000
ffff8e2303c4c540 2188089886 S Ii:2:008:1 -115:1 8 <
ffff8e2303c4c540 2188097865 C Ii:2:008:1 0:1 7 = 0200fccf ff0000
ffff8e2303c4c540 2188097891 S Ii:2:008:1 -115:1 8 <
ffff8e2303c4c540 2188105859 C Ii:2:008:1 0:1 7 = 0200fcef ff0000
ffff8e2303c4c540 2188105886 S Ii:2:008:1 -115:1 8 <
ffff8e2303c4c540 2188113869 C Ii:2:008:1 0:1 7 = 0200feef ff0000
ffff8e2303c4c540 2188113896 S Ii:2:008:1 -115:1 8 <
ffff8e2303c4c540 2188121869 C Ii:2:008:1 0:1 7 = 0200ff0f 000000
ffff8e2303c4c540 2188121895 S Ii:2:008:1 -115:1 8 <
ffff8e2303c4c540 2188129858 C Ii:2:008:1 0:1 7 = 0200ff0f 000000
ffff8e2303c4c540 2188129884 S Ii:2:008:1 -115:1 8 <
ffff8e2303c4c540 2188297866 C Ii:2:008:1 0:1 7 = 02010000 000000
ffff8e2303c4c540 2188297893 S Ii:2:008:1 -115:1 8 <
ffff8e2303c4c540 2188369860 C Ii:2:008:1 0:1 7 = 02000000 000000
ffff8e2303c4c540 2188369888 S Ii:2:008:1 -115:1 8 <
ffff8e2303c4c540 2188537875 C Ii:2:008:1 0:1 7 = 0200fd1f 000000
ffff8e2303c4c540 2188537907 S Ii:2:008:1 -115:1 8 <
ffff8e2303c4c540 2188545867 C Ii:2:008:1 0:1 7 = 0200fa3f 000000
ffff8e2303c4c540 2188545893 S Ii:2:008:1 -115:1 8 <
ffff8e2303c4c540 2188553870 C Ii:2:008:1 0:1 7 = 0200f57f 000000
ffff8e2303c4c540 2188553896 S Ii:2:008:1 -115:1 8 <
ffff8e2303c4c540 2188561861 C Ii:2:008:1 0:1 7 = 0200eedf 000000
ffff8e2303c4c540 2188561889 S Ii:2:008:1 -115:1 8 <
ffff8e2303c4c540 2188569868 C Ii:2:008:1 0:1 7 = 0200ea2f 010000
ffff8e2303c4c540 2188569893 S Ii:2:008:1 -115:1 8 <
ffff8e2303c4c540 2188577868 C Ii:2:008:1 0:1 7 = 0200e75f 010000
ffff8e2303c4c540 2188577894 S Ii:2:008:1 -115:1 8 <
ffff8e2303c4c540 2188585872 C Ii:2:008:1 0:1 7 = 0200e85f 010000
ffff8e2303c4c540 2188585899 S Ii:2:008:1 -115:1 8 <
ffff8e2303c4c540 2188593861 C Ii:2:008:1 0:1 7 = 0200e85f 010000
ffff8e2303c4c540 2188593887 S Ii:2:008:1 -115:1 8 <
ffff8e2303c4c540 2188601833 C Ii:2:008:1 0:1 7 = 0200eb4f 010000
ffff8e2303c4c540 2188601857 S Ii:2:008:1 -115:1 8 <
ffff8e2303c4c540 2188609870 C Ii:2:008:1 0:1 7 = 0200eb5f 010000
ffff8e2303c4c540 2188609896 S Ii:2:008:1 -115:1 8 <
ffff8e2303c4c540 2188617870 C Ii:2:008:1 0:1 7 = 0200ea5f 010000
ffff8e2303c4c540 2188617895 S Ii:2:008:1 -115:1 8 <
ffff8e2303c4c540 2188625871 C Ii:2:008:1 0:1 7 = 0200ea7f 010000
ffff8e2303c4c540 2188625898 S Ii:2:008:1 -115:1 8 <
ffff8e2303c4c540 2188633867 C Ii:2:008:1 0:1 7 = 0200e97f 010000
ffff8e2303c4c540 2188633893 S Ii:2:008:1 -115:1 8 <
ffff8e2303c4c540 2188641860 C Ii:2:008:1 0:1 7 = 0200e88f 010000
ffff8e2303c4c540 2188641886 S Ii:2:008:1 -115:1 8 <
ffff8e2303c4c540 2188649871 C Ii:2:008:1 0:1 7 = 0200e88f 010000
ffff8e2303c4c540 2188649897 S Ii:2:008:1 -115:1 8 <
ffff8e2303c4c540 2188657870 C Ii:2:008:1 0:1 7 = 0200e69f 010000
ffff8e2303c4c540 2188657896 S Ii:2:008:1 -115:1 8 <
ffff8e2303c4c540 2188665868 C Ii:2:008:1 0:1 7 = 0200e89f 010000
ffff8e2303c4c540 2188665896 S Ii:2:008:1 -115:1 8 <
ffff8e2303c4c540 2188673871 C Ii:2:008:1 0:1 7 = 0200e98f 010000
ffff8e2303c4c540 2188673897 S Ii:2:008:1 -115:1 8 <
ffff8e2303c4c540 2188681861 C Ii:2:008:1 0:1 7 = 0200ea8f 010000
ffff8e2303c4c540 2188681889 S Ii:2:008:1 -115:1 8 <
ffff8e2303c4c540 2188688868 C Ii:2:008:1 0:1 7 = 0200ee7f 010000
ffff8e2303c4c540 2188688895 S Ii:2:008:1 -115:1 8 <
ffff8e2303c4c540 2188696870 C Ii:2:008:1 0:1 7 = 0200ee6f 010000
ffff8e2303c4c540 2188696896 S Ii:2:008:1 -115:1 8 <
ffff8e2303c4c540 2188704870 C Ii:2:008:1 0:1 7 = 0200f05f 010000
ffff8e2303c4c540 2188704896 S Ii:2:008:1 -115:1 8 <
ffff8e2303c4c540 2188712861 C Ii:2:008:1 0:1 7 = 0200f07f 010000
ffff8e2303c4c540 2188712889 S Ii:2:008:1 -115:1 8 <
ffff8e2303c4c540 2188720861 C Ii:2:008:1 0:1 7 = 0200f06f 010000
ffff8e2303c4c540 2188720887 S Ii:2:008:1 -115:1 8 <
ffff8e2303c4c540 2188728862 C Ii:2:008:1 0:1 7 = 0200f16f 010000
ffff8e2303c4c540 2188728890 S Ii:2:008:1 -115:1 8 <
ffff8e2303c4c540 2188736861 C Ii:2:008:1 0:1 7 = 0200f41f 010000
ffff8e2303c4c540 2188736887 S Ii:2:008:1 -115:1 8 <
ffff8e2303c4c540 2188744868 C Ii:2:008:1 0:1 7 = 0200f4ff 000000
ffff8e2303c4c540 2188744894 S Ii:2:008:1 -115:1 8 <
ffff8e2303c4c540 2188752863 C Ii:2:008:1 0:1 7 = 0200f5df 000000
ffff8e2303c4c540 2188752891 S Ii:2:008:1 -115:1 8 <
ffff8e2303c4c540 2188760868 C Ii:2:008:1 0:1 7 = 0200f6cf 000000
ffff8e2303c4c540 2188760894 S Ii:2:008:1 -115:1 8 <
ffff8e2303c4c540 2188768862 C Ii:2:008:1 0:1 7 = 0200f4ef 000000
ffff8e2303c4c540 2188768889 S Ii:2:008:1 -115:1 8 <
ffff8e2303c4c540 2188776868 C Ii:2:008:1 0:1 7 = 0200f7bf 000000
ffff8e2303c4c540 2188776894 S Ii:2:008:1 -115:1 8 <
ffff8e2303c4c540 2188784871 C Ii:2:008:1 0:1 7 = 0200f9af 000000
ffff8e2303c4c540 2188784897 S Ii:2:008:1 -115:1 8 <
ffff8e2303c4c540 2188792868 C Ii:2:008:1 0:1 7 = 0200fa9f 000000
ffff8e2303c4c540 2188792894 S Ii:2:008:1 -115:1 8 <
ffff8e2303c4c540 2188800863 C Ii:2:008:1 0:1 7 = 0200fb9f 000000
ffff8e2303c4c540 2188800889 S Ii:2:008:1 -115:1 8 <
ffff8e2303c4c540 2188808869 C Ii:2:008:1 0:1 7 = 0200fa9f 000000
ffff8e2303c4c540 2188808895 S Ii:2:008:1 -115:1 8 <
ffff8e2303c4c540 2188816868 C Ii:2:008:1 0:1 7 = 0200fb7f 000000
ffff8e2303c4c540 2188816895 S Ii:2:008:1 -115:1 8 <
ffff8e2303c4c540 2188824868 C Ii:2:008:1 0:1 7 = 0200fc5f 000000
ffff8e2303c4c540 2188824894 S Ii:2:008:1 -115:1 8 <
ffff8e2303c4c540 2188832870 C Ii:2:008:1 0:1 7 = 0200fd3f 000000
ffff8e2303c4c540 2188832895 S Ii:2:008:1 -115:1 8 <
ffff8e2303c4c540 2188840864 C Ii:2:008:1 0:1 7 = 0200ff0f 000000
ffff8e2303c4c540 2188840891 S Ii:2:008:1 -115:1 8 <
ffff8e2303c4c540 2188848868 C Ii:2:008:1 0:1 7 = 0200ff1f 000000
ffff8e2303c4c540 2188848893 S Ii:2:008:1 -115:1 8 <
ffff8e2303c4c540 2189000864 C Ii:2:008:1 0:1 7 = 020000f0 ff0000
ffff8e2303c4c540 2189000892 S Ii:2:008:1 -115:1 8 <
ffff8e2302151980 2189002088 S Bo:2:002:2 -115 31 = 55534243 90050000 00000000 00000600 00000000 00000000 00000000 000000
ffff8e2302151980 2189002115 C Bo:2:002:2 0 31 >
ffff8e2302151980 2189002123 S Bi:2:002:1 -115 13 <
ffff8e2302151980 2189002159 C Bi:2:002:1 0 13 = 55534253 90050000 00000000 00
ffff8e2303c4c540 2189016870 C Ii:2:008:1 0:1 7 = 020000e0 ff0000
ffff8e2303c4c540 2189016896 S Ii:2:008:1 -115:1 8 <
ffff8e2303c4c540 2189024871 C Ii:2:008:1 0:1 7 = 020000f0 ff0000
ffff8e2303c4c540 2189024897 S Ii:2:008:1 -115:1 8 <
ffff8e2303c4c540 2189032870 C Ii:2:008:1 0:1 7 = 020000f0 ff0000
ffff8e2303c4c540 2189032896 S Ii:2:008:1 -115:1 8 <
ffff8e2303c4c540 2189040871 C Ii:2:008:1 0:1 7 = 020000f0 ff0000
ffff8e2303c4c540 2189040898 S Ii:2:008:1 -115:1 8 <
ffff8e2303c4c540 2189144874 C Ii:2:008:1 0:1 7 = 02010000 000000
ffff8e2303c4c540 2189144901 S Ii:2:008:1 -115:1 8 <
ffff8e2303c4c540 2189240840 C Ii:2:008:1 0:1 7 = 02000000 000000
ffff8e2303c4c540 2189240870 S Ii:2:008:1 -115:1 8 <
ffff8e2315a10f00 2190383850 C Ii:2:005:1 0:16 8 = 00000600 00000000
ffff8e2315a10f00 2190383886 S Ii:2:005:1 -115:16 8 <
ffff8e2315a10f00 2190495845 C Ii:2:005:1 0:16 8 = 00000000 00000000
ffff8e2315a10f00 2190495869 S Ii:2:005:1 -115:16 8 <
ffff8e2315a10f00 2190607884 C Ii:2:005:1 0:16 8 = 00001200 00000000
ffff8e2315a10f00 2190607910 S Ii:2:005:1 -115:16 8 <
ffff8e2315a10f00 2190703848 C Ii:2:005:1 0:16 8 = 00001012 00000000
ffff8e2315a10f00 2190703872 S Ii:2:005:1 -115:16 8 <
ffff8e2315a10f00 2190735878 C Ii:2:005:1 0:16 8 = 00001000 00000000
ffff8e2315a10f00 2190735904 S Ii:2:005:1 -115:16 8 <
ffff8e2315a10f00 2190783878 C Ii:2:005:1 0:16 8 = 00000000 00000000
ffff8e2315a10f00 2190783903 S Ii:2:005:1 -115:16 8 <
ffff8e2315a10f00 2190879883 C Ii:2:005:1 0:16 8 = 00001300 00000000
ffff8e2315a10f00 2190879908 S Ii:2:005:1 -115:16 8 <
ffff8e2315a10f00 2190959882 C Ii:2:005:1 0:16 8 = 00000f13 00000000
ffff8e2315a10f00 2190959908 S Ii:2:005:1 -115:16 8 <
ffff8e2315a10f00 2190975849 C Ii:2:005:1 0:16 8 = 0000080f 13000000
ffff8e2315a10f00 2190975880 S Ii:2:005:1 -115:16 8 <
ffff8e2315a10f00 2190991873 C Ii:2:005:1 0:16 8 = 0000080f 00000000
ffff8e2315a10f00 2190991901 S Ii:2:005:1 -115:16 8 <
ffff8e2302151980 2191050179 S Bo:2:002:2 -115 31 = 55534243 91050000 00000000 00000600 00000000 00000000 00000000 000000
ffff8e2302151980 2191050211 C Bo:2:002:2 0 31 >
ffff8e2302151980 2191050218 S Bi:2:002:1 -115 13 <
ffff8e2302151980 2191050255 C Bi:2:002:1 0 13 = 55534253 91050000 00000000 00
ffff8e2315a10f00 2191071883 C Ii:2:005:1 0:16 8 = 00000817 00000000
ffff8e2315a10f00 2191071911 S Ii:2:005:1 -115:16 8 <
ffff8e2315a10f00 2191087847 C Ii:2:005:1 0:16 8 = 00001700 00000000
ffff8e2315a10f00 2191087871 S Ii:2:005:1 -115:16 8 <
ffff8e2315a10f00 2191183880 C Ii:2:005:1 0:16 8 = 00000800 00000000
ffff8e2315a10f00 2191183907 S Ii:2:005:1 -115:16 8 <
ffff8e2315a10f00 2191279875 C Ii:2:005:1 0:16 8 = 00000000 00000000
ffff8e2315a10f00 2191279901 S Ii:2:005:1 -115:16 8 <
ffff8e2315a10f00 2191343885 C Ii:2:005:1 0:16 8 = 00002800 00000000
ffff8e2315a10f00 2191343911 S Ii:2:005:1 -115:16 8 <
ffff8e2315a10f00 2191407852 C Ii:2:005:1 0:16 8 = 00000000 00000000
ffff8e2315a10f00 2191407891 S Ii:2:005:1 -115:16 8 <
ffff8e2302151980 2193098149 S Bo:2:002:2 -115 31 = 55534243 92050000 00000000 00000600 00000000 00000000 00000000 000000
ffff8e2302151980 2193098182 C Bo:2:002:2 0 31 >
ffff8e2302151980 2193098191 S Bi:2:002:1 -115 13 <
ffff8e2302151980 2193098221 C Bi:2:002:1 0 13 = 55534253 92050000 00000000 00
ffff8e2302151980 2195147173 S Bo:2:002:2 -115 31 = 55534243 93050000 00000000 00000600 00000000 00000000 00000000 000000
ffff8e2302151980 2195147205 C Bo:2:002:2 0 31 >
ffff8e2302151980 2195147213 S Bi:2:002:1 -115 13 <
ffff8e2302151980 2195147249 C Bi:2:002:1 0 13 = 55534253 93050000 00000000 00
ffff8e2315a10f00 2195279892 C Ii:2:005:1 0:16 8 = 00000f00 00000000
ffff8e2315a10f00 2195279926 S Ii:2:005:1 -115:16 8 <
ffff8e2315a10f00 2195359905 C Ii:2:005:1 0:16 8 = 00000000 00000000
ffff8e2315a10f00 2195359929 S Ii:2:005:1 -115:16 8 <
ffff8e2315a10f00 2195391900 C Ii:2:005:1 0:16 8 = 00000800 00000000
ffff8e2315a10f00 2195391925 S Ii:2:005:1 -115:16 8 <
ffff8e2315a10f00 2195519899 C Ii:2:005:1 0:16 8 = 00000817 00000000
ffff8e2315a10f00 2195519925 S Ii:2:005:1 -115:16 8 <
ffff8e2315a10f00 2195567893 C Ii:2:005:1 0:16 8 = 00001700 00000000
ffff8e2315a10f00 2195567919 S Ii:2:005:1 -115:16 8 <
ffff8e2315a10f00 2195599890 C Ii:2:005:1 0:16 8 = 00000000 00000000
ffff8e2315a10f00 2195599915 S Ii:2:005:1 -115:16 8 <
ffff8e2315a10f00 2195711901 C Ii:2:005:1 0:16 8 = 00001600 00000000
ffff8e2315a10f00 2195711927 S Ii:2:005:1 -115:16 8 <
ffff8e2315a10f00 2195823905 C Ii:2:005:1 0:16 8 = 00000000 00000000
ffff8e2315a10f00 2195823930 S Ii:2:005:1 -115:16 8 <
ffff8e2315a10f00 2195855899 C Ii:2:005:1 0:16 8 = 00002c00 00000000
ffff8e2315a10f00 2195855925 S Ii:2:005:1 -115:16 8 <
ffff8e2315a10f00 2195967903 C Ii:2:005:1 0:16 8 = 00000000 00000000
ffff8e2315a10f00 2195967929 S Ii:2:005:1 -115:16 8 <
ffff8e2315a10f00 2195983895 C Ii:2:005:1 0:16 8 = 00001500 00000000
ffff8e2315a10f00 2195983922 S Ii:2:005:1 -115:16 8 <
ffff8e2315a10f00 2196079903 C Ii:2:005:1 0:16 8 = 00000000 00000000
ffff8e2315a10f00 2196079928 S Ii:2:005:1 -115:16 8 <
ffff8e2315a10f00 2196095895 C Ii:2:005:1 0:16 8 = 00000800 00000000
ffff8e2315a10f00 2196095923 S Ii:2:005:1 -115:16 8 <
ffff8e2315a10f00 2196143903 C Ii:2:005:1 0:16 8 = 00000000 00000000
ffff8e2315a10f00 2196143927 S Ii:2:005:1 -115:16 8 <
ffff8e2315a10f00 2196175902 C Ii:2:005:1 0:16 8 = 00000400 00000000
ffff8e2315a10f00 2196175928 S Ii:2:005:1 -115:16 8 <
ffff8e2315a10f00 2196287899 C Ii:2:005:1 0:16 8 = 00000704 00000000
ffff8e2315a10f00 2196287927 S Ii:2:005:1 -115:16 8 <
ffff8e2315a10f00 2196319894 C Ii:2:005:1 0:16 8 = 00000700 00000000
ffff8e2315a10f00 2196319919 S Ii:2:005:1 -115:16 8 <
ffff8e2315a10f00 2196399895 C Ii:2:005:1 0:16 8 = 00002c00 00000000
ffff8e2315a10f00 2196399923 S Ii:2:005:1 -115:16 8 <
ffff8e2315a10f00 2196495895 C Ii:2:005:1 0:16 8 = 00000000 00000000
ffff8e2315a10f00 2196495920 S Ii:2:005:1 -115:16 8 <
ffff8e2315a10f00 2196607895 C Ii:2:005:1 0:16 8 = 00001100 00000000
ffff8e2315a10f00 2196607921 S Ii:2:005:1 -115:16 8 <
ffff8e2315a10f00 2196687897 C Ii:2:005:1 0:16 8 = 00000000 00000000
ffff8e2315a10f00 2196687923 S Ii:2:005:1 -115:16 8 <
ffff8e2315a10f00 2196783903 C Ii:2:005:1 0:16 8 = 00001200 00000000
ffff8e2315a10f00 2196783928 S Ii:2:005:1 -115:16 8 <
ffff8e2315a10f00 2196831904 C Ii:2:005:1 0:16 8 = 00000000 00000000
ffff8e2315a10f00 2196831929 S Ii:2:005:1 -115:16 8 <
ffff8e2315a10f00 2196847897 C Ii:2:005:1 0:16 8 = 00001a00 00000000
ffff8e2315a10f00 2196847923 S Ii:2:005:1 -115:16 8 <
ffff8e2315a10f00 2196943903 C Ii:2:005:1 0:16 8 = 00000000 00000000
ffff8e2315a10f00 2196943929 S Ii:2:005:1 -115:16 8 <
ffff8e2302151980 2197194148 S Bo:2:002:2 -115 31 = 55534243 94050000 00000000 00000600 00000000 00000000 00000000 000000
ffff8e2302151980 2197194174 C Bo:2:002:2 0 31 >
ffff8e2302151980 2197194181 S Bi:2:002:1 -115 13 <
ffff8e2302151980 2197194217 C Bi:2:002:1 0 13 = 55534253 94050000 00000000 00
ffff8e2315a10f00 2197471903 C Ii:2:005:1 0:16 8 = 00002a00 00000000
ffff8e2315a10f00 2197471937 S Ii:2:005:1 -115:16 8 <
ffff8e2315a10f00 2197535893 C Ii:2:005:1 0:16 8 = 00000000 00000000
ffff8e2315a10f00 2197535920 S Ii:2:005:1 -115:16 8 <
ffff8e2315a10f00 2197631884 C Ii:2:005:1 0:16 8 = 00002a00 00000000
ffff8e2315a10f00 2197631932 S Ii:2:005:1 -115:16 8 <
ffff8e2315a10f00 2197695903 C Ii:2:005:1 0:16 8 = 00000000 00000000
ffff8e2315a10f00 2197695936 S Ii:2:005:1 -115:16 8 <
ffff8e2315a10f00 2197711890 C Ii:2:005:1 0:16 8 = 00000800 00000000
ffff8e2315a10f00 2197711907 S Ii:2:005:1 -115:16 8 <
ffff8e2315a10f00 2197791875 C Ii:2:005:1 0:16 8 = 00000000 00000000
ffff8e2315a10f00 2197791899 S Ii:2:005:1 -115:16 8 <
ffff8e2315a10f00 2197887914 C Ii:2:005:1 0:16 8 = 00001b00 00000000
ffff8e2315a10f00 2197887944 S Ii:2:005:1 -115:16 8 <
ffff8e2315a10f00 2197983916 C Ii:2:005:1 0:16 8 = 00000000 00000000
ffff8e2315a10f00 2197983942 S Ii:2:005:1 -115:16 8 <
ffff8e2315a10f00 2198143903 C Ii:2:005:1 0:16 8 = 00001700 00000000
ffff8e2315a10f00 2198143927 S Ii:2:005:1 -115:16 8 <
ffff8e2315a10f00 2198223910 C Ii:2:005:1 0:16 8 = 00000000 00000000
ffff8e2315a10f00 2198223935 S Ii:2:005:1 -115:16 8 <
ffff8e2315a10f00 2198463905 C Ii:2:005:1 0:16 8 = 00002c00 00000000
ffff8e2315a10f00 2198463932 S Ii:2:005:1 -115:16 8 <
ffff8e2315a10f00 2198559905 C Ii:2:005:1 0:16 8 = 00000000 00000000
ffff8e2315a10f00 2198559931 S Ii:2:005:1 -115:16 8 <
ffff8e2315a10f00 2198655915 C Ii:2:005:1 0:16 8 = 00001a00 00000000
ffff8e2315a10f00 2198655941 S Ii:2:005:1 -115:16 8 <
ffff8e2315a10f00 2198751904 C Ii:2:005:1 0:16 8 = 00000b00 00000000
ffff8e2315a10f00 2198751931 S Ii:2:005:1 -115:16 8 <
ffff8e2315a10f00 2198815903 C Ii:2:005:1 0:16 8 = 00000000 00000000
ffff8e2315a10f00 2198815935 S Ii:2:005:1 -115:16 8 <
ffff8e2315a10f00 2198895905 C Ii:2:005:1 0:16 8 = 00000800 00000000
ffff8e2315a10f00 2198895938 S Ii:2:005:1 -115:16 8 <
ffff8e2315a10f00 2198943913 C Ii:2:005:1 0:16 8 = 00000811 00000000
ffff8e2315a10f00 2198943945 S Ii:2:005:1 -115:16 8 <
ffff8e2315a10f00 2198991907 C Ii:2:005:1 0:16 8 = 00001100 00000000
ffff8e2315a10f00 2198991938 S Ii:2:005:1 -115:16 8 <
ffff8e2315a10f00 2199039905 C Ii:2:005:1 0:16 8 = 00002c00 00000000
ffff8e2315a10f00 2199039937 S Ii:2:005:1 -115:16 8 <
ffff8e2315a10f00 2199119916 C Ii:2:005:1 0:16 8 = 00000000 00000000
ffff8e2315a10f00 2199119946 S Ii:2:005:1 -115:16 8 <
ffff8e2315a10f00 2199183906 C Ii:2:005:1 0:16 8 = 00001c00 00000000
ffff8e2315a10f00 2199183940 S Ii:2:005:1 -115:16 8 <
ffff8e2302151980 2199242176 S Bo:2:002:2 -115 31 = 55534243 95050000 00000000 00000600 00000000 00000000 00000000 000000
ffff8e2302151980 2199242204 C Bo:2:002:2 0 31 >
ffff8e2302151980 2199242212 S Bi:2:002:1 -115 13 <
ffff8e2302151980 2199242248 C Bi:2:002:1 0 13 = 55534253 95050000 00000000 00
ffff8e2315a10f00 2199247906 C Ii:2:005:1 0:16 8 = 00000000 00000000
ffff8e2315a10f00 2199247931 S Ii:2:005:1 -115:16 8 <
ffff8e2315a10f00 2199343913 C Ii:2:005:1 0:16 8 = 00001200 00000000
ffff8e2315a10f00 2199343937 S Ii:2:005:1 -115:16 8 <
ffff8e2315a10f00 2199439908 C Ii:2:005:1 0:16 8 = 00001812 00000000
ffff8e2315a10f00 2199439933 S Ii:2:005:1 -115:16 8 <
ffff8e2315a10f00 2199471908 C Ii:2:005:1 0:16 8 = 00002c18 12000000
ffff8e2315a10f00 2199471934 S Ii:2:005:1 -115:16 8 <
ffff8e2315a10f00 2199487915 C Ii:2:005:1 0:16 8 = 00002c18 00000000
ffff8e2315a10f00 2199487939 S Ii:2:005:1 -115:16 8 <
ffff8e2315a10f00 2199519917 C Ii:2:005:1 0:16 8 = 00002c04 00000000
ffff8e2315a10f00 2199519944 S Ii:2:005:1 -115:16 8 <
ffff8e2315a10f00 2199567921 C Ii:2:005:1 0:16 8 = 00000400 00000000
ffff8e2315a10f00 2199567947 S Ii:2:005:1 -115:16 8 <
ffff8e2315a10f00 2199615907 C Ii:2:005:1 0:16 8 = 00001504 00000000
ffff8e2315a10f00 2199615933 S Ii:2:005:1 -115:16 8 <
ffff8e2315a10f00 2199631889 C Ii:2:005:1 0:16 8 = 00001500 00000000
ffff8e2315a10f00 2199631917 S Ii:2:005:1 -115:16 8 <
ffff8e2315a10f00 2199679915 C Ii:2:005:1 0:16 8 = 00000815 00000000
ffff8e2315a10f00 2199679941 S Ii:2:005:1 -115:16 8 <
ffff8e2315a10f00 2199727917 C Ii:2:005:1 0:16 8 = 00000800 00000000
ffff8e2315a10f00 2199727941 S Ii:2:005:1 -115:16 8 <
ffff8e2315a10f00 2199743909 C Ii:2:005:1 0:16 8 = 0000082c 00000000
ffff8e2315a10f00 2199743935 S Ii:2:005:1 -115:16 8 <
ffff8e2315a10f00 2199807909 C Ii:2:005:1 0:16 8 = 00002c00 00000000
ffff8e2315a10f00 2199807941 S Ii:2:005:1 -115:16 8 <
ffff8e2315a10f00 2199887913 C Ii:2:005:1 0:16 8 = 00000000 00000000
ffff8e2315a10f00 2199887943 S Ii:2:005:1 -115:16 8 <
ffff8e2315a10f00 2200207915 C Ii:2:005:1 0:16 8 = 00001500 00000000
ffff8e2315a10f00 2200207954 S Ii:2:005:1 -115:16 8 <
ffff8e2315a10f00 2200303913 C Ii:2:005:1 0:16 8 = 00000815 00000000
ffff8e2315a10f00 2200303941 S Ii:2:005:1 -115:16 8 <
ffff8e2315a10f00 2200319912 C Ii:2:005:1 0:16 8 = 00000800 00000000
ffff8e2315a10f00 2200319942 S Ii:2:005:1 -115:16 8 <
ffff8e2315a10f00 2200415923 C Ii:2:005:1 0:16 8 = 00000000 00000000
ffff8e2315a10f00 2200415952 S Ii:2:005:1 -115:16 8 <
ffff8e2315a10f00 2200431921 C Ii:2:005:1 0:16 8 = 00000400 00000000
ffff8e2315a10f00 2200431954 S Ii:2:005:1 -115:16 8 <
ffff8e2315a10f00 2200511912 C Ii:2:005:1 0:16 8 = 00000704 00000000
ffff8e2315a10f00 2200511945 S Ii:2:005:1 -115:16 8 <
ffff8e2315a10f00 2200575919 C Ii:2:005:1 0:16 8 = 00000700 00000000
ffff8e2315a10f00 2200575949 S Ii:2:005:1 -115:16 8 <
ffff8e2315a10f00 2200623914 C Ii:2:005:1 0:16 8 = 00000000 00000000
ffff8e2315a10f00 2200623945 S Ii:2:005:1 -115:16 8 <
ffff8e2315a10f00 2200655913 C Ii:2:005:1 0:16 8 = 00001c00 00000000
ffff8e2315a10f00 2200655946 S Ii:2:005:1 -115:16 8 <
ffff8e2315a10f00 2200735912 C Ii:2:005:1 0:16 8 = 00000000 00000000
ffff8e2315a10f00 2200735943 S Ii:2:005:1 -115:16 8 <
ffff8e2315a10f00 2200911886 C Ii:2:005:1 0:16 8 = 00002800 00000000
ffff8e2315a10f00 2200911914 S Ii:2:005:1 -115:16 8 <
ffff8e2315a10f00 2200975887 C Ii:2:005:1 0:16 8 = 00000000 00000000
ffff8e2315a10f00 2200975918 S Ii:2:005:1 -115:16 8 <
