ffff8e2315a10f00 3433014873 C Ii:2:005:1 0:16 8 = 00001200 00000000
ffff8e2315a10f00 3433014925 S Ii:2:005:1 -115:16 8 <
ffff8e2315a10f00 3433062893 C Ii:2:005:1 0:16 8 = 00000c12 00000000
ffff8e2315a10f00 3433062917 S Ii:2:005:1 -115:16 8 <
ffff8e2315a10f00 3433110890 C Ii:2:005:1 0:16 8 = 00000c00 00000000
ffff8e2315a10f00 3433110915 S Ii:2:005:1 -115:16 8 <
ffff8e2315a10f00 3433158887 C Ii:2:005:1 0:16 8 = 00000000 00000000
ffff8e2315a10f00 3433158912 S Ii:2:005:1 -115:16 8 <
ffff8e2315a10f00 3433270881 C Ii:2:005:1 0:16 8 = 00001100 00000000
ffff8e2315a10f00 3433270908 S Ii:2:005:1 -115:16 8 <
ffff8e2315a10f00 3433318882 C Ii:2:005:1 0:16 8 = 00000a11 00000000
ffff8e2315a10f00 3433318912 S Ii:2:005:1 -115:16 8 <
ffff8e2315a10f00 3433366881 C Ii:2:005:1 0:16 8 = 00000a00 00000000
ffff8e2315a10f00 3433366910 S Ii:2:005:1 -115:16 8 <
ffff8e230c8c1b00 3433372388 S Co:2:011:0 s 40 9a 1312 cc83 0000 0
ffff8e230c8c1b00 3433372492 C Co:2:011:0 0 0
ffff8e230c8c1b00 3433372509 S Co:2:011:0 s 40 9a 2518 00c3 0000 0
ffff8e230c8c1b00 3433372571 C Co:2:011:0 0 0
ffff8e230c8c1b00 3433372577 S Co:2:011:0 s 40 a4 ff9f 0000 0000 0
ffff8e230c8c1b00 3433372644 C Co:2:011:0 0 0
ffff8e230c8c1b00 3433372649 S Co:2:011:0 s 40 9a 2727 0000 0000 0
ffff8e230c8c1b00 3433372776 C Co:2:011:0 0 0
ffff8e2301f33b00 3433372782 S Ii:2:011:1 -115:1 8 <
ffff8e230c8c1b00 3433372789 S Ci:2:011:0 s c0 95 0706 0000 0002 2 <
ffff8e230c8c1b00 3433372882 C Ci:2:011:0 0 2 = 9fee
ffff8e2301f326c0 3433372888 S Bi:2:011:2 -115 32 <
ffff8e2301f32e40 3433372891 S Bi:2:011:2 -115 32 <
ffff8e230c8c1b00 3433372894 S Co:2:011:0 s 40 a4 ff9f 0000 0000 0
ffff8e230c8c1b00 3433372957 C Co:2:011:0 0 0
ffff8e230c8c1b00 3433373042 S Co:2:011:0 s 40 a4 ff9f 0000 0000 0
ffff8e230c8c1b00 3433373108 C Co:2:011:0 0 0
ffff8e230c8c1b00 3433373118 S Co:2:011:0 s 40 a4 ff9f 0000 0000 0
ffff8e230c8c1b00 3433373182 C Co:2:011:0 0 0
ffff8e2301f326c0 3433375233 C Bi:2:011:2 -2 0
ffff8e2301f32e40 3433377233 C Bi:2:011:2 -2 0
ffff8e2301f33b00 3433379256 C Ii:2:011:1 -2:1 0
ffff8e2315a10f00 3433414884 C Ii:2:005:1 0:16 8 = 00000000 00000000
ffff8e2315a10f00 3433414914 S Ii:2:005:1 -115:16 8 <
ffff8e23036146c0 3433435830 S Co:2:011:0 s 40 9a 1312 cc83 0000 0
ffff8e23036146c0 3433435937 C Co:2:011:0 0 0
ffff8e23036146c0 3433435948 S Co:2:011:0 s 40 9a 2518 00c3 0000 0
ffff8e23036146c0 3433436019 C Co:2:011:0 0 0
ffff8e23036146c0 3433436026 S Co:2:011:0 s 40 a4 ff9f 0000 0000 0
ffff8e23036146c0 3433436096 C Co:2:011:0 0 0
ffff8e23036146c0 3433436101 S Co:2:011:0 s 40 9a 2727 0000 0000 0
ffff8e23036146c0 3433436163 C Co:2:011:0 0 0
ffff8e2301f33b00 3433436168 S Ii:2:011:1 -115:1 8 <
ffff8e23036146c0 3433436174 S Ci:2:011:0 s c0 95 0706 0000 0002 2 <
ffff8e23036146c0 3433436271 C Ci:2:011:0 0 2 = 9fee
ffff8e2301f326c0 3433436276 S Bi:2:011:2 -115 32 <
ffff8e2301f32e40 3433436280 S Bi:2:011:2 -115 32 <
ffff8e23036146c0 3433436282 S Co:2:011:0 s 40 a4 ff9f 0000 0000 0
ffff8e23036146c0 3433436347 C Co:2:011:0 0 0
ffff8e23036146c0 3433436403 S Co:2:011:0 s 40 a4 ff9f 0000 0000 0
ffff8e23036146c0 3433436471 C Co:2:011:0 0 0
ffff8e23036146c0 3433436480 S Co:2:011:0 s 40 a4 ff9f 0000 0000 0
ffff8e23036146c0 3433436543 C Co:2:011:0 0 0
ffff8e2301f32240 3433436640 S Bo:2:011:2 -115 14 = 50524f47 52414d42 54393030 3055
ffff8e2301f32240 3433436771 C Bo:2:011:2 0 14 >
ffff8e2315a10f00 3433463013 C Ii:2:005:1 0:16 8 = 00002c00 00000000
ffff8e2315a10f00 3433463041 S Ii:2:005:1 -115:16 8 <
ffff8e2302151980 3433547117 S Bo:2:002:2 -115 31 = 55534243 f71f0000 00000000 00000600 00000000 00000000 00000000 000000
ffff8e2302151980 3433547160 C Bo:2:002:2 0 31 >
ffff8e2302151980 3433547172 S Bi:2:002:1 -115 13 <
ffff8e2302151980 3433547222 C Bi:2:002:1 0 13 = 55534253 f71f0000 00000000 00
ffff8e2315a10f00 3433575013 C Ii:2:005:1 0:16 8 = 00000000 00000000
ffff8e2315a10f00 3433575040 S Ii:2:005:1 -115:16 8 <
ffff8e2315a10f00 3433607006 C Ii:2:005:1 0:16 8 = 00001200 00000000
ffff8e2315a10f00 3433607033 S Ii:2:005:1 -115:16 8 <
ffff8e2315a10f00 3433703011 C Ii:2:005:1 0:16 8 = 00000000 00000000
ffff8e2315a10f00 3433703036 S Ii:2:005:1 -115:16 8 <
ffff8e2315a10f00 3433735015 C Ii:2:005:1 0:16 8 = 00001900 00000000
ffff8e2315a10f00 3433735039 S Ii:2:005:1 -115:16 8 <
ffff8e2315a10f00 3433815018 C Ii:2:005:1 0:16 8 = 00000000 00000000
ffff8e2315a10f00 3433815044 S Ii:2:005:1 -115:16 8 <
ffff8e2315a10f00 3433879013 C Ii:2:005:1 0:16 8 = 00000800 00000000
ffff8e2315a10f00 3433879039 S Ii:2:005:1 -115:16 8 <
ffff8e2315a10f00 3433975024 C Ii:2:005:1 0:16 8 = 00000815 00000000
ffff8e2315a10f00 3433975053 S Ii:2:005:1 -115:16 8 <
ffff8e2315a10f00 3434023006 C Ii:2:005:1 0:16 8 = 00001500 00000000
ffff8e2315a10f00 3434023035 S Ii:2:005:1 -115:16 8 <
ffff8e2315a10f00 3434055006 C Ii:2:005:1 0:16 8 = 00002c15 00000000
ffff8e2315a10f00 3434055031 S Ii:2:005:1 -115:16 8 <
ffff8e2315a10f00 3434071015 C Ii:2:005:1 0:16 8 = 00002c00 00000000
ffff8e2315a10f00 3434071044 S Ii:2:005:1 -115:16 8 <
ffff8e2315a10f00 3434150985 C Ii:2:005:1 0:16 8 = 00000000 00000000
ffff8e2315a10f00 3434151029 S Ii:2:005:1 -115:16 8 <
ffff8e2315a10f00 3434182980 C Ii:2:005:1 0:16 8 = 00001700 00000000
ffff8e2315a10f00 3434183013 S Ii:2:005:1 -115:16 8 <
ffff8e2315a10f00 3434279022 C Ii:2:005:1 0:16 8 = 00000000 00000000
ffff8e2315a10f00 3434279052 S Ii:2:005:1 -115:16 8 <
ffff8e2315a10f00 3434311010 C Ii:2:005:1 0:16 8 = 00000b00 00000000
ffff8e2315a10f00 3434311038 S Ii:2:005:1 -115:16 8 <
ffff8e2315a10f00 3434342979 C Ii:2:005:1 0:16 8 = 0000080b 00000000
ffff8e2315a10f00 3434343018 S Ii:2:005:1 -115:16 8 <
ffff8e2315a10f00 3434375024 C Ii:2:005:1 0:16 8 = 00000800 00000000
ffff8e2315a10f00 3434375051 S Ii:2:005:1 -115:16 8 <
ffff8e2315a10f00 3434423007 C Ii:2:005:1 0:16 8 = 00000815 00000000
ffff8e2315a10f00 3434423032 S Ii:2:005:1 -115:16 8 <
ffff8e2315a10f00 3434471019 C Ii:2:005:1 0:16 8 = 00001500 00000000
ffff8e2315a10f00 3434471046 S Ii:2:005:1 -115:16 8 <
ffff8e2315a10f00 3434503016 C Ii:2:005:1 0:16 8 = 00000815 00000000
ffff8e2315a10f00 3434503043 S Ii:2:005:1 -115:16 8 <
ffff8e2315a10f00 3434535025 C Ii:2:005:1 0:16 8 = 00000800 00000000
ffff8e2315a10f00 3434535049 S Ii:2:005:1 -115:16 8 <
ffff8e2315a10f00 3434615020 C Ii:2:005:1 0:16 8 = 00000000 00000000
ffff8e2315a10f00 3434615048 S Ii:2:005:1 -115:16 8 <
ffff8e2315a10f00 3435335027 C Ii:2:005:1 0:16 8 = 00002800 00000000
ffff8e2315a10f00 3435335054 S Ii:2:005:1 -115:16 8 <
ffff8e2315a10f00 3435383019 C Ii:2:005:1 0:16 8 = 00000000 00000000
ffff8e2315a10f00 3435383044 S Ii:2:005:1 -115:16 8 <
ffff8e2301f32240 3435437359 S Bo:2:011:2 -115 4 = 52000080
ffff8e2301f32240 3435437436 C Bo:2:011:2 0 4 >
ffff8e2302151980 3435594098 S Bo:2:002:2 -115 31 = 55534243 f81f0000 00000000 00000600 00000000 00000000 00000000 000000
ffff8e2302151980 3435594127 C Bo:2:002:2 0 31 >
ffff8e2302151980 3435594138 S Bi:2:002:1 -115 13 <
ffff8e2302151980 3435594183 C Bi:2:002:1 0 13 = 55534253 f81f0000 00000000 00
ffff8e2315a10f00 3436439030 C Ii:2:005:1 0:16 8 = 20000000 00000000
ffff8e2315a10f00 3436439067 S Ii:2:005:1 -115:16 8 <
ffff8e2315a10f00 3436487023 C Ii:2:005:1 0:16 8 = 00000000 00000000
ffff8e2315a10f00 3436487049 S Ii:2:005:1 -115:16 8 <
ffff8e2302151980 3437642183 S Bo:2:002:2 -115 31 = 55534243 f91f0000 00000000 00000600 00000000 00000000 00000000 000000
ffff8e2302151980 3437642247 C Bo:2:002:2 0 31 >
ffff8e2302151980 3437642258 S Bi:2:002:1 -115 13 <
ffff8e2302151980 3437642286 C Bi:2:002:1 0 13 = 55534253 f91f0000 00000000 00
ffff8e2315a10f00 3437879020 C Ii:2:005:1 0:16 8 = 00002800 00000000
ffff8e2315a10f00 3437879048 S Ii:2:005:1 -115:16 8 <
ffff8e2315a10f00 3437959013 C Ii:2:005:1 0:16 8 = 00000000 00000000
ffff8e2315a10f00 3437959059 S Ii:2:005:1 -115:16 8 <
ffff8e2301f32240 3438438029 S Bo:2:011:2 -115 1 = 45
ffff8e2301f32240 3438438085 C Bo:2:011:2 0 1 >
ffff8e2301f326c0 3438440169 C Bi:2:011:2 -2 0
ffff8e2301f32e40 3438442279 C Bi:2:011:2 -2 0
ffff8e2301f33b00 3438444278 C Ii:2:011:1 -2:1 0
ffff8e2303c4c540 3439363906 C Ii:2:008:1 0:1 7 = 02000100 000000
ffff8e2303c4c540 3439363941 S Ii:2:008:1 -115:1 8 <
ffff8e2303c4c540 3439371900 C Ii:2:008:1 0:1 7 = 0200ff0f 000000
ffff8e2303c4c540 3439371927 S Ii:2:008:1 -115:1 8 <
ffff8e2303c4c540 3439379907 C Ii:2:008:1 0:1 7 = 0200ff0f 000000
ffff8e2303c4c540 3439379933 S Ii:2:008:1 -115:1 8 <
ffff8e2303c4c540 3439387909 C Ii:2:008:1 0:1 7 = 0200fe1f 000000
ffff8e2303c4c540 3439387935 S Ii:2:008:1 -115:1 8 <
ffff8e2303c4c540 3439395900 C Ii:2:008:1 0:1 7 = 0200fd3f 000000
ffff8e2303c4c540 3439395928 S Ii:2:008:1 -115:1 8 <
ffff8e2303c4c540 3439403912 C Ii:2:008:1 0:1 7 = 0200ff5f 000000
ffff8e2303c4c540 3439403938 S Ii:2:008:1 -115:1 8 <
ffff8e2303c4c540 3439411911 C Ii:2:008:1 0:1 7 = 0200ff9f 000000
ffff8e2303c4c540 3439411937 S Ii:2:008:1 -115:1 8 <
ffff8e2303c4c540 3439419913 C Ii:2:008:1 0:1 7 = 020001d0 000000
ffff8e2303c4c540 3439419940 S Ii:2:008:1 -115:1 8 <
ffff8e2303c4c540 3439427919 C Ii:2:008:1 0:1 7 = 020004e0 000000
ffff8e2303c4c540 3439427945 S Ii:2:008:1 -115:1 8 <
ffff8e2303c4c540 3439435913 C Ii:2:008:1 0:1 7 = 02000500 010000
ffff8e2303c4c540 3439435940 S Ii:2:008:1 -115:1 8 <
ffff8e2303c4c540 3439443907 C Ii:2:008:1 0:1 7 = 020004b0 000000
ffff8e2303c4c540 3439443933 S Ii:2:008:1 -115:1 8 <
ffff8e2303c4c540 3439451911 C Ii:2:008:1 0:1 7 = 02000470 000000
ffff8e2303c4c540 3439451937 S Ii:2:008:1 -115:1 8 <
ffff8e2303c4c540 3439459912 C Ii:2:008:1 0:1 7 = 02000020 000000
ffff8e2303c4c540 3439459939 S Ii:2:008:1 -115:1 8 <
ffff8e2303c4c540 3439651916 C Ii:2:008:1 0:1 7 = 0200fd1f 000000
ffff8e2303c4c540 3439651946 S Ii:2:008:1 -115:1 8 <
ffff8e2303c4c540 3439659901 C Ii:2:008:1 0:1 7 = 0200f90f 000000
ffff8e2303c4c540 3439659928 S Ii:2:008:1 -115:1 8 <
ffff8e2303c4c540 3439667911 C Ii:2:008:1 0:1 7 = 0200f62f 000000
ffff8e2303c4c540 3439667937 S Ii:2:008:1 -115:1 8 <
ffff8e2303c4c540 3439675910 C Ii:2:008:1 0:1 7 = 0200f12f 000000
ffff8e2303c4c540 3439675939 S Ii:2:008:1 -115:1 8 <
ffff8e2303c4c540 3439683902 C Ii:2:008:1 0:1 7 = 0200f02f 000000
ffff8e2303c4c540 3439683929 S Ii:2:008:1 -115:1 8 <
ffff8e2302151980 3439691123 S Bo:2:002:2 -115 31 = 55534243 fa1f0000 00000000 00000600 00000000 00000000 00000000 000000
ffff8e2302151980 3439691169 C Bo:2:002:2 0 31 >
ffff8e2302151980 3439691181 S Bi:2:002:1 -115 13 <
ffff8e2302151980 3439691209 C Bi:2:002:1 0 13 = 55534253 fa1f0000 00000000 00
ffff8e2303c4c540 3439691996 C Ii:2:008:1 0:1 7 = 0200f13f 000000
ffff8e2303c4c540 3439692020 S Ii:2:008:1 -115:1 8 <
ffff8e2303c4c540 3439699908 C Ii:2:008:1 0:1 7 = 0200f33f 000000
ffff8e2303c4c540 3439699934 S Ii:2:008:1 -115:1 8 <
ffff8e2303c4c540 3439707902 C Ii:2:008:1 0:1 7 = 0200f63f 000000
ffff8e2303c4c540 3439707929 S Ii:2:008:1 -115:1 8 <
ffff8e2303c4c540 3439715910 C Ii:2:008:1 0:1 7 = 0200fa1f 000000
ffff8e2303c4c540 3439715936 S Ii:2:008:1 -115:1 8 <
ffff8e2303c4c540 3439723901 C Ii:2:008:1 0:1 7 = 0200fc2f 000000
ffff8e2303c4c540 3439723927 S Ii:2:008:1 -115:1 8 <
ffff8e2303c4c540 3439731903 C Ii:2:008:1 0:1 7 = 0200ff1f 000000
ffff8e2303c4c540 3439731931 S Ii:2:008:1 -115:1 8 <
ffff8e2303c4c540 3439739902 C Ii:2:008:1 0:1 7 = 02000350 000000
ffff8e2303c4c540 3439739928 S Ii:2:008:1 -115:1 8 <
ffff8e2303c4c540 3439747909 C Ii:2:008:1 0:1 7 = 02000790 000000
ffff8e2303c4c540 3439747935 S Ii:2:008:1 -115:1 8 <
ffff8e2303c4c540 3439755912 C Ii:2:008:1 0:1 7 = 02000b90 000000
ffff8e2303c4c540 3439755940 S Ii:2:008:1 -115:1 8 <
ffff8e2303c4c540 3439763912 C Ii:2:008:1 0:1 7 = 02000fb0 000000
ffff8e2303c4c540 3439763938 S Ii:2:008:1 -115:1 8 <
ffff8e2303c4c540 3439771910 C Ii:2:008:1 0:1 7 = 02000d80 000000
ffff8e2303c4c540 3439771937 S Ii:2:008:1 -115:1 8 <
ffff8e2303c4c540 3439779904 C Ii:2:008:1 0:1 7 = 02000950 000000
ffff8e2303c4c540 3439779930 S Ii:2:008:1 -115:1 8 <
ffff8e2303c4c540 3439787908 C Ii:2:008:1 0:1 7 = 02000730 000000
ffff8e2303c4c540 3439787935 S Ii:2:008:1 -115:1 8 <
ffff8e2303c4c540 3439795910 C Ii:2:008:1 0:1 7 = 02000220 000000
ffff8e2303c4c540 3439795936 S Ii:2:008:1 -115:1 8 <
ffff8e2303c4c540 3439811902 C Ii:2:008:1 0:1 7 = 02000200 000000
ffff8e2303c4c540 3439811927 S Ii:2:008:1 -115:1 8 <
ffff8e2303c4c540 3439819909 C Ii:2:008:1 0:1 7 = 02000200 000000
ffff8e2303c4c540 3439819934 S Ii:2:008:1 -115:1 8 <
ffff8e2303c4c540 3439827902 C Ii:2:008:1 0:1 7 = 020007e0 ff0000
ffff8e2303c4c540 3439827929 S Ii:2:008:1 -115:1 8 <
ffff8e2303c4c540 3439835902 C Ii:2:008:1 0:1 7 = 02000ae0 ff0000
ffff8e2303c4c540 3439835929 S Ii:2:008:1 -115:1 8 <
ffff8e2303c4c540 3439843908 C Ii:2:008:1 0:1 7 = 02000ae0 ff0000
ffff8e2303c4c540 3439843935 S Ii:2:008:1 -115:1 8 <
ffff8e2303c4c540 3439851911 C Ii:2:008:1 0:1 7 = 020009e0 ff0000
ffff8e2303c4c540 3439851937 S Ii:2:008:1 -115:1 8 <
ffff8e2303c4c540 3439859909 C Ii:2:008:1 0:1 7 = 020004f0 ff0000
ffff8e2303c4c540 3439859935 S Ii:2:008:1 -115:1 8 <
ffff8e2303c4c540 3439867902 C Ii:2:008:1 0:1 7 = 02000100 000000
ffff8e2303c4c540 3439867928 S Ii:2:008:1 -115:1 8 <
ffff8e2303c4c540 3440195910 C Ii:2:008:1 0:1 7 = 02000100 000000
ffff8e2303c4c540 3440195937 S Ii:2:008:1 -115:1 8 <
ffff8e2303c4c540 3440203912 C Ii:2:008:1 0:1 7 = 02000300 000000
ffff8e2303c4c540 3440203938 S Ii:2:008:1 -115:1 8 <
ffff8e2303c4c540 3440211915 C Ii:2:008:1 0:1 7 = 020007e0 ff0000
ffff8e2303c4c540 3440211941 S Ii:2:008:1 -115:1 8 <
ffff8e2303c4c540 3440219905 C Ii:2:008:1 0:1 7 = 02000bf0 ff0000
ffff8e2303c4c540 3440219931 S Ii:2:008:1 -115:1 8 <
ffff8e2303c4c540 3440227915 C Ii:2:008:1 0:1 7 = 02000de0 ff0000
ffff8e2303c4c540 3440227941 S Ii:2:008:1 -115:1 8 <
ffff8e2303c4c540 3440235904 C Ii:2:008:1 0:1 7 = 02000fc0 ff0000
ffff8e2303c4c540 3440235930 S Ii:2:008:1 -115:1 8 <
ffff8e2303c4c540 3440243913 C Ii:2:008:1 0:1 7 = 02000fb0 ff0000
ffff8e2303c4c540 3440243939 S Ii:2:008:1 -115:1 8 <
ffff8e2303c4c540 3440251877 C Ii:2:008:1 0:1 7 = 02001290 ff0000
ffff8e2303c4c540 3440251902 S Ii:2:008:1 -115:1 8 <
ffff8e2303c4c540 3440259904 C Ii:2:008:1 0:1 7 = 02001250 ff0000
ffff8e2303c4c540 3440259930 S Ii:2:008:1 -115:1 8 <
ffff8e2303c4c540 3440267914 C Ii:2:008:1 0:1 7 = 02001500 ff0000
ffff8e2303c4c540 3440267940 S Ii:2:008:1 -115:1 8 <
ffff8e2303c4c540 3440275880 C Ii:2:008:1 0:1 7 = 020014c0 fe0000
ffff8e2303c4c540 3440275904 S Ii:2:008:1 -115:1 8 <
ffff8e2303c4c540 3440283912 C Ii:2:008:1 0:1 7 = 020013b0 fe0000
ffff8e2303c4c540 3440283939 S Ii:2:008:1 -115:1 8 <
ffff8e2303c4c540 3440291881 C Ii:2:008:1 0:1 7 = 020013a0 fe0000
ffff8e2303c4c540 3440291912 S Ii:2:008:1 -115:1 8 <
ffff8e2303c4c540 3440299904 C Ii:2:008:1 0:1 7 = 020011b0 fe0000
ffff8e2303c4c540 3440299930 S Ii:2:008:1 -115:1 8 <
ffff8e2303c4c540 3440307917 C Ii:2:008:1 0:1 7 = 020012d0 fe0000
ffff8e2303c4c540 3440307942 S Ii:2:008:1 -115:1 8 <
ffff8e2303c4c540 3440315911 C Ii:2:008:1 0:1 7 = 02001000 ff0000
ffff8e2303c4c540 3440315937 S Ii:2:008:1 -115:1 8 <
ffff8e2303c4c540 3440323904 C Ii:2:008:1 0:1 7 = 02001030 ff0000
ffff8e2303c4c540 3440323930 S Ii:2:008:1 -115:1 8 <
ffff8e2303c4c540 3440331906 C Ii:2:008:1 0:1 7 = 02000f40 ff0000
ffff8e2303c4c540 3440331933 S Ii:2:008:1 -115:1 8 <
ffff8e2303c4c540 3440339914 C Ii:2:008:1 0:1 7 = 02000d50 ff0000
ffff8e2303c4c540 3440339941 S Ii:2:008:1 -115:1 8 <
ffff8e2303c4c540 3440347913 C Ii:2:008:1 0:1 7 = 02000d40 ff0000
ffff8e2303c4c540 3440347938 S Ii:2:008:1 -115:1 8 <
ffff8e2303c4c540 3440355904 C Ii:2:008:1 0:1 7 = 02000b30 ff0000
ffff8e2303c4c540 3440355932 S Ii:2:008:1 -115:1 8 <
ffff8e2303c4c540 3440363904 C Ii:2:008:1 0:1 7 = 02000b40 ff0000
ffff8e2303c4c540 3440363931 S Ii:2:008:1 -115:1 8 <
ffff8e2303c4c540 3440371901 C Ii:2:008:1 0:1 7 = 02000a30 ff0000
ffff8e2303c4c540 3440371938 S Ii:2:008:1 -115:1 8 <
ffff8e2303c4c540 3440379904 C Ii:2:008:1 0:1 7 = 02000760 ff0000
ffff8e2303c4c540 3440379934 S Ii:2:008:1 -115:1 8 <
ffff8e2303c4c540 3440387912 C Ii:2:008:1 0:1 7 = 02000850 ff0000
ffff8e2303c4c540 3440387939 S Ii:2:008:1 -115:1 8 <
ffff8e2303c4c540 3440395906 C Ii:2:008:1 0:1 7 = 02000670 ff0000
ffff8e2303c4c540 3440395934 S Ii:2:008:1 -115:1 8 <
ffff8e2303c4c540 3440403906 C Ii:2:008:1 0:1 7 = 020005b0 ff0000
ffff8e2303c4c540 3440403933 S Ii:2:008:1 -115:1 8 <
ffff8e2303c4c540 3440411906 C Ii:2:008:1 0:1 7 = 020004b0 ff0000
ffff8e2303c4c540 3440411933 S Ii:2:008:1 -115:1 8 <
ffff8e2303c4c540 3440419916 C Ii:2:008:1 0:1 7 = 020001f0 ff0000
ffff8e2303c4c540 3440419941 S Ii:2:008:1 -115:1 8 <
ffff8e2302151980 3441739135 S Bo:2:002:2 -115 31 = 55534243 fb1f0000 00000000 00000600 00000000 00000000 00000000 000000
ffff8e2302151980 3441739184 C Bo:2:002:2 0 31 >
ffff8e2302151980 3441739196 S Bi:2:002:1 -115 13 <
ffff8e2302151980 3441739224 C Bi:2:002:1 0 13 = 55534253 fb1f0000 00000000 00
ffff8e2303c4c540 3442274924 C Ii:2:008:1 0:1 7 = 020002f0 ff0000
ffff8e2303c4c540 3442274958 S Ii:2:008:1 -115:1 8 <
ffff8e2303c4c540 3442282920 C Ii:2:008:1 0:1 7 = 020004f0 ff0000
ffff8e2303c4c540 3442282946 S Ii:2:008:1 -115:1 8 <
ffff8e2303c4c540 3442290924 C Ii:2:008:1 0:1 7 = 02000c00 000000
ffff8e2303c4c540 3442290950 S Ii:2:008:1 -115:1 8 <
ffff8e2303c4c540 3442298912 C Ii:2:008:1 0:1 7 = 020017e0 ff0000
ffff8e2303c4c540 3442298939 S Ii:2:008:1 -115:1 8 <
ffff8e2303c4c540 3442306912 C Ii:2:008:1 0:1 7 = 020024e0 ff0000
ffff8e2303c4c540 3442306939 S Ii:2:008:1 -115:1 8 <
ffff8e2303c4c540 3442314921 C Ii:2:008:1 0:1 7 = 02002ed0 ff0000
ffff8e2303c4c540 3442314947 S Ii:2:008:1 -115:1 8 <
ffff8e2303c4c540 3442322923 C Ii:2:008:1 0:1 7 = 020030c0 ff0000
ffff8e2303c4c540 3442322950 S Ii:2:008:1 -115:1 8 <
ffff8e2303c4c540 3442330922 C Ii:2:008:1 0:1 7 = 020026d0 ff0000
ffff8e2303c4c540 3442330948 S Ii:2:008:1 -115:1 8 <
ffff8e2303c4c540 3442338912 C Ii:2:008:1 0:1 7 = 020019f0 ff0000
ffff8e2303c4c540 3442338939 S Ii:2:008:1 -115:1 8 <
ffff8e2303c4c540 3442346918 C Ii:2:008:1 0:1 7 = 02000bf0 ff0000
ffff8e2303c4c540 3442346945 S Ii:2:008:1 -115:1 8 <
ffff8e2303c4c540 3442354921 C Ii:2:008:1 0:1 7 = 02000100 000000
ffff8e2303c4c540 3442354947 S Ii:2:008:1 -115:1 8 <
ffff8e2303c4c540 3442362918 C Ii:2:008:1 0:1 7 = 020000d0 ff0000
ffff8e2303c4c540 3442362944 S Ii:2:008:1 -115:1 8 <
ffff8e2303c4c540 3442370920 C Ii:2:008:1 0:1 7 = 0200ff9f ff0000
ffff8e2303c4c540 3442370946 S Ii:2:008:1 -115:1 8 <
ffff8e2303c4c540 3442378911 C Ii:2:008:1 0:1 7 = 0200fe3f ff0000
ffff8e2303c4c540 3442378938 S Ii:2:008:1 -115:1 8 <
ffff8e2303c4c540 3442386913 C Ii:2:008:1 0:1 7 = 0200fcbf fe0000
ffff8e2303c4c540 3442386941 S Ii:2:008:1 -115:1 8 <
ffff8e2303c4c540 3442394886 C Ii:2:008:1 0:1 7 = 0200f76f fe0000
ffff8e2303c4c540 3442394911 S Ii:2:008:1 -115:1 8 <
ffff8e2303c4c540 3442402918 C Ii:2:008:1 0:1 7 = 0200f64f fe0000
ffff8e2303c4c540 3442402944 S Ii:2:008:1 -115:1 8 <
ffff8e2303c4c540 3442410918 C Ii:2:008:1 0:1 7 = 0200f54f fe0000
ffff8e2303c4c540 3442410944 S Ii:2:008:1 -115:1 8 <
ffff8e2303c4c540 3442418922 C Ii:2:008:1 0:1 7 = 0200f76f fe0000
ffff8e2303c4c540 3442418949 S Ii:2:008:1 -115:1 8 <
ffff8e2303c4c540 3442426919 C Ii:2:008:1 0:1 7 = 0200f98f fe0000
ffff8e2303c4c540 3442426945 S Ii:2:008:1 -115:1 8 <
ffff8e2303c4c540 3442434921 C Ii:2:008:1 0:1 7 = 0200fcaf fe0000
ffff8e2303c4c540 3442434947 S Ii:2:008:1 -115:1 8 <
ffff8e2303c4c540 3442442911 C Ii:2:008:1 0:1 7 = 0200fecf fe0000
ffff8e2303c4c540 3442442938 S Ii:2:008:1 -115:1 8 <
ffff8e2303c4c540 3442450915 C Ii:2:008:1 0:1 7 = 0200ffef fe0000
ffff8e2303c4c540 3442450942 S Ii:2:008:1 -115:1 8 <
ffff8e2303c4c540 3442458920 C Ii:2:008:1 0:1 7 = 02000000 ff0000
ffff8e2303c4c540 3442458946 S Ii:2:008:1 -115:1 8 <
ffff8e2303c4c540 3442466922 C Ii:2:008:1 0:1 7 = 0200ff2f ff0000
ffff8e2303c4c540 3442466949 S Ii:2:008:1 -115:1 8 <
ffff8e2303c4c540 3442474912 C Ii:2:008:1 0:1 7 = 02000040 ff0000
ffff8e2303c4c540 3442474938 S Ii:2:008:1 -115:1 8 <
ffff8e2303c4c540 3442482920 C Ii:2:008:1 0:1 7 = 0200fe7f ff0000
ffff8e2303c4c540 3442482945 S Ii:2:008:1 -115:1 8 <
ffff8e2303c4c540 3442490921 C Ii:2:008:1 0:1 7 = 0200fe8f ff0000
ffff8e2303c4c540 3442490948 S Ii:2:008:1 -115:1 8 <
ffff8e2303c4c540 3442498912 C Ii:2:008:1 0:1 7 = 0200feaf ff0000
ffff8e2303c4c540 3442498939 S Ii:2:008:1 -115:1 8 <
ffff8e2303c4c540 3442506922 C Ii:2:008:1 0:1 7 = 0200fdaf ff0000
ffff8e2303c4c540 3442506948 S Ii:2:008:1 -115:1 8 <
ffff8e2303c4c540 3442514914 C Ii:2:008:1 0:1 7 = 0200fdbf ff0000
ffff8e2303c4c540 3442514941 S Ii:2:008:1 -115:1 8 <
ffff8e2303c4c540 3442522912 C Ii:2:008:1 0:1 7 = 0200febf ff0000
ffff8e2303c4c540 3442522940 S Ii:2:008:1 -115:1 8 <
ffff8e2303c4c540 3442530922 C Ii:2:008:1 0:1 7 = 0200ffdf ff0000
ffff8e2303c4c540 3442530949 S Ii:2:008:1 -115:1 8 <
ffff8e2303c4c540 3442538886 C Ii:2:008:1 0:1 7 = 0200ff0f 000000
ffff8e2303c4c540 3442538910 S Ii:2:008:1 -115:1 8 <
ffff8e2303c4c540 3442546919 C Ii:2:008:1 0:1 7 = 0200ffff ff0000
ffff8e2303c4c540 3442546945 S Ii:2:008:1 -115:1 8 <
ffff8e2302151980 3443787172 S Bo:2:002:2 -115 31 = 55534243 fc1f0000 00000000 00000600 00000000 00000000 00000000 000000
ffff8e2302151980 3443787222 C Bo:2:002:2 0 31 >
ffff8e2302151980 3443787233 S Bi:2:002:1 -115 13 <
ffff8e2302151980 3443787260 C Bi:2:002:1 0 13 = 55534253 fc1f0000 00000000 00
ffff8e2303c4c540 3443873932 C Ii:2:008:1 0:1 7 = 02000320 000000
ffff8e2303c4c540 3443873962 S Ii:2:008:1 -115:1 8 <
ffff8e2303c4c540 3443881918 C Ii:2:008:1 0:1 7 = 02000450 000000
ffff8e2303c4c540 3443881946 S Ii:2:008:1 -115:1 8 <
ffff8e2303c4c540 3443889917 C Ii:2:008:1 0:1 7 = 02000450 000000
ffff8e2303c4c540 3443889944 S Ii:2:008:1 -115:1 8 <
ffff8e2303c4c540 3443897929 C Ii:2:008:1 0:1 7 = 02000560 000000
ffff8e2303c4c540 3443897954 S Ii:2:008:1 -115:1 8 <
ffff8e2303c4c540 3443905919 C Ii:2:008:1 0:1 7 = 02000140 000000
ffff8e2303c4c540 3443905947 S Ii:2:008:1 -115:1 8 <
ffff8e2303c4c540 3443913918 C Ii:2:008:1 0:1 7 = 02000110 000000
ffff8e2303c4c540 3443913945 S Ii:2:008:1 -115:1 8 <
ffff8e2303c4c540 3443921917 C Ii:2:008:1 0:1 7 = 02000020 000000
ffff8e2303c4c540 3443921942 S Ii:2:008:1 -115:1 8 <
ffff8e2303c4c540 3443937929 C Ii:2:008:1 0:1 7 = 0200ff2f 000000
ffff8e2303c4c540 3443937955 S Ii:2:008:1 -115:1 8 <
ffff8e2303c4c540 3443945916 C Ii:2:008:1 0:1 7 = 0200fd1f 000000
ffff8e2303c4c540 3443945944 S Ii:2:008:1 -115:1 8 <
ffff8e2303c4c540 3443953924 C Ii:2:008:1 0:1 7 = 0200fc2f 000000
ffff8e2303c4c540 3443953950 S Ii:2:008:1 -115:1 8 <
ffff8e2303c4c540 3443961917 C Ii:2:008:1 0:1 7 = 0200fb1f 000000
ffff8e2303c4c540 3443961943 S Ii:2:008:1 -115:1 8 <
ffff8e2303c4c540 3443969923 C Ii:2:008:1 0:1 7 = 0200fc1f 000000
ffff8e2303c4c540 3443969950 S Ii:2:008:1 -115:1 8 <
ffff8e2303c4c540 3443977924 C Ii:2:008:1 0:1 7 = 0200fc1f 000000
ffff8e2303c4c540 3443977950 S Ii:2:008:1 -115:1 8 <
ffff8e2303c4c540 3443985916 C Ii:2:008:1 0:1 7 = 0200fd0f 000000
ffff8e2303c4c540 3443985943 S Ii:2:008:1 -115:1 8 <
ffff8e2303c4c540 3443993917 C Ii:2:008:1 0:1 7 = 0200fc0f 000000
ffff8e2303c4c540 3443993944 S Ii:2:008:1 -115:1 8 <
ffff8e2303c4c540 3444001925 C Ii:2:008:1 0:1 7 = 0200fe0f 000000
ffff8e2303c4c540 3444001950 S Ii:2:008:1 -115:1 8 <
ffff8e2303c4c540 3444009918 C Ii:2:008:1 0:1 7 = 0200fe0f 000000
ffff8e2303c4c540 3444009945 S Ii:2:008:1 -115:1 8 <
ffff8e2303c4c540 3444017917 C Ii:2:008:1 0:1 7 = 0200fd0f 000000
ffff8e2303c4c540 3444017943 S Ii:2:008:1 -115:1 8 <
ffff8e2303c4c540 3444025927 C Ii:2:008:1 0:1 7 = 0200fe0f 000000
ffff8e2303c4c540 3444025953 S Ii:2:008:1 -115:1 8 <
ffff8e2303c4c540 3444033924 C Ii:2:008:1 0:1 7 = 0200fe0f 000000
ffff8e2303c4c540 3444033950 S Ii:2:008:1 -115:1 8 <
ffff8e2303c4c540 3444041894 C Ii:2:008:1 0:1 7 = 0200ff0f 000000
ffff8e2303c4c540 3444041925 S Ii:2:008:1 -115:1 8 <
ffff8e2303c4c540 3444049925 C Ii:2:008:1 0:1 7 = 0200ff0f 000000
ffff8e2303c4c540 3444049951 S Ii:2:008:1 -115:1 8 <
ffff8e2303c4c540 3444057924 C Ii:2:008:1 0:1 7 = 0200fe0f 000000
ffff8e2303c4c540 3444057950 S Ii:2:008:1 -115:1 8 <
ffff8e2303c4c540 3444065918 C Ii:2:008:1 0:1 7 = 0200fe0f 000000
ffff8e2303c4c540 3444065944 S Ii:2:008:1 -115:1 8 <
ffff8e2303c4c540 3444073924 C Ii:2:008:1 0:1 7 = 0200fd0f 000000
ffff8e2303c4c540 3444073951 S Ii:2:008:1 -115:1 8 <
ffff8e2303c4c540 3444081918 C Ii:2:008:1 0:1 7 = 0200fb1f 000000
ffff8e2303c4c540 3444081944 S Ii:2:008:1 -115:1 8 <
ffff8e2303c4c540 3444089917 C Ii:2:008:1 0:1 7 = 0200fa2f 000000
ffff8e2303c4c540 3444089945 S Ii:2:008:1 -115:1 8 <
ffff8e2303c4c540 3444097920 C Ii:2:008:1 0:1 7 = 0200f81f 000000
ffff8e2303c4c540 3444097948 S Ii:2:008:1 -115:1 8 <
ffff8e2303c4c540 3444105918 C Ii:2:008:1 0:1 7 = 0200f72f 000000
ffff8e2303c4c540 3444105944 S Ii:2:008:1 -115:1 8 <
ffff8e2303c4c540 3444113928 C Ii:2:008:1 0:1 7 = 0200f80f 000000
ffff8e2303c4c540 3444113954 S Ii:2:008:1 -115:1 8 <
ffff8e2303c4c540 3444121894 C Ii:2:008:1 0:1 7 = 0200f91f 000000
ffff8e2303c4c540 3444121926 S Ii:2:008:1 -115:1 8 <
ffff8e2303c4c540 3444129925 C Ii:2:008:1 0:1 7 = 0200fb0f 000000
ffff8e2303c4c540 3444129950 S Ii:2:008:1 -115:1 8 <
ffff8e2303c4c540 3444137932 C Ii:2:008:1 0:1 7 = 0200fe1f 000000
ffff8e2303c4c540 3444137958 S Ii:2:008:1 -115:1 8 <
ffff8e2303c4c540 3444145925 C Ii:2:008:1 0:1 7 = 0200ff1f 000000
ffff8e2303c4c540 3444145953 S Ii:2:008:1 -115:1 8 <
ffff8e2303c4c540 3445505941 C Ii:2:008:1 0:1 7 = 02000210 000000
ffff8e2303c4c540 3445505974 S Ii:2:008:1 -115:1 8 <
ffff8e2303c4c540 3445513923 C Ii:2:008:1 0:1 7 = 02000520 000000
ffff8e2303c4c540 3445513950 S Ii:2:008:1 -115:1 8 <
ffff8e2303c4c540 3445521924 C Ii:2:008:1 0:1 7 = 02000940 000000
ffff8e2303c4c540 3445521953 S Ii:2:008:1 -115:1 8 <
ffff8e2303c4c540 3445529907 C Ii:2:008:1 0:1 7 = 02000d60 000000
ffff8e2303c4c540 3445529939 S Ii:2:008:1 -115:1 8 <
ffff8e2303c4c540 3445537933 C Ii:2:008:1 0:1 7 = 02001160 000000
ffff8e2303c4c540 3445537960 S Ii:2:008:1 -115:1 8 <
ffff8e2303c4c540 3445545931 C Ii:2:008:1 0:1 7 = 02001060 000000
ffff8e2303c4c540 3445545957 S Ii:2:008:1 -115:1 8 <
ffff8e2303c4c540 3445553925 C Ii:2:008:1 0:1 7 = 02001060 000000
ffff8e2303c4c540 3445553953 S Ii:2:008:1 -115:1 8 <
ffff8e2303c4c540 3445561901 C Ii:2:008:1 0:1 7 = 02000b30 000000
ffff8e2303c4c540 3445561926 S Ii:2:008:1 -115:1 8 <
ffff8e2303c4c540 3445569932 C Ii:2:008:1 0:1 7 = 02000710 000000
ffff8e2303c4c540 3445569958 S Ii:2:008:1 -115:1 8 <
ffff8e2303c4c540 3445577924 C Ii:2:008:1 0:1 7 = 02000310 000000
ffff8e2303c4c540 3445577951 S Ii:2:008:1 -115:1 8 <
ffff8e2303c4c540 3445665934 C Ii:2:008:1 0:1 7 = 0200ff0f 000000
ffff8e2303c4c540 3445665960 S Ii:2:008:1 -115:1 8 <
ffff8e2303c4c540 3445681935 C Ii:2:008:1 0:1 7 = 0200ff0f 000000
ffff8e2303c4c540 3445681960 S Ii:2:008:1 -115:1 8 <
ffff8e2303c4c540 3445689922 C Ii:2:008:1 0:1 7 = 0200ff0f 000000
ffff8e2303c4c540 3445689948 S Ii:2:008:1 -115:1 8 <
ffff8e2302151980 3445834110 S Bo:2:002:2 -115 31 = 55534243 fd1f0000 00000000 00000600 00000000 00000000 00000000 000000
ffff8e2302151980 3445834141 C Bo:2:002:2 0 31 >
ffff8e2302151980 3445834151 S Bi:2:002:1 -115 13 <
ffff8e2302151980 3445834192 C Bi:2:002:1 0 13 = 55534253 fd1f0000 00000000 00
ffff8e2303c4c540 3446848943 C Ii:2:008:1 0:1 7 = 0200ff0f 000000
ffff8e2303c4c540 3446848976 S Ii:2:008:1 -115:1 8 <
ffff8e2303c4c540 3446856939 C Ii:2:008:1 0:1 7 = 0200fd0f 000000
ffff8e2303c4c540 3446856965 S Ii:2:008:1 -115:1 8 <
ffff8e2303c4c540 3446864941 C Ii:2:008:1 0:1 7 = 0200fc0f 000000
ffff8e2303c4c540 3446864967 S Ii:2:008:1 -115:1 8 <
ffff8e2303c4c540 3446872941 C Ii:2:008:1 0:1 7 = 0200f90f 000000
ffff8e2303c4c540 3446872967 S Ii:2:008:1 -115:1 8 <
ffff8e2303c4c540 3446880942 C Ii:2:008:1 0:1 7 = 0200f70f 000000
ffff8e2303c4c540 3446880968 S Ii:2:008:1 -115:1 8 <
ffff8e2303c4c540 3446888929 C Ii:2:008:1 0:1 7 = 0200f70f 000000
ffff8e2303c4c540 3446888956 S Ii:2:008:1 -115:1 8 <
ffff8e2303c4c540 3446896943 C Ii:2:008:1 0:1 7 = 0200f60f 000000
ffff8e2303c4c540 3446896969 S Ii:2:008:1 -115:1 8 <
ffff8e2303c4c540 3446904942 C Ii:2:008:1 0:1 7 = 0200f40f 000000
ffff8e2303c4c540 3446904967 S Ii:2:008:1 -115:1 8 <
ffff8e2303c4c540 3446912935 C Ii:2:008:1 0:1 7 = 0200f60f 000000
ffff8e2303c4c540 3446912961 S Ii:2:008:1 -115:1 8 <
ffff8e2303c4c540 3446920928 C Ii:2:008:1 0:1 7 = 0200f30f 000000
ffff8e2303c4c540 3446920955 S Ii:2:008:1 -115:1 8 <
ffff8e2303c4c540 3446928936 C Ii:2:008:1 0:1 7 = 0200f30f 000000
ffff8e2303c4c540 3446928961 S Ii:2:008:1 -115:1 8 <
ffff8e2303c4c540 3446936938 C Ii:2:008:1 0:1 7 = 0200f30f 000000
ffff8e2303c4c540 3446936965 S Ii:2:008:1 -115:1 8 <
ffff8e2303c4c540 3446944928 C Ii:2:008:1 0:1 7 = 0200f20f 000000
ffff8e2303c4c540 3446944952 S Ii:2:008:1 -115:1 8 <
ffff8e2303c4c540 3446952937 C Ii:2:008:1 0:1 7 = 0200f20f 000000
ffff8e2303c4c540 3446952963 S Ii:2:008:1 -115:1 8 <
ffff8e2303c4c540 3446960939 C Ii:2:008:1 0:1 7 = 0200f00f 000000
ffff8e2303c4c540 3446960965 S Ii:2:008:1 -115:1 8 <
ffff8e2303c4c540 3446968935 C Ii:2:008:1 0:1 7 = 0200ef0f 000000
ffff8e2303c4c540 3446968961 S Ii:2:008:1 -115:1 8 <
ffff8e2303c4c540 3446976935 C Ii:2:008:1 0:1 7 = 0200ed0f 000000
ffff8e2303c4c540 3446976961 S Ii:2:008:1 -115:1 8 <
ffff8e2303c4c540 3446984937 C Ii:2:008:1 0:1 7 = 0200ed0f 000000
ffff8e2303c4c540 3446984963 S Ii:2:008:1 -115:1 8 <
ffff8e2303c4c540 3446992937 C Ii:2:008:1 0:1 7 = 0200ee0f 000000
ffff8e2303c4c540 3446992963 S Ii:2:008:1 -115:1 8 <
ffff8e2303c4c540 3447000935 C Ii:2:008:1 0:1 7 = 0200ef0f 000000
ffff8e2303c4c540 3447000961 S Ii:2:008:1 -115:1 8 <
ffff8e2303c4c540 3447008928 C Ii:2:008:1 0:1 7 = 0200f00f 000000
ffff8e2303c4c540 3447008955 S Ii:2:008:1 -115:1 8 <
ffff8e2303c4c540 3447016929 C Ii:2:008:1 0:1 7 = 0200f20f 000000
ffff8e2303c4c540 3447016956 S Ii:2:008:1 -115:1 8 <
ffff8e2303c4c540 3447024931 C Ii:2:008:1 0:1 7 = 0200f60f 000000
ffff8e2303c4c540 3447024957 S Ii:2:008:1 -115:1 8 <
ffff8e2303c4c540 3447032929 C Ii:2:008:1 0:1 7 = 0200f90f 000000
ffff8e2303c4c540 3447032956 S Ii:2:008:1 -115:1 8 <
ffff8e2303c4c540 3447040940 C Ii:2:008:1 0:1 7 = 0200fe0f 000000
ffff8e2303c4c540 3447040965 S Ii:2:008:1 -115:1 8 <
ffff8e2303c4c540 3447048928 C Ii:2:008:1 0:1 7 = 0200ff0f 000000
ffff8e2303c4c540 3447048953 S Ii:2:008:1 -115:1 8 <
ffff8e2303c4c540 3447056936 C Ii:2:008:1 0:1 7 = 0200ff0f 000000
ffff8e2303c4c540 3447056961 S Ii:2:008:1 -115:1 8 <
ffff8e2303c4c540 3447064927 C Ii:2:008:1 0:1 7 = 0200ff0f 000000
ffff8e2303c4c540 3447064954 S Ii:2:008:1 -115:1 8 <
ffff8e2303c4c540 3447072929 C Ii:2:008:1 0:1 7 = 0200fd0f 000000
ffff8e2303c4c540 3447072955 S Ii:2:008:1 -115:1 8 <
ffff8e2303c4c540 3447080937 C Ii:2:008:1 0:1 7 = 0200fc0f 000000
ffff8e2303c4c540 3447080964 S Ii:2:008:1 -115:1 8 <
ffff8e2303c4c540 3447088936 C Ii:2:008:1 0:1 7 = 0200fb0f 000000
ffff8e2303c4c540 3447088962 S Ii:2:008:1 -115:1 8 <
ffff8e2303c4c540 3447096937 C Ii:2:008:1 0:1 7 = 0200fa0f 000000
ffff8e2303c4c540 3447096963 S Ii:2:008:1 -115:1 8 <
ffff8e2303c4c540 3447104928 C Ii:2:008:1 0:1 7 = 0200fa0f 000000
ffff8e2303c4c540 3447104954 S Ii:2:008:1 -115:1 8 <
ffff8e2303c4c540 3447112928 C Ii:2:008:1 0:1 7 = 0200fb0f 000000
ffff8e2303c4c540 3447112957 S Ii:2:008:1 -115:1 8 <
ffff8e2303c4c540 3447120938 C Ii:2:008:1 0:1 7 = 0200fd0f 000000
ffff8e2303c4c540 3447120963 S Ii:2:008:1 -115:1 8 <
ffff8e2303c4c540 3447128929 C Ii:2:008:1 0:1 7 = 0200fe0f 000000
ffff8e2303c4c540 3447128955 S Ii:2:008:1 -115:1 8 <
ffff8e2303c4c540 3447312933 C Ii:2:008:1 0:1 7 = 0200fd0f 000000
ffff8e2303c4c540 3447312968 S Ii:2:008:1 -115:1 8 <
ffff8e2303c4c540 3447320931 C Ii:2:008:1 0:1 7 = 0200fa0f 000000
ffff8e2303c4c540 3447320958 S Ii:2:008:1 -115:1 8 <
ffff8e2303c4c540 3447328930 C Ii:2:008:1 0:1 7 = 0200f6df ff0000
ffff8e2303c4c540 3447328959 S Ii:2:008:1 -115:1 8 <
ffff8e2303c4c540 3447336930 C Ii:2:008:1 0:1 7 = 0200f3bf ff0000
ffff8e2303c4c540 3447336956 S Ii:2:008:1 -115:1 8 <
ffff8e2303c4c540 3447344940 C Ii:2:008:1 0:1 7 = 0200f2bf ff0000
ffff8e2303c4c540 3447344966 S Ii:2:008:1 -115:1 8 <
ffff8e2303c4c540 3447352942 C Ii:2:008:1 0:1 7 = 0200f4af ff0000
ffff8e2303c4c540 3447352969 S Ii:2:008:1 -115:1 8 <
ffff8e2303c4c540 3447360938 C Ii:2:008:1 0:1 7 = 0200f7df ff0000
ffff8e2303c4c540 3447360965 S Ii:2:008:1 -115:1 8 <
ffff8e2303c4c540 3447368938 C Ii:2:008:1 0:1 7 = 0200f8ff ff0000
ffff8e2303c4c540 3447368965 S Ii:2:008:1 -115:1 8 <
ffff8e2303c4c540 3447376942 C Ii:2:008:1 0:1 7 = 0200f9df ff0000
ffff8e2303c4c540 3447376968 S Ii:2:008:1 -115:1 8 <
ffff8e2303c4c540 3447384906 C Ii:2:008:1 0:1 7 = 0200f6df ff0000
ffff8e2303c4c540 3447384932 S Ii:2:008:1 -115:1 8 <
ffff8e2303c4c540 3447392936 C Ii:2:008:1 0:1 7 = 0200f5df ff0000
ffff8e2303c4c540 3447392962 S Ii:2:008:1 -115:1 8 <
ffff8e2303c4c540 3447400930 C Ii:2:008:1 0:1 7 = 0200f5af ff0000
ffff8e2303c4c540 3447400956 S Ii:2:008:1 -115:1 8 <
ffff8e2303c4c540 3447408940 C Ii:2:008:1 0:1 7 = 0200f6af ff0000
ffff8e2303c4c540 3447408967 S Ii:2:008:1 -115:1 8 <
ffff8e2303c4c540 3447416937 C Ii:2:008:1 0:1 7 = 0200f8bf ff0000
ffff8e2303c4c540 3447416962 S Ii:2:008:1 -115:1 8 <
ffff8e2303c4c540 3447424929 C Ii:2:008:1 0:1 7 = 0200f9bf ff0000
ffff8e2303c4c540 3447424956 S Ii:2:008:1 -115:1 8 <
ffff8e2303c4c540 3447432937 C Ii:2:008:1 0:1 7 = 0200f7af ff0000
ffff8e2303c4c540 3447432964 S Ii:2:008:1 -115:1 8 <
ffff8e2303c4c540 3447440936 C Ii:2:008:1 0:1 7 = 0200f59f ff0000
ffff8e2303c4c540 3447440962 S Ii:2:008:1 -115:1 8 <
ffff8e2303c4c540 3447448930 C Ii:2:008:1 0:1 7 = 0200f5af ff0000
ffff8e2303c4c540 3447448957 S Ii:2:008:1 -115:1 8 <
ffff8e2303c4c540 3447456937 C Ii:2:008:1 0:1 7 = 0200f5af ff0000
ffff8e2303c4c540 3447456963 S Ii:2:008:1 -115:1 8 <
ffff8e2303c4c540 3447464937 C Ii:2:008:1 0:1 7 = 0200f9df ff0000
ffff8e2303c4c540 3447464963 S Ii:2:008:1 -115:1 8 <
ffff8e2303c4c540 3447472904 C Ii:2:008:1 0:1 7 = 0200fcff ff0000
ffff8e2303c4c540 3447472929 S Ii:2:008:1 -115:1 8 <
ffff8e2303c4c540 3447480939 C Ii:2:008:1 0:1 7 = 0200ffff ff0000
ffff8e2303c4c540 3447480965 S Ii:2:008:1 -115:1 8 <
ffff8e2303c4c540 3447488930 C Ii:2:008:1 0:1 7 = 0200ff0f 000000
ffff8e2303c4c540 3447488957 S Ii:2:008:1 -115:1 8 <
ffff8e2303c4c540 3447496936 C Ii:2:008:1 0:1 7 = 0200fe1f 000000
ffff8e2303c4c540 3447496963 S Ii:2:008:1 -115:1 8 <
ffff8e2303c4c540 3447504940 C Ii:2:008:1 0:1 7 = 02000030 000000
ffff8e2303c4c540 3447504965 S Ii:2:008:1 -115:1 8 <
ffff8e2303c4c540 3447512940 C Ii:2:008:1 0:1 7 = 02000040 000000
ffff8e2303c4c540 3447512965 S Ii:2:008:1 -115:1 8 <
ffff8e2303c4c540 3447520939 C Ii:2:008:1 0:1 7 = 02000050 000000
ffff8e2303c4c540 3447520965 S Ii:2:008:1 -115:1 8 <
ffff8e2303c4c540 3447528904 C Ii:2:008:1 0:1 7 = 02000350 000000
ffff8e2303c4c540 3447528929 S Ii:2:008:1 -115:1 8 <
ffff8e2303c4c540 3447536931 C Ii:2:008:1 0:1 7 = 02000440 000000
ffff8e2303c4c540 3447536958 S Ii:2:008:1 -115:1 8 <
ffff8e2303c4c540 3447544940 C Ii:2:008:1 0:1 7 = 02000310 000000
ffff8e2303c4c540 3447544966 S Ii:2:008:1 -115:1 8 <
ffff8e2303c4c540 3447552941 C Ii:2:008:1 0:1 7 = 02000410 000000
ffff8e2303c4c540 3447552967 S Ii:2:008:1 -115:1 8 <
ffff8e2303c4c540 3447560946 C Ii:2:008:1 0:1 7 = 02000300 000000
ffff8e2303c4c540 3447560973 S Ii:2:008:1 -115:1 8 <
ffff8e2303c4c540 3447568904 C Ii:2:008:1 0:1 7 = 02000300 000000
ffff8e2303c4c540 3447568929 S Ii:2:008:1 -115:1 8 <
ffff8e2303c4c540 3447576919 C Ii:2:008:1 0:1 7 = 02000300 000000
ffff8e2303c4c540 3447576950 S Ii:2:008:1 -115:1 8 <
ffff8e2303c4c540 3447584904 C Ii:2:008:1 0:1 7 = 020003f0 ff0000
ffff8e2303c4c540 3447584929 S Ii:2:008:1 -115:1 8 <
ffff8e2303c4c540 3447592942 C Ii:2:008:1 0:1 7 = 020002f0 ff0000
ffff8e2303c4c540 3447592968 S Ii:2:008:1 -115:1 8 <
ffff8e2303c4c540 3447600941 C Ii:2:008:1 0:1 7 = 020002e0 ff0000
ffff8e2303c4c540 3447600968 S Ii:2:008:1 -115:1 8 <
ffff8e2303c4c540 3447608932 C Ii:2:008:1 0:1 7 = 020001d0 ff0000
ffff8e2303c4c540 3447608958 S Ii:2:008:1 -115:1 8 <
ffff8e2303c4c540 3447616940 C Ii:2:008:1 0:1 7 = 020000c0 ff0000
ffff8e2303c4c540 3447616966 S Ii:2:008:1 -115:1 8 <
ffff8e2303c4c540 3447624932 C Ii:2:008:1 0:1 7 = 020000c0 ff0000
ffff8e2303c4c540 3447624959 S Ii:2:008:1 -115:1 8 <
ffff8e2303c4c540 3447632941 C Ii:2:008:1 0:1 7 = 020000c0 ff0000
ffff8e2303c4c540 3447632967 S Ii:2:008:1 -115:1 8 <
ffff8e2303c4c540 3447640941 C Ii:2:008:1 0:1 7 = 020000c0 ff0000
ffff8e2303c4c540 3447640966 S Ii:2:008:1 -115:1 8 <
ffff8e2303c4c540 3447648942 C Ii:2:008:1 0:1 7 = 0200febf ff0000
ffff8e2303c4c540 3447648967 S Ii:2:008:1 -115:1 8 <
ffff8e2303c4c540 3447656939 C Ii:2:008:1 0:1 7 = 0200fccf ff0000
ffff8e2303c4c540 3447656965 S Ii:2:008:1 -115:1 8 <
ffff8e2303c4c540 3447664941 C Ii:2:008:1 0:1 7 = 0200fabf ff0000
ffff8e2303c4c540 3447664968 S Ii:2:008:1 -115:1 8 <
ffff8e2303c4c540 3447672931 C Ii:2:008:1 0:1 7 = 0200f9cf ff0000
ffff8e2303c4c540 3447672957 S Ii:2:008:1 -115:1 8 <
ffff8e2303c4c540 3447680941 C Ii:2:008:1 0:1 7 = 0200fa0f 000000
ffff8e2303c4c540 3447680967 S Ii:2:008:1 -115:1 8 <
ffff8e2303c4c540 3447688944 C Ii:2:008:1 0:1 7 = 0200faff ff0000
ffff8e2303c4c540 3447688970 S Ii:2:008:1 -115:1 8 <
ffff8e2303c4c540 3447696938 C Ii:2:008:1 0:1 7 = 0200fb1f 000000
ffff8e2303c4c540 3447696963 S Ii:2:008:1 -115:1 8 <
ffff8e2303c4c540 3447704944 C Ii:2:008:1 0:1 7 = 0200fb3f 000000
ffff8e2303c4c540 3447704971 S Ii:2:008:1 -115:1 8 <
ffff8e2303c4c540 3447712941 C Ii:2:008:1 0:1 7 = 0200fa3f 000000
ffff8e2303c4c540 3447712967 S Ii:2:008:1 -115:1 8 <
ffff8e2303c4c540 3447720931 C Ii:2:008:1 0:1 7 = 0200fb3f 000000
ffff8e2303c4c540 3447720958 S Ii:2:008:1 -115:1 8 <
ffff8e2303c4c540 3447728932 C Ii:2:008:1 0:1 7 = 0200fa3f 000000
ffff8e2303c4c540 3447728960 S Ii:2:008:1 -115:1 8 <
ffff8e2303c4c540 3447736931 C Ii:2:008:1 0:1 7 = 0200fd3f 000000
ffff8e2303c4c540 3447736957 S Ii:2:008:1 -115:1 8 <
ffff8e2303c4c540 3447744937 C Ii:2:008:1 0:1 7 = 0200fd1f 000000
ffff8e2303c4c540 3447744964 S Ii:2:008:1 -115:1 8 <
ffff8e2303c4c540 3447752905 C Ii:2:008:1 0:1 7 = 0200fd2f 000000
ffff8e2303c4c540 3447752931 S Ii:2:008:1 -115:1 8 <
ffff8e2303c4c540 3447760943 C Ii:2:008:1 0:1 7 = 0200fe0f 000000
ffff8e2303c4c540 3447760969 S Ii:2:008:1 -115:1 8 <
ffff8e2303c4c540 3447768905 C Ii:2:008:1 0:1 7 = 0200fe1f 000000
ffff8e2303c4c540 3447768931 S Ii:2:008:1 -115:1 8 <
ffff8e2303c4c540 3447776945 C Ii:2:008:1 0:1 7 = 0200fd1f 000000
ffff8e2303c4c540 3447776974 S Ii:2:008:1 -115:1 8 <
ffff8e2303c4c540 3447784941 C Ii:2:008:1 0:1 7 = 0200fe0f 000000
ffff8e2303c4c540 3447784967 S Ii:2:008:1 -115:1 8 <
ffff8e2303c4c540 3447792944 C Ii:2:008:1 0:1 7 = 0200ff0f 000000
ffff8e2303c4c540 3447792969 S Ii:2:008:1 -115:1 8 <
ffff8e2303c4c540 3447800944 C Ii:2:008:1 0:1 7 = 0200ff0f 000000
ffff8e2303c4c540 3447800970 S Ii:2:008:1 -115:1 8 <
ffff8e2303c4c540 3447816938 C Ii:2:008:1 0:1 7 = 0200ff1f 000000
ffff8e2303c4c540 3447816965 S Ii:2:008:1 -115:1 8 <
ffff8e2303c4c540 3447824932 C Ii:2:008:1 0:1 7 = 0200ff0f 000000
ffff8e2303c4c540 3447824958 S Ii:2:008:1 -115:1 8 <
ffff8e2303c4c540 3447832931 C Ii:2:008:1 0:1 7 = 0200fe1f 000000
ffff8e2303c4c540 3447832957 S Ii:2:008:1 -115:1 8 <
ffff8e2303c4c540 3447840940 C Ii:2:008:1 0:1 7 = 0200fd1f 000000
ffff8e2303c4c540 3447840967 S Ii:2:008:1 -115:1 8 <
ffff8e2303c4c540 3447848931 C Ii:2:008:1 0:1 7 = 0200fe0f 000000
ffff8e2303c4c540 3447848955 S Ii:2:008:1 -115:1 8 <
ffff8e2303c4c540 3447856941 C Ii:2:008:1 0:1 7 = 0200ff0f 000000
ffff8e2303c4c540 3447856967 S Ii:2:008:1 -115:1 8 <
ffff8e2303c4c540 3447864939 C Ii:2:008:1 0:1 7 = 0200fe0f 000000
ffff8e2303c4c540 3447864965 S Ii:2:008:1 -115:1 8 <
ffff8e2302151980 3447882093 S Bo:2:002:2 -115 31 = 55534243 fe1f0000 00000000 00000600 00000000 00000000 00000000 000000
ffff8e2302151980 3447882125 C Bo:2:002:2 0 31 >
ffff8e2302151980 3447882134 S Bi:2:002:1 -115 13 <
ffff8e2302151980 3447882173 C Bi:2:002:1 0 13 = 55534253 fe1f0000 00000000 00
ffff8e2303c4c540 3448264946 C Ii:2:008:1 0:1 7 = 0200ff1f 000000
ffff8e2303c4c540 3448264980 S Ii:2:008:1 -115:1 8 <
ffff8e2303c4c540 3448272942 C Ii:2:008:1 0:1 7 = 0200fd4f 000000
ffff8e2303c4c540 3448272969 S Ii:2:008:1 -115:1 8 <
ffff8e2303c4c540 3448280942 C Ii:2:008:1 0:1 7 = 0200fd8f 000000
ffff8e2303c4c540 3448280968 S Ii:2:008:1 -115:1 8 <
ffff8e2303c4c540 3448288932 C Ii:2:008:1 0:1 7 = 0200fdaf 000000
ffff8e2303c4c540 3448288959 S Ii:2:008:1 -115:1 8 <
ffff8e2303c4c540 3448296941 C Ii:2:008:1 0:1 7 = 0200fdbf 000000
ffff8e2303c4c540 3448296968 S Ii:2:008:1 -115:1 8 <
ffff8e2303c4c540 3448304933 C Ii:2:008:1 0:1 7 = 0200ffcf 000000
ffff8e2303c4c540 3448304959 S Ii:2:008:1 -115:1 8 <
ffff8e2303c4c540 3448312949 C Ii:2:008:1 0:1 7 = 0200ffbf 000000
ffff8e2303c4c540 3448312975 S Ii:2:008:1 -115:1 8 <
ffff8e2303c4c540 3448320940 C Ii:2:008:1 0:1 7 = 020000d0 000000
ffff8e2303c4c540 3448320966 S Ii:2:008:1 -115:1 8 <
ffff8e2303c4c540 3448328909 C Ii:2:008:1 0:1 7 = 020002e0 000000
ffff8e2303c4c540 3448328942 S Ii:2:008:1 -115:1 8 <
ffff8e2303c4c540 3448336941 C Ii:2:008:1 0:1 7 = 020003c0 000000
ffff8e2303c4c540 3448336968 S Ii:2:008:1 -115:1 8 <
ffff8e2303c4c540 3448344939 C Ii:2:008:1 0:1 7 = 020006a0 000000
ffff8e2303c4c540 3448344965 S Ii:2:008:1 -115:1 8 <
ffff8e2303c4c540 3448352945 C Ii:2:008:1 0:1 7 = 02000780 000000
ffff8e2303c4c540 3448352972 S Ii:2:008:1 -115:1 8 <
ffff8e2303c4c540 3448360947 C Ii:2:008:1 0:1 7 = 02000550 000000
ffff8e2303c4c540 3448360974 S Ii:2:008:1 -115:1 8 <
ffff8e2303c4c540 3448368946 C Ii:2:008:1 0:1 7 = 02000330 000000
ffff8e2303c4c540 3448368972 S Ii:2:008:1 -115:1 8 <
ffff8e2303c4c540 3448376943 C Ii:2:008:1 0:1 7 = 02000110 000000
ffff8e2303c4c540 3448376969 S Ii:2:008:1 -115:1 8 <
ffff8e2303c4c540 3448487943 C Ii:2:008:1 0:1 7 = 020000e0 ff0000
ffff8e2303c4c540 3448487970 S Ii:2:008:1 -115:1 8 <
ffff8e2303c4c540 3448495940 C Ii:2:008:1 0:1 7 = 020000f0 ff0000
ffff8e2303c4c540 3448495966 S Ii:2:008:1 -115:1 8 <
ffff8e2303c4c540 3448503945 C Ii:2:008:1 0:1 7 = 0200ffef ff0000
ffff8e2303c4c540 3448503971 S Ii:2:008:1 -115:1 8 <
ffff8e2303c4c540 3448511941 C Ii:2:008:1 0:1 7 = 0200fddf ff0000
ffff8e2303c4c540 3448511967 S Ii:2:008:1 -115:1 8 <
ffff8e2303c4c540 3448519933 C Ii:2:008:1 0:1 7 = 0200fcdf ff0000
ffff8e2303c4c540 3448519962 S Ii:2:008:1 -115:1 8 <
ffff8e2303c4c540 3448527934 C Ii:2:008:1 0:1 7 = 0200fcef ff0000
ffff8e2303c4c540 3448527960 S Ii:2:008:1 -115:1 8 <
ffff8e2303c4c540 3448535942 C Ii:2:008:1 0:1 7 = 0200feff ff0000
ffff8e2303c4c540 3448535969 S Ii:2:008:1 -115:1 8 <
ffff8e2303c4c540 3448543943 C Ii:2:008:1 0:1 7 = 0200ffff ff0000
ffff8e2303c4c540 3448543969 S Ii:2:008:1 -115:1 8 <
ffff8e2303c4c540 3448823942 C Ii:2:008:1 0:1 7 = 02000100 000000
ffff8e2303c4c540 3448823968 S Ii:2:008:1 -115:1 8 <
ffff8e2303c4c540 3448831947 C Ii:2:008:1 0:1 7 = 02000100 000000
ffff8e2303c4c540 3448831972 S Ii:2:008:1 -115:1 8 <
ffff8e2303c4c540 3448847942 C Ii:2:008:1 0:1 7 = 02000100 000000
ffff8e2303c4c540 3448847968 S Ii:2:008:1 -115:1 8 <
ffff8e2303c4c540 3449151952 C Ii:2:008:1 0:1 7 = 02000100 000000
ffff8e2303c4c540 3449151985 S Ii:2:008:1 -115:1 8 <
ffff8e2303c4c540 3449159942 C Ii:2:008:1 0:1 7 = 02000100 000000
ffff8e2303c4c540 3449159967 S Ii:2:008:1 -115:1 8 <
ffff8e2303c4c540 3449167938 C Ii:2:008:1 0:1 7 = 02000200 000000
ffff8e2303c4c540 3449167964 S Ii:2:008:1 -115:1 8 <
ffff8e2303c4c540 3449175945 C Ii:2:008:1 0:1 7 = 02000100 000000
ffff8e2303c4c540 3449175971 S Ii:2:008:1 -115:1 8 <
ffff8e2303c4c540 3449183948 C Ii:2:008:1 0:1 7 = 02000100 000000
ffff8e2303c4c540 3449183973 S Ii:2:008:1 -115:1 8 <
ffff8e2303c4c540 3449231936 C Ii:2:008:1 0:1 7 = 02000110 000000
ffff8e2303c4c540 3449231963 S Ii:2:008:1 -115:1 8 <
ffff8e2303c4c540 3449239947 C Ii:2:008:1 0:1 7 = 02000110 000000
ffff8e2303c4c540 3449239972 S Ii:2:008:1 -115:1 8 <
ffff8e2303c4c540 3449247937 C Ii:2:008:1 0:1 7 = 02000220 000000
ffff8e2303c4c540 3449247964 S Ii:2:008:1 -115:1 8 <
ffff8e2303c4c540 3449255937 C Ii:2:008:1 0:1 7 = 02000110 000000
ffff8e2303c4c540 3449255967 S Ii:2:008:1 -115:1 8 <
ffff8e2303c4c540 3449263936 C Ii:2:008:1 0:1 7 = 02000110 000000
ffff8e2303c4c540 3449263962 S Ii:2:008:1 -115:1 8 <
ffff8e2303c4c540 3449359943 C Ii:2:008:1 0:1 7 = 02000010 000000
ffff8e2303c4c540 3449359967 S Ii:2:008:1 -115:1 8 <
ffff8e2303c4c540 3449367946 C Ii:2:008:1 0:1 7 = 02000020 000000
ffff8e2303c4c540 3449367972 S Ii:2:008:1 -115:1 8 <
ffff8e2303c4c540 3449375945 C Ii:2:008:1 0:1 7 = 02000010 000000
ffff8e2303c4c540 3449375971 S Ii:2:008:1 -115:1 8 <
ffff8e2303c4c540 3449383946 C Ii:2:008:1 0:1 7 = 02000020 000000
ffff8e2303c4c540 3449383972 S Ii:2:008:1 -115:1 8 <
ffff8e2303c4c540 3449407943 C Ii:2:008:1 0:1 7 = 0200ff1f 000000
ffff8e2303c4c540 3449407970 S Ii:2:008:1 -115:1 8 <
ffff8e2303c4c540 3449423943 C Ii:2:008:1 0:1 7 = 0200fe2f 000000
ffff8e2303c4c540 3449423969 S Ii:2:008:1 -115:1 8 <
ffff8e2303c4c540 3449431947 C Ii:2:008:1 0:1 7 = 0200ff2f 000000
ffff8e2303c4c540 3449431974 S Ii:2:008:1 -115:1 8 <
ffff8e2303c4c540 3449439937 C Ii:2:008:1 0:1 7 = 0200fd3f 000000
ffff8e2303c4c540 3449439963 S Ii:2:008:1 -115:1 8 <
ffff8e2303c4c540 3449447950 C Ii:2:008:1 0:1 7 = 0200fe3f 000000
ffff8e2303c4c540 3449447976 S Ii:2:008:1 -115:1 8 <
ffff8e2303c4c540 3449455939 C Ii:2:008:1 0:1 7 = 0200fe3f 000000
ffff8e2303c4c540 3449455967 S Ii:2:008:1 -115:1 8 <
ffff8e2303c4c540 3449463953 C Ii:2:008:1 0:1 7 = 0200fd3f 000000
ffff8e2303c4c540 3449463978 S Ii:2:008:1 -115:1 8 <
ffff8e2303c4c540 3449471946 C Ii:2:008:1 0:1 7 = 0200fe2f 000000
ffff8e2303c4c540 3449471972 S Ii:2:008:1 -115:1 8 <
ffff8e2303c4c540 3449479952 C Ii:2:008:1 0:1 7 = 0200fd3f 000000
ffff8e2303c4c540 3449479979 S Ii:2:008:1 -115:1 8 <
ffff8e2303c4c540 3449487938 C Ii:2:008:1 0:1 7 = 0200fe4f 000000
ffff8e2303c4c540 3449487964 S Ii:2:008:1 -115:1 8 <
ffff8e2303c4c540 3449495939 C Ii:2:008:1 0:1 7 = 0200ff3f 000000
ffff8e2303c4c540 3449495967 S Ii:2:008:1 -115:1 8 <
ffff8e2303c4c540 3449503951 C Ii:2:008:1 0:1 7 = 0200fe3f 000000
ffff8e2303c4c540 3449503977 S Ii:2:008:1 -115:1 8 <
ffff8e2303c4c540 3449511946 C Ii:2:008:1 0:1 7 = 0200ff2f 000000
ffff8e2303c4c540 3449511973 S Ii:2:008:1 -115:1 8 <
ffff8e2303c4c540 3449519937 C Ii:2:008:1 0:1 7 = 0200fe2f 000000
ffff8e2303c4c540 3449519963 S Ii:2:008:1 -115:1 8 <
ffff8e2303c4c540 3449527938 C Ii:2:008:1 0:1 7 = 0200ff1f 000000
ffff8e2303c4c540 3449527965 S Ii:2:008:1 -115:1 8 <
ffff8e2303c4c540 3449535947 C Ii:2:008:1 0:1 7 = 0200ff1f 000000
ffff8e2303c4c540 3449535974 S Ii:2:008:1 -115:1 8 <
ffff8e2303c4c540 3449543947 C Ii:2:008:1 0:1 7 = 0200ff1f 000000
ffff8e2303c4c540 3449543973 S Ii:2:008:1 -115:1 8 <
ffff8e2303c4c540 3449607947 C Ii:2:008:1 0:1 7 = 0200ff1f 000000
ffff8e2303c4c540 3449607973 S Ii:2:008:1 -115:1 8 <
ffff8e2303c4c540 3449623938 C Ii:2:008:1 0:1 7 = 0200ff1f 000000
ffff8e2303c4c540 3449623965 S Ii:2:008:1 -115:1 8 <
ffff8e2303c4c540 3449631938 C Ii:2:008:1 0:1 7 = 0200ff1f 000000
ffff8e2303c4c540 3449631964 S Ii:2:008:1 -115:1 8 <
ffff8e2303c4c540 3449639947 C Ii:2:008:1 0:1 7 = 0200ff1f 000000
ffff8e2303c4c540 3449639974 S Ii:2:008:1 -115:1 8 <
ffff8e2303c4c540 3449655938 C Ii:2:008:1 0:1 7 = 0200ff1f 000000
ffff8e2303c4c540 3449655965 S Ii:2:008:1 -115:1 8 <
ffff8e2303c4c540 3449663950 C Ii:2:008:1 0:1 7 = 0200ff1f 000000
ffff8e2303c4c540 3449663975 S Ii:2:008:1 -115:1 8 <
ffff8e2303c4c540 3449727938 C Ii:2:008:1 0:1 7 = 0200ff2f 000000
ffff8e2303c4c540 3449727966 S Ii:2:008:1 -115:1 8 <
ffff8e2303c4c540 3449735940 C Ii:2:008:1 0:1 7 = 0200ff3f 000000
ffff8e2303c4c540 3449735966 S Ii:2:008:1 -115:1 8 <
ffff8e2303c4c540 3449743937 C Ii:2:008:1 0:1 7 = 0200fe3f 000000
ffff8e2303c4c540 3449743963 S Ii:2:008:1 -115:1 8 <
ffff8e2303c4c540 3449751947 C Ii:2:008:1 0:1 7 = 0200ff4f 000000
ffff8e2303c4c540 3449751974 S Ii:2:008:1 -115:1 8 <
ffff8e2303c4c540 3449759938 C Ii:2:008:1 0:1 7 = 0200ff3f 000000
ffff8e2303c4c540 3449759964 S Ii:2:008:1 -115:1 8 <
ffff8e2303c4c540 3449767958 C Ii:2:008:1 0:1 7 = 02000020 000000
ffff8e2303c4c540 3449767975 S Ii:2:008:1 -115:1 8 <
ffff8e2303c4c540 3449775938 C Ii:2:008:1 0:1 7 = 02000040 000000
ffff8e2303c4c540 3449775955 S Ii:2:008:1 -115:1 8 <
ffff8e2303c4c540 3449783939 C Ii:2:008:1 0:1 7 = 02000030 000000
ffff8e2303c4c540 3449783955 S Ii:2:008:1 -115:1 8 <
ffff8e2303c4c540 3449791946 C Ii:2:008:1 0:1 7 = 02000030 000000
ffff8e2303c4c540 3449791961 S Ii:2:008:1 -115:1 8 <
ffff8e2303c4c540 3449799939 C Ii:2:008:1 0:1 7 = 02000030 000000
ffff8e2303c4c540 3449799960 S Ii:2:008:1 -115:1 8 <
ffff8e2303c4c540 3449807939 C Ii:2:008:1 0:1 7 = 02000030 000000
ffff8e2303c4c540 3449807956 S Ii:2:008:1 -115:1 8 <
ffff8e2303c4c540 3449815954 C Ii:2:008:1 0:1 7 = 02000040 000000
ffff8e2303c4c540 3449815970 S Ii:2:008:1 -115:1 8 <
ffff8e2303c4c540 3449823951 C Ii:2:008:1 0:1 7 = 02000030 000000
ffff8e2303c4c540 3449823967 S Ii:2:008:1 -115:1 8 <
ffff8e2303c4c540 3449831939 C Ii:2:008:1 0:1 7 = 02000070 000000
ffff8e2303c4c540 3449831956 S Ii:2:008:1 -115:1 8 <
ffff8e2303c4c540 3449839946 C Ii:2:008:1 0:1 7 = 0200ff8f 000000
ffff8e2303c4c540 3449839963 S Ii:2:008:1 -115:1 8 <
ffff8e2303c4c540 3449847950 C Ii:2:008:1 0:1 7 = 0200fe9f 000000
ffff8e2303c4c540 3449847966 S Ii:2:008:1 -115:1 8 <
ffff8e2303c4c540 3449855945 C Ii:2:008:1 0:1 7 = 0200ffaf 000000
ffff8e2303c4c540 3449855963 S Ii:2:008:1 -115:1 8 <
ffff8e2303c4c540 3449863947 C Ii:2:008:1 0:1 7 = 0200fdaf 000000
ffff8e2303c4c540 3449863965 S Ii:2:008:1 -115:1 8 <
ffff8e2303c4c540 3449871946 C Ii:2:008:1 0:1 7 = 0200ff8f 000000
ffff8e2303c4c540 3449871963 S Ii:2:008:1 -115:1 8 <
ffff8e2303c4c540 3449879947 C Ii:2:008:1 0:1 7 = 0200fe7f 000000
ffff8e2303c4c540 3449879965 S Ii:2:008:1 -115:1 8 <
ffff8e2303c4c540 3449887949 C Ii:2:008:1 0:1 7 = 0200ff5f 000000
ffff8e2303c4c540 3449887966 S Ii:2:008:1 -115:1 8 <
ffff8e2303c4c540 3449895951 C Ii:2:008:1 0:1 7 = 0200ff2f 000000
ffff8e2303c4c540 3449895968 S Ii:2:008:1 -115:1 8 <
ffff8e2303c4c540 3449903946 C Ii:2:008:1 0:1 7 = 02000010 000000
ffff8e2303c4c540 3449903963 S Ii:2:008:1 -115:1 8 <
ffff8e2303c4c540 3449911952 C Ii:2:008:1 0:1 7 = 02000020 000000
ffff8e2303c4c540 3449911968 S Ii:2:008:1 -115:1 8 <
ffff8e2303c4c540 3449927947 C Ii:2:008:1 0:1 7 = 02000010 000000
ffff8e2303c4c540 3449927963 S Ii:2:008:1 -115:1 8 <
ffff8e2302151980 3449930196 S Bo:2:002:2 -115 31 = 55534243 ff1f0000 00000000 00000600 00000000 00000000 00000000 000000
ffff8e2302151980 3449930251 C Bo:2:002:2 0 31 >
ffff8e2302151980 3449930261 S Bi:2:002:1 -115 13 <
ffff8e2302151980 3449930290 C Bi:2:002:1 0 13 = 55534253 ff1f0000 00000000 00
ffff8e2303c4c540 3449935940 C Ii:2:008:1 0:1 7 = 02000020 000000
ffff8e2303c4c540 3449935956 S Ii:2:008:1 -115:1 8 <
ffff8e2303c4c540 3449951955 C Ii:2:008:1 0:1 7 = 02000010 000000
ffff8e2303c4c540 3449951972 S Ii:2:008:1 -115:1 8 <
ffff8e2303c4c540 3449959939 C Ii:2:008:1 0:1 7 = 02000010 000000
ffff8e2303c4c540 3449959955 S Ii:2:008:1 -115:1 8 <
ffff8e2303c4c540 3450039916 C Ii:2:008:1 0:1 7 = 0200ffff ff0000
ffff8e2303c4c540 3450039939 S Ii:2:008:1 -115:1 8 <
ffff8e2303c4c540 3450047945 C Ii:2:008:1 0:1 7 = 0200feff ff0000
ffff8e2303c4c540 3450047962 S Ii:2:008:1 -115:1 8 <
ffff8e2303c4c540 3450055948 C Ii:2:008:1 0:1 7 = 0200feef ff0000
ffff8e2303c4c540 3450055966 S Ii:2:008:1 -115:1 8 <
ffff8e2303c4c540 3450063946 C Ii:2:008:1 0:1 7 = 0200fcdf ff0000
ffff8e2303c4c540 3450063963 S Ii:2:008:1 -115:1 8 <
ffff8e2303c4c540 3450071940 C Ii:2:008:1 0:1 7 = 0200fdef ff0000
ffff8e2303c4c540 3450071957 S Ii:2:008:1 -115:1 8 <
ffff8e2303c4c540 3450079947 C Ii:2:008:1 0:1 7 = 0200ffef ff0000
ffff8e2303c4c540 3450079965 S Ii:2:008:1 -115:1 8 <
ffff8e2303c4c540 3450087951 C Ii:2:008:1 0:1 7 = 0200feff ff0000
ffff8e2303c4c540 3450087968 S Ii:2:008:1 -115:1 8 <
ffff8e2303c4c540 3450103939 C Ii:2:008:1 0:1 7 = 0200ff0f 000000
ffff8e2303c4c540 3450103956 S Ii:2:008:1 -115:1 8 <
ffff8e2303c4c540 3450119946 C Ii:2:008:1 0:1 7 = 0200ff0f 000000
ffff8e2303c4c540 3450119963 S Ii:2:008:1 -115:1 8 <
ffff8e2303c4c540 3450127939 C Ii:2:008:1 0:1 7 = 0200ff0f 000000
ffff8e2303c4c540 3450127956 S Ii:2:008:1 -115:1 8 <
ffff8e2303c4c540 3450615942 C Ii:2:008:1 0:1 7 = 0200ffff ff0000
ffff8e2303c4c540 3450615973 S Ii:2:008:1 -115:1 8 <
ffff8e2303c4c540 3450623942 C Ii:2:008:1 0:1 7 = 020000f0 ff0000
ffff8e2303c4c540 3450623968 S Ii:2:008:1 -115:1 8 <
ffff8e2303c4c540 3450631949 C Ii:2:008:1 0:1 7 = 0200ff0f 000000
ffff8e2303c4c540 3450631975 S Ii:2:008:1 -115:1 8 <
ffff8e2303c4c540 3450639954 C Ii:2:008:1 0:1 7 = 0200ffff ff0000
ffff8e2303c4c540 3450639982 S Ii:2:008:1 -115:1 8 <
ffff8e2302151980 3451979102 S Bo:2:002:2 -115 31 = 55534243 00200000 00000000 00000600 00000000 00000000 00000000 000000
ffff8e2302151980 3451979133 C Bo:2:002:2 0 31 >
ffff8e2302151980 3451979141 S Bi:2:002:1 -115 13 <
ffff8e2302151980 3451979188 C Bi:2:002:1 0 13 = 55534253 00200000 00000000 00
ffff8e2303c4c540 3453725969 C Ii:2:008:1 0:1 7 = 02000010 000000
ffff8e2303c4c540 3453726003 S Ii:2:008:1 -115:1 8 <
ffff8e2303c4c540 3453733962 C Ii:2:008:1 0:1 7 = 0200ff2f 000000
ffff8e2303c4c540 3453733988 S Ii:2:008:1 -115:1 8 <
ffff8e2303c4c540 3453741953 C Ii:2:008:1 0:1 7 = 02000030 000000
ffff8e2303c4c540 3453741978 S Ii:2:008:1 -115:1 8 <
ffff8e2303c4c540 3453749963 C Ii:2:008:1 0:1 7 = 0200ff4f 000000
ffff8e2303c4c540 3453749990 S Ii:2:008:1 -115:1 8 <
ffff8e2303c4c540 3453757959 C Ii:2:008:1 0:1 7 = 0200ff3f 000000
ffff8e2303c4c540 3453757986 S Ii:2:008:1 -115:1 8 <
ffff8e2303c4c540 3453765962 C Ii:2:008:1 0:1 7 = 0200ff6f 000000
ffff8e2303c4c540 3453765989 S Ii:2:008:1 -115:1 8 <
ffff8e2303c4c540 3453773954 C Ii:2:008:1 0:1 7 = 02000040 000000
ffff8e2303c4c540 3453773981 S Ii:2:008:1 -115:1 8 <
ffff8e2303c4c540 3453781963 C Ii:2:008:1 0:1 7 = 0200ff5f 000000
ffff8e2303c4c540 3453781989 S Ii:2:008:1 -115:1 8 <
ffff8e2303c4c540 3453789953 C Ii:2:008:1 0:1 7 = 0200fe6f 000000
ffff8e2303c4c540 3453789980 S Ii:2:008:1 -115:1 8 <
ffff8e2303c4c540 3453797959 C Ii:2:008:1 0:1 7 = 02000020 000000
ffff8e2303c4c540 3453797986 S Ii:2:008:1 -115:1 8 <
ffff8e2303c4c540 3453805962 C Ii:2:008:1 0:1 7 = 0200ff3f 000000
ffff8e2303c4c540 3453805989 S Ii:2:008:1 -115:1 8 <
ffff8e2303c4c540 3453813930 C Ii:2:008:1 0:1 7 = 0200fe4f 000000
ffff8e2303c4c540 3453813961 S Ii:2:008:1 -115:1 8 <
ffff8e2303c4c540 3453821967 C Ii:2:008:1 0:1 7 = 02000040 000000
ffff8e2303c4c540 3453821992 S Ii:2:008:1 -115:1 8 <
ffff8e2303c4c540 3453829965 C Ii:2:008:1 0:1 7 = 0200ff4f 000000
ffff8e2303c4c540 3453829991 S Ii:2:008:1 -115:1 8 <
ffff8e2303c4c540 3453837968 C Ii:2:008:1 0:1 7 = 0200ff3f 000000
ffff8e2303c4c540 3453837995 S Ii:2:008:1 -115:1 8 <
ffff8e2303c4c540 3453869959 C Ii:2:008:1 0:1 7 = 02000100 000000
ffff8e2303c4c540 3453869986 S Ii:2:008:1 -115:1 8 <
ffff8e2303c4c540 3453877952 C Ii:2:008:1 0:1 7 = 02000100 000000
ffff8e2303c4c540 3453877978 S Ii:2:008:1 -115:1 8 <
ffff8e2303c4c540 3453893964 C Ii:2:008:1 0:1 7 = 02000100 000000
ffff8e2303c4c540 3453893990 S Ii:2:008:1 -115:1 8 <
ffff8e2303c4c540 3453973954 C Ii:2:008:1 0:1 7 = 020000e0 ff0000
ffff8e2303c4c540 3453973982 S Ii:2:008:1 -115:1 8 <
ffff8e2303c4c540 3453981955 C Ii:2:008:1 0:1 7 = 020000d0 ff0000
ffff8e2303c4c540 3453981981 S Ii:2:008:1 -115:1 8 <
ffff8e2303c4c540 3453989962 C Ii:2:008:1 0:1 7 = 020000c0 ff0000
ffff8e2303c4c540 3453989987 S Ii:2:008:1 -115:1 8 <
ffff8e2303c4c540 3453997966 C Ii:2:008:1 0:1 7 = 0200ffbf ff0000
ffff8e2303c4c540 3453997993 S Ii:2:008:1 -115:1 8 <
ffff8e2303c4c540 3454005965 C Ii:2:008:1 0:1 7 = 0200fc9f ff0000
ffff8e2303c4c540 3454005992 S Ii:2:008:1 -115:1 8 <
ffff8e2303c4c540 3454013930 C Ii:2:008:1 0:1 7 = 0200fa9f ff0000
ffff8e2303c4c540 3454013963 S Ii:2:008:1 -115:1 8 <
ffff8e2303c4c540 3454021961 C Ii:2:008:1 0:1 7 = 0200faaf ff0000
ffff8e2303c4c540 3454021988 S Ii:2:008:1 -115:1 8 <
ffff8e2302151980 3454026122 S Bo:2:002:2 -115 31 = 55534243 01200000 00000000 00000600 00000000 00000000 00000000 000000
ffff8e2302151980 3454026168 C Bo:2:002:2 0 31 >
ffff8e2302151980 3454026179 S Bi:2:002:1 -115 13 <
ffff8e2302151980 3454026208 C Bi:2:002:1 0 13 = 55534253 01200000 00000000 00
ffff8e2303c4c540 3454029965 C Ii:2:008:1 0:1 7 = 0200f99f ff0000
ffff8e2303c4c540 3454029992 S Ii:2:008:1 -115:1 8 <
ffff8e2303c4c540 3454037967 C Ii:2:008:1 0:1 7 = 0200f9bf ff0000
ffff8e2303c4c540 3454037993 S Ii:2:008:1 -115:1 8 <
ffff8e2303c4c540 3454045954 C Ii:2:008:1 0:1 7 = 0200faaf ff0000
ffff8e2303c4c540 3454045980 S Ii:2:008:1 -115:1 8 <
ffff8e2303c4c540 3454053961 C Ii:2:008:1 0:1 7 = 0200fa9f ff0000
ffff8e2303c4c540 3454053987 S Ii:2:008:1 -115:1 8 <
ffff8e2303c4c540 3454061957 C Ii:2:008:1 0:1 7 = 0200fabf ff0000
ffff8e2303c4c540 3454061985 S Ii:2:008:1 -115:1 8 <
ffff8e2303c4c540 3454069953 C Ii:2:008:1 0:1 7 = 0200fddf ff0000
ffff8e2303c4c540 3454069980 S Ii:2:008:1 -115:1 8 <
ffff8e2303c4c540 3454077964 C Ii:2:008:1 0:1 7 = 0200ffff ff0000
ffff8e2303c4c540 3454077990 S Ii:2:008:1 -115:1 8 <
ffff8e2303c4c540 3454085960 C Ii:2:008:1 0:1 7 = 0200ffff ff0000
ffff8e2303c4c540 3454085987 S Ii:2:008:1 -115:1 8 <
ffff8e2303c4c540 3454965983 C Ii:2:008:1 0:1 7 = 0200ffff ff0000
ffff8e2303c4c540 3454966005 S Ii:2:008:1 -115:1 8 <
ffff8e2303c4c540 3454973956 C Ii:2:008:1 0:1 7 = 0200fdff ff0000
ffff8e2303c4c540 3454973986 S Ii:2:008:1 -115:1 8 <
ffff8e2303c4c540 3454981964 C Ii:2:008:1 0:1 7 = 0200feef ff0000
ffff8e2303c4c540 3454981990 S Ii:2:008:1 -115:1 8 <
ffff8e2303c4c540 3454989963 C Ii:2:008:1 0:1 7 = 0200fddf ff0000
ffff8e2303c4c540 3454989990 S Ii:2:008:1 -115:1 8 <
ffff8e2303c4c540 3454997966 C Ii:2:008:1 0:1 7 = 0200ffef ff0000
ffff8e2303c4c540 3454997992 S Ii:2:008:1 -115:1 8 <
ffff8e2303c4c540 3455005964 C Ii:2:008:1 0:1 7 = 0200ffef ff0000
ffff8e2303c4c540 3455005990 S Ii:2:008:1 -115:1 8 <
ffff8e2303c4c540 3455013957 C Ii:2:008:1 0:1 7 = 0200feef ff0000
ffff8e2303c4c540 3455013984 S Ii:2:008:1 -115:1 8 <
ffff8e2303c4c540 3455021957 C Ii:2:008:1 0:1 7 = 020000f0 ff0000
ffff8e2303c4c540 3455021983 S Ii:2:008:1 -115:1 8 <
ffff8e2303c4c540 3455029967 C Ii:2:008:1 0:1 7 = 0200feff ff0000
ffff8e2303c4c540 3455029993 S Ii:2:008:1 -115:1 8 <
ffff8e2303c4c540 3455037958 C Ii:2:008:1 0:1 7 = 0200ffef ff0000
ffff8e2303c4c540 3455037983 S Ii:2:008:1 -115:1 8 <
ffff8e2303c4c540 3455045957 C Ii:2:008:1 0:1 7 = 0200ff0f 000000
ffff8e2303c4c540 3455045983 S Ii:2:008:1 -115:1 8 <
ffff8e2303c4c540 3455053965 C Ii:2:008:1 0:1 7 = 0200ffff ff0000
ffff8e2303c4c540 3455053991 S Ii:2:008:1 -115:1 8 <
ffff8e2303c4c540 3455069958 C Ii:2:008:1 0:1 7 = 0200ffff ff0000
ffff8e2303c4c540 3455069985 S Ii:2:008:1 -115:1 8 <
ffff8e2303c4c540 3455077957 C Ii:2:008:1 0:1 7 = 020000f0 ff0000
ffff8e2303c4c540 3455077983 S Ii:2:008:1 -115:1 8 <
ffff8e2303c4c540 3455085957 C Ii:2:008:1 0:1 7 = 0200ff0f 000000
ffff8e2303c4c540 3455085982 S Ii:2:008:1 -115:1 8 <
ffff8e2303c4c540 3455093957 C Ii:2:008:1 0:1 7 = 0200ffff ff0000
ffff8e2303c4c540 3455093985 S Ii:2:008:1 -115:1 8 <
ffff8e2303c4c540 3455101958 C Ii:2:008:1 0:1 7 = 020000f0 ff0000
ffff8e2303c4c540 3455101985 S Ii:2:008:1 -115:1 8 <
ffff8e2303c4c540 3455109958 C Ii:2:008:1 0:1 7 = 020000f0 ff0000
ffff8e2303c4c540 3455109984 S Ii:2:008:1 -115:1 8 <
ffff8e2303c4c540 3455125969 C Ii:2:008:1 0:1 7 = 020000f0 ff0000
ffff8e2303c4c540 3455125995 S Ii:2:008:1 -115:1 8 <
ffff8e2302151980 3456074129 S Bo:2:002:2 -115 31 = 55534243 02200000 00000000 00000600 00000000 00000000 00000000 000000
ffff8e2302151980 3456074163 C Bo:2:002:2 0 31 >
ffff8e2302151980 3456074174 S Bi:2:002:1 -115 13 <
ffff8e2302151980 3456074211 C Bi:2:002:1 0 13 = 55534253 02200000 00000000 00
ffff8e2303c4c540 3456196972 C Ii:2:008:1 0:1 7 = 02000110 000000
ffff8e2303c4c540 3456197002 S Ii:2:008:1 -115:1 8 <
ffff8e2303c4c540 3456204971 C Ii:2:008:1 0:1 7 = 02000130 000000
ffff8e2303c4c540 3456204997 S Ii:2:008:1 -115:1 8 <
ffff8e2303c4c540 3456212962 C Ii:2:008:1 0:1 7 = 02000350 000000
ffff8e2303c4c540 3456212988 S Ii:2:008:1 -115:1 8 <
ffff8e2303c4c540 3456220971 C Ii:2:008:1 0:1 7 = 02000340 000000
ffff8e2303c4c540 3456220998 S Ii:2:008:1 -115:1 8 <
ffff8e2303c4c540 3456228961 C Ii:2:008:1 0:1 7 = 02000330 000000
ffff8e2303c4c540 3456228987 S Ii:2:008:1 -115:1 8 <
ffff8e2303c4c540 3456236968 C Ii:2:008:1 0:1 7 = 02000120 000000
ffff8e2303c4c540 3456236994 S Ii:2:008:1 -115:1 8 <
ffff8e2303c4c540 3456260961 C Ii:2:008:1 0:1 7 = 02000110 000000
ffff8e2303c4c540 3456260989 S Ii:2:008:1 -115:1 8 <
ffff8e2303c4c540 3456268971 C Ii:2:008:1 0:1 7 = 02000100 000000
ffff8e2303c4c540 3456268996 S Ii:2:008:1 -115:1 8 <
ffff8e2303c4c540 3456276969 C Ii:2:008:1 0:1 7 = 02000010 000000
ffff8e2303c4c540 3456276994 S Ii:2:008:1 -115:1 8 <
ffff8e2303c4c540 3456284963 C Ii:2:008:1 0:1 7 = 02000110 000000
ffff8e2303c4c540 3456284989 S Ii:2:008:1 -115:1 8 <
ffff8e2303c4c540 3456660970 C Ii:2:008:1 0:1 7 = 02000010 000000
ffff8e2303c4c540 3456661002 S Ii:2:008:1 -115:1 8 <
ffff8e2303c4c540 3456668972 C Ii:2:008:1 0:1 7 = 02000220 000000
ffff8e2303c4c540 3456668998 S Ii:2:008:1 -115:1 8 <
ffff8e2303c4c540 3456676970 C Ii:2:008:1 0:1 7 = 02000130 000000
ffff8e2303c4c540 3456676996 S Ii:2:008:1 -115:1 8 <
ffff8e2303c4c540 3456684970 C Ii:2:008:1 0:1 7 = 02000240 000000
ffff8e2303c4c540 3456684996 S Ii:2:008:1 -115:1 8 <
ffff8e2303c4c540 3456692973 C Ii:2:008:1 0:1 7 = 02000350 000000
ffff8e2303c4c540 3456693000 S Ii:2:008:1 -115:1 8 <
ffff8e2303c4c540 3456700965 C Ii:2:008:1 0:1 7 = 02000140 000000
ffff8e2303c4c540 3456700990 S Ii:2:008:1 -115:1 8 <
ffff8e2303c4c540 3456708940 C Ii:2:008:1 0:1 7 = 02000230 000000
ffff8e2303c4c540 3456708970 S Ii:2:008:1 -115:1 8 <
ffff8e2303c4c540 3456716964 C Ii:2:008:1 0:1 7 = 02000130 000000
ffff8e2303c4c540 3456716991 S Ii:2:008:1 -115:1 8 <
ffff8e2303c4c540 3456724973 C Ii:2:008:1 0:1 7 = 02000230 000000
ffff8e2303c4c540 3456724999 S Ii:2:008:1 -115:1 8 <
ffff8e2303c4c540 3456732963 C Ii:2:008:1 0:1 7 = 02000230 000000
ffff8e2303c4c540 3456732990 S Ii:2:008:1 -115:1 8 <
ffff8e2303c4c540 3456740941 C Ii:2:008:1 0:1 7 = 02000130 000000
ffff8e2303c4c540 3456740975 S Ii:2:008:1 -115:1 8 <
ffff8e2303c4c540 3456748974 C Ii:2:008:1 0:1 7 = 02000240 000000
ffff8e2303c4c540 3456749000 S Ii:2:008:1 -115:1 8 <
ffff8e2303c4c540 3456756971 C Ii:2:008:1 0:1 7 = 02000130 000000
ffff8e2303c4c540 3456756997 S Ii:2:008:1 -115:1 8 <
ffff8e2303c4c540 3456764974 C Ii:2:008:1 0:1 7 = 02000150 000000
ffff8e2303c4c540 3456765000 S Ii:2:008:1 -115:1 8 <
ffff8e2303c4c540 3456772977 C Ii:2:008:1 0:1 7 = 02000230 000000
ffff8e2303c4c540 3456773003 S Ii:2:008:1 -115:1 8 <
ffff8e2303c4c540 3456780963 C Ii:2:008:1 0:1 7 = 02000030 000000
ffff8e2303c4c540 3456780989 S Ii:2:008:1 -115:1 8 <
ffff8e2303c4c540 3456788964 C Ii:2:008:1 0:1 7 = 02000130 000000
ffff8e2303c4c540 3456788989 S Ii:2:008:1 -115:1 8 <
ffff8e2303c4c540 3456796970 C Ii:2:008:1 0:1 7 = 02000010 000000
ffff8e2303c4c540 3456796996 S Ii:2:008:1 -115:1 8 <
ffff8e2303c4c540 3456804971 C Ii:2:008:1 0:1 7 = 02000010 000000
ffff8e2303c4c540 3456804996 S Ii:2:008:1 -115:1 8 <
ffff8e2303c4c540 3457052976 C Ii:2:008:1 0:1 7 = 02000030 000000
ffff8e2303c4c540 3457053001 S Ii:2:008:1 -115:1 8 <
ffff8e2303c4c540 3457060964 C Ii:2:008:1 0:1 7 = 02000270 000000
ffff8e2303c4c540 3457060993 S Ii:2:008:1 -115:1 8 <
ffff8e2303c4c540 3457068964 C Ii:2:008:1 0:1 7 = 020003c0 000000
ffff8e2303c4c540 3457068993 S Ii:2:008:1 -115:1 8 <
ffff8e2303c4c540 3457076973 C Ii:2:008:1 0:1 7 = 020003e0 000000
ffff8e2303c4c540 3457076999 S Ii:2:008:1 -115:1 8 <
ffff8e2303c4c540 3457084965 C Ii:2:008:1 0:1 7 = 020003d0 000000
ffff8e2303c4c540 3457084991 S Ii:2:008:1 -115:1 8 <
ffff8e2303c4c540 3457092973 C Ii:2:008:1 0:1 7 = 020001a0 000000
ffff8e2303c4c540 3457092999 S Ii:2:008:1 -115:1 8 <
ffff8e2303c4c540 3457100965 C Ii:2:008:1 0:1 7 = 020002b0 000000
ffff8e2303c4c540 3457100993 S Ii:2:008:1 -115:1 8 <
ffff8e2303c4c540 3457108949 C Ii:2:008:1 0:1 7 = 020001a0 000000
ffff8e2303c4c540 3457108967 S Ii:2:008:1 -115:1 8 <
ffff8e2303c4c540 3457116972 C Ii:2:008:1 0:1 7 = 020002c0 000000
ffff8e2303c4c540 3457116989 S Ii:2:008:1 -115:1 8 <
ffff8e2303c4c540 3457124954 C Ii:2:008:1 0:1 7 = 020002c0 000000
ffff8e2303c4c540 3457124976 S Ii:2:008:1 -115:1 8 <
ffff8e2303c4c540 3457132971 C Ii:2:008:1 0:1 7 = 020003b0 000000
ffff8e2303c4c540 3457132988 S Ii:2:008:1 -115:1 8 <
ffff8e2303c4c540 3457140972 C Ii:2:008:1 0:1 7 = 020002b0 000000
ffff8e2303c4c540 3457140990 S Ii:2:008:1 -115:1 8 <
ffff8e2303c4c540 3457148965 C Ii:2:008:1 0:1 7 = 020003a0 000000
ffff8e2303c4c540 3457148981 S Ii:2:008:1 -115:1 8 <
ffff8e2303c4c540 3457156939 C Ii:2:008:1 0:1 7 = 02000280 000000
ffff8e2303c4c540 3457156962 S Ii:2:008:1 -115:1 8 <
ffff8e2303c4c540 3457164972 C Ii:2:008:1 0:1 7 = 02000070 000000
ffff8e2303c4c540 3457164989 S Ii:2:008:1 -115:1 8 <
ffff8e2303c4c540 3457172965 C Ii:2:008:1 0:1 7 = 02000170 000000
ffff8e2303c4c540 3457172981 S Ii:2:008:1 -115:1 8 <
ffff8e2303c4c540 3457180965 C Ii:2:008:1 0:1 7 = 02000150 000000
ffff8e2303c4c540 3457180982 S Ii:2:008:1 -115:1 8 <
ffff8e2303c4c540 3457188944 C Ii:2:008:1 0:1 7 = 02000170 000000
ffff8e2303c4c540 3457188960 S Ii:2:008:1 -115:1 8 <
ffff8e2303c4c540 3457196972 C Ii:2:008:1 0:1 7 = 02000250 000000
ffff8e2303c4c540 3457196988 S Ii:2:008:1 -115:1 8 <
ffff8e2303c4c540 3457204974 C Ii:2:008:1 0:1 7 = 02000370 000000
ffff8e2303c4c540 3457204992 S Ii:2:008:1 -115:1 8 <
ffff8e2303c4c540 3457212965 C Ii:2:008:1 0:1 7 = 020003a0 000000
ffff8e2303c4c540 3457212982 S Ii:2:008:1 -115:1 8 <
ffff8e2303c4c540 3457220942 C Ii:2:008:1 0:1 7 = 020003a0 000000
ffff8e2303c4c540 3457220958 S Ii:2:008:1 -115:1 8 <
ffff8e2303c4c540 3457228972 C Ii:2:008:1 0:1 7 = 020004b0 000000
ffff8e2303c4c540 3457228990 S Ii:2:008:1 -115:1 8 <
ffff8e2303c4c540 3457236965 C Ii:2:008:1 0:1 7 = 020004a0 000000
ffff8e2303c4c540 3457236982 S Ii:2:008:1 -115:1 8 <
ffff8e2303c4c540 3457244939 C Ii:2:008:1 0:1 7 = 02000480 000000
ffff8e2303c4c540 3457244956 S Ii:2:008:1 -115:1 8 <
ffff8e2303c4c540 3457252968 C Ii:2:008:1 0:1 7 = 02000370 000000
ffff8e2303c4c540 3457252984 S Ii:2:008:1 -115:1 8 <
ffff8e2303c4c540 3457260969 C Ii:2:008:1 0:1 7 = 02000350 000000
ffff8e2303c4c540 3457260997 S Ii:2:008:1 -115:1 8 <
ffff8e2303c4c540 3457268979 C Ii:2:008:1 0:1 7 = 02000140 000000
ffff8e2303c4c540 3457268997 S Ii:2:008:1 -115:1 8 <
ffff8e2303c4c540 3457276967 C Ii:2:008:1 0:1 7 = 02000020 000000
ffff8e2303c4c540 3457276983 S Ii:2:008:1 -115:1 8 <
ffff8e2303c4c540 3457284983 C Ii:2:008:1 0:1 7 = 02000110 000000
ffff8e2303c4c540 3457284999 S Ii:2:008:1 -115:1 8 <
ffff8e2303c4c540 3457292978 C Ii:2:008:1 0:1 7 = 02000010 000000
ffff8e2303c4c540 3457292993 S Ii:2:008:1 -115:1 8 <
ffff8e2303c4c540 3457300979 C Ii:2:008:1 0:1 7 = 02000010 000000
ffff8e2303c4c540 3457300995 S Ii:2:008:1 -115:1 8 <
ffff8e2303c4c540 3457580977 C Ii:2:008:1 0:1 7 = 02000110 000000
ffff8e2303c4c540 3457580993 S Ii:2:008:1 -115:1 8 <
ffff8e2303c4c540 3457588966 C Ii:2:008:1 0:1 7 = 02000100 000000
ffff8e2303c4c540 3457588982 S Ii:2:008:1 -115:1 8 <
ffff8e2303c4c540 3457596977 C Ii:2:008:1 0:1 7 = 02000110 000000
ffff8e2303c4c540 3457596993 S Ii:2:008:1 -115:1 8 <
ffff8e2303c4c540 3457604974 C Ii:2:008:1 0:1 7 = 02000320 000000
ffff8e2303c4c540 3457604996 S Ii:2:008:1 -115:1 8 <
ffff8e2303c4c540 3457612968 C Ii:2:008:1 0:1 7 = 02000400 000000
ffff8e2303c4c540 3457612984 S Ii:2:008:1 -115:1 8 <
ffff8e2303c4c540 3457620967 C Ii:2:008:1 0:1 7 = 02000720 000000
ffff8e2303c4c540 3457620984 S Ii:2:008:1 -115:1 8 <
ffff8e2303c4c540 3457628975 C Ii:2:008:1 0:1 7 = 02000a10 000000
ffff8e2303c4c540 3457628992 S Ii:2:008:1 -115:1 8 <
ffff8e2303c4c540 3457636942 C Ii:2:008:1 0:1 7 = 02000c10 000000
ffff8e2303c4c540 3457636958 S Ii:2:008:1 -115:1 8 <
ffff8e2303c4c540 3457644966 C Ii:2:008:1 0:1 7 = 02000ef0 ff0000
ffff8e2303c4c540 3457644983 S Ii:2:008:1 -115:1 8 <
ffff8e2303c4c540 3457652975 C Ii:2:008:1 0:1 7 = 02000dd0 ff0000
ffff8e2303c4c540 3457652991 S Ii:2:008:1 -115:1 8 <
ffff8e2303c4c540 3457660967 C Ii:2:008:1 0:1 7 = 02000cb0 ff0000
ffff8e2303c4c540 3457660983 S Ii:2:008:1 -115:1 8 <
ffff8e2303c4c540 3457668942 C Ii:2:008:1 0:1 7 = 020009b0 ff0000
ffff8e2303c4c540 3457668958 S Ii:2:008:1 -115:1 8 <
ffff8e2303c4c540 3457676988 C Ii:2:008:1 0:1 7 = 020006c0 ff0000
ffff8e2303c4c540 3457677003 S Ii:2:008:1 -115:1 8 <
ffff8e2303c4c540 3457684976 C Ii:2:008:1 0:1 7 = 020003e0 ff0000
ffff8e2303c4c540 3457684992 S Ii:2:008:1 -115:1 8 <
ffff8e2303c4c540 3457708977 C Ii:2:008:1 0:1 7 = 020000f0 ff0000
ffff8e2303c4c540 3457708994 S Ii:2:008:1 -115:1 8 <
ffff8e2303c4c540 3457716969 C Ii:2:008:1 0:1 7 = 020000d0 ff0000
ffff8e2303c4c540 3457716985 S Ii:2:008:1 -115:1 8 <
ffff8e2303c4c540 3457724980 C Ii:2:008:1 0:1 7 = 0200ffcf ff0000
ffff8e2303c4c540 3457724997 S Ii:2:008:1 -115:1 8 <
ffff8e2303c4c540 3457732982 C Ii:2:008:1 0:1 7 = 0200fe8f ff0000
ffff8e2303c4c540 3457732999 S Ii:2:008:1 -115:1 8 <
ffff8e2303c4c540 3457740983 C Ii:2:008:1 0:1 7 = 0200ff9f ff0000
ffff8e2303c4c540 3457740999 S Ii:2:008:1 -115:1 8 <
ffff8e2303c4c540 3457747968 C Ii:2:008:1 0:1 7 = 0200fd8f ff0000
ffff8e2303c4c540 3457747984 S Ii:2:008:1 -115:1 8 <
ffff8e2303c4c540 3457755976 C Ii:2:008:1 0:1 7 = 0200ff7f ff0000
ffff8e2303c4c540 3457755994 S Ii:2:008:1 -115:1 8 <
ffff8e2303c4c540 3457763973 C Ii:2:008:1 0:1 7 = 0200fc6f ff0000
ffff8e2303c4c540 3457763990 S Ii:2:008:1 -115:1 8 <
ffff8e2303c4c540 3457771967 C Ii:2:008:1 0:1 7 = 0200fb5f ff0000
ffff8e2303c4c540 3457771984 S Ii:2:008:1 -115:1 8 <
ffff8e2303c4c540 3457779967 C Ii:2:008:1 0:1 7 = 0200fb5f ff0000
ffff8e2303c4c540 3457779985 S Ii:2:008:1 -115:1 8 <
ffff8e2303c4c540 3457787977 C Ii:2:008:1 0:1 7 = 0200fa7f ff0000
ffff8e2303c4c540 3457787994 S Ii:2:008:1 -115:1 8 <
ffff8e2303c4c540 3457795974 C Ii:2:008:1 0:1 7 = 0200fa9f ff0000
ffff8e2303c4c540 3457795991 S Ii:2:008:1 -115:1 8 <
ffff8e2303c4c540 3457803969 C Ii:2:008:1 0:1 7 = 0200f88f ff0000
ffff8e2303c4c540 3457803986 S Ii:2:008:1 -115:1 8 <
ffff8e2303c4c540 3457811967 C Ii:2:008:1 0:1 7 = 0200f78f ff0000
ffff8e2303c4c540 3457811984 S Ii:2:008:1 -115:1 8 <
ffff8e2303c4c540 3457819979 C Ii:2:008:1 0:1 7 = 0200f64f ff0000
ffff8e2303c4c540 3457819996 S Ii:2:008:1 -115:1 8 <
ffff8e2303c4c540 3457827976 C Ii:2:008:1 0:1 7 = 0200f74f ff0000
ffff8e2303c4c540 3457827992 S Ii:2:008:1 -115:1 8 <
ffff8e2303c4c540 3457835967 C Ii:2:008:1 0:1 7 = 0200f73f ff0000
ffff8e2303c4c540 3457835984 S Ii:2:008:1 -115:1 8 <
ffff8e2303c4c540 3457843976 C Ii:2:008:1 0:1 7 = 0200f62f ff0000
ffff8e2303c4c540 3457843993 S Ii:2:008:1 -115:1 8 <
ffff8e2303c4c540 3457851974 C Ii:2:008:1 0:1 7 = 0200f64f ff0000
ffff8e2303c4c540 3457851990 S Ii:2:008:1 -115:1 8 <
ffff8e2303c4c540 3457859969 C Ii:2:008:1 0:1 7 = 0200f74f ff0000
ffff8e2303c4c540 3457859986 S Ii:2:008:1 -115:1 8 <
ffff8e2303c4c540 3457867968 C Ii:2:008:1 0:1 7 = 0200f94f ff0000
ffff8e2303c4c540 3457867984 S Ii:2:008:1 -115:1 8 <
ffff8e2303c4c540 3457875971 C Ii:2:008:1 0:1 7 = 0200fb8f ff0000
ffff8e2303c4c540 3457875987 S Ii:2:008:1 -115:1 8 <
ffff8e2303c4c540 3457883967 C Ii:2:008:1 0:1 7 = 0200feaf ff0000
ffff8e2303c4c540 3457883984 S Ii:2:008:1 -115:1 8 <
ffff8e2303c4c540 3457891977 C Ii:2:008:1 0:1 7 = 0200fedf ff0000
ffff8e2303c4c540 3457891993 S Ii:2:008:1 -115:1 8 <
ffff8e2303c4c540 3457899978 C Ii:2:008:1 0:1 7 = 020000f0 ff0000
ffff8e2303c4c540 3457899994 S Ii:2:008:1 -115:1 8 <
ffff8e2303c4c540 3457907977 C Ii:2:008:1 0:1 7 = 0200ff0f 000000
ffff8e2303c4c540 3457907993 S Ii:2:008:1 -115:1 8 <
ffff8e2303c4c540 3457915967 C Ii:2:008:1 0:1 7 = 0200ffff ff0000
ffff8e2303c4c540 3457915985 S Ii:2:008:1 -115:1 8 <
ffff8e2302151980 3458122079 S Bo:2:002:2 -115 31 = 55534243 03200000 00000000 00000600 00000000 00000000 00000000 000000
ffff8e2302151980 3458122136 C Bo:2:002:2 0 31 >
ffff8e2302151980 3458122147 S Bi:2:002:1 -115 13 <
ffff8e2302151980 3458122175 C Bi:2:002:1 0 13 = 55534253 03200000 00000000 00
ffff8e2302151980 3460170172 S Bo:2:002:2 -115 31 = 55534243 04200000 00000000 00000600 00000000 00000000 00000000 000000
ffff8e2302151980 3460170232 C Bo:2:002:2 0 31 >
ffff8e2302151980 3460170244 S Bi:2:002:1 -115 13 <
ffff8e2302151980 3460170270 C Bi:2:002:1 0 13 = 55534253 04200000 00000000 00
ffff8e2302151980 3462218136 S Bo:2:002:2 -115 31 = 55534243 05200000 00000000 00000600 00000000 00000000 00000000 000000
ffff8e2302151980 3462218198 C Bo:2:002:2 0 31 >
ffff8e2302151980 3462218210 S Bi:2:002:1 -115 13 <
ffff8e2302151980 3462218235 C Bi:2:002:1 0 13 = 55534253 05200000 00000000 00
ffff8e2303c4c540 3463546000 C Ii:2:008:1 0:1 7 = 0200ff0f 000000
ffff8e2303c4c540 3463546023 S Ii:2:008:1 -115:1 8 <
ffff8e2303c4c540 3463561994 C Ii:2:008:1 0:1 7 = 0200feff ff0000
ffff8e2303c4c540 3463562016 S Ii:2:008:1 -115:1 8 <
ffff8e2303c4c540 3463569967 C Ii:2:008:1 0:1 7 = 0200ffff ff0000
ffff8e2303c4c540 3463569983 S Ii:2:008:1 -115:1 8 <
ffff8e2303c4c540 3463577996 C Ii:2:008:1 0:1 7 = 0200ff0f 000000
ffff8e2303c4c540 3463578013 S Ii:2:008:1 -115:1 8 <
ffff8e2303c4c540 3463585995 C Ii:2:008:1 0:1 7 = 0200ffff ff0000
ffff8e2303c4c540 3463586013 S Ii:2:008:1 -115:1 8 <
ffff8e2303c4c540 3463601962 C Ii:2:008:1 0:1 7 = 0200fe1f 000000
ffff8e2303c4c540 3463601980 S Ii:2:008:1 -115:1 8 <
ffff8e2303c4c540 3463609995 C Ii:2:008:1 0:1 7 = 0200fe0f 000000
ffff8e2303c4c540 3463610012 S Ii:2:008:1 -115:1 8 <
ffff8e2303c4c540 3463617997 C Ii:2:008:1 0:1 7 = 0200fd3f 000000
ffff8e2303c4c540 3463618014 S Ii:2:008:1 -115:1 8 <
ffff8e2303c4c540 3463625996 C Ii:2:008:1 0:1 7 = 0200fd2f 000000
ffff8e2303c4c540 3463626016 S Ii:2:008:1 -115:1 8 <
ffff8e2303c4c540 3463633961 C Ii:2:008:1 0:1 7 = 0200fe3f 000000
ffff8e2303c4c540 3463633978 S Ii:2:008:1 -115:1 8 <
ffff8e2303c4c540 3463641998 C Ii:2:008:1 0:1 7 = 0200ff3f 000000
ffff8e2303c4c540 3463642016 S Ii:2:008:1 -115:1 8 <
ffff8e2303c4c540 3463649997 C Ii:2:008:1 0:1 7 = 0200fd1f 000000
ffff8e2303c4c540 3463650014 S Ii:2:008:1 -115:1 8 <
ffff8e2303c4c540 3463657989 C Ii:2:008:1 0:1 7 = 0200fe2f 000000
ffff8e2303c4c540 3463658006 S Ii:2:008:1 -115:1 8 <
ffff8e2303c4c540 3463665988 C Ii:2:008:1 0:1 7 = 0200ff0f 000000
ffff8e2303c4c540 3463666005 S Ii:2:008:1 -115:1 8 <
ffff8e2303c4c540 3463673996 C Ii:2:008:1 0:1 7 = 0200fe0f 000000
ffff8e2303c4c540 3463674012 S Ii:2:008:1 -115:1 8 <
ffff8e2303c4c540 3463713995 C Ii:2:008:1 0:1 7 = 0200ff0f 000000
ffff8e2303c4c540 3463714011 S Ii:2:008:1 -115:1 8 <
ffff8e2303c4c540 3463730000 C Ii:2:008:1 0:1 7 = 0200ff0f 000000
ffff8e2303c4c540 3463730017 S Ii:2:008:1 -115:1 8 <
ffff8e2303c4c540 3463737962 C Ii:2:008:1 0:1 7 = 0200ff0f 000000
ffff8e2303c4c540 3463737979 S Ii:2:008:1 -115:1 8 <
ffff8e2303c4c540 3463817997 C Ii:2:008:1 0:1 7 = 0200ff0f 000000
ffff8e2303c4c540 3463818014 S Ii:2:008:1 -115:1 8 <
ffff8e2303c4c540 3463825989 C Ii:2:008:1 0:1 7 = 0200fdef ff0000
ffff8e2303c4c540 3463826006 S Ii:2:008:1 -115:1 8 <
ffff8e2303c4c540 3463834001 C Ii:2:008:1 0:1 7 = 0200faef ff0000
ffff8e2303c4c540 3463834019 S Ii:2:008:1 -115:1 8 <
ffff8e2303c4c540 3463841962 C Ii:2:008:1 0:1 7 = 0200fadf ff0000
ffff8e2303c4c540 3463841980 S Ii:2:008:1 -115:1 8 <
ffff8e2303c4c540 3463849991 C Ii:2:008:1 0:1 7 = 0200f7cf ff0000
ffff8e2303c4c540 3463850007 S Ii:2:008:1 -115:1 8 <
ffff8e2303c4c540 3463857995 C Ii:2:008:1 0:1 7 = 0200f8af ff0000
ffff8e2303c4c540 3463858013 S Ii:2:008:1 -115:1 8 <
ffff8e2303c4c540 3463866002 C Ii:2:008:1 0:1 7 = 0200f69f ff0000
ffff8e2303c4c540 3463866018 S Ii:2:008:1 -115:1 8 <
ffff8e2303c4c540 3463873962 C Ii:2:008:1 0:1 7 = 0200f78f ff0000
ffff8e2303c4c540 3463873981 S Ii:2:008:1 -115:1 8 <
ffff8e2303c4c540 3463881991 C Ii:2:008:1 0:1 7 = 0200f78f ff0000
ffff8e2303c4c540 3463882007 S Ii:2:008:1 -115:1 8 <
ffff8e2303c4c540 3463889996 C Ii:2:008:1 0:1 7 = 0200f9af ff0000
ffff8e2303c4c540 3463890012 S Ii:2:008:1 -115:1 8 <
ffff8e2303c4c540 3463897989 C Ii:2:008:1 0:1 7 = 0200fbcf ff0000
ffff8e2303c4c540 3463898006 S Ii:2:008:1 -115:1 8 <
ffff8e2303c4c540 3463905990 C Ii:2:008:1 0:1 7 = 0200fcdf ff0000
ffff8e2303c4c540 3463906006 S Ii:2:008:1 -115:1 8 <
ffff8e2303c4c540 3463913996 C Ii:2:008:1 0:1 7 = 0200fedf ff0000
ffff8e2303c4c540 3463914013 S Ii:2:008:1 -115:1 8 <
ffff8e2303c4c540 3463921963 C Ii:2:008:1 0:1 7 = 0200feff ff0000
ffff8e2303c4c540 3463921982 S Ii:2:008:1 -115:1 8 <
ffff8e2303c4c540 3463937992 C Ii:2:008:1 0:1 7 = 0200ff0f 000000
ffff8e2303c4c540 3463938008 S Ii:2:008:1 -115:1 8 <
ffff8e2303c4c540 3463945963 C Ii:2:008:1 0:1 7 = 0200ff1f 000000
ffff8e2303c4c540 3463945981 S Ii:2:008:1 -115:1 8 <
ffff8e2303c4c540 3463953962 C Ii:2:008:1 0:1 7 = 0200fe1f 000000
ffff8e2303c4c540 3463953979 S Ii:2:008:1 -115:1 8 <
ffff8e2303c4c540 3463961999 C Ii:2:008:1 0:1 7 = 0200fd2f 000000
ffff8e2303c4c540 3463962016 S Ii:2:008:1 -115:1 8 <
ffff8e2303c4c540 3463970005 C Ii:2:008:1 0:1 7 = 0200fc3f 000000
ffff8e2303c4c540 3463970023 S Ii:2:008:1 -115:1 8 <
ffff8e2303c4c540 3463977990 C Ii:2:008:1 0:1 7 = 0200fc4f 000000
ffff8e2303c4c540 3463978017 S Ii:2:008:1 -115:1 8 <
ffff8e2303c4c540 3463985990 C Ii:2:008:1 0:1 7 = 0200fc5f 000000
ffff8e2303c4c540 3463986017 S Ii:2:008:1 -115:1 8 <
ffff8e2303c4c540 3463993989 C Ii:2:008:1 0:1 7 = 0200fd4f 000000
ffff8e2303c4c540 3463994016 S Ii:2:008:1 -115:1 8 <
ffff8e2303c4c540 3464001990 C Ii:2:008:1 0:1 7 = 0200fd4f 000000
ffff8e2303c4c540 3464002017 S Ii:2:008:1 -115:1 8 <
ffff8e2303c4c540 3464009990 C Ii:2:008:1 0:1 7 = 0200ff2f 000000
ffff8e2303c4c540 3464010017 S Ii:2:008:1 -115:1 8 <
ffff8e2303c4c540 3464017996 C Ii:2:008:1 0:1 7 = 0200ff1f 000000
ffff8e2303c4c540 3464018023 S Ii:2:008:1 -115:1 8 <
ffff8e2302151980 3464266159 S Bo:2:002:2 -115 31 = 55534243 06200000 00000000 00000600 00000000 00000000 00000000 000000
ffff8e2302151980 3464266204 C Bo:2:002:2 0 31 >
ffff8e2302151980 3464266215 S Bi:2:002:1 -115 13 <
ffff8e2302151980 3464266243 C Bi:2:002:1 0 13 = 55534253 06200000 00000000 00
ffff8e2303c4c540 3464369999 C Ii:2:008:1 0:1 7 = 02000020 000000
ffff8e2303c4c540 3464370026 S Ii:2:008:1 -115:1 8 <
ffff8e2303c4c540 3464377996 C Ii:2:008:1 0:1 7 = 02000020 000000
ffff8e2303c4c540 3464378026 S Ii:2:008:1 -115:1 8 <
ffff8e2303c4c540 3464385997 C Ii:2:008:1 0:1 7 = 02000030 000000
ffff8e2303c4c540 3464386023 S Ii:2:008:1 -115:1 8 <
ffff8e2303c4c540 3464393990 C Ii:2:008:1 0:1 7 = 02000140 000000
ffff8e2303c4c540 3464394017 S Ii:2:008:1 -115:1 8 <
ffff8e2303c4c540 3464402005 C Ii:2:008:1 0:1 7 = 02000220 000000
ffff8e2303c4c540 3464402030 S Ii:2:008:1 -115:1 8 <
ffff8e2303c4c540 3464409966 C Ii:2:008:1 0:1 7 = 02000210 000000
ffff8e2303c4c540 3464409998 S Ii:2:008:1 -115:1 8 <
ffff8e2303c4c540 3464417992 C Ii:2:008:1 0:1 7 = 02000310 000000
ffff8e2303c4c540 3464418018 S Ii:2:008:1 -115:1 8 <
ffff8e2303c4c540 3464425990 C Ii:2:008:1 0:1 7 = 02000100 000000
ffff8e2303c4c540 3464426016 S Ii:2:008:1 -115:1 8 <
ffff8e2303c4c540 3464433999 C Ii:2:008:1 0:1 7 = 02000210 000000
ffff8e2303c4c540 3464434025 S Ii:2:008:1 -115:1 8 <
ffff8e2303c4c540 3464441998 C Ii:2:008:1 0:1 7 = 02000220 000000
ffff8e2303c4c540 3464442025 S Ii:2:008:1 -115:1 8 <
ffff8e2303c4c540 3464450000 C Ii:2:008:1 0:1 7 = 02000330 000000
ffff8e2303c4c540 3464450026 S Ii:2:008:1 -115:1 8 <
ffff8e2303c4c540 3464457991 C Ii:2:008:1 0:1 7 = 02000330 000000
ffff8e2303c4c540 3464458018 S Ii:2:008:1 -115:1 8 <
ffff8e2303c4c540 3464465990 C Ii:2:008:1 0:1 7 = 02000120 000000
ffff8e2303c4c540 3464466017 S Ii:2:008:1 -115:1 8 <
ffff8e2303c4c540 3464474000 C Ii:2:008:1 0:1 7 = 02000110 000000
ffff8e2303c4c540 3464474026 S Ii:2:008:1 -115:1 8 <
ffff8e2303c4c540 3464489966 C Ii:2:008:1 0:1 7 = 020001f0 ff0000
ffff8e2303c4c540 3464489990 S Ii:2:008:1 -115:1 8 <
ffff8e2303c4c540 3464497998 C Ii:2:008:1 0:1 7 = 020001f0 ff0000
ffff8e2303c4c540 3464498024 S Ii:2:008:1 -115:1 8 <
ffff8e2303c4c540 3464514003 C Ii:2:008:1 0:1 7 = 020001e0 ff0000
ffff8e2303c4c540 3464514029 S Ii:2:008:1 -115:1 8 <
ffff8e2303c4c540 3464522000 C Ii:2:008:1 0:1 7 = 0200ffff ff0000
ffff8e2303c4c540 3464522036 S Ii:2:008:1 -115:1 8 <
ffff8e2303c4c540 3464529991 C Ii:2:008:1 0:1 7 = 0200ffdf ff0000
ffff8e2303c4c540 3464530017 S Ii:2:008:1 -115:1 8 <
ffff8e2303c4c540 3464538006 C Ii:2:008:1 0:1 7 = 0200fcdf ff0000
ffff8e2303c4c540 3464538035 S Ii:2:008:1 -115:1 8 <
ffff8e2303c4c540 3464545991 C Ii:2:008:1 0:1 7 = 0200fcdf ff0000
ffff8e2303c4c540 3464546018 S Ii:2:008:1 -115:1 8 <
ffff8e2303c4c540 3464554005 C Ii:2:008:1 0:1 7 = 0200fdbf ff0000
ffff8e2303c4c540 3464554031 S Ii:2:008:1 -115:1 8 <
ffff8e2303c4c540 3464561995 C Ii:2:008:1 0:1 7 = 0200fdcf ff0000
ffff8e2303c4c540 3464562022 S Ii:2:008:1 -115:1 8 <
ffff8e2303c4c540 3464570002 C Ii:2:008:1 0:1 7 = 0200fdaf ff0000
ffff8e2303c4c540 3464570028 S Ii:2:008:1 -115:1 8 <
ffff8e2303c4c540 3464577992 C Ii:2:008:1 0:1 7 = 0200fcbf ff0000
ffff8e2303c4c540 3464578019 S Ii:2:008:1 -115:1 8 <
ffff8e2303c4c540 3464586003 C Ii:2:008:1 0:1 7 = 0200fcdf ff0000
ffff8e2303c4c540 3464586038 S Ii:2:008:1 -115:1 8 <
ffff8e2303c4c540 3464593992 C Ii:2:008:1 0:1 7 = 0200fcdf ff0000
ffff8e2303c4c540 3464594019 S Ii:2:008:1 -115:1 8 <
ffff8e2303c4c540 3464601992 C Ii:2:008:1 0:1 7 = 0200fdff ff0000
ffff8e2303c4c540 3464602025 S Ii:2:008:1 -115:1 8 <
ffff8e2303c4c540 3464609998 C Ii:2:008:1 0:1 7 = 0200ff0f 000000
ffff8e2303c4c540 3464610024 S Ii:2:008:1 -115:1 8 <
ffff8e2303c4c540 3464617993 C Ii:2:008:1 0:1 7 = 0200ffff ff0000
ffff8e2303c4c540 3464618020 S Ii:2:008:1 -115:1 8 <
ffff8e2303c4c540 3464776999 C Ii:2:008:1 0:1 7 = 02000110 000000
ffff8e2303c4c540 3464777025 S Ii:2:008:1 -115:1 8 <
ffff8e2303c4c540 3464784993 C Ii:2:008:1 0:1 7 = 02000110 000000
ffff8e2303c4c540 3464785019 S Ii:2:008:1 -115:1 8 <
ffff8e2303c4c540 3464793004 C Ii:2:008:1 0:1 7 = 02000220 000000
ffff8e2303c4c540 3464793030 S Ii:2:008:1 -115:1 8 <
ffff8e2303c4c540 3464800993 C Ii:2:008:1 0:1 7 = 02000110 000000
ffff8e2303c4c540 3464801019 S Ii:2:008:1 -115:1 8 <
ffff8e2303c4c540 3464809000 C Ii:2:008:1 0:1 7 = 02000220 000000
ffff8e2303c4c540 3464809026 S Ii:2:008:1 -115:1 8 <
ffff8e2303c4c540 3464817009 C Ii:2:008:1 0:1 7 = 02000120 000000
ffff8e2303c4c540 3464817036 S Ii:2:008:1 -115:1 8 <
ffff8e2303c4c540 3464825003 C Ii:2:008:1 0:1 7 = 02000010 000000
ffff8e2303c4c540 3464825028 S Ii:2:008:1 -115:1 8 <
ffff8e2303c4c540 3464833000 C Ii:2:008:1 0:1 7 = 02000120 000000
ffff8e2303c4c540 3464833026 S Ii:2:008:1 -115:1 8 <
ffff8e2303c4c540 3464864999 C Ii:2:008:1 0:1 7 = 02000110 000000
ffff8e2303c4c540 3464865025 S Ii:2:008:1 -115:1 8 <
ffff8e2303c4c540 3464872992 C Ii:2:008:1 0:1 7 = 02000100 000000
ffff8e2303c4c540 3464873018 S Ii:2:008:1 -115:1 8 <
ffff8e2303c4c540 3464881003 C Ii:2:008:1 0:1 7 = 02000210 000000
ffff8e2303c4c540 3464881030 S Ii:2:008:1 -115:1 8 <
ffff8e2303c4c540 3464889002 C Ii:2:008:1 0:1 7 = 02000320 000000
ffff8e2303c4c540 3464889028 S Ii:2:008:1 -115:1 8 <
ffff8e2303c4c540 3464896993 C Ii:2:008:1 0:1 7 = 02000200 000000
ffff8e2303c4c540 3464897019 S Ii:2:008:1 -115:1 8 <
ffff8e2303c4c540 3464904999 C Ii:2:008:1 0:1 7 = 02000320 000000
ffff8e2303c4c540 3464905025 S Ii:2:008:1 -115:1 8 <
ffff8e2303c4c540 3464913003 C Ii:2:008:1 0:1 7 = 02000310 000000
ffff8e2303c4c540 3464913029 S Ii:2:008:1 -115:1 8 <
ffff8e2303c4c540 3464921002 C Ii:2:008:1 0:1 7 = 02000210 000000
ffff8e2303c4c540 3464921028 S Ii:2:008:1 -115:1 8 <
ffff8e2303c4c540 3464928993 C Ii:2:008:1 0:1 7 = 02000420 000000
ffff8e2303c4c540 3464929021 S Ii:2:008:1 -115:1 8 <
ffff8e2303c4c540 3464937002 C Ii:2:008:1 0:1 7 = 02000310 000000
ffff8e2303c4c540 3464937028 S Ii:2:008:1 -115:1 8 <
ffff8e2303c4c540 3464944994 C Ii:2:008:1 0:1 7 = 02000420 000000
ffff8e2303c4c540 3464945020 S Ii:2:008:1 -115:1 8 <
ffff8e2303c4c540 3464953002 C Ii:2:008:1 0:1 7 = 02000530 000000
ffff8e2303c4c540 3464953029 S Ii:2:008:1 -115:1 8 <
ffff8e2303c4c540 3464960994 C Ii:2:008:1 0:1 7 = 02000530 000000
ffff8e2303c4c540 3464961020 S Ii:2:008:1 -115:1 8 <
ffff8e2303c4c540 3464968993 C Ii:2:008:1 0:1 7 = 02000630 000000
ffff8e2303c4c540 3464969019 S Ii:2:008:1 -115:1 8 <
ffff8e2303c4c540 3464977003 C Ii:2:008:1 0:1 7 = 02000630 000000
ffff8e2303c4c540 3464977030 S Ii:2:008:1 -115:1 8 <
ffff8e2303c4c540 3464985003 C Ii:2:008:1 0:1 7 = 02000630 000000
ffff8e2303c4c540 3464985029 S Ii:2:008:1 -115:1 8 <
ffff8e2303c4c540 3464993003 C Ii:2:008:1 0:1 7 = 02000630 000000
ffff8e2303c4c540 3464993030 S Ii:2:008:1 -115:1 8 <
ffff8e2303c4c540 3465001002 C Ii:2:008:1 0:1 7 = 02000620 000000
ffff8e2303c4c540 3465001028 S Ii:2:008:1 -115:1 8 <
ffff8e2303c4c540 3465009000 C Ii:2:008:1 0:1 7 = 02000610 000000
ffff8e2303c4c540 3465009026 S Ii:2:008:1 -115:1 8 <
ffff8e2303c4c540 3465017000 C Ii:2:008:1 0:1 7 = 02000530 000000
ffff8e2303c4c540 3465017027 S Ii:2:008:1 -115:1 8 <
ffff8e2303c4c540 3465025011 C Ii:2:008:1 0:1 7 = 02000530 000000
ffff8e2303c4c540 3465025037 S Ii:2:008:1 -115:1 8 <
ffff8e2303c4c540 3465033001 C Ii:2:008:1 0:1 7 = 02000630 000000
ffff8e2303c4c540 3465033027 S Ii:2:008:1 -115:1 8 <
ffff8e2303c4c540 3465040993 C Ii:2:008:1 0:1 7 = 02000530 000000
ffff8e2303c4c540 3465041020 S Ii:2:008:1 -115:1 8 <
ffff8e2303c4c540 3465048995 C Ii:2:008:1 0:1 7 = 02000310 000000
ffff8e2303c4c540 3465049022 S Ii:2:008:1 -115:1 8 <
ffff8e2303c4c540 3465056994 C Ii:2:008:1 0:1 7 = 02000310 000000
ffff8e2303c4c540 3465057021 S Ii:2:008:1 -115:1 8 <
ffff8e2303c4c540 3465065000 C Ii:2:008:1 0:1 7 = 02000310 000000
ffff8e2303c4c540 3465065027 S Ii:2:008:1 -115:1 8 <
ffff8e2303c4c540 3465073003 C Ii:2:008:1 0:1 7 = 02000310 000000
ffff8e2303c4c540 3465073029 S Ii:2:008:1 -115:1 8 <
ffff8e2303c4c540 3465080993 C Ii:2:008:1 0:1 7 = 02000420 000000
ffff8e2303c4c540 3465081020 S Ii:2:008:1 -115:1 8 <
ffff8e2303c4c540 3465089000 C Ii:2:008:1 0:1 7 = 02000420 000000
ffff8e2303c4c540 3465089026 S Ii:2:008:1 -115:1 8 <
ffff8e2303c4c540 3465097004 C Ii:2:008:1 0:1 7 = 02000310 000000
ffff8e2303c4c540 3465097030 S Ii:2:008:1 -115:1 8 <
ffff8e2303c4c540 3465104996 C Ii:2:008:1 0:1 7 = 02000110 000000
ffff8e2303c4c540 3465105022 S Ii:2:008:1 -115:1 8 <
ffff8e2303c4c540 3465112995 C Ii:2:008:1 0:1 7 = 02000110 000000
ffff8e2303c4c540 3465113022 S Ii:2:008:1 -115:1 8 <
ffff8e2302151980 3466314134 S Bo:2:002:2 -115 31 = 55534243 07200000 00000000 00000600 00000000 00000000 00000000 000000
ffff8e2302151980 3466314183 C Bo:2:002:2 0 31 >
ffff8e2302151980 3466314195 S Bi:2:002:1 -115 13 <
ffff8e2302151980 3466314224 C Bi:2:002:1 0 13 = 55534253 07200000 00000000 00
ffff8e2303c4c540 3466761001 C Ii:2:008:1 0:1 7 = 02000330 000000
ffff8e2303c4c540 3466761034 S Ii:2:008:1 -115:1 8 <
ffff8e2303c4c540 3466769001 C Ii:2:008:1 0:1 7 = 02000550 000000
ffff8e2303c4c540 3466769029 S Ii:2:008:1 -115:1 8 <
ffff8e2303c4c540 3466777000 C Ii:2:008:1 0:1 7 = 02000770 000000
ffff8e2303c4c540 3466777026 S Ii:2:008:1 -115:1 8 <
ffff8e2303c4c540 3466785009 C Ii:2:008:1 0:1 7 = 02000880 000000
ffff8e2303c4c540 3466785035 S Ii:2:008:1 -115:1 8 <
ffff8e2303c4c540 3466793023 C Ii:2:008:1 0:1 7 = 02000660 000000
ffff8e2303c4c540 3466793050 S Ii:2:008:1 -115:1 8 <
ffff8e2303c4c540 3466801000 C Ii:2:008:1 0:1 7 = 02000550 000000
ffff8e2303c4c540 3466801026 S Ii:2:008:1 -115:1 8 <
ffff8e2303c4c540 3466809017 C Ii:2:008:1 0:1 7 = 02000330 000000
ffff8e2303c4c540 3466809043 S Ii:2:008:1 -115:1 8 <
ffff8e2303c4c540 3466817012 C Ii:2:008:1 0:1 7 = 02000110 000000
ffff8e2303c4c540 3466817039 S Ii:2:008:1 -115:1 8 <
ffff8e2303c4c540 3466824999 C Ii:2:008:1 0:1 7 = 02000110 000000
ffff8e2303c4c540 3466825025 S Ii:2:008:1 -115:1 8 <
ffff8e2303c4c540 3466977012 C Ii:2:008:1 0:1 7 = 0200ffff ff0000
ffff8e2303c4c540 3466977045 S Ii:2:008:1 -115:1 8 <
ffff8e2303c4c540 3466985013 C Ii:2:008:1 0:1 7 = 0200feff ff0000
ffff8e2303c4c540 3466985039 S Ii:2:008:1 -115:1 8 <
ffff8e2303c4c540 3466993001 C Ii:2:008:1 0:1 7 = 0200ff0f 000000
ffff8e2303c4c540 3466993028 S Ii:2:008:1 -115:1 8 <
ffff8e2303c4c540 3467001007 C Ii:2:008:1 0:1 7 = 0200feff ff0000
ffff8e2303c4c540 3467001035 S Ii:2:008:1 -115:1 8 <
ffff8e2303c4c540 3467512016 C Ii:2:008:1 0:1 7 = 0200ff1f 000000
ffff8e2303c4c540 3467512045 S Ii:2:008:1 -115:1 8 <
ffff8e2303c4c540 3467528003 C Ii:2:008:1 0:1 7 = 0200ff1f 000000
ffff8e2303c4c540 3467528036 S Ii:2:008:1 -115:1 8 <
ffff8e2303c4c540 3467535981 C Ii:2:008:1 0:1 7 = 0200ff1f 000000
ffff8e2303c4c540 3467536016 S Ii:2:008:1 -115:1 8 <
ffff8e2302151980 3468362127 S Bo:2:002:2 -115 31 = 55534243 08200000 00000000 00000600 00000000 00000000 00000000 000000
ffff8e2302151980 3468362159 C Bo:2:002:2 0 31 >
ffff8e2302151980 3468362170 S Bi:2:002:1 -115 13 <
ffff8e2302151980 3468362222 C Bi:2:002:1 0 13 = 55534253 08200000 00000000 00
ffff8e2303c4c540 3468848020 C Ii:2:008:1 0:1 7 = 0200ff1f 000000
ffff8e2303c4c540 3468848049 S Ii:2:008:1 -115:1 8 <
ffff8e2303c4c540 3468856008 C Ii:2:008:1 0:1 7 = 02000040 000000
ffff8e2303c4c540 3468856035 S Ii:2:008:1 -115:1 8 <
ffff8e2303c4c540 3468864020 C Ii:2:008:1 0:1 7 = 02000290 000000
ffff8e2303c4c540 3468864047 S Ii:2:008:1 -115:1 8 <
ffff8e2303c4c540 3468872016 C Ii:2:008:1 0:1 7 = 020004c0 000000
ffff8e2303c4c540 3468872042 S Ii:2:008:1 -115:1 8 <
ffff8e2303c4c540 3468879984 C Ii:2:008:1 0:1 7 = 02000900 010000
ffff8e2303c4c540 3468880017 S Ii:2:008:1 -115:1 8 <
ffff8e2303c4c540 3468888017 C Ii:2:008:1 0:1 7 = 02000d00 010000
ffff8e2303c4c540 3468888044 S Ii:2:008:1 -115:1 8 <
ffff8e2303c4c540 3468896007 C Ii:2:008:1 0:1 7 = 02000f20 010000
ffff8e2303c4c540 3468896036 S Ii:2:008:1 -115:1 8 <
ffff8e2303c4c540 3468904020 C Ii:2:008:1 0:1 7 = 02000f20 010000
ffff8e2303c4c540 3468904046 S Ii:2:008:1 -115:1 8 <
ffff8e2303c4c540 3468911982 C Ii:2:008:1 0:1 7 = 02000e20 010000
ffff8e2303c4c540 3468912009 S Ii:2:008:1 -115:1 8 <
ffff8e2303c4c540 3468920018 C Ii:2:008:1 0:1 7 = 02000cf0 000000
ffff8e2303c4c540 3468920045 S Ii:2:008:1 -115:1 8 <
ffff8e2303c4c540 3468928008 C Ii:2:008:1 0:1 7 = 020008b0 000000
ffff8e2303c4c540 3468928034 S Ii:2:008:1 -115:1 8 <
ffff8e2303c4c540 3468936019 C Ii:2:008:1 0:1 7 = 02000560 000000
ffff8e2303c4c540 3468936044 S Ii:2:008:1 -115:1 8 <
ffff8e2303c4c540 3468943985 C Ii:2:008:1 0:1 7 = 02000220 000000
ffff8e2303c4c540 3468944014 S Ii:2:008:1 -115:1 8 <
ffff8e2303c4c540 3468952018 C Ii:2:008:1 0:1 7 = 02000110 000000
ffff8e2303c4c540 3468952044 S Ii:2:008:1 -115:1 8 <
ffff8e2303c4c540 3469056017 C Ii:2:008:1 0:1 7 = 0200ffff ff0000
ffff8e2303c4c540 3469056044 S Ii:2:008:1 -115:1 8 <
ffff8e2303c4c540 3469064022 C Ii:2:008:1 0:1 7 = 020000f0 ff0000
ffff8e2303c4c540 3469064048 S Ii:2:008:1 -115:1 8 <
ffff8e2303c4c540 3469072009 C Ii:2:008:1 0:1 7 = 0200feff ff0000
ffff8e2303c4c540 3469072036 S Ii:2:008:1 -115:1 8 <
ffff8e2303c4c540 3469080008 C Ii:2:008:1 0:1 7 = 0200ffef ff0000
ffff8e2303c4c540 3469080035 S Ii:2:008:1 -115:1 8 <
ffff8e2303c4c540 3469088016 C Ii:2:008:1 0:1 7 = 0200ff0f 000000
ffff8e2303c4c540 3469088043 S Ii:2:008:1 -115:1 8 <
ffff8e2303c4c540 3469096017 C Ii:2:008:1 0:1 7 = 0200ffff ff0000
ffff8e2303c4c540 3469096044 S Ii:2:008:1 -115:1 8 <
ffff8e2303c4c540 3469184009 C Ii:2:008:1 0:1 7 = 0200ffff ff0000
ffff8e2303c4c540 3469184036 S Ii:2:008:1 -115:1 8 <
ffff8e2303c4c540 3469192021 C Ii:2:008:1 0:1 7 = 0200ffff ff0000
ffff8e2303c4c540 3469192049 S Ii:2:008:1 -115:1 8 <
ffff8e2303c4c540 3469200017 C Ii:2:008:1 0:1 7 = 0200feef ff0000
ffff8e2303c4c540 3469200044 S Ii:2:008:1 -115:1 8 <
ffff8e2303c4c540 3469208022 C Ii:2:008:1 0:1 7 = 0200ffff ff0000
ffff8e2303c4c540 3469208048 S Ii:2:008:1 -115:1 8 <
ffff8e2303c4c540 3469216007 C Ii:2:008:1 0:1 7 = 0200ffff ff0000
ffff8e2303c4c540 3469216035 S Ii:2:008:1 -115:1 8 <
ffff8e2303c4c540 3469256022 C Ii:2:008:1 0:1 7 = 0200ffff ff0000
ffff8e2303c4c540 3469256049 S Ii:2:008:1 -115:1 8 <
ffff8e2303c4c540 3469264021 C Ii:2:008:1 0:1 7 = 020000f0 ff0000
ffff8e2303c4c540 3469264047 S Ii:2:008:1 -115:1 8 <
ffff8e2303c4c540 3469272010 C Ii:2:008:1 0:1 7 = 0200ff0f 000000
ffff8e2303c4c540 3469272037 S Ii:2:008:1 -115:1 8 <
ffff8e2303c4c540 3469280010 C Ii:2:008:1 0:1 7 = 0200ffff ff0000
ffff8e2303c4c540 3469280035 S Ii:2:008:1 -115:1 8 <
ffff8e2303c4c540 3469391010 C Ii:2:008:1 0:1 7 = 0200ffff ff0000
ffff8e2303c4c540 3469391037 S Ii:2:008:1 -115:1 8 <
ffff8e2303c4c540 3469399018 C Ii:2:008:1 0:1 7 = 020000f0 ff0000
ffff8e2303c4c540 3469399044 S Ii:2:008:1 -115:1 8 <
ffff8e2303c4c540 3469407022 C Ii:2:008:1 0:1 7 = 0200ff0f 000000
ffff8e2303c4c540 3469407048 S Ii:2:008:1 -115:1 8 <
ffff8e2303c4c540 3469415025 C Ii:2:008:1 0:1 7 = 0200ffff ff0000
ffff8e2303c4c540 3469415051 S Ii:2:008:1 -115:1 8 <
ffff8e2302151980 3470411130 S Bo:2:002:2 -115 31 = 55534243 09200000 00000000 00000600 00000000 00000000 00000000 000000
ffff8e2302151980 3470411178 C Bo:2:002:2 0 31 >
ffff8e2302151980 3470411190 S Bi:2:002:1 -115 13 <
ffff8e2302151980 3470411217 C Bi:2:002:1 0 13 = 55534253 09200000 00000000 00
ffff8e2303c4c540 3470759017 C Ii:2:008:1 0:1 7 = 020001d0 ff0000
ffff8e2303c4c540 3470759048 S Ii:2:008:1 -115:1 8 <
ffff8e2303c4c540 3470767026 C Ii:2:008:1 0:1 7 = 020001a0 ff0000
ffff8e2303c4c540 3470767052 S Ii:2:008:1 -115:1 8 <
ffff8e2303c4c540 3470775025 C Ii:2:008:1 0:1 7 = 02000370 ff0000
ffff8e2303c4c540 3470775051 S Ii:2:008:1 -115:1 8 <
ffff8e2303c4c540 3470783024 C Ii:2:008:1 0:1 7 = 02000240 ff0000
ffff8e2303c4c540 3470783051 S Ii:2:008:1 -115:1 8 <
ffff8e2303c4c540 3470791015 C Ii:2:008:1 0:1 7 = 02000250 ff0000
ffff8e2303c4c540 3470791042 S Ii:2:008:1 -115:1 8 <
ffff8e2303c4c540 3470799023 C Ii:2:008:1 0:1 7 = 02000280 ff0000
ffff8e2303c4c540 3470799050 S Ii:2:008:1 -115:1 8 <
ffff8e2303c4c540 3470807023 C Ii:2:008:1 0:1 7 = 02000190 ff0000
ffff8e2303c4c540 3470807050 S Ii:2:008:1 -115:1 8 <
ffff8e2303c4c540 3470815023 C Ii:2:008:1 0:1 7 = 020002b0 ff0000
ffff8e2303c4c540 3470815049 S Ii:2:008:1 -115:1 8 <
ffff8e2303c4c540 3470823026 C Ii:2:008:1 0:1 7 = 020001b0 ff0000
ffff8e2303c4c540 3470823052 S Ii:2:008:1 -115:1 8 <
ffff8e2303c4c540 3470831026 C Ii:2:008:1 0:1 7 = 020002a0 ff0000
ffff8e2303c4c540 3470831054 S Ii:2:008:1 -115:1 8 <
ffff8e2303c4c540 3470839024 C Ii:2:008:1 0:1 7 = 020000b0 ff0000
ffff8e2303c4c540 3470839050 S Ii:2:008:1 -115:1 8 <
ffff8e2303c4c540 3470847017 C Ii:2:008:1 0:1 7 = 02000180 ff0000
ffff8e2303c4c540 3470847044 S Ii:2:008:1 -115:1 8 <
ffff8e2303c4c540 3470855024 C Ii:2:008:1 0:1 7 = 02000280 ff0000
ffff8e2303c4c540 3470855051 S Ii:2:008:1 -115:1 8 <
ffff8e2303c4c540 3470863017 C Ii:2:008:1 0:1 7 = 02000150 ff0000
ffff8e2303c4c540 3470863043 S Ii:2:008:1 -115:1 8 <
ffff8e2303c4c540 3470871017 C Ii:2:008:1 0:1 7 = 02000250 ff0000
ffff8e2303c4c540 3470871043 S Ii:2:008:1 -115:1 8 <
ffff8e2303c4c540 3470879027 C Ii:2:008:1 0:1 7 = 02000160 ff0000
ffff8e2303c4c540 3470879054 S Ii:2:008:1 -115:1 8 <
ffff8e2303c4c540 3470887023 C Ii:2:008:1 0:1 7 = 02000060 ff0000
ffff8e2303c4c540 3470887049 S Ii:2:008:1 -115:1 8 <
ffff8e2303c4c540 3470895018 C Ii:2:008:1 0:1 7 = 02000080 ff0000
ffff8e2303c4c540 3470895045 S Ii:2:008:1 -115:1 8 <
ffff8e2303c4c540 3470903017 C Ii:2:008:1 0:1 7 = 020000a0 ff0000
ffff8e2303c4c540 3470903043 S Ii:2:008:1 -115:1 8 <
ffff8e2303c4c540 3470911017 C Ii:2:008:1 0:1 7 = 02000180 ff0000
ffff8e2303c4c540 3470911045 S Ii:2:008:1 -115:1 8 <
ffff8e2303c4c540 3470919023 C Ii:2:008:1 0:1 7 = 02000190 ff0000
ffff8e2303c4c540 3470919049 S Ii:2:008:1 -115:1 8 <
ffff8e2303c4c540 3470927017 C Ii:2:008:1 0:1 7 = 020000a0 ff0000
ffff8e2303c4c540 3470927043 S Ii:2:008:1 -115:1 8 <
ffff8e2303c4c540 3470935017 C Ii:2:008:1 0:1 7 = 02000190 ff0000
ffff8e2303c4c540 3470935044 S Ii:2:008:1 -115:1 8 <
ffff8e2303c4c540 3470943017 C Ii:2:008:1 0:1 7 = 020000b0 ff0000
ffff8e2303c4c540 3470943043 S Ii:2:008:1 -115:1 8 <
ffff8e2303c4c540 3470951025 C Ii:2:008:1 0:1 7 = 020000d0 ff0000
ffff8e2303c4c540 3470951052 S Ii:2:008:1 -115:1 8 <
ffff8e2303c4c540 3470959027 C Ii:2:008:1 0:1 7 = 020000d0 ff0000
ffff8e2303c4c540 3470959053 S Ii:2:008:1 -115:1 8 <
ffff8e2303c4c540 3470975024 C Ii:2:008:1 0:1 7 = 020000f0 ff0000
ffff8e2303c4c540 3470975051 S Ii:2:008:1 -115:1 8 <
ffff8e2303c4c540 3471391021 C Ii:2:008:1 0:1 7 = 020000f0 ff0000
ffff8e2303c4c540 3471391049 S Ii:2:008:1 -115:1 8 <
ffff8e2303c4c540 3471399025 C Ii:2:008:1 0:1 7 = 020002d0 ff0000
ffff8e2303c4c540 3471399051 S Ii:2:008:1 -115:1 8 <
ffff8e2303c4c540 3471407017 C Ii:2:008:1 0:1 7 = 020001d0 ff0000
ffff8e2303c4c540 3471407044 S Ii:2:008:1 -115:1 8 <
ffff8e2303c4c540 3471415028 C Ii:2:008:1 0:1 7 = 020002c0 ff0000
ffff8e2303c4c540 3471415055 S Ii:2:008:1 -115:1 8 <
ffff8e2303c4c540 3471423025 C Ii:2:008:1 0:1 7 = 020001d0 ff0000
ffff8e2303c4c540 3471423052 S Ii:2:008:1 -115:1 8 <
ffff8e2303c4c540 3471431025 C Ii:2:008:1 0:1 7 = 020000f0 ff0000
ffff8e2303c4c540 3471431050 S Ii:2:008:1 -115:1 8 <
ffff8e2303c4c540 3471439025 C Ii:2:008:1 0:1 7 = 020001e0 ff0000
ffff8e2303c4c540 3471439051 S Ii:2:008:1 -115:1 8 <
ffff8e2303c4c540 3471447030 C Ii:2:008:1 0:1 7 = 020001e0 ff0000
ffff8e2303c4c540 3471447058 S Ii:2:008:1 -115:1 8 <
ffff8e2303c4c540 3471455026 C Ii:2:008:1 0:1 7 = 020000f0 ff0000
ffff8e2303c4c540 3471455052 S Ii:2:008:1 -115:1 8 <
ffff8e2303c4c540 3471463017 C Ii:2:008:1 0:1 7 = 020002d0 ff0000
ffff8e2303c4c540 3471463043 S Ii:2:008:1 -115:1 8 <
ffff8e2303c4c540 3471471025 C Ii:2:008:1 0:1 7 = 020001f0 ff0000
ffff8e2303c4c540 3471471051 S Ii:2:008:1 -115:1 8 <
ffff8e2303c4c540 3471479018 C Ii:2:008:1 0:1 7 = 020001e0 ff0000
ffff8e2303c4c540 3471479046 S Ii:2:008:1 -115:1 8 <
ffff8e2303c4c540 3471487019 C Ii:2:008:1 0:1 7 = 020002d0 ff0000
ffff8e2303c4c540 3471487045 S Ii:2:008:1 -115:1 8 <
ffff8e2303c4c540 3471503030 C Ii:2:008:1 0:1 7 = 020001f0 ff0000
ffff8e2303c4c540 3471503057 S Ii:2:008:1 -115:1 8 <
ffff8e2303c4c540 3471671028 C Ii:2:008:1 0:1 7 = 02000200 000000
ffff8e2303c4c540 3471671054 S Ii:2:008:1 -115:1 8 <
ffff8e2303c4c540 3471677990 C Ii:2:008:1 0:1 7 = 020006f0 ff0000
ffff8e2303c4c540 3471678010 S Ii:2:008:1 -115:1 8 <
ffff8e2303c4c540 3471686019 C Ii:2:008:1 0:1 7 = 02000bf0 ff0000
ffff8e2303c4c540 3471686047 S Ii:2:008:1 -115:1 8 <
ffff8e2303c4c540 3471693996 C Ii:2:008:1 0:1 7 = 02001000 000000
ffff8e2303c4c540 3471694034 S Ii:2:008:1 -115:1 8 <
ffff8e2303c4c540 3471702020 C Ii:2:008:1 0:1 7 = 020015e0 ff0000
ffff8e2303c4c540 3471702045 S Ii:2:008:1 -115:1 8 <
ffff8e2303c4c540 3471710018 C Ii:2:008:1 0:1 7 = 020016f0 ff0000
ffff8e2303c4c540 3471710047 S Ii:2:008:1 -115:1 8 <
ffff8e2303c4c540 3471718018 C Ii:2:008:1 0:1 7 = 020018f0 ff0000
ffff8e2303c4c540 3471718045 S Ii:2:008:1 -115:1 8 <
ffff8e2303c4c540 3471726026 C Ii:2:008:1 0:1 7 = 02001ae0 ff0000
ffff8e2303c4c540 3471726053 S Ii:2:008:1 -115:1 8 <
ffff8e2303c4c540 3471734026 C Ii:2:008:1 0:1 7 = 02001bd0 ff0000
ffff8e2303c4c540 3471734053 S Ii:2:008:1 -115:1 8 <
ffff8e2303c4c540 3471742026 C Ii:2:008:1 0:1 7 = 02001ed0 ff0000
ffff8e2303c4c540 3471742053 S Ii:2:008:1 -115:1 8 <
ffff8e2303c4c540 3471750019 C Ii:2:008:1 0:1 7 = 020022c0 ff0000
ffff8e2303c4c540 3471750045 S Ii:2:008:1 -115:1 8 <
ffff8e2303c4c540 3471758019 C Ii:2:008:1 0:1 7 = 020026d0 ff0000
ffff8e2303c4c540 3471758046 S Ii:2:008:1 -115:1 8 <
ffff8e2303c4c540 3471766027 C Ii:2:008:1 0:1 7 = 020029e0 ff0000
ffff8e2303c4c540 3471766054 S Ii:2:008:1 -115:1 8 <
ffff8e2303c4c540 3471774019 C Ii:2:008:1 0:1 7 = 02002bf0 ff0000
ffff8e2303c4c540 3471774046 S Ii:2:008:1 -115:1 8 <
ffff8e2303c4c540 3471782027 C Ii:2:008:1 0:1 7 = 02002d00 000000
ffff8e2303c4c540 3471782052 S Ii:2:008:1 -115:1 8 <
ffff8e2303c4c540 3471790027 C Ii:2:008:1 0:1 7 = 02002d00 000000
ffff8e2303c4c540 3471790052 S Ii:2:008:1 -115:1 8 <
ffff8e2303c4c540 3471798021 C Ii:2:008:1 0:1 7 = 02002b00 000000
ffff8e2303c4c540 3471798048 S Ii:2:008:1 -115:1 8 <
ffff8e2303c4c540 3471806031 C Ii:2:008:1 0:1 7 = 02002a00 000000
ffff8e2303c4c540 3471806057 S Ii:2:008:1 -115:1 8 <
ffff8e2303c4c540 3471814026 C Ii:2:008:1 0:1 7 = 02002900 000000
ffff8e2303c4c540 3471814052 S Ii:2:008:1 -115:1 8 <
ffff8e2303c4c540 3471822018 C Ii:2:008:1 0:1 7 = 02002600 000000
ffff8e2303c4c540 3471822044 S Ii:2:008:1 -115:1 8 <
ffff8e2303c4c540 3471830017 C Ii:2:008:1 0:1 7 = 02002700 000000
ffff8e2303c4c540 3471830044 S Ii:2:008:1 -115:1 8 <
ffff8e2303c4c540 3471838019 C Ii:2:008:1 0:1 7 = 02002700 000000
ffff8e2303c4c540 3471838045 S Ii:2:008:1 -115:1 8 <
ffff8e2303c4c540 3471846029 C Ii:2:008:1 0:1 7 = 02002710 000000
ffff8e2303c4c540 3471846055 S Ii:2:008:1 -115:1 8 <
ffff8e2303c4c540 3471854019 C Ii:2:008:1 0:1 7 = 02002820 000000
ffff8e2303c4c540 3471854046 S Ii:2:008:1 -115:1 8 <
ffff8e2303c4c540 3471862018 C Ii:2:008:1 0:1 7 = 02002430 000000
ffff8e2303c4c540 3471862044 S Ii:2:008:1 -115:1 8 <
ffff8e2303c4c540 3471870030 C Ii:2:008:1 0:1 7 = 02002340 000000
ffff8e2303c4c540 3471870057 S Ii:2:008:1 -115:1 8 <
ffff8e2303c4c540 3471878019 C Ii:2:008:1 0:1 7 = 02001f60 000000
ffff8e2303c4c540 3471878046 S Ii:2:008:1 -115:1 8 <
ffff8e2303c4c540 3471886028 C Ii:2:008:1 0:1 7 = 02001a70 000000
ffff8e2303c4c540 3471886055 S Ii:2:008:1 -115:1 8 <
ffff8e2303c4c540 3471894027 C Ii:2:008:1 0:1 7 = 02001880 000000
ffff8e2303c4c540 3471894052 S Ii:2:008:1 -115:1 8 <
ffff8e2303c4c540 3471902019 C Ii:2:008:1 0:1 7 = 02001260 000000
ffff8e2303c4c540 3471902046 S Ii:2:008:1 -115:1 8 <
ffff8e2303c4c540 3471910028 C Ii:2:008:1 0:1 7 = 02000d60 000000
ffff8e2303c4c540 3471910055 S Ii:2:008:1 -115:1 8 <
ffff8e2303c4c540 3471918018 C Ii:2:008:1 0:1 7 = 02000840 000000
ffff8e2303c4c540 3471918042 S Ii:2:008:1 -115:1 8 <
ffff8e2303c4c540 3471926027 C Ii:2:008:1 0:1 7 = 02000440 000000
ffff8e2303c4c540 3471926053 S Ii:2:008:1 -115:1 8 <
ffff8e2303c4c540 3471934022 C Ii:2:008:1 0:1 7 = 02000230 000000
ffff8e2303c4c540 3471934049 S Ii:2:008:1 -115:1 8 <
ffff8e2303c4c540 3471942030 C Ii:2:008:1 0:1 7 = 02000130 000000
ffff8e2303c4c540 3471942057 S Ii:2:008:1 -115:1 8 <
ffff8e2303c4c540 3471949992 C Ii:2:008:1 0:1 7 = 02000110 000000
ffff8e2303c4c540 3471950022 S Ii:2:008:1 -115:1 8 <
ffff8e2303c4c540 3471958019 C Ii:2:008:1 0:1 7 = 02000010 000000
ffff8e2303c4c540 3471958045 S Ii:2:008:1 -115:1 8 <
ffff8e2303c4c540 3471966031 C Ii:2:008:1 0:1 7 = 02000010 000000
ffff8e2303c4c540 3471966056 S Ii:2:008:1 -115:1 8 <
ffff8e2303c4c540 3472166034 C Ii:2:008:1 0:1 7 = 020000f0 ff0000
ffff8e2303c4c540 3472166060 S Ii:2:008:1 -115:1 8 <
ffff8e2303c4c540 3472174034 C Ii:2:008:1 0:1 7 = 020000d0 ff0000
ffff8e2303c4c540 3472174060 S Ii:2:008:1 -115:1 8 <
ffff8e2303c4c540 3472182028 C Ii:2:008:1 0:1 7 = 020002c0 ff0000
ffff8e2303c4c540 3472182055 S Ii:2:008:1 -115:1 8 <
ffff8e2303c4c540 3472190020 C Ii:2:008:1 0:1 7 = 02000190 ff0000
ffff8e2303c4c540 3472190047 S Ii:2:008:1 -115:1 8 <
ffff8e2303c4c540 3472198029 C Ii:2:008:1 0:1 7 = 02000380 ff0000
ffff8e2303c4c540 3472198055 S Ii:2:008:1 -115:1 8 <
ffff8e2303c4c540 3472206021 C Ii:2:008:1 0:1 7 = 02000590 ff0000
ffff8e2303c4c540 3472206049 S Ii:2:008:1 -115:1 8 <
ffff8e2303c4c540 3472213992 C Ii:2:008:1 0:1 7 = 02000680 ff0000
ffff8e2303c4c540 3472214015 S Ii:2:008:1 -115:1 8 <
ffff8e2303c4c540 3472222032 C Ii:2:008:1 0:1 7 = 020007a0 ff0000
ffff8e2303c4c540 3472222057 S Ii:2:008:1 -115:1 8 <
ffff8e2303c4c540 3472230022 C Ii:2:008:1 0:1 7 = 020009a0 ff0000
ffff8e2303c4c540 3472230048 S Ii:2:008:1 -115:1 8 <
ffff8e2303c4c540 3472238022 C Ii:2:008:1 0:1 7 = 020009c0 ff0000
ffff8e2303c4c540 3472238049 S Ii:2:008:1 -115:1 8 <
ffff8e2303c4c540 3472246028 C Ii:2:008:1 0:1 7 = 020007e0 ff0000
ffff8e2303c4c540 3472246054 S Ii:2:008:1 -115:1 8 <
ffff8e2303c4c540 3472253993 C Ii:2:008:1 0:1 7 = 020006f0 ff0000
ffff8e2303c4c540 3472254027 S Ii:2:008:1 -115:1 8 <
ffff8e2303c4c540 3472262033 C Ii:2:008:1 0:1 7 = 020004f0 ff0000
ffff8e2303c4c540 3472262051 S Ii:2:008:1 -115:1 8 <
ffff8e2303c4c540 3472270028 C Ii:2:008:1 0:1 7 = 020003f0 ff0000
ffff8e2303c4c540 3472270045 S Ii:2:008:1 -115:1 8 <
ffff8e2303c4c540 3472277993 C Ii:2:008:1 0:1 7 = 020003f0 ff0000
ffff8e2303c4c540 3472278024 S Ii:2:008:1 -115:1 8 <
ffff8e2303c4c540 3472286030 C Ii:2:008:1 0:1 7 = 020001e0 ff0000
ffff8e2303c4c540 3472286049 S Ii:2:008:1 -115:1 8 <
ffff8e2303c4c540 3472294019 C Ii:2:008:1 0:1 7 = 020001d0 ff0000
ffff8e2303c4c540 3472294036 S Ii:2:008:1 -115:1 8 <
ffff8e2303c4c540 3472301992 C Ii:2:008:1 0:1 7 = 020001d0 ff0000
ffff8e2303c4c540 3472302022 S Ii:2:008:1 -115:1 8 <
ffff8e2303c4c540 3472309992 C Ii:2:008:1 0:1 7 = 020000d0 ff0000
ffff8e2303c4c540 3472310025 S Ii:2:008:1 -115:1 8 <
ffff8e2303c4c540 3472318023 C Ii:2:008:1 0:1 7 = 020001f0 ff0000
ffff8e2303c4c540 3472318041 S Ii:2:008:1 -115:1 8 <
ffff8e2302151980 3472458101 S Bo:2:002:2 -115 31 = 55534243 0a200000 00000000 00000600 00000000 00000000 00000000 000000
ffff8e2302151980 3472458139 C Bo:2:002:2 0 31 >
ffff8e2302151980 3472458153 S Bi:2:002:1 -115 13 <
ffff8e2302151980 3472458177 C Bi:2:002:1 0 13 = 55534253 0a200000 00000000 00
