ffff8e2302151980 2221770128 S Bo:2:002:2 -115 31 = 55534243 a0050000 00000000 00000600 00000000 00000000 00000000 000000
ffff8e2302151980 2221770180 C Bo:2:002:2 0 31 >
ffff8e2302151980 2221770188 S Bi:2:002:1 -115 13 <
ffff8e2302151980 2221770235 C Bi:2:002:1 0 13 = 55534253 a0050000 00000000 00
ffff8e2302151980 2223818110 S Bo:2:002:2 -115 31 = 55534243 a1050000 00000000 00000600 00000000 00000000 00000000 000000
ffff8e2302151980 2223818142 C Bo:2:002:2 0 31 >
ffff8e2302151980 2223818150 S Bi:2:002:1 -115 13 <
ffff8e2302151980 2223818188 C Bi:2:002:1 0 13 = 55534253 a1050000 00000000 00
ffff8e2302151980 2225866165 S Bo:2:002:2 -115 31 = 55534243 a2050000 00000000 00000600 00000000 00000000 00000000 000000
ffff8e2302151980 2225866199 C Bo:2:002:2 0 31 >
ffff8e2302151980 2225866207 S Bi:2:002:1 -115 13 <
ffff8e2302151980 2225866252 C Bi:2:002:1 0 13 = 55534253 a2050000 00000000 00
ffff8e2302151980 2227914123 S Bo:2:002:2 -115 31 = 55534243 a3050000 00000000 00000600 00000000 00000000 00000000 000000
ffff8e2302151980 2227914155 C Bo:2:002:2 0 31 >
ffff8e2302151980 2227914163 S Bi:2:002:1 -115 13 <
ffff8e2302151980 2227914198 C Bi:2:002:1 0 13 = 55534253 a3050000 00000000 00
ffff8e2302151980 2229962130 S Bo:2:002:2 -115 31 = 55534243 a4050000 00000000 00000600 00000000 00000000 00000000 000000
ffff8e2302151980 2229962162 C Bo:2:002:2 0 31 >
ffff8e2302151980 2229962170 S Bi:2:002:1 -115 13 <
ffff8e2302151980 2229962205 C Bi:2:002:1 0 13 = 55534253 a4050000 00000000 00
ffff8e2302151980 2232010131 S Bo:2:002:2 -115 31 = 55534243 a5050000 00000000 00000600 00000000 00000000 00000000 000000
ffff8e2302151980 2232010166 C Bo:2:002:2 0 31 >
ffff8e2302151980 2232010174 S Bi:2:002:1 -115 13 <
ffff8e2302151980 2232010210 C Bi:2:002:1 0 13 = 55534253 a5050000 00000000 00
ffff8e2303c4c540 2232119042 C Ii:2:008:1 0:1 7 = 02000190 00fc00
ffff8e2303c4c540 2232119075 S Ii:2:008:1 -115:1 8 <
ffff8e2303c4c540 2232127047 C Ii:2:008:1 0:1 7 = 0200dbbf 000100
ffff8e2303c4c540 2232127072 S Ii:2:008:1 -115:1 8 <
ffff8e2303c4c540 2232135041 C Ii:2:008:1 0:1 7 = 0200cbcf 000000
ffff8e2303c4c540 2232135069 S Ii:2:008:1 -115:1 8 <
ffff8e2303c4c540 2232143015 C Ii:2:008:1 0:1 7 = 0200bfbf 000100
ffff8e2303c4c540 2232143037 S Ii:2:008:1 -115:1 8 <
ffff8e2303c4c540 2232151041 C Ii:2:008:1 0:1 7 = 0200c81f 000000
ffff8e2303c4c540 2232151068 S Ii:2:008:1 -115:1 8 <
ffff8e2303c4c540 2232159009 C Ii:2:008:1 0:1 7 = 0200d1bf ff0100
ffff8e2303c4c540 2232159030 S Ii:2:008:1 -115:1 8 <
ffff8e2303c4c540 2232167064 C Ii:2:008:1 0:1 7 = 0200db8f ff0000
ffff8e2303c4c540 2232167091 S Ii:2:008:1 -115:1 8 <
ffff8e2303c4c540 2232175014 C Ii:2:008:1 0:1 7 = 0200e36f ff0000
ffff8e2303c4c540 2232175033 S Ii:2:008:1 -115:1 8 <
ffff8e2303c4c540 2232183038 C Ii:2:008:1 0:1 7 = 0200ec5f ff0000
ffff8e2303c4c540 2232183065 S Ii:2:008:1 -115:1 8 <
ffff8e2303c4c540 2232191018 C Ii:2:008:1 0:1 7 = 0200f33f ff0000
ffff8e2303c4c540 2232191036 S Ii:2:008:1 -115:1 8 <
ffff8e2303c4c540 2232199059 C Ii:2:008:1 0:1 7 = 0200f74f ff0000
ffff8e2303c4c540 2232199075 S Ii:2:008:1 -115:1 8 <
ffff8e2303c4c540 2232207057 C Ii:2:008:1 0:1 7 = 0200fa2f ff0000
ffff8e2303c4c540 2232207074 S Ii:2:008:1 -115:1 8 <
ffff8e2303c4c540 2232215051 C Ii:2:008:1 0:1 7 = 0200fc5f ff0000
ffff8e2303c4c540 2232215067 S Ii:2:008:1 -115:1 8 <
ffff8e2303c4c540 2232223039 C Ii:2:008:1 0:1 7 = 0200fe8f ff0000
ffff8e2303c4c540 2232223055 S Ii:2:008:1 -115:1 8 <
ffff8e2303c4c540 2232231038 C Ii:2:008:1 0:1 7 = 0200ffcf ff0000
ffff8e2303c4c540 2232231055 S Ii:2:008:1 -115:1 8 <
ffff8e2303c4c540 2232239043 C Ii:2:008:1 0:1 7 = 020000e0 ff0000
ffff8e2303c4c540 2232239059 S Ii:2:008:1 -115:1 8 <
ffff8e2303c4c540 2232263039 C Ii:2:008:1 0:1 7 = 0200fe2f 000000
ffff8e2303c4c540 2232263055 S Ii:2:008:1 -115:1 8 <
ffff8e2303c4c540 2232271046 C Ii:2:008:1 0:1 7 = 0200ff5f 000000
ffff8e2303c4c540 2232271063 S Ii:2:008:1 -115:1 8 <
ffff8e2303c4c540 2232279050 C Ii:2:008:1 0:1 7 = 0200fedf 000000
ffff8e2303c4c540 2232279080 S Ii:2:008:1 -115:1 8 <
ffff8e2303c4c540 2232287051 C Ii:2:008:1 0:1 7 = 0200ff6f 01ff00
ffff8e2303c4c540 2232287068 S Ii:2:008:1 -115:1 8 <
ffff8e2303c4c540 2232295017 C Ii:2:008:1 0:1 7 = 02000010 020000
ffff8e2303c4c540 2232295033 S Ii:2:008:1 -115:1 8 <
ffff8e2303c4c540 2232303072 C Ii:2:008:1 0:1 7 = 020001a0 02ff00
ffff8e2303c4c540 2232303088 S Ii:2:008:1 -115:1 8 <
ffff8e2303c4c540 2232311041 C Ii:2:008:1 0:1 7 = 02000010 030000
ffff8e2303c4c540 2232311058 S Ii:2:008:1 -115:1 8 <
ffff8e2303c4c540 2232319054 C Ii:2:008:1 0:1 7 = 02000150 03ff00
ffff8e2303c4c540 2232319072 S Ii:2:008:1 -115:1 8 <
ffff8e2303c4c540 2232327057 C Ii:2:008:1 0:1 7 = 02000060 030000
ffff8e2303c4c540 2232327073 S Ii:2:008:1 -115:1 8 <
ffff8e2303c4c540 2232335072 C Ii:2:008:1 0:1 7 = 0200fd2f 03ff00
ffff8e2303c4c540 2232335089 S Ii:2:008:1 -115:1 8 <
ffff8e2303c4c540 2232343018 C Ii:2:008:1 0:1 7 = 0200fcef 020000
ffff8e2303c4c540 2232343034 S Ii:2:008:1 -115:1 8 <
ffff8e2303c4c540 2232351047 C Ii:2:008:1 0:1 7 = 0200fa7f 02ff00
ffff8e2303c4c540 2232351064 S Ii:2:008:1 -115:1 8 <
ffff8e2303c4c540 2232359054 C Ii:2:008:1 0:1 7 = 0200fc4f 020000
ffff8e2303c4c540 2232359072 S Ii:2:008:1 -115:1 8 <
ffff8e2303c4c540 2232367067 C Ii:2:008:1 0:1 7 = 0200fe1f 020000
ffff8e2303c4c540 2232367083 S Ii:2:008:1 -115:1 8 <
ffff8e2303c4c540 2232375059 C Ii:2:008:1 0:1 7 = 0200ffef 010000
ffff8e2303c4c540 2232375075 S Ii:2:008:1 -115:1 8 <
ffff8e2303c4c540 2232383041 C Ii:2:008:1 0:1 7 = 020001f0 010000
ffff8e2303c4c540 2232383059 S Ii:2:008:1 -115:1 8 <
ffff8e2303c4c540 2232391038 C Ii:2:008:1 0:1 7 = 02000510 020000
ffff8e2303c4c540 2232391054 S Ii:2:008:1 -115:1 8 <
ffff8e2303c4c540 2232399039 C Ii:2:008:1 0:1 7 = 02000820 020000
ffff8e2303c4c540 2232399056 S Ii:2:008:1 -115:1 8 <
ffff8e2303c4c540 2232407039 C Ii:2:008:1 0:1 7 = 02000d20 020000
ffff8e2303c4c540 2232407068 S Ii:2:008:1 -115:1 8 <
ffff8e2303c4c540 2232415044 C Ii:2:008:1 0:1 7 = 02001010 020000
ffff8e2303c4c540 2232415071 S Ii:2:008:1 -115:1 8 <
ffff8e2303c4c540 2232423032 C Ii:2:008:1 0:1 7 = 020011e0 010000
ffff8e2303c4c540 2232423047 S Ii:2:008:1 -115:1 8 <
ffff8e2303c4c540 2232431050 C Ii:2:008:1 0:1 7 = 020013c0 010000
ffff8e2303c4c540 2232431076 S Ii:2:008:1 -115:1 8 <
ffff8e2303c4c540 2232439060 C Ii:2:008:1 0:1 7 = 020015b0 010000
ffff8e2303c4c540 2232439087 S Ii:2:008:1 -115:1 8 <
ffff8e2303c4c540 2232447041 C Ii:2:008:1 0:1 7 = 02001990 010000
ffff8e2303c4c540 2232447067 S Ii:2:008:1 -115:1 8 <
ffff8e2303c4c540 2232455049 C Ii:2:008:1 0:1 7 = 02001f70 010000
ffff8e2303c4c540 2232455074 S Ii:2:008:1 -115:1 8 <
ffff8e2303c4c540 2232463049 C Ii:2:008:1 0:1 7 = 02002250 010000
ffff8e2303c4c540 2232463076 S Ii:2:008:1 -115:1 8 <
ffff8e2303c4c540 2232471049 C Ii:2:008:1 0:1 7 = 02002420 010000
ffff8e2303c4c540 2232471076 S Ii:2:008:1 -115:1 8 <
ffff8e2303c4c540 2232479045 C Ii:2:008:1 0:1 7 = 02001fe0 000000
ffff8e2303c4c540 2232479071 S Ii:2:008:1 -115:1 8 <
ffff8e2303c4c540 2232487012 C Ii:2:008:1 0:1 7 = 02001aa0 000000
ffff8e2303c4c540 2232487037 S Ii:2:008:1 -115:1 8 <
ffff8e2303c4c540 2232495047 C Ii:2:008:1 0:1 7 = 02001150 000000
ffff8e2303c4c540 2232495072 S Ii:2:008:1 -115:1 8 <
ffff8e2303c4c540 2232503046 C Ii:2:008:1 0:1 7 = 02000a30 000000
ffff8e2303c4c540 2232503072 S Ii:2:008:1 -115:1 8 <
ffff8e2303c4c540 2232511042 C Ii:2:008:1 0:1 7 = 02000600 000000
ffff8e2303c4c540 2232511069 S Ii:2:008:1 -115:1 8 <
ffff8e2303c4c540 2232519052 C Ii:2:008:1 0:1 7 = 02000300 000000
ffff8e2303c4c540 2232519079 S Ii:2:008:1 -115:1 8 <
ffff8e2303c4c540 2232527038 C Ii:2:008:1 0:1 7 = 02000200 000000
ffff8e2303c4c540 2232527065 S Ii:2:008:1 -115:1 8 <
ffff8e2303c4c540 2232535042 C Ii:2:008:1 0:1 7 = 02000300 000000
ffff8e2303c4c540 2232535068 S Ii:2:008:1 -115:1 8 <
ffff8e2303c4c540 2232543039 C Ii:2:008:1 0:1 7 = 020002f0 ff0000
ffff8e2303c4c540 2232543067 S Ii:2:008:1 -115:1 8 <
ffff8e2303c4c540 2232551050 C Ii:2:008:1 0:1 7 = 020004f0 ff0000
ffff8e2303c4c540 2232551076 S Ii:2:008:1 -115:1 8 <
ffff8e2303c4c540 2232559049 C Ii:2:008:1 0:1 7 = 020004f0 ff0000
ffff8e2303c4c540 2232559076 S Ii:2:008:1 -115:1 8 <
ffff8e2303c4c540 2232567050 C Ii:2:008:1 0:1 7 = 020006d0 ff0000
ffff8e2303c4c540 2232567078 S Ii:2:008:1 -115:1 8 <
ffff8e2303c4c540 2232575039 C Ii:2:008:1 0:1 7 = 020006e0 ff0000
ffff8e2303c4c540 2232575066 S Ii:2:008:1 -115:1 8 <
ffff8e2303c4c540 2232583040 C Ii:2:008:1 0:1 7 = 020007c0 ff0000
ffff8e2303c4c540 2232583067 S Ii:2:008:1 -115:1 8 <
ffff8e2303c4c540 2232591043 C Ii:2:008:1 0:1 7 = 020008c0 ff0000
ffff8e2303c4c540 2232591069 S Ii:2:008:1 -115:1 8 <
ffff8e2303c4c540 2232599058 C Ii:2:008:1 0:1 7 = 020007c0 ff0000
ffff8e2303c4c540 2232599084 S Ii:2:008:1 -115:1 8 <
ffff8e2303c4c540 2232607054 C Ii:2:008:1 0:1 7 = 020009a0 ff0000
ffff8e2303c4c540 2232607081 S Ii:2:008:1 -115:1 8 <
ffff8e2303c4c540 2232615041 C Ii:2:008:1 0:1 7 = 020007c0 ff0000
ffff8e2303c4c540 2232615068 S Ii:2:008:1 -115:1 8 <
ffff8e2303c4c540 2232623051 C Ii:2:008:1 0:1 7 = 020007c0 ff0000
ffff8e2303c4c540 2232623077 S Ii:2:008:1 -115:1 8 <
ffff8e2303c4c540 2232631040 C Ii:2:008:1 0:1 7 = 020006d0 ff0000
ffff8e2303c4c540 2232631067 S Ii:2:008:1 -115:1 8 <
ffff8e2303c4c540 2232639054 C Ii:2:008:1 0:1 7 = 020003f0 ff0000
ffff8e2303c4c540 2232639081 S Ii:2:008:1 -115:1 8 <
ffff8e2303c4c540 2232647054 C Ii:2:008:1 0:1 7 = 020002f0 ff0000
ffff8e2303c4c540 2232647081 S Ii:2:008:1 -115:1 8 <
ffff8e2303c4c540 2232679053 C Ii:2:008:1 0:1 7 = 020000e0 ff0000
ffff8e2303c4c540 2232679081 S Ii:2:008:1 -115:1 8 <
ffff8e2303c4c540 2232687051 C Ii:2:008:1 0:1 7 = 020000c0 ff0000
ffff8e2303c4c540 2232687079 S Ii:2:008:1 -115:1 8 <
ffff8e2303c4c540 2232695039 C Ii:2:008:1 0:1 7 = 0200ff9f ff0000
ffff8e2303c4c540 2232695066 S Ii:2:008:1 -115:1 8 <
ffff8e2303c4c540 2232703042 C Ii:2:008:1 0:1 7 = 0200fc6f ff0000
ffff8e2303c4c540 2232703070 S Ii:2:008:1 -115:1 8 <
ffff8e2303c4c540 2232711044 C Ii:2:008:1 0:1 7 = 0200f82f ff0000
ffff8e2303c4c540 2232711071 S Ii:2:008:1 -115:1 8 <
ffff8e2303c4c540 2232719048 C Ii:2:008:1 0:1 7 = 0200f4ff fe0000
ffff8e2303c4c540 2232719074 S Ii:2:008:1 -115:1 8 <
ffff8e2303c4c540 2232727039 C Ii:2:008:1 0:1 7 = 0200f0df fe0000
ffff8e2303c4c540 2232727067 S Ii:2:008:1 -115:1 8 <
ffff8e2303c4c540 2232735040 C Ii:2:008:1 0:1 7 = 0200edaf fe0000
ffff8e2303c4c540 2232735067 S Ii:2:008:1 -115:1 8 <
ffff8e2303c4c540 2232743046 C Ii:2:008:1 0:1 7 = 0200e88f fe0000
ffff8e2303c4c540 2232743073 S Ii:2:008:1 -115:1 8 <
ffff8e2303c4c540 2232751020 C Ii:2:008:1 0:1 7 = 0200e06f fe0000
ffff8e2303c4c540 2232751040 S Ii:2:008:1 -115:1 8 <
ffff8e2303c4c540 2232759067 C Ii:2:008:1 0:1 7 = 0200d83f fe0000
ffff8e2303c4c540 2232759088 S Ii:2:008:1 -115:1 8 <
ffff8e2303c4c540 2232767039 C Ii:2:008:1 0:1 7 = 0200ceff fd0000
ffff8e2303c4c540 2232767061 S Ii:2:008:1 -115:1 8 <
ffff8e2303c4c540 2232775040 C Ii:2:008:1 0:1 7 = 0200c1bf fd0000
ffff8e2303c4c540 2232775060 S Ii:2:008:1 -115:1 8 <
ffff8e2303c4c540 2232783050 C Ii:2:008:1 0:1 7 = 0200b77f fd0000
ffff8e2303c4c540 2232783072 S Ii:2:008:1 -115:1 8 <
ffff8e2303c4c540 2232791053 C Ii:2:008:1 0:1 7 = 0200ad5f fd0000
ffff8e2303c4c540 2232791075 S Ii:2:008:1 -115:1 8 <
ffff8e2303c4c540 2232799056 C Ii:2:008:1 0:1 7 = 0200a64f fd0000
ffff8e2303c4c540 2232799076 S Ii:2:008:1 -115:1 8 <
ffff8e2303c4c540 2232807044 C Ii:2:008:1 0:1 7 = 0200a16f fd0000
ffff8e2303c4c540 2232807066 S Ii:2:008:1 -115:1 8 <
ffff8e2303c4c540 2232815040 C Ii:2:008:1 0:1 7 = 02009f9f fd0000
ffff8e2303c4c540 2232815061 S Ii:2:008:1 -115:1 8 <
ffff8e2303c4c540 2232823050 C Ii:2:008:1 0:1 7 = 02009ddf fd0000
ffff8e2303c4c540 2232823071 S Ii:2:008:1 -115:1 8 <
ffff8e2303c4c540 2232831048 C Ii:2:008:1 0:1 7 = 02009c0f fe0000
ffff8e2303c4c540 2232831069 S Ii:2:008:1 -115:1 8 <
ffff8e2303c4c540 2232839051 C Ii:2:008:1 0:1 7 = 02009c3f fe0000
ffff8e2303c4c540 2232839072 S Ii:2:008:1 -115:1 8 <
ffff8e2303c4c540 2232846041 C Ii:2:008:1 0:1 7 = 02009b5f fe0000
ffff8e2303c4c540 2232846061 S Ii:2:008:1 -115:1 8 <
ffff8e2303c4c540 2232854056 C Ii:2:008:1 0:1 7 = 0200999f fe0000
ffff8e2303c4c540 2232854078 S Ii:2:008:1 -115:1 8 <
ffff8e2303c4c540 2232862054 C Ii:2:008:1 0:1 7 = 020096cf fe0000
ffff8e2303c4c540 2232862091 S Ii:2:008:1 -115:1 8 <
ffff8e2303c4c540 2232870053 C Ii:2:008:1 0:1 7 = 020094ff fe0000
ffff8e2303c4c540 2232870076 S Ii:2:008:1 -115:1 8 <
ffff8e2303c4c540 2232878020 C Ii:2:008:1 0:1 7 = 0200941f ff0000
ffff8e2303c4c540 2232878039 S Ii:2:008:1 -115:1 8 <
ffff8e2303c4c540 2232886060 C Ii:2:008:1 0:1 7 = 0200964f ff0000
ffff8e2303c4c540 2232886080 S Ii:2:008:1 -115:1 8 <
ffff8e2303c4c540 2232894051 C Ii:2:008:1 0:1 7 = 0200995f ff0000
ffff8e2303c4c540 2232894073 S Ii:2:008:1 -115:1 8 <
ffff8e2303c4c540 2232902052 C Ii:2:008:1 0:1 7 = 02009f9f ff0000
ffff8e2303c4c540 2232902072 S Ii:2:008:1 -115:1 8 <
ffff8e2303c4c540 2232910045 C Ii:2:008:1 0:1 7 = 0200a5af ff0000
ffff8e2303c4c540 2232910070 S Ii:2:008:1 -115:1 8 <
ffff8e2303c4c540 2232918055 C Ii:2:008:1 0:1 7 = 0200addf ff0000
ffff8e2303c4c540 2232918076 S Ii:2:008:1 -115:1 8 <
ffff8e2303c4c540 2232926041 C Ii:2:008:1 0:1 7 = 0200b5ff ff0000
ffff8e2303c4c540 2232926063 S Ii:2:008:1 -115:1 8 <
ffff8e2303c4c540 2232934019 C Ii:2:008:1 0:1 7 = 0200bd1f 000000
ffff8e2303c4c540 2232934054 S Ii:2:008:1 -115:1 8 <
ffff8e2303c4c540 2232942017 C Ii:2:008:1 0:1 7 = 0200c46f 000000
ffff8e2303c4c540 2232942050 S Ii:2:008:1 -115:1 8 <
ffff8e2303c4c540 2232950041 C Ii:2:008:1 0:1 7 = 0200cb8f 000000
ffff8e2303c4c540 2232950066 S Ii:2:008:1 -115:1 8 <
ffff8e2303c4c540 2232958050 C Ii:2:008:1 0:1 7 = 0200d3cf 000000
ffff8e2303c4c540 2232958077 S Ii:2:008:1 -115:1 8 <
ffff8e2303c4c540 2232966054 C Ii:2:008:1 0:1 7 = 0200d9ff 000000
ffff8e2303c4c540 2232966087 S Ii:2:008:1 -115:1 8 <
ffff8e2303c4c540 2232974051 C Ii:2:008:1 0:1 7 = 0200e00f 010000
ffff8e2303c4c540 2232974077 S Ii:2:008:1 -115:1 8 <
ffff8e2303c4c540 2232982062 C Ii:2:008:1 0:1 7 = 0200e70f 010000
ffff8e2303c4c540 2232982081 S Ii:2:008:1 -115:1 8 <
ffff8e2303c4c540 2232990059 C Ii:2:008:1 0:1 7 = 0200f0ef 000000
ffff8e2303c4c540 2232990075 S Ii:2:008:1 -115:1 8 <
ffff8e2303c4c540 2232998057 C Ii:2:008:1 0:1 7 = 0200f7af 000000
ffff8e2303c4c540 2232998073 S Ii:2:008:1 -115:1 8 <
ffff8e2303c4c540 2233006062 C Ii:2:008:1 0:1 7 = 0200fd7f 000000
ffff8e2303c4c540 2233006078 S Ii:2:008:1 -115:1 8 <
ffff8e2303c4c540 2233014069 C Ii:2:008:1 0:1 7 = 02000030 000000
ffff8e2303c4c540 2233014084 S Ii:2:008:1 -115:1 8 <
ffff8e2303c4c540 2233022039 C Ii:2:008:1 0:1 7 = 02000020 000000
ffff8e2303c4c540 2233022060 S Ii:2:008:1 -115:1 8 <
ffff8e2303c4c540 2233030053 C Ii:2:008:1 0:1 7 = 02000010 000000
ffff8e2303c4c540 2233030069 S Ii:2:008:1 -115:1 8 <
ffff8e2303c4c540 2233038054 C Ii:2:008:1 0:1 7 = 02000010 000000
ffff8e2303c4c540 2233038070 S Ii:2:008:1 -115:1 8 <
ffff8e2303c4c540 2233062042 C Ii:2:008:1 0:1 7 = 02000020 000000
ffff8e2303c4c540 2233062059 S Ii:2:008:1 -115:1 8 <
ffff8e2303c4c540 2233070044 C Ii:2:008:1 0:1 7 = 02000010 000000
ffff8e2303c4c540 2233070060 S Ii:2:008:1 -115:1 8 <
ffff8e2303c4c540 2233078058 C Ii:2:008:1 0:1 7 = 02000330 000000
ffff8e2303c4c540 2233078074 S Ii:2:008:1 -115:1 8 <
ffff8e2303c4c540 2233086050 C Ii:2:008:1 0:1 7 = 02000330 000000
ffff8e2303c4c540 2233086067 S Ii:2:008:1 -115:1 8 <
ffff8e2303c4c540 2233094040 C Ii:2:008:1 0:1 7 = 02000330 000000
ffff8e2303c4c540 2233094056 S Ii:2:008:1 -115:1 8 <
ffff8e2303c4c540 2233102063 C Ii:2:008:1 0:1 7 = 02000430 000000
ffff8e2303c4c540 2233102081 S Ii:2:008:1 -115:1 8 <
ffff8e2303c4c540 2233110046 C Ii:2:008:1 0:1 7 = 02000130 00ff00
ffff8e2303c4c540 2233110062 S Ii:2:008:1 -115:1 8 <
ffff8e2303c4c540 2233118067 C Ii:2:008:1 0:1 7 = 02000250 000000
ffff8e2303c4c540 2233118084 S Ii:2:008:1 -115:1 8 <
ffff8e2303c4c540 2233126051 C Ii:2:008:1 0:1 7 = 02000250 00ff00
ffff8e2303c4c540 2233126069 S Ii:2:008:1 -115:1 8 <
ffff8e2303c4c540 2233134053 C Ii:2:008:1 0:1 7 = 02000150 000000
ffff8e2303c4c540 2233134069 S Ii:2:008:1 -115:1 8 <
ffff8e2303c4c540 2233142051 C Ii:2:008:1 0:1 7 = 02000150 000000
ffff8e2303c4c540 2233142068 S Ii:2:008:1 -115:1 8 <
ffff8e2303c4c540 2233150051 C Ii:2:008:1 0:1 7 = 02000140 000000
ffff8e2303c4c540 2233150069 S Ii:2:008:1 -115:1 8 <
ffff8e2303c4c540 2233158053 C Ii:2:008:1 0:1 7 = 02000020 00ff00
ffff8e2303c4c540 2233158069 S Ii:2:008:1 -115:1 8 <
ffff8e2303c4c540 2233166049 C Ii:2:008:1 0:1 7 = 02000010 000000
ffff8e2303c4c540 2233166080 S Ii:2:008:1 -115:1 8 <
ffff8e2303c4c540 2233174052 C Ii:2:008:1 0:1 7 = 02000000 00ff00
ffff8e2303c4c540 2233174069 S Ii:2:008:1 -115:1 8 <
ffff8e2303c4c540 2233182052 C Ii:2:008:1 0:1 7 = 02000000 00ff00
ffff8e2303c4c540 2233182069 S Ii:2:008:1 -115:1 8 <
ffff8e2303c4c540 2233302053 C Ii:2:008:1 0:1 7 = 02000020 000000
ffff8e2303c4c540 2233302069 S Ii:2:008:1 -115:1 8 <
ffff8e2303c4c540 2233310042 C Ii:2:008:1 0:1 7 = 0200ff2f 000000
ffff8e2303c4c540 2233310058 S Ii:2:008:1 -115:1 8 <
ffff8e2303c4c540 2233318042 C Ii:2:008:1 0:1 7 = 0200ff2f 000000
ffff8e2303c4c540 2233318059 S Ii:2:008:1 -115:1 8 <
ffff8e2303c4c540 2233326043 C Ii:2:008:1 0:1 7 = 02000030 000000
ffff8e2303c4c540 2233326059 S Ii:2:008:1 -115:1 8 <
ffff8e2303c4c540 2233334044 C Ii:2:008:1 0:1 7 = 0200ff1f 000000
ffff8e2303c4c540 2233334061 S Ii:2:008:1 -115:1 8 <
ffff8e2303c4c540 2233342053 C Ii:2:008:1 0:1 7 = 0200fe2f 000000
ffff8e2303c4c540 2233342071 S Ii:2:008:1 -115:1 8 <
ffff8e2303c4c540 2233350057 C Ii:2:008:1 0:1 7 = 0200ff4f 000000
ffff8e2303c4c540 2233350074 S Ii:2:008:1 -115:1 8 <
ffff8e2303c4c540 2233358045 C Ii:2:008:1 0:1 7 = 0200fe4f 000000
ffff8e2303c4c540 2233358063 S Ii:2:008:1 -115:1 8 <
ffff8e2303c4c540 2233366042 C Ii:2:008:1 0:1 7 = 0200ff4f 000000
ffff8e2303c4c540 2233366059 S Ii:2:008:1 -115:1 8 <
ffff8e2303c4c540 2233374053 C Ii:2:008:1 0:1 7 = 02000060 000000
ffff8e2303c4c540 2233374069 S Ii:2:008:1 -115:1 8 <
ffff8e2303c4c540 2233382053 C Ii:2:008:1 0:1 7 = 02000060 000000
ffff8e2303c4c540 2233382069 S Ii:2:008:1 -115:1 8 <
ffff8e2303c4c540 2233390060 C Ii:2:008:1 0:1 7 = 02000090 000000
ffff8e2303c4c540 2233390076 S Ii:2:008:1 -115:1 8 <
ffff8e2303c4c540 2233398026 C Ii:2:008:1 0:1 7 = 020001c0 000000
ffff8e2303c4c540 2233398042 S Ii:2:008:1 -115:1 8 <
ffff8e2303c4c540 2233406064 C Ii:2:008:1 0:1 7 = 020003c0 000000
ffff8e2303c4c540 2233406080 S Ii:2:008:1 -115:1 8 <
ffff8e2303c4c540 2233414044 C Ii:2:008:1 0:1 7 = 020003e0 000000
ffff8e2303c4c540 2233414061 S Ii:2:008:1 -115:1 8 <
ffff8e2303c4c540 2233422065 C Ii:2:008:1 0:1 7 = 020007f0 000000
ffff8e2303c4c540 2233422082 S Ii:2:008:1 -115:1 8 <
ffff8e2303c4c540 2233430043 C Ii:2:008:1 0:1 7 = 02000800 010000
ffff8e2303c4c540 2233430059 S Ii:2:008:1 -115:1 8 <
ffff8e2303c4c540 2233438050 C Ii:2:008:1 0:1 7 = 02000b40 010000
ffff8e2303c4c540 2233438067 S Ii:2:008:1 -115:1 8 <
ffff8e2303c4c540 2233446041 C Ii:2:008:1 0:1 7 = 02000d50 010000
ffff8e2303c4c540 2233446058 S Ii:2:008:1 -115:1 8 <
ffff8e2303c4c540 2233454060 C Ii:2:008:1 0:1 7 = 02000c40 010000
ffff8e2303c4c540 2233454077 S Ii:2:008:1 -115:1 8 <
ffff8e2303c4c540 2233462060 C Ii:2:008:1 0:1 7 = 02000b20 010000
ffff8e2303c4c540 2233462077 S Ii:2:008:1 -115:1 8 <
ffff8e2303c4c540 2233470068 C Ii:2:008:1 0:1 7 = 020008e0 000000
ffff8e2303c4c540 2233470084 S Ii:2:008:1 -115:1 8 <
ffff8e2303c4c540 2233478048 C Ii:2:008:1 0:1 7 = 02000590 000000
ffff8e2303c4c540 2233478065 S Ii:2:008:1 -115:1 8 <
ffff8e2303c4c540 2233486059 C Ii:2:008:1 0:1 7 = 02000260 000000
ffff8e2303c4c540 2233486074 S Ii:2:008:1 -115:1 8 <
ffff8e2303c4c540 2233494055 C Ii:2:008:1 0:1 7 = 02000020 000000
ffff8e2303c4c540 2233494071 S Ii:2:008:1 -115:1 8 <
ffff8e2303c4c540 2233502066 C Ii:2:008:1 0:1 7 = 02000010 000000
ffff8e2303c4c540 2233502081 S Ii:2:008:1 -115:1 8 <
ffff8e2303c4c540 2233518052 C Ii:2:008:1 0:1 7 = 02000010 000000
ffff8e2303c4c540 2233518068 S Ii:2:008:1 -115:1 8 <
ffff8e2303c4c540 2233526046 C Ii:2:008:1 0:1 7 = 02000020 000000
ffff8e2303c4c540 2233526076 S Ii:2:008:1 -115:1 8 <
ffff8e2303c4c540 2233534066 C Ii:2:008:1 0:1 7 = 02000010 000000
ffff8e2303c4c540 2233534081 S Ii:2:008:1 -115:1 8 <
ffff8e2303c4c540 2233542026 C Ii:2:008:1 0:1 7 = 02000020 000000
ffff8e2303c4c540 2233542042 S Ii:2:008:1 -115:1 8 <
ffff8e2303c4c540 2233574051 C Ii:2:008:1 0:1 7 = 02000210 000000
ffff8e2303c4c540 2233574067 S Ii:2:008:1 -115:1 8 <
ffff8e2303c4c540 2233582033 C Ii:2:008:1 0:1 7 = 020003e0 ff0000
ffff8e2303c4c540 2233582050 S Ii:2:008:1 -115:1 8 <
ffff8e2303c4c540 2233590059 C Ii:2:008:1 0:1 7 = 020004c0 ff0000
ffff8e2303c4c540 2233590075 S Ii:2:008:1 -115:1 8 <
ffff8e2303c4c540 2233598043 C Ii:2:008:1 0:1 7 = 020004c0 ff0000
ffff8e2303c4c540 2233598060 S Ii:2:008:1 -115:1 8 <
ffff8e2303c4c540 2233606056 C Ii:2:008:1 0:1 7 = 020003a0 ff0000
ffff8e2303c4c540 2233606073 S Ii:2:008:1 -115:1 8 <
ffff8e2303c4c540 2233614042 C Ii:2:008:1 0:1 7 = 020003c0 ff0000
ffff8e2303c4c540 2233614059 S Ii:2:008:1 -115:1 8 <
ffff8e2303c4c540 2233622064 C Ii:2:008:1 0:1 7 = 020002d0 ff0000
ffff8e2303c4c540 2233622080 S Ii:2:008:1 -115:1 8 <
ffff8e2303c4c540 2233630046 C Ii:2:008:1 0:1 7 = 020001e0 ff0000
ffff8e2303c4c540 2233630063 S Ii:2:008:1 -115:1 8 <
ffff8e2303c4c540 2233638047 C Ii:2:008:1 0:1 7 = 020001d0 ff0000
ffff8e2303c4c540 2233638064 S Ii:2:008:1 -115:1 8 <
ffff8e2303c4c540 2233646044 C Ii:2:008:1 0:1 7 = 020002a0 ff0000
ffff8e2303c4c540 2233646061 S Ii:2:008:1 -115:1 8 <
ffff8e2303c4c540 2233654050 C Ii:2:008:1 0:1 7 = 02000370 ff0000
ffff8e2303c4c540 2233654067 S Ii:2:008:1 -115:1 8 <
ffff8e2303c4c540 2233662052 C Ii:2:008:1 0:1 7 = 02000360 ff0000
ffff8e2303c4c540 2233662068 S Ii:2:008:1 -115:1 8 <
ffff8e2303c4c540 2233670054 C Ii:2:008:1 0:1 7 = 02000340 ff0000
ffff8e2303c4c540 2233670071 S Ii:2:008:1 -115:1 8 <
ffff8e2303c4c540 2233678045 C Ii:2:008:1 0:1 7 = 02000350 ff0000
ffff8e2303c4c540 2233678062 S Ii:2:008:1 -115:1 8 <
ffff8e2303c4c540 2233686043 C Ii:2:008:1 0:1 7 = 02000130 ff0000
ffff8e2303c4c540 2233686059 S Ii:2:008:1 -115:1 8 <
ffff8e2303c4c540 2233694043 C Ii:2:008:1 0:1 7 = 02000120 ff0000
ffff8e2303c4c540 2233694060 S Ii:2:008:1 -115:1 8 <
ffff8e2303c4c540 2233702053 C Ii:2:008:1 0:1 7 = 02000020 ff0000
ffff8e2303c4c540 2233702070 S Ii:2:008:1 -115:1 8 <
ffff8e2303c4c540 2233710053 C Ii:2:008:1 0:1 7 = 02000010 ff0000
ffff8e2303c4c540 2233710074 S Ii:2:008:1 -115:1 8 <
ffff8e2303c4c540 2233718056 C Ii:2:008:1 0:1 7 = 02000030 ff0000
ffff8e2303c4c540 2233718073 S Ii:2:008:1 -115:1 8 <
ffff8e2303c4c540 2233726044 C Ii:2:008:1 0:1 7 = 02000040 ff0000
ffff8e2303c4c540 2233726062 S Ii:2:008:1 -115:1 8 <
ffff8e2303c4c540 2233734050 C Ii:2:008:1 0:1 7 = 02000030 ff0000
ffff8e2303c4c540 2233734066 S Ii:2:008:1 -115:1 8 <
ffff8e2303c4c540 2233742052 C Ii:2:008:1 0:1 7 = 0200ff3f ff0000
ffff8e2303c4c540 2233742068 S Ii:2:008:1 -115:1 8 <
ffff8e2303c4c540 2233750056 C Ii:2:008:1 0:1 7 = 0200ff2f ff0000
ffff8e2303c4c540 2233750072 S Ii:2:008:1 -115:1 8 <
ffff8e2303c4c540 2233758062 C Ii:2:008:1 0:1 7 = 0200fd1f ff0000
ffff8e2303c4c540 2233758079 S Ii:2:008:1 -115:1 8 <
ffff8e2303c4c540 2233766043 C Ii:2:008:1 0:1 7 = 0200fd1f ff0000
ffff8e2303c4c540 2233766059 S Ii:2:008:1 -115:1 8 <
ffff8e2303c4c540 2233774066 C Ii:2:008:1 0:1 7 = 0200fe1f ff0000
ffff8e2303c4c540 2233774083 S Ii:2:008:1 -115:1 8 <
ffff8e2303c4c540 2233782054 C Ii:2:008:1 0:1 7 = 0200fe3f ff0000
ffff8e2303c4c540 2233782070 S Ii:2:008:1 -115:1 8 <
ffff8e2303c4c540 2233790054 C Ii:2:008:1 0:1 7 = 0200fe6f ff0000
ffff8e2303c4c540 2233790071 S Ii:2:008:1 -115:1 8 <
ffff8e2303c4c540 2233798048 C Ii:2:008:1 0:1 7 = 0200fd7f ff0000
ffff8e2303c4c540 2233798065 S Ii:2:008:1 -115:1 8 <
ffff8e2303c4c540 2233806053 C Ii:2:008:1 0:1 7 = 0200fdaf ff0000
ffff8e2303c4c540 2233806070 S Ii:2:008:1 -115:1 8 <
ffff8e2303c4c540 2233814044 C Ii:2:008:1 0:1 7 = 0200fcaf ff0000
ffff8e2303c4c540 2233814061 S Ii:2:008:1 -115:1 8 <
ffff8e2303c4c540 2233822063 C Ii:2:008:1 0:1 7 = 0200fbbf ff0000
ffff8e2303c4c540 2233822080 S Ii:2:008:1 -115:1 8 <
ffff8e2303c4c540 2233830049 C Ii:2:008:1 0:1 7 = 0200fbcf ff0000
ffff8e2303c4c540 2233830066 S Ii:2:008:1 -115:1 8 <
ffff8e2303c4c540 2233838066 C Ii:2:008:1 0:1 7 = 0200fcdf ff0000
ffff8e2303c4c540 2233838083 S Ii:2:008:1 -115:1 8 <
ffff8e2303c4c540 2233846053 C Ii:2:008:1 0:1 7 = 0200fbef ff0000
ffff8e2303c4c540 2233846070 S Ii:2:008:1 -115:1 8 <
ffff8e2303c4c540 2233854067 C Ii:2:008:1 0:1 7 = 0200fcef ff0000
ffff8e2303c4c540 2233854082 S Ii:2:008:1 -115:1 8 <
ffff8e2303c4c540 2233862052 C Ii:2:008:1 0:1 7 = 0200fdef ff0000
ffff8e2303c4c540 2233862069 S Ii:2:008:1 -115:1 8 <
ffff8e2303c4c540 2233870069 C Ii:2:008:1 0:1 7 = 0200fdff ff0000
ffff8e2303c4c540 2233870084 S Ii:2:008:1 -115:1 8 <
ffff8e2303c4c540 2233878055 C Ii:2:008:1 0:1 7 = 0200ffef ff0000
ffff8e2303c4c540 2233878071 S Ii:2:008:1 -115:1 8 <
ffff8e2303c4c540 2233886046 C Ii:2:008:1 0:1 7 = 02000000 000100
ffff8e2303c4c540 2233886063 S Ii:2:008:1 -115:1 8 <
ffff8e2303c4c540 2233902073 C Ii:2:008:1 0:1 7 = 02000000 000100
ffff8e2303c4c540 2233902089 S Ii:2:008:1 -115:1 8 <
ffff8e2303c4c540 2233918057 C Ii:2:008:1 0:1 7 = 02000000 000100
ffff8e2303c4c540 2233918074 S Ii:2:008:1 -115:1 8 <
ffff8e2303c4c540 2233934054 C Ii:2:008:1 0:1 7 = 02000000 000100
ffff8e2303c4c540 2233934071 S Ii:2:008:1 -115:1 8 <
ffff8e2303c4c540 2233950047 C Ii:2:008:1 0:1 7 = 02000000 000100
ffff8e2303c4c540 2233950065 S Ii:2:008:1 -115:1 8 <
ffff8e2303c4c540 2233982052 C Ii:2:008:1 0:1 7 = 02000000 000100
ffff8e2303c4c540 2233982069 S Ii:2:008:1 -115:1 8 <
ffff8e2302151980 2234058094 S Bo:2:002:2 -115 31 = 55534243 a6050000 00000000 00000600 00000000 00000000 00000000 000000
ffff8e2302151980 2234058119 C Bo:2:002:2 0 31 >
ffff8e2302151980 2234058126 S Bi:2:002:1 -115 13 <
ffff8e2302151980 2234058163 C Bi:2:002:1 0 13 = 55534253 a6050000 00000000 00
ffff8e2303c4c540 2234166025 C Ii:2:008:1 0:1 7 = 02000040 000000
ffff8e2303c4c540 2234166041 S Ii:2:008:1 -115:1 8 <
ffff8e2303c4c540 2234174056 C Ii:2:008:1 0:1 7 = 02000070 000000
ffff8e2303c4c540 2234174072 S Ii:2:008:1 -115:1 8 <
ffff8e2303c4c540 2234182061 C Ii:2:008:1 0:1 7 = 02000090 000000
ffff8e2303c4c540 2234182078 S Ii:2:008:1 -115:1 8 <
ffff8e2303c4c540 2234190078 C Ii:2:008:1 0:1 7 = 020000d0 000000
ffff8e2303c4c540 2234190092 S Ii:2:008:1 -115:1 8 <
ffff8e2303c4c540 2234198022 C Ii:2:008:1 0:1 7 = 020000c0 000000
ffff8e2303c4c540 2234198039 S Ii:2:008:1 -115:1 8 <
ffff8e2303c4c540 2234206025 C Ii:2:008:1 0:1 7 = 020000e0 000000
ffff8e2303c4c540 2234206040 S Ii:2:008:1 -115:1 8 <
ffff8e2303c4c540 2234214050 C Ii:2:008:1 0:1 7 = 020001f0 000000
ffff8e2303c4c540 2234214066 S Ii:2:008:1 -115:1 8 <
ffff8e2303c4c540 2234222025 C Ii:2:008:1 0:1 7 = 020000e0 000000
ffff8e2303c4c540 2234222040 S Ii:2:008:1 -115:1 8 <
ffff8e2303c4c540 2234230047 C Ii:2:008:1 0:1 7 = 020001d0 000000
ffff8e2303c4c540 2234230066 S Ii:2:008:1 -115:1 8 <
ffff8e2303c4c540 2234238022 C Ii:2:008:1 0:1 7 = 020001b0 000000
ffff8e2303c4c540 2234238038 S Ii:2:008:1 -115:1 8 <
ffff8e2303c4c540 2234246033 C Ii:2:008:1 0:1 7 = 020000b0 000000
ffff8e2303c4c540 2234246048 S Ii:2:008:1 -115:1 8 <
ffff8e2303c4c540 2234254045 C Ii:2:008:1 0:1 7 = 020000a0 000000
ffff8e2303c4c540 2234254061 S Ii:2:008:1 -115:1 8 <
ffff8e2303c4c540 2234262066 C Ii:2:008:1 0:1 7 = 020000b0 000000
ffff8e2303c4c540 2234262082 S Ii:2:008:1 -115:1 8 <
ffff8e2303c4c540 2234270050 C Ii:2:008:1 0:1 7 = 020000c0 000000
ffff8e2303c4c540 2234270071 S Ii:2:008:1 -115:1 8 <
ffff8e2303c4c540 2234278030 C Ii:2:008:1 0:1 7 = 020000c0 000000
ffff8e2303c4c540 2234278048 S Ii:2:008:1 -115:1 8 <
ffff8e2303c4c540 2234286021 C Ii:2:008:1 0:1 7 = 020000b0 000000
ffff8e2303c4c540 2234286037 S Ii:2:008:1 -115:1 8 <
ffff8e2303c4c540 2234294026 C Ii:2:008:1 0:1 7 = 02000080 000000
ffff8e2303c4c540 2234294041 S Ii:2:008:1 -115:1 8 <
ffff8e2303c4c540 2234302054 C Ii:2:008:1 0:1 7 = 02000050 000000
ffff8e2303c4c540 2234302070 S Ii:2:008:1 -115:1 8 <
ffff8e2303c4c540 2234310063 C Ii:2:008:1 0:1 7 = 02000030 000000
ffff8e2303c4c540 2234310079 S Ii:2:008:1 -115:1 8 <
ffff8e2303c4c540 2234470047 C Ii:2:008:1 0:1 7 = 02000100 000000
ffff8e2303c4c540 2234470076 S Ii:2:008:1 -115:1 8 <
ffff8e2303c4c540 2234478053 C Ii:2:008:1 0:1 7 = 02000100 000000
ffff8e2303c4c540 2234478080 S Ii:2:008:1 -115:1 8 <
ffff8e2303c4c540 2234486055 C Ii:2:008:1 0:1 7 = 020002f0 ff0000
ffff8e2303c4c540 2234486082 S Ii:2:008:1 -115:1 8 <
ffff8e2303c4c540 2234494063 C Ii:2:008:1 0:1 7 = 020003e0 ff0000
ffff8e2303c4c540 2234494090 S Ii:2:008:1 -115:1 8 <
ffff8e2303c4c540 2234502017 C Ii:2:008:1 0:1 7 = 020003b0 ff0000
ffff8e2303c4c540 2234502035 S Ii:2:008:1 -115:1 8 <
ffff8e2303c4c540 2234510042 C Ii:2:008:1 0:1 7 = 020003b0 ff0000
ffff8e2303c4c540 2234510053 S Ii:2:008:1 -115:1 8 <
ffff8e2303c4c540 2234518064 C Ii:2:008:1 0:1 7 = 02000590 ff0000
ffff8e2303c4c540 2234518081 S Ii:2:008:1 -115:1 8 <
ffff8e2303c4c540 2234526059 C Ii:2:008:1 0:1 7 = 020003a0 ff0000
ffff8e2303c4c540 2234526087 S Ii:2:008:1 -115:1 8 <
ffff8e2303c4c540 2234534060 C Ii:2:008:1 0:1 7 = 020002b0 ff0000
ffff8e2303c4c540 2234534087 S Ii:2:008:1 -115:1 8 <
ffff8e2303c4c540 2234542066 C Ii:2:008:1 0:1 7 = 020002a0 ff0000
ffff8e2303c4c540 2234542093 S Ii:2:008:1 -115:1 8 <
ffff8e2303c4c540 2234550055 C Ii:2:008:1 0:1 7 = 020000a0 ff0000
ffff8e2303c4c540 2234550082 S Ii:2:008:1 -115:1 8 <
ffff8e2303c4c540 2234558069 C Ii:2:008:1 0:1 7 = 02000180 ff0000
ffff8e2303c4c540 2234558092 S Ii:2:008:1 -115:1 8 <
ffff8e2303c4c540 2234566063 C Ii:2:008:1 0:1 7 = 020001a0 ff0000
ffff8e2303c4c540 2234566086 S Ii:2:008:1 -115:1 8 <
ffff8e2303c4c540 2234574062 C Ii:2:008:1 0:1 7 = 020000a0 ff0000
ffff8e2303c4c540 2234574085 S Ii:2:008:1 -115:1 8 <
ffff8e2303c4c540 2234582063 C Ii:2:008:1 0:1 7 = 0200febf ff0000
ffff8e2303c4c540 2234582086 S Ii:2:008:1 -115:1 8 <
ffff8e2303c4c540 2234590020 C Ii:2:008:1 0:1 7 = 0200fdcf ff0000
ffff8e2303c4c540 2234590033 S Ii:2:008:1 -115:1 8 <
ffff8e2303c4c540 2234598029 C Ii:2:008:1 0:1 7 = 0200fddf ff0000
ffff8e2303c4c540 2234598048 S Ii:2:008:1 -115:1 8 <
ffff8e2303c4c540 2234606021 C Ii:2:008:1 0:1 7 = 0200fddf ff0000
ffff8e2303c4c540 2234606037 S Ii:2:008:1 -115:1 8 <
ffff8e2303c4c540 2234614058 C Ii:2:008:1 0:1 7 = 0200ffdf ff0000
ffff8e2303c4c540 2234614075 S Ii:2:008:1 -115:1 8 <
ffff8e2303c4c540 2234622067 C Ii:2:008:1 0:1 7 = 020000e0 ff0000
ffff8e2303c4c540 2234622084 S Ii:2:008:1 -115:1 8 <
ffff8e2303c4c540 2234630051 C Ii:2:008:1 0:1 7 = 020000f0 ff0000
ffff8e2303c4c540 2234630080 S Ii:2:008:1 -115:1 8 <
ffff8e2303c4c540 2234638026 C Ii:2:008:1 0:1 7 = 020000e0 ff0000
ffff8e2303c4c540 2234638046 S Ii:2:008:1 -115:1 8 <
ffff8e2303c4c540 2234646061 C Ii:2:008:1 0:1 7 = 020000f0 ff0000
ffff8e2303c4c540 2234646076 S Ii:2:008:1 -115:1 8 <
ffff8e2303c4c540 2234782024 C Ii:2:008:1 0:1 7 = 02010000 000000
ffff8e2303c4c540 2234782041 S Ii:2:008:1 -115:1 8 <
ffff8e2303c4c540 2234886054 C Ii:2:008:1 0:1 7 = 02000000 000000
ffff8e2303c4c540 2234886072 S Ii:2:008:1 -115:1 8 <
ffff8e2303c4c540 2235094061 C Ii:2:008:1 0:1 7 = 02000300 000000
ffff8e2303c4c540 2235094086 S Ii:2:008:1 -115:1 8 <
ffff8e2303c4c540 2235102064 C Ii:2:008:1 0:1 7 = 020008f0 ff0000
ffff8e2303c4c540 2235102081 S Ii:2:008:1 -115:1 8 <
ffff8e2303c4c540 2235110031 C Ii:2:008:1 0:1 7 = 020011f0 ff0000
ffff8e2303c4c540 2235110067 S Ii:2:008:1 -115:1 8 <
ffff8e2303c4c540 2235118082 C Ii:2:008:1 0:1 7 = 02001df0 ff0000
ffff8e2303c4c540 2235118098 S Ii:2:008:1 -115:1 8 <
ffff8e2303c4c540 2235126054 C Ii:2:008:1 0:1 7 = 020027d0 ff0000
ffff8e2303c4c540 2235126071 S Ii:2:008:1 -115:1 8 <
ffff8e2303c4c540 2235134030 C Ii:2:008:1 0:1 7 = 020030a0 ff0000
ffff8e2303c4c540 2235134046 S Ii:2:008:1 -115:1 8 <
ffff8e2303c4c540 2235142063 C Ii:2:008:1 0:1 7 = 02003590 ff0000
ffff8e2303c4c540 2235142079 S Ii:2:008:1 -115:1 8 <
ffff8e2303c4c540 2235150062 C Ii:2:008:1 0:1 7 = 02003b50 ff0000
ffff8e2303c4c540 2235150078 S Ii:2:008:1 -115:1 8 <
ffff8e2303c4c540 2235158071 C Ii:2:008:1 0:1 7 = 02004140 ff0000
ffff8e2303c4c540 2235158088 S Ii:2:008:1 -115:1 8 <
ffff8e2303c4c540 2235166049 C Ii:2:008:1 0:1 7 = 02004700 ff0000
ffff8e2303c4c540 2235166065 S Ii:2:008:1 -115:1 8 <
ffff8e2303c4c540 2235174084 C Ii:2:008:1 0:1 7 = 020050e0 fe0000
ffff8e2303c4c540 2235174100 S Ii:2:008:1 -115:1 8 <
ffff8e2303c4c540 2235181061 C Ii:2:008:1 0:1 7 = 020057c0 fe0000
ffff8e2303c4c540 2235181078 S Ii:2:008:1 -115:1 8 <
ffff8e2303c4c540 2235189058 C Ii:2:008:1 0:1 7 = 02005cc0 fe0000
ffff8e2303c4c540 2235189074 S Ii:2:008:1 -115:1 8 <
ffff8e2303c4c540 2235197050 C Ii:2:008:1 0:1 7 = 020061c0 fe0000
ffff8e2303c4c540 2235197068 S Ii:2:008:1 -115:1 8 <
ffff8e2303c4c540 2235205022 C Ii:2:008:1 0:1 7 = 020065d0 fe0000
ffff8e2303c4c540 2235205038 S Ii:2:008:1 -115:1 8 <
ffff8e2303c4c540 2235213056 C Ii:2:008:1 0:1 7 = 02006610 ff0000
ffff8e2303c4c540 2235213073 S Ii:2:008:1 -115:1 8 <
ffff8e2303c4c540 2235221049 C Ii:2:008:1 0:1 7 = 02006760 ff0000
ffff8e2303c4c540 2235221066 S Ii:2:008:1 -115:1 8 <
ffff8e2303c4c540 2235229083 C Ii:2:008:1 0:1 7 = 020068a0 ff0000
ffff8e2303c4c540 2235229100 S Ii:2:008:1 -115:1 8 <
ffff8e2303c4c540 2235237061 C Ii:2:008:1 0:1 7 = 02006bd0 ff0000
ffff8e2303c4c540 2235237078 S Ii:2:008:1 -115:1 8 <
ffff8e2303c4c540 2235245059 C Ii:2:008:1 0:1 7 = 02006d00 000000
ffff8e2303c4c540 2235245076 S Ii:2:008:1 -115:1 8 <
ffff8e2303c4c540 2235253051 C Ii:2:008:1 0:1 7 = 02007050 000000
ffff8e2303c4c540 2235253068 S Ii:2:008:1 -115:1 8 <
ffff8e2303c4c540 2235261022 C Ii:2:008:1 0:1 7 = 02007090 000000
ffff8e2303c4c540 2235261039 S Ii:2:008:1 -115:1 8 <
ffff8e2303c4c540 2235269060 C Ii:2:008:1 0:1 7 = 02006ed0 000000
ffff8e2303c4c540 2235269076 S Ii:2:008:1 -115:1 8 <
ffff8e2303c4c540 2235277058 C Ii:2:008:1 0:1 7 = 02006a20 010000
ffff8e2303c4c540 2235277074 S Ii:2:008:1 -115:1 8 <
ffff8e2303c4c540 2235285051 C Ii:2:008:1 0:1 7 = 02006650 010000
ffff8e2303c4c540 2235285069 S Ii:2:008:1 -115:1 8 <
ffff8e2303c4c540 2235293050 C Ii:2:008:1 0:1 7 = 02005fb0 010000
ffff8e2303c4c540 2235293066 S Ii:2:008:1 -115:1 8 <
ffff8e2303c4c540 2235301049 C Ii:2:008:1 0:1 7 = 020057e0 010000
ffff8e2303c4c540 2235301081 S Ii:2:008:1 -115:1 8 <
ffff8e2303c4c540 2235309061 C Ii:2:008:1 0:1 7 = 02004d00 020000
ffff8e2303c4c540 2235309078 S Ii:2:008:1 -115:1 8 <
ffff8e2303c4c540 2235317054 C Ii:2:008:1 0:1 7 = 02004200 020000
ffff8e2303c4c540 2235317071 S Ii:2:008:1 -115:1 8 <
ffff8e2303c4c540 2235325054 C Ii:2:008:1 0:1 7 = 02003800 020000
ffff8e2303c4c540 2235325071 S Ii:2:008:1 -115:1 8 <
ffff8e2303c4c540 2235333052 C Ii:2:008:1 0:1 7 = 02003010 020000
ffff8e2303c4c540 2235333068 S Ii:2:008:1 -115:1 8 <
ffff8e2303c4c540 2235341058 C Ii:2:008:1 0:1 7 = 02002940 020000
ffff8e2303c4c540 2235341074 S Ii:2:008:1 -115:1 8 <
ffff8e2303c4c540 2235349054 C Ii:2:008:1 0:1 7 = 02002450 020000
ffff8e2303c4c540 2235349070 S Ii:2:008:1 -115:1 8 <
ffff8e2303c4c540 2235357071 C Ii:2:008:1 0:1 7 = 02002080 020000
ffff8e2303c4c540 2235357093 S Ii:2:008:1 -115:1 8 <
ffff8e2303c4c540 2235365050 C Ii:2:008:1 0:1 7 = 02001ea0 020000
ffff8e2303c4c540 2235365066 S Ii:2:008:1 -115:1 8 <
ffff8e2303c4c540 2235373050 C Ii:2:008:1 0:1 7 = 02001cb0 020000
ffff8e2303c4c540 2235373079 S Ii:2:008:1 -115:1 8 <
ffff8e2303c4c540 2235381066 C Ii:2:008:1 0:1 7 = 02001aa0 020000
ffff8e2303c4c540 2235381082 S Ii:2:008:1 -115:1 8 <
ffff8e2303c4c540 2235389055 C Ii:2:008:1 0:1 7 = 02001880 020000
ffff8e2303c4c540 2235389082 S Ii:2:008:1 -115:1 8 <
ffff8e2303c4c540 2235397054 C Ii:2:008:1 0:1 7 = 02001630 020000
ffff8e2303c4c540 2235397081 S Ii:2:008:1 -115:1 8 <
ffff8e2303c4c540 2235405055 C Ii:2:008:1 0:1 7 = 020014b0 010000
ffff8e2303c4c540 2235405081 S Ii:2:008:1 -115:1 8 <
ffff8e2303c4c540 2235413057 C Ii:2:008:1 0:1 7 = 02001470 010000
ffff8e2303c4c540 2235413083 S Ii:2:008:1 -115:1 8 <
ffff8e2303c4c540 2235421059 C Ii:2:008:1 0:1 7 = 02001430 010000
ffff8e2303c4c540 2235421086 S Ii:2:008:1 -115:1 8 <
ffff8e2303c4c540 2235429060 C Ii:2:008:1 0:1 7 = 020016f0 000000
ffff8e2303c4c540 2235429087 S Ii:2:008:1 -115:1 8 <
ffff8e2303c4c540 2235437059 C Ii:2:008:1 0:1 7 = 020017f0 000000
ffff8e2303c4c540 2235437086 S Ii:2:008:1 -115:1 8 <
ffff8e2303c4c540 2235445051 C Ii:2:008:1 0:1 7 = 020019c0 000000
ffff8e2303c4c540 2235445077 S Ii:2:008:1 -115:1 8 <
ffff8e2303c4c540 2235453061 C Ii:2:008:1 0:1 7 = 02001a90 000000
ffff8e2303c4c540 2235453087 S Ii:2:008:1 -115:1 8 <
ffff8e2303c4c540 2235461052 C Ii:2:008:1 0:1 7 = 02001c90 000000
ffff8e2303c4c540 2235461080 S Ii:2:008:1 -115:1 8 <
ffff8e2303c4c540 2235469057 C Ii:2:008:1 0:1 7 = 02001c60 000000
ffff8e2303c4c540 2235469083 S Ii:2:008:1 -115:1 8 <
ffff8e2303c4c540 2235477060 C Ii:2:008:1 0:1 7 = 02001e60 000000
ffff8e2303c4c540 2235477087 S Ii:2:008:1 -115:1 8 <
ffff8e2303c4c540 2235485050 C Ii:2:008:1 0:1 7 = 02002040 000000
ffff8e2303c4c540 2235485077 S Ii:2:008:1 -115:1 8 <
ffff8e2303c4c540 2235493058 C Ii:2:008:1 0:1 7 = 02002340 000000
ffff8e2303c4c540 2235493083 S Ii:2:008:1 -115:1 8 <
ffff8e2303c4c540 2235501059 C Ii:2:008:1 0:1 7 = 02002730 000000
ffff8e2303c4c540 2235501086 S Ii:2:008:1 -115:1 8 <
ffff8e2303c4c540 2235509055 C Ii:2:008:1 0:1 7 = 02002730 000000
ffff8e2303c4c540 2235509082 S Ii:2:008:1 -115:1 8 <
ffff8e2303c4c540 2235517052 C Ii:2:008:1 0:1 7 = 02002720 000000
ffff8e2303c4c540 2235517079 S Ii:2:008:1 -115:1 8 <
ffff8e2303c4c540 2235525050 C Ii:2:008:1 0:1 7 = 02002420 000000
ffff8e2303c4c540 2235525077 S Ii:2:008:1 -115:1 8 <
ffff8e2303c4c540 2235533061 C Ii:2:008:1 0:1 7 = 02001e00 000000
ffff8e2303c4c540 2235533086 S Ii:2:008:1 -115:1 8 <
ffff8e2303c4c540 2235541060 C Ii:2:008:1 0:1 7 = 020016f0 ff0000
ffff8e2303c4c540 2235541086 S Ii:2:008:1 -115:1 8 <
ffff8e2303c4c540 2235549060 C Ii:2:008:1 0:1 7 = 02000ee0 ff0000
ffff8e2303c4c540 2235549086 S Ii:2:008:1 -115:1 8 <
ffff8e2303c4c540 2235557060 C Ii:2:008:1 0:1 7 = 020006d0 ff0000
ffff8e2303c4c540 2235557088 S Ii:2:008:1 -115:1 8 <
ffff8e2303c4c540 2235565052 C Ii:2:008:1 0:1 7 = 0200feaf ff0000
ffff8e2303c4c540 2235565079 S Ii:2:008:1 -115:1 8 <
ffff8e2303c4c540 2235573060 C Ii:2:008:1 0:1 7 = 0200f9af ff0000
ffff8e2303c4c540 2235573086 S Ii:2:008:1 -115:1 8 <
ffff8e2303c4c540 2235581060 C Ii:2:008:1 0:1 7 = 0200f67f ff0000
ffff8e2303c4c540 2235581085 S Ii:2:008:1 -115:1 8 <
ffff8e2303c4c540 2235589060 C Ii:2:008:1 0:1 7 = 0200f49f ff0000
ffff8e2303c4c540 2235589087 S Ii:2:008:1 -115:1 8 <
ffff8e2303c4c540 2235597058 C Ii:2:008:1 0:1 7 = 0200f5bf ff0000
ffff8e2303c4c540 2235597085 S Ii:2:008:1 -115:1 8 <
ffff8e2303c4c540 2235605053 C Ii:2:008:1 0:1 7 = 0200f9df ff0000
ffff8e2303c4c540 2235605080 S Ii:2:008:1 -115:1 8 <
ffff8e2303c4c540 2235613064 C Ii:2:008:1 0:1 7 = 0200fb0f 000000
ffff8e2303c4c540 2235613089 S Ii:2:008:1 -115:1 8 <
ffff8e2303c4c540 2235621064 C Ii:2:008:1 0:1 7 = 0200fdff ff0000
ffff8e2303c4c540 2235621090 S Ii:2:008:1 -115:1 8 <
ffff8e2303c4c540 2235629062 C Ii:2:008:1 0:1 7 = 0200fbff ff0000
ffff8e2303c4c540 2235629089 S Ii:2:008:1 -115:1 8 <
ffff8e2303c4c540 2235637056 C Ii:2:008:1 0:1 7 = 0200faff ff0000
ffff8e2303c4c540 2235637082 S Ii:2:008:1 -115:1 8 <
ffff8e2303c4c540 2235645052 C Ii:2:008:1 0:1 7 = 0200f90f 000000
ffff8e2303c4c540 2235645080 S Ii:2:008:1 -115:1 8 <
ffff8e2303c4c540 2235653065 C Ii:2:008:1 0:1 7 = 0200f70f 000000
ffff8e2303c4c540 2235653090 S Ii:2:008:1 -115:1 8 <
ffff8e2303c4c540 2235661055 C Ii:2:008:1 0:1 7 = 0200f40f 000000
ffff8e2303c4c540 2235661082 S Ii:2:008:1 -115:1 8 <
ffff8e2303c4c540 2235669061 C Ii:2:008:1 0:1 7 = 0200f20f 000000
ffff8e2303c4c540 2235669087 S Ii:2:008:1 -115:1 8 <
ffff8e2303c4c540 2235677057 C Ii:2:008:1 0:1 7 = 0200f2ff ff0000
ffff8e2303c4c540 2235677084 S Ii:2:008:1 -115:1 8 <
ffff8e2303c4c540 2235685051 C Ii:2:008:1 0:1 7 = 0200f1ff ff0000
ffff8e2303c4c540 2235685079 S Ii:2:008:1 -115:1 8 <
ffff8e2303c4c540 2235693063 C Ii:2:008:1 0:1 7 = 0200f0ff ff0000
ffff8e2303c4c540 2235693088 S Ii:2:008:1 -115:1 8 <
ffff8e2303c4c540 2235701027 C Ii:2:008:1 0:1 7 = 0200ef0f 000000
ffff8e2303c4c540 2235701059 S Ii:2:008:1 -115:1 8 <
ffff8e2303c4c540 2235709061 C Ii:2:008:1 0:1 7 = 0200edff ff0000
ffff8e2303c4c540 2235709087 S Ii:2:008:1 -115:1 8 <
ffff8e2303c4c540 2235717052 C Ii:2:008:1 0:1 7 = 0200edff ff0000
ffff8e2303c4c540 2235717079 S Ii:2:008:1 -115:1 8 <
ffff8e2303c4c540 2235725053 C Ii:2:008:1 0:1 7 = 0200edff ff0000
ffff8e2303c4c540 2235725081 S Ii:2:008:1 -115:1 8 <
ffff8e2303c4c540 2235733055 C Ii:2:008:1 0:1 7 = 0200ef0f 000000
ffff8e2303c4c540 2235733080 S Ii:2:008:1 -115:1 8 <
ffff8e2303c4c540 2235741056 C Ii:2:008:1 0:1 7 = 0200f10f 000000
ffff8e2303c4c540 2235741083 S Ii:2:008:1 -115:1 8 <
ffff8e2303c4c540 2235749058 C Ii:2:008:1 0:1 7 = 0200f50f 000000
ffff8e2303c4c540 2235749085 S Ii:2:008:1 -115:1 8 <
ffff8e2303c4c540 2235757054 C Ii:2:008:1 0:1 7 = 0200f80f 000000
ffff8e2303c4c540 2235757081 S Ii:2:008:1 -115:1 8 <
ffff8e2303c4c540 2235765054 C Ii:2:008:1 0:1 7 = 0200fb0f 000000
ffff8e2303c4c540 2235765080 S Ii:2:008:1 -115:1 8 <
ffff8e2303c4c540 2235773025 C Ii:2:008:1 0:1 7 = 0200fa0f 000000
ffff8e2303c4c540 2235773047 S Ii:2:008:1 -115:1 8 <
ffff8e2303c4c540 2235781060 C Ii:2:008:1 0:1 7 = 0200fa0f 000000
ffff8e2303c4c540 2235781086 S Ii:2:008:1 -115:1 8 <
ffff8e2303c4c540 2235789060 C Ii:2:008:1 0:1 7 = 0200f9df ff0000
ffff8e2303c4c540 2235789087 S Ii:2:008:1 -115:1 8 <
ffff8e2303c4c540 2235797060 C Ii:2:008:1 0:1 7 = 0200f6df ff0000
ffff8e2303c4c540 2235797088 S Ii:2:008:1 -115:1 8 <
ffff8e2303c4c540 2235805053 C Ii:2:008:1 0:1 7 = 0200f7bf ff0000
ffff8e2303c4c540 2235805080 S Ii:2:008:1 -115:1 8 <
ffff8e2303c4c540 2235813059 C Ii:2:008:1 0:1 7 = 0200f7cf ff0000
ffff8e2303c4c540 2235813083 S Ii:2:008:1 -115:1 8 <
ffff8e2303c4c540 2235821060 C Ii:2:008:1 0:1 7 = 0200f8cf ff0000
ffff8e2303c4c540 2235821086 S Ii:2:008:1 -115:1 8 <
ffff8e2303c4c540 2235829058 C Ii:2:008:1 0:1 7 = 0200f8df ff0000
ffff8e2303c4c540 2235829085 S Ii:2:008:1 -115:1 8 <
ffff8e2303c4c540 2235837061 C Ii:2:008:1 0:1 7 = 0200f9cf ff0000
ffff8e2303c4c540 2235837088 S Ii:2:008:1 -115:1 8 <
ffff8e2303c4c540 2235845052 C Ii:2:008:1 0:1 7 = 0200fbdf ff0000
ffff8e2303c4c540 2235845079 S Ii:2:008:1 -115:1 8 <
ffff8e2303c4c540 2235853061 C Ii:2:008:1 0:1 7 = 0200fbdf ff0000
ffff8e2303c4c540 2235853088 S Ii:2:008:1 -115:1 8 <
ffff8e2303c4c540 2235861056 C Ii:2:008:1 0:1 7 = 0200fcef ff0000
ffff8e2303c4c540 2235861084 S Ii:2:008:1 -115:1 8 <
ffff8e2303c4c540 2235869053 C Ii:2:008:1 0:1 7 = 0200fcef ff0000
ffff8e2303c4c540 2235869079 S Ii:2:008:1 -115:1 8 <
ffff8e2303c4c540 2235877060 C Ii:2:008:1 0:1 7 = 0200faff ff0000
ffff8e2303c4c540 2235877086 S Ii:2:008:1 -115:1 8 <
ffff8e2303c4c540 2235885052 C Ii:2:008:1 0:1 7 = 0200faff ff0000
ffff8e2303c4c540 2235885079 S Ii:2:008:1 -115:1 8 <
ffff8e2303c4c540 2235893077 C Ii:2:008:1 0:1 7 = 0200faff ff0000
ffff8e2303c4c540 2235893094 S Ii:2:008:1 -115:1 8 <
ffff8e2303c4c540 2235901061 C Ii:2:008:1 0:1 7 = 0200f9df ff0000
ffff8e2303c4c540 2235901078 S Ii:2:008:1 -115:1 8 <
ffff8e2303c4c540 2235909060 C Ii:2:008:1 0:1 7 = 0200f9df ff0000
ffff8e2303c4c540 2235909077 S Ii:2:008:1 -115:1 8 <
ffff8e2303c4c540 2235917060 C Ii:2:008:1 0:1 7 = 0200f8bf ff0000
ffff8e2303c4c540 2235917077 S Ii:2:008:1 -115:1 8 <
ffff8e2303c4c540 2235925056 C Ii:2:008:1 0:1 7 = 0200f5cf ff0000
ffff8e2303c4c540 2235925073 S Ii:2:008:1 -115:1 8 <
ffff8e2303c4c540 2235933061 C Ii:2:008:1 0:1 7 = 0200f3cf ff0000
ffff8e2303c4c540 2235933078 S Ii:2:008:1 -115:1 8 <
ffff8e2303c4c540 2235941061 C Ii:2:008:1 0:1 7 = 0200f3cf ff0000
ffff8e2303c4c540 2235941078 S Ii:2:008:1 -115:1 8 <
ffff8e2303c4c540 2235949060 C Ii:2:008:1 0:1 7 = 0200f3df ff0000
ffff8e2303c4c540 2235949077 S Ii:2:008:1 -115:1 8 <
ffff8e2303c4c540 2235957058 C Ii:2:008:1 0:1 7 = 0200f6ef ff0000
ffff8e2303c4c540 2235957076 S Ii:2:008:1 -115:1 8 <
ffff8e2303c4c540 2235965052 C Ii:2:008:1 0:1 7 = 0200f9ef ff0000
ffff8e2303c4c540 2235965069 S Ii:2:008:1 -115:1 8 <
ffff8e2303c4c540 2235973065 C Ii:2:008:1 0:1 7 = 0200fb0f 000000
ffff8e2303c4c540 2235973081 S Ii:2:008:1 -115:1 8 <
ffff8e2303c4c540 2235981062 C Ii:2:008:1 0:1 7 = 0200fcef ff0000
ffff8e2303c4c540 2235981079 S Ii:2:008:1 -115:1 8 <
ffff8e2303c4c540 2235989062 C Ii:2:008:1 0:1 7 = 0200feff ff0000
ffff8e2303c4c540 2235989079 S Ii:2:008:1 -115:1 8 <
ffff8e2303c4c540 2235997063 C Ii:2:008:1 0:1 7 = 0200feef ff0000
ffff8e2303c4c540 2235997079 S Ii:2:008:1 -115:1 8 <
ffff8e2303c4c540 2236005053 C Ii:2:008:1 0:1 7 = 0200feff ff0000
ffff8e2303c4c540 2236005071 S Ii:2:008:1 -115:1 8 <
ffff8e2303c4c540 2236013053 C Ii:2:008:1 0:1 7 = 0200ff0f 000000
ffff8e2303c4c540 2236013069 S Ii:2:008:1 -115:1 8 <
ffff8e2303c4c540 2236021060 C Ii:2:008:1 0:1 7 = 0200fe0f 000000
ffff8e2303c4c540 2236021077 S Ii:2:008:1 -115:1 8 <
ffff8e2303c4c540 2236029064 C Ii:2:008:1 0:1 7 = 0200fd0f 000000
ffff8e2303c4c540 2236029081 S Ii:2:008:1 -115:1 8 <
ffff8e2303c4c540 2236037063 C Ii:2:008:1 0:1 7 = 0200fdff ff0000
ffff8e2303c4c540 2236037081 S Ii:2:008:1 -115:1 8 <
ffff8e2303c4c540 2236045053 C Ii:2:008:1 0:1 7 = 0200fdef ff0000
ffff8e2303c4c540 2236045070 S Ii:2:008:1 -115:1 8 <
ffff8e2303c4c540 2236053054 C Ii:2:008:1 0:1 7 = 0200fddf ff0000
ffff8e2303c4c540 2236053071 S Ii:2:008:1 -115:1 8 <
ffff8e2303c4c540 2236061057 C Ii:2:008:1 0:1 7 = 0200ffff ff0000
ffff8e2303c4c540 2236061075 S Ii:2:008:1 -115:1 8 <
ffff8e2303c4c540 2236069057 C Ii:2:008:1 0:1 7 = 0200feef ff0000
ffff8e2303c4c540 2236069075 S Ii:2:008:1 -115:1 8 <
ffff8e2303c4c540 2236085052 C Ii:2:008:1 0:1 7 = 0200ff0f 000000
ffff8e2303c4c540 2236085069 S Ii:2:008:1 -115:1 8 <
ffff8e2302151980 2236106119 S Bo:2:002:2 -115 31 = 55534243 a7050000 00000000 00000600 00000000 00000000 00000000 000000
ffff8e2302151980 2236106157 C Bo:2:002:2 0 31 >
ffff8e2302151980 2236106166 S Bi:2:002:1 -115 13 <
ffff8e2302151980 2236106201 C Bi:2:002:1 0 13 = 55534253 a7050000 00000000 00
ffff8e2303c4c540 2236213060 C Ii:2:008:1 0:1 7 = 02000020 000000
ffff8e2303c4c540 2236213077 S Ii:2:008:1 -115:1 8 <
ffff8e2303c4c540 2236221063 C Ii:2:008:1 0:1 7 = 02000140 000000
ffff8e2303c4c540 2236221080 S Ii:2:008:1 -115:1 8 <
ffff8e2303c4c540 2236229060 C Ii:2:008:1 0:1 7 = 02000580 000000
ffff8e2303c4c540 2236229077 S Ii:2:008:1 -115:1 8 <
ffff8e2303c4c540 2236237055 C Ii:2:008:1 0:1 7 = 020007a0 000000
ffff8e2303c4c540 2236237072 S Ii:2:008:1 -115:1 8 <
ffff8e2303c4c540 2236245054 C Ii:2:008:1 0:1 7 = 02000ad0 000000
ffff8e2303c4c540 2236245070 S Ii:2:008:1 -115:1 8 <
ffff8e2303c4c540 2236253055 C Ii:2:008:1 0:1 7 = 02000df0 000000
ffff8e2303c4c540 2236253071 S Ii:2:008:1 -115:1 8 <
ffff8e2303c4c540 2236261057 C Ii:2:008:1 0:1 7 = 02000e00 010000
ffff8e2303c4c540 2236261075 S Ii:2:008:1 -115:1 8 <
ffff8e2303c4c540 2236269061 C Ii:2:008:1 0:1 7 = 02001130 010000
ffff8e2303c4c540 2236269077 S Ii:2:008:1 -115:1 8 <
ffff8e2303c4c540 2236277054 C Ii:2:008:1 0:1 7 = 02001150 010000
ffff8e2303c4c540 2236277072 S Ii:2:008:1 -115:1 8 <
ffff8e2303c4c540 2236285053 C Ii:2:008:1 0:1 7 = 02001470 010000
ffff8e2303c4c540 2236285070 S Ii:2:008:1 -115:1 8 <
ffff8e2303c4c540 2236293056 C Ii:2:008:1 0:1 7 = 02001790 010000
ffff8e2303c4c540 2236293073 S Ii:2:008:1 -115:1 8 <
ffff8e2303c4c540 2236301062 C Ii:2:008:1 0:1 7 = 02001ba0 010000
ffff8e2303c4c540 2236301079 S Ii:2:008:1 -115:1 8 <
ffff8e2303c4c540 2236309060 C Ii:2:008:1 0:1 7 = 02001bb0 010000
ffff8e2303c4c540 2236309078 S Ii:2:008:1 -115:1 8 <
ffff8e2303c4c540 2236317057 C Ii:2:008:1 0:1 7 = 02001bb0 010000
ffff8e2303c4c540 2236317074 S Ii:2:008:1 -115:1 8 <
ffff8e2303c4c540 2236325054 C Ii:2:008:1 0:1 7 = 02001ac0 010000
ffff8e2303c4c540 2236325070 S Ii:2:008:1 -115:1 8 <
ffff8e2303c4c540 2236333056 C Ii:2:008:1 0:1 7 = 020018d0 010000
ffff8e2303c4c540 2236333072 S Ii:2:008:1 -115:1 8 <
ffff8e2303c4c540 2236341054 C Ii:2:008:1 0:1 7 = 020017e0 010000
ffff8e2303c4c540 2236341072 S Ii:2:008:1 -115:1 8 <
ffff8e2303c4c540 2236349058 C Ii:2:008:1 0:1 7 = 020017f0 010000
ffff8e2303c4c540 2236349074 S Ii:2:008:1 -115:1 8 <
ffff8e2303c4c540 2236357054 C Ii:2:008:1 0:1 7 = 020016e0 010000
ffff8e2303c4c540 2236357071 S Ii:2:008:1 -115:1 8 <
ffff8e2303c4c540 2236365057 C Ii:2:008:1 0:1 7 = 020013d0 010000
ffff8e2303c4c540 2236365073 S Ii:2:008:1 -115:1 8 <
ffff8e2303c4c540 2236373052 C Ii:2:008:1 0:1 7 = 020010b0 010000
ffff8e2303c4c540 2236373070 S Ii:2:008:1 -115:1 8 <
ffff8e2303c4c540 2236381074 C Ii:2:008:1 0:1 7 = 02000b90 010000
ffff8e2303c4c540 2236381091 S Ii:2:008:1 -115:1 8 <
ffff8e2303c4c540 2236389052 C Ii:2:008:1 0:1 7 = 02000950 010000
ffff8e2303c4c540 2236389069 S Ii:2:008:1 -115:1 8 <
ffff8e2303c4c540 2236397053 C Ii:2:008:1 0:1 7 = 02000740 010000
ffff8e2303c4c540 2236397071 S Ii:2:008:1 -115:1 8 <
ffff8e2303c4c540 2236405056 C Ii:2:008:1 0:1 7 = 02000820 010000
ffff8e2303c4c540 2236405073 S Ii:2:008:1 -115:1 8 <
ffff8e2303c4c540 2236413059 C Ii:2:008:1 0:1 7 = 02000810 010000
ffff8e2303c4c540 2236413076 S Ii:2:008:1 -115:1 8 <
ffff8e2303c4c540 2236421056 C Ii:2:008:1 0:1 7 = 02000910 010000
ffff8e2303c4c540 2236421074 S Ii:2:008:1 -115:1 8 <
ffff8e2303c4c540 2236429058 C Ii:2:008:1 0:1 7 = 02000a00 010000
ffff8e2303c4c540 2236429074 S Ii:2:008:1 -115:1 8 <
ffff8e2303c4c540 2236437054 C Ii:2:008:1 0:1 7 = 02000a00 010000
ffff8e2303c4c540 2236437072 S Ii:2:008:1 -115:1 8 <
ffff8e2303c4c540 2236445056 C Ii:2:008:1 0:1 7 = 02000b00 010000
ffff8e2303c4c540 2236445072 S Ii:2:008:1 -115:1 8 <
ffff8e2303c4c540 2236453067 C Ii:2:008:1 0:1 7 = 02000c00 010000
ffff8e2303c4c540 2236453083 S Ii:2:008:1 -115:1 8 <
ffff8e2303c4c540 2236461055 C Ii:2:008:1 0:1 7 = 02000d00 010000
ffff8e2303c4c540 2236461072 S Ii:2:008:1 -115:1 8 <
ffff8e2303c4c540 2236469064 C Ii:2:008:1 0:1 7 = 020011e0 000000
ffff8e2303c4c540 2236469081 S Ii:2:008:1 -115:1 8 <
ffff8e2303c4c540 2236477060 C Ii:2:008:1 0:1 7 = 020013e0 000000
ffff8e2303c4c540 2236477077 S Ii:2:008:1 -115:1 8 <
ffff8e2303c4c540 2236485057 C Ii:2:008:1 0:1 7 = 020015c0 000000
ffff8e2303c4c540 2236485074 S Ii:2:008:1 -115:1 8 <
ffff8e2303c4c540 2236493026 C Ii:2:008:1 0:1 7 = 02001ac0 000000
ffff8e2303c4c540 2236493042 S Ii:2:008:1 -115:1 8 <
ffff8e2303c4c540 2236501062 C Ii:2:008:1 0:1 7 = 02001cc0 000000
ffff8e2303c4c540 2236501080 S Ii:2:008:1 -115:1 8 <
ffff8e2303c4c540 2236509069 C Ii:2:008:1 0:1 7 = 02001ec0 000000
ffff8e2303c4c540 2236509085 S Ii:2:008:1 -115:1 8 <
ffff8e2303c4c540 2236517061 C Ii:2:008:1 0:1 7 = 02001eb0 000000
ffff8e2303c4c540 2236517078 S Ii:2:008:1 -115:1 8 <
ffff8e2303c4c540 2236525057 C Ii:2:008:1 0:1 7 = 02001eb0 000000
ffff8e2303c4c540 2236525075 S Ii:2:008:1 -115:1 8 <
ffff8e2303c4c540 2236533067 C Ii:2:008:1 0:1 7 = 02001fb0 000000
ffff8e2303c4c540 2236533083 S Ii:2:008:1 -115:1 8 <
ffff8e2303c4c540 2236541062 C Ii:2:008:1 0:1 7 = 020021a0 000000
ffff8e2303c4c540 2236541078 S Ii:2:008:1 -115:1 8 <
ffff8e2303c4c540 2236549067 C Ii:2:008:1 0:1 7 = 020025b0 000000
ffff8e2303c4c540 2236549084 S Ii:2:008:1 -115:1 8 <
ffff8e2303c4c540 2236557028 C Ii:2:008:1 0:1 7 = 020027c0 000000
ffff8e2303c4c540 2236557044 S Ii:2:008:1 -115:1 8 <
ffff8e2303c4c540 2236565067 C Ii:2:008:1 0:1 7 = 020028d0 000000
ffff8e2303c4c540 2236565084 S Ii:2:008:1 -115:1 8 <
ffff8e2303c4c540 2236573053 C Ii:2:008:1 0:1 7 = 020026e0 000000
ffff8e2303c4c540 2236573069 S Ii:2:008:1 -115:1 8 <
ffff8e2303c4c540 2236581060 C Ii:2:008:1 0:1 7 = 020023c0 000000
ffff8e2303c4c540 2236581076 S Ii:2:008:1 -115:1 8 <
ffff8e2303c4c540 2236589059 C Ii:2:008:1 0:1 7 = 020020a0 000000
ffff8e2303c4c540 2236589076 S Ii:2:008:1 -115:1 8 <
ffff8e2303c4c540 2236597067 C Ii:2:008:1 0:1 7 = 02001ca0 000000
ffff8e2303c4c540 2236597082 S Ii:2:008:1 -115:1 8 <
ffff8e2303c4c540 2236605055 C Ii:2:008:1 0:1 7 = 02001990 000000
ffff8e2303c4c540 2236605071 S Ii:2:008:1 -115:1 8 <
ffff8e2303c4c540 2236613056 C Ii:2:008:1 0:1 7 = 02001790 000000
ffff8e2303c4c540 2236613073 S Ii:2:008:1 -115:1 8 <
ffff8e2303c4c540 2236621057 C Ii:2:008:1 0:1 7 = 02001680 000000
ffff8e2303c4c540 2236621074 S Ii:2:008:1 -115:1 8 <
ffff8e2303c4c540 2236629056 C Ii:2:008:1 0:1 7 = 02001670 000000
ffff8e2303c4c540 2236629073 S Ii:2:008:1 -115:1 8 <
ffff8e2303c4c540 2236637065 C Ii:2:008:1 0:1 7 = 02001750 000000
ffff8e2303c4c540 2236637083 S Ii:2:008:1 -115:1 8 <
ffff8e2303c4c540 2236645063 C Ii:2:008:1 0:1 7 = 02001740 000000
ffff8e2303c4c540 2236645079 S Ii:2:008:1 -115:1 8 <
ffff8e2303c4c540 2236653056 C Ii:2:008:1 0:1 7 = 02001820 000000
ffff8e2303c4c540 2236653074 S Ii:2:008:1 -115:1 8 <
ffff8e2303c4c540 2236661063 C Ii:2:008:1 0:1 7 = 02001920 000000
ffff8e2303c4c540 2236661080 S Ii:2:008:1 -115:1 8 <
ffff8e2303c4c540 2236669060 C Ii:2:008:1 0:1 7 = 02001a00 000000
ffff8e2303c4c540 2236669076 S Ii:2:008:1 -115:1 8 <
ffff8e2303c4c540 2236677062 C Ii:2:008:1 0:1 7 = 02001a00 000000
ffff8e2303c4c540 2236677078 S Ii:2:008:1 -115:1 8 <
ffff8e2303c4c540 2236685063 C Ii:2:008:1 0:1 7 = 020017e0 ff0000
ffff8e2303c4c540 2236685081 S Ii:2:008:1 -115:1 8 <
ffff8e2303c4c540 2236693055 C Ii:2:008:1 0:1 7 = 020015a0 ff0000
ffff8e2303c4c540 2236693072 S Ii:2:008:1 -115:1 8 <
ffff8e2303c4c540 2236701065 C Ii:2:008:1 0:1 7 = 02001260 ff0000
ffff8e2303c4c540 2236701082 S Ii:2:008:1 -115:1 8 <
ffff8e2303c4c540 2236709064 C Ii:2:008:1 0:1 7 = 02000c70 ff0000
ffff8e2303c4c540 2236709080 S Ii:2:008:1 -115:1 8 <
ffff8e2303c4c540 2236717055 C Ii:2:008:1 0:1 7 = 02000c40 ff0000
ffff8e2303c4c540 2236717071 S Ii:2:008:1 -115:1 8 <
ffff8e2303c4c540 2236725076 C Ii:2:008:1 0:1 7 = 02000930 ff0000
ffff8e2303c4c540 2236725093 S Ii:2:008:1 -115:1 8 <
ffff8e2303c4c540 2236733065 C Ii:2:008:1 0:1 7 = 02000650 ff0000
ffff8e2303c4c540 2236733082 S Ii:2:008:1 -115:1 8 <
ffff8e2303c4c540 2236741064 C Ii:2:008:1 0:1 7 = 02000720 ff0000
ffff8e2303c4c540 2236741080 S Ii:2:008:1 -115:1 8 <
ffff8e2303c4c540 2236749067 C Ii:2:008:1 0:1 7 = 02000430 ff0000
ffff8e2303c4c540 2236749084 S Ii:2:008:1 -115:1 8 <
ffff8e2303c4c540 2236757060 C Ii:2:008:1 0:1 7 = 02000250 ff0000
ffff8e2303c4c540 2236757077 S Ii:2:008:1 -115:1 8 <
ffff8e2303c4c540 2236765058 C Ii:2:008:1 0:1 7 = 02000260 ff0000
ffff8e2303c4c540 2236765074 S Ii:2:008:1 -115:1 8 <
ffff8e2303c4c540 2236773057 C Ii:2:008:1 0:1 7 = 02000050 ff0000
ffff8e2303c4c540 2236773075 S Ii:2:008:1 -115:1 8 <
ffff8e2303c4c540 2236781026 C Ii:2:008:1 0:1 7 = 02000080 ff0000
ffff8e2303c4c540 2236781036 S Ii:2:008:1 -115:1 8 <
ffff8e2303c4c540 2236789064 C Ii:2:008:1 0:1 7 = 02000080 ff0000
ffff8e2303c4c540 2236789080 S Ii:2:008:1 -115:1 8 <
ffff8e2303c4c540 2236797061 C Ii:2:008:1 0:1 7 = 02000080 ff0000
ffff8e2303c4c540 2236797078 S Ii:2:008:1 -115:1 8 <
ffff8e2303c4c540 2236805061 C Ii:2:008:1 0:1 7 = 02000090 ff0000
ffff8e2303c4c540 2236805078 S Ii:2:008:1 -115:1 8 <
ffff8e2303c4c540 2236813055 C Ii:2:008:1 0:1 7 = 02000080 ff0000
ffff8e2303c4c540 2236813072 S Ii:2:008:1 -115:1 8 <
ffff8e2303c4c540 2236821064 C Ii:2:008:1 0:1 7 = 0200ff9f ff0000
ffff8e2303c4c540 2236821081 S Ii:2:008:1 -115:1 8 <
ffff8e2303c4c540 2236829066 C Ii:2:008:1 0:1 7 = 0200ffcf ff0000
ffff8e2303c4c540 2236829082 S Ii:2:008:1 -115:1 8 <
ffff8e2303c4c540 2236837067 C Ii:2:008:1 0:1 7 = 020000c0 ff0000
ffff8e2303c4c540 2236837083 S Ii:2:008:1 -115:1 8 <
ffff8e2303c4c540 2236845060 C Ii:2:008:1 0:1 7 = 0200fecf ff0000
ffff8e2303c4c540 2236845078 S Ii:2:008:1 -115:1 8 <
ffff8e2303c4c540 2236853057 C Ii:2:008:1 0:1 7 = 0200ffef ff0000
ffff8e2303c4c540 2236853074 S Ii:2:008:1 -115:1 8 <
ffff8e2303c4c540 2236861065 C Ii:2:008:1 0:1 7 = 020000d0 ff0000
ffff8e2303c4c540 2236861082 S Ii:2:008:1 -115:1 8 <
ffff8e2303c4c540 2236869064 C Ii:2:008:1 0:1 7 = 0200fedf ff0000
ffff8e2303c4c540 2236869080 S Ii:2:008:1 -115:1 8 <
ffff8e2303c4c540 2236877060 C Ii:2:008:1 0:1 7 = 0200ffef ff0000
ffff8e2303c4c540 2236877077 S Ii:2:008:1 -115:1 8 <
ffff8e2303c4c540 2236885064 C Ii:2:008:1 0:1 7 = 0200fddf ff0000
ffff8e2303c4c540 2236885081 S Ii:2:008:1 -115:1 8 <
ffff8e2303c4c540 2236893057 C Ii:2:008:1 0:1 7 = 0200fddf ff0000
ffff8e2303c4c540 2236893074 S Ii:2:008:1 -115:1 8 <
ffff8e2303c4c540 2236901058 C Ii:2:008:1 0:1 7 = 0200fdcf ff0000
ffff8e2303c4c540 2236901074 S Ii:2:008:1 -115:1 8 <
ffff8e2303c4c540 2236909063 C Ii:2:008:1 0:1 7 = 0200fcdf ff0000
ffff8e2303c4c540 2236909080 S Ii:2:008:1 -115:1 8 <
ffff8e2303c4c540 2236917061 C Ii:2:008:1 0:1 7 = 0200fbef ff0000
ffff8e2303c4c540 2236917078 S Ii:2:008:1 -115:1 8 <
ffff8e2303c4c540 2236925062 C Ii:2:008:1 0:1 7 = 0200fcef ff0000
ffff8e2303c4c540 2236925079 S Ii:2:008:1 -115:1 8 <
ffff8e2303c4c540 2236933057 C Ii:2:008:1 0:1 7 = 0200fcff ff0000
ffff8e2303c4c540 2236933074 S Ii:2:008:1 -115:1 8 <
ffff8e2303c4c540 2236941061 C Ii:2:008:1 0:1 7 = 0200fdff ff0000
ffff8e2303c4c540 2236941078 S Ii:2:008:1 -115:1 8 <
ffff8e2303c4c540 2236949062 C Ii:2:008:1 0:1 7 = 0200ffff ff0000
ffff8e2303c4c540 2236949079 S Ii:2:008:1 -115:1 8 <
ffff8e2303c4c540 2236957076 C Ii:2:008:1 0:1 7 = 0200ff0f 000000
ffff8e2303c4c540 2236957092 S Ii:2:008:1 -115:1 8 <
ffff8e2303c4c540 2237061061 C Ii:2:008:1 0:1 7 = 0200fd3f 000000
ffff8e2303c4c540 2237061079 S Ii:2:008:1 -115:1 8 <
ffff8e2303c4c540 2237069065 C Ii:2:008:1 0:1 7 = 0200fd3f 000000
ffff8e2303c4c540 2237069081 S Ii:2:008:1 -115:1 8 <
ffff8e2303c4c540 2237077061 C Ii:2:008:1 0:1 7 = 0200fc5f 000000
ffff8e2303c4c540 2237077078 S Ii:2:008:1 -115:1 8 <
ffff8e2303c4c540 2237085060 C Ii:2:008:1 0:1 7 = 0200fb7f 000000
ffff8e2303c4c540 2237085078 S Ii:2:008:1 -115:1 8 <
ffff8e2303c4c540 2237093059 C Ii:2:008:1 0:1 7 = 0200fb6f 000000
ffff8e2303c4c540 2237093075 S Ii:2:008:1 -115:1 8 <
ffff8e2303c4c540 2237101057 C Ii:2:008:1 0:1 7 = 0200fc6f 000000
ffff8e2303c4c540 2237101074 S Ii:2:008:1 -115:1 8 <
ffff8e2303c4c540 2237109058 C Ii:2:008:1 0:1 7 = 0200fa6f 000000
ffff8e2303c4c540 2237109075 S Ii:2:008:1 -115:1 8 <
ffff8e2303c4c540 2237117056 C Ii:2:008:1 0:1 7 = 0200fb4f 000000
ffff8e2303c4c540 2237117073 S Ii:2:008:1 -115:1 8 <
ffff8e2303c4c540 2237125054 C Ii:2:008:1 0:1 7 = 0200fd5f 000000
ffff8e2303c4c540 2237125071 S Ii:2:008:1 -115:1 8 <
ffff8e2303c4c540 2237133053 C Ii:2:008:1 0:1 7 = 0200fc5f 000000
ffff8e2303c4c540 2237133070 S Ii:2:008:1 -115:1 8 <
ffff8e2303c4c540 2237141062 C Ii:2:008:1 0:1 7 = 0200fe3f 000000
ffff8e2303c4c540 2237141079 S Ii:2:008:1 -115:1 8 <
ffff8e2303c4c540 2237149067 C Ii:2:008:1 0:1 7 = 0200fd4f 000000
ffff8e2303c4c540 2237149083 S Ii:2:008:1 -115:1 8 <
ffff8e2303c4c540 2237157064 C Ii:2:008:1 0:1 7 = 0200fd2f 000000
ffff8e2303c4c540 2237157081 S Ii:2:008:1 -115:1 8 <
ffff8e2303c4c540 2237165063 C Ii:2:008:1 0:1 7 = 0200fe2f 000000
ffff8e2303c4c540 2237165080 S Ii:2:008:1 -115:1 8 <
ffff8e2303c4c540 2237173061 C Ii:2:008:1 0:1 7 = 0200ff2f 000000
ffff8e2303c4c540 2237173078 S Ii:2:008:1 -115:1 8 <
ffff8e2303c4c540 2237181058 C Ii:2:008:1 0:1 7 = 0200ff0f 000000
ffff8e2303c4c540 2237181074 S Ii:2:008:1 -115:1 8 <
ffff8e2303c4c540 2237660069 C Ii:2:008:1 0:1 7 = 0200ff1f 000000
ffff8e2303c4c540 2237660086 S Ii:2:008:1 -115:1 8 <
ffff8e2303c4c540 2237668060 C Ii:2:008:1 0:1 7 = 0200ff1f 000000
ffff8e2303c4c540 2237668077 S Ii:2:008:1 -115:1 8 <
ffff8e2303c4c540 2237676059 C Ii:2:008:1 0:1 7 = 02000010 000000
ffff8e2303c4c540 2237676074 S Ii:2:008:1 -115:1 8 <
ffff8e2303c4c540 2237684070 C Ii:2:008:1 0:1 7 = 0200ff0f 000000
ffff8e2303c4c540 2237684087 S Ii:2:008:1 -115:1 8 <
ffff8e2303c4c540 2237972062 C Ii:2:008:1 0:1 7 = 0200ff1f 000000
ffff8e2303c4c540 2237972080 S Ii:2:008:1 -115:1 8 <
ffff8e2303c4c540 2237980062 C Ii:2:008:1 0:1 7 = 0200ff1f 000000
ffff8e2303c4c540 2237980078 S Ii:2:008:1 -115:1 8 <
ffff8e2303c4c540 2237988070 C Ii:2:008:1 0:1 7 = 02000010 000000
ffff8e2303c4c540 2237988086 S Ii:2:008:1 -115:1 8 <
ffff8e2303c4c540 2237996066 C Ii:2:008:1 0:1 7 = 0200ff0f 000000
ffff8e2303c4c540 2237996084 S Ii:2:008:1 -115:1 8 <
ffff8e2302151980 2238154126 S Bo:2:002:2 -115 31 = 55534243 a8050000 00000000 00000600 00000000 00000000 00000000 000000
ffff8e2302151980 2238154157 C Bo:2:002:2 0 31 >
ffff8e2302151980 2238154165 S Bi:2:002:1 -115 13 <
ffff8e2302151980 2238154202 C Bi:2:002:1 0 13 = 55534253 a8050000 00000000 00
ffff8e2303c4c540 2238188063 C Ii:2:008:1 0:1 7 = 02010000 000000
ffff8e2303c4c540 2238188082 S Ii:2:008:1 -115:1 8 <
ffff8e2303c4c540 2238244065 C Ii:2:008:1 0:1 7 = 02010010 000000
ffff8e2303c4c540 2238244081 S Ii:2:008:1 -115:1 8 <
ffff8e2303c4c540 2238252067 C Ii:2:008:1 0:1 7 = 02010020 000000
ffff8e2303c4c540 2238252084 S Ii:2:008:1 -115:1 8 <
ffff8e2303c4c540 2238260062 C Ii:2:008:1 0:1 7 = 02000010 000000
ffff8e2303c4c540 2238260080 S Ii:2:008:1 -115:1 8 <
ffff8e2303c4c540 2238268061 C Ii:2:008:1 0:1 7 = 02000020 000000
ffff8e2303c4c540 2238268088 S Ii:2:008:1 -115:1 8 <
ffff8e2303c4c540 2238332041 C Ii:2:008:1 0:1 7 = 0200fe2f 000000
ffff8e2303c4c540 2238332073 S Ii:2:008:1 -115:1 8 <
ffff8e2303c4c540 2238340039 C Ii:2:008:1 0:1 7 = 0200fc1f 000000
ffff8e2303c4c540 2238340066 S Ii:2:008:1 -115:1 8 <
ffff8e2303c4c540 2238348038 C Ii:2:008:1 0:1 7 = 0200f92f 000000
ffff8e2303c4c540 2238348061 S Ii:2:008:1 -115:1 8 <
ffff8e2303c4c540 2238356036 C Ii:2:008:1 0:1 7 = 0200f71f 000000
ffff8e2303c4c540 2238356065 S Ii:2:008:1 -115:1 8 <
ffff8e2303c4c540 2238364039 C Ii:2:008:1 0:1 7 = 0200f60f 000000
ffff8e2303c4c540 2238364062 S Ii:2:008:1 -115:1 8 <
ffff8e2303c4c540 2238372033 C Ii:2:008:1 0:1 7 = 0200f70f 000000
ffff8e2303c4c540 2238372061 S Ii:2:008:1 -115:1 8 <
ffff8e2303c4c540 2238380041 C Ii:2:008:1 0:1 7 = 0200f5ef ff0000
ffff8e2303c4c540 2238380065 S Ii:2:008:1 -115:1 8 <
ffff8e2303c4c540 2238388036 C Ii:2:008:1 0:1 7 = 0200f0cf ff0000
ffff8e2303c4c540 2238388066 S Ii:2:008:1 -115:1 8 <
ffff8e2303c4c540 2238396034 C Ii:2:008:1 0:1 7 = 0200e9af ff0000
ffff8e2303c4c540 2238396052 S Ii:2:008:1 -115:1 8 <
ffff8e2303c4c540 2238404034 C Ii:2:008:1 0:1 7 = 0200e38f ff0000
ffff8e2303c4c540 2238404053 S Ii:2:008:1 -115:1 8 <
ffff8e2303c4c540 2238412033 C Ii:2:008:1 0:1 7 = 0200dd5f ff0000
ffff8e2303c4c540 2238412049 S Ii:2:008:1 -115:1 8 <
ffff8e2303c4c540 2238420032 C Ii:2:008:1 0:1 7 = 0200d92f ff0000
ffff8e2303c4c540 2238420046 S Ii:2:008:1 -115:1 8 <
ffff8e2303c4c540 2238428035 C Ii:2:008:1 0:1 7 = 0200d61f ff0000
ffff8e2303c4c540 2238428055 S Ii:2:008:1 -115:1 8 <
ffff8e2303c4c540 2238436036 C Ii:2:008:1 0:1 7 = 0200d31f ff0000
ffff8e2303c4c540 2238436056 S Ii:2:008:1 -115:1 8 <
ffff8e2303c4c540 2238444033 C Ii:2:008:1 0:1 7 = 0200d00f ff0000
ffff8e2303c4c540 2238444046 S Ii:2:008:1 -115:1 8 <
ffff8e2303c4c540 2238452033 C Ii:2:008:1 0:1 7 = 0200d02f ff0000
ffff8e2303c4c540 2238452050 S Ii:2:008:1 -115:1 8 <
ffff8e2303c4c540 2238460031 C Ii:2:008:1 0:1 7 = 0200d01f ff0000
ffff8e2303c4c540 2238460054 S Ii:2:008:1 -115:1 8 <
ffff8e2303c4c540 2238468034 C Ii:2:008:1 0:1 7 = 0200cf1f ff0000
ffff8e2303c4c540 2238468054 S Ii:2:008:1 -115:1 8 <
ffff8e2303c4c540 2238476032 C Ii:2:008:1 0:1 7 = 0200d31f ff0000
ffff8e2303c4c540 2238476053 S Ii:2:008:1 -115:1 8 <
ffff8e2303c4c540 2238484036 C Ii:2:008:1 0:1 7 = 0200d73f ff0000
ffff8e2303c4c540 2238484057 S Ii:2:008:1 -115:1 8 <
ffff8e2303c4c540 2238492049 C Ii:2:008:1 0:1 7 = 0200dc5f ff0000
ffff8e2303c4c540 2238492067 S Ii:2:008:1 -115:1 8 <
ffff8e2303c4c540 2238500060 C Ii:2:008:1 0:1 7 = 0200e15f ff0000
ffff8e2303c4c540 2238500078 S Ii:2:008:1 -115:1 8 <
ffff8e2303c4c540 2238508036 C Ii:2:008:1 0:1 7 = 0200e36f ff0000
ffff8e2303c4c540 2238508051 S Ii:2:008:1 -115:1 8 <
ffff8e2303c4c540 2238516060 C Ii:2:008:1 0:1 7 = 0200e66f ff0000
ffff8e2303c4c540 2238516077 S Ii:2:008:1 -115:1 8 <
ffff8e2303c4c540 2238524061 C Ii:2:008:1 0:1 7 = 0200e75f ff0000
ffff8e2303c4c540 2238524076 S Ii:2:008:1 -115:1 8 <
ffff8e2303c4c540 2238532060 C Ii:2:008:1 0:1 7 = 0200e84f ff0000
ffff8e2303c4c540 2238532076 S Ii:2:008:1 -115:1 8 <
ffff8e2303c4c540 2238540061 C Ii:2:008:1 0:1 7 = 0200ea6f ff0000
ffff8e2303c4c540 2238540076 S Ii:2:008:1 -115:1 8 <
ffff8e2303c4c540 2238548063 C Ii:2:008:1 0:1 7 = 0200ec7f ff0000
ffff8e2303c4c540 2238548079 S Ii:2:008:1 -115:1 8 <
ffff8e2303c4c540 2238556060 C Ii:2:008:1 0:1 7 = 0200f08f ff0000
ffff8e2303c4c540 2238556077 S Ii:2:008:1 -115:1 8 <
ffff8e2303c4c540 2238564061 C Ii:2:008:1 0:1 7 = 0200f2af ff0000
ffff8e2303c4c540 2238564087 S Ii:2:008:1 -115:1 8 <
ffff8e2303c4c540 2238572061 C Ii:2:008:1 0:1 7 = 0200f4af ff0000
ffff8e2303c4c540 2238572086 S Ii:2:008:1 -115:1 8 <
ffff8e2303c4c540 2238580064 C Ii:2:008:1 0:1 7 = 0200f49f ff0000
ffff8e2303c4c540 2238580089 S Ii:2:008:1 -115:1 8 <
ffff8e2303c4c540 2238588061 C Ii:2:008:1 0:1 7 = 0200f38f ff0000
ffff8e2303c4c540 2238588088 S Ii:2:008:1 -115:1 8 <
ffff8e2303c4c540 2238596062 C Ii:2:008:1 0:1 7 = 0200f08f ff0000
ffff8e2303c4c540 2238596086 S Ii:2:008:1 -115:1 8 <
ffff8e2303c4c540 2238604064 C Ii:2:008:1 0:1 7 = 0200ef8f ff0000
ffff8e2303c4c540 2238604089 S Ii:2:008:1 -115:1 8 <
ffff8e2303c4c540 2238612062 C Ii:2:008:1 0:1 7 = 0200ee6f ff0000
ffff8e2303c4c540 2238612080 S Ii:2:008:1 -115:1 8 <
ffff8e2303c4c540 2238620062 C Ii:2:008:1 0:1 7 = 0200ee6f ff0000
ffff8e2303c4c540 2238620079 S Ii:2:008:1 -115:1 8 <
ffff8e2303c4c540 2238628033 C Ii:2:008:1 0:1 7 = 0200ef7f ff0000
ffff8e2303c4c540 2238628051 S Ii:2:008:1 -115:1 8 <
ffff8e2303c4c540 2238636062 C Ii:2:008:1 0:1 7 = 0200f18f ff0000
ffff8e2303c4c540 2238636078 S Ii:2:008:1 -115:1 8 <
ffff8e2303c4c540 2238644064 C Ii:2:008:1 0:1 7 = 0200f3af ff0000
ffff8e2303c4c540 2238644080 S Ii:2:008:1 -115:1 8 <
ffff8e2303c4c540 2238652035 C Ii:2:008:1 0:1 7 = 0200f3cf ff0000
ffff8e2303c4c540 2238652051 S Ii:2:008:1 -115:1 8 <
ffff8e2303c4c540 2238660057 C Ii:2:008:1 0:1 7 = 0200f3bf ff0000
ffff8e2303c4c540 2238660085 S Ii:2:008:1 -115:1 8 <
ffff8e2303c4c540 2238668034 C Ii:2:008:1 0:1 7 = 0200f4cf ff0000
ffff8e2303c4c540 2238668054 S Ii:2:008:1 -115:1 8 <
ffff8e2303c4c540 2238676054 C Ii:2:008:1 0:1 7 = 0200f3af ff0000
ffff8e2303c4c540 2238676064 S Ii:2:008:1 -115:1 8 <
ffff8e2303c4c540 2238684045 C Ii:2:008:1 0:1 7 = 0200f4af ff0000
ffff8e2303c4c540 2238684055 S Ii:2:008:1 -115:1 8 <
ffff8e2303c4c540 2238692046 C Ii:2:008:1 0:1 7 = 0200f5af ff0000
ffff8e2303c4c540 2238692055 S Ii:2:008:1 -115:1 8 <
ffff8e2303c4c540 2238700033 C Ii:2:008:1 0:1 7 = 0200f7af ff0000
ffff8e2303c4c540 2238700046 S Ii:2:008:1 -115:1 8 <
ffff8e2303c4c540 2238708031 C Ii:2:008:1 0:1 7 = 0200faaf ff0000
ffff8e2303c4c540 2238708041 S Ii:2:008:1 -115:1 8 <
ffff8e2303c4c540 2238716057 C Ii:2:008:1 0:1 7 = 0200fadf ff0000
ffff8e2303c4c540 2238716069 S Ii:2:008:1 -115:1 8 <
ffff8e2303c4c540 2238724031 C Ii:2:008:1 0:1 7 = 0200fccf ff0000
ffff8e2303c4c540 2238724041 S Ii:2:008:1 -115:1 8 <
ffff8e2303c4c540 2238732058 C Ii:2:008:1 0:1 7 = 0200fcdf ff0000
ffff8e2303c4c540 2238732068 S Ii:2:008:1 -115:1 8 <
ffff8e2303c4c540 2238740045 C Ii:2:008:1 0:1 7 = 0200fcdf ff0000
ffff8e2303c4c540 2238740055 S Ii:2:008:1 -115:1 8 <
ffff8e2303c4c540 2238748039 C Ii:2:008:1 0:1 7 = 0200fddf ff0000
ffff8e2303c4c540 2238748056 S Ii:2:008:1 -115:1 8 <
ffff8e2303c4c540 2238756055 C Ii:2:008:1 0:1 7 = 0200fdcf ff0000
ffff8e2303c4c540 2238756080 S Ii:2:008:1 -115:1 8 <
ffff8e2303c4c540 2238764055 C Ii:2:008:1 0:1 7 = 0200fdcf ff0000
ffff8e2303c4c540 2238764080 S Ii:2:008:1 -115:1 8 <
ffff8e2303c4c540 2238772040 C Ii:2:008:1 0:1 7 = 0200fdcf ff0000
ffff8e2303c4c540 2238772058 S Ii:2:008:1 -115:1 8 <
ffff8e2303c4c540 2238780051 C Ii:2:008:1 0:1 7 = 0200fd9f ff0000
ffff8e2303c4c540 2238780069 S Ii:2:008:1 -115:1 8 <
ffff8e2303c4c540 2238788036 C Ii:2:008:1 0:1 7 = 0200fc9f ff0000
ffff8e2303c4c540 2238788062 S Ii:2:008:1 -115:1 8 <
ffff8e2303c4c540 2238796063 C Ii:2:008:1 0:1 7 = 0200faaf ff0000
ffff8e2303c4c540 2238796086 S Ii:2:008:1 -115:1 8 <
ffff8e2303c4c540 2238804063 C Ii:2:008:1 0:1 7 = 0200f89f ff0000
ffff8e2303c4c540 2238804087 S Ii:2:008:1 -115:1 8 <
ffff8e2303c4c540 2238812062 C Ii:2:008:1 0:1 7 = 0200f7bf ff0000
ffff8e2303c4c540 2238812088 S Ii:2:008:1 -115:1 8 <
ffff8e2303c4c540 2238820062 C Ii:2:008:1 0:1 7 = 0200f8bf ff0000
ffff8e2303c4c540 2238820089 S Ii:2:008:1 -115:1 8 <
ffff8e2303c4c540 2238828063 C Ii:2:008:1 0:1 7 = 0200f9cf ff0000
ffff8e2303c4c540 2238828098 S Ii:2:008:1 -115:1 8 <
ffff8e2303c4c540 2238836063 C Ii:2:008:1 0:1 7 = 0200fabf ff0000
ffff8e2303c4c540 2238836089 S Ii:2:008:1 -115:1 8 <
ffff8e2303c4c540 2238844066 C Ii:2:008:1 0:1 7 = 0200fbdf ff0000
ffff8e2303c4c540 2238844091 S Ii:2:008:1 -115:1 8 <
ffff8e2303c4c540 2238852065 C Ii:2:008:1 0:1 7 = 0200fccf ff0000
ffff8e2303c4c540 2238852089 S Ii:2:008:1 -115:1 8 <
ffff8e2303c4c540 2238860065 C Ii:2:008:1 0:1 7 = 0200fddf ff0000
ffff8e2303c4c540 2238860090 S Ii:2:008:1 -115:1 8 <
ffff8e2303c4c540 2238868042 C Ii:2:008:1 0:1 7 = 020000f0 ff0000
ffff8e2303c4c540 2238868058 S Ii:2:008:1 -115:1 8 <
ffff8e2303c4c540 2238876032 C Ii:2:008:1 0:1 7 = 0200fedf ff0000
ffff8e2303c4c540 2238876043 S Ii:2:008:1 -115:1 8 <
ffff8e2303c4c540 2238884046 C Ii:2:008:1 0:1 7 = 0200ffdf ff0000
ffff8e2303c4c540 2238884056 S Ii:2:008:1 -115:1 8 <
ffff8e2303c4c540 2238892046 C Ii:2:008:1 0:1 7 = 0200fdbf ff0000
ffff8e2303c4c540 2238892061 S Ii:2:008:1 -115:1 8 <
ffff8e2303c4c540 2238900045 C Ii:2:008:1 0:1 7 = 0200fdbf ff0000
ffff8e2303c4c540 2238900058 S Ii:2:008:1 -115:1 8 <
ffff8e2303c4c540 2238908060 C Ii:2:008:1 0:1 7 = 0200fdaf ff0000
ffff8e2303c4c540 2238908085 S Ii:2:008:1 -115:1 8 <
ffff8e2303c4c540 2238916053 C Ii:2:008:1 0:1 7 = 0200fbaf ff0000
ffff8e2303c4c540 2238916079 S Ii:2:008:1 -115:1 8 <
ffff8e2303c4c540 2238924048 C Ii:2:008:1 0:1 7 = 0200fbaf ff0000
ffff8e2303c4c540 2238924061 S Ii:2:008:1 -115:1 8 <
ffff8e2303c4c540 2238932066 C Ii:2:008:1 0:1 7 = 0200fa9f ff0000
ffff8e2303c4c540 2238932100 S Ii:2:008:1 -115:1 8 <
ffff8e2303c4c540 2238940066 C Ii:2:008:1 0:1 7 = 0200fbbf ff0000
ffff8e2303c4c540 2238940097 S Ii:2:008:1 -115:1 8 <
ffff8e2303c4c540 2238948065 C Ii:2:008:1 0:1 7 = 0200fcaf ff0000
ffff8e2303c4c540 2238948097 S Ii:2:008:1 -115:1 8 <
ffff8e2303c4c540 2238956066 C Ii:2:008:1 0:1 7 = 0200fb9f ff0000
ffff8e2303c4c540 2238956093 S Ii:2:008:1 -115:1 8 <
ffff8e2303c4c540 2238964066 C Ii:2:008:1 0:1 7 = 0200faaf ff0000
ffff8e2303c4c540 2238964092 S Ii:2:008:1 -115:1 8 <
ffff8e2303c4c540 2238972065 C Ii:2:008:1 0:1 7 = 0200fa8f ff0000
ffff8e2303c4c540 2238972093 S Ii:2:008:1 -115:1 8 <
ffff8e2303c4c540 2238980063 C Ii:2:008:1 0:1 7 = 0200f89f ff0000
ffff8e2303c4c540 2238980090 S Ii:2:008:1 -115:1 8 <
ffff8e2303c4c540 2238988074 C Ii:2:008:1 0:1 7 = 0200f99f ff0000
ffff8e2303c4c540 2238988101 S Ii:2:008:1 -115:1 8 <
ffff8e2303c4c540 2238996066 C Ii:2:008:1 0:1 7 = 0200f99f ff0000
ffff8e2303c4c540 2238996093 S Ii:2:008:1 -115:1 8 <
ffff8e2303c4c540 2239004064 C Ii:2:008:1 0:1 7 = 0200f79f ff0000
ffff8e2303c4c540 2239004090 S Ii:2:008:1 -115:1 8 <
ffff8e2303c4c540 2239012065 C Ii:2:008:1 0:1 7 = 0200f79f ff0000
ffff8e2303c4c540 2239012093 S Ii:2:008:1 -115:1 8 <
ffff8e2303c4c540 2239020064 C Ii:2:008:1 0:1 7 = 0200f8af ff0000
ffff8e2303c4c540 2239020090 S Ii:2:008:1 -115:1 8 <
ffff8e2303c4c540 2239028038 C Ii:2:008:1 0:1 7 = 0200f8af ff0000
ffff8e2303c4c540 2239028063 S Ii:2:008:1 -115:1 8 <
ffff8e2303c4c540 2239036037 C Ii:2:008:1 0:1 7 = 0200fbbf ff0000
ffff8e2303c4c540 2239036066 S Ii:2:008:1 -115:1 8 <
ffff8e2303c4c540 2239044051 C Ii:2:008:1 0:1 7 = 0200fddf ff0000
ffff8e2303c4c540 2239044078 S Ii:2:008:1 -115:1 8 <
ffff8e2303c4c540 2239052069 C Ii:2:008:1 0:1 7 = 0200feef ff0000
ffff8e2303c4c540 2239052096 S Ii:2:008:1 -115:1 8 <
ffff8e2303c4c540 2239060064 C Ii:2:008:1 0:1 7 = 0200ffff ff0000
ffff8e2303c4c540 2239060090 S Ii:2:008:1 -115:1 8 <
ffff8e2303c4c540 2239092072 C Ii:2:008:1 0:1 7 = 0200ff0f 000000
ffff8e2303c4c540 2239092098 S Ii:2:008:1 -115:1 8 <
ffff8e2303c4c540 2239100067 C Ii:2:008:1 0:1 7 = 0200ffff ff0000
ffff8e2303c4c540 2239100095 S Ii:2:008:1 -115:1 8 <
ffff8e2303c4c540 2239108079 C Ii:2:008:1 0:1 7 = 0200ffef ff0000
ffff8e2303c4c540 2239108105 S Ii:2:008:1 -115:1 8 <
ffff8e2303c4c540 2239116079 C Ii:2:008:1 0:1 7 = 0200feff ff0000
ffff8e2303c4c540 2239116105 S Ii:2:008:1 -115:1 8 <
ffff8e2303c4c540 2239124070 C Ii:2:008:1 0:1 7 = 020000f0 ff0000
ffff8e2303c4c540 2239124097 S Ii:2:008:1 -115:1 8 <
ffff8e2303c4c540 2239132067 C Ii:2:008:1 0:1 7 = 0200ffff ff0000
ffff8e2303c4c540 2239132094 S Ii:2:008:1 -115:1 8 <
ffff8e2303c4c540 2239164066 C Ii:2:008:1 0:1 7 = 0200fe0f 000000
ffff8e2303c4c540 2239164093 S Ii:2:008:1 -115:1 8 <
ffff8e2303c4c540 2239172065 C Ii:2:008:1 0:1 7 = 0200ffff ff0000
ffff8e2303c4c540 2239172092 S Ii:2:008:1 -115:1 8 <
ffff8e2303c4c540 2239180068 C Ii:2:008:1 0:1 7 = 0200feff ff0000
ffff8e2303c4c540 2239180095 S Ii:2:008:1 -115:1 8 <
ffff8e2303c4c540 2239188074 C Ii:2:008:1 0:1 7 = 0200ffff ff0000
ffff8e2303c4c540 2239188099 S Ii:2:008:1 -115:1 8 <
ffff8e2303c4c540 2239244074 C Ii:2:008:1 0:1 7 = 0200ff0f 000000
ffff8e2303c4c540 2239244101 S Ii:2:008:1 -115:1 8 <
ffff8e2303c4c540 2239252066 C Ii:2:008:1 0:1 7 = 0200ff0f 000000
ffff8e2303c4c540 2239252089 S Ii:2:008:1 -115:1 8 <
ffff8e2303c4c540 2239268066 C Ii:2:008:1 0:1 7 = 0200ff0f 000000
ffff8e2303c4c540 2239268092 S Ii:2:008:1 -115:1 8 <
ffff8e2303c4c540 2239388066 C Ii:2:008:1 0:1 7 = 0200ff1f 000000
ffff8e2303c4c540 2239388092 S Ii:2:008:1 -115:1 8 <
ffff8e2303c4c540 2239396066 C Ii:2:008:1 0:1 7 = 0200ff1f 000000
ffff8e2303c4c540 2239396094 S Ii:2:008:1 -115:1 8 <
ffff8e2303c4c540 2239404067 C Ii:2:008:1 0:1 7 = 0200fc1f 000000
ffff8e2303c4c540 2239404094 S Ii:2:008:1 -115:1 8 <
ffff8e2303c4c540 2239412042 C Ii:2:008:1 0:1 7 = 0200fb0f 000000
ffff8e2303c4c540 2239412076 S Ii:2:008:1 -115:1 8 <
ffff8e2303c4c540 2239420040 C Ii:2:008:1 0:1 7 = 0200fa0f 000000
ffff8e2303c4c540 2239420065 S Ii:2:008:1 -115:1 8 <
ffff8e2303c4c540 2239428057 C Ii:2:008:1 0:1 7 = 0200f90f 000000
ffff8e2303c4c540 2239428090 S Ii:2:008:1 -115:1 8 <
ffff8e2303c4c540 2239436067 C Ii:2:008:1 0:1 7 = 0200fbff ff0000
ffff8e2303c4c540 2239436094 S Ii:2:008:1 -115:1 8 <
ffff8e2303c4c540 2239444066 C Ii:2:008:1 0:1 7 = 0200fdff ff0000
ffff8e2303c4c540 2239444092 S Ii:2:008:1 -115:1 8 <
ffff8e2303c4c540 2239452066 C Ii:2:008:1 0:1 7 = 0200feff ff0000
ffff8e2303c4c540 2239452092 S Ii:2:008:1 -115:1 8 <
ffff8e2303c4c540 2239460066 C Ii:2:008:1 0:1 7 = 0200ff0f 000000
ffff8e2303c4c540 2239460093 S Ii:2:008:1 -115:1 8 <
ffff8e2303c4c540 2239468067 C Ii:2:008:1 0:1 7 = 0200fdef ff0000
ffff8e2303c4c540 2239468095 S Ii:2:008:1 -115:1 8 <
ffff8e2303c4c540 2239476075 C Ii:2:008:1 0:1 7 = 0200fdff ff0000
ffff8e2303c4c540 2239476101 S Ii:2:008:1 -115:1 8 <
ffff8e2303c4c540 2239484067 C Ii:2:008:1 0:1 7 = 0200feef ff0000
ffff8e2303c4c540 2239484095 S Ii:2:008:1 -115:1 8 <
ffff8e2303c4c540 2239492066 C Ii:2:008:1 0:1 7 = 0200ffff ff0000
ffff8e2303c4c540 2239492093 S Ii:2:008:1 -115:1 8 <
ffff8e2303c4c540 2239500069 C Ii:2:008:1 0:1 7 = 0200ff0f 000000
ffff8e2303c4c540 2239500096 S Ii:2:008:1 -115:1 8 <
ffff8e2303c4c540 2239572068 C Ii:2:008:1 0:1 7 = 020000f0 ff0000
ffff8e2303c4c540 2239572094 S Ii:2:008:1 -115:1 8 <
ffff8e2303c4c540 2239580069 C Ii:2:008:1 0:1 7 = 020000f0 ff0000
ffff8e2303c4c540 2239580097 S Ii:2:008:1 -115:1 8 <
ffff8e2303c4c540 2239588070 C Ii:2:008:1 0:1 7 = 020000f0 ff0000
ffff8e2303c4c540 2239588097 S Ii:2:008:1 -115:1 8 <
ffff8e2303c4c540 2239652074 C Ii:2:008:1 0:1 7 = 020000f0 ff0000
ffff8e2303c4c540 2239652100 S Ii:2:008:1 -115:1 8 <
ffff8e2303c4c540 2239660068 C Ii:2:008:1 0:1 7 = 020000f0 ff0000
ffff8e2303c4c540 2239660095 S Ii:2:008:1 -115:1 8 <
ffff8e2303c4c540 2239668068 C Ii:2:008:1 0:1 7 = 020000f0 ff0000
ffff8e2303c4c540 2239668095 S Ii:2:008:1 -115:1 8 <
ffff8e2303c4c540 2239740069 C Ii:2:008:1 0:1 7 = 02010000 000000
ffff8e2303c4c540 2239740097 S Ii:2:008:1 -115:1 8 <
ffff8e2303c4c540 2239844070 C Ii:2:008:1 0:1 7 = 02000000 000000
ffff8e2303c4c540 2239844100 S Ii:2:008:1 -115:1 8 <
ffff8e2303c4c540 2239875047 C Ii:2:008:1 0:1 7 = 020002f0 ff0000
ffff8e2303c4c540 2239875073 S Ii:2:008:1 -115:1 8 <
ffff8e2303c4c540 2239883043 C Ii:2:008:1 0:1 7 = 020005f0 ff0000
ffff8e2303c4c540 2239883069 S Ii:2:008:1 -115:1 8 <
ffff8e2303c4c540 2239891043 C Ii:2:008:1 0:1 7 = 020005f0 ff0000
ffff8e2303c4c540 2239891068 S Ii:2:008:1 -115:1 8 <
ffff8e2303c4c540 2239899041 C Ii:2:008:1 0:1 7 = 02000500 000000
ffff8e2303c4c540 2239899064 S Ii:2:008:1 -115:1 8 <
ffff8e2303c4c540 2239907068 C Ii:2:008:1 0:1 7 = 02000300 000000
ffff8e2303c4c540 2239907092 S Ii:2:008:1 -115:1 8 <
ffff8e2303c4c540 2239915042 C Ii:2:008:1 0:1 7 = 02000100 000000
ffff8e2303c4c540 2239915067 S Ii:2:008:1 -115:1 8 <
ffff8e2302151980 2240203089 S Bo:2:002:2 -115 31 = 55534243 a9050000 00000000 00000600 00000000 00000000 00000000 000000
ffff8e2302151980 2240203123 C Bo:2:002:2 0 31 >
ffff8e2302151980 2240203132 S Bi:2:002:1 -115 13 <
ffff8e2302151980 2240203160 C Bi:2:002:1 0 13 = 55534253 a9050000 00000000 00
ffff8e2303c4c540 2240563077 C Ii:2:008:1 0:1 7 = 02000210 000000
ffff8e2303c4c540 2240563114 S Ii:2:008:1 -115:1 8 <
ffff8e2303c4c540 2240571070 C Ii:2:008:1 0:1 7 = 02000550 000000
ffff8e2303c4c540 2240571098 S Ii:2:008:1 -115:1 8 <
ffff8e2303c4c540 2240579043 C Ii:2:008:1 0:1 7 = 02000860 000000
ffff8e2303c4c540 2240579064 S Ii:2:008:1 -115:1 8 <
ffff8e2303c4c540 2240587079 C Ii:2:008:1 0:1 7 = 02000cc0 000000
ffff8e2303c4c540 2240587105 S Ii:2:008:1 -115:1 8 <
ffff8e2303c4c540 2240595072 C Ii:2:008:1 0:1 7 = 02000e00 010000
ffff8e2303c4c540 2240595099 S Ii:2:008:1 -115:1 8 <
ffff8e2303c4c540 2240603045 C Ii:2:008:1 0:1 7 = 02001130 010000
ffff8e2303c4c540 2240603069 S Ii:2:008:1 -115:1 8 <
ffff8e2303c4c540 2240611071 C Ii:2:008:1 0:1 7 = 02001270 010000
ffff8e2303c4c540 2240611098 S Ii:2:008:1 -115:1 8 <
ffff8e2303c4c540 2240619073 C Ii:2:008:1 0:1 7 = 02001290 010000
ffff8e2303c4c540 2240619106 S Ii:2:008:1 -115:1 8 <
ffff8e2303c4c540 2240627071 C Ii:2:008:1 0:1 7 = 02001390 010000
ffff8e2303c4c540 2240627087 S Ii:2:008:1 -115:1 8 <
ffff8e2303c4c540 2240635062 C Ii:2:008:1 0:1 7 = 020012a0 010000
ffff8e2303c4c540 2240635078 S Ii:2:008:1 -115:1 8 <
ffff8e2303c4c540 2240643072 C Ii:2:008:1 0:1 7 = 02001390 010000
ffff8e2303c4c540 2240643088 S Ii:2:008:1 -115:1 8 <
ffff8e2303c4c540 2240651072 C Ii:2:008:1 0:1 7 = 02001680 010000
ffff8e2303c4c540 2240651090 S Ii:2:008:1 -115:1 8 <
ffff8e2303c4c540 2240659071 C Ii:2:008:1 0:1 7 = 02001b80 010000
ffff8e2303c4c540 2240659087 S Ii:2:008:1 -115:1 8 <
ffff8e2303c4c540 2240667072 C Ii:2:008:1 0:1 7 = 02001e90 010000
ffff8e2303c4c540 2240667089 S Ii:2:008:1 -115:1 8 <
ffff8e2303c4c540 2240675072 C Ii:2:008:1 0:1 7 = 02002290 010000
ffff8e2303c4c540 2240675088 S Ii:2:008:1 -115:1 8 <
ffff8e2303c4c540 2240683071 C Ii:2:008:1 0:1 7 = 02002490 010000
ffff8e2303c4c540 2240683088 S Ii:2:008:1 -115:1 8 <
ffff8e2303c4c540 2240691072 C Ii:2:008:1 0:1 7 = 02002370 010000
ffff8e2303c4c540 2240691089 S Ii:2:008:1 -115:1 8 <
ffff8e2303c4c540 2240699073 C Ii:2:008:1 0:1 7 = 02002140 010000
ffff8e2303c4c540 2240699089 S Ii:2:008:1 -115:1 8 <
ffff8e2303c4c540 2240707063 C Ii:2:008:1 0:1 7 = 02002120 010000
ffff8e2303c4c540 2240707080 S Ii:2:008:1 -115:1 8 <
ffff8e2303c4c540 2240715067 C Ii:2:008:1 0:1 7 = 02001c00 010000
ffff8e2303c4c540 2240715085 S Ii:2:008:1 -115:1 8 <
ffff8e2303c4c540 2240723052 C Ii:2:008:1 0:1 7 = 02001af0 000000
ffff8e2303c4c540 2240723068 S Ii:2:008:1 -115:1 8 <
ffff8e2303c4c540 2240731063 C Ii:2:008:1 0:1 7 = 02001ae0 000000
ffff8e2303c4c540 2240731080 S Ii:2:008:1 -115:1 8 <
ffff8e2303c4c540 2240739060 C Ii:2:008:1 0:1 7 = 020013b0 000000
ffff8e2303c4c540 2240739078 S Ii:2:008:1 -115:1 8 <
ffff8e2303c4c540 2240747057 C Ii:2:008:1 0:1 7 = 02000f90 000000
ffff8e2303c4c540 2240747073 S Ii:2:008:1 -115:1 8 <
ffff8e2303c4c540 2240755061 C Ii:2:008:1 0:1 7 = 02000a60 000000
ffff8e2303c4c540 2240755078 S Ii:2:008:1 -115:1 8 <
ffff8e2303c4c540 2240763071 C Ii:2:008:1 0:1 7 = 02000540 000000
ffff8e2303c4c540 2240763088 S Ii:2:008:1 -115:1 8 <
ffff8e2303c4c540 2240771060 C Ii:2:008:1 0:1 7 = 02000450 000000
ffff8e2303c4c540 2240771074 S Ii:2:008:1 -115:1 8 <
ffff8e2303c4c540 2240779055 C Ii:2:008:1 0:1 7 = 02000440 000000
ffff8e2303c4c540 2240779071 S Ii:2:008:1 -115:1 8 <
ffff8e2303c4c540 2240787071 C Ii:2:008:1 0:1 7 = 02000220 000000
ffff8e2303c4c540 2240787089 S Ii:2:008:1 -115:1 8 <
ffff8e2303c4c540 2240795073 C Ii:2:008:1 0:1 7 = 02000230 000000
ffff8e2303c4c540 2240795089 S Ii:2:008:1 -115:1 8 <
ffff8e2303c4c540 2240803074 C Ii:2:008:1 0:1 7 = 02000200 000000
ffff8e2303c4c540 2240803091 S Ii:2:008:1 -115:1 8 <
ffff8e2303c4c540 2240851073 C Ii:2:008:1 0:1 7 = 02000010 000000
ffff8e2303c4c540 2240851089 S Ii:2:008:1 -115:1 8 <
ffff8e2303c4c540 2240859074 C Ii:2:008:1 0:1 7 = 02000010 000000
ffff8e2303c4c540 2240859090 S Ii:2:008:1 -115:1 8 <
ffff8e2303c4c540 2240867073 C Ii:2:008:1 0:1 7 = 02000020 000000
ffff8e2303c4c540 2240867089 S Ii:2:008:1 -115:1 8 <
ffff8e2303c4c540 2240875072 C Ii:2:008:1 0:1 7 = 02000030 000000
ffff8e2303c4c540 2240875090 S Ii:2:008:1 -115:1 8 <
ffff8e2303c4c540 2240883044 C Ii:2:008:1 0:1 7 = 02000150 000000
ffff8e2303c4c540 2240883060 S Ii:2:008:1 -115:1 8 <
ffff8e2303c4c540 2240891084 C Ii:2:008:1 0:1 7 = 02000080 000000
ffff8e2303c4c540 2240891100 S Ii:2:008:1 -115:1 8 <
ffff8e2303c4c540 2240899073 C Ii:2:008:1 0:1 7 = 02000190 000000
ffff8e2303c4c540 2240899091 S Ii:2:008:1 -115:1 8 <
ffff8e2303c4c540 2240907073 C Ii:2:008:1 0:1 7 = 020003c0 000000
ffff8e2303c4c540 2240907089 S Ii:2:008:1 -115:1 8 <
ffff8e2303c4c540 2240915073 C Ii:2:008:1 0:1 7 = 020004d0 000000
ffff8e2303c4c540 2240915090 S Ii:2:008:1 -115:1 8 <
ffff8e2303c4c540 2240923073 C Ii:2:008:1 0:1 7 = 020006e0 000000
ffff8e2303c4c540 2240923091 S Ii:2:008:1 -115:1 8 <
ffff8e2303c4c540 2240931071 C Ii:2:008:1 0:1 7 = 020007e0 000000
ffff8e2303c4c540 2240931088 S Ii:2:008:1 -115:1 8 <
ffff8e2303c4c540 2240939074 C Ii:2:008:1 0:1 7 = 020007e0 000000
ffff8e2303c4c540 2240939090 S Ii:2:008:1 -115:1 8 <
ffff8e2303c4c540 2240947072 C Ii:2:008:1 0:1 7 = 020007b0 000000
ffff8e2303c4c540 2240947090 S Ii:2:008:1 -115:1 8 <
ffff8e2303c4c540 2240955073 C Ii:2:008:1 0:1 7 = 02000690 000000
ffff8e2303c4c540 2240955090 S Ii:2:008:1 -115:1 8 <
ffff8e2303c4c540 2240963073 C Ii:2:008:1 0:1 7 = 02000570 000000
ffff8e2303c4c540 2240963091 S Ii:2:008:1 -115:1 8 <
ffff8e2303c4c540 2240971068 C Ii:2:008:1 0:1 7 = 02000550 000000
ffff8e2303c4c540 2240971084 S Ii:2:008:1 -115:1 8 <
ffff8e2303c4c540 2240979061 C Ii:2:008:1 0:1 7 = 02000350 000000
ffff8e2303c4c540 2240979078 S Ii:2:008:1 -115:1 8 <
ffff8e2303c4c540 2240987073 C Ii:2:008:1 0:1 7 = 02000350 000000
ffff8e2303c4c540 2240987090 S Ii:2:008:1 -115:1 8 <
ffff8e2303c4c540 2240995075 C Ii:2:008:1 0:1 7 = 02000330 000000
ffff8e2303c4c540 2240995091 S Ii:2:008:1 -115:1 8 <
ffff8e2303c4c540 2241003050 C Ii:2:008:1 0:1 7 = 02000130 000000
ffff8e2303c4c540 2241003066 S Ii:2:008:1 -115:1 8 <
ffff8e2303c4c540 2241011073 C Ii:2:008:1 0:1 7 = 02000100 000000
ffff8e2303c4c540 2241011089 S Ii:2:008:1 -115:1 8 <
ffff8e2303c4c540 2241027081 C Ii:2:008:1 0:1 7 = 02000010 000000
ffff8e2303c4c540 2241027097 S Ii:2:008:1 -115:1 8 <
ffff8e2303c4c540 2241035073 C Ii:2:008:1 0:1 7 = 02000010 000000
ffff8e2303c4c540 2241035089 S Ii:2:008:1 -115:1 8 <
ffff8e2303c4c540 2241043073 C Ii:2:008:1 0:1 7 = 02000010 000000
ffff8e2303c4c540 2241043089 S Ii:2:008:1 -115:1 8 <
ffff8e2303c4c540 2241051074 C Ii:2:008:1 0:1 7 = 02000020 000000
ffff8e2303c4c540 2241051091 S Ii:2:008:1 -115:1 8 <
ffff8e2303c4c540 2241059073 C Ii:2:008:1 0:1 7 = 02000010 000000
ffff8e2303c4c540 2241059090 S Ii:2:008:1 -115:1 8 <
ffff8e2303c4c540 2241083081 C Ii:2:008:1 0:1 7 = 02000010 000000
ffff8e2303c4c540 2241083097 S Ii:2:008:1 -115:1 8 <
ffff8e2303c4c540 2241091075 C Ii:2:008:1 0:1 7 = 02000010 000000
ffff8e2303c4c540 2241091091 S Ii:2:008:1 -115:1 8 <
ffff8e2303c4c540 2241099050 C Ii:2:008:1 0:1 7 = 02000010 000000
ffff8e2303c4c540 2241099066 S Ii:2:008:1 -115:1 8 <
ffff8e2303c4c540 2241979078 C Ii:2:008:1 0:1 7 = 02010000 000000
ffff8e2303c4c540 2241979096 S Ii:2:008:1 -115:1 8 <
ffff8e2303c4c540 2242051086 C Ii:2:008:1 0:1 7 = 02000000 000000
ffff8e2303c4c540 2242051103 S Ii:2:008:1 -115:1 8 <
ffff8e259d4f6900 2242057642 S Co:2:011:0 s 40 9a 1312 cc83 0000 0
ffff8e259d4f6900 2242057722 C Co:2:011:0 0 0
ffff8e259d4f6900 2242057737 S Co:2:011:0 s 40 9a 2518 00c3 0000 0
ffff8e259d4f6900 2242057809 C Co:2:011:0 0 0
ffff8e259d4f6900 2242057822 S Co:2:011:0 s 40 a4 ff9f 0000 0000 0
ffff8e259d4f6900 2242057954 C Co:2:011:0 0 0
ffff8e259d4f6900 2242057969 S Co:2:011:0 s 40 9a 2727 0000 0000 0
ffff8e259d4f6900 2242058036 C Co:2:011:0 0 0
ffff8e2301f33b00 2242058059 S Ii:2:011:1 -115:1 8 <
ffff8e259d4f6900 2242058069 S Ci:2:011:0 s c0 95 0706 0000 0002 2 <
ffff8e259d4f6900 2242058163 C Ci:2:011:0 0 2 = 9fee
ffff8e2301f326c0 2242058175 S Bi:2:011:2 -115 32 <
ffff8e2301f32e40 2242058180 S Bi:2:011:2 -115 32 <
ffff8e259d4f6900 2242058184 S Co:2:011:0 s 40 a4 ff9f 0000 0000 0
ffff8e259d4f6900 2242058247 C Co:2:011:0 0 0
ffff8e23036146c0 2242058424 S Co:2:011:0 s 40 9a 1312 cc83 0000 0
ffff8e23036146c0 2242058509 C Co:2:011:0 0 0
ffff8e23036146c0 2242058523 S Co:2:011:0 s 40 9a 2518 00c3 0000 0
ffff8e23036146c0 2242058592 C Co:2:011:0 0 0
ffff8e23036146c0 2242058603 S Co:2:011:0 s 40 a4 ff9f 0000 0000 0
ffff8e23036146c0 2242058669 C Co:2:011:0 0 0
ffff8e23036146c0 2242058687 S Co:2:011:0 s 40 9a 2727 0000 0000 0
ffff8e23036146c0 2242058750 C Co:2:011:0 0 0
ffff8e23036146c0 2242058776 S Co:2:011:0 s 40 a4 ffbf 0000 0000 0
ffff8e23036146c0 2242058842 C Co:2:011:0 0 0
ffff8e23036146c0 2242058859 S Co:2:011:0 s 40 a4 ffbf 0000 0000 0
ffff8e23036146c0 2242058991 C Co:2:011:0 0 0
ffff8e23036146c0 2242059042 S Co:2:011:0 s 40 a4 ffbf 0000 0000 0
ffff8e23036146c0 2242059108 C Co:2:011:0 0 0
ffff8e23036146c0 2242059124 S Co:2:011:0 s 40 a4 ffbf 0000 0000 0
ffff8e23036146c0 2242059195 C Co:2:011:0 0 0
ffff8e23036146c0 2242059217 S Co:2:011:0 s 40 a4 ffbf 0000 0000 0
ffff8e23036146c0 2242059283 C Co:2:011:0 0 0
ffff8e23036146c0 2242059309 S Co:2:011:0 s 40 a4 ffbf 0000 0000 0
ffff8e23036146c0 2242059374 C Co:2:011:0 0 0
ffff8e23036146c0 2242059397 S Co:2:011:0 s 40 a4 ffff 0000 0000 0
ffff8e23036146c0 2242059469 C Co:2:011:0 0 0
ffff8e23036146c0 2242059494 S Co:2:011:0 s 40 a4 ffff 0000 0000 0
ffff8e23036146c0 2242059565 C Co:2:011:0 0 0
ffff8e2301f32240 2242066179 S Bo:2:011:2 -115 14 = 50524f47 52414d42 54393030 3055
ffff8e2301f32240 2242066233 C Bo:2:011:2 0 14 >
ffff8e2301f326c0 2242154695 C Bi:2:011:2 0 1 = 06
ffff8e2301f326c0 2242154700 S Bi:2:011:2 -115 32 <
ffff8e2301f32240 2242155086 S Bo:2:011:2 -115 1 = 46
ffff8e2301f32240 2242155128 C Bo:2:011:2 0 1 >
ffff8e2301f32e40 2242158787 C Bi:2:011:2 0 16 = 01360174 04000520 02000260 01033004
ffff8e2301f32e40 2242158791 S Bi:2:011:2 -115 32 <
ffff8e2301f32240 2242159056 S Bo:2:011:2 -115 1 = 4d
ffff8e2301f32240 2242159093 C Bo:2:011:2 0 1 >
ffff8e2301f326c0 2242162329 C Bi:2:011:2 0 12 = 52542d39 35302020 20202020
ffff8e2301f326c0 2242162332 S Bi:2:011:2 -115 32 <
ffff8e2301f32240 2242162750 S Bo:2:011:2 -115 25 = 53454e44 20130608 03070a06 030a1202 09050101 0b010d08 00
ffff8e2301f32240 2242162819 C Bo:2:011:2 0 25 >
ffff8e2301f32e40 2242167123 C Bi:2:011:2 0 1 = 06
ffff8e2301f32e40 2242167127 S Bi:2:011:2 -115 32 <
ffff8e2301f32240 2242167443 S Bo:2:011:2 -115 4 = 52000080
ffff8e2301f32240 2242167479 C Bo:2:011:2 0 4 >
ffff8e2301f326c0 2242171192 C Bi:2:011:2 0 32 = 52000080 00001014 00001014 00000000 00000044 ffffffff 6362772e 60667220
ffff8e2301f326c0 2242171196 S Bi:2:011:2 -115 32 <
ffff8e2301f32e40 2242174259 C Bi:2:011:2 0 32 = 013f2f70 02441014 02441014 00000000 00000044 ffffffff 6362772e 60677035
ffff8e2301f32e40 2242174260 S Bi:2:011:2 -115 32 <
ffff8e2301f326c0 2242177334 C Bi:2:011:2 0 32 = 72052b6d 00731014 00731014 00000000 00000044 ffffffff 6362772e 60647720
ffff8e2301f326c0 2242177338 S Bi:2:011:2 -115 32 <
ffff8e2301f32e40 2242180396 C Bi:2:011:2 0 32 = 013f2f70 02611014 02611014 00000000 00000044 ffffffff 6362772e 60657535
ffff8e2301f32e40 2242180398 S Bi:2:011:2 -115 32 <
ffff8e2301f326c0 2242182643 C Bi:2:011:2 0 4 = 72052b6d
ffff8e2301f326c0 2242182645 S Bi:2:011:2 -115 32 <
ffff8e2301f32240 2242183145 S Bo:2:011:2 -115 4 = 52008080
ffff8e2301f32240 2242183181 C Bo:2:011:2 0 4 >
ffff8e2301f32e40 2242186986 C Bi:2:011:2 0 32 = 52008080 00061014 00061014 00000000 00000044 ffffffff 6362772e 60637220
ffff8e2301f32e40 2242186990 S Bi:2:011:2 -115 32 <
ffff8e2301f326c0 2242189984 C Bi:2:011:2 0 32 = 013f2f70 02341014 02341014 00000000 00000044 ffffffff 6362772e 60607035
ffff8e2301f326c0 2242189989 S Bi:2:011:2 -115 32 <
ffff8e2301f32e40 2242193013 C Bi:2:011:2 0 32 = 72052b6d 00231014 00231014 00000000 00000044 ffffffff 6362772e 60617720
ffff8e2301f32e40 2242193015 S Bi:2:011:2 -115 32 <
ffff8e2301f326c0 2242196072 C Bi:2:011:2 0 32 = 013f2f70 02d41014 02d41014 00000000 00000044 ffffffff 6362772e 606e7035
ffff8e2301f326c0 2242196076 S Bi:2:011:2 -115 32 <
ffff8e2301f32e40 2242198507 C Bi:2:011:2 0 4 = 72052b6d
ffff8e2301f32e40 2242198508 S Bi:2:011:2 -115 32 <
ffff8e2301f32240 2242198968 S Bo:2:011:2 -115 4 = 52010080
ffff8e2301f32240 2242199013 C Bo:2:011:2 0 4 >
ffff8e2301f326c0 2242202716 C Bi:2:011:2 0 32 = 52010080 00001114 00001114 00000000 00000044 ffffffff 6362772e 61667220
ffff8e2301f326c0 2242202719 S Bi:2:011:2 -115 32 <
ffff8e2301f32e40 2242205760 C Bi:2:011:2 0 32 = 013f2f70 02441114 02441114 00000000 00000044 ffffffff 6362772e 61677035
ffff8e2301f32e40 2242205762 S Bi:2:011:2 -115 32 <
ffff8e2301f326c0 2242208849 C Bi:2:011:2 0 32 = 72052b6d 00731114 00731114 00000000 00000044 ffffffff 6362772e 61647720
ffff8e2301f326c0 2242208851 S Bi:2:011:2 -115 32 <
ffff8e2301f32e40 2242211983 C Bi:2:011:2 0 32 = 013f2f70 02611114 02611114 00000000 00000044 ffffffff 6362772e 61657535
ffff8e2301f32e40 2242211985 S Bi:2:011:2 -115 32 <
ffff8e2301f326c0 2242214189 C Bi:2:011:2 0 4 = 72052b6d
ffff8e2301f326c0 2242214191 S Bi:2:011:2 -115 32 <
ffff8e2301f32240 2242214452 S Bo:2:011:2 -115 4 = 52018080
ffff8e2301f32240 2242214488 C Bo:2:011:2 0 4 >
ffff8e2301f32e40 2242218213 C Bi:2:011:2 0 32 = 52018080 00061114 00061114 00000000 00000044 ffffffff 6362772e 61637220
ffff8e2301f32e40 2242218216 S Bi:2:011:2 -115 32 <
ffff8e2301f326c0 2242221238 C Bi:2:011:2 0 32 = 013f2f70 02341114 02341114 00000000 00000044 ffffffff 6362772e 61607035
ffff8e2301f326c0 2242221239 S Bi:2:011:2 -115 32 <
ffff8e2301f32e40 2242224302 C Bi:2:011:2 0 32 = 72052b6d 00231114 00231114 00000000 00000044 ffffffff 6362772e 61617720
ffff8e2301f32e40 2242224305 S Bi:2:011:2 -115 32 <
ffff8e2301f326c0 2242227372 C Bi:2:011:2 0 32 = 013f2f70 02d11114 02d11114 00000000 00000044 ffffffff 6362772e 616e7535
ffff8e2301f326c0 2242227373 S Bi:2:011:2 -115 32 <
ffff8e2301f32e40 2242229668 C Bi:2:011:2 0 4 = 72052b6d
ffff8e2301f32e40 2242229670 S Bi:2:011:2 -115 32 <
ffff8e2301f32240 2242229968 S Bo:2:011:2 -115 4 = 52020080
ffff8e2301f32240 2242230008 C Bo:2:011:2 0 4 >
ffff8e2301f326c0 2242233691 C Bi:2:011:2 0 32 = 52020080 00001614 00001614 00000000 00000044 ffffffff 6362772e 66667220
ffff8e2301f326c0 2242233693 S Bi:2:011:2 -115 32 <
ffff8e2301f32e40 2242236759 C Bi:2:011:2 0 32 = 013f2f70 02441614 02441614 00000000 00000044 ffffffff 6362772e 66677035
ffff8e2301f32e40 2242236760 S Bi:2:011:2 -115 32 <
ffff8e2301f326c0 2242239851 C Bi:2:011:2 0 32 = 72052b6d 00731614 00731614 00000000 00000044 ffffffff 6362772e 66647720
ffff8e2301f326c0 2242239852 S Bi:2:011:2 -115 32 <
ffff8e2301f32e40 2242242984 C Bi:2:011:2 0 32 = 013f2f70 02611614 02611614 00000000 00000044 ffffffff 6362772e 66657535
ffff8e2301f32e40 2242242985 S Bi:2:011:2 -115 32 <
ffff8e2301f326c0 2242245215 C Bi:2:011:2 0 4 = 72052b6d
ffff8e2301f326c0 2242245216 S Bi:2:011:2 -115 32 <
ffff8e2301f32240 2242245512 S Bo:2:011:2 -115 4 = 52028080
ffff8e2301f32240 2242245546 C Bo:2:011:2 0 4 >
ffff8e2301f32e40 2242249239 C Bi:2:011:2 0 32 = 52028080 00061614 00061614 00000000 00000044 ffffffff 6362772e 66637220
ffff8e2301f32e40 2242249241 S Bi:2:011:2 -115 32 <
ffff8e2302151980 2242250055 S Bo:2:002:2 -115 31 = 55534243 aa050000 00000000 00000600 00000000 00000000 00000000 000000
ffff8e2302151980 2242250072 C Bo:2:002:2 0 31 >
ffff8e2302151980 2242250077 S Bi:2:002:1 -115 13 <
ffff8e2302151980 2242250165 C Bi:2:002:1 0 13 = 55534253 aa050000 00000000 00
ffff8e2301f326c0 2242252304 C Bi:2:011:2 0 32 = 013f2f70 02341614 02341614 00000000 00000044 ffffffff 6362772e 66607035
ffff8e2301f326c0 2242252306 S Bi:2:011:2 -115 32 <
ffff8e2301f32e40 2242255372 C Bi:2:011:2 0 32 = 72052b6d 00231614 00231614 00000000 00000044 ffffffff 6362772e 66617720
ffff8e2301f32e40 2242255373 S Bi:2:011:2 -115 32 <
ffff8e2301f326c0 2242258440 C Bi:2:011:2 0 32 = 013f2f70 02d11614 02d11614 00000000 00000044 ffffffff 6362772e 666e7535
ffff8e2301f326c0 2242258441 S Bi:2:011:2 -115 32 <
ffff8e2301f32e40 2242260691 C Bi:2:011:2 0 4 = 72052b6d
ffff8e2301f32e40 2242260692 S Bi:2:011:2 -115 32 <
ffff8e2301f32240 2242260955 S Bo:2:011:2 -115 4 = 52030080
ffff8e2301f32240 2242260991 C Bo:2:011:2 0 4 >
ffff8e2301f326c0 2242264714 C Bi:2:011:2 0 32 = 52030080 00001714 00001714 00000000 00000044 ffffffff 601b6243 131a0e20
ffff8e2301f326c0 2242264717 S Bi:2:011:2 -115 32 <
ffff8e2301f32e40 2242267760 C Bi:2:011:2 0 32 = 6362772e 02441714 02441714 00000000 00000044 ffffffff 6362772e 67677035
ffff8e2301f32e40 2242267762 S Bi:2:011:2 -115 32 <
ffff8e2301f326c0 2242270847 C Bi:2:011:2 0 32 = 72052b6d 00731714 00731714 00000000 00000044 ffffffff 6362772e 67647720
ffff8e2301f326c0 2242270848 S Bi:2:011:2 -115 32 <
ffff8e2301f32e40 2242273982 C Bi:2:011:2 0 32 = 013f2f70 02611714 02611714 00000000 00000044 ffffffff 6362772e 67657535
ffff8e2301f32e40 2242273984 S Bi:2:011:2 -115 32 <
ffff8e2301f326c0 2242276237 C Bi:2:011:2 0 4 = 72052b6d
ffff8e2301f326c0 2242276238 S Bi:2:011:2 -115 32 <
ffff8e2301f32240 2242276488 S Bo:2:011:2 -115 4 = 52038080
ffff8e2301f32240 2242276524 C Bo:2:011:2 0 4 >
ffff8e2301f32e40 2242280214 C Bi:2:011:2 0 32 = 52038080 00061714 00061714 00000000 00000044 ffffffff 6362772e 67637220
ffff8e2301f32e40 2242280217 S Bi:2:011:2 -115 32 <
ffff8e2301f326c0 2242283283 C Bi:2:011:2 0 32 = 013f2f70 02341714 02341714 00000000 00000044 ffffffff 6362772e 67607035
ffff8e2301f326c0 2242283284 S Bi:2:011:2 -115 32 <
ffff8e2301f32e40 2242286349 C Bi:2:011:2 0 32 = 72052b6d 00231714 00231714 00000000 00000044 ffffffff 6362772e 67617720
ffff8e2301f32e40 2242286350 S Bi:2:011:2 -115 32 <
ffff8e2301f326c0 2242289439 C Bi:2:011:2 0 32 = 013f2f70 02d11714 02d11714 00000000 00000044 ffffffff 6362772e 676e7535
ffff8e2301f326c0 2242289440 S Bi:2:011:2 -115 32 <
ffff8e2301f32e40 2242291737 C Bi:2:011:2 0 4 = 72052b6d
ffff8e2301f32e40 2242291738 S Bi:2:011:2 -115 32 <
ffff8e2301f32240 2242292022 S Bo:2:011:2 -115 4 = 52040080
ffff8e2301f32240 2242292069 C Bo:2:011:2 0 4 >
ffff8e2301f326c0 2242295762 C Bi:2:011:2 0 32 = 52040080 00001414 00001214 07521704 00000004 ffffffff 1514714c 0b76706d
ffff8e2301f326c0 2242295765 S Bi:2:011:2 -115 32 <
ffff8e2301f32e40 2242298848 C Bi:2:011:2 0 32 = ffffffff 00731414 00731214 07521704 00000004 ffffffff 15147147 16760b4f
ffff8e2301f32e40 2242298850 S Bi:2:011:2 -115 32 <
ffff8e2301f326c0 2242301982 C Bi:2:011:2 0 32 = 1fffffff 00061414 00061214 07521704 00000004 ffffffff 6362772e 64637230
ffff8e2301f326c0 2242301984 S Bi:2:011:2 -115 32 <
ffff8e2301f32e40 2242304983 C Bi:2:011:2 0 32 = 6266ffff 00231414 00231214 07521704 00000004 ffffffff 6362772e 64617730
ffff8e2301f32e40 2242304985 S Bi:2:011:2 -115 32 <
ffff8e2301f326c0 2242307260 C Bi:2:011:2 0 4 = 6266ffff
ffff8e2301f326c0 2242307261 S Bi:2:011:2 -115 32 <
ffff8e2301f32240 2242307775 S Bo:2:011:2 -115 4 = 52048080
ffff8e2301f32240 2242307816 C Bo:2:011:2 0 4 >
ffff8e2301f32e40 2242311510 C Bi:2:011:2 0 32 = 52048080 00001514 00001314 07521704 00000004 ffffffff 1514754e 1b760669
ffff8e2301f32e40 2242311513 S Bi:2:011:2 -115 32 <
ffff8e2301f326c0 2242314575 C Bi:2:011:2 0 32 = 353f3661 00731514 00731314 07521704 00000004 ffffffff 1514714e 1b76706d
ffff8e2301f326c0 2242314576 S Bi:2:011:2 -115 32 <
ffff8e2301f32e40 2242317641 C Bi:2:011:2 0 32 = ffffffff 00061514 00061514 07521704 00000004 ffffffff 6362772e 65637230
ffff8e2301f32e40 2242317643 S Bi:2:011:2 -115 32 <
ffff8e2301f326c0 2242320711 C Bi:2:011:2 0 32 = 6266ffff ffffffff ffffffff ffffffff ffffffff ffffffff ffffffff ffffffff
ffff8e2301f326c0 2242320713 S Bi:2:011:2 -115 32 <
ffff8e2301f32e40 2242323118 C Bi:2:011:2 0 4 = ffffffff
ffff8e2301f32e40 2242323125 S Bi:2:011:2 -115 32 <
ffff8e2301f32240 2242323408 S Bo:2:011:2 -115 4 = 52050080
ffff8e2301f32240 2242323446 C Bo:2:011:2 0 4 >
ffff8e2301f326c0 2242327144 C Bi:2:011:2 0 32 = 52050080 00007643 00007643 00000000 00000044 ffffffff 6665712e 66667220
ffff8e2301f326c0 2242327150 S Bi:2:011:2 -115 32 <
ffff8e2301f32e40 2242330214 C Bi:2:011:2 0 32 = 013f2f70 02447643 02447643 00000000 00000044 ffffffff 6665712e 66677035
ffff8e2301f32e40 2242330220 S Bi:2:011:2 -115 32 <
ffff8e2301f326c0 2242333284 C Bi:2:011:2 0 32 = 72052b6d 00737643 00737643 00000000 00000044 ffffffff 6665712e 66647720
ffff8e2301f326c0 2242333290 S Bi:2:011:2 -115 32 <
ffff8e2301f32e40 2242336337 C Bi:2:011:2 0 32 = 013f2f70 02617643 02617643 00000000 00000044 ffffffff 6665712e 66657535
ffff8e2301f32e40 2242336342 S Bi:2:011:2 -115 32 <
ffff8e2301f326c0 2242338610 C Bi:2:011:2 0 4 = 72052b6d
ffff8e2301f326c0 2242338615 S Bi:2:011:2 -115 32 <
ffff8e2301f32240 2242338886 S Bo:2:011:2 -115 4 = 52058080
ffff8e2301f32240 2242338966 C Bo:2:011:2 0 4 >
ffff8e2301f32e40 2242342634 C Bi:2:011:2 0 32 = 52058080 00067643 00067643 00000000 00000044 ffffffff 6665712e 66637220
ffff8e2301f32e40 2242342639 S Bi:2:011:2 -115 32 <
ffff8e2301f326c0 2242345716 C Bi:2:011:2 0 32 = 013f2f70 02347643 02347643 00000000 00000044 ffffffff 6665712e 66607035
ffff8e2301f326c0 2242345721 S Bi:2:011:2 -115 32 <
ffff8e2301f32e40 2242348804 C Bi:2:011:2 0 32 = 72052b6d 00237643 00237643 00000000 00000044 ffffffff 6665712e 66617720
ffff8e2301f32e40 2242348808 S Bi:2:011:2 -115 32 <
ffff8e2301f326c0 2242351852 C Bi:2:011:2 0 32 = 013f2f70 02d17643 02d17643 00000000 00000044 ffffffff 6665712e 666e7535
ffff8e2301f326c0 2242351857 S Bi:2:011:2 -115 32 <
ffff8e2301f32e40 2242354142 C Bi:2:011:2 0 4 = 72052b6d
ffff8e2301f32e40 2242354147 S Bi:2:011:2 -115 32 <
ffff8e2301f32240 2242354439 S Bo:2:011:2 -115 4 = 52060080
ffff8e2301f32240 2242354476 C Bo:2:011:2 0 4 >
ffff8e2301f326c0 2242358170 C Bi:2:011:2 0 32 = 52060080 00007743 00007743 00000000 00000044 ffffffff 6566014d 7215034c
ffff8e2301f326c0 2242358176 S Bi:2:011:2 -115 32 <
ffff8e2301f32e40 2242361239 C Bi:2:011:2 0 32 = 1e767633 02447743 02447743 00000000 00000044 ffffffff 6665712e 67677035
ffff8e2301f32e40 2242361243 S Bi:2:011:2 -115 32 <
ffff8e2301f326c0 2242364306 C Bi:2:011:2 0 32 = 72052b6d 00737743 00737743 00000000 00000044 ffffffff 6665712e 67647720
ffff8e2301f326c0 2242364310 S Bi:2:011:2 -115 32 <
ffff8e2301f32e40 2242367374 C Bi:2:011:2 0 32 = 013f2f70 02617743 02617743 00000000 00000044 ffffffff 6665712e 67657535
ffff8e2301f32e40 2242367380 S Bi:2:011:2 -115 32 <
ffff8e2301f326c0 2242369637 C Bi:2:011:2 0 4 = 72052b6d
ffff8e2301f326c0 2242369641 S Bi:2:011:2 -115 32 <
ffff8e2301f32240 2242369914 S Bo:2:011:2 -115 4 = 52068080
ffff8e2301f32240 2242369972 C Bo:2:011:2 0 4 >
ffff8e2301f32e40 2242373644 C Bi:2:011:2 0 32 = 52068080 00067743 00067743 00000000 00000044 ffffffff 6665712e 67637220
ffff8e2301f32e40 2242373651 S Bi:2:011:2 -115 32 <
ffff8e2301f326c0 2242376713 C Bi:2:011:2 0 32 = 013f2f70 02347743 02347743 00000000 00000044 ffffffff 6665712e 67607035
ffff8e2301f326c0 2242376719 S Bi:2:011:2 -115 32 <
ffff8e2301f32e40 2242379806 C Bi:2:011:2 0 32 = 72052b6d 00237743 00237743 00000000 00000044 ffffffff 6665712e 67617720
ffff8e2301f32e40 2242379811 S Bi:2:011:2 -115 32 <
ffff8e2301f326c0 2242382849 C Bi:2:011:2 0 32 = 013f2f70 00067243 00060443 07521704 00000004 ffffffff 15147155 1e767530
ffff8e2301f326c0 2242382854 S Bi:2:011:2 -115 32 <
ffff8e2301f32e40 2242385169 C Bi:2:011:2 0 4 = 313bffff
ffff8e2301f32e40 2242385173 S Bi:2:011:2 -115 32 <
ffff8e2301f32240 2242385428 S Bo:2:011:2 -115 4 = 52070080
ffff8e2301f32240 2242385465 C Bo:2:011:2 0 4 >
ffff8e2301f326c0 2242389143 C Bi:2:011:2 0 32 = 52070080 ffffffff ffffffff ffffffff ffffffff ffffffff ffffffff ffffffff
ffff8e2301f326c0 2242389149 S Bi:2:011:2 -115 32 <
ffff8e2301f32e40 2242392214 C Bi:2:011:2 0 32 = ffffffff 00000a14 00000a14 00000000 00000004 ffffffff 601b6241 020411ff
ffff8e2301f32e40 2242392219 S Bi:2:011:2 -115 32 <
ffff8e2301f326c0 2242395294 C Bi:2:011:2 0 32 = ffffffff 00631a14 00631a14 00000000 00000004 ffffffff 1b051120 7967ffff
ffff8e2301f326c0 2242395300 S Bi:2:011:2 -115 32 <
ffff8e2301f32e40 2242398349 C Bi:2:011:2 0 32 = ffffffff 00731a14 00731a14 00000000 00000004 ffffffff 1b0511ff ffffffff
ffff8e2301f32e40 2242398353 S Bi:2:011:2 -115 32 <
ffff8e2301f326c0 2242400693 C Bi:2:011:2 0 4 = ffffffff
ffff8e2301f326c0 2242400697 S Bi:2:011:2 -115 32 <
ffff8e2301f32240 2242400965 S Bo:2:011:2 -115 4 = 52078080
ffff8e2301f32240 2242401000 C Bo:2:011:2 0 4 >
ffff8e2301f32e40 2242404717 C Bi:2:011:2 0 32 = 52078080 00431a14 00431a14 00000000 00000004 ffffffff 1b051120 7f67ffff
ffff8e2301f32e40 2242404723 S Bi:2:011:2 -115 32 <
ffff8e2301f326c0 2242407761 C Bi:2:011:2 0 32 = ffffffff 00531a14 00531a14 00000000 00000004 ffffffff 1b051120 7f64ffff
ffff8e2301f326c0 2242407767 S Bi:2:011:2 -115 32 <
ffff8e2301f32e40 2242410850 C Bi:2:011:2 0 32 = ffffffff 00c61a14 00361043 00000000 00000004 ffffffff 13196f39 63766931
ffff8e2301f32e40 2242410856 S Bi:2:011:2 -115 32 <
ffff8e2301f326c0 2242413984 C Bi:2:011:2 0 32 = ffffffff 00d61a14 00061043 00000000 00000004 ffffffff 13196f39 63ffffff
ffff8e2301f326c0 2242413988 S Bi:2:011:2 -115 32 <
ffff8e2301f32e40 2242416190 C Bi:2:011:2 0 4 = ffffffff
ffff8e2301f32e40 2242416195 S Bi:2:011:2 -115 32 <
ffff8e2301f32240 2242416473 S Bo:2:011:2 -115 4 = 52080080
ffff8e2301f32240 2242416510 C Bo:2:011:2 0 4 >
ffff8e2301f326c0 2242420215 C Bi:2:011:2 0 32 = 52080080 00261a14 00161043 00000000 00000004 ffffffff 13196f39 63766f31
ffff8e2301f326c0 2242420221 S Bi:2:011:2 -115 32 <
ffff8e2301f32e40 2242423283 C Bi:2:011:2 0 32 = ffffffff 00361a14 00661043 00000000 00000004 ffffffff 13196f39 63766f32
ffff8e2301f32e40 2242423287 S Bi:2:011:2 -115 32 <
ffff8e2301f326c0 2242426350 C Bi:2:011:2 0 32 = ffffffff 00c61a14 00361043 00000000 00000004 ffffffff 13196f39 60766931
ffff8e2301f326c0 2242426355 S Bi:2:011:2 -115 32 <
ffff8e2301f32e40 2242429420 C Bi:2:011:2 0 32 = ffffffff 00d61a14 00061043 00000000 00000004 ffffffff 13196f39 60ffffff
ffff8e2301f32e40 2242429424 S Bi:2:011:2 -115 32 <
ffff8e2301f326c0 2242431695 C Bi:2:011:2 0 4 = ffffffff
ffff8e2301f326c0 2242431699 S Bi:2:011:2 -115 32 <
ffff8e2301f32240 2242431948 S Bo:2:011:2 -115 4 = 52088080
ffff8e2301f32240 2242432008 C Bo:2:011:2 0 4 >
ffff8e2301f32e40 2242435693 C Bi:2:011:2 0 32 = 52088080 00261a14 00161043 00000000 00000004 ffffffff 13196f39 60766f31
ffff8e2301f32e40 2242435698 S Bi:2:011:2 -115 32 <
ffff8e2301f326c0 2242438761 C Bi:2:011:2 0 32 = ffffffff 00361a14 00661043 00000000 00000004 ffffffff 13196f39 60766f32
ffff8e2301f326c0 2242438767 S Bi:2:011:2 -115 32 <
ffff8e2301f32e40 2242441852 C Bi:2:011:2 0 32 = ffffffff 00731b14 00d32543 00000000 00000004 ffffffff 1e1f0e41 11050354
ffff8e2301f32e40 2242441857 S Bi:2:011:2 -115 32 <
ffff8e2301f326c0 2242444986 C Bi:2:011:2 0 32 = 60766931 00431b14 00232543 00000000 00000004 ffffffff 1e1f0e41 11050354
ffff8e2301f326c0 2242444989 S Bi:2:011:2 -115 32 <
ffff8e2301f32e40 2242447217 C Bi:2:011:2 0 4 = 60ffffff
ffff8e2301f32e40 2242447219 S Bi:2:011:2 -115 32 <
ffff8e2301f32240 2242447413 S Bo:2:011:2 -115 4 = 52090080
ffff8e2301f32240 2242447450 C Bo:2:011:2 0 4 >
ffff8e2301f326c0 2242451142 C Bi:2:011:2 0 32 = 52090080 00531b14 00332543 00000000 00000004 ffffffff 1e1f0e41 11050354
ffff8e2301f326c0 2242451145 S Bi:2:011:2 -115 32 <
ffff8e2301f32e40 2242454214 C Bi:2:011:2 0 32 = 60766f31 00c31a14 00032543 00000000 00000004 ffffffff 1e1f0e41 11050354
ffff8e2301f32e40 2242454218 S Bi:2:011:2 -115 32 <
ffff8e2301f326c0 2242457287 C Bi:2:011:2 0 32 = 60766f32 ffffffff ffffffff ffffffff ffffffff ffffffff ffffffff ffffffff
ffff8e2301f326c0 2242457289 S Bi:2:011:2 -115 32 <
ffff8e2301f32e40 2242460353 C Bi:2:011:2 0 32 = ffffffff 00763a43 00665a29 0000dc02 00000004 ffffffff 1b051120 7964ffff
ffff8e2301f32e40 2242460355 S Bi:2:011:2 -115 32 <
ffff8e2301f326c0 2242462737 C Bi:2:011:2 0 4 = ffffffff
ffff8e2301f326c0 2242462739 S Bi:2:011:2 -115 32 <
ffff8e2301f32240 2242462937 S Bo:2:011:2 -115 4 = 52098080
ffff8e2301f32240 2242462975 C Bo:2:011:2 0 4 >
ffff8e2301f32e40 2242466671 C Bi:2:011:2 0 32 = 52098080 00463a43 00765a29 0000dc02 00000004 ffffffff 1b051120 7967ffff
ffff8e2301f32e40 2242466673 S Bi:2:011:2 -115 32 <
ffff8e2301f326c0 2242469763 C Bi:2:011:2 0 32 = ffffffff 00003a43 00465a29 0000dc02 00000004 ffffffff 1b0511ff ffffffff
ffff8e2301f326c0 2242469765 S Bi:2:011:2 -115 32 <
ffff8e2301f32e40 2242472805 C Bi:2:011:2 0 32 = ffffffff 00c63543 00005a29 0000dc02 00000004 ffffffff 1b051120 7f67ffff
ffff8e2301f32e40 2242472807 S Bi:2:011:2 -115 32 <
ffff8e2301f326c0 2242475986 C Bi:2:011:2 0 32 = ffffffff 00d63543 00c65529 0000dc02 00000004 ffffffff 1b051120 7f64ffff
ffff8e2301f326c0 2242475988 S Bi:2:011:2 -115 32 <
ffff8e2301f32e40 2242478240 C Bi:2:011:2 0 4 = ffffffff
ffff8e2301f32e40 2242478243 S Bi:2:011:2 -115 32 <
ffff8e2301f32240 2242478479 S Bo:2:011:2 -115 4 = 520a0080
ffff8e2301f32240 2242478516 C Bo:2:011:2 0 4 >
ffff8e2301f326c0 2242482214 C Bi:2:011:2 0 32 = 520a0080 00063743 00063743 00000000 00000004 ffffffff 1b051120 013f2f70
ffff8e2301f326c0 2242482216 S Bi:2:011:2 -115 32 <
ffff8e2301f32e40 2242485286 C Bi:2:011:2 0 32 = 3e333aff 00001a14 00001014 00000000 00000004 ffffffff 1b051120 04392b63
ffff8e2301f32e40 2242485288 S Bi:2:011:2 -115 32 <
ffff8e2301f326c0 2242488351 C Bi:2:011:2 0 32 = 37ffffff 00001a14 00001a14 00000000 00000004 ffffffff 1b051120 01051656
ffff8e2301f326c0 2242488353 S Bi:2:011:2 -115 32 <
ffff8e2301f32e40 2242491419 C Bi:2:011:2 0 32 = ffffffff ffffffff ffffffff ffffffff ffffffff ffffffff ffffffff ffffffff
ffff8e2301f32e40 2242491423 S Bi:2:011:2 -115 32 <
ffff8e2301f326c0 2242493739 C Bi:2:011:2 0 4 = ffffffff
ffff8e2301f326c0 2242493743 S Bi:2:011:2 -115 32 <
ffff8e2301f32240 2242493938 S Bo:2:011:2 -115 4 = 520a8080
ffff8e2301f32240 2242493974 C Bo:2:011:2 0 4 >
ffff8e2301f32e40 2242497660 C Bi:2:011:2 0 32 = 520a8080 ffffffff ffffffff ffffffff ffffffff ffffffff ffffffff ffffffff
ffff8e2301f32e40 2242497666 S Bi:2:011:2 -115 32 <
ffff8e2301f326c0 2242500763 C Bi:2:011:2 0 32 = ffffffff ffffffff ffffffff ffffffff ffffffff ffffffff ffffffff ffffffff
ffff8e2301f326c0 2242500766 S Bi:2:011:2 -115 32 <
ffff8e2301f32e40 2242503807 C Bi:2:011:2 0 32 = ffffffff ffffffff ffffffff ffffffff ffffffff ffffffff ffffffff ffffffff
ffff8e2301f32e40 2242503809 S Bi:2:011:2 -115 32 <
ffff8e2301f326c0 2242506984 C Bi:2:011:2 0 32 = ffffffff ffffffff ffffffff ffffffff ffffffff ffffffff ffffffff ffffffff
ffff8e2301f326c0 2242506986 S Bi:2:011:2 -115 32 <
ffff8e2301f32e40 2242509262 C Bi:2:011:2 0 4 = ffffffff
ffff8e2301f32e40 2242509264 S Bi:2:011:2 -115 32 <
ffff8e2301f32240 2242509446 S Bo:2:011:2 -115 4 = 520b0080
ffff8e2301f32240 2242509481 C Bo:2:011:2 0 4 >
ffff8e2301f326c0 2242513192 C Bi:2:011:2 0 32 = 520b0080 ffffffff ffffffff ffffffff ffffffff ffffffff ffffffff ffffffff
ffff8e2301f326c0 2242513195 S Bi:2:011:2 -115 32 <
ffff8e2301f32e40 2242516264 C Bi:2:011:2 0 32 = ffffffff ffffffff ffffffff ffffffff ffffffff ffffffff ffffffff ffffffff
ffff8e2301f32e40 2242516267 S Bi:2:011:2 -115 32 <
ffff8e2301f326c0 2242519332 C Bi:2:011:2 0 32 = ffffffff ffffffff ffffffff ffffffff ffffffff ffffffff ffffffff ffffffff
ffff8e2301f326c0 2242519334 S Bi:2:011:2 -115 32 <
ffff8e2301f32e40 2242522393 C Bi:2:011:2 0 32 = ffffffff ffffffff ffffffff ffffffff ffffffff ffffffff ffffffff ffffffff
ffff8e2301f32e40 2242522395 S Bi:2:011:2 -115 32 <
ffff8e2301f326c0 2242524783 C Bi:2:011:2 0 4 = ffffffff
ffff8e2301f326c0 2242524785 S Bi:2:011:2 -115 32 <
ffff8e2301f32240 2242524960 S Bo:2:011:2 -115 4 = 520b8080
ffff8e2301f32240 2242524996 C Bo:2:011:2 0 4 >
ffff8e2301f32e40 2242528717 C Bi:2:011:2 0 32 = 520b8080 ffffffff ffffffff ffffffff ffffffff ffffffff ffffffff ffffffff
ffff8e2301f32e40 2242528720 S Bi:2:011:2 -115 32 <
ffff8e2301f326c0 2242531761 C Bi:2:011:2 0 32 = ffffffff ffffffff ffffffff ffffffff ffffffff ffffffff ffffffff ffffffff
ffff8e2301f326c0 2242531764 S Bi:2:011:2 -115 32 <
ffff8e2301f32e40 2242534852 C Bi:2:011:2 0 32 = ffffffff ffffffff ffffffff ffffffff ffffffff ffffffff ffffffff ffffffff
ffff8e2301f32e40 2242534854 S Bi:2:011:2 -115 32 <
ffff8e2301f326c0 2242537986 C Bi:2:011:2 0 32 = ffffffff ffffffff ffffffff ffffffff ffffffff ffffffff ffffffff ffffffff
ffff8e2301f326c0 2242537988 S Bi:2:011:2 -115 32 <
ffff8e2301f32e40 2242540280 C Bi:2:011:2 0 4 = ffffffff
ffff8e2301f32e40 2242540282 S Bi:2:011:2 -115 32 <
ffff8e2301f32240 2242540476 S Bo:2:011:2 -115 4 = 520c0080
ffff8e2301f32240 2242540512 C Bo:2:011:2 0 4 >
ffff8e2301f326c0 2242544215 C Bi:2:011:2 0 32 = 520c0080 ffffffff ffffffff ffffffff ffffffff ffffffff ffffffff ffffffff
ffff8e2301f326c0 2242544218 S Bi:2:011:2 -115 32 <
ffff8e2301f32e40 2242547284 C Bi:2:011:2 0 32 = ffffffff ffffffff ffffffff ffffffff ffffffff ffffffff ffffffff ffffffff
ffff8e2301f32e40 2242547286 S Bi:2:011:2 -115 32 <
ffff8e2301f326c0 2242550348 C Bi:2:011:2 0 32 = ffffffff ffffffff ffffffff ffffffff ffffffff ffffffff ffffffff ffffffff
ffff8e2301f326c0 2242550350 S Bi:2:011:2 -115 32 <
ffff8e2301f32e40 2242553420 C Bi:2:011:2 0 32 = ffffffff 0000c111 0000c111 00000000 00000045 ffffffff 133a2665 2031306f
ffff8e2301f32e40 2242553421 S Bi:2:011:2 -115 32 <
ffff8e2301f326c0 2242555786 C Bi:2:011:2 0 4 = 24336254
ffff8e2301f326c0 2242555787 S Bi:2:011:2 -115 32 <
ffff8e2301f32240 2242556036 S Bo:2:011:2 -115 4 = 520c8080
ffff8e2301f32240 2242556073 C Bo:2:011:2 0 4 >
ffff8e2301f32e40 2242559764 C Bi:2:011:2 0 32 = 520c8080 00d3c411 00d3c411 00000000 00000045 ffffffff 10332e6c 3324276e
ffff8e2301f32e40 2242559766 S Bi:2:011:2 -115 32 <
ffff8e2301f326c0 2242562851 C Bi:2:011:2 0 32 = 33ffffff 00005712 00005712 00000000 00000045 ffffffff 173b2772 35332c63
ffff8e2301f326c0 2242562853 S Bi:2:011:2 -115 32 <
ffff8e2301f32e40 2242565986 C Bi:2:011:2 0 32 = 2bffffff 00005412 00005412 00000000 00000045 ffffffff 10332e20 113f3679
ffff8e2301f32e40 2242565990 S Bi:2:011:2 -115 32 <
ffff8e2301f326c0 2242568984 C Bi:2:011:2 0 32 = 72102b72 00736a12 00736a12 00000000 00000045 ffffffff 10332e20 113f3679
ffff8e2301f326c0 2242568986 S Bi:2:011:2 -115 32 <
ffff8e2301f32e40 2242571310 C Bi:2:011:2 0 4 = 72021552
ffff8e2301f32e40 2242571313 S Bi:2:011:2 -115 32 <
ffff8e2301f32240 2242571581 S Bo:2:011:2 -115 4 = 520d0080
ffff8e2301f32240 2242571619 C Bo:2:011:2 0 4 >
ffff8e2301f326c0 2242575368 C Bi:2:011:2 0 32 = 520d0080 00067612 00067612 00000000 00000045 ffffffff 13790320 023f2e6f
ffff8e2301f326c0 2242575372 S Bi:2:011:2 -115 32 <
ffff8e2301f32e40 2242578402 C Bi:2:011:2 0 32 = 26760168 00737412 00737412 00000000 00000045 ffffffff 17312e69 3c222d6e
ffff8e2301f32e40 2242578405 S Bi:2:011:2 -115 32 <
ffff8e2301f326c0 2242581465 C Bi:2:011:2 0 32 = 72173270 00237512 00237512 00000000 00000045 ffffffff 01352d74 263f3168
ffff8e2301f326c0 2242581468 S Bi:2:011:2 -115 32 <
ffff8e2301f32e40 2242584534 C Bi:2:011:2 0 32 = 726673ff 00730a12 00730a12 00000000 00000045 ffffffff 01352d74 263f3168
ffff8e2301f32e40 2242584537 S Bi:2:011:2 -115 32 <
ffff8e2301f326c0 2242586830 C Bi:2:011:2 0 4 = 726670ff
ffff8e2301f326c0 2242586832 S Bi:2:011:2 -115 32 <
ffff8e2301f32240 2242587065 S Bo:2:011:2 -115 4 = 520d8080
ffff8e2301f32240 2242587104 C Bo:2:011:2 0 4 >
ffff8e2301f32e40 2242590831 C Bi:2:011:2 0 32 = 520d8080 00231412 00231412 00000000 00000045 ffffffff 01352d74 263f3168
ffff8e2301f32e40 2242590835 S Bi:2:011:2 -115 32 <
ffff8e2301f326c0 2242593855 C Bi:2:011:2 0 32 = 726671ff 00233012 00233012 00000000 00000045 ffffffff 01352d74 263f3168
ffff8e2301f326c0 2242593858 S Bi:2:011:2 -115 32 <
ffff8e2301f32e40 2242596985 C Bi:2:011:2 0 32 = 726676ff 00063612 00063612 00000000 00000045 ffffffff 0121236e 253f216b
ffff8e2301f32e40 2242596987 S Bi:2:011:2 -115 32 <
ffff8e2301f326c0 2242600031 C Bi:2:011:2 0 32 = 721815ff 0000c012 0000c012 00000000 00000045 ffffffff 133a2665 2031306f
ffff8e2301f326c0 2242600032 S Bi:2:011:2 -115 32 <
ffff8e2301f32e40 2242602330 C Bi:2:011:2 0 4 = 24336241
ffff8e2301f32e40 2242602334 S Bi:2:011:2 -115 32 <
ffff8e2301f32240 2242602544 S Bo:2:011:2 -115 4 = 520e0080
ffff8e2301f32240 2242602582 C Bo:2:011:2 0 4 >
ffff8e2301f326c0 2242606263 C Bi:2:011:2 0 32 = 520e0080 0000c112 0000c112 00000000 00000045 ffffffff 1c333574 3d212c61
ffff8e2301f326c0 2242606265 S Bi:2:011:2 -115 32 <
ffff8e2301f32e40 2242609330 C Bi:2:011:2 0 32 = 20323120 0000c512 0000c512 00000000 00000045 ffffffff 0121236e 253f216b
ffff8e2301f32e40 2242609333 S Bi:2:011:2 -115 32 <
ffff8e2301f326c0 2242612397 C Bi:2:011:2 0 32 = 721504ff 0000d312 0000d312 00000000 00000045 ffffffff 01352d74 263f3168
ffff8e2301f326c0 2242612399 S Bi:2:011:2 -115 32 <
ffff8e2301f32e40 2242615512 C Bi:2:011:2 0 32 = 726677ff 00064a13 00064a13 00000000 00000045 ffffffff 10332e20 113f3679
ffff8e2301f32e40 2242615514 S Bi:2:011:2 -115 32 <
ffff8e2301f326c0 2242617965 C Bi:2:011:2 0 4 = 72171250
ffff8e2301f326c0 2242617967 S Bi:2:011:2 -115 32 <
ffff8e2301f32240 2242618205 S Bo:2:011:2 -115 4 = 520e8080
ffff8e2301f32240 2242618243 C Bo:2:011:2 0 4 >
ffff8e2301f32e40 2242621989 C Bi:2:011:2 0 32 = 520e8080 610e5b13 610e5b13 00000000 00000045 ffffffff 52560a20 1a332e69
ffff8e2301f32e40 2242621993 S Bi:2:011:2 -115 32 <
ffff8e2301f326c0 2242625013 C Bi:2:011:2 0 32 = 223726ff 00737313 00737313 00000000 00000045 ffffffff 133a2620 130612ff
ffff8e2301f326c0 2242625015 S Bi:2:011:2 -115 32 <
ffff8e2301f32e40 2242628078 C Bi:2:011:2 0 32 = ffffffff 00007b13 00007b13 00000000 00000045 ffffffff 0121236e 253f216b
ffff8e2301f32e40 2242628080 S Bi:2:011:2 -115 32 <
ffff8e2301f326c0 2242631141 C Bi:2:011:2 0 32 = 72063069 00060313 00060313 00000000 00000045 ffffffff 17312e69 3c222d6e
ffff8e2301f326c0 2242631143 S Bi:2:011:2 -115 32 <
ffff8e2301f32e40 2242633534 C Bi:2:011:2 0 4 = 72023572
ffff8e2301f32e40 2242633536 S Bi:2:011:2 -115 32 <
ffff8e2301f32240 2242633773 S Bo:2:011:2 -115 4 = 520f0080
ffff8e2301f32240 2242633818 C Bo:2:011:2 0 4 >
ffff8e2301f326c0 2242637513 C Bi:2:011:2 0 32 = 520f0080 00234213 00234213 00000000 00000045 ffffffff 01352d74 263f3168
ffff8e2301f326c0 2242637516 S Bi:2:011:2 -115 32 <
ffff8e2301f32e40 2242640584 C Bi:2:011:2 0 32 = 726674ff 00061313 00061313 00000000 00000045 ffffffff 0121236e 253f216b
ffff8e2301f32e40 2242640588 S Bi:2:011:2 -115 32 <
ffff8e2301f326c0 2242643646 C Bi:2:011:2 0 32 = 720515ff 00732413 00732413 00000000 00000045 ffffffff 10332e20 113f3679
ffff8e2301f326c0 2242643648 S Bi:2:011:2 -115 32 <
ffff8e2301f32e40 2242646717 C Bi:2:011:2 0 32 = 72171649 00005413 00005413 00000000 00000045 ffffffff 02050c49 72193273
ffff8e2301f32e40 2242646718 S Bi:2:011:2 -115 32 <
ffff8e2301f326c0 2242649076 C Bi:2:011:2 0 4 = ffffffff
ffff8e2301f326c0 2242649078 S Bi:2:011:2 -115 32 <
ffff8e2301f32240 2242649291 S Bo:2:011:2 -115 4 = 520f8080
ffff8e2301f32240 2242649328 C Bo:2:011:2 0 4 >
ffff8e2301f32e40 2242653056 C Bi:2:011:2 0 32 = 520f8080 00000a13 00000a13 00000000 00000045 ffffffff 17110341 72042364
ffff8e2301f32e40 2242653058 S Bi:2:011:2 -115 32 <
ffff8e2301f326c0 2242656122 C Bi:2:011:2 0 32 = 3324ffff 62655613 62655613 00000000 00000045 ffffffff 01212b73 21262d72
ffff8e2301f326c0 2242656124 S Bi:2:011:2 -115 32 <
ffff8e2301f32e40 2242659193 C Bi:2:011:2 0 32 = 26ffffff 0261d341 0261d341 00000000 00000045 ffffffff 1b242b73 3a760147
ffff8e2301f32e40 2242659195 S Bi:2:011:2 -115 32 <
ffff8e2301f326c0 2242662294 C Bi:2:011:2 0 32 = ffffffff 00000113 00000113 00000000 00000045 ffffffff 01352d74 263f3168
ffff8e2301f326c0 2242662297 S Bi:2:011:2 -115 32 <
ffff8e2301f32e40 2242664583 C Bi:2:011:2 0 4 = 72042364
ffff8e2301f32e40 2242664587 S Bi:2:011:2 -115 32 <
ffff8e2301f32240 2242666041 S Bo:2:011:2 -115 4 = 52100080
ffff8e2301f32240 2242666081 C Bo:2:011:2 0 4 >
ffff8e2301f326c0 2242669767 C Bi:2:011:2 0 32 = 52100080 00230613 00230613 00000000 00000045 ffffffff 01352d74 263f3168
ffff8e2301f326c0 2242669773 S Bi:2:011:2 -115 32 <
ffff8e2301f32e40 2242672872 C Bi:2:011:2 0 32 = 721b2b6c 00007224 00007224 00000000 00000045 ffffffff 15030352 1676074d
ffff8e2301f32e40 2242672875 S Bi:2:011:2 -115 32 <
ffff8e2301f326c0 2242675992 C Bi:2:011:2 0 32 = 170405ff 00006724 00006724 00000000 00000045 ffffffff 131f102d 131f10ff
ffff8e2301f326c0 2242675995 S Bi:2:011:2 -115 32 <
ffff8e2301f32e40 2242678987 C Bi:2:011:2 0 32 = ffffffff 0023c024 0023c024 00000000 00000045 ffffffff 131f102d 131f10ff
ffff8e2301f32e40 2242678990 S Bi:2:011:2 -115 32 <
ffff8e2301f326c0 2242681264 C Bi:2:011:2 0 4 = ffffffff
ffff8e2301f326c0 2242681267 S Bi:2:011:2 -115 32 <
ffff8e2301f32240 2242681551 S Bo:2:011:2 -115 4 = 52108080
ffff8e2301f32240 2242681588 C Bo:2:011:2 0 4 >
ffff8e2301f32e40 2242685287 C Bi:2:011:2 0 32 = 52108080 00236124 00236124 00000000 00000045 ffffffff 131f102d 131f10ff
ffff8e2301f32e40 2242685289 S Bi:2:011:2 -115 32 <
ffff8e2301f326c0 2242688353 C Bi:2:011:2 0 32 = ffffffff 00064728 00064728 00000000 00000045 ffffffff 131f102d 131f10ff
ffff8e2301f326c0 2242688356 S Bi:2:011:2 -115 32 <
ffff8e2301f32e40 2242691422 C Bi:2:011:2 0 32 = ffffffff 00002324 00002324 00000000 00000045 ffffffff 131f102d 131f10ff
ffff8e2301f32e40 2242691425 S Bi:2:011:2 -115 32 <
ffff8e2301f326c0 2242694487 C Bi:2:011:2 0 32 = ffffffff 00234b29 00234b29 00000000 00000045 ffffffff 131f102d 131f10ff
ffff8e2301f326c0 2242694490 S Bi:2:011:2 -115 32 <
ffff8e2301f32e40 2242696788 C Bi:2:011:2 0 4 = ffffffff
ffff8e2301f32e40 2242696791 S Bi:2:011:2 -115 32 <
ffff8e2301f32240 2242697344 S Bo:2:011:2 -115 4 = 52110080
ffff8e2301f32240 2242697383 C Bo:2:011:2 0 4 >
ffff8e2301f326c0 2242701102 C Bi:2:011:2 0 32 = 52110080 0073d127 0073d127 00000000 00000045 ffffffff 131f102d 131f10ff
ffff8e2301f326c0 2242701105 S Bi:2:011:2 -115 32 <
ffff8e2301f32e40 2242704173 C Bi:2:011:2 0 32 = ffffffff 00066624 00066624 00000000 00000045 ffffffff 131f102d 131f10ff
ffff8e2301f32e40 2242704176 S Bi:2:011:2 -115 32 <
ffff8e2301f326c0 2242707245 C Bi:2:011:2 0 32 = ffffffff 00237024 00237024 00000000 00000045 ffffffff 131f102d 131f10ff
ffff8e2301f326c0 2242707248 S Bi:2:011:2 -115 32 <
ffff8e2301f32e40 2242710309 C Bi:2:011:2 0 32 = ffffffff 0006d326 0006d326 00000000 00000045 ffffffff 131f102d 131f10ff
ffff8e2301f32e40 2242710312 S Bi:2:011:2 -115 32 <
ffff8e2301f326c0 2242712649 C Bi:2:011:2 0 4 = ffffffff
ffff8e2301f326c0 2242712658 S Bi:2:011:2 -115 32 <
ffff8e2301f32240 2242712857 S Bo:2:011:2 -115 4 = 52118080
ffff8e2301f32240 2242712966 C Bo:2:011:2 0 4 >
ffff8e2301f32e40 2242716704 C Bi:2:011:2 0 32 = 52118080 00233024 00233024 00000000 00000045 ffffffff 52170641 52760543
ffff8e2301f32e40 2242716717 S Bi:2:011:2 -115 32 <
ffff8e2301f326c0 2242719753 C Bi:2:011:2 0 32 = 1bffffff 00004624 00004624 00000000 00000045 ffffffff 52170641 52760543
ffff8e2301f326c0 2242719767 S Bi:2:011:2 -115 32 <
ffff8e2301f32e40 2242722841 C Bi:2:011:2 0 32 = 1bffffff 00005224 00005224 00000000 00000045 ffffffff 52170641 52760543
ffff8e2301f32e40 2242722855 S Bi:2:011:2 -115 32 <
ffff8e2301f326c0 2242725887 C Bi:2:011:2 0 32 = 1bffffff 00066224 00066224 00000000 00000045 ffffffff 52170641 52760543
ffff8e2301f326c0 2242725905 S Bi:2:011:2 -115 32 <
ffff8e2301f32e40 2242728177 C Bi:2:011:2 0 4 = 1bffffff
ffff8e2301f32e40 2242728190 S Bi:2:011:2 -115 32 <
ffff8e2301f32240 2242728424 S Bo:2:011:2 -115 4 = 52120080
ffff8e2301f32240 2242728463 C Bo:2:011:2 0 4 >
ffff8e2301f326c0 2242732204 C Bi:2:011:2 0 32 = 52120080 00006124 00006124 00000000 00000045 ffffffff 52170641 52760543
ffff8e2301f326c0 2242732217 S Bi:2:011:2 -115 32 <
ffff8e2301f32e40 2242735274 C Bi:2:011:2 0 32 = 1bffffff 0073d624 0073d624 00000000 00000045 ffffffff 52170641 52760543
ffff8e2301f32e40 2242735286 S Bi:2:011:2 -115 32 <
ffff8e2301f326c0 2242738324 C Bi:2:011:2 0 32 = 1bffffff 0006d424 0006d424 00000000 00000045 ffffffff 52170641 52760543
ffff8e2301f326c0 2242738337 S Bi:2:011:2 -115 32 <
ffff8e2301f32e40 2242741409 C Bi:2:011:2 0 32 = 1bffffff 0023d524 0023d524 00000000 00000045 ffffffff 52170641 52760543
ffff8e2301f32e40 2242741423 S Bi:2:011:2 -115 32 <
ffff8e2301f326c0 2242743704 C Bi:2:011:2 0 4 = 1bffffff
ffff8e2301f326c0 2242743719 S Bi:2:011:2 -115 32 <
ffff8e2301f32240 2242743938 S Bo:2:011:2 -115 4 = 52128080
ffff8e2301f32240 2242743979 C Bo:2:011:2 0 4 >
ffff8e2301f32e40 2242747714 C Bi:2:011:2 0 32 = 52128080 00065b23 00065b23 00000000 00000045 ffffffff 13061252 1d170148
ffff8e2301f32e40 2242747726 S Bi:2:011:2 -115 32 <
ffff8e2301f326c0 2242750751 C Bi:2:011:2 0 32 = ffffffff 00236224 00236224 00000000 00000045 ffffffff 13061252 1d170148
ffff8e2301f326c0 2242750766 S Bi:2:011:2 -115 32 <
ffff8e2301f32e40 2242753841 C Bi:2:011:2 0 32 = ffffffff 00730a37 00730a37 00000000 00000045 ffffffff 13061252 1d170148
ffff8e2301f32e40 2242753856 S Bi:2:011:2 -115 32 <
ffff8e2301f326c0 2242757029 C Bi:2:011:2 0 32 = ffffffff 0006c127 0006c127 00000000 00000045 ffffffff 13061252 1d170148
ffff8e2301f326c0 2242757042 S Bi:2:011:2 -115 32 <
ffff8e2301f32e40 2242759204 C Bi:2:011:2 0 4 = ffffffff
ffff8e2301f32e40 2242759217 S Bi:2:011:2 -115 32 <
ffff8e2301f32240 2242759429 S Bo:2:011:2 -115 4 = 52130080
ffff8e2301f32240 2242759471 C Bo:2:011:2 0 4 >
ffff8e2301f326c0 2242763179 C Bi:2:011:2 0 32 = 52130080 00236737 00236737 00000000 00000045 ffffffff 06191545 52ffffff
ffff8e2301f326c0 2242763194 S Bi:2:011:2 -115 32 <
ffff8e2301f32e40 2242766248 C Bi:2:011:2 0 32 = ffffffff 0023d326 0023d326 00000000 00000045 ffffffff 06191545 52ffffff
ffff8e2301f32e40 2242766261 S Bi:2:011:2 -115 32 <
ffff8e2301f326c0 2242769318 C Bi:2:011:2 0 32 = ffffffff 00064a37 00064a37 00000000 00000045 ffffffff 06191545 52ffffff
ffff8e2301f326c0 2242769331 S Bi:2:011:2 -115 32 <
ffff8e2301f32e40 2242772387 C Bi:2:011:2 0 32 = ffffffff 00735a24 00735a24 00000000 00000045 ffffffff 06191545 52ffffff
ffff8e2301f32e40 2242772402 S Bi:2:011:2 -115 32 <
ffff8e2301f326c0 2242774726 C Bi:2:011:2 0 4 = ffffffff
ffff8e2301f326c0 2242774741 S Bi:2:011:2 -115 32 <
ffff8e2301f32240 2242774942 S Bo:2:011:2 -115 4 = 52138080
ffff8e2301f32240 2242774984 C Bo:2:011:2 0 4 >
ffff8e2301f32e40 2242778705 C Bi:2:011:2 0 32 = 52138080 00062124 00062124 00000000 00000045 ffffffff 06191545 52ffffff
ffff8e2301f32e40 2242778718 S Bi:2:011:2 -115 32 <
ffff8e2301f326c0 2242781770 C Bi:2:011:2 0 32 = ffffffff 00236424 00236424 00000000 00000045 ffffffff 1d0611ff ffffffff
ffff8e2301f326c0 2242781779 S Bi:2:011:2 -115 32 <
ffff8e2301f32e40 2242784840 C Bi:2:011:2 0 32 = ffffffff 00234724 00234724 00000000 00000045 ffffffff 1d0611ff ffffffff
ffff8e2301f32e40 2242784854 S Bi:2:011:2 -115 32 <
ffff8e2301f326c0 2242788023 C Bi:2:011:2 0 32 = ffffffff 00737034 00737034 00000000 00000045 ffffffff 1d0611ff ffffffff
ffff8e2301f326c0 2242788038 S Bi:2:011:2 -115 32 <
ffff8e2301f32e40 2242790226 C Bi:2:011:2 0 4 = ffffffff
ffff8e2301f32e40 2242790239 S Bi:2:011:2 -115 32 <
ffff8e2301f32240 2242790441 S Bo:2:011:2 -115 4 = 52140080
ffff8e2301f32240 2242790480 C Bo:2:011:2 0 4 >
ffff8e2301f326c0 2242794204 C Bi:2:011:2 0 32 = 52140080 00066031 00066031 00000000 00000045 ffffffff 1d0611ff ffffffff
ffff8e2301f326c0 2242794217 S Bi:2:011:2 -115 32 <
ffff8e2301f32e40 2242797274 C Bi:2:011:2 0 32 = ffffffff 00063737 00063737 00000000 00000045 ffffffff 1d0611ff ffffffff
ffff8e2301f32e40 2242797287 S Bi:2:011:2 -115 32 <
ffff8e2301f326c0 2242800331 C Bi:2:011:2 0 32 = ffffffff 0073cb27 0073cb27 00000000 00000045 ffffffff 1d0611ff ffffffff
ffff8e2301f326c0 2242800344 S Bi:2:011:2 -115 32 <
ffff8e2301f32e40 2242803419 C Bi:2:011:2 0 32 = ffffffff 0000c126 0000c126 00000000 00000045 ffffffff 1d0611ff ffffffff
ffff8e2301f32e40 2242803432 S Bi:2:011:2 -115 32 <
ffff8e2301f326c0 2242805774 C Bi:2:011:2 0 4 = ffffffff
ffff8e2301f326c0 2242805788 S Bi:2:011:2 -115 32 <
ffff8e2301f32240 2242806036 S Bo:2:011:2 -115 4 = 52148080
ffff8e2301f32240 2242806079 C Bo:2:011:2 0 4 >
ffff8e2301f32e40 2242809800 C Bi:2:011:2 0 32 = 52148080 00736124 00736124 00000000 00000045 ffffffff 13020b53 ffffffff
ffff8e2301f32e40 2242809814 S Bi:2:011:2 -115 32 <
ffff8e2301f326c0 2242812861 C Bi:2:011:2 0 32 = ffffffff 0073d724 0073d724 00000000 00000045 ffffffff 13020b53 ffffffff
ffff8e2301f326c0 2242812871 S Bi:2:011:2 -115 32 <
ffff8e2301f32e40 2242816040 C Bi:2:011:2 0 32 = ffffffff 0023d724 0023d724 00000000 00000045 ffffffff 13020b53 ffffffff
ffff8e2301f32e40 2242816050 S Bi:2:011:2 -115 32 <
ffff8e2301f326c0 2242819022 C Bi:2:011:2 0 32 = ffffffff 0000d524 0000d524 00000000 00000045 ffffffff 13020b53 ffffffff
ffff8e2301f326c0 2242819039 S Bi:2:011:2 -115 32 <
ffff8e2301f32e40 2242821297 C Bi:2:011:2 0 4 = ffffffff
ffff8e2301f32e40 2242821310 S Bi:2:011:2 -115 32 <
ffff8e2301f32240 2242821513 S Bo:2:011:2 -115 4 = 52150080
ffff8e2301f32240 2242821553 C Bo:2:011:2 0 4 >
ffff8e2301f326c0 2242825275 C Bi:2:011:2 0 32 = 52150080 00006129 00006129 00000000 00000045 ffffffff 13020b53 ffffffff
ffff8e2301f326c0 2242825287 S Bi:2:011:2 -115 32 <
ffff8e2301f32e40 2242828311 C Bi:2:011:2 0 32 = ffffffff 00067624 00067624 00000000 00000045 ffffffff 52130620 1304104f
ffff8e2301f32e40 2242828321 S Bi:2:011:2 -115 32 <
ffff8e2301f326c0 2242831409 C Bi:2:011:2 0 32 = 0505ffff 00006424 00006424 00000000 00000045 ffffffff 52130620 1304104f
ffff8e2301f326c0 2242831424 S Bi:2:011:2 -115 32 <
ffff8e2301f32e40 2242834476 C Bi:2:011:2 0 32 = 0505ffff 00233230 00233230 00000000 00000045 ffffffff 52130620 1304104f
ffff8e2301f32e40 2242834490 S Bi:2:011:2 -115 32 <
ffff8e2301f326c0 2242836809 C Bi:2:011:2 0 4 = 0505ffff
ffff8e2301f326c0 2242836821 S Bi:2:011:2 -115 32 <
ffff8e2301f32240 2242837065 S Bo:2:011:2 -115 4 = 52158080
ffff8e2301f32240 2242837104 C Bo:2:011:2 0 4 >
ffff8e2301f32e40 2242840814 C Bi:2:011:2 0 32 = 52158080 00732733 00732733 00000000 00000045 ffffffff 52130620 1304104f
ffff8e2301f32e40 2242840823 S Bi:2:011:2 -115 32 <
ffff8e2301f326c0 2242843860 C Bi:2:011:2 0 32 = 0505ffff 00066024 00066024 00000000 00000045 ffffffff 13040f59 72170343
ffff8e2301f326c0 2242843868 S Bi:2:011:2 -115 32 <
ffff8e2301f32e40 2242846991 C Bi:2:011:2 0 32 = ffffffff 00005325 00005325 00000000 00000045 ffffffff 13040f59 72170343
ffff8e2301f32e40 2242846993 S Bi:2:011:2 -115 32 <
ffff8e2301f326c0 2242850034 C Bi:2:011:2 0 32 = ffffffff 00730a08 00730a08 00000000 00000045 ffffffff 01171020 52131143
ffff8e2301f326c0 2242850036 S Bi:2:011:2 -115 32 <
ffff8e2301f32e40 2242852286 C Bi:2:011:2 0 4 = 0713ffff
ffff8e2301f32e40 2242852288 S Bi:2:011:2 -115 32 <
ffff8e2301f32240 2242852527 S Bo:2:011:2 -115 4 = 52160080
ffff8e2301f32240 2242852568 C Bo:2:011:2 0 4 >
ffff8e2301f326c0 2242856261 C Bi:2:011:2 0 32 = 52160080 0000c227 0000c227 00000000 00000045 ffffffff 1e191520 1e131445
ffff8e2301f326c0 2242856263 S Bi:2:011:2 -115 32 <
ffff8e2301f32e40 2242859331 C Bi:2:011:2 0 32 = 1effffff ffffffff ffffffff ffffffff ffffffff ffffffff ffffffff ffffffff
ffff8e2301f32e40 2242859334 S Bi:2:011:2 -115 32 <
ffff8e2301f326c0 2242862398 C Bi:2:011:2 0 32 = ffffffff ffffffff ffffffff ffffffff ffffffff ffffffff ffffffff ffffffff
ffff8e2301f326c0 2242862400 S Bi:2:011:2 -115 32 <
ffff8e2301f32e40 2242865466 C Bi:2:011:2 0 32 = ffffffff ffffffff ffffffff ffffffff ffffffff ffffffff ffffffff ffffffff
ffff8e2301f32e40 2242865468 S Bi:2:011:2 -115 32 <
ffff8e2301f326c0 2242867786 C Bi:2:011:2 0 4 = ffffffff
ffff8e2301f326c0 2242867788 S Bi:2:011:2 -115 32 <
ffff8e2301f32240 2242867996 S Bo:2:011:2 -115 4 = 52168080
ffff8e2301f32240 2242868033 C Bo:2:011:2 0 4 >
ffff8e2301f32e40 2242871718 C Bi:2:011:2 0 32 = 52168080 ffffffff ffffffff ffffffff ffffffff ffffffff ffffffff ffffffff
ffff8e2301f32e40 2242871721 S Bi:2:011:2 -115 32 <
ffff8e2301f326c0 2242874831 C Bi:2:011:2 0 32 = ffffffff ffffffff ffffffff ffffffff ffffffff ffffffff ffffffff ffffffff
ffff8e2301f326c0 2242874842 S Bi:2:011:2 -115 32 <
ffff8e2301f32e40 2242877888 C Bi:2:011:2 0 32 = ffffffff ffffffff ffffffff ffffffff ffffffff ffffffff ffffffff ffffffff
ffff8e2301f32e40 2242877903 S Bi:2:011:2 -115 32 <
ffff8e2301f326c0 2242881021 C Bi:2:011:2 0 32 = ffffffff ffffffff ffffffff ffffffff ffffffff ffffffff ffffffff ffffffff
ffff8e2301f326c0 2242881036 S Bi:2:011:2 -115 32 <
ffff8e2301f32e40 2242883343 C Bi:2:011:2 0 4 = ffffffff
ffff8e2301f32e40 2242883358 S Bi:2:011:2 -115 32 <
ffff8e2301f32240 2242883551 S Bo:2:011:2 -115 4 = 52170080
ffff8e2301f32240 2242883590 C Bo:2:011:2 0 4 >
ffff8e2301f326c0 2242887324 C Bi:2:011:2 0 32 = 52170080 ffffffff ffffffff ffffffff ffffffff ffffffff ffffffff ffffffff
ffff8e2301f326c0 2242887337 S Bi:2:011:2 -115 32 <
ffff8e2301f32e40 2242890386 C Bi:2:011:2 0 32 = ffffffff ffffffff ffffffff ffffffff ffffffff ffffffff ffffffff ffffffff
ffff8e2301f32e40 2242890401 S Bi:2:011:2 -115 32 <
ffff8e2301f326c0 2242893455 C Bi:2:011:2 0 32 = ffffffff ffffffff ffffffff ffffffff ffffffff ffffffff ffffffff ffffffff
ffff8e2301f326c0 2242893471 S Bi:2:011:2 -115 32 <
ffff8e2301f32e40 2242896526 C Bi:2:011:2 0 32 = ffffffff ffffffff ffffffff ffffffff ffffffff ffffffff ffffffff ffffffff
ffff8e2301f32e40 2242896541 S Bi:2:011:2 -115 32 <
ffff8e2301f326c0 2242898880 C Bi:2:011:2 0 4 = ffffffff
ffff8e2301f326c0 2242898895 S Bi:2:011:2 -115 32 <
ffff8e2301f32240 2242899086 S Bo:2:011:2 -115 4 = 52178080
ffff8e2301f32240 2242899125 C Bo:2:011:2 0 4 >
ffff8e2301f32e40 2242902854 C Bi:2:011:2 0 32 = 52178080 ffffffff ffffffff ffffffff ffffffff ffffffff ffffffff ffffffff
ffff8e2301f32e40 2242902869 S Bi:2:011:2 -115 32 <
ffff8e2301f326c0 2242906021 C Bi:2:011:2 0 32 = ffffffff ffffffff ffffffff ffffffff ffffffff ffffffff ffffffff ffffffff
ffff8e2301f326c0 2242906035 S Bi:2:011:2 -115 32 <
ffff8e2301f32e40 2242909021 C Bi:2:011:2 0 32 = ffffffff ffffffff ffffffff ffffffff ffffffff ffffffff ffffffff ffffffff
ffff8e2301f32e40 2242909034 S Bi:2:011:2 -115 32 <
ffff8e2301f326c0 2242912055 C Bi:2:011:2 0 32 = ffffffff ffffffff ffffffff ffffffff ffffffff ffffffff ffffffff ffffffff
ffff8e2301f326c0 2242912068 S Bi:2:011:2 -115 32 <
ffff8e2301f32e40 2242914363 C Bi:2:011:2 0 4 = ffffffff
ffff8e2301f32e40 2242914378 S Bi:2:011:2 -115 32 <
ffff8e2301f32240 2242914577 S Bo:2:011:2 -115 4 = 52180080
ffff8e2301f32240 2242914617 C Bo:2:011:2 0 4 >
ffff8e2301f326c0 2242918338 C Bi:2:011:2 0 32 = 52180080 ffffffff ffffffff ffffffff ffffffff ffffffff ffffffff ffffffff
ffff8e2301f326c0 2242918351 S Bi:2:011:2 -115 32 <
ffff8e2301f32e40 2242921410 C Bi:2:011:2 0 32 = ffffffff ffffffff ffffffff ffffffff ffffffff ffffffff ffffffff ffffffff
ffff8e2301f32e40 2242921423 S Bi:2:011:2 -115 32 <
ffff8e2301f326c0 2242924477 C Bi:2:011:2 0 32 = ffffffff ffffffff ffffffff ffffffff ffffffff ffffffff ffffffff ffffffff
ffff8e2301f326c0 2242924490 S Bi:2:011:2 -115 32 <
ffff8e2301f32e40 2242927521 C Bi:2:011:2 0 32 = ffffffff ffffffff ffffffff ffffffff ffffffff ffffffff ffffffff ffffffff
ffff8e2301f32e40 2242927533 S Bi:2:011:2 -115 32 <
ffff8e2301f326c0 2242929864 C Bi:2:011:2 0 4 = ffffffff
ffff8e2301f326c0 2242929877 S Bi:2:011:2 -115 32 <
ffff8e2301f32240 2242930065 S Bo:2:011:2 -115 4 = 52188080
ffff8e2301f32240 2242930107 C Bo:2:011:2 0 4 >
ffff8e2301f32e40 2242933848 C Bi:2:011:2 0 32 = 52188080 ffffffff ffffffff ffffffff ffffffff ffffffff ffffffff ffffffff
ffff8e2301f32e40 2242933860 S Bi:2:011:2 -115 32 <
ffff8e2301f326c0 2242936862 C Bi:2:011:2 0 32 = ffffffff ffffffff ffffffff ffffffff ffffffff ffffffff ffffffff ffffffff
ffff8e2301f326c0 2242936879 S Bi:2:011:2 -115 32 <
ffff8e2301f32e40 2242940020 C Bi:2:011:2 0 32 = ffffffff 00002a15 00002a15 00003703 00000044 ffffffff 161f1154 52131153
ffff8e2301f32e40 2242940035 S Bi:2:011:2 -115 32 <
ffff8e2301f326c0 2242943046 C Bi:2:011:2 0 32 = 72152a2e 00002215 00002215 00003703 00000044 ffffffff 11190353 06111741
ffff8e2301f326c0 2242943059 S Bi:2:011:2 -115 32 <
ffff8e2301f32e40 2242945387 C Bi:2:011:2 0 4 = 52126243
ffff8e2301f32e40 2242945402 S Bi:2:011:2 -115 32 <
ffff8e2301f32240 2242945631 S Bo:2:011:2 -115 4 = 52190080
ffff8e2301f32240 2242945673 C Bo:2:011:2 0 4 >
ffff8e2301f326c0 2242949413 C Bi:2:011:2 0 32 = 52190080 00232115 00232115 00003703 00000044 ffffffff 01171020 113e6c36
ffff8e2301f326c0 2242949428 S Bi:2:011:2 -115 32 <
ffff8e2301f32e40 2242952450 C Bi:2:011:2 0 32 = 65ffffff 00002415 00002415 00003703 00000044 ffffffff 10332e66 33253620
ffff8e2301f32e40 2242952459 S Bi:2:011:2 -115 32 <
ffff8e2301f326c0 2242955525 C Bi:2:011:2 0 32 = 040211ff 00233a15 00236616 00003703 00000044 ffffffff 1f171049 1c17624d
ffff8e2301f326c0 2242955533 S Bi:2:011:2 -115 32 <
ffff8e2301f32e40 2242958587 C Bi:2:011:2 0 32 = 60ffffff 00002115 00002115 00003703 00000044 ffffffff 011e0b50 7f050a49
ffff8e2301f32e40 2242958592 S Bi:2:011:2 -115 32 <
ffff8e2301f326c0 2242960968 C Bi:2:011:2 0 4 = 02767236
ffff8e2301f326c0 2242960972 S Bi:2:011:2 -115 32 <
ffff8e2301f32240 2242961236 S Bo:2:011:2 -115 4 = 52198080
ffff8e2301f32240 2242961274 C Bo:2:011:2 0 4 >
ffff8e2301f32e40 2242965028 C Bi:2:011:2 0 32 = 52198080 00002615 00002615 00003703 00000044 ffffffff 011e0b50 7f050a49
ffff8e2301f32e40 2242965034 S Bi:2:011:2 -115 32 <
ffff8e2301f326c0 2242968039 C Bi:2:011:2 0 32 = 02767238 00002715 00002715 00003703 00000044 ffffffff 01171020 02191054
ffff8e2301f326c0 2242968045 S Bi:2:011:2 -115 32 <
ffff8e2301f32e40 2242971102 C Bi:2:011:2 0 32 = 726772ff 00063a15 00066616 00003703 00000044 ffffffff 1f171049 1c17624d
ffff8e2301f32e40 2242971106 S Bi:2:011:2 -115 32 <
ffff8e2301f326c0 2242974173 C Bi:2:011:2 0 32 = 63ffffff 00062415 00062415 00003703 00004044 ffffffff 10040b44 15136231
ffff8e2301f326c0 2242974176 S Bi:2:011:2 -115 32 <
ffff8e2301f32e40 2242976562 C Bi:2:011:2 0 4 = 61ffffff
ffff8e2301f32e40 2242976567 S Bi:2:011:2 -115 32 <
ffff8e2301f32240 2242976827 S Bo:2:011:2 -115 4 = 521a0080
ffff8e2301f32240 2242976864 C Bo:2:011:2 0 4 >
ffff8e2301f326c0 2242980618 C Bi:2:011:2 0 32 = 521a0080 00002515 00002515 00003703 00000044 ffffffff 02191054 72191253
ffff8e2301f326c0 2242980624 S Bi:2:011:2 -115 32 <
ffff8e2301f32e40 2242983654 C Bi:2:011:2 0 32 = 726776ff 00062715 00062715 00003703 00000044 ffffffff 04021120 6367ffff
ffff8e2301f32e40 2242983660 S Bi:2:011:2 -115 32 <
ffff8e2301f326c0 2242986723 C Bi:2:011:2 0 32 = ffffffff 00062615 00062615 00003703 00000044 ffffffff 11170e4c 1b180520
ffff8e2301f326c0 2242986727 S Bi:2:011:2 -115 32 <
ffff8e2301f32e40 2242989770 C Bi:2:011:2 0 32 = 626fffff 00732415 00732415 00003703 00000044 ffffffff 011e0b50 7f050a49
ffff8e2301f32e40 2242989776 S Bi:2:011:2 -115 32 <
ffff8e2301f326c0 2242992059 C Bi:2:011:2 0 4 = 02767532
ffff8e2301f326c0 2242992070 S Bi:2:011:2 -115 32 <
ffff8e2301f32240 2242992287 S Bo:2:011:2 -115 4 = 521a8080
ffff8e2301f32240 2242992326 C Bo:2:011:2 0 4 >
ffff8e2301f32e40 2242996067 C Bi:2:011:2 0 32 = 521a8080 00232a15 00232a15 00003703 00000044 ffffffff 011e0b50 7f050a49
ffff8e2301f32e40 2242996073 S Bi:2:011:2 -115 32 <
ffff8e2301f326c0 2242999108 C Bi:2:011:2 0 32 = 02767537 00062a15 00062a15 00003703 00004044 ffffffff 01171020 01020354
ffff8e2301f326c0 2242999114 S Bi:2:011:2 -115 32 <
ffff8e2301f32e40 2243002179 C Bi:2:011:2 0 32 = 17767337 00733215 00735416 00003703 00000044 ffffffff 1f171049 1c176252
ffff8e2301f32e40 2243002185 S Bi:2:011:2 -115 32 <
ffff8e2301f326c0 2243005275 C Bi:2:011:2 0 32 = 020210ff 00233015 00235a16 00003703 00000044 ffffffff 1f171049 1c176252
ffff8e2301f326c0 2243005281 S Bi:2:011:2 -115 32 <
ffff8e2301f32e40 2243007614 C Bi:2:011:2 0 4 = 020210ff
ffff8e2301f32e40 2243007626 S Bi:2:011:2 -115 32 <
ffff8e2301f32240 2243007847 S Bo:2:011:2 -115 4 = 521b0080
ffff8e2301f32240 2243008049 C Bo:2:011:2 0 4 >
ffff8e2301f326c0 2243011730 C Bi:2:011:2 0 32 = 521b0080 00063715 00066316 00003703 00000044 ffffffff 1f171049 1c176252
ffff8e2301f326c0 2243011745 S Bi:2:011:2 -115 32 <
ffff8e2301f32e40 2243014797 C Bi:2:011:2 0 32 = 020210ff 00063a15 00063a15 00003703 00004044 ffffffff 1f67624c 17110343
ffff8e2301f32e40 2243014809 S Bi:2:011:2 -115 32 <
ffff8e2301f326c0 2243017888 C Bi:2:011:2 0 32 = 0b767137 00732715 00732715 00003703 00000044 ffffffff 16050120 6566ffff
ffff8e2301f326c0 2243017901 S Bi:2:011:2 -115 32 <
ffff8e2301f32e40 2243021021 C Bi:2:011:2 0 32 = ffffffff 00062215 00064416 00003703 00000044 ffffffff 02191054 72191253
ffff8e2301f32e40 2243021034 S Bi:2:011:2 -115 32 <
ffff8e2301f326c0 2243023300 C Bi:2:011:2 0 4 = 726673ff
ffff8e2301f326c0 2243023316 S Bi:2:011:2 -115 32 <
ffff8e2301f32240 2243023545 S Bo:2:011:2 -115 4 = 521b8080
ffff8e2301f32240 2243023585 C Bo:2:011:2 0 4 >
ffff8e2301f32e40 2243027299 C Bi:2:011:2 0 32 = 521b8080 00002315 00002315 00003703 00000044 ffffffff 11190353 06111741
ffff8e2301f32e40 2243027314 S Bi:2:011:2 -115 32 <
ffff8e2301f326c0 2243030384 C Bi:2:011:2 0 32 = 52126230 00062315 00062315 00003703 00000044 ffffffff 11190353 06111741
ffff8e2301f326c0 2243030397 S Bi:2:011:2 -115 32 <
ffff8e2301f32e40 2243033456 C Bi:2:011:2 0 32 = 52126230 00002015 00002015 00003703 00000044 ffffffff 02191054 72191253
ffff8e2301f32e40 2243033469 S Bi:2:011:2 -115 32 <
ffff8e2301f326c0 2243036527 C Bi:2:011:2 0 32 = 726676ff 00062015 00062015 00003703 00000044 ffffffff 02191054 72191253
ffff8e2301f326c0 2243036540 S Bi:2:011:2 -115 32 <
ffff8e2301f32e40 2243038818 C Bi:2:011:2 0 4 = 726677ff
ffff8e2301f32e40 2243038831 S Bi:2:011:2 -115 32 <
ffff8e2301f32240 2243039062 S Bo:2:011:2 -115 4 = 521c0080
ffff8e2301f32240 2243039102 C Bo:2:011:2 0 4 >
ffff8e2301f326c0 2243042843 C Bi:2:011:2 0 32 = 521c0080 00062115 00062115 00003703 00000044 ffffffff 011e0b50 7f050a49
ffff8e2301f326c0 2243042857 S Bi:2:011:2 -115 32 <
ffff8e2301f32e40 2243045887 C Bi:2:011:2 0 32 = 02767237 00062515 00062515 00003703 00000044 ffffffff 1e191520 02191545
ffff8e2301f32e40 2243045901 S Bi:2:011:2 -115 32 <
ffff8e2301f326c0 2243049020 C Bi:2:011:2 0 32 = 52767335 00002b15 00002b15 00003703 00000044 ffffffff 011e0b50 7f050a49
ffff8e2301f326c0 2243049035 S Bi:2:011:2 -115 32 <
ffff8e2301f32e40 2243052065 C Bi:2:011:2 0 32 = 02767338 00062b15 00062b15 00003703 00000044 ffffffff 011e0b50 7f050a49
ffff8e2301f32e40 2243052079 S Bi:2:011:2 -115 32 <
ffff8e2301f326c0 2243054320 C Bi:2:011:2 0 4 = 02767339
ffff8e2301f326c0 2243054335 S Bi:2:011:2 -115 32 <
ffff8e2301f32240 2243054567 S Bo:2:011:2 -115 4 = 521c8080
ffff8e2301f32240 2243054608 C Bo:2:011:2 0 4 >
ffff8e2301f32e40 2243058343 C Bi:2:011:2 0 32 = 521c8080 00003215 00005416 00003703 00000044 ffffffff 02191054 72191253
ffff8e2301f32e40 2243058356 S Bi:2:011:2 -115 32 <
ffff8e2301f326c0 2243061384 C Bi:2:011:2 0 32 = 726472ff 00003315 00003315 00003703 00000044 ffffffff 11190353 06111741
ffff8e2301f326c0 2243061393 S Bi:2:011:2 -115 32 <
ffff8e2301f32e40 2243064449 C Bi:2:011:2 0 32 = 52126232 00235b16 00235b16 00003703 00000044 ffffffff 1f050b20 1c191054
ffff8e2301f32e40 2243064457 S Bi:2:011:2 -115 32 <
ffff8e2301f326c0 2243067519 C Bi:2:011:2 0 32 = 1a767033 00735b16 00735b16 00003703 00000044 ffffffff 1f050b20 01191754
ffff8e2301f326c0 2243067525 S Bi:2:011:2 -115 32 <
ffff8e2301f32e40 2243069794 C Bi:2:011:2 0 4 = 1a767034
ffff8e2301f32e40 2243069799 S Bi:2:011:2 -115 32 <
ffff8e2301f32240 2243070082 S Bo:2:011:2 -115 4 = 521d0080
ffff8e2301f32240 2243070122 C Bo:2:011:2 0 4 >
ffff8e2301f326c0 2243073842 C Bi:2:011:2 0 32 = 521d0080 00065a16 00065a16 00003703 00000044 ffffffff 1f050b20 061e034d
ffff8e2301f326c0 2243073849 S Bi:2:011:2 -115 32 <
ffff8e2301f32e40 2243076997 C Bi:2:011:2 0 32 = 17056232 00065b16 00065b16 00003703 00000044 ffffffff 1f050b20 05131154
ffff8e2301f32e40 2243077003 S Bi:2:011:2 -115 32 <
ffff8e2301f326c0 2243079996 C Bi:2:011:2 0 32 = 726474ff 00732315 00732315 00003703 00000044 ffffffff 01190e45 1c026243
ffff8e2301f326c0 2243080009 S Bi:2:011:2 -115 32 <
ffff8e2301f32e40 2243083032 C Bi:2:011:2 0 32 = 15767432 00232315 00232315 00003703 00000044 ffffffff 02191054 1e170c44
ffff8e2301f32e40 2243083042 S Bi:2:011:2 -115 32 <
ffff8e2301f326c0 2243085318 C Bi:2:011:2 0 4 = 721505ff
ffff8e2301f326c0 2243085329 S Bi:2:011:2 -115 32 <
ffff8e2301f32240 2243085587 S Bo:2:011:2 -115 4 = 521d8080
ffff8e2301f32240 2243085628 C Bo:2:011:2 0 4 >
ffff8e2301f32e40 2243089365 C Bi:2:011:2 0 32 = 521d8080 00732015 00732015 00003703 00000044 ffffffff 10040b58 1a170f20
ffff8e2301f32e40 2243089375 S Bi:2:011:2 -115 32 <
ffff8e2301f326c0 2243092406 C Bi:2:011:2 0 32 = 11116236 00232015 00232015 00003703 00000044 ffffffff 021a1b4d 1d031648
ffff8e2301f326c0 2243092412 S Bi:2:011:2 -115 32 <
ffff8e2301f32e40 2243095473 C Bi:2:011:2 0 32 = 72050352 00732615 00732615 00003703 00000044 ffffffff 1e130b53 07040720
ffff8e2301f32e40 2243095478 S Bi:2:011:2 -115 32 <
ffff8e2301f326c0 2243098548 C Bi:2:011:2 0 32 = 646effff 00232615 00232615 00003703 00000044 ffffffff 1e130b53 07040720
ffff8e2301f326c0 2243098556 S Bi:2:011:2 -115 32 <
ffff8e2301f32e40 2243100838 C Bi:2:011:2 0 4 = 646fffff
ffff8e2301f32e40 2243100843 S Bi:2:011:2 -115 32 <
ffff8e2301f32240 2243101161 S Bo:2:011:2 -115 4 = 521e0080
ffff8e2301f32240 2243101201 C Bo:2:011:2 0 4 >
ffff8e2301f326c0 2243104987 C Bi:2:011:2 0 32 = 521e0080 00232715 00232715 00003703 00000044 ffffffff 1e130b53 07040720
ffff8e2301f326c0 2243104993 S Bi:2:011:2 -115 32 <
ffff8e2301f32e40 2243107998 C Bi:2:011:2 0 32 = 6567ffff 00732515 00732515 00003703 00000044 ffffffff 1e130b53 07040720
ffff8e2301f32e40 2243108010 S Bi:2:011:2 -115 32 <
ffff8e2301f326c0 2243111062 C Bi:2:011:2 0 32 = 6562ffff 00732b15 00732b15 00003703 00000044 ffffffff 011e0b50 7f050a49
ffff8e2301f326c0 2243111070 S Bi:2:011:2 -115 32 <
ffff8e2301f32e40 2243114131 C Bi:2:011:2 0 32 = 02767538 00232b15 00232b15 00003703 00000044 ffffffff 011e0b50 7f050a49
ffff8e2301f32e40 2243114137 S Bi:2:011:2 -115 32 <
ffff8e2301f326c0 2243116520 C Bi:2:011:2 0 4 = 02767539
ffff8e2301f326c0 2243116526 S Bi:2:011:2 -115 32 <
ffff8e2301f32240 2243116872 S Bo:2:011:2 -115 4 = 521e8080
ffff8e2301f32240 2243116959 C Bo:2:011:2 0 4 >
ffff8e2301f32e40 2243120713 C Bi:2:011:2 0 32 = 521e8080 00233215 00235416 00003703 00000044 ffffffff 1f171049 1c176252
ffff8e2301f32e40 2243120719 S Bi:2:011:2 -115 32 <
ffff8e2301f326c0 2243123728 C Bi:2:011:2 0 32 = 020210ff 00733315 00733315 00003703 00000044 ffffffff 11190353 06111741
ffff8e2301f326c0 2243123733 S Bi:2:011:2 -115 32 <
ffff8e2301f32e40 2243126814 C Bi:2:011:2 0 32 = 52126238 00233315 00233315 00003703 00000044 ffffffff 11190353 06111741
ffff8e2301f32e40 2243126819 S Bi:2:011:2 -115 32 <
ffff8e2301f326c0 2243129857 C Bi:2:011:2 0 32 = 52126238 00733015 00733015 00003703 00000044 ffffffff 1f050b20 6a62ffff
ffff8e2301f326c0 2243129859 S Bi:2:011:2 -115 32 <
ffff8e2301f32e40 2243132200 C Bi:2:011:2 0 4 = ffffffff
ffff8e2301f32e40 2243132205 S Bi:2:011:2 -115 32 <
ffff8e2301f32240 2243132563 S Bo:2:011:2 -115 4 = 521f0080
ffff8e2301f32240 2243132602 C Bo:2:011:2 0 4 >
ffff8e2301f326c0 2243136290 C Bi:2:011:2 0 32 = 521f0080 00233015 00233015 00003703 00000044 ffffffff 1f050b20 6a63ffff
ffff8e2301f326c0 2243136294 S Bi:2:011:2 -115 32 <
ffff8e2301f32e40 2243139379 C Bi:2:011:2 0 32 = ffffffff 00235b16 00235b16 00003703 00000044 ffffffff 131f1120 63767a37
ffff8e2301f32e40 2243139381 S Bi:2:011:2 -115 32 <
ffff8e2301f326c0 2243142448 C Bi:2:011:2 0 32 = ffffffff 00736216 00736216 00003703 00000044 ffffffff 131f1120 60767a38
ffff8e2301f326c0 2243142452 S Bi:2:011:2 -115 32 <
ffff8e2301f32e40 2243145515 C Bi:2:011:2 0 32 = ffffffff 00063a15 00066616 00003703 00000044 ffffffff 1a030f42 17046256
ffff8e2301f32e40 2243145517 S Bi:2:011:2 -115 32 <
ffff8e2301f326c0 2243147972 C Bi:2:011:2 0 4 = 06056239
ffff8e2301f326c0 2243147982 S Bi:2:011:2 -115 32 <
ffff8e2301f32240 2243148314 S Bo:2:011:2 -115 4 = 521f8080
ffff8e2301f32240 2243148354 C Bo:2:011:2 0 4 >
ffff8e2301f32e40 2243152086 C Bi:2:011:2 0 32 = 521f8080 00001715 00001715 00003703 00000044 ffffffff 1e130b53 07040720
ffff8e2301f32e40 2243152096 S Bi:2:011:2 -115 32 <
ffff8e2301f326c0 2243155107 C Bi:2:011:2 0 32 = 1e67ffff 00731715 00731715 00003703 00000044 ffffffff 1e130b53 07040720
ffff8e2301f326c0 2243155119 S Bi:2:011:2 -115 32 <
ffff8e2301f32e40 2243158223 C Bi:2:011:2 0 32 = 1e64ffff 00061415 00061415 00003703 00000044 ffffffff 1e130b53 07040720
ffff8e2301f32e40 2243158231 S Bi:2:011:2 -115 32 <
ffff8e2301f326c0 2243161248 C Bi:2:011:2 0 32 = 1e65ffff 00732215 00734416 00003703 00000044 ffffffff 02191054 72191253
ffff8e2301f326c0 2243161255 S Bi:2:011:2 -115 32 <
ffff8e2301f32e40 2243163544 C Bi:2:011:2 0 4 = 726072ff
ffff8e2301f32e40 2243163555 S Bi:2:011:2 -115 32 <
ffff8e2301f32240 2243163798 S Bo:2:011:2 -115 4 = 52200080
ffff8e2301f32240 2243163841 C Bo:2:011:2 0 4 >
ffff8e2301f326c0 2243167563 C Bi:2:011:2 0 32 = 52200080 00232215 00232215 00003703 00000044 ffffffff 01171020 6467ffff
ffff8e2301f326c0 2243167568 S Bi:2:011:2 -115 32 <
ffff8e2301f32e40 2243170637 C Bi:2:011:2 0 32 = ffffffff 00732115 00732115 00003703 00000044 ffffffff 1c150b20 6460ffff
ffff8e2301f32e40 2243170647 S Bi:2:011:2 -115 32 <
ffff8e2301f326c0 2243173702 C Bi:2:011:2 0 32 = ffffffff 00232415 00232415 00003703 00000044 ffffffff 01171020 1d186f53
ffff8e2301f326c0 2243173709 S Bi:2:011:2 -115 32 <
ffff8e2301f32e40 2243176773 C Bi:2:011:2 0 32 = 11130c45 00732a15 00732a15 00003703 00000044 ffffffff 1e130b53 07040720
ffff8e2301f32e40 2243176780 S Bi:2:011:2 -115 32 <
ffff8e2301f326c0 2243179086 C Bi:2:011:2 0 4 = 6560ffff
ffff8e2301f326c0 2243179092 S Bi:2:011:2 -115 32 <
ffff8e2301f32240 2243179403 S Bo:2:011:2 -115 4 = 52208080
ffff8e2301f32240 2243179450 C Bo:2:011:2 0 4 >
ffff8e2301f32e40 2243183153 C Bi:2:011:2 0 32 = 52208080 00063315 00063315 00003703 00000044 ffffffff 1e130b53 07040720
ffff8e2301f32e40 2243183161 S Bi:2:011:2 -115 32 <
ffff8e2301f326c0 2243186222 C Bi:2:011:2 0 32 = 6b67ffff 00233315 00233315 00003703 00000044 ffffffff 1e130b53 07040720
ffff8e2301f326c0 2243186231 S Bi:2:011:2 -115 32 <
ffff8e2301f32e40 2243189291 C Bi:2:011:2 0 32 = 6b62ffff ffffffff ffffffff ffffffff ffffffff ffffffff ffffffff ffffffff
ffff8e2301f32e40 2243189297 S Bi:2:011:2 -115 32 <
ffff8e2301f326c0 2243192363 C Bi:2:011:2 0 32 = ffffffff ffffffff ffffffff ffffffff ffffffff ffffffff ffffffff ffffffff
ffff8e2301f326c0 2243192370 S Bi:2:011:2 -115 32 <
ffff8e2301f32e40 2243194748 C Bi:2:011:2 0 4 = ffffffff
ffff8e2301f32e40 2243194755 S Bi:2:011:2 -115 32 <
ffff8e2301f32240 2243195071 S Bo:2:011:2 -115 4 = 52210080
ffff8e2301f32240 2243195112 C Bo:2:011:2 0 4 >
ffff8e2301f326c0 2243198843 C Bi:2:011:2 0 32 = 52210080 ffffffff ffffffff ffffffff ffffffff ffffffff ffffffff ffffffff
ffff8e2301f326c0 2243198849 S Bi:2:011:2 -115 32 <
ffff8e2301f32e40 2243201862 C Bi:2:011:2 0 32 = ffffffff ffffffff ffffffff ffffffff ffffffff ffffffff ffffffff ffffffff
ffff8e2301f32e40 2243201868 S Bi:2:011:2 -115 32 <
ffff8e2301f326c0 2243204995 C Bi:2:011:2 0 32 = ffffffff ffffffff ffffffff ffffffff ffffffff ffffffff ffffffff ffffffff
ffff8e2301f326c0 2243205008 S Bi:2:011:2 -115 32 <
ffff8e2301f32e40 2243208055 C Bi:2:011:2 0 32 = ffffffff ffffffff ffffffff ffffffff ffffffff ffffffff ffffffff ffffffff
ffff8e2301f32e40 2243208062 S Bi:2:011:2 -115 32 <
ffff8e2301f326c0 2243210249 C Bi:2:011:2 0 4 = ffffffff
ffff8e2301f326c0 2243210255 S Bi:2:011:2 -115 32 <
ffff8e2301f32240 2243210587 S Bo:2:011:2 -115 4 = 52218080
ffff8e2301f32240 2243210626 C Bo:2:011:2 0 4 >
ffff8e2301f32e40 2243214315 C Bi:2:011:2 0 32 = 52218080 ffffffff ffffffff ffffffff ffffffff ffffffff ffffffff ffffffff
ffff8e2301f32e40 2243214321 S Bi:2:011:2 -115 32 <
ffff8e2301f326c0 2243217385 C Bi:2:011:2 0 32 = ffffffff ffffffff ffffffff ffffffff ffffffff ffffffff ffffffff ffffffff
ffff8e2301f326c0 2243217391 S Bi:2:011:2 -115 32 <
ffff8e2301f32e40 2243220479 C Bi:2:011:2 0 32 = ffffffff ffffffff ffffffff ffffffff ffffffff ffffffff ffffffff ffffffff
ffff8e2301f32e40 2243220485 S Bi:2:011:2 -115 32 <
ffff8e2301f326c0 2243223546 C Bi:2:011:2 0 32 = ffffffff ffffffff ffffffff ffffffff ffffffff ffffffff ffffffff ffffffff
ffff8e2301f326c0 2243223553 S Bi:2:011:2 -115 32 <
ffff8e2301f32e40 2243225821 C Bi:2:011:2 0 4 = ffffffff
ffff8e2301f32e40 2243225827 S Bi:2:011:2 -115 32 <
ffff8e2301f32240 2243226158 S Bo:2:011:2 -115 4 = 52220080
ffff8e2301f32240 2243226196 C Bo:2:011:2 0 4 >
ffff8e2301f326c0 2243229995 C Bi:2:011:2 0 32 = 52220080 ffffffff ffffffff ffffffff ffffffff ffffffff ffffffff ffffffff
ffff8e2301f326c0 2243230007 S Bi:2:011:2 -115 32 <
ffff8e2301f32e40 2243233030 C Bi:2:011:2 0 32 = ffffffff ffffffff ffffffff ffffffff ffffffff ffffffff ffffffff ffffffff
ffff8e2301f32e40 2243233040 S Bi:2:011:2 -115 32 <
ffff8e2301f326c0 2243236073 C Bi:2:011:2 0 32 = ffffffff ffffffff ffffffff ffffffff ffffffff ffffffff ffffffff ffffffff
ffff8e2301f326c0 2243236082 S Bi:2:011:2 -115 32 <
ffff8e2301f32e40 2243239108 C Bi:2:011:2 0 32 = ffffffff ffffffff ffffffff ffffffff ffffffff ffffffff ffffffff ffffffff
ffff8e2301f32e40 2243239113 S Bi:2:011:2 -115 32 <
ffff8e2301f326c0 2243241479 C Bi:2:011:2 0 4 = ffffffff
ffff8e2301f326c0 2243241485 S Bi:2:011:2 -115 32 <
ffff8e2301f32240 2243241756 S Bo:2:011:2 -115 4 = 52228080
ffff8e2301f32240 2243241829 C Bo:2:011:2 0 4 >
ffff8e2301f32e40 2243245519 C Bi:2:011:2 0 32 = 52228080 ffffffff ffffffff ffffffff ffffffff ffffffff ffffffff ffffffff
ffff8e2301f32e40 2243245524 S Bi:2:011:2 -115 32 <
ffff8e2301f326c0 2243248591 C Bi:2:011:2 0 32 = ffffffff ffffffff ffffffff ffffffff ffffffff ffffffff ffffffff ffffffff
ffff8e2301f326c0 2243248597 S Bi:2:011:2 -115 32 <
ffff8e2301f32e40 2243251681 C Bi:2:011:2 0 32 = ffffffff ffffffff ffffffff ffffffff ffffffff ffffffff ffffffff ffffffff
ffff8e2301f32e40 2243251687 S Bi:2:011:2 -115 32 <
ffff8e2301f326c0 2243254753 C Bi:2:011:2 0 32 = ffffffff ffffffff ffffffff ffffffff ffffffff ffffffff ffffffff ffffffff
ffff8e2301f326c0 2243254759 S Bi:2:011:2 -115 32 <
ffff8e2301f32e40 2243257000 C Bi:2:011:2 0 4 = ffffffff
ffff8e2301f32e40 2243257014 S Bi:2:011:2 -115 32 <
ffff8e2301f32240 2243257325 S Bo:2:011:2 -115 4 = 52230080
ffff8e2301f32240 2243257394 C Bo:2:011:2 0 4 >
ffff8e2301f326c0 2243261078 C Bi:2:011:2 0 32 = 52230080 ffffffff ffffffff ffffffff ffffffff ffffffff ffffffff ffffffff
ffff8e2301f326c0 2243261084 S Bi:2:011:2 -115 32 <
ffff8e2301f32e40 2243264135 C Bi:2:011:2 0 32 = ffffffff ffffffff ffffffff ffffffff ffffffff ffffffff ffffffff ffffffff
ffff8e2301f32e40 2243264157 S Bi:2:011:2 -115 32 <
ffff8e2301f326c0 2243267202 C Bi:2:011:2 0 32 = ffffffff ffffffff ffffffff ffffffff ffffffff ffffffff ffffffff ffffffff
ffff8e2301f326c0 2243267213 S Bi:2:011:2 -115 32 <
ffff8e2301f32e40 2243270284 C Bi:2:011:2 0 32 = ffffffff ffffffff ffffffff ffffffff ffffffff ffffffff ffffffff ffffffff
ffff8e2301f32e40 2243270294 S Bi:2:011:2 -115 32 <
ffff8e2301f326c0 2243272686 C Bi:2:011:2 0 4 = ffffffff
ffff8e2301f326c0 2243272700 S Bi:2:011:2 -115 32 <
ffff8e2301f32240 2243272934 S Bo:2:011:2 -115 4 = 52238080
ffff8e2301f32240 2243272973 C Bo:2:011:2 0 4 >
ffff8e2301f32e40 2243276709 C Bi:2:011:2 0 32 = 52238080 ffffffff ffffffff ffffffff ffffffff ffffffff ffffffff ffffffff
ffff8e2301f32e40 2243276722 S Bi:2:011:2 -115 32 <
ffff8e2301f326c0 2243279759 C Bi:2:011:2 0 32 = ffffffff ffffffff ffffffff ffffffff ffffffff ffffffff ffffffff ffffffff
ffff8e2301f326c0 2243279773 S Bi:2:011:2 -115 32 <
ffff8e2301f32e40 2243282854 C Bi:2:011:2 0 32 = ffffffff ffffffff ffffffff ffffffff ffffffff ffffffff ffffffff ffffffff
ffff8e2301f32e40 2243282869 S Bi:2:011:2 -115 32 <
ffff8e2301f326c0 2243285888 C Bi:2:011:2 0 32 = ffffffff ffffffff ffffffff ffffffff ffffffff ffffffff ffffffff ffffffff
ffff8e2301f326c0 2243285903 S Bi:2:011:2 -115 32 <
ffff8e2301f32e40 2243288228 C Bi:2:011:2 0 4 = ffffffff
ffff8e2301f32e40 2243288243 S Bi:2:011:2 -115 32 <
ffff8e2301f32240 2243288470 S Bo:2:011:2 -115 4 = 52240080
ffff8e2301f32240 2243288508 C Bo:2:011:2 0 4 >
ffff8e2301f326c0 2243292224 C Bi:2:011:2 0 32 = 52240080 ffffffff ffffffff ffffffff ffffffff ffffffff ffffffff ffffffff
ffff8e2301f326c0 2243292234 S Bi:2:011:2 -115 32 <
ffff8e2301f32e40 2243295299 C Bi:2:011:2 0 32 = ffffffff ffffffff ffffffff ffffffff ffffffff ffffffff ffffffff ffffffff
ffff8e2301f32e40 2243295314 S Bi:2:011:2 -115 32 <
ffff8e2301f326c0 2243298365 C Bi:2:011:2 0 32 = ffffffff ffffffff ffffffff ffffffff ffffffff ffffffff ffffffff ffffffff
ffff8e2301f326c0 2243298378 S Bi:2:011:2 -115 32 <
ffff8e2301f32e40 2243301428 C Bi:2:011:2 0 32 = ffffffff ffffffff ffffffff ffffffff ffffffff ffffffff ffffffff ffffffff
ffff8e2301f32e40 2243301443 S Bi:2:011:2 -115 32 <
ffff8e2301f326c0 2243303704 C Bi:2:011:2 0 4 = ffffffff
ffff8e2301f326c0 2243303718 S Bi:2:011:2 -115 32 <
ffff8e2301f32240 2243303976 S Bo:2:011:2 -115 4 = 52248080
ffff8e2301f32240 2243304027 C Bo:2:011:2 0 4 >
ffff8e2301f32e40 2243307701 C Bi:2:011:2 0 32 = 52248080 ffffffff ffffffff ffffffff ffffffff ffffffff ffffffff ffffffff
ffff8e2301f32e40 2243307709 S Bi:2:011:2 -115 32 <
ffff8e2301f326c0 2243310772 C Bi:2:011:2 0 32 = ffffffff ffffffff ffffffff ffffffff ffffffff ffffffff ffffffff ffffffff
ffff8e2301f326c0 2243310788 S Bi:2:011:2 -115 32 <
ffff8e2301f32e40 2243313863 C Bi:2:011:2 0 32 = ffffffff ffffffff ffffffff ffffffff ffffffff ffffffff ffffffff ffffffff
ffff8e2301f32e40 2243313877 S Bi:2:011:2 -115 32 <
ffff8e2301f326c0 2243316997 C Bi:2:011:2 0 32 = ffffffff ffffffff ffffffff ffffffff ffffffff ffffffff ffffffff ffffffff
ffff8e2301f326c0 2243317011 S Bi:2:011:2 -115 32 <
ffff8e2301f32e40 2243319230 C Bi:2:011:2 0 4 = ffffffff
ffff8e2301f32e40 2243319242 S Bi:2:011:2 -115 32 <
ffff8e2301f32240 2243319492 S Bo:2:011:2 -115 4 = 52250080
ffff8e2301f32240 2243319533 C Bo:2:011:2 0 4 >
ffff8e2301f326c0 2243323250 C Bi:2:011:2 0 32 = 52250080 ffffffff ffffffff ffffffff ffffffff ffffffff ffffffff ffffffff
ffff8e2301f326c0 2243323265 S Bi:2:011:2 -115 32 <
ffff8e2301f32e40 2243326317 C Bi:2:011:2 0 32 = ffffffff 77502244 77502244 00000000 00000044 ffffffff 021b1020 62676234
ffff8e2301f32e40 2243326329 S Bi:2:011:2 -115 32 <
ffff8e2301f326c0 2243329389 C Bi:2:011:2 0 32 = 66606c30 274e2244 274e2244 00000000 00000044 ffffffff 021b1020 62646234
ffff8e2301f326c0 2243329400 S Bi:2:011:2 -115 32 <
ffff8e2301f32e40 2243332452 C Bi:2:011:2 0 32 = 66606c30 77672244 77672244 00000000 00000044 ffffffff 021b1020 62656234
ffff8e2301f32e40 2243332463 S Bi:2:011:2 -115 32 <
ffff8e2301f326c0 2243334752 C Bi:2:011:2 0 4 = 66606c30
ffff8e2301f326c0 2243334765 S Bi:2:011:2 -115 32 <
ffff8e2301f32240 2243335044 S Bo:2:011:2 -115 4 = 52258080
ffff8e2301f32240 2243335088 C Bo:2:011:2 0 4 >
ffff8e2301f32e40 2243338770 C Bi:2:011:2 0 32 = 52258080 27152244 27152244 00000000 00000044 ffffffff 021b1020 62626234
ffff8e2301f32e40 2243338775 S Bi:2:011:2 -115 32 <
ffff8e2301f326c0 2243341860 C Bi:2:011:2 0 32 = 66606c30 77562244 77562244 00000000 00000044 ffffffff 021b1020 62636234
ffff8e2301f326c0 2243341865 S Bi:2:011:2 -115 32 <
ffff8e2301f32e40 2243344992 C Bi:2:011:2 0 32 = 66606c30 273e2244 273e2244 00000000 00000044 ffffffff 021b1020 62606234
ffff8e2301f32e40 2243344997 S Bi:2:011:2 -115 32 <
ffff8e2301f326c0 2243347993 C Bi:2:011:2 0 32 = 66606c30 77d72244 77d72244 00000000 00000044 ffffffff 021b1020 62616234
ffff8e2301f326c0 2243347997 S Bi:2:011:2 -115 32 <
ffff8e2301f32e40 2243350244 C Bi:2:011:2 0 4 = 66606c30
ffff8e2301f32e40 2243350248 S Bi:2:011:2 -115 32 <
ffff8e2301f32240 2243350541 S Bo:2:011:2 -115 4 = 52260080
ffff8e2301f32240 2243350582 C Bo:2:011:2 0 4 >
ffff8e2301f326c0 2243354270 C Bi:2:011:2 0 32 = 52260080 27c52244 27c52244 00000000 00000044 ffffffff 021b1020 626e6234
ffff8e2301f326c0 2243354274 S Bi:2:011:2 -115 32 <
ffff8e2301f32e40 2243357344 C Bi:2:011:2 0 32 = 66606c30 77502344 77502344 00000000 00000044 ffffffff 021b1020 626f6234
ffff8e2301f32e40 2243357351 S Bi:2:011:2 -115 32 <
ffff8e2301f326c0 2243360403 C Bi:2:011:2 0 32 = 66606c31 274e2344 274e2344 00000000 00000044 ffffffff 021b1020 63666234
ffff8e2301f326c0 2243360408 S Bi:2:011:2 -115 32 <
ffff8e2301f32e40 2243363474 C Bi:2:011:2 0 32 = 66606c31 77672344 77672344 00000000 00000044 ffffffff 021b1020 63676234
ffff8e2301f32e40 2243363490 S Bi:2:011:2 -115 32 <
ffff8e2301f326c0 2243365752 C Bi:2:011:2 0 4 = 66606c31
ffff8e2301f326c0 2243365762 S Bi:2:011:2 -115 32 <
ffff8e2301f32240 2243366084 S Bo:2:011:2 -115 4 = 52268080
ffff8e2301f32240 2243366126 C Bo:2:011:2 0 4 >
ffff8e2301f32e40 2243369844 C Bi:2:011:2 0 32 = 52268080 27152344 27152344 00000000 00000044 ffffffff 021b1020 63646234
ffff8e2301f32e40 2243369858 S Bi:2:011:2 -115 32 <
ffff8e2301f326c0 2243372997 C Bi:2:011:2 0 32 = 66606c31 77562344 77562344 00000000 00000044 ffffffff 021b1020 63656234
ffff8e2301f326c0 2243373015 S Bi:2:011:2 -115 32 <
ffff8e2301f32e40 2243376037 C Bi:2:011:2 0 32 = 66606c31 273e2344 273e2344 00000000 00000044 ffffffff 021b1020 63626234
ffff8e2301f32e40 2243376046 S Bi:2:011:2 -115 32 <
ffff8e2301f326c0 2243379017 C Bi:2:011:2 0 32 = 66606c31 77d72344 77d72344 00000000 00000044 ffffffff 021b1020 63636234
ffff8e2301f326c0 2243379027 S Bi:2:011:2 -115 32 <
ffff8e2301f32e40 2243381272 C Bi:2:011:2 0 4 = 66606c31
ffff8e2301f32e40 2243381280 S Bi:2:011:2 -115 32 <
ffff8e2301f32240 2243381579 S Bo:2:011:2 -115 4 = 52270080
ffff8e2301f32240 2243381619 C Bo:2:011:2 0 4 >
ffff8e2301f326c0 2243385344 C Bi:2:011:2 0 32 = 52270080 27c52344 27c52344 00000000 00000044 ffffffff 021b1020 63606234
ffff8e2301f326c0 2243385354 S Bi:2:011:2 -115 32 <
ffff8e2301f32e40 2243388408 C Bi:2:011:2 0 32 = 66606c31 00061725 00061725 00000000 00000044 ffffffff 01373663 3d3b6231
ffff8e2301f32e40 2243388425 S Bi:2:011:2 -115 32 <
ffff8e2301f326c0 2243391475 C Bi:2:011:2 0 32 = ffffffff 00061625 00061625 00000000 00000044 ffffffff 01373663 3d3b6232
ffff8e2301f326c0 2243391486 S Bi:2:011:2 -115 32 <
ffff8e2301f32e40 2243394539 C Bi:2:011:2 0 32 = ffffffff 00163225 00163225 00000000 00000044 ffffffff 01373663 3d3b6233
ffff8e2301f32e40 2243394548 S Bi:2:011:2 -115 32 <
ffff8e2301f326c0 2243396795 C Bi:2:011:2 0 4 = ffffffff
ffff8e2301f326c0 2243396810 S Bi:2:011:2 -115 32 <
ffff8e2301f32240 2243397218 S Bo:2:011:2 -115 4 = 52278080
ffff8e2301f32240 2243397259 C Bo:2:011:2 0 4 >
ffff8e2301f32e40 2243401025 C Bi:2:011:2 0 32 = 52278080 00361725 00361725 00000000 00000044 ffffffff 01373663 3d3b6234
ffff8e2301f32e40 2243401040 S Bi:2:011:2 -115 32 <
ffff8e2301f326c0 2243404043 C Bi:2:011:2 0 32 = ffffffff 00002425 00002425 00000000 00000044 ffffffff 01373663 3d3b6235
ffff8e2301f326c0 2243404055 S Bi:2:011:2 -115 32 <
ffff8e2301f32e40 2243407109 C Bi:2:011:2 0 32 = ffffffff 0000c725 0000c725 00000000 00000044 ffffffff 01373663 3d3b6236
ffff8e2301f32e40 2243407122 S Bi:2:011:2 -115 32 <
ffff8e2301f326c0 2243410181 C Bi:2:011:2 0 32 = ffffffff 02445745 02445745 00000000 00000044 ffffffff 011f0f50 72050b54
ffff8e2301f326c0 2243410196 S Bi:2:011:2 -115 32 <
ffff8e2301f32e40 2243412481 C Bi:2:011:2 0 4 = 17767231
ffff8e2301f32e40 2243412496 S Bi:2:011:2 -115 32 <
ffff8e2301f32240 2243412768 S Bo:2:011:2 -115 4 = 52280080
ffff8e2301f32240 2243412809 C Bo:2:011:2 0 4 >
ffff8e2301f326c0 2243416527 C Bi:2:011:2 0 32 = 52280080 00735745 00735745 00000000 00000044 ffffffff 011f0f50 72050b54
ffff8e2301f326c0 2243416542 S Bi:2:011:2 -115 32 <
ffff8e2301f32e40 2243419567 C Bi:2:011:2 0 32 = 17767232 02615745 02615745 00000000 00000044 ffffffff 011f0f50 72050b54
ffff8e2301f32e40 2243419578 S Bi:2:011:2 -115 32 <
ffff8e2301f326c0 2243422630 C Bi:2:011:2 0 32 = 17767233 00065745 00065745 00000000 00000044 ffffffff 011f0f50 72050b54
ffff8e2301f326c0 2243422639 S Bi:2:011:2 -115 32 <
ffff8e2301f32e40 2243425722 C Bi:2:011:2 0 32 = 17767234 02345745 02345745 00000000 00000044 ffffffff 011f0f50 72050b54
ffff8e2301f32e40 2243425732 S Bi:2:011:2 -115 32 <
ffff8e2301f326c0 2243427971 C Bi:2:011:2 0 4 = 17767235
ffff8e2301f326c0 2243427986 S Bi:2:011:2 -115 32 <
ffff8e2301f32240 2243428305 S Bo:2:011:2 -115 4 = 52288080
ffff8e2301f32240 2243428346 C Bo:2:011:2 0 4 >
ffff8e2301f32e40 2243432038 C Bi:2:011:2 0 32 = 52288080 00235545 00235545 00000000 00000044 ffffffff 011f0f50 72050b54
ffff8e2301f32e40 2243432046 S Bi:2:011:2 -115 32 <
ffff8e2301f326c0 2243435109 C Bi:2:011:2 0 32 = 17767236 0006d245 0006d245 00000000 00000044 ffffffff 011f0f50 72050b54
ffff8e2301f326c0 2243435124 S Bi:2:011:2 -115 32 <
ffff8e2301f32e40 2243438178 C Bi:2:011:2 0 32 = 17767237 0000d345 0000d345 00000000 00000044 ffffffff 011f0f50 72050b54
ffff8e2301f32e40 2243438186 S Bi:2:011:2 -115 32 <
ffff8e2301f326c0 2243441247 C Bi:2:011:2 0 32 = 17767238 0073d345 0073d345 00000000 00000044 ffffffff 011f0f50 72050b54
ffff8e2301f326c0 2243441256 S Bi:2:011:2 -115 32 <
ffff8e2301f32e40 2243443495 C Bi:2:011:2 0 4 = 17767239
ffff8e2301f32e40 2243443503 S Bi:2:011:2 -115 32 <
ffff8e2301f32240 2243443778 S Bo:2:011:2 -115 4 = 52290080
ffff8e2301f32240 2243443830 C Bo:2:011:2 0 4 >
ffff8e2301f326c0 2243447517 C Bi:2:011:2 0 32 = 52290080 0006d345 0006d345 00000000 00000044 ffffffff 011f0f50 72050b54
ffff8e2301f326c0 2243447525 S Bi:2:011:2 -115 32 <
ffff8e2301f32e40 2243450586 C Bi:2:011:2 0 32 = 17767330 0023d345 0023d345 00000000 00000044 ffffffff 011f0f50 72050b54
ffff8e2301f32e40 2243450595 S Bi:2:011:2 -115 32 <
ffff8e2301f326c0 2243453651 C Bi:2:011:2 0 32 = 17767331 0000d045 0000d045 00000000 00000044 ffffffff 011f0f50 72050b54
ffff8e2301f326c0 2243453660 S Bi:2:011:2 -115 32 <
ffff8e2301f32e40 2243456731 C Bi:2:011:2 0 32 = 17767332 0073d045 0073d045 00000000 00000044 ffffffff 011f0f50 72050b54
ffff8e2301f32e40 2243456740 S Bi:2:011:2 -115 32 <
ffff8e2301f326c0 2243459042 C Bi:2:011:2 0 4 = 17767333
ffff8e2301f326c0 2243459054 S Bi:2:011:2 -115 32 <
ffff8e2301f32240 2243459350 S Bo:2:011:2 -115 4 = 52298080
ffff8e2301f32240 2243459390 C Bo:2:011:2 0 4 >
ffff8e2301f32e40 2243463136 C Bi:2:011:2 0 32 = 52298080 0006d045 0006d045 00000000 00000044 ffffffff 011f0f50 72050b54
ffff8e2301f32e40 2243463149 S Bi:2:011:2 -115 32 <
ffff8e2301f326c0 2243466179 C Bi:2:011:2 0 32 = 17767334 0023d045 0023d045 00000000 00000044 ffffffff 011f0f50 72050b54
ffff8e2301f326c0 2243466190 S Bi:2:011:2 -115 32 <
ffff8e2301f32e40 2243469248 C Bi:2:011:2 0 32 = 17767335 0000d145 0000d145 00000000 00000044 ffffffff 011f0f50 72050b54
ffff8e2301f32e40 2243469257 S Bi:2:011:2 -115 32 <
ffff8e2301f326c0 2243472313 C Bi:2:011:2 0 32 = 17767336 0073d145 0073d145 00000000 00000044 ffffffff 011f0f50 72050b54
ffff8e2301f326c0 2243472321 S Bi:2:011:2 -115 32 <
ffff8e2301f32e40 2243474700 C Bi:2:011:2 0 4 = 17767337
ffff8e2301f32e40 2243474710 S Bi:2:011:2 -115 32 <
ffff8e2301f32240 2243474975 S Bo:2:011:2 -115 4 = 522a0080
ffff8e2301f32240 2243475027 C Bo:2:011:2 0 4 >
ffff8e2301f326c0 2243478724 C Bi:2:011:2 0 32 = 522a0080 0006d145 0006d145 00000000 00000044 ffffffff 011f0f50 72050b54
ffff8e2301f326c0 2243478734 S Bi:2:011:2 -115 32 <
ffff8e2301f32e40 2243481770 C Bi:2:011:2 0 32 = 17767338 0023d145 0023d145 00000000 00000044 ffffffff 011f0f50 72050b54
ffff8e2301f32e40 2243481779 S Bi:2:011:2 -115 32 <
ffff8e2301f326c0 2243484859 C Bi:2:011:2 0 32 = 17767339 0000d645 0000d645 00000000 00000044 ffffffff 011f0f50 72050b54
ffff8e2301f326c0 2243484868 S Bi:2:011:2 -115 32 <
ffff8e2301f32e40 2243488042 C Bi:2:011:2 0 32 = 17767030 0073d645 0073d645 00000000 00000044 ffffffff 011f0f50 72050b54
ffff8e2301f32e40 2243488050 S Bi:2:011:2 -115 32 <
ffff8e2301f326c0 2243490251 C Bi:2:011:2 0 4 = 17767031
ffff8e2301f326c0 2243490265 S Bi:2:011:2 -115 32 <
ffff8e2301f32240 2243490546 S Bo:2:011:2 -115 4 = 522a8080
ffff8e2301f32240 2243490587 C Bo:2:011:2 0 4 >
ffff8e2301f32e40 2243494273 C Bi:2:011:2 0 32 = 522a8080 0006d645 0006d645 00000000 00000044 ffffffff 011f0f50 72050b54
ffff8e2301f32e40 2243494287 S Bi:2:011:2 -115 32 <
ffff8e2301f326c0 2243497341 C Bi:2:011:2 0 32 = 17767032 0023d645 0023d645 00000000 00000044 ffffffff 011f0f50 72050b54
ffff8e2301f326c0 2243497349 S Bi:2:011:2 -115 32 <
ffff8e2301f32e40 2243500459 C Bi:2:011:2 0 32 = 17767033 0261d415 0261d415 00000000 00000044 ffffffff 011f0f50 72050b54
ffff8e2301f32e40 2243500468 S Bi:2:011:2 -115 32 <
ffff8e2301f326c0 2243503521 C Bi:2:011:2 0 32 = 17767034 0006d415 0006d415 00000000 00000044 ffffffff 011f0f50 72050b54
ffff8e2301f326c0 2243503531 S Bi:2:011:2 -115 32 <
ffff8e2301f32e40 2243505752 C Bi:2:011:2 0 4 = 17767035
ffff8e2301f32e40 2243505763 S Bi:2:011:2 -115 32 <
ffff8e2301f32240 2243506066 S Bo:2:011:2 -115 4 = 522b0080
ffff8e2301f32240 2243506110 C Bo:2:011:2 0 4 >
ffff8e2301f326c0 2243509814 C Bi:2:011:2 0 32 = 522b0080 0234d415 0234d415 00000000 00000044 ffffffff 011f0f50 72050b54
ffff8e2301f326c0 2243509818 S Bi:2:011:2 -115 32 <
ffff8e2301f32e40 2243512860 C Bi:2:011:2 0 32 = 17767036 0023d415 0023d415 00000000 00000044 ffffffff 011f0f50 72050b54
ffff8e2301f32e40 2243512865 S Bi:2:011:2 -115 32 <
ffff8e2301f326c0 2243515995 C Bi:2:011:2 0 32 = 17767037 0000d515 0000d515 00000000 00000044 ffffffff 011f0f50 72050b54
ffff8e2301f326c0 2243516008 S Bi:2:011:2 -115 32 <
ffff8e2301f32e40 2243519020 C Bi:2:011:2 0 32 = 17767038 00005216 00005216 00000000 00000044 ffffffff 011f0f50 72050b54
ffff8e2301f32e40 2243519026 S Bi:2:011:2 -115 32 <
ffff8e2301f326c0 2243521273 C Bi:2:011:2 0 4 = 17767039
ffff8e2301f326c0 2243521278 S Bi:2:011:2 -115 32 <
ffff8e2301f32240 2243521580 S Bo:2:011:2 -115 4 = 522b8080
ffff8e2301f32240 2243521620 C Bo:2:011:2 0 4 >
ffff8e2301f32e40 2243525368 C Bi:2:011:2 0 32 = 522b8080 02445216 02445216 00000000 00000044 ffffffff 011f0f50 72050b54
ffff8e2301f32e40 2243525374 S Bi:2:011:2 -115 32 <
ffff8e2301f326c0 2243528413 C Bi:2:011:2 0 32 = 17767130 00735216 00735216 00000000 00000044 ffffffff 011f0f50 72050b54
ffff8e2301f326c0 2243528424 S Bi:2:011:2 -115 32 <
ffff8e2301f32e40 2243531476 C Bi:2:011:2 0 32 = 17767131 02615216 02615216 00000000 00000044 ffffffff 011f0f50 72050b54
ffff8e2301f32e40 2243531485 S Bi:2:011:2 -115 32 <
ffff8e2301f326c0 2243534541 C Bi:2:011:2 0 32 = 17767132 00065216 00065216 00000000 00000044 ffffffff 011f0f50 72050b54
ffff8e2301f326c0 2243534549 S Bi:2:011:2 -115 32 <
ffff8e2301f32e40 2243536776 C Bi:2:011:2 0 4 = 17767133
ffff8e2301f32e40 2243536783 S Bi:2:011:2 -115 32 <
ffff8e2301f32240 2243537091 S Bo:2:011:2 -115 4 = 522c0080
ffff8e2301f32240 2243537131 C Bo:2:011:2 0 4 >
ffff8e2301f326c0 2243540843 C Bi:2:011:2 0 32 = 522c0080 02345216 02345216 00000000 00000044 ffffffff 011f0f50 72050b54
ffff8e2301f326c0 2243540854 S Bi:2:011:2 -115 32 <
ffff8e2301f32e40 2243543998 C Bi:2:011:2 0 32 = 17767134 00235216 00235216 00000000 00000044 ffffffff 011f0f50 72050b54
ffff8e2301f32e40 2243544009 S Bi:2:011:2 -115 32 <
ffff8e2301f326c0 2243546996 C Bi:2:011:2 0 32 = 17767135 02d15216 02d15216 00000000 00000044 ffffffff 011f0f50 72050b54
ffff8e2301f326c0 2243547013 S Bi:2:011:2 -115 32 <
ffff8e2301f32e40 2243550034 C Bi:2:011:2 0 32 = 17767136 00005316 00005316 00000000 00000044 ffffffff 011f0f50 72050b54
ffff8e2301f32e40 2243550044 S Bi:2:011:2 -115 32 <
ffff8e2301f326c0 2243552293 C Bi:2:011:2 0 4 = 17767137
ffff8e2301f326c0 2243552304 S Bi:2:011:2 -115 32 <
ffff8e2301f32240 2243552609 S Bo:2:011:2 -115 4 = 522c8080
ffff8e2301f32240 2243552650 C Bo:2:011:2 0 4 >
ffff8e2301f32e40 2243556359 C Bi:2:011:2 0 32 = 522c8080 02445316 02445316 00000000 00000044 ffffffff 011f0f50 72050b54
ffff8e2301f32e40 2243556368 S Bi:2:011:2 -115 32 <
ffff8e2301f326c0 2243559435 C Bi:2:011:2 0 32 = 17767138 00004216 00004216 00000000 00000044 ffffffff 011f0f50 72050b54
ffff8e2301f326c0 2243559450 S Bi:2:011:2 -115 32 <
ffff8e2301f32e40 2243562497 C Bi:2:011:2 0 32 = 17767139 0244c745 0244c745 00000000 00000044 ffffffff 011f0f50 72050b54
ffff8e2301f32e40 2243562507 S Bi:2:011:2 -115 32 <
ffff8e2301f326c0 2243565567 C Bi:2:011:2 0 32 = 17767630 0073c745 0073c745 00000000 00000044 ffffffff 011f0f50 72050b54
ffff8e2301f326c0 2243565581 S Bi:2:011:2 -115 32 <
ffff8e2301f32e40 2243567794 C Bi:2:011:2 0 4 = 17767631
ffff8e2301f32e40 2243567805 S Bi:2:011:2 -115 32 <
ffff8e2301f32240 2243568238 S Bo:2:011:2 -115 4 = 522d0080
ffff8e2301f32240 2243568278 C Bo:2:011:2 0 4 >
ffff8e2301f326c0 2243572011 C Bi:2:011:2 0 32 = 522d0080 0261c745 0261c745 00000000 00000044 ffffffff 011f0f50 72050b54
ffff8e2301f326c0 2243572026 S Bi:2:011:2 -115 32 <
ffff8e2301f32e40 2243575068 C Bi:2:011:2 0 32 = 17767632 0006c745 0006c745 00000000 00000044 ffffffff 011f0f50 72050b54
ffff8e2301f32e40 2243575082 S Bi:2:011:2 -115 32 <
ffff8e2301f326c0 2243578132 C Bi:2:011:2 0 32 = 17767633 0234c745 0234c745 00000000 00000044 ffffffff 011f0f50 72050b54
ffff8e2301f326c0 2243578148 S Bi:2:011:2 -115 32 <
ffff8e2301f32e40 2243581204 C Bi:2:011:2 0 32 = 17767634 0023c545 0023c545 00000000 00000044 ffffffff 011f0f50 72050b54
ffff8e2301f32e40 2243581214 S Bi:2:011:2 -115 32 <
ffff8e2301f326c0 2243583499 C Bi:2:011:2 0 4 = 17767635
ffff8e2301f326c0 2243583514 S Bi:2:011:2 -115 32 <
ffff8e2301f32240 2243583826 S Bo:2:011:2 -115 4 = 522d8080
ffff8e2301f32240 2243583868 C Bo:2:011:2 0 4 >
ffff8e2301f32e40 2243587597 C Bi:2:011:2 0 32 = 522d8080 00060216 00060216 00000000 00000044 ffffffff 071d6253 1b1b1220
ffff8e2301f32e40 2243587612 S Bi:2:011:2 -115 32 <
ffff8e2301f326c0 2243590634 C Bi:2:011:2 0 32 = 6267ffff 02340216 02340216 00000000 00000044 ffffffff 071d6253 1b1b1220
ffff8e2301f326c0 2243590650 S Bi:2:011:2 -115 32 <
ffff8e2301f32e40 2243593701 C Bi:2:011:2 0 32 = 6264ffff 02d1d216 02d1d216 00000000 00000044 ffffffff 071d6253 1b1b1220
ffff8e2301f32e40 2243593712 S Bi:2:011:2 -115 32 <
ffff8e2301f326c0 2243596770 C Bi:2:011:2 0 32 = 6265ffff 0244d116 0244d116 00000000 00000044 ffffffff 071d6253 1b1b1220
ffff8e2301f326c0 2243596778 S Bi:2:011:2 -115 32 <
ffff8e2301f32e40 2243599179 C Bi:2:011:2 0 4 = 6262ffff
ffff8e2301f32e40 2243599187 S Bi:2:011:2 -115 32 <
ffff8e2301f32240 2243599494 S Bo:2:011:2 -115 4 = 522e0080
ffff8e2301f32240 2243599535 C Bo:2:011:2 0 4 >
ffff8e2301f326c0 2243603240 C Bi:2:011:2 0 32 = 522e0080 00067217 00067217 00000000 00000044 ffffffff 071d6253 1b1b1220
ffff8e2301f326c0 2243603255 S Bi:2:011:2 -115 32 <
ffff8e2301f32e40 2243606321 C Bi:2:011:2 0 32 = 6263ffff 02347217 02347217 00000000 00000044 ffffffff 071d6253 1b1b1220
ffff8e2301f32e40 2243606338 S Bi:2:011:2 -115 32 <
ffff8e2301f326c0 2243609388 C Bi:2:011:2 0 32 = 6260ffff 02d17217 02d17217 00000000 00000044 ffffffff 071d6253 1b1b1220
ffff8e2301f326c0 2243609404 S Bi:2:011:2 -115 32 <
ffff8e2301f32e40 2243612453 C Bi:2:011:2 0 32 = 6261ffff 0244d144 0244d144 00000000 00000044 ffffffff 071d6253 1b1b1220
ffff8e2301f32e40 2243612462 S Bi:2:011:2 -115 32 <
ffff8e2301f326c0 2243614706 C Bi:2:011:2 0 4 = 626effff
ffff8e2301f326c0 2243614720 S Bi:2:011:2 -115 32 <
ffff8e2301f32240 2243615039 S Bo:2:011:2 -115 4 = 522e8080
ffff8e2301f32240 2243615080 C Bo:2:011:2 0 4 >
ffff8e2301f32e40 2243618799 C Bi:2:011:2 0 32 = 522e8080 0000d644 0000d644 00000000 00000044 ffffffff 071d6253 1b1b1220
ffff8e2301f32e40 2243618812 S Bi:2:011:2 -115 32 <
ffff8e2301f326c0 2243621867 C Bi:2:011:2 0 32 = 626fffff 0023d644 0023d644 00000000 00000044 ffffffff 071d6253 1b1b1220
ffff8e2301f326c0 2243621882 S Bi:2:011:2 -115 32 <
ffff8e2301f32e40 2243624999 C Bi:2:011:2 0 32 = 6366ffff 02d1c545 02d1c545 00000000 00000044 ffffffff 071d6253 1b1b1220
ffff8e2301f32e40 2243625018 S Bi:2:011:2 -115 32 <
ffff8e2301f326c0 2243627996 C Bi:2:011:2 0 32 = 6367ffff 0000ca45 0000ca45 00000000 00000044 ffffffff 071d6253 1b1b1220
ffff8e2301f326c0 2243628012 S Bi:2:011:2 -115 32 <
ffff8e2301f32e40 2243630388 C Bi:2:011:2 0 4 = 6364ffff
ffff8e2301f32e40 2243630402 S Bi:2:011:2 -115 32 <
ffff8e2301f32240 2243630666 S Bo:2:011:2 -115 4 = 522f0080
ffff8e2301f32240 2243630709 C Bo:2:011:2 0 4 >
ffff8e2301f326c0 2243634437 C Bi:2:011:2 0 32 = 522f0080 0244ca45 0244ca45 00000000 00000044 ffffffff 071d6253 1b1b1220
ffff8e2301f326c0 2243634452 S Bi:2:011:2 -115 32 <
ffff8e2301f32e40 2243637479 C Bi:2:011:2 0 32 = 6365ffff 0073ca45 0073ca45 00000000 00000044 ffffffff 071d6253 1b1b1220
ffff8e2301f32e40 2243637494 S Bi:2:011:2 -115 32 <
ffff8e2301f326c0 2243640540 C Bi:2:011:2 0 32 = 6362ffff 02d13407 02d13407 00000000 00000044 ffffffff 071d0e20 1e191520
ffff8e2301f326c0 2243640549 S Bi:2:011:2 -115 32 <
ffff8e2301f32e40 2243643609 C Bi:2:011:2 0 32 = 63ffffff 02612108 02612108 00000000 00000044 ffffffff 071d0e20 1e191520
ffff8e2301f32e40 2243643616 S Bi:2:011:2 -115 32 <
ffff8e2301f326c0 2243645974 C Bi:2:011:2 0 4 = 60ffffff
ffff8e2301f326c0 2243645988 S Bi:2:011:2 -115 32 <
ffff8e2301f32240 2243646309 S Bo:2:011:2 -115 4 = 522f8080
ffff8e2301f32240 2243646350 C Bo:2:011:2 0 4 >
ffff8e2301f32e40 2243650070 C Bi:2:011:2 0 32 = 522f8080 00062108 00062108 00000000 00000044 ffffffff 071d0e20 1e191520
ffff8e2301f32e40 2243650084 S Bi:2:011:2 -115 32 <
ffff8e2301f326c0 2243653110 C Bi:2:011:2 0 32 = 61ffffff 02342108 02342108 00000000 00000044 ffffffff 071d0e20 1e191520
ffff8e2301f326c0 2243653124 S Bi:2:011:2 -115 32 <
ffff8e2301f32e40 2243656181 C Bi:2:011:2 0 32 = 66ffffff 00232108 00232108 00000000 00000044 ffffffff 071d0e20 1e191520
ffff8e2301f32e40 2243656193 S Bi:2:011:2 -115 32 <
ffff8e2301f326c0 2243659258 C Bi:2:011:2 0 32 = 67ffffff 00060216 00060216 00000000 00000044 ffffffff 071d0e20 1f1f0620
ffff8e2301f326c0 2243659265 S Bi:2:011:2 -115 32 <
ffff8e2301f32e40 2243661586 C Bi:2:011:2 0 4 = 63ffffff
ffff8e2301f32e40 2243661594 S Bi:2:011:2 -115 32 <
ffff8e2301f32240 2243661885 S Bo:2:011:2 -115 4 = 52300080
ffff8e2301f32240 2243661975 C Bo:2:011:2 0 4 >
ffff8e2301f326c0 2243665653 C Bi:2:011:2 0 32 = 52300080 02340216 02340216 00000000 00000044 ffffffff 071d0e20 1f1f0620
ffff8e2301f326c0 2243665661 S Bi:2:011:2 -115 32 <
ffff8e2301f32e40 2243668729 C Bi:2:011:2 0 32 = 60ffffff 02d1d216 02d1d216 00000000 00000044 ffffffff 071d0e20 1a1f0548
ffff8e2301f32e40 2243668742 S Bi:2:011:2 -115 32 <
ffff8e2301f326c0 2243671818 C Bi:2:011:2 0 32 = 7267ffff 0244d116 0244d116 00000000 00000044 ffffffff 071d0e20 1a1f0548
ffff8e2301f326c0 2243671829 S Bi:2:011:2 -115 32 <
ffff8e2301f32e40 2243674862 C Bi:2:011:2 0 32 = 7264ffff 00067217 00067217 00000000 00000044 ffffffff 071d0e20 1a1f0548
ffff8e2301f32e40 2243674871 S Bi:2:011:2 -115 32 <
ffff8e2301f326c0 2243677274 C Bi:2:011:2 0 4 = 7265ffff
ffff8e2301f326c0 2243677286 S Bi:2:011:2 -115 32 <
ffff8e2301f32240 2243677643 S Bo:2:011:2 -115 4 = 52308080
ffff8e2301f32240 2243677684 C Bo:2:011:2 0 4 >
ffff8e2301f32e40 2243681418 C Bi:2:011:2 0 32 = 52308080 02347217 02347217 00000000 00000044 ffffffff 071d0e20 1a1f0548
ffff8e2301f32e40 2243681430 S Bi:2:011:2 -115 32 <
ffff8e2301f326c0 2243684460 C Bi:2:011:2 0 32 = 7262ffff 02d17217 02d17217 00000000 00000044 ffffffff 071d0e20 1a1f0548
ffff8e2301f326c0 2243684473 S Bi:2:011:2 -115 32 <
ffff8e2301f32e40 2243687520 C Bi:2:011:2 0 32 = 7263ffff 0244d144 0244d144 00000000 00000044 ffffffff 071d0e20 071e0420
ffff8e2301f32e40 2243687529 S Bi:2:011:2 -115 32 <
ffff8e2301f326c0 2243690591 C Bi:2:011:2 0 32 = 63ffffff 0000d644 0000d644 00000000 00000044 ffffffff 071d0e20 071e0420
ffff8e2301f326c0 2243690601 S Bi:2:011:2 -115 32 <
ffff8e2301f32e40 2243692972 C Bi:2:011:2 0 4 = 60ffffff
ffff8e2301f32e40 2243692981 S Bi:2:011:2 -115 32 <
ffff8e2301f32240 2243693342 S Bo:2:011:2 -115 4 = 52310080
ffff8e2301f32240 2243693382 C Bo:2:011:2 0 4 >
ffff8e2301f326c0 2243697064 C Bi:2:011:2 0 32 = 52310080 0023d644 0023d644 00000000 00000044 ffffffff 071d0e20 071e0420
ffff8e2301f326c0 2243697079 S Bi:2:011:2 -115 32 <
ffff8e2301f32e40 2243700182 C Bi:2:011:2 0 32 = 61ffffff 02d1c545 02d1c545 00000000 00000044 ffffffff 071d0e20 071e0420
ffff8e2301f32e40 2243700197 S Bi:2:011:2 -115 32 <
ffff8e2301f326c0 2243703254 C Bi:2:011:2 0 32 = 66ffffff 0000ca45 0000ca45 00000000 00000044 ffffffff 071d0e20 071e0420
ffff8e2301f326c0 2243703267 S Bi:2:011:2 -115 32 <
ffff8e2301f32e40 2243706273 C Bi:2:011:2 0 32 = 67ffffff 0244ca45 0244ca45 00000000 00000044 ffffffff 071d0e20 071e0420
ffff8e2301f32e40 2243706284 S Bi:2:011:2 -115 32 <
ffff8e2301f326c0 2243708661 C Bi:2:011:2 0 4 = 64ffffff
ffff8e2301f326c0 2243708668 S Bi:2:011:2 -115 32 <
ffff8e2301f32240 2243708999 S Bo:2:011:2 -115 4 = 52318080
ffff8e2301f32240 2243709054 C Bo:2:011:2 0 4 >
ffff8e2301f32e40 2243712725 C Bi:2:011:2 0 32 = 52318080 ffffffff ffffffff ffffffff ffffffff ffffffff ffffffff ffffffff
ffff8e2301f32e40 2243712729 S Bi:2:011:2 -115 32 <
ffff8e2301f326c0 2243715846 C Bi:2:011:2 0 32 = ffffffff ffffffff ffffffff ffffffff ffffffff ffffffff ffffffff ffffffff
ffff8e2301f326c0 2243715852 S Bi:2:011:2 -115 32 <
ffff8e2301f32e40 2243718863 C Bi:2:011:2 0 32 = ffffffff ffffffff ffffffff ffffffff ffffffff ffffffff ffffffff ffffffff
ffff8e2301f32e40 2243718868 S Bi:2:011:2 -115 32 <
ffff8e2301f326c0 2243722031 C Bi:2:011:2 0 32 = ffffffff ffffffff ffffffff ffffffff ffffffff ffffffff ffffffff ffffffff
ffff8e2301f326c0 2243722037 S Bi:2:011:2 -115 32 <
ffff8e2301f32e40 2243724368 C Bi:2:011:2 0 4 = ffffffff
ffff8e2301f32e40 2243724374 S Bi:2:011:2 -115 32 <
ffff8e2301f32240 2243724679 S Bo:2:011:2 -115 4 = 52320080
ffff8e2301f32240 2243724749 C Bo:2:011:2 0 4 >
ffff8e2301f326c0 2243728436 C Bi:2:011:2 0 32 = 52320080 ffffffff ffffffff ffffffff ffffffff ffffffff ffffffff ffffffff
ffff8e2301f326c0 2243728442 S Bi:2:011:2 -115 32 <
ffff8e2301f32e40 2243731504 C Bi:2:011:2 0 32 = ffffffff ffffffff ffffffff ffffffff ffffffff ffffffff ffffffff ffffffff
ffff8e2301f32e40 2243731510 S Bi:2:011:2 -115 32 <
ffff8e2301f326c0 2243734575 C Bi:2:011:2 0 32 = ffffffff ffffffff ffffffff ffffffff ffffffff ffffffff ffffffff ffffffff
ffff8e2301f326c0 2243734581 S Bi:2:011:2 -115 32 <
ffff8e2301f32e40 2243737639 C Bi:2:011:2 0 32 = ffffffff ffffffff ffffffff ffffffff ffffffff ffffffff ffffffff ffffffff
ffff8e2301f32e40 2243737646 S Bi:2:011:2 -115 32 <
ffff8e2301f326c0 2243740046 C Bi:2:011:2 0 4 = ffffffff
ffff8e2301f326c0 2243740052 S Bi:2:011:2 -115 32 <
ffff8e2301f32240 2243740331 S Bo:2:011:2 -115 4 = 52328080
ffff8e2301f32240 2243740400 C Bo:2:011:2 0 4 >
ffff8e2301f32e40 2243744114 C Bi:2:011:2 0 32 = 52328080 ffffffff ffffffff ffffffff ffffffff ffffffff ffffffff ffffffff
ffff8e2301f32e40 2243744120 S Bi:2:011:2 -115 32 <
ffff8e2301f326c0 2243747181 C Bi:2:011:2 0 32 = ffffffff ffffffff ffffffff ffffffff ffffffff ffffffff ffffffff ffffffff
ffff8e2301f326c0 2243747188 S Bi:2:011:2 -115 32 <
ffff8e2301f32e40 2243750253 C Bi:2:011:2 0 32 = ffffffff ffffffff ffffffff ffffffff ffffffff ffffffff ffffffff ffffffff
ffff8e2301f32e40 2243750260 S Bi:2:011:2 -115 32 <
ffff8e2301f326c0 2243753324 C Bi:2:011:2 0 32 = ffffffff ffffffff ffffffff ffffffff ffffffff ffffffff ffffffff ffffffff
ffff8e2301f326c0 2243753330 S Bi:2:011:2 -115 32 <
ffff8e2301f32e40 2243755571 C Bi:2:011:2 0 4 = ffffffff
ffff8e2301f32e40 2243755577 S Bi:2:011:2 -115 32 <
ffff8e2301f32240 2243755850 S Bo:2:011:2 -115 4 = 52330080
ffff8e2301f32240 2243756007 C Bo:2:011:2 0 4 >
ffff8e2301f326c0 2243759683 C Bi:2:011:2 0 32 = 52330080 ffffffff ffffffff ffffffff ffffffff ffffffff ffffffff ffffffff
ffff8e2301f326c0 2243759694 S Bi:2:011:2 -115 32 <
ffff8e2301f32e40 2243762728 C Bi:2:011:2 0 32 = ffffffff ffffffff ffffffff ffffffff ffffffff ffffffff ffffffff ffffffff
ffff8e2301f32e40 2243762734 S Bi:2:011:2 -115 32 <
ffff8e2301f326c0 2243765845 C Bi:2:011:2 0 32 = ffffffff ffffffff ffffffff ffffffff ffffffff ffffffff ffffffff ffffffff
ffff8e2301f326c0 2243765851 S Bi:2:011:2 -115 32 <
ffff8e2301f32e40 2243768891 C Bi:2:011:2 0 32 = ffffffff ffffffff ffffffff ffffffff ffffffff ffffffff ffffffff ffffffff
ffff8e2301f32e40 2243768898 S Bi:2:011:2 -115 32 <
ffff8e2301f326c0 2243771229 C Bi:2:011:2 0 4 = ffffffff
ffff8e2301f326c0 2243771235 S Bi:2:011:2 -115 32 <
ffff8e2301f32240 2243771549 S Bo:2:011:2 -115 4 = 52338080
ffff8e2301f32240 2243771618 C Bo:2:011:2 0 4 >
ffff8e2301f32e40 2243775324 C Bi:2:011:2 0 32 = 52338080 ffffffff ffffffff ffffffff ffffffff ffffffff ffffffff ffffffff
ffff8e2301f32e40 2243775330 S Bi:2:011:2 -115 32 <
ffff8e2301f326c0 2243778390 C Bi:2:011:2 0 32 = ffffffff ffffffff ffffffff ffffffff ffffffff ffffffff ffffffff ffffffff
ffff8e2301f326c0 2243778396 S Bi:2:011:2 -115 32 <
ffff8e2301f32e40 2243781458 C Bi:2:011:2 0 32 = ffffffff ffffffff ffffffff ffffffff ffffffff ffffffff ffffffff ffffffff
ffff8e2301f32e40 2243781464 S Bi:2:011:2 -115 32 <
ffff8e2301f326c0 2243784525 C Bi:2:011:2 0 32 = ffffffff ffffffff ffffffff ffffffff ffffffff ffffffff ffffffff ffffffff
ffff8e2301f326c0 2243784531 S Bi:2:011:2 -115 32 <
ffff8e2301f32e40 2243786778 C Bi:2:011:2 0 4 = ffffffff
ffff8e2301f32e40 2243786785 S Bi:2:011:2 -115 32 <
ffff8e2301f32240 2243787047 S Bo:2:011:2 -115 4 = 52340080
ffff8e2301f32240 2243787115 C Bo:2:011:2 0 4 >
ffff8e2301f326c0 2243790800 C Bi:2:011:2 0 32 = 52340080 ffffffff ffffffff ffffffff ffffffff ffffffff ffffffff ffffffff
ffff8e2301f326c0 2243790811 S Bi:2:011:2 -115 32 <
ffff8e2301f32e40 2243793894 C Bi:2:011:2 0 32 = ffffffff ffffffff ffffffff ffffffff ffffffff ffffffff ffffffff ffffffff
ffff8e2301f32e40 2243793904 S Bi:2:011:2 -115 32 <
ffff8e2301f326c0 2243797025 C Bi:2:011:2 0 32 = ffffffff ffffffff ffffffff ffffffff ffffffff ffffffff ffffffff ffffffff
ffff8e2301f326c0 2243797034 S Bi:2:011:2 -115 32 <
ffff8e2301f32e40 2243800027 C Bi:2:011:2 0 32 = ffffffff ffffffff ffffffff ffffffff ffffffff ffffffff ffffffff ffffffff
ffff8e2301f32e40 2243800037 S Bi:2:011:2 -115 32 <
ffff8e2301f326c0 2243802279 C Bi:2:011:2 0 4 = ffffffff
ffff8e2301f326c0 2243802289 S Bi:2:011:2 -115 32 <
ffff8e2301f32240 2243802583 S Bo:2:011:2 -115 4 = 52348080
ffff8e2301f32240 2243802652 C Bo:2:011:2 0 4 >
ffff8e2301f32e40 2243806347 C Bi:2:011:2 0 32 = 52348080 ffffffff ffffffff ffffffff ffffffff ffffffff ffffffff ffffffff
ffff8e2301f32e40 2243806356 S Bi:2:011:2 -115 32 <
ffff8e2301f326c0 2243809436 C Bi:2:011:2 0 32 = ffffffff ffffffff ffffffff ffffffff ffffffff ffffffff ffffffff ffffffff
ffff8e2301f326c0 2243809445 S Bi:2:011:2 -115 32 <
ffff8e2301f32e40 2243812481 C Bi:2:011:2 0 32 = ffffffff ffffffff ffffffff ffffffff ffffffff ffffffff ffffffff ffffffff
ffff8e2301f32e40 2243812491 S Bi:2:011:2 -115 32 <
ffff8e2301f326c0 2243815549 C Bi:2:011:2 0 32 = ffffffff ffffffff ffffffff ffffffff ffffffff ffffffff ffffffff ffffffff
ffff8e2301f326c0 2243815559 S Bi:2:011:2 -115 32 <
ffff8e2301f32e40 2243817983 C Bi:2:011:2 0 4 = ffffffff
ffff8e2301f32e40 2243817991 S Bi:2:011:2 -115 32 <
ffff8e2301f32240 2243818305 S Bo:2:011:2 -115 4 = 52350080
ffff8e2301f32240 2243818346 C Bo:2:011:2 0 4 >
ffff8e2301f326c0 2243822040 C Bi:2:011:2 0 32 = 52350080 ffffffff ffffffff ffffffff ffffffff ffffffff ffffffff ffffffff
ffff8e2301f326c0 2243822044 S Bi:2:011:2 -115 32 <
ffff8e2301f32e40 2243825114 C Bi:2:011:2 0 32 = ffffffff ffffffff ffffffff ffffffff ffffffff ffffffff ffffffff ffffffff
ffff8e2301f32e40 2243825122 S Bi:2:011:2 -115 32 <
ffff8e2301f326c0 2243828182 C Bi:2:011:2 0 32 = ffffffff ffffffff ffffffff ffffffff ffffffff ffffffff ffffffff ffffffff
ffff8e2301f326c0 2243828187 S Bi:2:011:2 -115 32 <
ffff8e2301f32e40 2243831250 C Bi:2:011:2 0 32 = ffffffff ffffffff ffffffff ffffffff ffffffff ffffffff ffffffff ffffffff
ffff8e2301f32e40 2243831254 S Bi:2:011:2 -115 32 <
ffff8e2301f326c0 2243833634 C Bi:2:011:2 0 4 = ffffffff
ffff8e2301f326c0 2243833640 S Bi:2:011:2 -115 32 <
ffff8e2301f32240 2243833941 S Bo:2:011:2 -115 4 = 52358080
ffff8e2301f32240 2243833980 C Bo:2:011:2 0 4 >
ffff8e2301f32e40 2243837731 C Bi:2:011:2 0 32 = 52358080 ffffffff ffffffff ffffffff ffffffff ffffffff ffffffff ffffffff
ffff8e2301f32e40 2243837737 S Bi:2:011:2 -115 32 <
ffff8e2301f326c0 2243840738 C Bi:2:011:2 0 32 = ffffffff ffffffff ffffffff ffffffff ffffffff ffffffff ffffffff ffffffff
ffff8e2301f326c0 2243840744 S Bi:2:011:2 -115 32 <
ffff8e2301f32e40 2243843819 C Bi:2:011:2 0 32 = ffffffff ffffffff ffffffff ffffffff ffffffff ffffffff ffffffff ffffffff
ffff8e2301f32e40 2243843823 S Bi:2:011:2 -115 32 <
ffff8e2301f326c0 2243846859 C Bi:2:011:2 0 32 = ffffffff ffffffff ffffffff ffffffff ffffffff ffffffff ffffffff ffffffff
ffff8e2301f326c0 2243846862 S Bi:2:011:2 -115 32 <
ffff8e2301f32e40 2243849130 C Bi:2:011:2 0 4 = ffffffff
ffff8e2301f32e40 2243849134 S Bi:2:011:2 -115 32 <
ffff8e2301f32240 2243849473 S Bo:2:011:2 -115 4 = 52360080
ffff8e2301f32240 2243849512 C Bo:2:011:2 0 4 >
ffff8e2301f326c0 2243853200 C Bi:2:011:2 0 32 = 52360080 ffffffff ffffffff ffffffff ffffffff ffffffff ffffffff ffffffff
ffff8e2301f326c0 2243853203 S Bi:2:011:2 -115 32 <
ffff8e2301f32e40 2243856270 C Bi:2:011:2 0 32 = ffffffff ffffffff ffffffff ffffffff ffffffff ffffffff ffffffff ffffffff
ffff8e2301f32e40 2243856275 S Bi:2:011:2 -115 32 <
ffff8e2301f326c0 2243859341 C Bi:2:011:2 0 32 = ffffffff ffffffff ffffffff ffffffff ffffffff ffffffff ffffffff ffffffff
ffff8e2301f326c0 2243859345 S Bi:2:011:2 -115 32 <
ffff8e2301f32e40 2243862402 C Bi:2:011:2 0 32 = ffffffff ffffffff ffffffff ffffffff ffffffff ffffffff ffffffff ffffffff
ffff8e2301f32e40 2243862405 S Bi:2:011:2 -115 32 <
ffff8e2301f326c0 2243864793 C Bi:2:011:2 0 4 = ffffffff
ffff8e2301f326c0 2243864798 S Bi:2:011:2 -115 32 <
ffff8e2301f32240 2243865139 S Bo:2:011:2 -115 4 = 52368080
ffff8e2301f32240 2243865179 C Bo:2:011:2 0 4 >
ffff8e2301f32e40 2243868858 C Bi:2:011:2 0 32 = 52368080 ffffffff ffffffff ffffffff ffffffff ffffffff ffffffff ffffffff
ffff8e2301f32e40 2243868861 S Bi:2:011:2 -115 32 <
ffff8e2301f326c0 2243872040 C Bi:2:011:2 0 32 = ffffffff ffffffff ffffffff ffffffff ffffffff ffffffff ffffffff ffffffff
ffff8e2301f326c0 2243872043 S Bi:2:011:2 -115 32 <
ffff8e2301f32e40 2243875017 C Bi:2:011:2 0 32 = ffffffff ffffffff ffffffff ffffffff ffffffff ffffffff ffffffff ffffffff
ffff8e2301f32e40 2243875022 S Bi:2:011:2 -115 32 <
ffff8e2301f326c0 2243878081 C Bi:2:011:2 0 32 = ffffffff ffffffff ffffffff ffffffff ffffffff ffffffff ffffffff ffffffff
ffff8e2301f326c0 2243878083 S Bi:2:011:2 -115 32 <
ffff8e2301f32e40 2243880340 C Bi:2:011:2 0 4 = ffffffff
ffff8e2301f32e40 2243880345 S Bi:2:011:2 -115 32 <
ffff8e2301f32240 2243880676 S Bo:2:011:2 -115 4 = 52370080
ffff8e2301f32240 2243880714 C Bo:2:011:2 0 4 >
ffff8e2301f326c0 2243884410 C Bi:2:011:2 0 32 = 52370080 ffffffff ffffffff ffffffff ffffffff ffffffff ffffffff ffffffff
ffff8e2301f326c0 2243884416 S Bi:2:011:2 -115 32 <
ffff8e2301f32e40 2243887478 C Bi:2:011:2 0 32 = ffffffff ffffffff ffffffff ffffffff ffffffff ffffffff ffffffff ffffffff
ffff8e2301f32e40 2243887483 S Bi:2:011:2 -115 32 <
ffff8e2301f326c0 2243890539 C Bi:2:011:2 0 32 = ffffffff ffffffff ffffffff ffffffff ffffffff ffffffff ffffffff ffffffff
ffff8e2301f326c0 2243890542 S Bi:2:011:2 -115 32 <
ffff8e2301f32e40 2243893611 C Bi:2:011:2 0 32 = ffffffff ffffffff ffffffff ffffffff ffffffff ffffffff ffffffff ffffffff
ffff8e2301f32e40 2243893617 S Bi:2:011:2 -115 32 <
ffff8e2301f326c0 2243896022 C Bi:2:011:2 0 4 = ffffffff
ffff8e2301f326c0 2243896027 S Bi:2:011:2 -115 32 <
ffff8e2301f32240 2243896326 S Bo:2:011:2 -115 4 = 52378080
ffff8e2301f32240 2243896367 C Bo:2:011:2 0 4 >
ffff8e2301f32e40 2243900085 C Bi:2:011:2 0 32 = 52378080 ffffffff ffffffff ffffffff ffffffff ffffffff ffffffff ffffffff
ffff8e2301f32e40 2243900089 S Bi:2:011:2 -115 32 <
ffff8e2301f326c0 2243903156 C Bi:2:011:2 0 32 = ffffffff ffffffff ffffffff ffffffff ffffffff ffffffff ffffffff ffffffff
ffff8e2301f326c0 2243903159 S Bi:2:011:2 -115 32 <
ffff8e2301f32e40 2243906223 C Bi:2:011:2 0 32 = ffffffff ffffffff ffffffff ffffffff ffffffff ffffffff ffffffff ffffffff
ffff8e2301f32e40 2243906227 S Bi:2:011:2 -115 32 <
ffff8e2301f326c0 2243909296 C Bi:2:011:2 0 32 = ffffffff ffffffff ffffffff ffffffff ffffffff ffffffff ffffffff ffffffff
ffff8e2301f326c0 2243909299 S Bi:2:011:2 -115 32 <
ffff8e2301f32e40 2243911496 C Bi:2:011:2 0 4 = ffffffff
ffff8e2301f32e40 2243911500 S Bi:2:011:2 -115 32 <
ffff8e2301f32240 2243911851 S Bo:2:011:2 -115 4 = 52380080
ffff8e2301f32240 2243911979 C Bo:2:011:2 0 4 >
ffff8e2301f326c0 2243915669 C Bi:2:011:2 0 32 = 52380080 ffffffff ffffffff ffffffff ffffffff ffffffff ffffffff ffffffff
ffff8e2301f326c0 2243915672 S Bi:2:011:2 -115 32 <
ffff8e2301f32e40 2243918734 C Bi:2:011:2 0 32 = ffffffff ffffffff ffffffff ffffffff ffffffff ffffffff ffffffff ffffffff
ffff8e2301f32e40 2243918738 S Bi:2:011:2 -115 32 <
ffff8e2301f326c0 2243921821 C Bi:2:011:2 0 32 = ffffffff ffffffff ffffffff ffffffff ffffffff ffffffff ffffffff ffffffff
ffff8e2301f326c0 2243921825 S Bi:2:011:2 -115 32 <
ffff8e2301f32e40 2243924860 C Bi:2:011:2 0 32 = ffffffff ffffffff ffffffff ffffffff ffffffff ffffffff ffffffff ffffffff
ffff8e2301f32e40 2243924864 S Bi:2:011:2 -115 32 <
ffff8e2301f326c0 2243927231 C Bi:2:011:2 0 4 = ffffffff
ffff8e2301f326c0 2243927248 S Bi:2:011:2 -115 32 <
ffff8e2301f32240 2243927571 S Bo:2:011:2 -115 4 = 52388080
ffff8e2301f32240 2243927613 C Bo:2:011:2 0 4 >
ffff8e2301f32e40 2243931293 C Bi:2:011:2 0 32 = 52388080 ffffffff ffffffff ffffffff ffffffff ffffffff ffffffff ffffffff
ffff8e2301f32e40 2243931296 S Bi:2:011:2 -115 32 <
ffff8e2301f326c0 2243934362 C Bi:2:011:2 0 32 = ffffffff ffffffff ffffffff ffffffff ffffffff ffffffff ffffffff ffffffff
ffff8e2301f326c0 2243934367 S Bi:2:011:2 -115 32 <
ffff8e2301f32e40 2243937439 C Bi:2:011:2 0 32 = ffffffff ffffffff ffffffff ffffffff ffffffff ffffffff ffffffff ffffffff
ffff8e2301f32e40 2243937443 S Bi:2:011:2 -115 32 <
ffff8e2301f326c0 2243940495 C Bi:2:011:2 0 32 = ffffffff ffffffff ffffffff ffffffff ffffffff ffffffff ffffffff ffffffff
ffff8e2301f326c0 2243940500 S Bi:2:011:2 -115 32 <
ffff8e2301f32e40 2243942971 C Bi:2:011:2 0 4 = ffffffff
ffff8e2301f32e40 2243942974 S Bi:2:011:2 -115 32 <
ffff8e2301f32240 2243943279 S Bo:2:011:2 -115 4 = 52390080
ffff8e2301f32240 2243943325 C Bo:2:011:2 0 4 >
ffff8e2301f326c0 2243947035 C Bi:2:011:2 0 32 = 52390080 ffffffff ffffffff ffffffff ffffffff ffffffff ffffffff ffffffff
ffff8e2301f326c0 2243947039 S Bi:2:011:2 -115 32 <
ffff8e2301f32e40 2243950085 C Bi:2:011:2 0 32 = ffffffff ffffffff ffffffff ffffffff ffffffff ffffffff ffffffff ffffffff
ffff8e2301f32e40 2243950089 S Bi:2:011:2 -115 32 <
ffff8e2301f326c0 2243953153 C Bi:2:011:2 0 32 = ffffffff ffffffff ffffffff ffffffff ffffffff ffffffff ffffffff ffffffff
ffff8e2301f326c0 2243953156 S Bi:2:011:2 -115 32 <
ffff8e2301f32e40 2243956224 C Bi:2:011:2 0 32 = ffffffff ffffffff ffffffff ffffffff ffffffff ffffffff ffffffff ffffffff
ffff8e2301f32e40 2243956228 S Bi:2:011:2 -115 32 <
ffff8e2301f326c0 2243958564 C Bi:2:011:2 0 4 = ffffffff
ffff8e2301f326c0 2243958567 S Bi:2:011:2 -115 32 <
ffff8e2301f32240 2243958885 S Bo:2:011:2 -115 4 = 52398080
ffff8e2301f32240 2243958972 C Bo:2:011:2 0 4 >
ffff8e2301f32e40 2243962679 C Bi:2:011:2 0 32 = 52398080 ffffffff ffffffff ffffffff ffffffff ffffffff ffffffff ffffffff
ffff8e2301f32e40 2243962682 S Bi:2:011:2 -115 32 <
ffff8e2301f326c0 2243965727 C Bi:2:011:2 0 32 = ffffffff ffffffff ffffffff ffffffff ffffffff ffffffff ffffffff ffffffff
ffff8e2301f326c0 2243965733 S Bi:2:011:2 -115 32 <
ffff8e2301f32e40 2243968814 C Bi:2:011:2 0 32 = ffffffff ffffffff ffffffff ffffffff ffffffff ffffffff ffffffff ffffffff
ffff8e2301f32e40 2243968817 S Bi:2:011:2 -115 32 <
ffff8e2301f326c0 2243971863 C Bi:2:011:2 0 32 = ffffffff ffffffff ffffffff ffffffff ffffffff ffffffff ffffffff ffffffff
ffff8e2301f326c0 2243971868 S Bi:2:011:2 -115 32 <
ffff8e2301f32e40 2243974249 C Bi:2:011:2 0 4 = ffffffff
ffff8e2301f32e40 2243974252 S Bi:2:011:2 -115 32 <
ffff8e2301f32240 2243974559 S Bo:2:011:2 -115 4 = 523a0080
ffff8e2301f32240 2243974599 C Bo:2:011:2 0 4 >
ffff8e2301f326c0 2243978344 C Bi:2:011:2 0 32 = 523a0080 ffffffff ffffffff ffffffff ffffffff ffffffff ffffffff ffffffff
ffff8e2301f326c0 2243978350 S Bi:2:011:2 -115 32 <
ffff8e2301f32e40 2243981389 C Bi:2:011:2 0 32 = ffffffff ffffffff ffffffff ffffffff ffffffff ffffffff ffffffff ffffffff
ffff8e2301f32e40 2243981403 S Bi:2:011:2 -115 32 <
ffff8e2301f326c0 2243984454 C Bi:2:011:2 0 32 = ffffffff ffffffff ffffffff ffffffff ffffffff ffffffff ffffffff ffffffff
ffff8e2301f326c0 2243984461 S Bi:2:011:2 -115 32 <
ffff8e2301f32e40 2243987523 C Bi:2:011:2 0 32 = ffffffff ffffffff ffffffff ffffffff ffffffff ffffffff ffffffff ffffffff
ffff8e2301f32e40 2243987534 S Bi:2:011:2 -115 32 <
ffff8e2301f326c0 2243989750 C Bi:2:011:2 0 4 = ffffffff
ffff8e2301f326c0 2243989757 S Bi:2:011:2 -115 32 <
ffff8e2301f32240 2243990124 S Bo:2:011:2 -115 4 = 523a8080
ffff8e2301f32240 2243990164 C Bo:2:011:2 0 4 >
ffff8e2301f32e40 2243993892 C Bi:2:011:2 0 32 = 523a8080 ffffffff ffffffff ffffffff ffffffff ffffffff ffffffff ffffffff
ffff8e2301f32e40 2243993907 S Bi:2:011:2 -115 32 <
ffff8e2301f326c0 2243996998 C Bi:2:011:2 0 32 = ffffffff ffffffff ffffffff ffffffff ffffffff ffffffff ffffffff ffffffff
ffff8e2301f326c0 2243997015 S Bi:2:011:2 -115 32 <
ffff8e2301f32e40 2244000039 C Bi:2:011:2 0 32 = ffffffff ffffffff ffffffff ffffffff ffffffff ffffffff ffffffff ffffffff
ffff8e2301f32e40 2244000049 S Bi:2:011:2 -115 32 <
ffff8e2301f326c0 2244003066 C Bi:2:011:2 0 32 = ffffffff ffffffff ffffffff ffffffff ffffffff ffffffff ffffffff ffffffff
ffff8e2301f326c0 2244003082 S Bi:2:011:2 -115 32 <
ffff8e2301f32e40 2244005457 C Bi:2:011:2 0 4 = ffffffff
ffff8e2301f32e40 2244005468 S Bi:2:011:2 -115 32 <
ffff8e2301f32240 2244005851 S Bo:2:011:2 -115 4 = 523b0080
ffff8e2301f32240 2244005979 C Bo:2:011:2 0 4 >
ffff8e2301f326c0 2244009687 C Bi:2:011:2 0 32 = 523b0080 ffffffff ffffffff ffffffff ffffffff ffffffff ffffffff ffffffff
ffff8e2301f326c0 2244009699 S Bi:2:011:2 -115 32 <
ffff8e2301f32e40 2244012735 C Bi:2:011:2 0 32 = ffffffff ffffffff ffffffff ffffffff ffffffff ffffffff ffffffff ffffffff
ffff8e2301f32e40 2244012754 S Bi:2:011:2 -115 32 <
ffff8e2301f326c0 2244015819 C Bi:2:011:2 0 32 = ffffffff ffffffff ffffffff ffffffff ffffffff ffffffff ffffffff ffffffff
ffff8e2301f326c0 2244015829 S Bi:2:011:2 -115 32 <
ffff8e2301f32e40 2244018865 C Bi:2:011:2 0 32 = ffffffff ffffffff ffffffff ffffffff ffffffff ffffffff ffffffff ffffffff
ffff8e2301f32e40 2244018875 S Bi:2:011:2 -115 32 <
ffff8e2301f326c0 2244021132 C Bi:2:011:2 0 4 = ffffffff
ffff8e2301f326c0 2244021140 S Bi:2:011:2 -115 32 <
ffff8e2301f32240 2244021484 S Bo:2:011:2 -115 4 = 523b8080
ffff8e2301f32240 2244021525 C Bo:2:011:2 0 4 >
ffff8e2301f32e40 2244025251 C Bi:2:011:2 0 32 = 523b8080 ffffffff ffffffff ffffffff ffffffff ffffffff ffffffff ffffffff
ffff8e2301f32e40 2244025259 S Bi:2:011:2 -115 32 <
ffff8e2301f326c0 2244028278 C Bi:2:011:2 0 32 = ffffffff ffffffff ffffffff ffffffff ffffffff ffffffff ffffffff ffffffff
ffff8e2301f326c0 2244028298 S Bi:2:011:2 -115 32 <
ffff8e2301f32e40 2244031352 C Bi:2:011:2 0 32 = ffffffff ffffffff ffffffff ffffffff ffffffff ffffffff ffffffff ffffffff
ffff8e2301f32e40 2244031364 S Bi:2:011:2 -115 32 <
ffff8e2301f326c0 2244034408 C Bi:2:011:2 0 32 = ffffffff ffffffff ffffffff ffffffff ffffffff ffffffff ffffffff ffffffff
ffff8e2301f326c0 2244034412 S Bi:2:011:2 -115 32 <
ffff8e2301f32e40 2244036795 C Bi:2:011:2 0 4 = ffffffff
ffff8e2301f32e40 2244036798 S Bi:2:011:2 -115 32 <
ffff8e2301f32240 2244037124 S Bo:2:011:2 -115 4 = 523c0080
ffff8e2301f32240 2244037163 C Bo:2:011:2 0 4 >
ffff8e2301f326c0 2244040859 C Bi:2:011:2 0 32 = 523c0080 ffffffff ffffffff ffffffff ffffffff ffffffff ffffffff ffffffff
ffff8e2301f326c0 2244040863 S Bi:2:011:2 -115 32 <
ffff8e2301f32e40 2244044005 C Bi:2:011:2 0 32 = ffffffff ffffffff ffffffff ffffffff ffffffff ffffffff ffffffff ffffffff
ffff8e2301f32e40 2244044012 S Bi:2:011:2 -115 32 <
ffff8e2301f326c0 2244046999 C Bi:2:011:2 0 32 = ffffffff ffffffff ffffffff ffffffff ffffffff ffffffff ffffffff ffffffff
ffff8e2301f326c0 2244047004 S Bi:2:011:2 -115 32 <
ffff8e2301f32e40 2244050086 C Bi:2:011:2 0 32 = ffffffff ffffffff ffffffff ffffffff ffffffff ffffffff ffffffff ffffffff
ffff8e2301f32e40 2244050091 S Bi:2:011:2 -115 32 <
ffff8e2301f326c0 2244052336 C Bi:2:011:2 0 4 = ffffffff
ffff8e2301f326c0 2244052339 S Bi:2:011:2 -115 32 <
ffff8e2301f32240 2244052623 S Bo:2:011:2 -115 4 = 523c8080
ffff8e2301f32240 2244052663 C Bo:2:011:2 0 4 >
ffff8e2301f32e40 2244056408 C Bi:2:011:2 0 32 = 523c8080 ffffffff ffffffff ffffffff ffffffff ffffffff ffffffff ffffffff
ffff8e2301f32e40 2244056414 S Bi:2:011:2 -115 32 <
ffff8e2301f326c0 2244059436 C Bi:2:011:2 0 32 = ffffffff ffffffff ffffffff ffffffff ffffffff ffffffff ffffffff ffffffff
ffff8e2301f326c0 2244059442 S Bi:2:011:2 -115 32 <
ffff8e2301f32e40 2244062499 C Bi:2:011:2 0 32 = ffffffff ffffffff ffffffff ffffffff ffffffff ffffffff ffffffff ffffffff
ffff8e2301f32e40 2244062505 S Bi:2:011:2 -115 32 <
ffff8e2301f326c0 2244065580 C Bi:2:011:2 0 32 = ffffffff ffffffff ffffffff ffffffff ffffffff ffffffff ffffffff ffffffff
ffff8e2301f326c0 2244065585 S Bi:2:011:2 -115 32 <
ffff8e2301f32e40 2244067842 C Bi:2:011:2 0 4 = ffffffff
ffff8e2301f32e40 2244067846 S Bi:2:011:2 -115 32 <
ffff8e2301f32240 2244068141 S Bo:2:011:2 -115 4 = 523d0080
ffff8e2301f32240 2244068182 C Bo:2:011:2 0 4 >
ffff8e2301f326c0 2244071862 C Bi:2:011:2 0 32 = 523d0080 ffffffff ffffffff ffffffff ffffffff ffffffff ffffffff ffffffff
ffff8e2301f326c0 2244071865 S Bi:2:011:2 -115 32 <
ffff8e2301f32e40 2244075008 C Bi:2:011:2 0 32 = ffffffff ffffffff ffffffff ffffffff ffffffff ffffffff ffffffff ffffffff
ffff8e2301f32e40 2244075013 S Bi:2:011:2 -115 32 <
ffff8e2301f326c0 2244078044 C Bi:2:011:2 0 32 = ffffffff ffffffff ffffffff ffffffff ffffffff ffffffff ffffffff ffffffff
ffff8e2301f326c0 2244078050 S Bi:2:011:2 -115 32 <
ffff8e2301f32e40 2244081107 C Bi:2:011:2 0 32 = ffffffff ffffffff ffffffff ffffffff ffffffff ffffffff ffffffff ffffffff
ffff8e2301f32e40 2244081111 S Bi:2:011:2 -115 32 <
ffff8e2301f326c0 2244083366 C Bi:2:011:2 0 4 = ffffffff
ffff8e2301f326c0 2244083372 S Bi:2:011:2 -115 32 <
ffff8e2301f32240 2244083650 S Bo:2:011:2 -115 4 = 523d8080
ffff8e2301f32240 2244083689 C Bo:2:011:2 0 4 >
ffff8e2301f32e40 2244087414 C Bi:2:011:2 0 32 = 523d8080 ffffffff ffffffff ffffffff ffffffff ffffffff ffffffff ffffffff
ffff8e2301f32e40 2244087420 S Bi:2:011:2 -115 32 <
ffff8e2301f326c0 2244090456 C Bi:2:011:2 0 32 = ffffffff ffffffff ffffffff ffffffff ffffffff ffffffff ffffffff ffffffff
ffff8e2301f326c0 2244090461 S Bi:2:011:2 -115 32 <
ffff8e2301f32e40 2244093523 C Bi:2:011:2 0 32 = ffffffff ffffffff ffffffff ffffffff ffffffff ffffffff ffffffff ffffffff
ffff8e2301f32e40 2244093529 S Bi:2:011:2 -115 32 <
ffff8e2301f326c0 2244096593 C Bi:2:011:2 0 32 = ffffffff ffffffff ffffffff ffffffff ffffffff ffffffff ffffffff ffffffff
ffff8e2301f326c0 2244096597 S Bi:2:011:2 -115 32 <
ffff8e2301f32e40 2244098844 C Bi:2:011:2 0 4 = ffffffff
ffff8e2301f32e40 2244098851 S Bi:2:011:2 -115 32 <
ffff8e2301f32240 2244099188 S Bo:2:011:2 -115 4 = 523e0080
ffff8e2301f32240 2244099229 C Bo:2:011:2 0 4 >
ffff8e2301f326c0 2244102994 C Bi:2:011:2 0 32 = 523e0080 ffffffff ffffffff ffffffff ffffffff ffffffff ffffffff ffffffff
ffff8e2301f326c0 2244102998 S Bi:2:011:2 -115 32 <
ffff8e2301f32e40 2244106008 C Bi:2:011:2 0 32 = ffffffff ffffffff ffffffff ffffffff ffffffff ffffffff ffffffff ffffffff
ffff8e2301f32e40 2244106016 S Bi:2:011:2 -115 32 <
ffff8e2301f326c0 2244109067 C Bi:2:011:2 0 32 = ffffffff ffffffff ffffffff ffffffff ffffffff ffffffff ffffffff ffffffff
ffff8e2301f326c0 2244109074 S Bi:2:011:2 -115 32 <
ffff8e2301f32e40 2244112129 C Bi:2:011:2 0 32 = ffffffff ffffffff ffffffff ffffffff ffffffff ffffffff ffffffff ffffffff
ffff8e2301f32e40 2244112134 S Bi:2:011:2 -115 32 <
ffff8e2301f326c0 2244114523 C Bi:2:011:2 0 4 = ffffffff
ffff8e2301f326c0 2244114527 S Bi:2:011:2 -115 32 <
ffff8e2301f32240 2244114766 S Bo:2:011:2 -115 4 = 523e8080
ffff8e2301f32240 2244114805 C Bo:2:011:2 0 4 >
ffff8e2301f32e40 2244118531 C Bi:2:011:2 0 32 = 523e8080 ffffffff ffffffff ffffffff ffffffff ffffffff ffffffff ffffffff
ffff8e2301f32e40 2244118537 S Bi:2:011:2 -115 32 <
ffff8e2301f326c0 2244121574 C Bi:2:011:2 0 32 = ffffffff ffffffff ffffffff ffffffff ffffffff ffffffff ffffffff ffffffff
ffff8e2301f326c0 2244121581 S Bi:2:011:2 -115 32 <
ffff8e2301f32e40 2244124641 C Bi:2:011:2 0 32 = ffffffff ffffffff ffffffff ffffffff ffffffff ffffffff ffffffff ffffffff
ffff8e2301f32e40 2244124646 S Bi:2:011:2 -115 32 <
ffff8e2301f326c0 2244127690 C Bi:2:011:2 0 32 = ffffffff ffffffff ffffffff ffffffff ffffffff ffffffff ffffffff ffffffff
ffff8e2301f326c0 2244127694 S Bi:2:011:2 -115 32 <
ffff8e2301f32e40 2244130074 C Bi:2:011:2 0 4 = ffffffff
ffff8e2301f32e40 2244130079 S Bi:2:011:2 -115 32 <
ffff8e2301f32240 2244130369 S Bo:2:011:2 -115 4 = 523f0080
ffff8e2301f32240 2244130408 C Bo:2:011:2 0 4 >
ffff8e2301f326c0 2244134130 C Bi:2:011:2 0 32 = 523f0080 ffffffff ffffffff ffffffff ffffffff ffffffff ffffffff ffffffff
ffff8e2301f326c0 2244134134 S Bi:2:011:2 -115 32 <
ffff8e2301f32e40 2244137206 C Bi:2:011:2 0 32 = ffffffff ffffffff ffffffff ffffffff ffffffff ffffffff ffffffff ffffffff
ffff8e2301f32e40 2244137212 S Bi:2:011:2 -115 32 <
ffff8e2301f326c0 2244140227 C Bi:2:011:2 0 32 = ffffffff ffffffff ffffffff ffffffff ffffffff ffffffff ffffffff ffffffff
ffff8e2301f326c0 2244140240 S Bi:2:011:2 -115 32 <
ffff8e2301f32e40 2244143295 C Bi:2:011:2 0 32 = ffffffff ffffffff ffffffff ffffffff ffffffff ffffffff ffffffff ffffffff
ffff8e2301f32e40 2244143299 S Bi:2:011:2 -115 32 <
ffff8e2301f326c0 2244145546 C Bi:2:011:2 0 4 = ffffffff
ffff8e2301f326c0 2244145552 S Bi:2:011:2 -115 32 <
ffff8e2301f32240 2244145858 S Bo:2:011:2 -115 4 = 523f8080
ffff8e2301f32240 2244145987 C Bo:2:011:2 0 4 >
ffff8e2301f32e40 2244149683 C Bi:2:011:2 0 32 = 523f8080 ffffffff ffffffff ffffffff ffffffff ffffffff ffffffff ffffffff
ffff8e2301f32e40 2244149689 S Bi:2:011:2 -115 32 <
ffff8e2301f326c0 2244152730 C Bi:2:011:2 0 32 = ffffffff ffffffff ffffffff ffffffff ffffffff ffffffff ffffffff ffffffff
ffff8e2301f326c0 2244152736 S Bi:2:011:2 -115 32 <
ffff8e2301f32e40 2244155817 C Bi:2:011:2 0 32 = ffffffff ffffffff ffffffff ffffffff ffffffff ffffffff ffffffff ffffffff
ffff8e2301f32e40 2244155822 S Bi:2:011:2 -115 32 <
ffff8e2301f326c0 2244158895 C Bi:2:011:2 0 32 = ffffffff ffffffff ffffffff ffffffff ffffffff ffffffff ffffffff ffffffff
ffff8e2301f326c0 2244158901 S Bi:2:011:2 -115 32 <
ffff8e2301f32e40 2244161258 C Bi:2:011:2 0 4 = ffffffff
ffff8e2301f32e40 2244161264 S Bi:2:011:2 -115 32 <
ffff8e2301f32240 2244161578 S Bo:2:011:2 -115 4 = 52400080
ffff8e2301f32240 2244161648 C Bo:2:011:2 0 4 >
ffff8e2301f326c0 2244165343 C Bi:2:011:2 0 32 = 52400080 ffffffff ffffffff ffffffff ffffffff ffffffff ffffffff ffffffff
ffff8e2301f326c0 2244165348 S Bi:2:011:2 -115 32 <
ffff8e2301f32e40 2244168445 C Bi:2:011:2 0 32 = ffffffff ffffffff ffffffff ffffffff ffffffff ffffffff ffffffff ffffffff
ffff8e2301f32e40 2244168456 S Bi:2:011:2 -115 32 <
ffff8e2301f326c0 2244171506 C Bi:2:011:2 0 32 = ffffffff ffffffff ffffffff ffffffff ffffffff ffffffff ffffffff ffffffff
ffff8e2301f326c0 2244171516 S Bi:2:011:2 -115 32 <
ffff8e2301f32e40 2244174572 C Bi:2:011:2 0 32 = ffffffff ffffffff ffffffff ffffffff ffffffff ffffffff ffffffff ffffffff
ffff8e2301f32e40 2244174582 S Bi:2:011:2 -115 32 <
ffff8e2301f326c0 2244177003 C Bi:2:011:2 0 4 = ffffffff
ffff8e2301f326c0 2244177014 S Bi:2:011:2 -115 32 <
ffff8e2301f32240 2244177321 S Bo:2:011:2 -115 4 = 52408080
ffff8e2301f32240 2244177389 C Bo:2:011:2 0 4 >
ffff8e2301f32e40 2244181099 C Bi:2:011:2 0 32 = 52408080 ffffffff ffffffff ffffffff ffffffff ffffffff ffffffff ffffffff
ffff8e2301f32e40 2244181105 S Bi:2:011:2 -115 32 <
ffff8e2301f326c0 2244184160 C Bi:2:011:2 0 32 = ffffffff ffffffff ffffffff ffffffff ffffffff ffffffff ffffffff ffffffff
ffff8e2301f326c0 2244184170 S Bi:2:011:2 -115 32 <
ffff8e2301f32e40 2244187232 C Bi:2:011:2 0 32 = ffffffff ffffffff ffffffff ffffffff ffffffff ffffffff ffffffff ffffffff
ffff8e2301f32e40 2244187243 S Bi:2:011:2 -115 32 <
ffff8e2301f326c0 2244190303 C Bi:2:011:2 0 32 = ffffffff ffffffff ffffffff ffffffff ffffffff ffffffff ffffffff ffffffff
ffff8e2301f326c0 2244190314 S Bi:2:011:2 -115 32 <
ffff8e2301f32e40 2244192644 C Bi:2:011:2 0 4 = ffffffff
ffff8e2301f32e40 2244192655 S Bi:2:011:2 -115 32 <
ffff8e2301f32240 2244192966 S Bo:2:011:2 -115 4 = 52410080
ffff8e2301f32240 2244193035 C Bo:2:011:2 0 4 >
ffff8e2301f326c0 2244196757 C Bi:2:011:2 0 32 = 52410080 ffffffff ffffffff ffffffff ffffffff ffffffff ffffffff ffffffff
ffff8e2301f326c0 2244196767 S Bi:2:011:2 -115 32 <
ffff8e2301f32e40 2244199803 C Bi:2:011:2 0 32 = ffffffff ffffffff ffffffff ffffffff ffffffff ffffffff ffffffff ffffffff
ffff8e2301f32e40 2244199813 S Bi:2:011:2 -115 32 <
ffff8e2301f326c0 2244202892 C Bi:2:011:2 0 32 = ffffffff ffffffff ffffffff ffffffff ffffffff ffffffff ffffffff ffffffff
ffff8e2301f326c0 2244202903 S Bi:2:011:2 -115 32 <
ffff8e2301f32e40 2244206025 C Bi:2:011:2 0 32 = ffffffff ffffffff ffffffff ffffffff ffffffff ffffffff ffffffff ffffffff
ffff8e2301f32e40 2244206035 S Bi:2:011:2 -115 32 <
ffff8e2301f326c0 2244208324 C Bi:2:011:2 0 4 = ffffffff
ffff8e2301f326c0 2244208334 S Bi:2:011:2 -115 32 <
ffff8e2301f32240 2244208652 S Bo:2:011:2 -115 4 = 52418080
ffff8e2301f32240 2244208720 C Bo:2:011:2 0 4 >
ffff8e2301f32e40 2244212438 C Bi:2:011:2 0 32 = 52418080 ffffffff ffffffff ffffffff ffffffff ffffffff ffffffff ffffffff
ffff8e2301f32e40 2244212444 S Bi:2:011:2 -115 32 <
ffff8e2301f326c0 2244215478 C Bi:2:011:2 0 32 = ffffffff ffffffff ffffffff ffffffff ffffffff ffffffff ffffffff ffffffff
ffff8e2301f326c0 2244215486 S Bi:2:011:2 -115 32 <
ffff8e2301f32e40 2244218545 C Bi:2:011:2 0 32 = ffffffff ffffffff ffffffff ffffffff ffffffff ffffffff ffffffff ffffffff
ffff8e2301f32e40 2244218552 S Bi:2:011:2 -115 32 <
ffff8e2301f326c0 2244221614 C Bi:2:011:2 0 32 = ffffffff ffffffff ffffffff ffffffff ffffffff ffffffff ffffffff ffffffff
ffff8e2301f326c0 2244221621 S Bi:2:011:2 -115 32 <
ffff8e2301f32e40 2244224031 C Bi:2:011:2 0 4 = ffffffff
ffff8e2301f32e40 2244224040 S Bi:2:011:2 -115 32 <
ffff8e2301f32240 2244224321 S Bo:2:011:2 -115 4 = 52420080
ffff8e2301f32240 2244224389 C Bo:2:011:2 0 4 >
ffff8e2301f326c0 2244228056 C Bi:2:011:2 0 32 = 52420080 ffffffff ffffffff ffffffff ffffffff ffffffff ffffffff ffffffff
ffff8e2301f326c0 2244228068 S Bi:2:011:2 -115 32 <
ffff8e2301f32e40 2244231111 C Bi:2:011:2 0 32 = ffffffff ffffffff ffffffff ffffffff ffffffff ffffffff ffffffff ffffffff
ffff8e2301f32e40 2244231117 S Bi:2:011:2 -115 32 <
ffff8e2301f326c0 2244234254 C Bi:2:011:2 0 32 = ffffffff ffffffff ffffffff ffffffff ffffffff ffffffff ffffffff ffffffff
ffff8e2301f326c0 2244234264 S Bi:2:011:2 -115 32 <
ffff8e2301f32e40 2244237281 C Bi:2:011:2 0 32 = ffffffff ffffffff ffffffff ffffffff ffffffff ffffffff ffffffff ffffffff
ffff8e2301f32e40 2244237290 S Bi:2:011:2 -115 32 <
ffff8e2301f326c0 2244239709 C Bi:2:011:2 0 4 = ffffffff
ffff8e2301f326c0 2244239720 S Bi:2:011:2 -115 32 <
ffff8e2301f32240 2244240033 S Bo:2:011:2 -115 4 = 52428080
ffff8e2301f32240 2244240111 C Bo:2:011:2 0 4 >
ffff8e2301f32e40 2244243803 C Bi:2:011:2 0 32 = 52428080 ffffffff ffffffff ffffffff ffffffff ffffffff ffffffff ffffffff
ffff8e2301f32e40 2244243814 S Bi:2:011:2 -115 32 <
ffff8e2301f326c0 2244246891 C Bi:2:011:2 0 32 = ffffffff ffffffff ffffffff ffffffff ffffffff ffffffff ffffffff ffffffff
ffff8e2301f326c0 2244246900 S Bi:2:011:2 -115 32 <
ffff8e2301f32e40 2244250026 C Bi:2:011:2 0 32 = ffffffff ffffffff ffffffff ffffffff ffffffff ffffffff ffffffff ffffffff
ffff8e2301f32e40 2244250036 S Bi:2:011:2 -115 32 <
ffff8e2301f326c0 2244253026 C Bi:2:011:2 0 32 = ffffffff ffffffff ffffffff ffffffff ffffffff ffffffff ffffffff ffffffff
ffff8e2301f326c0 2244253035 S Bi:2:011:2 -115 32 <
ffff8e2301f32e40 2244255348 C Bi:2:011:2 0 4 = ffffffff
ffff8e2301f32e40 2244255359 S Bi:2:011:2 -115 32 <
ffff8e2301f32240 2244255649 S Bo:2:011:2 -115 4 = 52430080
ffff8e2301f32240 2244255719 C Bo:2:011:2 0 4 >
ffff8e2301f326c0 2244259421 C Bi:2:011:2 0 32 = 52430080 ffffffff ffffffff ffffffff ffffffff ffffffff ffffffff ffffffff
ffff8e2301f326c0 2244259430 S Bi:2:011:2 -115 32 <
ffff8e2301f32e40 2244262482 C Bi:2:011:2 0 32 = ffffffff ffffffff ffffffff ffffffff ffffffff ffffffff ffffffff ffffffff
ffff8e2301f32e40 2244262493 S Bi:2:011:2 -115 32 <
ffff8e2301f326c0 2244265549 C Bi:2:011:2 0 32 = ffffffff ffffffff ffffffff ffffffff ffffffff ffffffff ffffffff ffffffff
ffff8e2301f326c0 2244265558 S Bi:2:011:2 -115 32 <
ffff8e2301f32e40 2244268616 C Bi:2:011:2 0 32 = ffffffff ffffffff ffffffff ffffffff ffffffff ffffffff ffffffff ffffffff
ffff8e2301f32e40 2244268625 S Bi:2:011:2 -115 32 <
ffff8e2301f326c0 2244270871 C Bi:2:011:2 0 4 = ffffffff
ffff8e2301f326c0 2244270880 S Bi:2:011:2 -115 32 <
ffff8e2301f32240 2244271202 S Bo:2:011:2 -115 4 = 52438080
ffff8e2301f32240 2244271270 C Bo:2:011:2 0 4 >
ffff8e2303c4c540 2244274086 C Ii:2:008:1 0:1 7 = 02000010 000000
ffff8e2303c4c540 2244274105 S Ii:2:008:1 -115:1 8 <
ffff8e2301f32e40 2244275005 C Bi:2:011:2 0 32 = 52438080 ffffffff ffffffff ffffffff ffffffff ffffffff ffffffff ffffffff
ffff8e2301f32e40 2244275016 S Bi:2:011:2 -115 32 <
ffff8e2301f326c0 2244278029 C Bi:2:011:2 0 32 = ffffffff ffffffff ffffffff ffffffff ffffffff ffffffff ffffffff ffffffff
ffff8e2301f326c0 2244278038 S Bi:2:011:2 -115 32 <
ffff8e2301f32e40 2244281097 C Bi:2:011:2 0 32 = ffffffff ffffffff ffffffff ffffffff ffffffff ffffffff ffffffff ffffffff
ffff8e2301f32e40 2244281102 S Bi:2:011:2 -115 32 <
ffff8e2303c4c540 2244282059 C Ii:2:008:1 0:1 7 = 0200ff2f 000000
ffff8e2303c4c540 2244282079 S Ii:2:008:1 -115:1 8 <
ffff8e2301f326c0 2244284162 C Bi:2:011:2 0 32 = ffffffff ffffffff ffffffff ffffffff ffffffff ffffffff ffffffff ffffffff
ffff8e2301f326c0 2244284171 S Bi:2:011:2 -115 32 <
ffff8e2301f32e40 2244286550 C Bi:2:011:2 0 4 = ffffffff
ffff8e2301f32e40 2244286560 S Bi:2:011:2 -115 32 <
ffff8e2301f32240 2244286847 S Bo:2:011:2 -115 4 = 52440080
ffff8e2301f32240 2244286982 C Bo:2:011:2 0 4 >
ffff8e2303c4c540 2244290059 C Ii:2:008:1 0:1 7 = 0200fd2f 000000
ffff8e2303c4c540 2244290081 S Ii:2:008:1 -115:1 8 <
ffff8e2301f326c0 2244290690 C Bi:2:011:2 0 32 = 52440080 ffffffff ffffffff ffffffff ffffffff ffffffff ffffffff ffffffff
ffff8e2301f326c0 2244290705 S Bi:2:011:2 -115 32 <
ffff8e2301f32e40 2244293758 C Bi:2:011:2 0 32 = ffffffff ffffffff ffffffff ffffffff ffffffff ffffffff ffffffff ffffffff
ffff8e2301f32e40 2244293769 S Bi:2:011:2 -115 32 <
ffff8e2301f326c0 2244296846 C Bi:2:011:2 0 32 = ffffffff ffffffff ffffffff ffffffff ffffffff ffffffff ffffffff ffffffff
ffff8e2301f326c0 2244296857 S Bi:2:011:2 -115 32 <
ffff8e2303c4c540 2244298056 C Ii:2:008:1 0:1 7 = 0200fb2f 000000
ffff8e2302151980 2244298059 S Bo:2:002:2 -115 31 = 55534243 ab050000 00000000 00000600 00000000 00000000 00000000 000000
ffff8e2303c4c540 2244298080 S Ii:2:008:1 -115:1 8 <
ffff8e2302151980 2244298100 C Bo:2:002:2 0 31 >
ffff8e2302151980 2244298109 S Bi:2:002:1 -115 13 <
ffff8e2302151980 2244298143 C Bi:2:002:1 0 13 = 55534253 ab050000 00000000 00
ffff8e2301f32e40 2244299893 C Bi:2:011:2 0 32 = ffffffff ffffffff ffffffff ffffffff ffffffff ffffffff ffffffff ffffffff
ffff8e2301f32e40 2244299905 S Bi:2:011:2 -115 32 <
ffff8e2301f326c0 2244302205 C Bi:2:011:2 0 4 = ffffffff
ffff8e2301f326c0 2244302215 S Bi:2:011:2 -115 32 <
ffff8e2301f32240 2244302513 S Bo:2:011:2 -115 4 = 52448080
ffff8e2301f32240 2244302582 C Bo:2:011:2 0 4 >
ffff8e2303c4c540 2244306057 C Ii:2:008:1 0:1 7 = 0200f72f 000000
ffff8e2303c4c540 2244306079 S Ii:2:008:1 -115:1 8 <
ffff8e2301f32e40 2244306279 C Bi:2:011:2 0 32 = 52448080 ffffffff ffffffff ffffffff ffffffff ffffffff ffffffff ffffffff
ffff8e2301f32e40 2244306289 S Bi:2:011:2 -115 32 <
ffff8e2301f326c0 2244309369 C Bi:2:011:2 0 32 = ffffffff ffffffff ffffffff ffffffff ffffffff ffffffff ffffffff ffffffff
ffff8e2301f326c0 2244309380 S Bi:2:011:2 -115 32 <
ffff8e2301f32e40 2244312407 C Bi:2:011:2 0 32 = ffffffff ffffffff ffffffff ffffffff ffffffff ffffffff ffffffff ffffffff
ffff8e2301f32e40 2244312412 S Bi:2:011:2 -115 32 <
ffff8e2303c4c540 2244314053 C Ii:2:008:1 0:1 7 = 0200f42f 000000
ffff8e2303c4c540 2244314071 S Ii:2:008:1 -115:1 8 <
ffff8e2301f326c0 2244315480 C Bi:2:011:2 0 32 = ffffffff ffffffff ffffffff ffffffff ffffffff ffffffff ffffffff ffffffff
ffff8e2301f326c0 2244315499 S Bi:2:011:2 -115 32 <
ffff8e2301f32e40 2244317708 C Bi:2:011:2 0 4 = ffffffff
ffff8e2301f32e40 2244317713 S Bi:2:011:2 -115 32 <
ffff8e2301f32240 2244317995 S Bo:2:011:2 -115 4 = 52450080
ffff8e2301f32240 2244318034 C Bo:2:011:2 0 4 >
ffff8e2301f326c0 2244321758 C Bi:2:011:2 0 32 = 52450080 ffffffff ffffffff ffffffff ffffffff ffffffff ffffffff ffffffff
ffff8e2301f326c0 2244321764 S Bi:2:011:2 -115 32 <
ffff8e2303c4c540 2244322085 C Ii:2:008:1 0:1 7 = 0200f21f 000000
ffff8e2303c4c540 2244322107 S Ii:2:008:1 -115:1 8 <
ffff8e2301f32e40 2244324827 C Bi:2:011:2 0 32 = ffffffff ffffffff ffffffff ffffffff ffffffff ffffffff ffffffff ffffffff
ffff8e2301f32e40 2244324840 S Bi:2:011:2 -115 32 <
ffff8e2301f326c0 2244327864 C Bi:2:011:2 0 32 = ffffffff ffffffff ffffffff ffffffff ffffffff ffffffff ffffffff ffffffff
ffff8e2301f326c0 2244327867 S Bi:2:011:2 -115 32 <
ffff8e2303c4c540 2244330055 C Ii:2:008:1 0:1 7 = 0200f10f 000000
ffff8e2303c4c540 2244330073 S Ii:2:008:1 -115:1 8 <
ffff8e2301f32e40 2244330998 C Bi:2:011:2 0 32 = ffffffff ffffffff ffffffff ffffffff ffffffff ffffffff ffffffff ffffffff
ffff8e2301f32e40 2244331002 S Bi:2:011:2 -115 32 <
ffff8e2301f326c0 2244333230 C Bi:2:011:2 0 4 = ffffffff
ffff8e2301f326c0 2244333235 S Bi:2:011:2 -115 32 <
ffff8e2301f32240 2244333508 S Bo:2:011:2 -115 4 = 52458080
ffff8e2301f32240 2244333553 C Bo:2:011:2 0 4 >
ffff8e2301f32e40 2244337281 C Bi:2:011:2 0 32 = 52458080 ffffffff ffffffff ffffffff ffffffff ffffffff ffffffff ffffffff
ffff8e2301f32e40 2244337287 S Bi:2:011:2 -115 32 <
ffff8e2303c4c540 2244338054 C Ii:2:008:1 0:1 7 = 0200f20f 000000
ffff8e2303c4c540 2244338073 S Ii:2:008:1 -115:1 8 <
ffff8e2301f326c0 2244340318 C Bi:2:011:2 0 32 = ffffffff ffffffff ffffffff ffffffff ffffffff ffffffff ffffffff ffffffff
ffff8e2301f326c0 2244340322 S Bi:2:011:2 -115 32 <
ffff8e2301f32e40 2244343387 C Bi:2:011:2 0 32 = ffffffff ffffffff ffffffff ffffffff ffffffff ffffffff ffffffff ffffffff
ffff8e2301f32e40 2244343390 S Bi:2:011:2 -115 32 <
ffff8e2303c4c540 2244346056 C Ii:2:008:1 0:1 7 = 0200f40f 000000
ffff8e2303c4c540 2244346080 S Ii:2:008:1 -115:1 8 <
ffff8e2301f326c0 2244346454 C Bi:2:011:2 0 32 = ffffffff ffffffff ffffffff ffffffff ffffffff ffffffff ffffffff ffffffff
ffff8e2301f326c0 2244346457 S Bi:2:011:2 -115 32 <
ffff8e2301f32e40 2244348752 C Bi:2:011:2 0 4 = ffffffff
ffff8e2301f32e40 2244348755 S Bi:2:011:2 -115 32 <
ffff8e2301f32240 2244349008 S Bo:2:011:2 -115 4 = 52460080
ffff8e2301f32240 2244349058 C Bo:2:011:2 0 4 >
ffff8e2301f326c0 2244352728 C Bi:2:011:2 0 32 = 52460080 ffffffff ffffffff ffffffff ffffffff ffffffff ffffffff ffffffff
ffff8e2301f326c0 2244352732 S Bi:2:011:2 -115 32 <
ffff8e2303c4c540 2244354057 C Ii:2:008:1 0:1 7 = 0200f60f 000000
ffff8e2303c4c540 2244354076 S Ii:2:008:1 -115:1 8 <
ffff8e2301f32e40 2244355825 C Bi:2:011:2 0 32 = ffffffff ffffffff ffffffff ffffffff ffffffff ffffffff ffffffff ffffffff
ffff8e2301f32e40 2244355831 S Bi:2:011:2 -115 32 <
ffff8e2301f326c0 2244359005 C Bi:2:011:2 0 32 = ffffffff ffffffff ffffffff ffffffff ffffffff ffffffff ffffffff ffffffff
ffff8e2301f326c0 2244359010 S Bi:2:011:2 -115 32 <
ffff8e2301f32e40 2244361998 C Bi:2:011:2 0 32 = ffffffff ffffffff ffffffff ffffffff ffffffff ffffffff ffffffff ffffffff
ffff8e2301f32e40 2244362008 S Bi:2:011:2 -115 32 <
ffff8e2303c4c540 2244362056 C Ii:2:008:1 0:1 7 = 0200f40f 000000
ffff8e2303c4c540 2244362079 S Ii:2:008:1 -115:1 8 <
ffff8e2301f326c0 2244364255 C Bi:2:011:2 0 4 = ffffffff
ffff8e2301f326c0 2244364261 S Bi:2:011:2 -115 32 <
ffff8e2301f32240 2244364502 S Bo:2:011:2 -115 4 = 52468080
ffff8e2301f32240 2244364543 C Bo:2:011:2 0 4 >
ffff8e2301f32e40 2244368227 C Bi:2:011:2 0 32 = 52468080 ffffffff ffffffff ffffffff ffffffff ffffffff ffffffff ffffffff
ffff8e2301f32e40 2244368231 S Bi:2:011:2 -115 32 <
ffff8e2303c4c540 2244370056 C Ii:2:008:1 0:1 7 = 0200f20f 000000
ffff8e2303c4c540 2244370082 S Ii:2:008:1 -115:1 8 <
ffff8e2301f326c0 2244371309 C Bi:2:011:2 0 32 = ffffffff ffffffff ffffffff ffffffff ffffffff ffffffff ffffffff ffffffff
ffff8e2301f326c0 2244371313 S Bi:2:011:2 -115 32 <
ffff8e2301f32e40 2244374362 C Bi:2:011:2 0 32 = ffffffff ffffffff ffffffff ffffffff ffffffff ffffffff ffffffff ffffffff
ffff8e2301f32e40 2244374369 S Bi:2:011:2 -115 32 <
ffff8e2301f326c0 2244377433 C Bi:2:011:2 0 32 = ffffffff ffffffff ffffffff ffffffff ffffffff ffffffff ffffffff ffffffff
ffff8e2301f326c0 2244377440 S Bi:2:011:2 -115 32 <
ffff8e2303c4c540 2244378055 C Ii:2:008:1 0:1 7 = 0200ef0f 000000
ffff8e2303c4c540 2244378080 S Ii:2:008:1 -115:1 8 <
ffff8e2301f32e40 2244379752 C Bi:2:011:2 0 4 = ffffffff
ffff8e2301f32e40 2244379761 S Bi:2:011:2 -115 32 <
ffff8e2301f32240 2244380073 S Bo:2:011:2 -115 4 = 52470080
ffff8e2301f32240 2244380113 C Bo:2:011:2 0 4 >
ffff8e2301f326c0 2244383819 C Bi:2:011:2 0 32 = 52470080 ffffffff ffffffff ffffffff ffffffff ffffffff ffffffff ffffffff
ffff8e2301f326c0 2244383825 S Bi:2:011:2 -115 32 <
ffff8e2303c4c540 2244386057 C Ii:2:008:1 0:1 7 = 0200ec0f 000000
ffff8e2303c4c540 2244386076 S Ii:2:008:1 -115:1 8 <
ffff8e2301f32e40 2244386863 C Bi:2:011:2 0 32 = ffffffff ffffffff ffffffff ffffffff ffffffff ffffffff ffffffff ffffffff
ffff8e2301f32e40 2244386871 S Bi:2:011:2 -115 32 <
ffff8e2301f326c0 2244390000 C Bi:2:011:2 0 32 = ffffffff ffffffff ffffffff ffffffff ffffffff ffffffff ffffffff ffffffff
ffff8e2301f326c0 2244390012 S Bi:2:011:2 -115 32 <
ffff8e2301f32e40 2244393022 C Bi:2:011:2 0 32 = ffffffff ffffffff ffffffff ffffffff ffffffff ffffffff ffffffff ffffffff
ffff8e2301f32e40 2244393027 S Bi:2:011:2 -115 32 <
ffff8e2303c4c540 2244394055 C Ii:2:008:1 0:1 7 = 0200e8df ff0000
ffff8e2303c4c540 2244394078 S Ii:2:008:1 -115:1 8 <
ffff8e2301f326c0 2244395277 C Bi:2:011:2 0 4 = ffffffff
ffff8e2301f326c0 2244395282 S Bi:2:011:2 -115 32 <
ffff8e2301f32240 2244395557 S Bo:2:011:2 -115 4 = 52478080
ffff8e2301f32240 2244395596 C Bo:2:011:2 0 4 >
ffff8e2301f32e40 2244399302 C Bi:2:011:2 0 32 = 52478080 ffffffff ffffffff ffffffff ffffffff ffffffff ffffffff ffffffff
ffff8e2301f32e40 2244399308 S Bi:2:011:2 -115 32 <
ffff8e2303c4c540 2244402055 C Ii:2:008:1 0:1 7 = 0200e3cf ff0000
ffff8e2303c4c540 2244402079 S Ii:2:008:1 -115:1 8 <
ffff8e2301f326c0 2244402366 C Bi:2:011:2 0 32 = ffffffff ffffffff ffffffff ffffffff ffffffff ffffffff ffffffff ffffffff
ffff8e2301f326c0 2244402374 S Bi:2:011:2 -115 32 <
ffff8e2301f32e40 2244405444 C Bi:2:011:2 0 32 = ffffffff ffffffff ffffffff ffffffff ffffffff ffffffff ffffffff ffffffff
ffff8e2301f32e40 2244405452 S Bi:2:011:2 -115 32 <
ffff8e2301f326c0 2244408500 C Bi:2:011:2 0 32 = ffffffff ffffffff ffffffff ffffffff ffffffff ffffffff ffffffff ffffffff
ffff8e2301f326c0 2244408507 S Bi:2:011:2 -115 32 <
ffff8e2303c4c540 2244410054 C Ii:2:008:1 0:1 7 = 0200de9f ff0000
ffff8e2303c4c540 2244410070 S Ii:2:008:1 -115:1 8 <
ffff8e2301f32e40 2244410798 C Bi:2:011:2 0 4 = ffffffff
ffff8e2301f32e40 2244410805 S Bi:2:011:2 -115 32 <
ffff8e2301f32240 2244411102 S Bo:2:011:2 -115 4 = 52480080
ffff8e2301f32240 2244411143 C Bo:2:011:2 0 4 >
ffff8e2301f326c0 2244414821 C Bi:2:011:2 0 32 = 52480080 ffffffff ffffffff ffffffff ffffffff ffffffff ffffffff ffffffff
ffff8e2301f326c0 2244414832 S Bi:2:011:2 -115 32 <
ffff8e2301f32e40 2244417900 C Bi:2:011:2 0 32 = ffffffff ffffffff ffffffff ffffffff ffffffff ffffffff ffffffff ffffffff
ffff8e2301f32e40 2244417906 S Bi:2:011:2 -115 32 <
ffff8e2303c4c540 2244418055 C Ii:2:008:1 0:1 7 = 0200d58f ff0000
ffff8e2303c4c540 2244418073 S Ii:2:008:1 -115:1 8 <
ffff8e2301f326c0 2244420999 C Bi:2:011:2 0 32 = ffffffff ffffffff ffffffff ffffffff ffffffff ffffffff ffffffff ffffffff
ffff8e2301f326c0 2244421010 S Bi:2:011:2 -115 32 <
ffff8e2301f32e40 2244424045 C Bi:2:011:2 0 32 = ffffffff ffffffff ffffffff ffffffff ffffffff ffffffff ffffffff ffffffff
ffff8e2301f32e40 2244424051 S Bi:2:011:2 -115 32 <
ffff8e2303c4c540 2244426054 C Ii:2:008:1 0:1 7 = 0200ce6f ff0000
ffff8e2303c4c540 2244426072 S Ii:2:008:1 -115:1 8 <
ffff8e2301f326c0 2244426298 C Bi:2:011:2 0 4 = ffffffff
ffff8e2301f326c0 2244426302 S Bi:2:011:2 -115 32 <
ffff8e2301f32240 2244426622 S Bo:2:011:2 -115 4 = 52488080
ffff8e2301f32240 2244426660 C Bo:2:011:2 0 4 >
ffff8e2301f32e40 2244430394 C Bi:2:011:2 0 32 = 52488080 ffffffff ffffffff ffffffff ffffffff ffffffff ffffffff ffffffff
ffff8e2301f32e40 2244430400 S Bi:2:011:2 -115 32 <
ffff8e2301f326c0 2244433434 C Bi:2:011:2 0 32 = ffffffff ffffffff ffffffff ffffffff ffffffff ffffffff ffffffff ffffffff
ffff8e2301f326c0 2244433440 S Bi:2:011:2 -115 32 <
ffff8e2303c4c540 2244434054 C Ii:2:008:1 0:1 7 = 0200c76f ff0000
ffff8e2303c4c540 2244434071 S Ii:2:008:1 -115:1 8 <
ffff8e2301f32e40 2244436505 C Bi:2:011:2 0 32 = ffffffff ffffffff ffffffff ffffffff ffffffff ffffffff ffffffff ffffffff
ffff8e2301f32e40 2244436509 S Bi:2:011:2 -115 32 <
ffff8e2301f326c0 2244439567 C Bi:2:011:2 0 32 = ffffffff ffffffff ffffffff ffffffff ffffffff ffffffff ffffffff ffffffff
ffff8e2301f326c0 2244439571 S Bi:2:011:2 -115 32 <
ffff8e2301f32e40 2244441796 C Bi:2:011:2 0 4 = ffffffff
ffff8e2301f32e40 2244441800 S Bi:2:011:2 -115 32 <
ffff8e2301f32240 2244442036 S Bo:2:011:2 -115 4 = 52490080
ffff8e2303c4c540 2244442053 C Ii:2:008:1 0:1 7 = 0200c36f ff0000
ffff8e2303c4c540 2244442068 S Ii:2:008:1 -115:1 8 <
ffff8e2301f32240 2244442097 C Bo:2:011:2 0 4 >
ffff8e2301f326c0 2244445802 C Bi:2:011:2 0 32 = 52490080 ffffffff ffffffff ffffffff ffffffff ffffffff ffffffff ffffffff
ffff8e2301f326c0 2244445808 S Bi:2:011:2 -115 32 <
ffff8e2301f32e40 2244448908 C Bi:2:011:2 0 32 = ffffffff ffffffff ffffffff ffffffff ffffffff ffffffff ffffffff ffffffff
ffff8e2301f32e40 2244448919 S Bi:2:011:2 -115 32 <
ffff8e2303c4c540 2244450057 C Ii:2:008:1 0:1 7 = 0200c26f ff0000
ffff8e2303c4c540 2244450075 S Ii:2:008:1 -115:1 8 <
ffff8e2301f326c0 2244452040 C Bi:2:011:2 0 32 = ffffffff ffffffff ffffffff ffffffff ffffffff ffffffff ffffffff ffffffff
ffff8e2301f326c0 2244452046 S Bi:2:011:2 -115 32 <
ffff8e2301f32e40 2244455034 C Bi:2:011:2 0 32 = ffffffff ffffffff ffffffff ffffffff ffffffff ffffffff ffffffff ffffffff
ffff8e2301f32e40 2244455040 S Bi:2:011:2 -115 32 <
ffff8e2301f326c0 2244457351 C Bi:2:011:2 0 4 = ffffffff
ffff8e2301f326c0 2244457367 S Bi:2:011:2 -115 32 <
ffff8e2301f32240 2244457618 S Bo:2:011:2 -115 4 = 52498080
ffff8e2301f32240 2244457659 C Bo:2:011:2 0 4 >
ffff8e2303c4c540 2244458054 C Ii:2:008:1 0:1 7 = 0200c29f ff0000
ffff8e2303c4c540 2244458071 S Ii:2:008:1 -115:1 8 <
ffff8e2301f32e40 2244461373 C Bi:2:011:2 0 32 = 52498080 ffffffff ffffffff ffffffff ffffffff ffffffff ffffffff ffffffff
ffff8e2301f32e40 2244461385 S Bi:2:011:2 -115 32 <
ffff8e2301f326c0 2244464442 C Bi:2:011:2 0 32 = ffffffff ffffffff ffffffff ffffffff ffffffff ffffffff ffffffff ffffffff
ffff8e2301f326c0 2244464455 S Bi:2:011:2 -115 32 <
ffff8e2303c4c540 2244466062 C Ii:2:008:1 0:1 7 = 0200c7af ff0000
ffff8e2303c4c540 2244466091 S Ii:2:008:1 -115:1 8 <
ffff8e2301f32e40 2244467506 C Bi:2:011:2 0 32 = ffffffff ffffffff ffffffff ffffffff ffffffff ffffffff ffffffff ffffffff
ffff8e2301f32e40 2244467521 S Bi:2:011:2 -115 32 <
ffff8e2301f326c0 2244470618 C Bi:2:011:2 0 32 = ffffffff ffffffff ffffffff ffffffff ffffffff ffffffff ffffffff ffffffff
ffff8e2301f326c0 2244470633 S Bi:2:011:2 -115 32 <
ffff8e2301f32e40 2244472870 C Bi:2:011:2 0 4 = ffffffff
ffff8e2301f32e40 2244472885 S Bi:2:011:2 -115 32 <
ffff8e2303c4c540 2244473055 C Ii:2:008:1 0:1 7 = 0200ccdf ff0000
ffff8e2303c4c540 2244473073 S Ii:2:008:1 -115:1 8 <
ffff8e2301f32240 2244473130 S Bo:2:011:2 -115 4 = 524a0080
ffff8e2301f32240 2244473171 C Bo:2:011:2 0 4 >
ffff8e2301f326c0 2244476894 C Bi:2:011:2 0 32 = 524a0080 ffffffff ffffffff ffffffff ffffffff ffffffff ffffffff ffffffff
ffff8e2301f326c0 2244476908 S Bi:2:011:2 -115 32 <
ffff8e2301f32e40 2244480050 C Bi:2:011:2 0 32 = ffffffff ffffffff ffffffff ffffffff ffffffff ffffffff ffffffff ffffffff
ffff8e2301f32e40 2244480064 S Bi:2:011:2 -115 32 <
ffff8e2303c4c540 2244481057 C Ii:2:008:1 0:1 7 = 0200d0df ff0000
ffff8e2303c4c540 2244481075 S Ii:2:008:1 -115:1 8 <
ffff8e2301f326c0 2244483008 C Bi:2:011:2 0 32 = ffffffff ffffffff ffffffff ffffffff ffffffff ffffffff ffffffff ffffffff
ffff8e2301f326c0 2244483017 S Bi:2:011:2 -115 32 <
ffff8e2301f32e40 2244486089 C Bi:2:011:2 0 32 = ffffffff ffffffff ffffffff ffffffff ffffffff ffffffff ffffffff ffffffff
ffff8e2301f32e40 2244486098 S Bi:2:011:2 -115 32 <
ffff8e2301f326c0 2244488344 C Bi:2:011:2 0 4 = ffffffff
ffff8e2301f326c0 2244488353 S Bi:2:011:2 -115 32 <
ffff8e2301f32240 2244488646 S Bo:2:011:2 -115 4 = 524a8080
ffff8e2301f32240 2244488685 C Bo:2:011:2 0 4 >
ffff8e2303c4c540 2244489084 C Ii:2:008:1 0:1 7 = 0200d5ff ff0000
ffff8e2303c4c540 2244489108 S Ii:2:008:1 -115:1 8 <
ffff8e2301f32e40 2244492437 C Bi:2:011:2 0 32 = 524a8080 ffffffff ffffffff ffffffff ffffffff ffffffff ffffffff ffffffff
ffff8e2301f32e40 2244492451 S Bi:2:011:2 -115 32 <
ffff8e2301f326c0 2244495509 C Bi:2:011:2 0 32 = ffffffff ffffffff ffffffff ffffffff ffffffff ffffffff ffffffff ffffffff
ffff8e2301f326c0 2244495524 S Bi:2:011:2 -115 32 <
ffff8e2303c4c540 2244497085 C Ii:2:008:1 0:1 7 = 0200d6ef ff0000
ffff8e2303c4c540 2244497106 S Ii:2:008:1 -115:1 8 <
ffff8e2301f32e40 2244498552 C Bi:2:011:2 0 32 = ffffffff ffffffff ffffffff ffffffff ffffffff ffffffff ffffffff ffffffff
ffff8e2301f32e40 2244498571 S Bi:2:011:2 -115 32 <
ffff8e2301f326c0 2244501642 C Bi:2:011:2 0 32 = ffffffff ffffffff ffffffff ffffffff ffffffff ffffffff ffffffff ffffffff
ffff8e2301f326c0 2244501654 S Bi:2:011:2 -115 32 <
ffff8e2301f32e40 2244504005 C Bi:2:011:2 0 4 = ffffffff
ffff8e2301f32e40 2244504019 S Bi:2:011:2 -115 32 <
ffff8e2301f32240 2244504258 S Bo:2:011:2 -115 4 = 524b0080
ffff8e2301f32240 2244504308 C Bo:2:011:2 0 4 >
ffff8e2303c4c540 2244505084 C Ii:2:008:1 0:1 7 = 0200d7ff ff0000
ffff8e2303c4c540 2244505108 S Ii:2:008:1 -115:1 8 <
ffff8e2301f326c0 2244508027 C Bi:2:011:2 0 32 = 524b0080 ffffffff ffffffff ffffffff ffffffff ffffffff ffffffff ffffffff
ffff8e2301f326c0 2244508040 S Bi:2:011:2 -115 32 <
ffff8e2301f32e40 2244511068 C Bi:2:011:2 0 32 = ffffffff ffffffff ffffffff ffffffff ffffffff ffffffff ffffffff ffffffff
ffff8e2301f32e40 2244511078 S Bi:2:011:2 -115 32 <
ffff8e2303c4c540 2244513061 C Ii:2:008:1 0:1 7 = 0200d7ef ff0000
ffff8e2303c4c540 2244513081 S Ii:2:008:1 -115:1 8 <
ffff8e2301f326c0 2244514136 C Bi:2:011:2 0 32 = ffffffff ffffffff ffffffff ffffffff ffffffff ffffffff ffffffff ffffffff
ffff8e2301f326c0 2244514145 S Bi:2:011:2 -115 32 <
ffff8e2301f32e40 2244517206 C Bi:2:011:2 0 32 = ffffffff ffffffff ffffffff ffffffff ffffffff ffffffff ffffffff ffffffff
ffff8e2301f32e40 2244517216 S Bi:2:011:2 -115 32 <
ffff8e2301f326c0 2244519547 C Bi:2:011:2 0 4 = ffffffff
ffff8e2301f326c0 2244519559 S Bi:2:011:2 -115 32 <
ffff8e2301f32240 2244519852 S Bo:2:011:2 -115 4 = 524b8080
ffff8e2301f32240 2244519981 C Bo:2:011:2 0 4 >
ffff8e2303c4c540 2244521084 C Ii:2:008:1 0:1 7 = 0200dadf ff0000
ffff8e2303c4c540 2244521098 S Ii:2:008:1 -115:1 8 <
ffff8e2301f32e40 2244523687 C Bi:2:011:2 0 32 = 524b8080 ffffffff ffffffff ffffffff ffffffff ffffffff ffffffff ffffffff
ffff8e2301f32e40 2244523693 S Bi:2:011:2 -115 32 <
ffff8e2301f326c0 2244526735 C Bi:2:011:2 0 32 = ffffffff ffffffff ffffffff ffffffff ffffffff ffffffff ffffffff ffffffff
ffff8e2301f326c0 2244526741 S Bi:2:011:2 -115 32 <
ffff8e2303c4c540 2244529061 C Ii:2:008:1 0:1 7 = 0200ddcf ff0000
ffff8e2303c4c540 2244529076 S Ii:2:008:1 -115:1 8 <
ffff8e2301f32e40 2244529837 C Bi:2:011:2 0 32 = ffffffff ffffffff ffffffff ffffffff ffffffff ffffffff ffffffff ffffffff
ffff8e2301f32e40 2244529845 S Bi:2:011:2 -115 32 <
ffff8e2301f326c0 2244532878 C Bi:2:011:2 0 32 = ffffffff ffffffff ffffffff ffffffff ffffffff ffffffff ffffffff ffffffff
ffff8e2301f326c0 2244532886 S Bi:2:011:2 -115 32 <
ffff8e2301f32e40 2244535241 C Bi:2:011:2 0 4 = ffffffff
ffff8e2301f32e40 2244535247 S Bi:2:011:2 -115 32 <
ffff8e2301f32240 2244535521 S Bo:2:011:2 -115 4 = 524c0080
ffff8e2301f32240 2244535559 C Bo:2:011:2 0 4 >
ffff8e2303c4c540 2244537085 C Ii:2:008:1 0:1 7 = 0200debf ff0000
ffff8e2303c4c540 2244537100 S Ii:2:008:1 -115:1 8 <
ffff8e2301f326c0 2244539259 C Bi:2:011:2 0 32 = 524c0080 ffffffff ffffffff ffffffff ffffffff ffffffff ffffffff ffffffff
ffff8e2301f326c0 2244539268 S Bi:2:011:2 -115 32 <
ffff8e2301f32e40 2244542322 C Bi:2:011:2 0 32 = ffffffff ffffffff ffffffff ffffffff ffffffff ffffffff ffffffff ffffffff
ffff8e2301f32e40 2244542328 S Bi:2:011:2 -115 32 <
ffff8e2303c4c540 2244545058 C Ii:2:008:1 0:1 7 = 0200e0df ff0000
ffff8e2303c4c540 2244545073 S Ii:2:008:1 -115:1 8 <
ffff8e2301f326c0 2244545404 C Bi:2:011:2 0 32 = ffffffff ffffffff ffffffff ffffffff ffffffff ffffffff ffffffff ffffffff
ffff8e2301f326c0 2244545409 S Bi:2:011:2 -115 32 <
ffff8e2301f32e40 2244548454 C Bi:2:011:2 0 32 = ffffffff ffffffff ffffffff ffffffff ffffffff ffffffff ffffffff ffffffff
ffff8e2301f32e40 2244548459 S Bi:2:011:2 -115 32 <
ffff8e2301f326c0 2244550754 C Bi:2:011:2 0 4 = ffffffff
ffff8e2301f326c0 2244550762 S Bi:2:011:2 -115 32 <
ffff8e2301f32240 2244551054 S Bo:2:011:2 -115 4 = 524c8080
ffff8e2301f32240 2244551093 C Bo:2:011:2 0 4 >
ffff8e2303c4c540 2244553084 C Ii:2:008:1 0:1 7 = 0200e2ef ff0000
ffff8e2303c4c540 2244553100 S Ii:2:008:1 -115:1 8 <
ffff8e2301f32e40 2244554804 C Bi:2:011:2 0 32 = 524c8080 ffffffff ffffffff ffffffff ffffffff ffffffff ffffffff ffffffff
ffff8e2301f32e40 2244554815 S Bi:2:011:2 -115 32 <
ffff8e2301f326c0 2244557894 C Bi:2:011:2 0 32 = ffffffff ffffffff ffffffff ffffffff ffffffff ffffffff ffffffff ffffffff
ffff8e2301f326c0 2244557905 S Bi:2:011:2 -115 32 <
ffff8e2301f32e40 2244561013 C Bi:2:011:2 0 32 = ffffffff ffffffff ffffffff ffffffff ffffffff ffffffff ffffffff ffffffff
ffff8e2301f32e40 2244561019 S Bi:2:011:2 -115 32 <
ffff8e2303c4c540 2244561060 C Ii:2:008:1 0:1 7 = 0200e5ff ff0000
ffff8e2303c4c540 2244561072 S Ii:2:008:1 -115:1 8 <
ffff8e2301f326c0 2244564000 C Bi:2:011:2 0 32 = ffffffff ffffffff ffffffff ffffffff ffffffff ffffffff ffffffff ffffffff
ffff8e2301f326c0 2244564014 S Bi:2:011:2 -115 32 <
ffff8e2301f32e40 2244566254 C Bi:2:011:2 0 4 = ffffffff
ffff8e2301f32e40 2244566260 S Bi:2:011:2 -115 32 <
ffff8e2301f32240 2244566592 S Bo:2:011:2 -115 4 = 524d0080
ffff8e2301f32240 2244566636 C Bo:2:011:2 0 4 >
ffff8e2303c4c540 2244569061 C Ii:2:008:1 0:1 7 = 0200e60f 000000
ffff8e2303c4c540 2244569076 S Ii:2:008:1 -115:1 8 <
ffff8e2301f326c0 2244570325 C Bi:2:011:2 0 32 = 524d0080 ffffffff ffffffff ffffffff ffffffff ffffffff ffffffff ffffffff
ffff8e2301f326c0 2244570330 S Bi:2:011:2 -115 32 <
ffff8e2301f32e40 2244573416 C Bi:2:011:2 0 32 = ffffffff ffffffff ffffffff ffffffff ffffffff ffffffff ffffffff ffffffff
ffff8e2301f32e40 2244573422 S Bi:2:011:2 -115 32 <
ffff8e2301f326c0 2244576484 C Bi:2:011:2 0 32 = ffffffff ffffffff ffffffff ffffffff ffffffff ffffffff ffffffff ffffffff
ffff8e2301f326c0 2244576490 S Bi:2:011:2 -115 32 <
ffff8e2303c4c540 2244577084 C Ii:2:008:1 0:1 7 = 0200ea0f 000000
ffff8e2303c4c540 2244577108 S Ii:2:008:1 -115:1 8 <
ffff8e2301f32e40 2244579552 C Bi:2:011:2 0 32 = ffffffff ffffffff ffffffff ffffffff ffffffff ffffffff ffffffff ffffffff
ffff8e2301f32e40 2244579558 S Bi:2:011:2 -115 32 <
ffff8e2301f326c0 2244582005 C Bi:2:011:2 0 4 = ffffffff
ffff8e2301f326c0 2244582017 S Bi:2:011:2 -115 32 <
ffff8e2301f32240 2244582312 S Bo:2:011:2 -115 4 = 524d8080
ffff8e2301f32240 2244582353 C Bo:2:011:2 0 4 >
ffff8e2303c4c540 2244585058 C Ii:2:008:1 0:1 7 = 0200eb0f 000000
ffff8e2303c4c540 2244585079 S Ii:2:008:1 -115:1 8 <
ffff8e2301f32e40 2244586044 C Bi:2:011:2 0 32 = 524d8080 ffffffff ffffffff ffffffff ffffffff ffffffff ffffffff ffffffff
ffff8e2301f32e40 2244586052 S Bi:2:011:2 -115 32 <
ffff8e2301f326c0 2244589116 C Bi:2:011:2 0 32 = ffffffff ffffffff ffffffff ffffffff ffffffff ffffffff ffffffff ffffffff
ffff8e2301f326c0 2244589123 S Bi:2:011:2 -115 32 <
ffff8e2301f32e40 2244592185 C Bi:2:011:2 0 32 = ffffffff ffffffff ffffffff ffffffff ffffffff ffffffff ffffffff ffffffff
ffff8e2301f32e40 2244592191 S Bi:2:011:2 -115 32 <
ffff8e2303c4c540 2244593054 C Ii:2:008:1 0:1 7 = 0200ed0f 000000
ffff8e2303c4c540 2244593072 S Ii:2:008:1 -115:1 8 <
ffff8e2301f326c0 2244595282 C Bi:2:011:2 0 32 = ffffffff ffffffff ffffffff ffffffff ffffffff ffffffff ffffffff ffffffff
ffff8e2301f326c0 2244595299 S Bi:2:011:2 -115 32 <
ffff8e2301f32e40 2244597664 C Bi:2:011:2 0 4 = ffffffff
ffff8e2301f32e40 2244597679 S Bi:2:011:2 -115 32 <
ffff8e2301f32240 2244597935 S Bo:2:011:2 -115 4 = 524e0080
ffff8e2301f32240 2244597977 C Bo:2:011:2 0 4 >
ffff8e2303c4c540 2244601085 C Ii:2:008:1 0:1 7 = 0200ef0f 000000
ffff8e2303c4c540 2244601107 S Ii:2:008:1 -115:1 8 <
ffff8e2301f326c0 2244601697 C Bi:2:011:2 0 32 = 524e0080 ffffffff ffffffff ffffffff ffffffff ffffffff ffffffff ffffffff
ffff8e2301f326c0 2244601702 S Bi:2:011:2 -115 32 <
ffff8e2301f32e40 2244605147 C Bi:2:011:2 0 32 = ffffffff ffffffff ffffffff ffffffff ffffffff ffffffff ffffffff ffffffff
ffff8e2301f32e40 2244605153 S Bi:2:011:2 -115 32 <
ffff8e2301f326c0 2244607853 C Bi:2:011:2 0 32 = ffffffff ffffffff ffffffff ffffffff ffffffff ffffffff ffffffff ffffffff
ffff8e2301f326c0 2244607859 S Bi:2:011:2 -115 32 <
ffff8e2303c4c540 2244609085 C Ii:2:008:1 0:1 7 = 0200ef0f 000000
ffff8e2303c4c540 2244609106 S Ii:2:008:1 -115:1 8 <
ffff8e2301f32e40 2244610895 C Bi:2:011:2 0 32 = ffffffff ffffffff ffffffff ffffffff ffffffff ffffffff ffffffff ffffffff
ffff8e2301f32e40 2244610901 S Bi:2:011:2 -115 32 <
ffff8e2301f326c0 2244613137 C Bi:2:011:2 0 4 = ffffffff
ffff8e2301f326c0 2244613142 S Bi:2:011:2 -115 32 <
ffff8e2301f32240 2244613480 S Bo:2:011:2 -115 4 = 524e8080
ffff8e2301f32240 2244613518 C Bo:2:011:2 0 4 >
ffff8e2303c4c540 2244617060 C Ii:2:008:1 0:1 7 = 0200f30f 000000
ffff8e2303c4c540 2244617082 S Ii:2:008:1 -115:1 8 <
ffff8e2301f32e40 2244617229 C Bi:2:011:2 0 32 = 524e8080 ffffffff ffffffff ffffffff ffffffff ffffffff ffffffff ffffffff
ffff8e2301f32e40 2244617234 S Bi:2:011:2 -115 32 <
ffff8e2301f326c0 2244620276 C Bi:2:011:2 0 32 = ffffffff ffffffff ffffffff ffffffff ffffffff ffffffff ffffffff ffffffff
ffff8e2301f326c0 2244620288 S Bi:2:011:2 -115 32 <
ffff8e2301f32e40 2244623356 C Bi:2:011:2 0 32 = ffffffff ffffffff ffffffff ffffffff ffffffff ffffffff ffffffff ffffffff
ffff8e2301f32e40 2244623365 S Bi:2:011:2 -115 32 <
ffff8e2303c4c540 2244625058 C Ii:2:008:1 0:1 7 = 0200f40f 000000
ffff8e2303c4c540 2244625073 S Ii:2:008:1 -115:1 8 <
ffff8e2301f326c0 2244626439 C Bi:2:011:2 0 32 = ffffffff ffffffff ffffffff ffffffff ffffffff ffffffff ffffffff ffffffff
ffff8e2301f326c0 2244626445 S Bi:2:011:2 -115 32 <
ffff8e2301f32e40 2244628799 C Bi:2:011:2 0 4 = ffffffff
ffff8e2301f32e40 2244628806 S Bi:2:011:2 -115 32 <
ffff8e2301f32240 2244629129 S Bo:2:011:2 -115 4 = 524f0080
ffff8e2301f32240 2244629172 C Bo:2:011:2 0 4 >
ffff8e2301f326c0 2244632909 C Bi:2:011:2 0 32 = 524f0080 ffffffff ffffffff ffffffff ffffffff ffffffff ffffffff ffffffff
ffff8e2301f326c0 2244632915 S Bi:2:011:2 -115 32 <
ffff8e2303c4c540 2244633053 C Ii:2:008:1 0:1 7 = 0200f50f 000000
ffff8e2303c4c540 2244633067 S Ii:2:008:1 -115:1 8 <
ffff8e2301f32e40 2244636049 C Bi:2:011:2 0 32 = ffffffff ffffffff ffffffff ffffffff ffffffff ffffffff ffffffff ffffffff
ffff8e2301f32e40 2244636057 S Bi:2:011:2 -115 32 <
ffff8e2301f326c0 2244639028 C Bi:2:011:2 0 32 = ffffffff ffffffff ffffffff ffffffff ffffffff ffffffff ffffffff ffffffff
ffff8e2301f326c0 2244639034 S Bi:2:011:2 -115 32 <
ffff8e2303c4c540 2244641057 C Ii:2:008:1 0:1 7 = 0200f60f 000000
ffff8e2303c4c540 2244641072 S Ii:2:008:1 -115:1 8 <
ffff8e2301f32e40 2244642118 C Bi:2:011:2 0 32 = ffffffff ffffffff ffffffff ffffffff ffffffff ffffffff ffffffff ffffffff
ffff8e2301f32e40 2244642125 S Bi:2:011:2 -115 32 <
ffff8e2301f326c0 2244644373 C Bi:2:011:2 0 4 = ffffffff
ffff8e2301f326c0 2244644381 S Bi:2:011:2 -115 32 <
ffff8e2301f32240 2244644689 S Bo:2:011:2 -115 4 = 524f8080
ffff8e2301f32240 2244644759 C Bo:2:011:2 0 4 >
ffff8e2301f32e40 2244648484 C Bi:2:011:2 0 32 = 524f8080 ffffffff ffffffff ffffffff ffffffff ffffffff ffffffff ffffffff
ffff8e2301f32e40 2244648490 S Bi:2:011:2 -115 32 <
ffff8e2303c4c540 2244649062 C Ii:2:008:1 0:1 7 = 0200f40f 000000
ffff8e2303c4c540 2244649095 S Ii:2:008:1 -115:1 8 <
ffff8e2301f326c0 2244651553 C Bi:2:011:2 0 32 = ffffffff ffffffff ffffffff ffffffff ffffffff ffffffff ffffffff ffffffff
ffff8e2301f326c0 2244651564 S Bi:2:011:2 -115 32 <
ffff8e2301f32e40 2244654578 C Bi:2:011:2 0 32 = ffffffff ffffffff ffffffff ffffffff ffffffff ffffffff ffffffff ffffffff
ffff8e2301f32e40 2244654588 S Bi:2:011:2 -115 32 <
ffff8e2303c4c540 2244657057 C Ii:2:008:1 0:1 7 = 0200f20f 000000
ffff8e2303c4c540 2244657074 S Ii:2:008:1 -115:1 8 <
ffff8e2301f326c0 2244657638 C Bi:2:011:2 0 32 = ffffffff ffffffff ffffffff ffffffff ffffffff ffffffff ffffffff ffffffff
ffff8e2301f326c0 2244657645 S Bi:2:011:2 -115 32 <
ffff8e2301f32e40 2244660050 C Bi:2:011:2 0 4 = ffffffff
ffff8e2301f32e40 2244660056 S Bi:2:011:2 -115 32 <
ffff8e2301f32240 2244660331 S Bo:2:011:2 -115 4 = 52500080
ffff8e2301f32240 2244660369 C Bo:2:011:2 0 4 >
ffff8e2301f326c0 2244664118 C Bi:2:011:2 0 32 = 52500080 ffffffff ffffffff ffffffff ffffffff ffffffff ffffffff ffffffff
ffff8e2301f326c0 2244664125 S Bi:2:011:2 -115 32 <
ffff8e2303c4c540 2244665058 C Ii:2:008:1 0:1 7 = 0200f20f 000000
ffff8e2303c4c540 2244665079 S Ii:2:008:1 -115:1 8 <
ffff8e2301f32e40 2244667185 C Bi:2:011:2 0 32 = ffffffff ffffffff ffffffff ffffffff ffffffff ffffffff ffffffff ffffffff
ffff8e2301f32e40 2244667191 S Bi:2:011:2 -115 32 <
ffff8e2301f326c0 2244670257 C Bi:2:011:2 0 32 = ffffffff ffffffff ffffffff ffffffff ffffffff ffffffff ffffffff ffffffff
ffff8e2301f326c0 2244670262 S Bi:2:011:2 -115 32 <
ffff8e2303c4c540 2244673085 C Ii:2:008:1 0:1 7 = 0200f00f 000000
ffff8e2303c4c540 2244673109 S Ii:2:008:1 -115:1 8 <
ffff8e2301f32e40 2244673276 C Bi:2:011:2 0 32 = ffffffff ffffffff ffffffff ffffffff ffffffff ffffffff ffffffff ffffffff
ffff8e2301f32e40 2244673281 S Bi:2:011:2 -115 32 <
ffff8e2301f326c0 2244675513 C Bi:2:011:2 0 4 = ffffffff
ffff8e2301f326c0 2244675519 S Bi:2:011:2 -115 32 <
ffff8e2301f32240 2244675848 S Bo:2:011:2 -115 4 = 52508080
ffff8e2301f32240 2244676006 C Bo:2:011:2 0 4 >
ffff8e2301f32e40 2244679658 C Bi:2:011:2 0 32 = 52508080 ffffffff ffffffff ffffffff ffffffff ffffffff ffffffff ffffffff
ffff8e2301f32e40 2244679664 S Bi:2:011:2 -115 32 <
ffff8e2303c4c540 2244681056 C Ii:2:008:1 0:1 7 = 0200f00f 000000
ffff8e2303c4c540 2244681078 S Ii:2:008:1 -115:1 8 <
ffff8e2301f326c0 2244682732 C Bi:2:011:2 0 32 = ffffffff ffffffff ffffffff ffffffff ffffffff ffffffff ffffffff ffffffff
ffff8e2301f326c0 2244682737 S Bi:2:011:2 -115 32 <
ffff8e2301f32e40 2244685848 C Bi:2:011:2 0 32 = ffffffff ffffffff ffffffff ffffffff ffffffff ffffffff ffffffff ffffffff
ffff8e2301f32e40 2244685859 S Bi:2:011:2 -115 32 <
ffff8e2301f326c0 2244688892 C Bi:2:011:2 0 32 = ffffffff ffffffff ffffffff ffffffff ffffffff ffffffff ffffffff ffffffff
ffff8e2301f326c0 2244688903 S Bi:2:011:2 -115 32 <
ffff8e2303c4c540 2244689054 C Ii:2:008:1 0:1 7 = 0200f20f 000000
ffff8e2303c4c540 2244689071 S Ii:2:008:1 -115:1 8 <
ffff8e2301f32e40 2244691233 C Bi:2:011:2 0 4 = ffffffff
ffff8e2301f32e40 2244691239 S Bi:2:011:2 -115 32 <
ffff8e2301f32240 2244691550 S Bo:2:011:2 -115 4 = 52510080
ffff8e2301f32240 2244691618 C Bo:2:011:2 0 4 >
ffff8e2301f326c0 2244695328 C Bi:2:011:2 0 32 = 52510080 ffffffff ffffffff ffffffff ffffffff ffffffff ffffffff ffffffff
ffff8e2301f326c0 2244695334 S Bi:2:011:2 -115 32 <
ffff8e2303c4c540 2244697085 C Ii:2:008:1 0:1 7 = 0200f3ef ff0000
ffff8e2303c4c540 2244697106 S Ii:2:008:1 -115:1 8 <
ffff8e2301f32e40 2244698395 C Bi:2:011:2 0 32 = ffffffff ffffffff ffffffff ffffffff ffffffff ffffffff ffffffff ffffffff
ffff8e2301f32e40 2244698401 S Bi:2:011:2 -115 32 <
ffff8e2301f326c0 2244701465 C Bi:2:011:2 0 32 = ffffffff ffffffff ffffffff ffffffff ffffffff ffffffff ffffffff ffffffff
ffff8e2301f326c0 2244701471 S Bi:2:011:2 -115 32 <
ffff8e2301f32e40 2244704532 C Bi:2:011:2 0 32 = ffffffff ffffffff ffffffff ffffffff ffffffff ffffffff ffffffff ffffffff
ffff8e2301f32e40 2244704538 S Bi:2:011:2 -115 32 <
ffff8e2303c4c540 2244705087 C Ii:2:008:1 0:1 7 = 0200f3ef ff0000
ffff8e2303c4c540 2244705111 S Ii:2:008:1 -115:1 8 <
ffff8e2301f326c0 2244706915 C Bi:2:011:2 0 4 = ffffffff
ffff8e2301f326c0 2244706921 S Bi:2:011:2 -115 32 <
ffff8e2301f32240 2244707232 S Bo:2:011:2 -115 4 = 52518080
ffff8e2301f32240 2244707301 C Bo:2:011:2 0 4 >
ffff8e2301f32e40 2244711028 C Bi:2:011:2 0 32 = 52518080 ffffffff ffffffff ffffffff ffffffff ffffffff ffffffff ffffffff
ffff8e2301f32e40 2244711035 S Bi:2:011:2 -115 32 <
ffff8e2303c4c540 2244713084 C Ii:2:008:1 0:1 7 = 0200f3df ff0000
ffff8e2303c4c540 2244713108 S Ii:2:008:1 -115:1 8 <
ffff8e2301f326c0 2244714052 C Bi:2:011:2 0 32 = ffffffff ffffffff ffffffff ffffffff ffffffff ffffffff ffffffff ffffffff
ffff8e2301f326c0 2244714057 S Bi:2:011:2 -115 32 <
ffff8e2301f32e40 2244717116 C Bi:2:011:2 0 32 = ffffffff ffffffff ffffffff ffffffff ffffffff ffffffff ffffffff ffffffff
ffff8e2301f32e40 2244717122 S Bi:2:011:2 -115 32 <
ffff8e2301f326c0 2244720178 C Bi:2:011:2 0 32 = ffffffff ffffffff ffffffff ffffffff ffffffff ffffffff ffffffff ffffffff
ffff8e2301f326c0 2244720184 S Bi:2:011:2 -115 32 <
ffff8e2303c4c540 2244721088 C Ii:2:008:1 0:1 7 = 0200f6ef ff0000
ffff8e2303c4c540 2244721112 S Ii:2:008:1 -115:1 8 <
ffff8e2301f32e40 2244722596 C Bi:2:011:2 0 4 = ffffffff
ffff8e2301f32e40 2244722602 S Bi:2:011:2 -115 32 <
ffff8e2301f32240 2244722956 S Bo:2:011:2 -115 4 = 52520080
ffff8e2301f32240 2244723026 C Bo:2:011:2 0 4 >
ffff8e2301f326c0 2244726714 C Bi:2:011:2 0 32 = 52520080 ffffffff ffffffff ffffffff ffffffff ffffffff ffffffff ffffffff
ffff8e2301f326c0 2244726721 S Bi:2:011:2 -115 32 <
ffff8e2303c4c540 2244729087 C Ii:2:008:1 0:1 7 = 0200f6df ff0000
ffff8e2303c4c540 2244729109 S Ii:2:008:1 -115:1 8 <
ffff8e2301f32e40 2244729778 C Bi:2:011:2 0 32 = ffffffff ffffffff ffffffff ffffffff ffffffff ffffffff ffffffff ffffffff
ffff8e2301f32e40 2244729783 S Bi:2:011:2 -115 32 <
ffff8e2301f326c0 2244732824 C Bi:2:011:2 0 32 = ffffffff ffffffff ffffffff ffffffff ffffffff ffffffff ffffffff ffffffff
ffff8e2301f326c0 2244732835 S Bi:2:011:2 -115 32 <
ffff8e2301f32e40 2244736072 C Bi:2:011:2 0 32 = ffffffff ffffffff ffffffff ffffffff ffffffff ffffffff ffffffff ffffffff
ffff8e2301f32e40 2244736078 S Bi:2:011:2 -115 32 <
ffff8e2303c4c540 2244737058 C Ii:2:008:1 0:1 7 = 0200f9ff ff0000
ffff8e2303c4c540 2244737079 S Ii:2:008:1 -115:1 8 <
ffff8e2301f326c0 2244738282 C Bi:2:011:2 0 4 = ffffffff
ffff8e2301f326c0 2244738288 S Bi:2:011:2 -115 32 <
ffff8e2301f32240 2244738557 S Bo:2:011:2 -115 4 = 52528080
ffff8e2301f32240 2244738626 C Bo:2:011:2 0 4 >
ffff8e2301f32e40 2244742324 C Bi:2:011:2 0 32 = 52528080 ffffffff ffffffff ffffffff ffffffff ffffffff ffffffff ffffffff
ffff8e2301f32e40 2244742329 S Bi:2:011:2 -115 32 <
ffff8e2303c4c540 2244745058 C Ii:2:008:1 0:1 7 = 0200fadf ff0000
ffff8e2303c4c540 2244745077 S Ii:2:008:1 -115:1 8 <
ffff8e2301f326c0 2244745365 C Bi:2:011:2 0 32 = ffffffff ffffffff ffffffff ffffffff ffffffff ffffffff ffffffff ffffffff
ffff8e2301f326c0 2244745371 S Bi:2:011:2 -115 32 <
ffff8e2301f32e40 2244748484 C Bi:2:011:2 0 32 = ffffffff ffffffff ffffffff ffffffff ffffffff ffffffff ffffffff ffffffff
ffff8e2301f32e40 2244748490 S Bi:2:011:2 -115 32 <
ffff8e2301f326c0 2244751552 C Bi:2:011:2 0 32 = ffffffff ffffffff ffffffff ffffffff ffffffff ffffffff ffffffff ffffffff
ffff8e2301f326c0 2244751558 S Bi:2:011:2 -115 32 <
ffff8e2303c4c540 2244753062 C Ii:2:008:1 0:1 7 = 0200f9cf ff0000
ffff8e2303c4c540 2244753087 S Ii:2:008:1 -115:1 8 <
ffff8e2301f32e40 2244753760 C Bi:2:011:2 0 4 = ffffffff
ffff8e2301f32e40 2244753765 S Bi:2:011:2 -115 32 <
ffff8e2301f32240 2244754036 S Bo:2:011:2 -115 4 = 52530080
ffff8e2301f32240 2244754080 C Bo:2:011:2 0 4 >
ffff8e2301f326c0 2244757804 C Bi:2:011:2 0 32 = 52530080 ffffffff ffffffff ffffffff ffffffff ffffffff ffffffff ffffffff
ffff8e2301f326c0 2244757810 S Bi:2:011:2 -115 32 <
ffff8e2301f32e40 2244760894 C Bi:2:011:2 0 32 = ffffffff ffffffff ffffffff ffffffff ffffffff ffffffff ffffffff ffffffff
ffff8e2301f32e40 2244760900 S Bi:2:011:2 -115 32 <
ffff8e2303c4c540 2244761054 C Ii:2:008:1 0:1 7 = 0200f6cf ff0000
ffff8e2303c4c540 2244761075 S Ii:2:008:1 -115:1 8 <
ffff8e2301f326c0 2244764030 C Bi:2:011:2 0 32 = ffffffff ffffffff ffffffff ffffffff ffffffff ffffffff ffffffff ffffffff
ffff8e2301f326c0 2244764036 S Bi:2:011:2 -115 32 <
ffff8e2301f32e40 2244767030 C Bi:2:011:2 0 32 = ffffffff ffffffff ffffffff ffffffff ffffffff ffffffff ffffffff ffffffff
ffff8e2301f32e40 2244767038 S Bi:2:011:2 -115 32 <
ffff8e2303c4c540 2244769085 C Ii:2:008:1 0:1 7 = 0200f4af ff0000
ffff8e2303c4c540 2244769108 S Ii:2:008:1 -115:1 8 <
ffff8e2301f326c0 2244769299 C Bi:2:011:2 0 4 = ffffffff
ffff8e2301f326c0 2244769303 S Bi:2:011:2 -115 32 <
ffff8e2301f32240 2244769636 S Bo:2:011:2 -115 4 = 52538080
ffff8e2301f32240 2244769683 C Bo:2:011:2 0 4 >
ffff8e2301f32e40 2244773418 C Bi:2:011:2 0 32 = 52538080 ffffffff ffffffff ffffffff ffffffff ffffffff ffffffff ffffffff
ffff8e2301f32e40 2244773424 S Bi:2:011:2 -115 32 <
ffff8e2301f326c0 2244776485 C Bi:2:011:2 0 32 = ffffffff ffffffff ffffffff ffffffff ffffffff ffffffff ffffffff ffffffff
ffff8e2301f326c0 2244776491 S Bi:2:011:2 -115 32 <
ffff8e2303c4c540 2244777086 C Ii:2:008:1 0:1 7 = 0200f5cf ff0000
ffff8e2303c4c540 2244777107 S Ii:2:008:1 -115:1 8 <
ffff8e2301f32e40 2244779552 C Bi:2:011:2 0 32 = ffffffff ffffffff ffffffff ffffffff ffffffff ffffffff ffffffff ffffffff
ffff8e2301f32e40 2244779558 S Bi:2:011:2 -115 32 <
ffff8e2301f326c0 2244782620 C Bi:2:011:2 0 32 = ffffffff ffffffff ffffffff ffffffff ffffffff ffffffff ffffffff ffffffff
ffff8e2301f326c0 2244782626 S Bi:2:011:2 -115 32 <
ffff8e2301f32e40 2244785005 C Bi:2:011:2 0 4 = ffffffff
ffff8e2301f32e40 2244785011 S Bi:2:011:2 -115 32 <
ffff8e2303c4c540 2244785054 C Ii:2:008:1 0:1 7 = 0200f7cf ff0000
ffff8e2303c4c540 2244785075 S Ii:2:008:1 -115:1 8 <
ffff8e2301f32240 2244785298 S Bo:2:011:2 -115 4 = 52540080
ffff8e2301f32240 2244785340 C Bo:2:011:2 0 4 >
ffff8e2301f326c0 2244789053 C Bi:2:011:2 0 32 = 52540080 ffffffff ffffffff ffffffff ffffffff ffffffff ffffffff ffffffff
ffff8e2301f326c0 2244789060 S Bi:2:011:2 -115 32 <
ffff8e2301f32e40 2244792090 C Bi:2:011:2 0 32 = ffffffff ffffffff ffffffff ffffffff ffffffff ffffffff ffffffff ffffffff
ffff8e2301f32e40 2244792097 S Bi:2:011:2 -115 32 <
ffff8e2303c4c540 2244793060 C Ii:2:008:1 0:1 7 = 0200faef ff0000
ffff8e2303c4c540 2244793080 S Ii:2:008:1 -115:1 8 <
ffff8e2301f326c0 2244795187 C Bi:2:011:2 0 32 = ffffffff ffffffff ffffffff ffffffff ffffffff ffffffff ffffffff ffffffff
ffff8e2301f326c0 2244795193 S Bi:2:011:2 -115 32 <
ffff8e2301f32e40 2244798257 C Bi:2:011:2 0 32 = ffffffff ffffffff ffffffff ffffffff ffffffff ffffffff ffffffff ffffffff
ffff8e2301f32e40 2244798265 S Bi:2:011:2 -115 32 <
ffff8e2301f326c0 2244800497 C Bi:2:011:2 0 4 = ffffffff
ffff8e2301f326c0 2244800506 S Bi:2:011:2 -115 32 <
ffff8e2301f32240 2244800859 S Bo:2:011:2 -115 4 = 52548080
ffff8e2301f32240 2244800966 C Bo:2:011:2 0 4 >
ffff8e2303c4c540 2244801054 C Ii:2:008:1 0:1 7 = 0200fcef ff0000
ffff8e2303c4c540 2244801070 S Ii:2:008:1 -115:1 8 <
ffff8e2301f32e40 2244804714 C Bi:2:011:2 0 32 = 52548080 ffffffff ffffffff ffffffff ffffffff ffffffff ffffffff ffffffff
ffff8e2301f32e40 2244804720 S Bi:2:011:2 -115 32 <
ffff8e2301f326c0 2244807738 C Bi:2:011:2 0 32 = ffffffff ffffffff ffffffff ffffffff ffffffff ffffffff ffffffff ffffffff
ffff8e2301f326c0 2244807743 S Bi:2:011:2 -115 32 <
ffff8e2303c4c540 2244809057 C Ii:2:008:1 0:1 7 = 0200fcff ff0000
ffff8e2303c4c540 2244809074 S Ii:2:008:1 -115:1 8 <
ffff8e2301f32e40 2244810821 C Bi:2:011:2 0 32 = ffffffff ffffffff ffffffff ffffffff ffffffff ffffffff ffffffff ffffffff
ffff8e2301f32e40 2244810826 S Bi:2:011:2 -115 32 <
ffff8e2301f326c0 2244813896 C Bi:2:011:2 0 32 = ffffffff ffffffff ffffffff ffffffff ffffffff ffffffff ffffffff ffffffff
ffff8e2301f326c0 2244813902 S Bi:2:011:2 -115 32 <
ffff8e2301f32e40 2244816162 C Bi:2:011:2 0 4 = ffffffff
ffff8e2301f32e40 2244816168 S Bi:2:011:2 -115 32 <
ffff8e2301f32240 2244816480 S Bo:2:011:2 -115 4 = 52550080
ffff8e2301f32240 2244816524 C Bo:2:011:2 0 4 >
ffff8e2303c4c540 2244817062 C Ii:2:008:1 0:1 7 = 0200fdef ff0000
ffff8e2303c4c540 2244817086 S Ii:2:008:1 -115:1 8 <
ffff8e2301f326c0 2244820232 C Bi:2:011:2 0 32 = 52550080 ffffffff ffffffff ffffffff ffffffff ffffffff ffffffff ffffffff
ffff8e2301f326c0 2244820238 S Bi:2:011:2 -115 32 <
ffff8e2301f32e40 2244823303 C Bi:2:011:2 0 32 = ffffffff ffffffff ffffffff ffffffff ffffffff ffffffff ffffffff ffffffff
ffff8e2301f32e40 2244823309 S Bi:2:011:2 -115 32 <
ffff8e2303c4c540 2244825063 C Ii:2:008:1 0:1 7 = 0200fdff ff0000
ffff8e2303c4c540 2244825091 S Ii:2:008:1 -115:1 8 <
ffff8e2301f326c0 2244826371 C Bi:2:011:2 0 32 = ffffffff ffffffff ffffffff ffffffff ffffffff ffffffff ffffffff ffffffff
ffff8e2301f326c0 2244826376 S Bi:2:011:2 -115 32 <
ffff8e2301f32e40 2244829436 C Bi:2:011:2 0 32 = ffffffff ffffffff ffffffff ffffffff ffffffff ffffffff ffffffff ffffffff
ffff8e2301f32e40 2244829442 S Bi:2:011:2 -115 32 <
ffff8e2301f326c0 2244831687 C Bi:2:011:2 0 4 = ffffffff
ffff8e2301f326c0 2244831694 S Bi:2:011:2 -115 32 <
ffff8e2301f32240 2244831954 S Bo:2:011:2 -115 4 = 52558080
ffff8e2301f32240 2244832020 C Bo:2:011:2 0 4 >
ffff8e2303c4c540 2244833064 C Ii:2:008:1 0:1 7 = 0200feef ff0000
ffff8e2303c4c540 2244833100 S Ii:2:008:1 -115:1 8 <
ffff8e2301f32e40 2244835749 C Bi:2:011:2 0 32 = 52558080 ffffffff ffffffff ffffffff ffffffff ffffffff ffffffff ffffffff
ffff8e2301f32e40 2244835755 S Bi:2:011:2 -115 32 <
ffff8e2301f326c0 2244838783 C Bi:2:011:2 0 32 = ffffffff ffffffff ffffffff ffffffff ffffffff ffffffff ffffffff ffffffff
ffff8e2301f326c0 2244838792 S Bi:2:011:2 -115 32 <
ffff8e2303c4c540 2244841058 C Ii:2:008:1 0:1 7 = 0200feff ff0000
ffff8e2303c4c540 2244841076 S Ii:2:008:1 -115:1 8 <
ffff8e2301f32e40 2244841868 C Bi:2:011:2 0 32 = ffffffff ffffffff ffffffff ffffffff ffffffff ffffffff ffffffff ffffffff
ffff8e2301f32e40 2244841874 S Bi:2:011:2 -115 32 <
ffff8e2301f326c0 2244844913 C Bi:2:011:2 0 32 = ffffffff ffffffff ffffffff ffffffff ffffffff ffffffff ffffffff ffffffff
ffff8e2301f326c0 2244844919 S Bi:2:011:2 -115 32 <
ffff8e2301f32e40 2244847238 C Bi:2:011:2 0 4 = ffffffff
ffff8e2301f32e40 2244847245 S Bi:2:011:2 -115 32 <
ffff8e2301f32240 2244847564 S Bo:2:011:2 -115 4 = 52560080
ffff8e2301f32240 2244847634 C Bo:2:011:2 0 4 >
ffff8e2303c4c540 2244849061 C Ii:2:008:1 0:1 7 = 020000f0 ff0000
ffff8e2303c4c540 2244849083 S Ii:2:008:1 -115:1 8 <
ffff8e2301f326c0 2244851331 C Bi:2:011:2 0 32 = 52560080 ffffffff ffffffff ffffffff ffffffff ffffffff ffffffff ffffffff
ffff8e2301f326c0 2244851337 S Bi:2:011:2 -115 32 <
ffff8e2301f32e40 2244854370 C Bi:2:011:2 0 32 = ffffffff ffffffff ffffffff ffffffff ffffffff ffffffff ffffffff ffffffff
ffff8e2301f32e40 2244854377 S Bi:2:011:2 -115 32 <
ffff8e2303c4c540 2244857060 C Ii:2:008:1 0:1 7 = 0200ffff ff0000
ffff8e2303c4c540 2244857081 S Ii:2:008:1 -115:1 8 <
ffff8e2301f326c0 2244857458 C Bi:2:011:2 0 32 = ffffffff ffffffff ffffffff ffffffff ffffffff ffffffff ffffffff ffffffff
ffff8e2301f326c0 2244857465 S Bi:2:011:2 -115 32 <
ffff8e2301f32e40 2244860508 C Bi:2:011:2 0 32 = ffffffff ffffffff ffffffff ffffffff ffffffff ffffffff ffffffff ffffffff
ffff8e2301f32e40 2244860514 S Bi:2:011:2 -115 32 <
ffff8e2301f326c0 2244862982 C Bi:2:011:2 0 4 = ffffffff
ffff8e2301f326c0 2244862988 S Bi:2:011:2 -115 32 <
ffff8e2301f32240 2244863319 S Bo:2:011:2 -115 4 = 52568080
ffff8e2301f32240 2244863388 C Bo:2:011:2 0 4 >
ffff8e2301f32e40 2244867071 C Bi:2:011:2 0 32 = 52568080 ffffffff ffffffff ffffffff ffffffff ffffffff ffffffff ffffffff
ffff8e2301f32e40 2244867077 S Bi:2:011:2 -115 32 <
ffff8e2301f326c0 2244870164 C Bi:2:011:2 0 32 = ffffffff ffffffff ffffffff ffffffff ffffffff ffffffff ffffffff ffffffff
ffff8e2301f326c0 2244870170 S Bi:2:011:2 -115 32 <
ffff8e2301f32e40 2244873235 C Bi:2:011:2 0 32 = ffffffff ffffffff ffffffff ffffffff ffffffff ffffffff ffffffff ffffffff
ffff8e2301f32e40 2244873241 S Bi:2:011:2 -115 32 <
ffff8e2301f326c0 2244876302 C Bi:2:011:2 0 32 = ffffffff ffffffff ffffffff ffffffff ffffffff ffffffff ffffffff ffffffff
ffff8e2301f326c0 2244876308 S Bi:2:011:2 -115 32 <
ffff8e2301f32e40 2244878597 C Bi:2:011:2 0 4 = ffffffff
ffff8e2301f32e40 2244878603 S Bi:2:011:2 -115 32 <
ffff8e2301f32240 2244878921 S Bo:2:011:2 -115 4 = 52570080
ffff8e2301f32240 2244879011 C Bo:2:011:2 0 4 >
ffff8e2303c4c540 2244881063 C Ii:2:008:1 0:1 7 = 0200ff0f 000000
ffff8e2303c4c540 2244881087 S Ii:2:008:1 -115:1 8 <
ffff8e2301f326c0 2244882687 C Bi:2:011:2 0 32 = 52570080 ffffffff ffffffff ffffffff ffffffff ffffffff ffffffff ffffffff
ffff8e2301f326c0 2244882692 S Bi:2:011:2 -115 32 <
ffff8e2301f32e40 2244885734 C Bi:2:011:2 0 32 = ffffffff ffffffff ffffffff ffffffff ffffffff ffffffff ffffffff ffffffff
ffff8e2301f32e40 2244885739 S Bi:2:011:2 -115 32 <
ffff8e2301f326c0 2244888849 C Bi:2:011:2 0 32 = ffffffff ffffffff ffffffff ffffffff ffffffff ffffffff ffffffff ffffffff
ffff8e2301f326c0 2244888855 S Bi:2:011:2 -115 32 <
ffff8e2303c4c540 2244889056 C Ii:2:008:1 0:1 7 = 0200ff0f 000000
ffff8e2303c4c540 2244889074 S Ii:2:008:1 -115:1 8 <
ffff8e2301f32e40 2244891895 C Bi:2:011:2 0 32 = ffffffff ffffffff ffffffff ffffffff ffffffff ffffffff ffffffff ffffffff
ffff8e2301f32e40 2244891901 S Bi:2:011:2 -115 32 <
ffff8e2301f326c0 2244894256 C Bi:2:011:2 0 4 = ffffffff
ffff8e2301f326c0 2244894262 S Bi:2:011:2 -115 32 <
ffff8e2301f32240 2244894663 S Bo:2:011:2 -115 4 = 52578080
ffff8e2301f32240 2244894735 C Bo:2:011:2 0 4 >
ffff8e2303c4c540 2244897085 C Ii:2:008:1 0:1 7 = 0200feff ff0000
ffff8e2303c4c540 2244897109 S Ii:2:008:1 -115:1 8 <
ffff8e2301f32e40 2244898438 C Bi:2:011:2 0 32 = 52578080 ffffffff ffffffff ffffffff ffffffff ffffffff ffffffff ffffffff
ffff8e2301f32e40 2244898444 S Bi:2:011:2 -115 32 <
ffff8e2301f326c0 2244901519 C Bi:2:011:2 0 32 = ffffffff ffffffff ffffffff ffffffff ffffffff ffffffff ffffffff ffffffff
ffff8e2301f326c0 2244901525 S Bi:2:011:2 -115 32 <
ffff8e2301f32e40 2244904549 C Bi:2:011:2 0 32 = ffffffff ffffffff ffffffff ffffffff ffffffff ffffffff ffffffff ffffffff
ffff8e2301f32e40 2244904555 S Bi:2:011:2 -115 32 <
ffff8e2303c4c540 2244905057 C Ii:2:008:1 0:1 7 = 0200ffff ff0000
ffff8e2303c4c540 2244905075 S Ii:2:008:1 -115:1 8 <
ffff8e2301f326c0 2244907617 C Bi:2:011:2 0 32 = ffffffff ffffffff ffffffff ffffffff ffffffff ffffffff ffffffff ffffffff
ffff8e2301f326c0 2244907623 S Bi:2:011:2 -115 32 <
ffff8e2301f32e40 2244909981 C Bi:2:011:2 0 4 = ffffffff
ffff8e2301f32e40 2244909987 S Bi:2:011:2 -115 32 <
ffff8e2301f32240 2244910317 S Bo:2:011:2 -115 4 = 52580080
ffff8e2301f32240 2244910386 C Bo:2:011:2 0 4 >
ffff8e2303c4c540 2244913085 C Ii:2:008:1 0:1 7 = 0200fdff ff0000
ffff8e2303c4c540 2244913107 S Ii:2:008:1 -115:1 8 <
ffff8e2301f326c0 2244914073 C Bi:2:011:2 0 32 = 52580080 ffffffff ffffffff ffffffff ffffffff ffffffff ffffffff ffffffff
ffff8e2301f326c0 2244914079 S Bi:2:011:2 -115 32 <
ffff8e2301f32e40 2244917115 C Bi:2:011:2 0 32 = ffffffff ffffffff ffffffff ffffffff ffffffff ffffffff ffffffff ffffffff
ffff8e2301f32e40 2244917121 S Bi:2:011:2 -115 32 <
ffff8e2301f326c0 2244920188 C Bi:2:011:2 0 32 = ffffffff ffffffff ffffffff ffffffff ffffffff ffffffff ffffffff ffffffff
ffff8e2301f326c0 2244920194 S Bi:2:011:2 -115 32 <
ffff8e2303c4c540 2244921057 C Ii:2:008:1 0:1 7 = 0200ffff ff0000
ffff8e2303c4c540 2244921074 S Ii:2:008:1 -115:1 8 <
ffff8e2301f32e40 2244923257 C Bi:2:011:2 0 32 = ffffffff ffffffff ffffffff ffffffff ffffffff ffffffff ffffffff ffffffff
ffff8e2301f32e40 2244923263 S Bi:2:011:2 -115 32 <
ffff8e2301f326c0 2244925639 C Bi:2:011:2 0 4 = ffffffff
ffff8e2301f326c0 2244925645 S Bi:2:011:2 -115 32 <
ffff8e2301f32240 2244925953 S Bo:2:011:2 -115 4 = 52588080
ffff8e2301f32240 2244925991 C Bo:2:011:2 0 4 >
ffff8e2303c4c540 2244929086 C Ii:2:008:1 0:1 7 = 0200feef ff0000
ffff8e2303c4c540 2244929108 S Ii:2:008:1 -115:1 8 <
ffff8e2301f32e40 2244929701 C Bi:2:011:2 0 32 = 52588080 ffffffff ffffffff ffffffff ffffffff ffffffff ffffffff ffffffff
ffff8e2301f32e40 2244929708 S Bi:2:011:2 -115 32 <
ffff8e2301f326c0 2244932785 C Bi:2:011:2 0 32 = ffffffff ffffffff ffffffff ffffffff ffffffff ffffffff ffffffff ffffffff
ffff8e2301f326c0 2244932791 S Bi:2:011:2 -115 32 <
ffff8e2301f32e40 2244935824 C Bi:2:011:2 0 32 = ffffffff ffffffff ffffffff ffffffff ffffffff ffffffff ffffffff ffffffff
ffff8e2301f32e40 2244935830 S Bi:2:011:2 -115 32 <
ffff8e2303c4c540 2244937060 C Ii:2:008:1 0:1 7 = 0200ffdf ff0000
ffff8e2303c4c540 2244937078 S Ii:2:008:1 -115:1 8 <
ffff8e2301f326c0 2244939012 C Bi:2:011:2 0 32 = ffffffff ffffffff ffffffff ffffffff ffffffff ffffffff ffffffff ffffffff
ffff8e2301f326c0 2244939019 S Bi:2:011:2 -115 32 <
ffff8e2301f32e40 2244941138 C Bi:2:011:2 0 4 = ffffffff
ffff8e2301f32e40 2244941144 S Bi:2:011:2 -115 32 <
ffff8e2301f32240 2244941495 S Bo:2:011:2 -115 4 = 52590080
ffff8e2301f32240 2244941534 C Bo:2:011:2 0 4 >
ffff8e2303c4c540 2244945061 C Ii:2:008:1 0:1 7 = 020000f0 ff0000
ffff8e2303c4c540 2244945076 S Ii:2:008:1 -115:1 8 <
ffff8e2301f326c0 2244945228 C Bi:2:011:2 0 32 = 52590080 ffffffff ffffffff ffffffff ffffffff ffffffff ffffffff ffffffff
ffff8e2301f326c0 2244945233 S Bi:2:011:2 -115 32 <
ffff8e2301f32e40 2244948278 C Bi:2:011:2 0 32 = ffffffff ffffffff ffffffff ffffffff ffffffff ffffffff ffffffff ffffffff
ffff8e2301f32e40 2244948283 S Bi:2:011:2 -115 32 <
ffff8e2301f326c0 2244951345 C Bi:2:011:2 0 32 = ffffffff ffffffff ffffffff ffffffff ffffffff ffffffff ffffffff ffffffff
ffff8e2301f326c0 2244951350 S Bi:2:011:2 -115 32 <
ffff8e2303c4c540 2244953058 C Ii:2:008:1 0:1 7 = 0200ffbf ff0000
ffff8e2303c4c540 2244953072 S Ii:2:008:1 -115:1 8 <
ffff8e2301f32e40 2244954456 C Bi:2:011:2 0 32 = ffffffff ffffffff ffffffff ffffffff ffffffff ffffffff ffffffff ffffffff
ffff8e2301f32e40 2244954460 S Bi:2:011:2 -115 32 <
ffff8e2301f326c0 2244956840 C Bi:2:011:2 0 4 = ffffffff
ffff8e2301f326c0 2244956846 S Bi:2:011:2 -115 32 <
ffff8e2301f32240 2244957188 S Bo:2:011:2 -115 4 = 52598080
ffff8e2301f32240 2244957227 C Bo:2:011:2 0 4 >
ffff8e2301f32e40 2244961056 C Bi:2:011:2 0 32 = 52598080 ffffffff ffffffff ffffffff ffffffff ffffffff ffffffff ffffffff
ffff8e2301f32e40 2244961062 S Bi:2:011:2 -115 32 <
ffff8e2303c4c540 2244961077 C Ii:2:008:1 0:1 7 = 0200ffdf ff0000
ffff8e2303c4c540 2244961088 S Ii:2:008:1 -115:1 8 <
ffff8e2301f326c0 2244964032 C Bi:2:011:2 0 32 = ffffffff ffffffff ffffffff ffffffff ffffffff ffffffff ffffffff ffffffff
ffff8e2301f326c0 2244964039 S Bi:2:011:2 -115 32 <
ffff8e2301f32e40 2244967073 C Bi:2:011:2 0 32 = ffffffff ffffffff ffffffff ffffffff ffffffff ffffffff ffffffff ffffffff
ffff8e2301f32e40 2244967078 S Bi:2:011:2 -115 32 <
ffff8e2303c4c540 2244969063 C Ii:2:008:1 0:1 7 = 020000d0 ff0000
ffff8e2303c4c540 2244969081 S Ii:2:008:1 -115:1 8 <
ffff8e2301f326c0 2244970139 C Bi:2:011:2 0 32 = ffffffff ffffffff ffffffff ffffffff ffffffff ffffffff ffffffff ffffffff
ffff8e2301f326c0 2244970145 S Bi:2:011:2 -115 32 <
ffff8e2301f32e40 2244972554 C Bi:2:011:2 0 4 = ffffffff
ffff8e2301f32e40 2244972560 S Bi:2:011:2 -115 32 <
ffff8e2301f32240 2244972887 S Bo:2:011:2 -115 4 = 525a0080
ffff8e2301f32240 2244972975 C Bo:2:011:2 0 4 >
ffff8e2301f326c0 2244976677 C Bi:2:011:2 0 32 = 525a0080 ffffffff ffffffff ffffffff ffffffff ffffffff ffffffff ffffffff
ffff8e2301f326c0 2244976683 S Bi:2:011:2 -115 32 <
ffff8e2303c4c540 2244977087 C Ii:2:008:1 0:1 7 = 0200ffdf ff0000
ffff8e2303c4c540 2244977101 S Ii:2:008:1 -115:1 8 <
ffff8e2301f32e40 2244979761 C Bi:2:011:2 0 32 = ffffffff ffffffff ffffffff ffffffff ffffffff ffffffff ffffffff ffffffff
ffff8e2301f32e40 2244979767 S Bi:2:011:2 -115 32 <
ffff8e2301f326c0 2244982849 C Bi:2:011:2 0 32 = ffffffff ffffffff ffffffff ffffffff ffffffff ffffffff ffffffff ffffffff
ffff8e2301f326c0 2244982856 S Bi:2:011:2 -115 32 <
ffff8e2303c4c540 2244985085 C Ii:2:008:1 0:1 7 = 020000e0 ff0000
ffff8e2303c4c540 2244985100 S Ii:2:008:1 -115:1 8 <
ffff8e2301f32e40 2244985870 C Bi:2:011:2 0 32 = ffffffff ffffffff ffffffff ffffffff ffffffff ffffffff ffffffff ffffffff
ffff8e2301f32e40 2244985876 S Bi:2:011:2 -115 32 <
ffff8e2301f326c0 2244988235 C Bi:2:011:2 0 4 = ffffffff
ffff8e2301f326c0 2244988242 S Bi:2:011:2 -115 32 <
ffff8e2301f32240 2244988528 S Bo:2:011:2 -115 4 = 525a8080
ffff8e2301f32240 2244988597 C Bo:2:011:2 0 4 >
ffff8e2301f32e40 2244992279 C Bi:2:011:2 0 32 = 525a8080 ffffffff ffffffff ffffffff ffffffff ffffffff ffffffff ffffffff
ffff8e2301f32e40 2244992285 S Bi:2:011:2 -115 32 <
ffff8e2303c4c540 2244993062 C Ii:2:008:1 0:1 7 = 020000f0 ff0000
ffff8e2303c4c540 2244993083 S Ii:2:008:1 -115:1 8 <
ffff8e2301f326c0 2244995375 C Bi:2:011:2 0 32 = ffffffff ffffffff ffffffff ffffffff ffffffff ffffffff ffffffff ffffffff
ffff8e2301f326c0 2244995381 S Bi:2:011:2 -115 32 <
ffff8e2301f32e40 2244998412 C Bi:2:011:2 0 32 = ffffffff ffffffff ffffffff ffffffff ffffffff ffffffff ffffffff ffffffff
ffff8e2301f32e40 2244998418 S Bi:2:011:2 -115 32 <
ffff8e2303c4c540 2245001059 C Ii:2:008:1 0:1 7 = 020000d0 ff0000
ffff8e2303c4c540 2245001073 S Ii:2:008:1 -115:1 8 <
ffff8e2301f326c0 2245001457 C Bi:2:011:2 0 32 = ffffffff ffffffff ffffffff ffffffff ffffffff ffffffff ffffffff ffffffff
ffff8e2301f326c0 2245001462 S Bi:2:011:2 -115 32 <
ffff8e2301f32e40 2245003908 C Bi:2:011:2 0 4 = ffffffff
ffff8e2301f32e40 2245003914 S Bi:2:011:2 -115 32 <
ffff8e2301f32240 2245004238 S Bo:2:011:2 -115 4 = 525b0080
ffff8e2301f32240 2245004288 C Bo:2:011:2 0 4 >
ffff8e2301f326c0 2245008054 C Bi:2:011:2 0 32 = 525b0080 ffffffff ffffffff ffffffff ffffffff ffffffff ffffffff ffffffff
ffff8e2301f326c0 2245008062 S Bi:2:011:2 -115 32 <
ffff8e2303c4c540 2245009062 C Ii:2:008:1 0:1 7 = 020000f0 ff0000
ffff8e2303c4c540 2245009077 S Ii:2:008:1 -115:1 8 <
ffff8e2301f32e40 2245011069 C Bi:2:011:2 0 32 = ffffffff ffffffff ffffffff ffffffff ffffffff ffffffff ffffffff ffffffff
ffff8e2301f32e40 2245011074 S Bi:2:011:2 -115 32 <
ffff8e2301f326c0 2245014137 C Bi:2:011:2 0 32 = ffffffff ffffffff ffffffff ffffffff ffffffff ffffffff ffffffff ffffffff
ffff8e2301f326c0 2245014143 S Bi:2:011:2 -115 32 <
ffff8e2303c4c540 2245017062 C Ii:2:008:1 0:1 7 = 020000e0 ff0000
ffff8e2303c4c540 2245017082 S Ii:2:008:1 -115:1 8 <
ffff8e2301f32e40 2245017187 C Bi:2:011:2 0 32 = ffffffff ffffffff ffffffff ffffffff ffffffff ffffffff ffffffff ffffffff
ffff8e2301f32e40 2245017191 S Bi:2:011:2 -115 32 <
ffff8e2301f326c0 2245019588 C Bi:2:011:2 0 4 = ffffffff
ffff8e2301f326c0 2245019594 S Bi:2:011:2 -115 32 <
ffff8e2301f32240 2245019941 S Bo:2:011:2 -115 4 = 525b8080
ffff8e2301f32240 2245019978 C Bo:2:011:2 0 4 >
ffff8e2301f32e40 2245023661 C Bi:2:011:2 0 32 = 525b8080 ffffffff ffffffff ffffffff ffffffff ffffffff ffffffff ffffffff
ffff8e2301f32e40 2245023666 S Bi:2:011:2 -115 32 <
ffff8e2303c4c540 2245025060 C Ii:2:008:1 0:1 7 = 020000f0 ff0000
ffff8e2303c4c540 2245025075 S Ii:2:008:1 -115:1 8 <
ffff8e2301f326c0 2245026762 C Bi:2:011:2 0 32 = ffffffff ffffffff ffffffff ffffffff ffffffff ffffffff ffffffff ffffffff
ffff8e2301f326c0 2245026768 S Bi:2:011:2 -115 32 <
ffff8e2301f32e40 2245029849 C Bi:2:011:2 0 32 = ffffffff ffffffff ffffffff ffffffff ffffffff ffffffff ffffffff ffffffff
ffff8e2301f32e40 2245029856 S Bi:2:011:2 -115 32 <
ffff8e2301f326c0 2245032895 C Bi:2:011:2 0 32 = ffffffff ffffffff ffffffff ffffffff ffffffff ffffffff ffffffff ffffffff
ffff8e2301f326c0 2245032901 S Bi:2:011:2 -115 32 <
ffff8e2303c4c540 2245033055 C Ii:2:008:1 0:1 7 = 020000f0 ff0000
ffff8e2303c4c540 2245033067 S Ii:2:008:1 -115:1 8 <
ffff8e2301f32e40 2245035233 C Bi:2:011:2 0 4 = ffffffff
ffff8e2301f32e40 2245035238 S Bi:2:011:2 -115 32 <
ffff8e2301f32240 2245035527 S Bo:2:011:2 -115 4 = 525c0080
ffff8e2301f32240 2245035566 C Bo:2:011:2 0 4 >
ffff8e2301f326c0 2245039259 C Bi:2:011:2 0 32 = 525c0080 ffffffff ffffffff ffffffff ffffffff ffffffff ffffffff ffffffff
ffff8e2301f326c0 2245039265 S Bi:2:011:2 -115 32 <
ffff8e2303c4c540 2245041063 C Ii:2:008:1 0:1 7 = 020000f0 ff0000
ffff8e2303c4c540 2245041090 S Ii:2:008:1 -115:1 8 <
ffff8e2301f32e40 2245042323 C Bi:2:011:2 0 32 = ffffffff ffffffff ffffffff ffffffff ffffffff ffffffff ffffffff ffffffff
ffff8e2301f32e40 2245042329 S Bi:2:011:2 -115 32 <
ffff8e2301f326c0 2245045393 C Bi:2:011:2 0 32 = ffffffff ffffffff ffffffff ffffffff ffffffff ffffffff ffffffff ffffffff
ffff8e2301f326c0 2245045399 S Bi:2:011:2 -115 32 <
ffff8e2301f32e40 2245048462 C Bi:2:011:2 0 32 = ffffffff ffffffff ffffffff ffffffff ffffffff ffffffff ffffffff ffffffff
ffff8e2301f32e40 2245048469 S Bi:2:011:2 -115 32 <
ffff8e2303c4c540 2245049057 C Ii:2:008:1 0:1 7 = 020000f0 ff0000
ffff8e2303c4c540 2245049071 S Ii:2:008:1 -115:1 8 <
ffff8e2301f326c0 2245050759 C Bi:2:011:2 0 4 = ffffffff
ffff8e2301f326c0 2245050769 S Bi:2:011:2 -115 32 <
ffff8e2301f32240 2245051090 S Bo:2:011:2 -115 4 = 525c8080
ffff8e2301f32240 2245051131 C Bo:2:011:2 0 4 >
ffff8e2301f32e40 2245054850 C Bi:2:011:2 0 32 = 525c8080 ffffffff ffffffff ffffffff ffffffff ffffffff ffffffff ffffffff
ffff8e2301f32e40 2245054856 S Bi:2:011:2 -115 32 <
ffff8e2303c4c540 2245057059 C Ii:2:008:1 0:1 7 = 020000f0 ff0000
ffff8e2303c4c540 2245057074 S Ii:2:008:1 -115:1 8 <
ffff8e2301f326c0 2245058044 C Bi:2:011:2 0 32 = ffffffff ffffffff ffffffff ffffffff ffffffff ffffffff ffffffff ffffffff
ffff8e2301f326c0 2245058050 S Bi:2:011:2 -115 32 <
ffff8e2301f32e40 2245061008 C Bi:2:011:2 0 32 = ffffffff ffffffff ffffffff ffffffff ffffffff ffffffff ffffffff ffffffff
ffff8e2301f32e40 2245061013 S Bi:2:011:2 -115 32 <
ffff8e2301f326c0 2245064051 C Bi:2:011:2 0 32 = ffffffff ffffffff ffffffff ffffffff ffffffff ffffffff ffffffff ffffffff
ffff8e2301f326c0 2245064057 S Bi:2:011:2 -115 32 <
ffff8e2303c4c540 2245065063 C Ii:2:008:1 0:1 7 = 020000f0 ff0000
ffff8e2303c4c540 2245065078 S Ii:2:008:1 -115:1 8 <
ffff8e2301f32e40 2245066436 C Bi:2:011:2 0 4 = ffffffff
ffff8e2301f32e40 2245066441 S Bi:2:011:2 -115 32 <
ffff8e2301f32240 2245066741 S Bo:2:011:2 -115 4 = 525d0080
ffff8e2301f32240 2245066810 C Bo:2:011:2 0 4 >
ffff8e2301f326c0 2245070530 C Bi:2:011:2 0 32 = 525d0080 ffffffff ffffffff ffffffff ffffffff ffffffff ffffffff ffffffff
ffff8e2301f326c0 2245070536 S Bi:2:011:2 -115 32 <
ffff8e2301f32e40 2245073611 C Bi:2:011:2 0 32 = ffffffff ffffffff ffffffff ffffffff ffffffff ffffffff ffffffff ffffffff
ffff8e2301f32e40 2245073617 S Bi:2:011:2 -115 32 <
ffff8e2301f326c0 2245076666 C Bi:2:011:2 0 32 = ffffffff ffffffff ffffffff ffffffff ffffffff ffffffff ffffffff ffffffff
ffff8e2301f326c0 2245076672 S Bi:2:011:2 -115 32 <
ffff8e2301f32e40 2245079735 C Bi:2:011:2 0 32 = ffffffff ffffffff ffffffff ffffffff ffffffff ffffffff ffffffff ffffffff
ffff8e2301f32e40 2245079741 S Bi:2:011:2 -115 32 <
ffff8e2301f326c0 2245082019 C Bi:2:011:2 0 4 = ffffffff
ffff8e2301f326c0 2245082027 S Bi:2:011:2 -115 32 <
ffff8e2301f32240 2245082399 S Bo:2:011:2 -115 4 = 525d8080
ffff8e2301f32240 2245082468 C Bo:2:011:2 0 4 >
ffff8e2301f32e40 2245086136 C Bi:2:011:2 0 32 = 525d8080 ffffffff ffffffff ffffffff ffffffff ffffffff ffffffff ffffffff
ffff8e2301f32e40 2245086141 S Bi:2:011:2 -115 32 <
ffff8e2301f326c0 2245089210 C Bi:2:011:2 0 32 = ffffffff ffffffff ffffffff ffffffff ffffffff ffffffff ffffffff ffffffff
ffff8e2301f326c0 2245089216 S Bi:2:011:2 -115 32 <
ffff8e2301f32e40 2245092286 C Bi:2:011:2 0 32 = ffffffff ffffffff ffffffff ffffffff ffffffff ffffffff ffffffff ffffffff
ffff8e2301f32e40 2245092292 S Bi:2:011:2 -115 32 <
ffff8e2301f326c0 2245095346 C Bi:2:011:2 0 32 = ffffffff ffffffff ffffffff ffffffff ffffffff ffffffff ffffffff ffffffff
ffff8e2301f326c0 2245095351 S Bi:2:011:2 -115 32 <
ffff8e2301f32e40 2245097666 C Bi:2:011:2 0 4 = ffffffff
ffff8e2301f32e40 2245097672 S Bi:2:011:2 -115 32 <
ffff8e2301f32240 2245097964 S Bo:2:011:2 -115 4 = 525e0080
ffff8e2301f32240 2245098010 C Bo:2:011:2 0 4 >
ffff8e2301f326c0 2245101709 C Bi:2:011:2 0 32 = 525e0080 ffffffff ffffffff ffffffff ffffffff ffffffff ffffffff ffffffff
ffff8e2301f326c0 2245101715 S Bi:2:011:2 -115 32 <
ffff8e2301f32e40 2245104805 C Bi:2:011:2 0 32 = ffffffff ffffffff ffffffff ffffffff ffffffff ffffffff ffffffff ffffffff
ffff8e2301f32e40 2245104812 S Bi:2:011:2 -115 32 <
ffff8e2301f326c0 2245107851 C Bi:2:011:2 0 32 = ffffffff ffffffff ffffffff ffffffff ffffffff ffffffff ffffffff ffffffff
ffff8e2301f326c0 2245107857 S Bi:2:011:2 -115 32 <
ffff8e2301f32e40 2245110913 C Bi:2:011:2 0 32 = ffffffff ffffffff ffffffff ffffffff ffffffff ffffffff ffffffff ffffffff
ffff8e2301f32e40 2245110918 S Bi:2:011:2 -115 32 <
ffff8e2301f326c0 2245113137 C Bi:2:011:2 0 4 = ffffffff
ffff8e2301f326c0 2245113142 S Bi:2:011:2 -115 32 <
ffff8e2301f32240 2245113449 S Bo:2:011:2 -115 4 = 525e8080
ffff8e2301f32240 2245113488 C Bo:2:011:2 0 4 >
ffff8e2301f32e40 2245117209 C Bi:2:011:2 0 32 = 525e8080 ffffffff ffffffff ffffffff ffffffff ffffffff ffffffff ffffffff
ffff8e2301f32e40 2245117214 S Bi:2:011:2 -115 32 <
ffff8e2301f326c0 2245120254 C Bi:2:011:2 0 32 = ffffffff ffffffff ffffffff ffffffff ffffffff ffffffff ffffffff ffffffff
ffff8e2301f326c0 2245120259 S Bi:2:011:2 -115 32 <
ffff8e2301f32e40 2245123345 C Bi:2:011:2 0 32 = ffffffff ffffffff ffffffff ffffffff ffffffff ffffffff ffffffff ffffffff
ffff8e2301f32e40 2245123349 S Bi:2:011:2 -115 32 <
ffff8e2301f326c0 2245126410 C Bi:2:011:2 0 32 = ffffffff ffffffff ffffffff ffffffff ffffffff ffffffff ffffffff ffffffff
ffff8e2301f326c0 2245126415 S Bi:2:011:2 -115 32 <
ffff8e2301f32e40 2245128658 C Bi:2:011:2 0 4 = ffffffff
ffff8e2301f32e40 2245128662 S Bi:2:011:2 -115 32 <
ffff8e2301f32240 2245128980 S Bo:2:011:2 -115 4 = 525f0080
ffff8e2301f32240 2245129018 C Bo:2:011:2 0 4 >
ffff8e2301f326c0 2245132733 C Bi:2:011:2 0 32 = 525f0080 ffffffff ffffffff ffffffff ffffffff ffffffff ffffffff ffffffff
ffff8e2301f326c0 2245132737 S Bi:2:011:2 -115 32 <
ffff8e2301f32e40 2245135779 C Bi:2:011:2 0 32 = ffffffff ffffffff ffffffff ffffffff ffffffff ffffffff ffffffff ffffffff
ffff8e2301f32e40 2245135784 S Bi:2:011:2 -115 32 <
ffff8e2301f326c0 2245138869 C Bi:2:011:2 0 32 = ffffffff ffffffff ffffffff ffffffff ffffffff ffffffff ffffffff ffffffff
ffff8e2301f326c0 2245138874 S Bi:2:011:2 -115 32 <
ffff8e2301f32e40 2245142010 C Bi:2:011:2 0 32 = ffffffff ffffffff ffffffff ffffffff ffffffff ffffffff ffffffff ffffffff
ffff8e2301f32e40 2245142015 S Bi:2:011:2 -115 32 <
ffff8e2301f326c0 2245144159 C Bi:2:011:2 0 4 = ffffffff
ffff8e2301f326c0 2245144164 S Bi:2:011:2 -115 32 <
ffff8e2301f32240 2245144466 S Bo:2:011:2 -115 4 = 525f8080
ffff8e2301f32240 2245144504 C Bo:2:011:2 0 4 >
ffff8e2301f32e40 2245148233 C Bi:2:011:2 0 32 = 525f8080 ffffffff ffffffff ffffffff ffffffff ffffffff ffffffff ffffffff
ffff8e2301f32e40 2245148238 S Bi:2:011:2 -115 32 <
ffff8e2301f326c0 2245151303 C Bi:2:011:2 0 32 = ffffffff ffffffff ffffffff ffffffff ffffffff ffffffff ffffffff ffffffff
ffff8e2301f326c0 2245151310 S Bi:2:011:2 -115 32 <
ffff8e2301f32e40 2245154369 C Bi:2:011:2 0 32 = ffffffff ffffffff ffffffff ffffffff ffffffff ffffffff ffffffff ffffffff
ffff8e2301f32e40 2245154375 S Bi:2:011:2 -115 32 <
ffff8e2301f326c0 2245157464 C Bi:2:011:2 0 32 = ffffffff ffffffff ffffffff ffffffff ffffffff ffffffff ffffffff ffffffff
ffff8e2301f326c0 2245157470 S Bi:2:011:2 -115 32 <
ffff8e2301f32e40 2245159713 C Bi:2:011:2 0 4 = ffffffff
ffff8e2301f32e40 2245159719 S Bi:2:011:2 -115 32 <
ffff8e2301f32240 2245160063 S Bo:2:011:2 -115 4 = 52600080
ffff8e2301f32240 2245160102 C Bo:2:011:2 0 4 >
ffff8e2301f326c0 2245163808 C Bi:2:011:2 0 32 = 52600080 ffffffff ffffffff ffffffff ffffffff ffffffff ffffffff ffffffff
ffff8e2301f326c0 2245163814 S Bi:2:011:2 -115 32 <
ffff8e2301f32e40 2245166895 C Bi:2:011:2 0 32 = ffffffff ffffffff ffffffff ffffffff ffffffff ffffffff ffffffff ffffffff
ffff8e2301f32e40 2245166901 S Bi:2:011:2 -115 32 <
ffff8e2301f326c0 2245170008 C Bi:2:011:2 0 32 = ffffffff ffffffff ffffffff ffffffff ffffffff ffffffff ffffffff ffffffff
ffff8e2301f326c0 2245170013 S Bi:2:011:2 -115 32 <
ffff8e2301f32e40 2245173051 C Bi:2:011:2 0 32 = ffffffff ffffffff ffffffff ffffffff ffffffff ffffffff ffffffff ffffffff
ffff8e2301f32e40 2245173058 S Bi:2:011:2 -115 32 <
ffff8e2301f326c0 2245175370 C Bi:2:011:2 0 4 = ffffffff
ffff8e2301f326c0 2245175376 S Bi:2:011:2 -115 32 <
ffff8e2301f32240 2245175770 S Bo:2:011:2 -115 4 = 52608080
ffff8e2301f32240 2245175839 C Bo:2:011:2 0 4 >
ffff8e2301f32e40 2245179528 C Bi:2:011:2 0 32 = 52608080 ffffffff ffffffff ffffffff ffffffff ffffffff ffffffff ffffffff
ffff8e2301f32e40 2245179534 S Bi:2:011:2 -115 32 <
ffff8e2301f326c0 2245182620 C Bi:2:011:2 0 32 = ffffffff ffffffff ffffffff ffffffff ffffffff ffffffff ffffffff ffffffff
ffff8e2301f326c0 2245182626 S Bi:2:011:2 -115 32 <
ffff8e2301f32e40 2245185660 C Bi:2:011:2 0 32 = ffffffff ffffffff ffffffff ffffffff ffffffff ffffffff ffffffff ffffffff
ffff8e2301f32e40 2245185666 S Bi:2:011:2 -115 32 <
ffff8e2301f326c0 2245188762 C Bi:2:011:2 0 32 = ffffffff ffffffff ffffffff ffffffff ffffffff ffffffff ffffffff ffffffff
ffff8e2301f326c0 2245188768 S Bi:2:011:2 -115 32 <
ffff8e2301f32e40 2245191052 C Bi:2:011:2 0 4 = ffffffff
ffff8e2301f32e40 2245191058 S Bi:2:011:2 -115 32 <
ffff8e2301f32240 2245191419 S Bo:2:011:2 -115 4 = 52610080
ffff8e2301f32240 2245191455 C Bo:2:011:2 0 4 >
ffff8e2301f326c0 2245195161 C Bi:2:011:2 0 32 = 52610080 ffffffff ffffffff ffffffff ffffffff ffffffff ffffffff ffffffff
ffff8e2301f326c0 2245195166 S Bi:2:011:2 -115 32 <
ffff8e2301f32e40 2245198231 C Bi:2:011:2 0 32 = ffffffff ffffffff ffffffff ffffffff ffffffff ffffffff ffffffff ffffffff
ffff8e2301f32e40 2245198237 S Bi:2:011:2 -115 32 <
ffff8e2301f326c0 2245201304 C Bi:2:011:2 0 32 = ffffffff ffffffff ffffffff ffffffff ffffffff ffffffff ffffffff ffffffff
ffff8e2301f326c0 2245201310 S Bi:2:011:2 -115 32 <
ffff8e2301f32e40 2245204396 C Bi:2:011:2 0 32 = ffffffff ffffffff ffffffff ffffffff ffffffff ffffffff ffffffff ffffffff
ffff8e2301f32e40 2245204402 S Bi:2:011:2 -115 32 <
ffff8e2301f326c0 2245206783 C Bi:2:011:2 0 4 = ffffffff
ffff8e2301f326c0 2245206789 S Bi:2:011:2 -115 32 <
ffff8e2301f32240 2245207127 S Bo:2:011:2 -115 4 = 52618080
ffff8e2301f32240 2245207165 C Bo:2:011:2 0 4 >
ffff8e2301f32e40 2245210868 C Bi:2:011:2 0 32 = 52618080 ffffffff ffffffff ffffffff ffffffff ffffffff ffffffff ffffffff
ffff8e2301f32e40 2245210873 S Bi:2:011:2 -115 32 <
ffff8e2301f326c0 2245214043 C Bi:2:011:2 0 32 = ffffffff ffffffff ffffffff ffffffff ffffffff ffffffff ffffffff ffffffff
ffff8e2301f326c0 2245214051 S Bi:2:011:2 -115 32 <
ffff8e2301f32e40 2245217040 C Bi:2:011:2 0 32 = ffffffff ffffffff ffffffff ffffffff ffffffff ffffffff ffffffff ffffffff
ffff8e2301f32e40 2245217048 S Bi:2:011:2 -115 32 <
ffff8e2301f326c0 2245220093 C Bi:2:011:2 0 32 = ffffffff ffffffff ffffffff ffffffff ffffffff ffffffff ffffffff ffffffff
ffff8e2301f326c0 2245220098 S Bi:2:011:2 -115 32 <
ffff8e2301f32e40 2245222464 C Bi:2:011:2 0 4 = ffffffff
ffff8e2301f32e40 2245222470 S Bi:2:011:2 -115 32 <
ffff8e2301f32240 2245222809 S Bo:2:011:2 -115 4 = 52620080
ffff8e2301f32240 2245222846 C Bo:2:011:2 0 4 >
ffff8e2301f326c0 2245226554 C Bi:2:011:2 0 32 = 52620080 ffffffff ffffffff ffffffff ffffffff ffffffff ffffffff ffffffff
ffff8e2301f326c0 2245226560 S Bi:2:011:2 -115 32 <
ffff8e2301f32e40 2245229617 C Bi:2:011:2 0 32 = ffffffff ffffffff ffffffff ffffffff ffffffff ffffffff ffffffff ffffffff
ffff8e2301f32e40 2245229623 S Bi:2:011:2 -115 32 <
ffff8e2301f326c0 2245232715 C Bi:2:011:2 0 32 = ffffffff ffffffff ffffffff ffffffff ffffffff ffffffff ffffffff ffffffff
ffff8e2301f326c0 2245232721 S Bi:2:011:2 -115 32 <
ffff8e2301f32e40 2245235761 C Bi:2:011:2 0 32 = ffffffff ffffffff ffffffff ffffffff ffffffff ffffffff ffffffff ffffffff
ffff8e2301f32e40 2245235767 S Bi:2:011:2 -115 32 <
ffff8e2301f326c0 2245238116 C Bi:2:011:2 0 4 = ffffffff
ffff8e2301f326c0 2245238123 S Bi:2:011:2 -115 32 <
ffff8e2301f32240 2245238493 S Bo:2:011:2 -115 4 = 52628080
ffff8e2301f32240 2245238532 C Bo:2:011:2 0 4 >
ffff8e2301f32e40 2245242232 C Bi:2:011:2 0 32 = 52628080 ffffffff ffffffff ffffffff ffffffff ffffffff ffffffff ffffffff
ffff8e2301f32e40 2245242238 S Bi:2:011:2 -115 32 <
ffff8e2301f326c0 2245245332 C Bi:2:011:2 0 32 = ffffffff ffffffff ffffffff ffffffff ffffffff ffffffff ffffffff ffffffff
ffff8e2301f326c0 2245245338 S Bi:2:011:2 -115 32 <
ffff8e2301f32e40 2245248366 C Bi:2:011:2 0 32 = ffffffff ffffffff ffffffff ffffffff ffffffff ffffffff ffffffff ffffffff
ffff8e2301f32e40 2245248372 S Bi:2:011:2 -115 32 <
ffff8e2301f326c0 2245251438 C Bi:2:011:2 0 32 = ffffffff ffffffff ffffffff ffffffff ffffffff ffffffff ffffffff ffffffff
ffff8e2301f326c0 2245251444 S Bi:2:011:2 -115 32 <
ffff8e2301f32e40 2245253803 C Bi:2:011:2 0 4 = ffffffff
ffff8e2301f32e40 2245253808 S Bi:2:011:2 -115 32 <
ffff8e2301f32240 2245254148 S Bo:2:011:2 -115 4 = 52630080
ffff8e2301f32240 2245254187 C Bo:2:011:2 0 4 >
ffff8e2301f326c0 2245258014 C Bi:2:011:2 0 32 = 52630080 00261a14 00761643 00000000 00000004 ffffffff 13196f32 65766932
ffff8e2301f326c0 2245258019 S Bi:2:011:2 -115 32 <
ffff8e2301f32e40 2245261038 C Bi:2:011:2 0 32 = ffffffff 00361a14 00461643 00000000 00000004 ffffffff 13196f32 65766931
ffff8e2301f32e40 2245261044 S Bi:2:011:2 -115 32 <
ffff8e2301f326c0 2245264049 C Bi:2:011:2 0 32 = ffffffff 00061a14 00001643 00000000 00000004 ffffffff 13196f32 65ffffff
ffff8e2301f326c0 2245264055 S Bi:2:011:2 -115 32 <
ffff8e2301f32e40 2245267116 C Bi:2:011:2 0 32 = ffffffff 00161a14 00c61143 00000000 00000004 ffffffff 13196f32 65766f31
ffff8e2301f32e40 2245267121 S Bi:2:011:2 -115 32 <
ffff8e2301f326c0 2245269488 C Bi:2:011:2 0 4 = ffffffff
ffff8e2301f326c0 2245269494 S Bi:2:011:2 -115 32 <
ffff8e2301f32240 2245269820 S Bo:2:011:2 -115 4 = 52638080
ffff8e2301f32240 2245269857 C Bo:2:011:2 0 4 >
ffff8e2301f32e40 2245273600 C Bi:2:011:2 0 32 = 52638080 00661a14 00d61143 00000000 00000004 ffffffff 13196f32 65766f32
ffff8e2301f32e40 2245273606 S Bi:2:011:2 -115 32 <
ffff8e2301f326c0 2245276667 C Bi:2:011:2 0 32 = ffffffff 00001b14 00261043 00000000 00000004 ffffffff 13196f39 63766932
ffff8e2301f326c0 2245276673 S Bi:2:011:2 -115 32 <
ffff8e2301f32e40 2245279736 C Bi:2:011:2 0 32 = ffffffff 00c61a14 00361043 00000000 00000004 ffffffff 13196f39 63766931
ffff8e2301f32e40 2245279742 S Bi:2:011:2 -115 32 <
ffff8e2301f326c0 2245282805 C Bi:2:011:2 0 32 = ffffffff 00d61a14 00061043 00000000 00000004 ffffffff 13196f39 63ffffff
ffff8e2301f326c0 2245282811 S Bi:2:011:2 -115 32 <
ffff8e2301f32e40 2245285139 C Bi:2:011:2 0 4 = ffffffff
ffff8e2301f32e40 2245285148 S Bi:2:011:2 -115 32 <
ffff8e2301f32240 2245285473 S Bo:2:011:2 -115 4 = 52640080
ffff8e2301f32240 2245285550 C Bo:2:011:2 0 4 >
ffff8e2301f326c0 2245289238 C Bi:2:011:2 0 32 = 52640080 00261a14 00161043 00000000 00000004 ffffffff 13196f39 63766f31
ffff8e2301f326c0 2245289245 S Bi:2:011:2 -115 32 <
ffff8e2301f32e40 2245292307 C Bi:2:011:2 0 32 = ffffffff 00361a14 00661043 00000000 00000004 ffffffff 13196f39 63766f32
ffff8e2301f32e40 2245292313 S Bi:2:011:2 -115 32 <
ffff8e2301f326c0 2245295383 C Bi:2:011:2 0 32 = ffffffff 00001b14 00261043 00000000 00000004 ffffffff 13196f39 60766932
ffff8e2301f326c0 2245295390 S Bi:2:011:2 -115 32 <
ffff8e2301f32e40 2245298441 C Bi:2:011:2 0 32 = ffffffff 00c61a14 00361043 00000000 00000004 ffffffff 13196f39 60766931
ffff8e2301f32e40 2245298447 S Bi:2:011:2 -115 32 <
ffff8e2301f326c0 2245300689 C Bi:2:011:2 0 4 = ffffffff
ffff8e2301f326c0 2245300696 S Bi:2:011:2 -115 32 <
ffff8e2301f32240 2245301042 S Bo:2:011:2 -115 4 = 52648080
ffff8e2301f32240 2245301087 C Bo:2:011:2 0 4 >
ffff8e2301f32e40 2245304806 C Bi:2:011:2 0 32 = 52648080 00d61a14 00061043 00000000 00000004 ffffffff 13196f39 60ffffff
ffff8e2301f32e40 2245304812 S Bi:2:011:2 -115 32 <
ffff8e2301f326c0 2245307896 C Bi:2:011:2 0 32 = ffffffff 00261a14 00161043 00000000 00000004 ffffffff 13196f39 60766f31
ffff8e2301f326c0 2245307902 S Bi:2:011:2 -115 32 <
ffff8e2301f32e40 2245311033 C Bi:2:011:2 0 32 = ffffffff 00361a14 00661043 00000000 00000004 ffffffff 13196f39 60766f32
ffff8e2301f32e40 2245311041 S Bi:2:011:2 -115 32 <
ffff8e2301f326c0 2245314033 C Bi:2:011:2 0 32 = ffffffff 00261a14 00761b43 00000000 00000004 ffffffff 14196f31 636e622b
ffff8e2301f326c0 2245314039 S Bi:2:011:2 -115 32 <
ffff8e2301f32e40 2245316372 C Bi:2:011:2 0 4 = 60ffffff
ffff8e2301f32e40 2245316378 S Bi:2:011:2 -115 32 <
ffff8e2301f32240 2245316703 S Bo:2:011:2 -115 4 = 52650080
ffff8e2301f32240 2245316772 C Bo:2:011:2 0 4 >
ffff8e2301f326c0 2245320487 C Bi:2:011:2 0 32 = 52650080 00361a14 00461b43 00000000 00000004 ffffffff 14196f31 636e622b
ffff8e2301f326c0 2245320493 S Bi:2:011:2 -115 32 <
ffff8e2301f32e40 2245323556 C Bi:2:011:2 0 32 = 63ffffff 00061a14 00001b43 00000000 00000004 ffffffff 14196f31 636effff
ffff8e2301f32e40 2245323562 S Bi:2:011:2 -115 32 <
ffff8e2301f326c0 2245326627 C Bi:2:011:2 0 32 = ffffffff 00161a14 00c61a43 00000000 00000004 ffffffff 14196f31 636e622d
ffff8e2301f326c0 2245326633 S Bi:2:011:2 -115 32 <
ffff8e2301f32e40 2245329634 C Bi:2:011:2 0 32 = 63ffffff 00661a14 00d61a43 00000000 00000004 ffffffff 14196f31 636e622d
ffff8e2301f32e40 2245329639 S Bi:2:011:2 -115 32 <
ffff8e2301f326c0 2245332030 C Bi:2:011:2 0 4 = 60ffffff
ffff8e2301f326c0 2245332035 S Bi:2:011:2 -115 32 <
ffff8e2301f32240 2245332344 S Bo:2:011:2 -115 4 = 52658080
ffff8e2301f32240 2245332413 C Bo:2:011:2 0 4 >
ffff8e2301f32e40 2245336093 C Bi:2:011:2 0 32 = 52658080 00d02443 00c31a14 00000000 00000004 ffffffff 1a170645 017b0b43
ffff8e2301f32e40 2245336098 S Bi:2:011:2 -115 32 <
ffff8e2301f326c0 2245339161 C Bi:2:011:2 0 32 = 1f766932 00202443 00d31a14 00000000 00000004 ffffffff 1a170645 017b0b43
ffff8e2301f326c0 2245339167 S Bi:2:011:2 -115 32 <
ffff8e2301f32e40 2245342232 C Bi:2:011:2 0 32 = 1f766931 00302443 00231a14 00000000 00000004 ffffffff 1a170645 017b0b43
ffff8e2301f32e40 2245342238 S Bi:2:011:2 -115 32 <
ffff8e2301f326c0 2245345305 C Bi:2:011:2 0 32 = 1fffffff 00562443 00331a14 00000000 00000004 ffffffff 1a170645 017b0b43
ffff8e2301f326c0 2245345311 S Bi:2:011:2 -115 32 <
ffff8e2301f32e40 2245347580 C Bi:2:011:2 0 4 = 1f766f31
ffff8e2301f32e40 2245347586 S Bi:2:011:2 -115 32 <
ffff8e2301f32240 2245347952 S Bo:2:011:2 -115 4 = 52660080
ffff8e2301f32240 2245348023 C Bo:2:011:2 0 4 >
ffff8e2301f326c0 2245351736 C Bi:2:011:2 0 32 = 52660080 00102443 00031a14 00000000 00000004 ffffffff 1a170645 017b0b43
ffff8e2301f326c0 2245351747 S Bi:2:011:2 -115 32 <
ffff8e2301f32e40 2245354805 C Bi:2:011:2 0 32 = 1f766f32 00532b43 00131b14 00000000 00000004 ffffffff 1a170645 017b1020
ffff8e2301f32e40 2245354811 S Bi:2:011:2 -115 32 <
ffff8e2301f326c0 2245357852 C Bi:2:011:2 0 32 = 7964ffff 00c32a43 00631b14 00000000 00000004 ffffffff 1a170645 017b1020
ffff8e2301f326c0 2245357858 S Bi:2:011:2 -115 32 <
ffff8e2301f32e40 2245361032 C Bi:2:011:2 0 32 = 7967ffff 00d32a43 00731b14 00000000 00000004 ffffffff 1a170645 017b10ff
ffff8e2301f32e40 2245361038 S Bi:2:011:2 -115 32 <
ffff8e2301f326c0 2245363263 C Bi:2:011:2 0 4 = ffffffff
ffff8e2301f326c0 2245363269 S Bi:2:011:2 -115 32 <
ffff8e2301f32240 2245363581 S Bo:2:011:2 -115 4 = 52668080
ffff8e2301f32240 2245363650 C Bo:2:011:2 0 4 >
ffff8e2301f32e40 2245367330 C Bi:2:011:2 0 32 = 52668080 00232a43 00431b14 00000000 00000004 ffffffff 1a170645 017b1020
ffff8e2301f32e40 2245367336 S Bi:2:011:2 -115 32 <
ffff8e2301f326c0 2245370440 C Bi:2:011:2 0 32 = 7f67ffff 00332a43 00531b14 00000000 00000004 ffffffff 1a170645 017b1020
ffff8e2301f326c0 2245370446 S Bi:2:011:2 -115 32 <
ffff8e2301f32e40 2245373510 C Bi:2:011:2 0 32 = 7f64ffff 00631b14 00c33543 00000000 00000004 ffffffff 1e1f0e41 11050354
ffff8e2301f32e40 2245373516 S Bi:2:011:2 -115 32 <
ffff8e2301f326c0 2245376582 C Bi:2:011:2 0 32 = 60766932 00731b14 00d33543 00000000 00000004 ffffffff 1e1f0e41 11050354
ffff8e2301f326c0 2245376588 S Bi:2:011:2 -115 32 <
ffff8e2301f32e40 2245379017 C Bi:2:011:2 0 4 = 60766931
ffff8e2301f32e40 2245379024 S Bi:2:011:2 -115 32 <
ffff8e2301f32240 2245379300 S Bo:2:011:2 -115 4 = 52670080
ffff8e2301f32240 2245379369 C Bo:2:011:2 0 4 >
ffff8e2301f326c0 2245383047 C Bi:2:011:2 0 32 = 52670080 00431b14 00233543 00000000 00000004 ffffffff 1e1f0e41 11050354
ffff8e2301f326c0 2245383054 S Bi:2:011:2 -115 32 <
ffff8e2301f32e40 2245386095 C Bi:2:011:2 0 32 = 60ffffff 00531b14 00333543 00000000 00000004 ffffffff 1e1f0e41 11050354
ffff8e2301f32e40 2245386101 S Bi:2:011:2 -115 32 <
ffff8e2301f326c0 2245389164 C Bi:2:011:2 0 32 = 60766f31 00c31a14 00033543 00000000 00000004 ffffffff 1e1f0e41 11050354
ffff8e2301f326c0 2245389169 S Bi:2:011:2 -115 32 <
ffff8e2301f32e40 2245392235 C Bi:2:011:2 0 32 = 60766f32 00761b14 00763743 0000c705 00000004 ffffffff 02196f31 6267622b
ffff8e2301f32e40 2245392241 S Bi:2:011:2 -115 32 <
ffff8e2301f326c0 2245394573 C Bi:2:011:2 0 4 = 60ffffff
ffff8e2301f326c0 2245394579 S Bi:2:011:2 -115 32 <
ffff8e2301f32240 2245394889 S Bo:2:011:2 -115 4 = 52678080
ffff8e2301f32240 2245394981 C Bo:2:011:2 0 4 >
ffff8e2301f32e40 2245398719 C Bi:2:011:2 0 32 = 52678080 00461b14 00463743 0000c705 00000004 ffffffff 02196f31 6267622b
ffff8e2301f32e40 2245398731 S Bi:2:011:2 -115 32 <
ffff8e2301f326c0 2245401723 C Bi:2:011:2 0 32 = 63ffffff 00001b14 00003743 0000c705 00000004 ffffffff 02196f31 6267ffff
ffff8e2301f326c0 2245401731 S Bi:2:011:2 -115 32 <
ffff8e2301f32e40 2245404851 C Bi:2:011:2 0 32 = ffffffff 00c61a14 00c63643 0000c705 00000004 ffffffff 02196f31 6267622d
ffff8e2301f32e40 2245404857 S Bi:2:011:2 -115 32 <
ffff8e2301f326c0 2245407898 C Bi:2:011:2 0 32 = 63ffffff 00d61a14 00d63643 0000c705 00000004 ffffffff 02196f31 6267622d
ffff8e2301f326c0 2245407904 S Bi:2:011:2 -115 32 <
ffff8e2301f32e40 2245410259 C Bi:2:011:2 0 4 = 60ffffff
ffff8e2301f32e40 2245410265 S Bi:2:011:2 -115 32 <
ffff8e2301f32240 2245410609 S Bo:2:011:2 -115 4 = 52680080
ffff8e2301f32240 2245410679 C Bo:2:011:2 0 4 >
ffff8e2301f326c0 2245414396 C Bi:2:011:2 0 32 = 52680080 00261a14 00762a43 0000dc02 00000004 ffffffff 01196f35 62766932
ffff8e2301f326c0 2245414402 S Bi:2:011:2 -115 32 <
ffff8e2301f32e40 2245417465 C Bi:2:011:2 0 32 = ffffffff 00361a14 00462a43 0000dc02 00000004 ffffffff 01196f35 62766931
ffff8e2301f32e40 2245417471 S Bi:2:011:2 -115 32 <
ffff8e2301f326c0 2245420531 C Bi:2:011:2 0 32 = ffffffff 00061a14 00002a43 0000dc02 00000004 ffffffff 01196f35 62ffffff
ffff8e2301f326c0 2245420537 S Bi:2:011:2 -115 32 <
ffff8e2301f32e40 2245423601 C Bi:2:011:2 0 32 = ffffffff 00161a14 00c62543 0000dc02 00000004 ffffffff 01196f35 62766f31
ffff8e2301f32e40 2245423608 S Bi:2:011:2 -115 32 <
ffff8e2301f326c0 2245426009 C Bi:2:011:2 0 4 = ffffffff
ffff8e2301f326c0 2245426015 S Bi:2:011:2 -115 32 <
ffff8e2301f32240 2245426338 S Bo:2:011:2 -115 4 = 52688080
ffff8e2301f32240 2245426407 C Bo:2:011:2 0 4 >
ffff8e2301f32e40 2245430121 C Bi:2:011:2 0 32 = 52688080 00661a14 00d62543 0000dc02 00000004 ffffffff 01196f35 62766f32
ffff8e2301f32e40 2245430127 S Bi:2:011:2 -115 32 <
ffff8e2301f326c0 2245433186 C Bi:2:011:2 0 32 = ffffffff 00131b14 00133243 00000000 00000004 ffffffff 07561151 7f050354
ffff8e2301f326c0 2245433193 S Bi:2:011:2 -115 32 <
ffff8e2301f32e40 2245436269 C Bi:2:011:2 0 32 = 727d70ff 00631b14 00633243 00000000 00000004 ffffffff 07561151 7f050354
ffff8e2301f32e40 2245436276 S Bi:2:011:2 -115 32 <
ffff8e2301f326c0 2245439330 C Bi:2:011:2 0 32 = 727d73ff 00731b14 00733243 00000000 00000004 ffffffff 07561151 7f050354
ffff8e2301f326c0 2245439336 S Bi:2:011:2 -115 32 <
ffff8e2301f32e40 2245441684 C Bi:2:011:2 0 4 = ffffffff
ffff8e2301f32e40 2245441690 S Bi:2:011:2 -115 32 <
ffff8e2301f32240 2245441985 S Bo:2:011:2 -115 4 = 52690080
ffff8e2301f32240 2245442053 C Bo:2:011:2 0 4 >
ffff8e2301f326c0 2245445766 C Bi:2:011:2 0 32 = 52690080 00431b14 00433243 00000000 00000004 ffffffff 07561151 7f050354
ffff8e2301f326c0 2245445772 S Bi:2:011:2 -115 32 <
ffff8e2301f32e40 2245448807 C Bi:2:011:2 0 32 = 727b73ff 00531b14 00533243 00000000 00000004 ffffffff 07561151 7f050354
ffff8e2301f32e40 2245448813 S Bi:2:011:2 -115 32 <
ffff8e2301f326c0 2245451899 C Bi:2:011:2 0 32 = 727b70ff ffffffff ffffffff ffffffff ffffffff ffffffff ffffffff ffffffff
ffff8e2301f326c0 2245451905 S Bi:2:011:2 -115 32 <
ffff8e2301f32e40 2245455032 C Bi:2:011:2 0 32 = ffffffff ffffffff ffffffff ffffffff ffffffff ffffffff ffffffff ffffffff
ffff8e2301f32e40 2245455040 S Bi:2:011:2 -115 32 <
ffff8e2301f326c0 2245457328 C Bi:2:011:2 0 4 = ffffffff
ffff8e2301f326c0 2245457334 S Bi:2:011:2 -115 32 <
ffff8e2301f32240 2245457605 S Bo:2:011:2 -115 4 = 52698080
ffff8e2301f32240 2245457675 C Bo:2:011:2 0 4 >
ffff8e2301f32e40 2245461375 C Bi:2:011:2 0 32 = 52698080 ffffffff ffffffff ffffffff ffffffff ffffffff ffffffff ffffffff
ffff8e2301f32e40 2245461381 S Bi:2:011:2 -115 32 <
ffff8e2301f326c0 2245464442 C Bi:2:011:2 0 32 = ffffffff ffffffff ffffffff ffffffff ffffffff ffffffff ffffffff ffffffff
ffff8e2301f326c0 2245464448 S Bi:2:011:2 -115 32 <
ffff8e2301f32e40 2245467484 C Bi:2:011:2 0 32 = ffffffff ffffffff ffffffff ffffffff ffffffff ffffffff ffffffff ffffffff
ffff8e2301f32e40 2245467489 S Bi:2:011:2 -115 32 <
ffff8e2301f326c0 2245470577 C Bi:2:011:2 0 32 = ffffffff ffffffff ffffffff ffffffff ffffffff ffffffff ffffffff ffffffff
ffff8e2301f326c0 2245470583 S Bi:2:011:2 -115 32 <
ffff8e2301f32e40 2245472875 C Bi:2:011:2 0 4 = ffffffff
ffff8e2301f32e40 2245472881 S Bi:2:011:2 -115 32 <
ffff8e2301f32240 2245473138 S Bo:2:011:2 -115 4 = 526a0080
ffff8e2301f32240 2245473181 C Bo:2:011:2 0 4 >
ffff8e2301f326c0 2245476896 C Bi:2:011:2 0 32 = 526a0080 ffffffff ffffffff ffffffff ffffffff ffffffff ffffffff ffffffff
ffff8e2301f326c0 2245476902 S Bi:2:011:2 -115 32 <
ffff8e2301f32e40 2245480037 C Bi:2:011:2 0 32 = ffffffff ffffffff ffffffff ffffffff ffffffff ffffffff ffffffff ffffffff
ffff8e2301f32e40 2245480043 S Bi:2:011:2 -115 32 <
ffff8e2301f326c0 2245483031 C Bi:2:011:2 0 32 = ffffffff ffffffff ffffffff ffffffff ffffffff ffffffff ffffffff ffffffff
ffff8e2301f326c0 2245483037 S Bi:2:011:2 -115 32 <
ffff8e2301f32e40 2245486094 C Bi:2:011:2 0 32 = ffffffff ffffffff ffffffff ffffffff ffffffff ffffffff ffffffff ffffffff
ffff8e2301f32e40 2245486103 S Bi:2:011:2 -115 32 <
ffff8e2301f326c0 2245488346 C Bi:2:011:2 0 4 = ffffffff
ffff8e2301f326c0 2245488352 S Bi:2:011:2 -115 32 <
ffff8e2301f32240 2245488648 S Bo:2:011:2 -115 4 = 526a8080
ffff8e2301f32240 2245488717 C Bo:2:011:2 0 4 >
ffff8e2301f32e40 2245492371 C Bi:2:011:2 0 32 = 526a8080 ffffffff ffffffff ffffffff ffffffff ffffffff ffffffff ffffffff
ffff8e2301f32e40 2245492377 S Bi:2:011:2 -115 32 <
ffff8e2301f326c0 2245495440 C Bi:2:011:2 0 32 = ffffffff ffffffff ffffffff ffffffff ffffffff ffffffff ffffffff ffffffff
ffff8e2301f326c0 2245495446 S Bi:2:011:2 -115 32 <
ffff8e2301f32e40 2245498505 C Bi:2:011:2 0 32 = ffffffff ffffffff ffffffff ffffffff ffffffff ffffffff ffffffff ffffffff
ffff8e2301f32e40 2245498511 S Bi:2:011:2 -115 32 <
ffff8e2301f326c0 2245501571 C Bi:2:011:2 0 32 = ffffffff ffffffff ffffffff ffffffff ffffffff ffffffff ffffffff ffffffff
ffff8e2301f326c0 2245501575 S Bi:2:011:2 -115 32 <
ffff8e2301f32e40 2245503848 C Bi:2:011:2 0 4 = ffffffff
ffff8e2301f32e40 2245503852 S Bi:2:011:2 -115 32 <
ffff8e2301f32240 2245504106 S Bo:2:011:2 -115 4 = 526b0080
ffff8e2301f32240 2245504144 C Bo:2:011:2 0 4 >
ffff8e2301f326c0 2245507826 C Bi:2:011:2 0 32 = 526b0080 ffffffff ffffffff ffffffff ffffffff ffffffff ffffffff ffffffff
ffff8e2301f326c0 2245507832 S Bi:2:011:2 -115 32 <
ffff8e2301f32e40 2245511014 C Bi:2:011:2 0 32 = ffffffff ffffffff ffffffff ffffffff ffffffff ffffffff ffffffff ffffffff
ffff8e2301f32e40 2245511022 S Bi:2:011:2 -115 32 <
ffff8e2301f326c0 2245514011 C Bi:2:011:2 0 32 = ffffffff ffffffff ffffffff ffffffff ffffffff ffffffff ffffffff ffffffff
ffff8e2301f326c0 2245514018 S Bi:2:011:2 -115 32 <
ffff8e2301f32e40 2245517068 C Bi:2:011:2 0 32 = ffffffff ffffffff ffffffff ffffffff ffffffff ffffffff ffffffff ffffffff
ffff8e2301f32e40 2245517073 S Bi:2:011:2 -115 32 <
ffff8e2301f326c0 2245519371 C Bi:2:011:2 0 4 = ffffffff
ffff8e2301f326c0 2245519375 S Bi:2:011:2 -115 32 <
ffff8e2301f32240 2245519679 S Bo:2:011:2 -115 4 = 526b8080
ffff8e2301f32240 2245519719 C Bo:2:011:2 0 4 >
ffff8e2301f32e40 2245523466 C Bi:2:011:2 0 32 = 526b8080 ffffffff ffffffff ffffffff ffffffff ffffffff ffffffff ffffffff
ffff8e2301f32e40 2245523472 S Bi:2:011:2 -115 32 <
ffff8e2301f326c0 2245526504 C Bi:2:011:2 0 32 = ffffffff ffffffff ffffffff ffffffff ffffffff ffffffff ffffffff ffffffff
ffff8e2301f326c0 2245526509 S Bi:2:011:2 -115 32 <
ffff8e2301f32e40 2245529572 C Bi:2:011:2 0 32 = ffffffff ffffffff ffffffff ffffffff ffffffff ffffffff ffffffff ffffffff
ffff8e2301f32e40 2245529576 S Bi:2:011:2 -115 32 <
ffff8e2301f326c0 2245532644 C Bi:2:011:2 0 32 = ffffffff ffffffff ffffffff ffffffff ffffffff ffffffff ffffffff ffffffff
ffff8e2301f326c0 2245532648 S Bi:2:011:2 -115 32 <
ffff8e2301f32e40 2245534979 C Bi:2:011:2 0 4 = ffffffff
ffff8e2301f32e40 2245534983 S Bi:2:011:2 -115 32 <
ffff8e2301f32240 2245535234 S Bo:2:011:2 -115 4 = 526c0080
ffff8e2301f32240 2245535271 C Bo:2:011:2 0 4 >
ffff8e2301f326c0 2245539010 C Bi:2:011:2 0 32 = 526c0080 ffffffff ffffffff ffffffff ffffffff ffffffff ffffffff ffffffff
ffff8e2301f326c0 2245539015 S Bi:2:011:2 -115 32 <
ffff8e2301f32e40 2245542047 C Bi:2:011:2 0 32 = ffffffff ffffffff ffffffff ffffffff ffffffff ffffffff ffffffff ffffffff
ffff8e2301f32e40 2245542052 S Bi:2:011:2 -115 32 <
ffff8e2301f326c0 2245545115 C Bi:2:011:2 0 32 = ffffffff ffffffff ffffffff ffffffff ffffffff ffffffff ffffffff ffffffff
ffff8e2301f326c0 2245545120 S Bi:2:011:2 -115 32 <
ffff8e2301f32e40 2245548190 C Bi:2:011:2 0 32 = ffffffff ffffffff ffffffff ffffffff ffffffff ffffffff ffffffff ffffffff
ffff8e2301f32e40 2245548197 S Bi:2:011:2 -115 32 <
ffff8e2301f326c0 2245550569 C Bi:2:011:2 0 4 = ffffffff
ffff8e2301f326c0 2245550573 S Bi:2:011:2 -115 32 <
ffff8e2301f32240 2245550826 S Bo:2:011:2 -115 4 = 526c8080
ffff8e2301f32240 2245550866 C Bo:2:011:2 0 4 >
ffff8e2301f32e40 2245554577 C Bi:2:011:2 0 32 = 526c8080 ffffffff ffffffff ffffffff ffffffff ffffffff ffffffff ffffffff
ffff8e2301f32e40 2245554583 S Bi:2:011:2 -115 32 <
ffff8e2301f326c0 2245557621 C Bi:2:011:2 0 32 = ffffffff ffffffff ffffffff ffffffff ffffffff ffffffff ffffffff ffffffff
ffff8e2301f326c0 2245557628 S Bi:2:011:2 -115 32 <
ffff8e2301f32e40 2245560687 C Bi:2:011:2 0 32 = ffffffff ffffffff ffffffff ffffffff ffffffff ffffffff ffffffff ffffffff
ffff8e2301f32e40 2245560691 S Bi:2:011:2 -115 32 <
ffff8e2301f326c0 2245563782 C Bi:2:011:2 0 32 = ffffffff ffffffff ffffffff ffffffff ffffffff ffffffff ffffffff ffffffff
ffff8e2301f326c0 2245563788 S Bi:2:011:2 -115 32 <
ffff8e2301f32e40 2245566069 C Bi:2:011:2 0 4 = ffffffff
ffff8e2301f32e40 2245566073 S Bi:2:011:2 -115 32 <
ffff8e2301f32240 2245566417 S Bo:2:011:2 -115 4 = 526d0080
ffff8e2301f32240 2245566456 C Bo:2:011:2 0 4 >
ffff8e2301f326c0 2245570190 C Bi:2:011:2 0 32 = 526d0080 ffffffff ffffffff ffffffff ffffffff ffffffff ffffffff ffffffff
ffff8e2301f326c0 2245570196 S Bi:2:011:2 -115 32 <
ffff8e2301f32e40 2245573260 C Bi:2:011:2 0 32 = ffffffff ffffffff ffffffff ffffffff ffffffff ffffffff ffffffff ffffffff
ffff8e2301f32e40 2245573266 S Bi:2:011:2 -115 32 <
ffff8e2301f326c0 2245576325 C Bi:2:011:2 0 32 = ffffffff ffffffff ffffffff ffffffff ffffffff ffffffff ffffffff ffffffff
ffff8e2301f326c0 2245576329 S Bi:2:011:2 -115 32 <
ffff8e2301f32e40 2245579346 C Bi:2:011:2 0 32 = ffffffff ffffffff ffffffff ffffffff ffffffff ffffffff ffffffff ffffffff
ffff8e2301f32e40 2245579350 S Bi:2:011:2 -115 32 <
ffff8e2301f326c0 2245581766 C Bi:2:011:2 0 4 = ffffffff
ffff8e2301f326c0 2245581774 S Bi:2:011:2 -115 32 <
ffff8e2301f32240 2245582165 S Bo:2:011:2 -115 4 = 526d8080
ffff8e2301f32240 2245582209 C Bo:2:011:2 0 4 >
ffff8e2301f32e40 2245585908 C Bi:2:011:2 0 32 = 526d8080 ffffffff ffffffff ffffffff ffffffff ffffffff ffffffff ffffffff
ffff8e2301f32e40 2245585915 S Bi:2:011:2 -115 32 <
ffff8e2301f326c0 2245589014 C Bi:2:011:2 0 32 = ffffffff ffffffff ffffffff ffffffff ffffffff ffffffff ffffffff ffffffff
ffff8e2301f326c0 2245589020 S Bi:2:011:2 -115 32 <
ffff8e2301f32e40 2245592048 C Bi:2:011:2 0 32 = ffffffff ffffffff ffffffff ffffffff ffffffff ffffffff ffffffff ffffffff
ffff8e2301f32e40 2245592052 S Bi:2:011:2 -115 32 <
ffff8e2301f326c0 2245595118 C Bi:2:011:2 0 32 = ffffffff ffffffff ffffffff ffffffff ffffffff ffffffff ffffffff ffffffff
ffff8e2301f326c0 2245595123 S Bi:2:011:2 -115 32 <
ffff8e2301f32e40 2245597423 C Bi:2:011:2 0 4 = ffffffff
ffff8e2301f32e40 2245597427 S Bi:2:011:2 -115 32 <
ffff8e2301f32240 2245597779 S Bo:2:011:2 -115 4 = 526e0080
ffff8e2301f32240 2245597817 C Bo:2:011:2 0 4 >
ffff8e2301f326c0 2245601530 C Bi:2:011:2 0 32 = 526e0080 ffffffff ffffffff ffffffff ffffffff ffffffff ffffffff ffffffff
ffff8e2301f326c0 2245601535 S Bi:2:011:2 -115 32 <
ffff8e2301f32e40 2245604624 C Bi:2:011:2 0 32 = ffffffff ffffffff ffffffff ffffffff ffffffff ffffffff ffffffff ffffffff
ffff8e2301f32e40 2245604629 S Bi:2:011:2 -115 32 <
ffff8e2301f326c0 2245607664 C Bi:2:011:2 0 32 = ffffffff ffffffff ffffffff ffffffff ffffffff ffffffff ffffffff ffffffff
ffff8e2301f326c0 2245607670 S Bi:2:011:2 -115 32 <
ffff8e2301f32e40 2245610762 C Bi:2:011:2 0 32 = ffffffff ffffffff ffffffff ffffffff ffffffff ffffffff ffffffff ffffffff
ffff8e2301f32e40 2245610768 S Bi:2:011:2 -115 32 <
ffff8e2301f326c0 2245613123 C Bi:2:011:2 0 4 = ffffffff
ffff8e2301f326c0 2245613130 S Bi:2:011:2 -115 32 <
ffff8e2301f32240 2245613461 S Bo:2:011:2 -115 4 = 526e8080
ffff8e2301f32240 2245613530 C Bo:2:011:2 0 4 >
ffff8e2301f32e40 2245617239 C Bi:2:011:2 0 32 = 526e8080 ffffffff ffffffff ffffffff ffffffff ffffffff ffffffff ffffffff
ffff8e2301f32e40 2245617245 S Bi:2:011:2 -115 32 <
ffff8e2301f326c0 2245620283 C Bi:2:011:2 0 32 = ffffffff ffffffff ffffffff ffffffff ffffffff ffffffff ffffffff ffffffff
ffff8e2301f326c0 2245620289 S Bi:2:011:2 -115 32 <
ffff8e2301f32e40 2245623379 C Bi:2:011:2 0 32 = ffffffff ffffffff ffffffff ffffffff ffffffff ffffffff ffffffff ffffffff
ffff8e2301f32e40 2245623385 S Bi:2:011:2 -115 32 <
ffff8e2301f326c0 2245626440 C Bi:2:011:2 0 32 = ffffffff ffffffff ffffffff ffffffff ffffffff ffffffff ffffffff ffffffff
ffff8e2301f326c0 2245626446 S Bi:2:011:2 -115 32 <
ffff8e2301f32e40 2245628831 C Bi:2:011:2 0 4 = ffffffff
ffff8e2301f32e40 2245628837 S Bi:2:011:2 -115 32 <
ffff8e2301f32240 2245629154 S Bo:2:011:2 -115 4 = 526f0080
ffff8e2301f32240 2245629223 C Bo:2:011:2 0 4 >
ffff8e2301f326c0 2245632911 C Bi:2:011:2 0 32 = 526f0080 ffffffff ffffffff ffffffff ffffffff ffffffff ffffffff ffffffff
ffff8e2301f326c0 2245632918 S Bi:2:011:2 -115 32 <
ffff8e2301f32e40 2245636031 C Bi:2:011:2 0 32 = ffffffff ffffffff ffffffff ffffffff ffffffff ffffffff ffffffff ffffffff
ffff8e2301f32e40 2245636037 S Bi:2:011:2 -115 32 <
ffff8e2301f326c0 2245639047 C Bi:2:011:2 0 32 = ffffffff ffffffff ffffffff ffffffff ffffffff ffffffff ffffffff ffffffff
ffff8e2301f326c0 2245639055 S Bi:2:011:2 -115 32 <
ffff8e2301f32e40 2245642094 C Bi:2:011:2 0 32 = ffffffff 77573402 77573402 00000000 00000004 ffffffff 11146230 63ffffff
ffff8e2301f32e40 2245642100 S Bi:2:011:2 -115 32 <
ffff8e2301f326c0 2245644514 C Bi:2:011:2 0 4 = ffffffff
ffff8e2301f326c0 2245644520 S Bi:2:011:2 -115 32 <
ffff8e2301f32240 2245644818 S Bo:2:011:2 -115 4 = 526f8080
ffff8e2301f32240 2245644856 C Bo:2:011:2 0 4 >
ffff8e2301f32e40 2245648555 C Bi:2:011:2 0 32 = 526f8080 77473402 77473402 00000000 00000004 ffffffff 11146230 60ffffff
ffff8e2301f32e40 2245648561 S Bi:2:011:2 -115 32 <
ffff8e2301f326c0 2245651641 C Bi:2:011:2 0 32 = ffffffff 77773402 77773402 00000000 00000004 ffffffff 11146230 61ffffff
ffff8e2301f326c0 2245651647 S Bi:2:011:2 -115 32 <
ffff8e2301f32e40 2245654716 C Bi:2:011:2 0 32 = ffffffff 77673402 77673402 00000000 00000004 ffffffff 11146230 66ffffff
ffff8e2301f32e40 2245654722 S Bi:2:011:2 -115 32 <
ffff8e2301f326c0 2245657808 C Bi:2:011:2 0 32 = ffffffff 77173402 77173402 00000000 00000004 ffffffff 11146230 67ffffff
ffff8e2301f326c0 2245657814 S Bi:2:011:2 -115 32 <
ffff8e2301f32e40 2245660162 C Bi:2:011:2 0 4 = ffffffff
ffff8e2301f32e40 2245660168 S Bi:2:011:2 -115 32 <
ffff8e2301f32240 2245660504 S Bo:2:011:2 -115 4 = 52700080
ffff8e2301f32240 2245660543 C Bo:2:011:2 0 4 >
ffff8e2301f326c0 2245664234 C Bi:2:011:2 0 32 = 52700080 77073402 77073402 00000000 00000004 ffffffff 11146230 64ffffff
ffff8e2301f326c0 2245664239 S Bi:2:011:2 -115 32 <
ffff8e2301f32e40 2245667304 C Bi:2:011:2 0 32 = ffffffff 77373402 77373402 00000000 00000004 ffffffff 11146230 65ffffff
ffff8e2301f32e40 2245667309 S Bi:2:011:2 -115 32 <
ffff8e2301f326c0 2245670372 C Bi:2:011:2 0 32 = ffffffff 77273402 77273402 00000000 00000004 ffffffff 11126230 6affffff
ffff8e2301f326c0 2245670378 S Bi:2:011:2 -115 32 <
ffff8e2301f32e40 2245673438 C Bi:2:011:2 0 32 = ffffffff 77d73402 77d73402 00000000 00000004 ffffffff 11146230 6bffffff
ffff8e2301f32e40 2245673442 S Bi:2:011:2 -115 32 <
ffff8e2301f326c0 2245675851 C Bi:2:011:2 0 4 = ffffffff
ffff8e2301f326c0 2245675857 S Bi:2:011:2 -115 32 <
ffff8e2301f32240 2245676157 S Bo:2:011:2 -115 4 = 52708080
ffff8e2301f32240 2245676195 C Bo:2:011:2 0 4 >
ffff8e2301f32e40 2245679885 C Bi:2:011:2 0 32 = 52708080 77c73402 77c73402 00000000 00000004 ffffffff 11146231 62ffffff
ffff8e2301f32e40 2245679890 S Bi:2:011:2 -115 32 <
ffff8e2301f326c0 2245683017 C Bi:2:011:2 0 32 = ffffffff 77573502 77573502 00000000 00000004 ffffffff 11146231 63ffffff
ffff8e2301f326c0 2245683022 S Bi:2:011:2 -115 32 <
ffff8e2301f32e40 2245686053 C Bi:2:011:2 0 32 = ffffffff 77473502 77473502 00000000 00000004 ffffffff 11146231 60ffffff
ffff8e2301f32e40 2245686062 S Bi:2:011:2 -115 32 <
ffff8e2301f326c0 2245689116 C Bi:2:011:2 0 32 = ffffffff 77773502 77773502 00000000 00000004 ffffffff 11146231 61ffffff
ffff8e2301f326c0 2245689121 S Bi:2:011:2 -115 32 <
ffff8e2301f32e40 2245691374 C Bi:2:011:2 0 4 = ffffffff
ffff8e2301f32e40 2245691378 S Bi:2:011:2 -115 32 <
ffff8e2301f32240 2245691656 S Bo:2:011:2 -115 4 = 52710080
ffff8e2301f32240 2245691696 C Bo:2:011:2 0 4 >
ffff8e2301f326c0 2245695390 C Bi:2:011:2 0 32 = 52710080 77673502 77673502 00000000 00000004 ffffffff 11146231 66ffffff
ffff8e2301f326c0 2245695393 S Bi:2:011:2 -115 32 <
ffff8e2301f32e40 2245698459 C Bi:2:011:2 0 32 = ffffffff 77173502 77173502 00000000 00000004 ffffffff 11146231 67ffffff
ffff8e2301f32e40 2245698463 S Bi:2:011:2 -115 32 <
ffff8e2301f326c0 2245701524 C Bi:2:011:2 0 32 = ffffffff 77073502 77073502 00000000 00000004 ffffffff 11146231 64ffffff
ffff8e2301f326c0 2245701528 S Bi:2:011:2 -115 32 <
ffff8e2301f32e40 2245704596 C Bi:2:011:2 0 32 = ffffffff 77373502 77373502 00000000 00000004 ffffffff 11146231 65ffffff
ffff8e2301f32e40 2245704600 S Bi:2:011:2 -115 32 <
ffff8e2301f326c0 2245706889 C Bi:2:011:2 0 4 = ffffffff
ffff8e2301f326c0 2245706892 S Bi:2:011:2 -115 32 <
ffff8e2301f32240 2245707195 S Bo:2:011:2 -115 4 = 52718080
ffff8e2301f32240 2245707232 C Bo:2:011:2 0 4 >
ffff8e2301f32e40 2245711011 C Bi:2:011:2 0 32 = 52718080 77273502 77273502 00000000 00000004 ffffffff 11146231 6affffff
ffff8e2301f32e40 2245711017 S Bi:2:011:2 -115 32 <
ffff8e2301f326c0 2245714016 C Bi:2:011:2 0 32 = ffffffff 77d73502 77d73502 00000000 00000004 ffffffff 11146231 6bffffff
ffff8e2301f326c0 2245714021 S Bi:2:011:2 -115 32 <
ffff8e2301f32e40 2245717071 C Bi:2:011:2 0 32 = ffffffff 77c73502 77c73502 00000000 00000004 ffffffff 11146232 62ffffff
ffff8e2301f32e40 2245717076 S Bi:2:011:2 -115 32 <
ffff8e2301f326c0 2245720138 C Bi:2:011:2 0 32 = ffffffff 77573a02 77573a02 00000000 00000004 ffffffff 11146232 63ffffff
ffff8e2301f326c0 2245720142 S Bi:2:011:2 -115 32 <
ffff8e2301f32e40 2245722397 C Bi:2:011:2 0 4 = ffffffff
ffff8e2301f32e40 2245722403 S Bi:2:011:2 -115 32 <
ffff8e2301f32240 2245722736 S Bo:2:011:2 -115 4 = 52720080
ffff8e2301f32240 2245722777 C Bo:2:011:2 0 4 >
ffff8e2301f326c0 2245726461 C Bi:2:011:2 0 32 = 52720080 77473a02 77473a02 00000000 00000004 ffffffff 11146232 60ffffff
ffff8e2301f326c0 2245726466 S Bi:2:011:2 -115 32 <
ffff8e2301f32e40 2245729529 C Bi:2:011:2 0 32 = ffffffff 77773a02 77773a02 00000000 00000004 ffffffff 11146232 61ffffff
ffff8e2301f32e40 2245729534 S Bi:2:011:2 -115 32 <
ffff8e2301f326c0 2245732639 C Bi:2:011:2 0 32 = ffffffff 77673a02 77673a02 00000000 00000004 ffffffff 11146232 66ffffff
ffff8e2301f326c0 2245732644 S Bi:2:011:2 -115 32 <
ffff8e2301f32e40 2245735713 C Bi:2:011:2 0 32 = ffffffff 77173a02 77173a02 00000000 00000004 ffffffff 11146232 67ffffff
ffff8e2301f32e40 2245735719 S Bi:2:011:2 -115 32 <
ffff8e2301f326c0 2245738072 C Bi:2:011:2 0 4 = ffffffff
ffff8e2301f326c0 2245738077 S Bi:2:011:2 -115 32 <
ffff8e2301f32240 2245738387 S Bo:2:011:2 -115 4 = 52728080
ffff8e2301f32240 2245738426 C Bo:2:011:2 0 4 >
ffff8e2301f32e40 2245742143 C Bi:2:011:2 0 32 = 52728080 77073a02 77073a02 00000000 00000004 ffffffff 11146232 64ffffff
ffff8e2301f32e40 2245742148 S Bi:2:011:2 -115 32 <
ffff8e2301f326c0 2245745191 C Bi:2:011:2 0 32 = ffffffff 77373a02 77373a02 00000000 00000004 ffffffff 11146232 65ffffff
ffff8e2301f326c0 2245745199 S Bi:2:011:2 -115 32 <
ffff8e2301f32e40 2245748280 C Bi:2:011:2 0 32 = ffffffff 77273a02 77273a02 00000000 00000004 ffffffff 11146232 6affffff
ffff8e2301f32e40 2245748286 S Bi:2:011:2 -115 32 <
ffff8e2301f326c0 2245751353 C Bi:2:011:2 0 32 = ffffffff 77d73a02 77d73a02 00000000 00000004 ffffffff 11146232 6bffffff
ffff8e2301f326c0 2245751359 S Bi:2:011:2 -115 32 <
ffff8e2301f32e40 2245753595 C Bi:2:011:2 0 4 = ffffffff
ffff8e2301f32e40 2245753600 S Bi:2:011:2 -115 32 <
ffff8e2301f32240 2245753908 S Bo:2:011:2 -115 4 = 52730080
ffff8e2301f32240 2245753991 C Bo:2:011:2 0 4 >
ffff8e2301f326c0 2245757691 C Bi:2:011:2 0 32 = 52730080 77c73a02 77c73a02 00000000 00000004 ffffffff 11146233 62ffffff
ffff8e2301f326c0 2245757697 S Bi:2:011:2 -115 32 <
ffff8e2301f32e40 2245760744 C Bi:2:011:2 0 32 = ffffffff 77573b02 77573b02 00000000 00000004 ffffffff 11146233 63ffffff
ffff8e2301f32e40 2245760749 S Bi:2:011:2 -115 32 <
ffff8e2301f326c0 2245763826 C Bi:2:011:2 0 32 = ffffffff 77473b02 77473b02 00000000 00000004 ffffffff 11146233 60ffffff
ffff8e2301f326c0 2245763830 S Bi:2:011:2 -115 32 <
ffff8e2301f32e40 2245766885 C Bi:2:011:2 0 32 = ffffffff 77773b02 77773b02 00000000 00000004 ffffffff 11146233 61ffffff
ffff8e2301f32e40 2245766889 S Bi:2:011:2 -115 32 <
ffff8e2301f326c0 2245769280 C Bi:2:011:2 0 4 = ffffffff
ffff8e2301f326c0 2245769285 S Bi:2:011:2 -115 32 <
ffff8e2301f32240 2245769593 S Bo:2:011:2 -115 4 = 52738080
ffff8e2301f32240 2245769631 C Bo:2:011:2 0 4 >
ffff8e2301f32e40 2245773377 C Bi:2:011:2 0 32 = 52738080 77673b02 77673b02 00000000 00000004 ffffffff 11146233 66ffffff
ffff8e2301f32e40 2245773383 S Bi:2:011:2 -115 32 <
ffff8e2301f326c0 2245776417 C Bi:2:011:2 0 32 = ffffffff 77173b02 77173b02 00000000 00000004 ffffffff 11146233 67ffffff
ffff8e2301f326c0 2245776422 S Bi:2:011:2 -115 32 <
ffff8e2301f32e40 2245779483 C Bi:2:011:2 0 32 = ffffffff 77073b02 77073b02 00000000 00000004 ffffffff 11146233 64ffffff
ffff8e2301f32e40 2245779487 S Bi:2:011:2 -115 32 <
ffff8e2301f326c0 2245782553 C Bi:2:011:2 0 32 = ffffffff 77373b02 77373b02 00000000 00000004 ffffffff 11146233 65ffffff
ffff8e2301f326c0 2245782558 S Bi:2:011:2 -115 32 <
ffff8e2301f32e40 2245784802 C Bi:2:011:2 0 4 = ffffffff
ffff8e2301f32e40 2245784806 S Bi:2:011:2 -115 32 <
ffff8e2301f32240 2245785129 S Bo:2:011:2 -115 4 = 52740080
ffff8e2301f32240 2245785168 C Bo:2:011:2 0 4 >
ffff8e2301f326c0 2245788898 C Bi:2:011:2 0 32 = 52740080 77273b02 77273b02 00000000 00000004 ffffffff 11146233 6affffff
ffff8e2301f326c0 2245788904 S Bi:2:011:2 -115 32 <
ffff8e2301f32e40 2245792049 C Bi:2:011:2 0 32 = ffffffff 77d73b02 77d73b02 00000000 00000004 ffffffff 11146233 6bffffff
ffff8e2301f32e40 2245792055 S Bi:2:011:2 -115 32 <
ffff8e2301f326c0 2245795009 C Bi:2:011:2 0 32 = ffffffff 77c73b02 77c73b02 00000000 00000004 ffffffff 11146234 62ffffff
ffff8e2301f326c0 2245795013 S Bi:2:011:2 -115 32 <
ffff8e2301f32e40 2245798093 C Bi:2:011:2 0 32 = ffffffff 00332b02 00332b02 00000000 00000004 ffffffff 11131254 726673ff
ffff8e2301f32e40 2245798096 S Bi:2:011:2 -115 32 <
ffff8e2301f326c0 2245800480 C Bi:2:011:2 0 4 = ffffffff
ffff8e2301f326c0 2245800484 S Bi:2:011:2 -115 32 <
ffff8e2301f32240 2245800846 S Bo:2:011:2 -115 4 = 52748080
ffff8e2301f32240 2245800885 C Bo:2:011:2 0 4 >
ffff8e2301f32e40 2245804600 C Bi:2:011:2 0 32 = 52748080 00232b02 00232b02 00000000 00000004 ffffffff 11131254 726670ff
ffff8e2301f32e40 2245804606 S Bi:2:011:2 -115 32 <
ffff8e2301f326c0 2245807663 C Bi:2:011:2 0 32 = ffffffff 00d32b02 00d32b02 00000000 00000004 ffffffff 11131254 726671ff
ffff8e2301f326c0 2245807668 S Bi:2:011:2 -115 32 <
ffff8e2301f32e40 2245810739 C Bi:2:011:2 0 32 = ffffffff 00533202 00533202 00000000 00000004 ffffffff 11131254 726676ff
ffff8e2301f32e40 2245810742 S Bi:2:011:2 -115 32 <
ffff8e2301f326c0 2245813778 C Bi:2:011:2 0 32 = ffffffff 00433202 00433202 00000000 00000004 ffffffff 11131254 726677ff
ffff8e2301f326c0 2245813781 S Bi:2:011:2 -115 32 <
ffff8e2301f32e40 2245816160 C Bi:2:011:2 0 4 = ffffffff
ffff8e2301f32e40 2245816163 S Bi:2:011:2 -115 32 <
ffff8e2301f32240 2245816516 S Bo:2:011:2 -115 4 = 52750080
ffff8e2301f32240 2245816557 C Bo:2:011:2 0 4 >
ffff8e2301f326c0 2245820309 C Bi:2:011:2 0 32 = 52750080 00733202 00733202 00000000 00000004 ffffffff 11131254 726674ff
ffff8e2301f326c0 2245820315 S Bi:2:011:2 -115 32 <
ffff8e2301f32e40 2245823350 C Bi:2:011:2 0 32 = ffffffff 00633202 00633202 00000000 00000004 ffffffff 11131254 726675ff
ffff8e2301f32e40 2245823356 S Bi:2:011:2 -115 32 <
ffff8e2301f326c0 2245826416 C Bi:2:011:2 0 32 = ffffffff 00033202 00033202 00000000 00000004 ffffffff 11131254 72667aff
ffff8e2301f326c0 2245826422 S Bi:2:011:2 -115 32 <
ffff8e2301f32e40 2245829485 C Bi:2:011:2 0 32 = ffffffff 00333202 00333202 00000000 00000004 ffffffff 11131254 72667bff
ffff8e2301f32e40 2245829492 S Bi:2:011:2 -115 32 <
ffff8e2301f326c0 2245831850 C Bi:2:011:2 0 4 = ffffffff
ffff8e2301f326c0 2245831856 S Bi:2:011:2 -115 32 <
ffff8e2301f32240 2245832215 S Bo:2:011:2 -115 4 = 52758080
ffff8e2301f32240 2245832254 C Bo:2:011:2 0 4 >
ffff8e2301f32e40 2245836068 C Bi:2:011:2 0 32 = 52758080 00233202 00233202 00000000 00000004 ffffffff 11131254 726772ff
ffff8e2301f32e40 2245836073 S Bi:2:011:2 -115 32 <
ffff8e2301f326c0 2245839028 C Bi:2:011:2 0 32 = ffffffff 00d33202 00d33202 00000000 00000004 ffffffff 11131254 726773ff
ffff8e2301f326c0 2245839034 S Bi:2:011:2 -115 32 <
ffff8e2301f32e40 2245842094 C Bi:2:011:2 0 32 = ffffffff 00533302 00533302 00000000 00000004 ffffffff 11131254 726770ff
ffff8e2301f32e40 2245842100 S Bi:2:011:2 -115 32 <
ffff8e2301f326c0 2245845163 C Bi:2:011:2 0 32 = ffffffff 00433302 00433302 00000000 00000004 ffffffff 11131254 726771ff
ffff8e2301f326c0 2245845168 S Bi:2:011:2 -115 32 <
ffff8e2301f32e40 2245847535 C Bi:2:011:2 0 4 = ffffffff
ffff8e2301f32e40 2245847542 S Bi:2:011:2 -115 32 <
ffff8e2301f32240 2245847866 S Bo:2:011:2 -115 4 = 52760080
ffff8e2301f32240 2245847970 C Bo:2:011:2 0 4 >
ffff8e2301f326c0 2245851692 C Bi:2:011:2 0 32 = 52760080 00733302 00733302 00000000 00000004 ffffffff 11131254 726776ff
ffff8e2301f326c0 2245851698 S Bi:2:011:2 -115 32 <
ffff8e2301f32e40 2245854736 C Bi:2:011:2 0 32 = ffffffff 00633302 00633302 00000000 00000004 ffffffff 11131254 726777ff
ffff8e2301f32e40 2245854742 S Bi:2:011:2 -115 32 <
ffff8e2301f326c0 2245857827 C Bi:2:011:2 0 32 = ffffffff 00033302 00033302 00000000 00000004 ffffffff 11131254 726774ff
ffff8e2301f326c0 2245857833 S Bi:2:011:2 -115 32 <
ffff8e2301f32e40 2245860900 C Bi:2:011:2 0 32 = ffffffff 00333302 00333302 00000000 00000004 ffffffff 11131254 726775ff
ffff8e2301f32e40 2245860917 S Bi:2:011:2 -115 32 <
ffff8e2301f326c0 2245863190 C Bi:2:011:2 0 4 = ffffffff
ffff8e2301f326c0 2245863196 S Bi:2:011:2 -115 32 <
ffff8e2301f32240 2245863512 S Bo:2:011:2 -115 4 = 52768080
ffff8e2301f32240 2245863585 C Bo:2:011:2 0 4 >
ffff8e2301f32e40 2245867260 C Bi:2:011:2 0 32 = 52768080 00233302 00233302 00000000 00000004 ffffffff 11131254 72677aff
ffff8e2301f32e40 2245867266 S Bi:2:011:2 -115 32 <
ffff8e2301f326c0 2245870351 C Bi:2:011:2 0 32 = ffffffff 00d33302 00d33302 00000000 00000004 ffffffff 11131254 72677bff
ffff8e2301f326c0 2245870357 S Bi:2:011:2 -115 32 <
ffff8e2301f32e40 2245873421 C Bi:2:011:2 0 32 = ffffffff 00533002 00533002 00000000 00000004 ffffffff 11131254 726472ff
ffff8e2301f32e40 2245873427 S Bi:2:011:2 -115 32 <
ffff8e2301f326c0 2245876462 C Bi:2:011:2 0 32 = ffffffff 00433002 00433002 00000000 00000004 ffffffff 11131254 726473ff
ffff8e2301f326c0 2245876468 S Bi:2:011:2 -115 32 <
ffff8e2301f32e40 2245878712 C Bi:2:011:2 0 4 = ffffffff
ffff8e2301f32e40 2245878717 S Bi:2:011:2 -115 32 <
ffff8e2301f32240 2245879084 S Bo:2:011:2 -115 4 = 52770080
ffff8e2301f32240 2245879121 C Bo:2:011:2 0 4 >
ffff8e2301f326c0 2245882836 C Bi:2:011:2 0 32 = 52770080 00733002 00733002 00000000 00000004 ffffffff 11131254 726470ff
ffff8e2301f326c0 2245882842 S Bi:2:011:2 -115 32 <
ffff8e2301f32e40 2245885899 C Bi:2:011:2 0 32 = ffffffff 00033002 00033002 00000000 00000004 ffffffff 11131254 726471ff
ffff8e2301f32e40 2245885905 S Bi:2:011:2 -115 32 <
ffff8e2301f326c0 2245889038 C Bi:2:011:2 0 32 = ffffffff 00633002 00633002 00000000 00000004 ffffffff 11131254 726476ff
ffff8e2301f326c0 2245889045 S Bi:2:011:2 -115 32 <
ffff8e2301f32e40 2245892050 C Bi:2:011:2 0 32 = ffffffff ffffffff ffffffff ffffffff ffffffff ffffffff ffffffff ffffffff
ffff8e2301f32e40 2245892056 S Bi:2:011:2 -115 32 <
ffff8e2301f326c0 2245894419 C Bi:2:011:2 0 4 = ffffffff
ffff8e2301f326c0 2245894425 S Bi:2:011:2 -115 32 <
ffff8e2301f32240 2245894716 S Bo:2:011:2 -115 4 = 52778080
ffff8e2301f32240 2245894754 C Bo:2:011:2 0 4 >
ffff8e2301f32e40 2245898489 C Bi:2:011:2 0 32 = 52778080 ffffffff ffffffff ffffffff ffffffff ffffffff ffffffff ffffffff
ffff8e2301f32e40 2245898495 S Bi:2:011:2 -115 32 <
ffff8e2301f326c0 2245901530 C Bi:2:011:2 0 32 = ffffffff ffffffff ffffffff ffffffff ffffffff ffffffff ffffffff ffffffff
ffff8e2301f326c0 2245901536 S Bi:2:011:2 -115 32 <
ffff8e2301f32e40 2245904640 C Bi:2:011:2 0 32 = ffffffff ffffffff ffffffff ffffffff ffffffff ffffffff ffffffff ffffffff
ffff8e2301f32e40 2245904647 S Bi:2:011:2 -115 32 <
ffff8e2301f326c0 2245907709 C Bi:2:011:2 0 32 = ffffffff ffffffff ffffffff ffffffff ffffffff ffffffff ffffffff ffffffff
ffff8e2301f326c0 2245907715 S Bi:2:011:2 -115 32 <
ffff8e2301f32e40 2245910019 C Bi:2:011:2 0 4 = ffffffff
ffff8e2301f32e40 2245910025 S Bi:2:011:2 -115 32 <
ffff8e2301f32240 2245910309 S Bo:2:011:2 -115 4 = 52780080
ffff8e2301f32240 2245910348 C Bo:2:011:2 0 4 >
ffff8e2301f326c0 2245914050 C Bi:2:011:2 0 32 = 52780080 ffffffff ffffffff ffffffff ffffffff ffffffff ffffffff ffffffff
ffff8e2301f326c0 2245914056 S Bi:2:011:2 -115 32 <
ffff8e2301f32e40 2245917118 C Bi:2:011:2 0 32 = ffffffff ffffffff ffffffff ffffffff ffffffff ffffffff ffffffff ffffffff
ffff8e2301f32e40 2245917124 S Bi:2:011:2 -115 32 <
ffff8e2301f326c0 2245920190 C Bi:2:011:2 0 32 = ffffffff ffffffff ffffffff ffffffff ffffffff ffffffff ffffffff ffffffff
ffff8e2301f326c0 2245920196 S Bi:2:011:2 -115 32 <
ffff8e2301f32e40 2245923262 C Bi:2:011:2 0 32 = ffffffff ffffffff ffffffff ffffffff ffffffff ffffffff ffffffff ffffffff
ffff8e2301f32e40 2245923267 S Bi:2:011:2 -115 32 <
ffff8e2301f326c0 2245925598 C Bi:2:011:2 0 4 = ffffffff
ffff8e2301f326c0 2245925604 S Bi:2:011:2 -115 32 <
ffff8e2301f32240 2245925888 S Bo:2:011:2 -115 4 = 52788080
ffff8e2301f32240 2245926002 C Bo:2:011:2 0 4 >
ffff8e2301f32e40 2245929691 C Bi:2:011:2 0 32 = 52788080 ffffffff ffffffff ffffffff ffffffff ffffffff ffffffff ffffffff
ffff8e2301f32e40 2245929697 S Bi:2:011:2 -115 32 <
ffff8e2301f326c0 2245932763 C Bi:2:011:2 0 32 = ffffffff ffffffff ffffffff ffffffff ffffffff ffffffff ffffffff ffffffff
ffff8e2301f326c0 2245932775 S Bi:2:011:2 -115 32 <
ffff8e2301f32e40 2245935856 C Bi:2:011:2 0 32 = ffffffff ffffffff ffffffff ffffffff ffffffff ffffffff ffffffff ffffffff
ffff8e2301f32e40 2245935865 S Bi:2:011:2 -115 32 <
ffff8e2301f326c0 2245938871 C Bi:2:011:2 0 32 = ffffffff ffffffff ffffffff ffffffff ffffffff ffffffff ffffffff ffffffff
ffff8e2301f326c0 2245938877 S Bi:2:011:2 -115 32 <
ffff8e2301f32e40 2245941292 C Bi:2:011:2 0 4 = ffffffff
ffff8e2301f32e40 2245941299 S Bi:2:011:2 -115 32 <
ffff8e2301f32240 2245941584 S Bo:2:011:2 -115 4 = 52790080
ffff8e2301f32240 2245941622 C Bo:2:011:2 0 4 >
ffff8e2301f326c0 2245945351 C Bi:2:011:2 0 32 = 52790080 ffffffff ffffffff ffffffff ffffffff ffffffff ffffffff ffffffff
ffff8e2301f326c0 2245945357 S Bi:2:011:2 -115 32 <
ffff8e2301f32e40 2245948417 C Bi:2:011:2 0 32 = ffffffff ffffffff ffffffff ffffffff ffffffff ffffffff ffffffff ffffffff
ffff8e2301f32e40 2245948424 S Bi:2:011:2 -115 32 <
ffff8e2301f326c0 2245951512 C Bi:2:011:2 0 32 = ffffffff ffffffff ffffffff ffffffff ffffffff ffffffff ffffffff ffffffff
ffff8e2301f326c0 2245951523 S Bi:2:011:2 -115 32 <
ffff8e2301f32e40 2245954566 C Bi:2:011:2 0 32 = ffffffff ffffffff ffffffff ffffffff ffffffff ffffffff ffffffff ffffffff
ffff8e2301f32e40 2245954572 S Bi:2:011:2 -115 32 <
ffff8e2301f326c0 2245956831 C Bi:2:011:2 0 4 = ffffffff
ffff8e2301f326c0 2245956842 S Bi:2:011:2 -115 32 <
ffff8e2301f32240 2245957177 S Bo:2:011:2 -115 4 = 52798080
ffff8e2301f32240 2245957217 C Bo:2:011:2 0 4 >
ffff8e2301f32e40 2245961017 C Bi:2:011:2 0 32 = 52798080 ffffffff ffffffff ffffffff ffffffff ffffffff ffffffff ffffffff
ffff8e2301f32e40 2245961024 S Bi:2:011:2 -115 32 <
ffff8e2301f326c0 2245964029 C Bi:2:011:2 0 32 = ffffffff ffffffff ffffffff ffffffff ffffffff ffffffff ffffffff ffffffff
ffff8e2301f326c0 2245964035 S Bi:2:011:2 -115 32 <
ffff8e2301f32e40 2245967074 C Bi:2:011:2 0 32 = ffffffff ffffffff ffffffff ffffffff ffffffff ffffffff ffffffff ffffffff
ffff8e2301f32e40 2245967080 S Bi:2:011:2 -115 32 <
ffff8e2301f326c0 2245970148 C Bi:2:011:2 0 32 = ffffffff ffffffff ffffffff ffffffff ffffffff ffffffff ffffffff ffffffff
ffff8e2301f326c0 2245970155 S Bi:2:011:2 -115 32 <
ffff8e2301f32e40 2245972486 C Bi:2:011:2 0 4 = ffffffff
ffff8e2301f32e40 2245972491 S Bi:2:011:2 -115 32 <
ffff8e2301f32240 2245972808 S Bo:2:011:2 -115 4 = 527a0080
ffff8e2301f32240 2245972877 C Bo:2:011:2 0 4 >
ffff8e2301f326c0 2245976578 C Bi:2:011:2 0 32 = 527a0080 ffffffff ffffffff ffffffff ffffffff ffffffff ffffffff ffffffff
ffff8e2301f326c0 2245976584 S Bi:2:011:2 -115 32 <
ffff8e2301f32e40 2245979647 C Bi:2:011:2 0 32 = ffffffff ffffffff ffffffff ffffffff ffffffff ffffffff ffffffff ffffffff
ffff8e2301f32e40 2245979653 S Bi:2:011:2 -115 32 <
ffff8e2301f326c0 2245982722 C Bi:2:011:2 0 32 = ffffffff ffffffff ffffffff ffffffff ffffffff ffffffff ffffffff ffffffff
ffff8e2301f326c0 2245982728 S Bi:2:011:2 -115 32 <
ffff8e2301f32e40 2245985765 C Bi:2:011:2 0 32 = ffffffff ffffffff ffffffff ffffffff ffffffff ffffffff ffffffff ffffffff
ffff8e2301f32e40 2245985771 S Bi:2:011:2 -115 32 <
ffff8e2301f326c0 2245987984 C Bi:2:011:2 0 4 = ffffffff
ffff8e2301f326c0 2245987990 S Bi:2:011:2 -115 32 <
ffff8e2301f32240 2245988299 S Bo:2:011:2 -115 4 = 527a8080
ffff8e2301f32240 2245988368 C Bo:2:011:2 0 4 >
ffff8e2301f32e40 2245992051 C Bi:2:011:2 0 32 = 527a8080 ffffffff ffffffff ffffffff ffffffff ffffffff ffffffff ffffffff
ffff8e2301f32e40 2245992057 S Bi:2:011:2 -115 32 <
ffff8e2301f326c0 2245995091 C Bi:2:011:2 0 32 = ffffffff ffffffff ffffffff ffffffff ffffffff ffffffff ffffffff ffffffff
ffff8e2301f326c0 2245995097 S Bi:2:011:2 -115 32 <
ffff8e2301f32e40 2245998193 C Bi:2:011:2 0 32 = ffffffff ffffffff ffffffff ffffffff ffffffff ffffffff ffffffff ffffffff
ffff8e2301f32e40 2245998201 S Bi:2:011:2 -115 32 <
ffff8e2301f326c0 2246001264 C Bi:2:011:2 0 32 = ffffffff ffffffff ffffffff ffffffff ffffffff ffffffff ffffffff ffffffff
ffff8e2301f326c0 2246001270 S Bi:2:011:2 -115 32 <
ffff8e2301f32e40 2246003544 C Bi:2:011:2 0 4 = ffffffff
ffff8e2301f32e40 2246003550 S Bi:2:011:2 -115 32 <
ffff8e2301f32240 2246003839 S Bo:2:011:2 -115 4 = 527b0080
ffff8e2301f32240 2246003907 C Bo:2:011:2 0 4 >
ffff8e2301f326c0 2246007601 C Bi:2:011:2 0 32 = 527b0080 ffffffff ffffffff ffffffff ffffffff ffffffff ffffffff ffffffff
ffff8e2301f326c0 2246007607 S Bi:2:011:2 -115 32 <
ffff8e2301f32e40 2246010671 C Bi:2:011:2 0 32 = ffffffff ffffffff ffffffff ffffffff ffffffff ffffffff ffffffff ffffffff
ffff8e2301f32e40 2246010676 S Bi:2:011:2 -115 32 <
ffff8e2301f326c0 2246013739 C Bi:2:011:2 0 32 = ffffffff ffffffff ffffffff ffffffff ffffffff ffffffff ffffffff ffffffff
ffff8e2301f326c0 2246013751 S Bi:2:011:2 -115 32 <
ffff8e2301f32e40 2246016809 C Bi:2:011:2 0 32 = ffffffff ffffffff ffffffff ffffffff ffffffff ffffffff ffffffff ffffffff
ffff8e2301f32e40 2246016819 S Bi:2:011:2 -115 32 <
ffff8e2301f326c0 2246019045 C Bi:2:011:2 0 4 = ffffffff
ffff8e2301f326c0 2246019055 S Bi:2:011:2 -115 32 <
ffff8e2301f32240 2246019319 S Bo:2:011:2 -115 4 = 527b8080
ffff8e2301f32240 2246019391 C Bo:2:011:2 0 4 >
ffff8e2301f32e40 2246023047 C Bi:2:011:2 0 32 = 527b8080 ffffffff ffffffff ffffffff ffffffff ffffffff ffffffff ffffffff
ffff8e2301f32e40 2246023054 S Bi:2:011:2 -115 32 <
ffff8e2301f326c0 2246026141 C Bi:2:011:2 0 32 = ffffffff ffffffff ffffffff ffffffff ffffffff ffffffff ffffffff ffffffff
ffff8e2301f326c0 2246026151 S Bi:2:011:2 -115 32 <
ffff8e2301f32e40 2246029213 C Bi:2:011:2 0 32 = ffffffff ffffffff ffffffff ffffffff ffffffff ffffffff ffffffff ffffffff
ffff8e2301f32e40 2246029223 S Bi:2:011:2 -115 32 <
ffff8e2301f326c0 2246032290 C Bi:2:011:2 0 32 = ffffffff ffffffff ffffffff ffffffff ffffffff ffffffff ffffffff ffffffff
ffff8e2301f326c0 2246032299 S Bi:2:011:2 -115 32 <
ffff8e2301f32e40 2246034532 C Bi:2:011:2 0 4 = ffffffff
ffff8e2301f32e40 2246034539 S Bi:2:011:2 -115 32 <
ffff8e2301f32240 2246034810 S Bo:2:011:2 -115 4 = 527c0080
ffff8e2301f32240 2246034848 C Bo:2:011:2 0 4 >
ffff8e2301f326c0 2246038583 C Bi:2:011:2 0 32 = 527c0080 ffffffff ffffffff ffffffff ffffffff ffffffff ffffffff ffffffff
ffff8e2301f326c0 2246038593 S Bi:2:011:2 -115 32 <
ffff8e2301f32e40 2246041619 C Bi:2:011:2 0 32 = ffffffff ffffffff ffffffff ffffffff ffffffff ffffffff ffffffff ffffffff
ffff8e2301f32e40 2246041626 S Bi:2:011:2 -115 32 <
ffff8e2301f326c0 2246044729 C Bi:2:011:2 0 32 = ffffffff ffffffff ffffffff ffffffff ffffffff ffffffff ffffffff ffffffff
ffff8e2301f326c0 2246044737 S Bi:2:011:2 -115 32 <
ffff8e2301f32e40 2246047766 C Bi:2:011:2 0 32 = ffffffff ffffffff ffffffff ffffffff ffffffff ffffffff ffffffff ffffffff
ffff8e2301f32e40 2246047772 S Bi:2:011:2 -115 32 <
ffff8e2301f326c0 2246050069 C Bi:2:011:2 0 4 = ffffffff
ffff8e2301f326c0 2246050075 S Bi:2:011:2 -115 32 <
ffff8e2301f32240 2246050350 S Bo:2:011:2 -115 4 = 527c8080
ffff8e2301f32240 2246050390 C Bo:2:011:2 0 4 >
ffff8e2301f32e40 2246054095 C Bi:2:011:2 0 32 = 527c8080 ffffffff ffffffff ffffffff ffffffff ffffffff ffffffff ffffffff
ffff8e2301f32e40 2246054101 S Bi:2:011:2 -115 32 <
ffff8e2301f326c0 2246057164 C Bi:2:011:2 0 32 = ffffffff ffffffff ffffffff ffffffff ffffffff ffffffff ffffffff ffffffff
ffff8e2301f326c0 2246057170 S Bi:2:011:2 -115 32 <
ffff8e2301f32e40 2246060237 C Bi:2:011:2 0 32 = ffffffff ffffffff ffffffff ffffffff ffffffff ffffffff ffffffff ffffffff
ffff8e2301f32e40 2246060243 S Bi:2:011:2 -115 32 <
ffff8e2301f326c0 2246063311 C Bi:2:011:2 0 32 = ffffffff ffffffff ffffffff ffffffff ffffffff ffffffff ffffffff ffffffff
ffff8e2301f326c0 2246063317 S Bi:2:011:2 -115 32 <
ffff8e2301f32e40 2246065554 C Bi:2:011:2 0 4 = ffffffff
ffff8e2301f32e40 2246065565 S Bi:2:011:2 -115 32 <
ffff8e2301f32240 2246065901 S Bo:2:011:2 -115 4 = 527d0080
ffff8e2301f32240 2246066015 C Bo:2:011:2 0 4 >
ffff8e2301f326c0 2246069694 C Bi:2:011:2 0 32 = 527d0080 ffffffff ffffffff ffffffff ffffffff ffffffff ffffffff ffffffff
ffff8e2301f326c0 2246069704 S Bi:2:011:2 -115 32 <
ffff8e2301f32e40 2246072765 C Bi:2:011:2 0 32 = ffffffff ffffffff ffffffff ffffffff ffffffff ffffffff ffffffff ffffffff
ffff8e2301f32e40 2246072775 S Bi:2:011:2 -115 32 <
ffff8e2301f326c0 2246075827 C Bi:2:011:2 0 32 = ffffffff ffffffff ffffffff ffffffff ffffffff ffffffff ffffffff ffffffff
ffff8e2301f326c0 2246075836 S Bi:2:011:2 -115 32 <
ffff8e2301f32e40 2246078899 C Bi:2:011:2 0 32 = ffffffff ffffffff ffffffff ffffffff ffffffff ffffffff ffffffff ffffffff
ffff8e2301f32e40 2246078905 S Bi:2:011:2 -115 32 <
ffff8e2301f326c0 2246081239 C Bi:2:011:2 0 4 = ffffffff
ffff8e2301f326c0 2246081250 S Bi:2:011:2 -115 32 <
ffff8e2301f32240 2246081590 S Bo:2:011:2 -115 4 = 527d8080
ffff8e2301f32240 2246081659 C Bo:2:011:2 0 4 >
ffff8e2301f32e40 2246085378 C Bi:2:011:2 0 32 = 527d8080 ffffffff ffffffff ffffffff ffffffff ffffffff ffffffff ffffffff
ffff8e2301f32e40 2246085389 S Bi:2:011:2 -115 32 <
ffff8e2301f326c0 2246088442 C Bi:2:011:2 0 32 = ffffffff ffffffff ffffffff ffffffff ffffffff ffffffff ffffffff ffffffff
ffff8e2301f326c0 2246088453 S Bi:2:011:2 -115 32 <
ffff8e2301f32e40 2246091513 C Bi:2:011:2 0 32 = ffffffff ffffffff ffffffff ffffffff ffffffff ffffffff ffffffff ffffffff
ffff8e2301f32e40 2246091524 S Bi:2:011:2 -115 32 <
ffff8e2301f326c0 2246094552 C Bi:2:011:2 0 32 = ffffffff ffffffff ffffffff ffffffff ffffffff ffffffff ffffffff ffffffff
ffff8e2301f326c0 2246094560 S Bi:2:011:2 -115 32 <
ffff8e2301f32e40 2246097012 C Bi:2:011:2 0 4 = ffffffff
ffff8e2301f32e40 2246097025 S Bi:2:011:2 -115 32 <
ffff8e2301f32240 2246097315 S Bo:2:011:2 -115 4 = 527e0080
ffff8e2301f32240 2246097354 C Bo:2:011:2 0 4 >
ffff8e2301f326c0 2246101074 C Bi:2:011:2 0 32 = 527e0080 ffffffff ffffffff ffffffff ffffffff ffffffff ffffffff ffffffff
ffff8e2301f326c0 2246101080 S Bi:2:011:2 -115 32 <
ffff8e2301f32e40 2246104147 C Bi:2:011:2 0 32 = ffffffff ffffffff ffffffff ffffffff ffffffff ffffffff ffffffff ffffffff
ffff8e2301f32e40 2246104154 S Bi:2:011:2 -115 32 <
ffff8e2301f326c0 2246107213 C Bi:2:011:2 0 32 = ffffffff ffffffff ffffffff ffffffff ffffffff ffffffff ffffffff ffffffff
ffff8e2301f326c0 2246107219 S Bi:2:011:2 -115 32 <
ffff8e2301f32e40 2246110287 C Bi:2:011:2 0 32 = ffffffff ffffffff ffffffff ffffffff ffffffff ffffffff ffffffff ffffffff
ffff8e2301f32e40 2246110297 S Bi:2:011:2 -115 32 <
ffff8e2301f326c0 2246112659 C Bi:2:011:2 0 4 = ffffffff
ffff8e2301f326c0 2246112670 S Bi:2:011:2 -115 32 <
ffff8e2301f32240 2246112966 S Bo:2:011:2 -115 4 = 527e8080
ffff8e2301f32240 2246113005 C Bo:2:011:2 0 4 >
ffff8e2301f32e40 2246116719 C Bi:2:011:2 0 32 = 527e8080 ffffffff ffffffff ffffffff ffffffff ffffffff ffffffff ffffffff
ffff8e2301f32e40 2246116730 S Bi:2:011:2 -115 32 <
ffff8e2301f326c0 2246119810 C Bi:2:011:2 0 32 = ffffffff ffffffff ffffffff ffffffff ffffffff ffffffff ffffffff ffffffff
ffff8e2301f326c0 2246119821 S Bi:2:011:2 -115 32 <
ffff8e2301f32e40 2246122828 C Bi:2:011:2 0 32 = ffffffff ffffffff ffffffff ffffffff ffffffff ffffffff ffffffff ffffffff
ffff8e2301f32e40 2246122835 S Bi:2:011:2 -115 32 <
ffff8e2301f326c0 2246126015 C Bi:2:011:2 0 32 = ffffffff ffffffff ffffffff ffffffff ffffffff ffffffff ffffffff ffffffff
ffff8e2301f326c0 2246126023 S Bi:2:011:2 -115 32 <
ffff8e2301f32e40 2246128305 C Bi:2:011:2 0 4 = ffffffff
ffff8e2301f32e40 2246128313 S Bi:2:011:2 -115 32 <
ffff8e2301f32240 2246128592 S Bo:2:011:2 -115 4 = 527f0080
ffff8e2301f32240 2246128662 C Bo:2:011:2 0 4 >
ffff8e2301f326c0 2246132327 C Bi:2:011:2 0 32 = 527f0080 ffffffff ffffffff ffffffff ffffffff ffffffff ffffffff ffffffff
ffff8e2301f326c0 2246132333 S Bi:2:011:2 -115 32 <
ffff8e2301f32e40 2246135401 C Bi:2:011:2 0 32 = ffffffff ffffffff ffffffff ffffffff ffffffff ffffffff ffffffff ffffffff
ffff8e2301f32e40 2246135413 S Bi:2:011:2 -115 32 <
ffff8e2301f326c0 2246138463 C Bi:2:011:2 0 32 = ffffffff ffffffff ffffffff ffffffff ffffffff ffffffff ffffffff ffffffff
ffff8e2301f326c0 2246138468 S Bi:2:011:2 -115 32 <
ffff8e2301f32e40 2246141560 C Bi:2:011:2 0 32 = ffffffff ffffffff ffffffff ffffffff ffffffff ffffffff ffffffff ffffffff
ffff8e2301f32e40 2246141567 S Bi:2:011:2 -115 32 <
ffff8e2301f326c0 2246143809 C Bi:2:011:2 0 4 = ffffffff
ffff8e2301f326c0 2246143815 S Bi:2:011:2 -115 32 <
ffff8e2301f32240 2246144175 S Bo:2:011:2 -115 4 = 527f8080
ffff8e2301f32240 2246144214 C Bo:2:011:2 0 4 >
ffff8e2301f32e40 2246148015 C Bi:2:011:2 0 32 = 527f8080 ffffffff ffffffff ffffffff ffffffff ffffffff ffffffff ffffffff
ffff8e2301f32e40 2246148022 S Bi:2:011:2 -115 32 <
ffff8e2301f326c0 2246151014 C Bi:2:011:2 0 32 = ffffffff ffffffff ffffffff ffffffff ffffffff ffffffff ffffffff ffffffff
ffff8e2301f326c0 2246151022 S Bi:2:011:2 -115 32 <
ffff8e2301f32e40 2246154052 C Bi:2:011:2 0 32 = ffffffff ffffffff ffffffff ffffffff ffffffff ffffffff ffffffff ffffffff
ffff8e2301f32e40 2246154058 S Bi:2:011:2 -115 32 <
ffff8e2301f326c0 2246157117 C Bi:2:011:2 0 32 = ffffffff ffffffff ffffffff ffffffff ffffffff ffffffff ffffffff ffffffff
ffff8e2301f326c0 2246157122 S Bi:2:011:2 -115 32 <
ffff8e2301f32e40 2246159510 C Bi:2:011:2 0 4 = ffffffff
ffff8e2301f32e40 2246159516 S Bi:2:011:2 -115 32 <
ffff8e2301f32240 2246159840 S Bo:2:011:2 -115 4 = 52800080
ffff8e2301f32240 2246159879 C Bo:2:011:2 0 4 >
ffff8e2301f326c0 2246163424 C Bi:2:011:2 0 32 = 52800080 56000001 50530000 00000000 ff5700ff 00004300 00000000 000000ff
ffff8e2301f326c0 2246163430 S Bi:2:011:2 -115 32 <
ffff8e2301f32e40 2246166464 C Bi:2:011:2 0 32 = ffffffff 56554701 50530000 00000000 ff5700ff 00004300 00000000 000000ff
ffff8e2301f32e40 2246166470 S Bi:2:011:2 -115 32 <
ffff8e2301f326c0 2246169529 C Bi:2:011:2 0 32 = ffffffff 56504b09 55530000 00000000 ff5700ff 00004300 00000000 000000ff
ffff8e2301f326c0 2246169534 S Bi:2:011:2 -115 32 <
ffff8e2301f32e40 2246172606 C Bi:2:011:2 0 32 = ffffffff ffffffff ffffffff ffffffff ffffffff ffffffff ffffffff ffffffff
ffff8e2301f32e40 2246172612 S Bi:2:011:2 -115 32 <
ffff8e2301f326c0 2246174850 C Bi:2:011:2 0 4 = ffffffff
ffff8e2301f326c0 2246174855 S Bi:2:011:2 -115 32 <
ffff8e2301f32240 2246175218 S Bo:2:011:2 -115 4 = 52900080
ffff8e2301f32240 2246175259 C Bo:2:011:2 0 4 >
ffff8e2301f32e40 2246178809 C Bi:2:011:2 0 32 = 52900080 53574005 53000000 00004300 56000000 000043ff 53000000 00005700
ffff8e2301f32e40 2246178815 S Bi:2:011:2 -115 32 <
ffff8e2301f326c0 2246181831 C Bi:2:011:2 0 32 = 00004000 5700ffff 00000000 00004302 54004303 ffffffff ffffffff ff00000b
ffff8e2301f326c0 2246181838 S Bi:2:011:2 -115 32 <
ffff8e2301f32e40 2246185014 C Bi:2:011:2 0 32 = 425e4104 545a450a 5b00ffff ffffffff ffffffff ffffffff ffffffff ffffffff
ffff8e2301f32e40 2246185020 S Bi:2:011:2 -115 32 <
ffff8e2301f326c0 2246188014 C Bi:2:011:2 0 32 = ffffffff ffffffff ffffffff ffffffff ffffffff ffffffff ffffffff ffffffff
ffff8e2301f326c0 2246188018 S Bi:2:011:2 -115 32 <
ffff8e2301f32e40 2246190348 C Bi:2:011:2 0 4 = ffffffff
ffff8e2301f32e40 2246190353 S Bi:2:011:2 -115 32 <
ffff8e2301f32240 2246190609 S Bo:2:011:2 -115 4 = 52a00080
ffff8e2301f32240 2246190648 C Bo:2:011:2 0 4 >
ffff8e2301f326c0 2246194373 C Bi:2:011:2 0 32 = 52a00080 53544104 57ff0001 53ffffff ffffffff ffffffff ffffffff ffffffff
ffff8e2301f326c0 2246194378 S Bi:2:011:2 -115 32 <
ffff8e2301f32e40 2246197445 C Bi:2:011:2 0 32 = ffffffff 53004300 5300ffff ffffffff ffffffff ffffffff ffffffff ffffffff
ffff8e2301f32e40 2246197452 S Bi:2:011:2 -115 32 <
ffff8e2301f326c0 2246200510 C Bi:2:011:2 0 32 = ffffffff ffffffff ffffffff ffffffff ffffffff ffffffff ffffffff ffffffff
ffff8e2301f326c0 2246200515 S Bi:2:011:2 -115 32 <
ffff8e2301f32e40 2246203574 C Bi:2:011:2 0 32 = ffffffff ffffffff ffffffff ffffffff ffffffff ffffffff ffffffff ffffffff
ffff8e2301f32e40 2246203579 S Bi:2:011:2 -115 32 <
ffff8e2301f326c0 2246205986 C Bi:2:011:2 0 4 = ffffffff
ffff8e2301f326c0 2246205992 S Bi:2:011:2 -115 32 <
ffff8e2301f32240 2246206273 S Bo:2:011:2 -115 4 = 52a08080
ffff8e2301f32240 2246206313 C Bo:2:011:2 0 4 >
ffff8e2301f32e40 2246210067 C Bi:2:011:2 0 32 = 52a08080 ffffffff ffffffff ffffffff ffffffff ffffffff ffffffff ffffffff
ffff8e2301f32e40 2246210072 S Bi:2:011:2 -115 32 <
ffff8e2301f326c0 2246213073 C Bi:2:011:2 0 32 = ffffffff ffffffff ffffffff ffffffff ffffffff ffffffff ffffffff ffffffff
ffff8e2301f326c0 2246213079 S Bi:2:011:2 -115 32 <
ffff8e2301f32e40 2246216139 C Bi:2:011:2 0 32 = ffffffff ffffffff ffffffff ffffffff ffffffff ffffffff ffffffff ffffffff
ffff8e2301f32e40 2246216143 S Bi:2:011:2 -115 32 <
ffff8e2301f326c0 2246219211 C Bi:2:011:2 0 32 = ffffffff ffffffff ffffffff ffffffff ffffffff ffffffff ffffffff ffffffff
ffff8e2301f326c0 2246219215 S Bi:2:011:2 -115 32 <
ffff8e2301f32e40 2246221553 C Bi:2:011:2 0 4 = ffffffff
ffff8e2301f32e40 2246221557 S Bi:2:011:2 -115 32 <
ffff8e2301f32240 2246221849 S Bo:2:011:2 -115 4 = 52a10080
ffff8e2301f32240 2246221886 C Bo:2:011:2 0 4 >
ffff8e2301f326c0 2246225575 C Bi:2:011:2 0 32 = 52a10080 ffffffff ffffffff ffffffff ffffffff ffffffff ffffffff ffffffff
ffff8e2301f326c0 2246225581 S Bi:2:011:2 -115 32 <
ffff8e2301f32e40 2246228641 C Bi:2:011:2 0 32 = ffffffff ffffffff ffffffff ffffffff ffffffff ffffffff ffffffff ffffffff
ffff8e2301f32e40 2246228647 S Bi:2:011:2 -115 32 <
ffff8e2301f326c0 2246231711 C Bi:2:011:2 0 32 = ffffffff ffffffff ffffffff ffffffff ffffffff ffffffff ffffffff ffffffff
ffff8e2301f326c0 2246231716 S Bi:2:011:2 -115 32 <
ffff8e2301f32e40 2246234785 C Bi:2:011:2 0 32 = ffffffff ffffffff ffffffff ffffffff ffffffff ffffffff ffffffff ffffffff
ffff8e2301f32e40 2246234790 S Bi:2:011:2 -115 32 <
ffff8e2301f326c0 2246237094 C Bi:2:011:2 0 4 = ffffffff
ffff8e2301f326c0 2246237099 S Bi:2:011:2 -115 32 <
ffff8e2301f32240 2246237416 S Bo:2:011:2 -115 4 = 52b00080
ffff8e2301f32240 2246237459 C Bo:2:011:2 0 4 >
ffff8e2301f32e40 2246240985 C Bi:2:011:2 0 32 = 52b00080 004fa022 ec75e026 2c719a27 4c7e1629 847f0000 00000000 00000000
ffff8e2301f32e40 2246240991 S Bi:2:011:2 -115 32 <
ffff8e2301f326c0 2246244052 C Bi:2:011:2 0 32 = 00000000 5100be08 50706226 486d7d2f 614e0a17 27413d1c 1a709e3c 2270aa03
ffff8e2301f326c0 2246244058 S Bi:2:011:2 -115 32 <
ffff8e2301f32e40 2246247119 C Bi:2:011:2 0 32 = f848321c 43444101 00527a04 00007a0b 56000053 59520000 c05d4600 00034f04
ffff8e2301f32e40 2246247123 S Bi:2:011:2 -115 32 <
ffff8e2301f326c0 2246250189 C Bi:2:011:2 0 32 = 00000815 56000081 47520000 a2434600 00475404 00009c19 56000079 70520000
ffff8e2301f326c0 2246250194 S Bi:2:011:2 -115 32 <
ffff8e2301f32e40 2246252449 C Bi:2:011:2 0 4 = f2744600
ffff8e2301f32e40 2246252453 S Bi:2:011:2 -115 32 <
ffff8e2301f32240 2246252746 S Bo:2:011:2 -115 4 = 52b08080
ffff8e2301f32240 2246252786 C Bo:2:011:2 0 4 >
ffff8e2301f326c0 2246256291 C Bi:2:011:2 0 32 = 52b08080 00456104 0000bf22 56000084 7e520000 a8654600 005e0000 00000000
ffff8e2301f326c0 2246256296 S Bi:2:011:2 -115 32 <
ffff8e2301f32e40 2246259352 C Bi:2:011:2 0 32 = 00000000 5100be08 50706226 486d7d2f 614e0a17 27413d1c 1a709e3c 2270aa03
ffff8e2301f32e40 2246259357 S Bi:2:011:2 -115 32 <
ffff8e2301f326c0 2246262417 C Bi:2:011:2 0 32 = f848321c 43444101 00527a04 00007a0b 56000053 59520000 c05d4600 00034f04
ffff8e2301f326c0 2246262422 S Bi:2:011:2 -115 32 <
ffff8e2301f32e40 2246265485 C Bi:2:011:2 0 32 = 00000815 56000081 47520000 a2434600 00475404 00009c19 56000079 70520000
ffff8e2301f32e40 2246265489 S Bi:2:011:2 -115 32 <
ffff8e2301f326c0 2246267763 C Bi:2:011:2 0 4 = f2744600
ffff8e2301f326c0 2246267768 S Bi:2:011:2 -115 32 <
ffff8e2301f32240 2246268069 S Bo:2:011:2 -115 4 = 52c00080
ffff8e2301f32240 2246268107 C Bo:2:011:2 0 4 >
ffff8e2301f32e40 2246271862 C Bi:2:011:2 0 32 = 52c00080 1a372f20 10372c64 21ffffff ffffffff 133f3062 333826ff ffffffff
ffff8e2301f32e40 2246271868 S Bi:2:011:2 -115 32 <
ffff8e2301f326c0 2246274873 C Bi:2:011:2 0 32 = ffffffff 1f373069 3c33ffff ffffffff ffffffff 021b10ff ffffffff ffffffff
ffff8e2301f326c0 2246274879 S Bi:2:011:2 -115 32 <
ffff8e2301f32e40 2246278013 C Bi:2:011:2 0 32 = ffffffff 6776076d 22223bff ffffffff ffffffff 6476076d 22223bff ffffffff
ffff8e2301f32e40 2246278018 S Bi:2:011:2 -115 32 <
ffff8e2301f326c0 2246281027 C Bi:2:011:2 0 32 = ffffffff 6576076d 22223bff ffffffff ffffffff 6a76076d 22223bff ffffffff
ffff8e2301f326c0 2246281032 S Bi:2:011:2 -115 32 <
ffff8e2301f32e40 2246283283 C Bi:2:011:2 0 4 = ffffffff
ffff8e2301f32e40 2246283287 S Bi:2:011:2 -115 32 <
ffff8e2301f32240 2246283592 S Bo:2:011:2 -115 4 = 52c08080
ffff8e2301f32240 2246283630 C Bo:2:011:2 0 4 >
ffff8e2301f326c0 2246287379 C Bi:2:011:2 0 32 = 52c08080 04373069 3d2331ff ffffffff ffffffff 1114ffff ffffffff ffffffff
ffff8e2301f326c0 2246287385 S Bi:2:011:2 -115 32 <
ffff8e2301f32e40 2246290425 C Bi:2:011:2 0 32 = ffffffff 08392c65 173a2776 3738ffff ffffffff 08392c65 0621276c 2433ffff
ffff8e2301f32e40 2246290431 S Bi:2:011:2 -115 32 <
ffff8e2301f326c0 2246293488 C Bi:2:011:2 0 32 = ffffffff 08392c65 063e2b72 2633276e ffffffff 08392c65 14393772 2633276e
ffff8e2301f326c0 2246293494 S Bi:2:011:2 -115 32 <
ffff8e2301f32e40 2246296550 C Bi:2:011:2 0 32 = ffffffff 08392c65 143f2474 37332cff ffffffff ffffffff ffffffff ffffffff
ffff8e2301f32e40 2246296554 S Bi:2:011:2 -115 32 <
ffff8e2301f326c0 2246298809 C Bi:2:011:2 0 4 = ffffffff
ffff8e2301f326c0 2246298814 S Bi:2:011:2 -115 32 <
ffff8e2301f32240 2246299191 S Bo:2:011:2 -115 4 = 52d00080
ffff8e2301f32240 2246299235 C Bo:2:011:2 0 4 >
ffff8e2301f32e40 2246303006 C Bi:2:011:2 0 32 = 52d00080 ffffffff ffffffff ffffffff ffffffff 15040741 06131154 721e0b54
ffff8e2301f32e40 2246303010 S Bi:2:011:2 -115 32 <
ffff8e2301f326c0 2246306018 C Bi:2:011:2 0 32 = ffffffff 10140134 ffffffff ffffffff ffffffff 11171249 06170eff ffffffff
ffff8e2301f326c0 2246306024 S Bi:2:011:2 -115 32 <
ffff8e2301f32e40 2246309074 C Bi:2:011:2 0 32 = ffffffff 111a0353 011f0120 141bffff ffffffff 02030e53 17ffffff ffffffff
ffff8e2301f32e40 2246309078 S Bi:2:011:2 -115 32 <
ffff8e2301f326c0 2246312145 C Bi:2:011:2 0 32 = ffffffff 1a130352 06761b4f 521d1148 ffffffff 11171249 06170e20 0b19104b
ffff8e2301f326c0 2246312152 S Bi:2:011:2 -115 32 <
ffff8e2301f32e40 2246314483 C Bi:2:011:2 0 4 = ffffffff
ffff8e2301f32e40 2246314488 S Bi:2:011:2 -115 32 <
ffff8e2301f32240 2246314739 S Bo:2:011:2 -115 4 = 52d08080
ffff8e2301f32240 2246314778 C Bo:2:011:2 0 4 >
ffff8e2301f326c0 2246318491 C Bi:2:011:2 0 32 = 52d08080 10140120 0b19104b ffffffff ffffffff ffffffff ffffffff ffffffff
ffff8e2301f326c0 2246318497 S Bi:2:011:2 -115 32 <
ffff8e2301f32e40 2246321543 C Bi:2:011:2 0 32 = ffffffff ffffffff ffffffff ffffffff ffffffff ffffffff ffffffff ffffffff
ffff8e2301f32e40 2246321552 S Bi:2:011:2 -115 32 <
ffff8e2301f326c0 2246324643 C Bi:2:011:2 0 32 = ffffffff ffffffff ffffffff ffffffff ffffffff ffffffff ffffffff ffffffff
ffff8e2301f326c0 2246324648 S Bi:2:011:2 -115 32 <
ffff8e2301f32e40 2246327743 C Bi:2:011:2 0 32 = ffffffff ffffffff ffffffff ffffffff ffffffff ffffffff ffffffff ffffffff
ffff8e2301f32e40 2246327750 S Bi:2:011:2 -115 32 <
ffff8e2301f326c0 2246329987 C Bi:2:011:2 0 4 = ffffffff
ffff8e2301f326c0 2246329993 S Bi:2:011:2 -115 32 <
ffff8e2301f32240 2246330354 S Bo:2:011:2 -115 4 = 52d10080
ffff8e2301f32240 2246330394 C Bo:2:011:2 0 4 >
ffff8e2301f32e40 2246334120 C Bi:2:011:2 0 32 = 52d10080 ffffffff ffffffff ffffffff ffffffff 52190f41 1c1f0320 1b1816ff
ffff8e2301f32e40 2246334126 S Bi:2:011:2 -115 32 <
ffff8e2301f326c0 2246337168 C Bi:2:011:2 0 32 = ffffffff 52190f41 1c1f0320 1b1816ff ffffffff 52190f41 1c1f0320 1b1816ff
ffff8e2301f326c0 2246337174 S Bi:2:011:2 -115 32 <
ffff8e2301f32e40 2246340236 C Bi:2:011:2 0 32 = ffffffff 10140120 01131056 1b1507ff ffffffff 10140120 01131056 1b1507ff
ffff8e2301f32e40 2246340242 S Bi:2:011:2 -115 32 <
ffff8e2301f326c0 2246343336 C Bi:2:011:2 0 32 = ffffffff 04196254 07040945 0bffffff ffffffff 111e0b4e 13761049 ffffffff
ffff8e2301f326c0 2246343344 S Bi:2:011:2 -115 32 <
ffff8e2301f32e40 2246345694 C Bi:2:011:2 0 4 = ffffffff
ffff8e2301f32e40 2246345700 S Bi:2:011:2 -115 32 <
ffff8e2302151980 2246346039 S Bo:2:002:2 -115 31 = 55534243 ac050000 00000000 00000600 00000000 00000000 00000000 000000
ffff8e2301f32240 2246346043 S Bo:2:011:2 -115 4 = 52d18080
ffff8e2302151980 2246346064 C Bo:2:002:2 0 31 >
ffff8e2302151980 2246346071 S Bi:2:002:1 -115 13 <
ffff8e2301f32240 2246346107 C Bo:2:011:2 0 4 >
ffff8e2302151980 2246346152 C Bi:2:002:1 0 13 = 55534253 ac050000 00000000 00
ffff8e2301f326c0 2246349812 C Bi:2:011:2 0 32 = 52d18080 111e0b4e 13761049 ffffffff ffffffff 04196241 1f131049 1117ffff
ffff8e2301f326c0 2246349818 S Bi:2:011:2 -115 32 <
ffff8e2301f32e40 2246352890 C Bi:2:011:2 0 32 = ffffffff 04196241 1f131049 1117ffff ffffffff 1c1e0920 18171241 1cffffff
ffff8e2301f32e40 2246352896 S Bi:2:011:2 -115 32 <
ffff8e2301f326c0 2246356018 C Bi:2:011:2 0 32 = ffffffff 05011420 061f0f45 72050b47 ffffffff 111e1720 061f0f45 72050b47
ffff8e2301f326c0 2246356024 S Bi:2:011:2 -115 32 <
ffff8e2301f32e40 2246359020 C Bi:2:011:2 0 32 = ffffffff 04196256 1b13164e 131bffff ffffffff 1003185a 1704ffff ffffffff
ffff8e2301f32e40 2246359028 S Bi:2:011:2 -115 32 <
ffff8e2301f326c0 2246361374 C Bi:2:011:2 0 4 = ffffffff
ffff8e2301f326c0 2246361380 S Bi:2:011:2 -115 32 <
ffff8e2301f32240 2246361756 S Bo:2:011:2 -115 4 = 52d20080
ffff8e2301f32240 2246361797 C Bo:2:011:2 0 4 >
ffff8e2301f32e40 2246365523 C Bi:2:011:2 0 32 = 52d20080 ffffffff ffffffff ffffffff ffffffff 011e034e 051f014b ffffffff
ffff8e2301f32e40 2246365528 S Bi:2:011:2 -115 32 <
ffff8e2301f326c0 2246368563 C Bi:2:011:2 0 32 = ffffffff 15170c44 1704ffff ffffffff ffffffff 1c131520 0b19104b ffffffff
ffff8e2301f326c0 2246368571 S Bi:2:011:2 -115 32 <
ffff8e2301f32e40 2246371626 C Bi:2:011:2 0 32 = ffffffff 011e034e 1c190c20 04190e4d ffffffff 52170420 04190e4d 1702ffff
ffff8e2301f32e40 2246371632 S Bi:2:011:2 -115 32 <
ffff8e2301f326c0 2246374766 C Bi:2:011:2 0 32 = ffffffff 011e034e 1c190c20 04190e4d ffffffff 15170c44 1704ffff ffffffff
ffff8e2301f326c0 2246374772 S Bi:2:011:2 -115 32 <
ffff8e2301f32e40 2246377054 C Bi:2:011:2 0 4 = ffffffff
ffff8e2301f32e40 2246377060 S Bi:2:011:2 -115 32 <
ffff8e2301f32240 2246377385 S Bo:2:011:2 -115 4 = 52d28080
ffff8e2301f32240 2246377423 C Bo:2:011:2 0 4 >
ffff8e2301f326c0 2246381148 C Bi:2:011:2 0 32 = 52d28080 011e034e 051f014b ffffffff ffffffff 1c131520 0b19104b ffffffff
ffff8e2301f326c0 2246381154 S Bi:2:011:2 -115 32 <
ffff8e2301f32e40 2246384219 C Bi:2:011:2 0 32 = ffffffff 1c131520 0b19104b ffffffff ffffffff 15170c44 1704ffff ffffffff
ffff8e2301f32e40 2246384225 S Bi:2:011:2 -115 32 <
ffff8e2301f326c0 2246387289 C Bi:2:011:2 0 32 = ffffffff 011e034e 051f014b ffffffff ffffffff 011e034e 1c190c20 04190e4d
ffff8e2301f326c0 2246387295 S Bi:2:011:2 -115 32 <
ffff8e2301f32e40 2246390328 C Bi:2:011:2 0 32 = ffffffff 1c131520 0b19104b ffffffff ffffffff 011e034e 051f014b ffffffff
ffff8e2301f32e40 2246390334 S Bi:2:011:2 -115 32 <
ffff8e2301f326c0 2246392743 C Bi:2:011:2 0 4 = ffffffff
ffff8e2301f326c0 2246392749 S Bi:2:011:2 -115 32 <
ffff8e2301f32240 2246393116 S Bo:2:011:2 -115 4 = 54000080
ffff8e2301f32240 2246393156 C Bo:2:011:2 0 4 >
ffff8e2301f32e40 2246396720 C Bi:2:011:2 0 32 = 54000080 53570002 50004f4e 00000057 00000000 00180d43 131a0e05 5100000d
ffff8e2301f32e40 2246396726 S Bi:2:011:2 -115 32 <
ffff8e2301f326c0 2246399768 C Bi:2:011:2 0 32 = 00004500 535700ff 00ff0000 50550049 521f1153 ff530b52 1b0511ff 57ffffff
ffff8e2301f326c0 2246399774 S Bi:2:011:2 -115 32 <
ffff8e2301f32e40 2246402810 C Bi:2:011:2 0 32 = ffffffff ffffffff ffffffff ffffffff ffff004e 1d1b0753 01170545 01ffffff
ffff8e2301f32e40 2246402816 S Bi:2:011:2 -115 32 <
ffff8e2301f326c0 2246405902 C Bi:2:011:2 0 32 = ffffffff ffffffff ffffffff ffffffff ffffffff ffffffff ffffff00 00000000
ffff8e2301f326c0 2246405908 S Bi:2:011:2 -115 32 <
ffff8e2301f32e40 2246408265 C Bi:2:011:2 0 4 = 00000000
ffff8e2301f32e40 2246408271 S Bi:2:011:2 -115 32 <
ffff8e2301f32240 2246408645 S Bo:2:011:2 -115 1 = 45
ffff8e2301f32240 2246408688 C Bo:2:011:2 0 1 >
ffff8e239bf93d40 2246408830 S Co:2:011:0 s 40 a4 ffff 0000 0000 0
ffff8e239bf93d40 2246408960 C Co:2:011:0 0 0
ffff8e2301f326c0 2246411073 C Bi:2:011:2 -2 0
ffff8e2301f32e40 2246411104 C Bi:2:011:2 -2 1 = 06
ffff8e2301f33b00 2246415133 C Ii:2:011:1 -2:1 0
ffff8e2302151980 2248394137 S Bo:2:002:2 -115 31 = 55534243 ad050000 00000000 00000600 00000000 00000000 00000000 000000
ffff8e2302151980 2248394200 C Bo:2:002:2 0 31 >
ffff8e2302151980 2248394212 S Bi:2:002:1 -115 13 <
ffff8e2302151980 2248394237 C Bi:2:002:1 0 13 = 55534253 ad050000 00000000 00
ffff8e2302151980 2250442128 S Bo:2:002:2 -115 31 = 55534243 ae050000 00000000 00000600 00000000 00000000 00000000 000000
ffff8e2302151980 2250442161 C Bo:2:002:2 0 31 >
ffff8e2302151980 2250442173 S Bi:2:002:1 -115 13 <
ffff8e2302151980 2250442201 C Bi:2:002:1 0 13 = 55534253 ae050000 00000000 00
ffff8e2303c4c540 2252270134 C Ii:2:008:1 0:1 7 = 020016f0 ff0000
ffff8e2303c4c540 2252270158 S Ii:2:008:1 -115:1 8 <
ffff8e2303c4c540 2252278119 C Ii:2:008:1 0:1 7 = 020031e0 ff0000
ffff8e2303c4c540 2252278137 S Ii:2:008:1 -115:1 8 <
ffff8e2303c4c540 2252286119 C Ii:2:008:1 0:1 7 = 02004db0 ff0000
ffff8e2303c4c540 2252286136 S Ii:2:008:1 -115:1 8 <
ffff8e2303c4c540 2252294119 C Ii:2:008:1 0:1 7 = 020065a0 ff0000
ffff8e2303c4c540 2252294136 S Ii:2:008:1 -115:1 8 <
ffff8e2303c4c540 2252302117 C Ii:2:008:1 0:1 7 = 020060a0 ff0000
ffff8e2303c4c540 2252302134 S Ii:2:008:1 -115:1 8 <
ffff8e2303c4c540 2252310091 C Ii:2:008:1 0:1 7 = 020045a0 ff0000
ffff8e2303c4c540 2252310107 S Ii:2:008:1 -115:1 8 <
ffff8e2303c4c540 2252318091 C Ii:2:008:1 0:1 7 = 020027b0 ff0000
ffff8e2303c4c540 2252318107 S Ii:2:008:1 -115:1 8 <
ffff8e2303c4c540 2252326090 C Ii:2:008:1 0:1 7 = 02000dd0 ff0000
ffff8e2303c4c540 2252326108 S Ii:2:008:1 -115:1 8 <
ffff8e2303c4c540 2252334091 C Ii:2:008:1 0:1 7 = 0200f6ff ff0000
ffff8e2303c4c540 2252334106 S Ii:2:008:1 -115:1 8 <
ffff8e2303c4c540 2252342120 C Ii:2:008:1 0:1 7 = 0200edff ff0000
ffff8e2303c4c540 2252342138 S Ii:2:008:1 -115:1 8 <
ffff8e2303c4c540 2252350120 C Ii:2:008:1 0:1 7 = 0200e30f 000000
ffff8e2303c4c540 2252350137 S Ii:2:008:1 -115:1 8 <
ffff8e2303c4c540 2252358118 C Ii:2:008:1 0:1 7 = 0200dcff ff0000
ffff8e2303c4c540 2252358135 S Ii:2:008:1 -115:1 8 <
ffff8e2303c4c540 2252366119 C Ii:2:008:1 0:1 7 = 0200d6ff ff0000
ffff8e2303c4c540 2252366136 S Ii:2:008:1 -115:1 8 <
ffff8e2303c4c540 2252374120 C Ii:2:008:1 0:1 7 = 0200cfdf ff0000
ffff8e2303c4c540 2252374139 S Ii:2:008:1 -115:1 8 <
ffff8e2303c4c540 2252382120 C Ii:2:008:1 0:1 7 = 0200c8df ff0000
ffff8e2303c4c540 2252382137 S Ii:2:008:1 -115:1 8 <
ffff8e2303c4c540 2252390118 C Ii:2:008:1 0:1 7 = 0200c4df ff0000
ffff8e2303c4c540 2252390136 S Ii:2:008:1 -115:1 8 <
ffff8e2303c4c540 2252398091 C Ii:2:008:1 0:1 7 = 0200bfdf ff0000
ffff8e2303c4c540 2252398108 S Ii:2:008:1 -115:1 8 <
ffff8e2303c4c540 2252406120 C Ii:2:008:1 0:1 7 = 0200c1ef ff0000
ffff8e2303c4c540 2252406136 S Ii:2:008:1 -115:1 8 <
ffff8e2303c4c540 2252414119 C Ii:2:008:1 0:1 7 = 0200c3ff ff0000
ffff8e2303c4c540 2252414137 S Ii:2:008:1 -115:1 8 <
ffff8e2303c4c540 2252422119 C Ii:2:008:1 0:1 7 = 0200c6ff ff0000
ffff8e2303c4c540 2252422135 S Ii:2:008:1 -115:1 8 <
ffff8e2303c4c540 2252430120 C Ii:2:008:1 0:1 7 = 0200ca0f 000000
ffff8e2303c4c540 2252430137 S Ii:2:008:1 -115:1 8 <
ffff8e2303c4c540 2252438131 C Ii:2:008:1 0:1 7 = 0200cb0f 000000
ffff8e2303c4c540 2252438147 S Ii:2:008:1 -115:1 8 <
ffff8e2303c4c540 2252446121 C Ii:2:008:1 0:1 7 = 0200cbef ff0000
ffff8e2303c4c540 2252446138 S Ii:2:008:1 -115:1 8 <
ffff8e2303c4c540 2252454121 C Ii:2:008:1 0:1 7 = 0200c8bf ff0000
ffff8e2303c4c540 2252454137 S Ii:2:008:1 -115:1 8 <
ffff8e2303c4c540 2252462093 C Ii:2:008:1 0:1 7 = 0200c29f ff0000
ffff8e2303c4c540 2252462110 S Ii:2:008:1 -115:1 8 <
ffff8e2303c4c540 2252470130 C Ii:2:008:1 0:1 7 = 0200bb6f ff0000
ffff8e2303c4c540 2252470146 S Ii:2:008:1 -115:1 8 <
ffff8e2303c4c540 2252478130 C Ii:2:008:1 0:1 7 = 0200b37f ff0000
ffff8e2303c4c540 2252478146 S Ii:2:008:1 -115:1 8 <
ffff8e2303c4c540 2252486121 C Ii:2:008:1 0:1 7 = 0200ae8f ff0000
ffff8e2303c4c540 2252486138 S Ii:2:008:1 -115:1 8 <
ffff8e2302151980 2252490126 S Bo:2:002:2 -115 31 = 55534243 af050000 00000000 00000600 00000000 00000000 00000000 000000
ffff8e2302151980 2252490186 C Bo:2:002:2 0 31 >
ffff8e2302151980 2252490197 S Bi:2:002:1 -115 13 <
ffff8e2302151980 2252490225 C Bi:2:002:1 0 13 = 55534253 af050000 00000000 00
ffff8e2303c4c540 2252494128 C Ii:2:008:1 0:1 7 = 0200acaf ff0000
ffff8e2303c4c540 2252494145 S Ii:2:008:1 -115:1 8 <
ffff8e2303c4c540 2252502121 C Ii:2:008:1 0:1 7 = 0200b0ef ff0000
ffff8e2303c4c540 2252502137 S Ii:2:008:1 -115:1 8 <
ffff8e2303c4c540 2252510092 C Ii:2:008:1 0:1 7 = 0200b72f 000000
ffff8e2303c4c540 2252510108 S Ii:2:008:1 -115:1 8 <
ffff8e2303c4c540 2252518135 C Ii:2:008:1 0:1 7 = 0200c19f 000000
ffff8e2303c4c540 2252518153 S Ii:2:008:1 -115:1 8 <
ffff8e2303c4c540 2252526132 C Ii:2:008:1 0:1 7 = 0200cddf 000000
ffff8e2303c4c540 2252526148 S Ii:2:008:1 -115:1 8 <
ffff8e2303c4c540 2252534092 C Ii:2:008:1 0:1 7 = 0200d84f 010000
ffff8e2303c4c540 2252534107 S Ii:2:008:1 -115:1 8 <
ffff8e2303c4c540 2252542122 C Ii:2:008:1 0:1 7 = 0200e08f 010000
ffff8e2303c4c540 2252542139 S Ii:2:008:1 -115:1 8 <
ffff8e2303c4c540 2252550121 C Ii:2:008:1 0:1 7 = 0200e9ff 010000
ffff8e2303c4c540 2252550137 S Ii:2:008:1 -115:1 8 <
ffff8e2303c4c540 2252558134 C Ii:2:008:1 0:1 7 = 0200f06f 020000
ffff8e2303c4c540 2252558151 S Ii:2:008:1 -115:1 8 <
ffff8e2303c4c540 2252566119 C Ii:2:008:1 0:1 7 = 0200f4bf 020000
ffff8e2303c4c540 2252566136 S Ii:2:008:1 -115:1 8 <
ffff8e2303c4c540 2252574120 C Ii:2:008:1 0:1 7 = 0200fa2f 030000
ffff8e2303c4c540 2252574138 S Ii:2:008:1 -115:1 8 <
ffff8e2303c4c540 2252582120 C Ii:2:008:1 0:1 7 = 0200fe8f 030000
ffff8e2303c4c540 2252582139 S Ii:2:008:1 -115:1 8 <
ffff8e2303c4c540 2252590120 C Ii:2:008:1 0:1 7 = 020005d0 030000
ffff8e2303c4c540 2252590137 S Ii:2:008:1 -115:1 8 <
ffff8e2303c4c540 2252598127 C Ii:2:008:1 0:1 7 = 02000bf0 030000
ffff8e2303c4c540 2252598143 S Ii:2:008:1 -115:1 8 <
ffff8e2303c4c540 2252606129 C Ii:2:008:1 0:1 7 = 02001320 040000
ffff8e2303c4c540 2252606146 S Ii:2:008:1 -115:1 8 <
ffff8e2303c4c540 2252614119 C Ii:2:008:1 0:1 7 = 02001a10 040000
ffff8e2303c4c540 2252614137 S Ii:2:008:1 -115:1 8 <
ffff8e2303c4c540 2252622121 C Ii:2:008:1 0:1 7 = 020022f0 030000
ffff8e2303c4c540 2252622139 S Ii:2:008:1 -115:1 8 <
ffff8e2303c4c540 2252630120 C Ii:2:008:1 0:1 7 = 020027b0 030000
ffff8e2303c4c540 2252630137 S Ii:2:008:1 -115:1 8 <
ffff8e2303c4c540 2252638120 C Ii:2:008:1 0:1 7 = 02002d40 030000
ffff8e2303c4c540 2252638137 S Ii:2:008:1 -115:1 8 <
ffff8e2303c4c540 2252646128 C Ii:2:008:1 0:1 7 = 02003390 020000
ffff8e2303c4c540 2252646146 S Ii:2:008:1 -115:1 8 <
ffff8e2303c4c540 2252654121 C Ii:2:008:1 0:1 7 = 020036d0 010000
ffff8e2303c4c540 2252654138 S Ii:2:008:1 -115:1 8 <
ffff8e2303c4c540 2252662120 C Ii:2:008:1 0:1 7 = 02003d00 010000
ffff8e2303c4c540 2252662137 S Ii:2:008:1 -115:1 8 <
ffff8e2303c4c540 2252670119 C Ii:2:008:1 0:1 7 = 02004750 000000
ffff8e2303c4c540 2252670136 S Ii:2:008:1 -115:1 8 <
ffff8e2303c4c540 2252678122 C Ii:2:008:1 0:1 7 = 02004dc0 ff0000
ffff8e2303c4c540 2252678139 S Ii:2:008:1 -115:1 8 <
ffff8e2303c4c540 2252686094 C Ii:2:008:1 0:1 7 = 02005230 ff0000
ffff8e2303c4c540 2252686110 S Ii:2:008:1 -115:1 8 <
ffff8e2303c4c540 2252694093 C Ii:2:008:1 0:1 7 = 020054b0 fe0000
ffff8e2303c4c540 2252694109 S Ii:2:008:1 -115:1 8 <
ffff8e2303c4c540 2252702097 C Ii:2:008:1 0:1 7 = 02005140 fe0000
ffff8e2303c4c540 2252702114 S Ii:2:008:1 -115:1 8 <
ffff8e2303c4c540 2252710109 C Ii:2:008:1 0:1 7 = 02004bc0 fd0000
ffff8e2303c4c540 2252710126 S Ii:2:008:1 -115:1 8 <
ffff8e2303c4c540 2252718129 C Ii:2:008:1 0:1 7 = 02004260 fd0000
ffff8e2303c4c540 2252718145 S Ii:2:008:1 -115:1 8 <
ffff8e2303c4c540 2252726094 C Ii:2:008:1 0:1 7 = 020037e0 fc0000
ffff8e2303c4c540 2252726110 S Ii:2:008:1 -115:1 8 <
ffff8e2303c4c540 2252734094 C Ii:2:008:1 0:1 7 = 02002c70 fc0000
ffff8e2303c4c540 2252734111 S Ii:2:008:1 -115:1 8 <
ffff8e2303c4c540 2252742092 C Ii:2:008:1 0:1 7 = 02002410 fc0000
ffff8e2303c4c540 2252742107 S Ii:2:008:1 -115:1 8 <
ffff8e2303c4c540 2252750092 C Ii:2:008:1 0:1 7 = 02001cf0 fb0000
ffff8e2303c4c540 2252750109 S Ii:2:008:1 -115:1 8 <
ffff8e2303c4c540 2252758092 C Ii:2:008:1 0:1 7 = 02001700 fc0000
ffff8e2303c4c540 2252758108 S Ii:2:008:1 -115:1 8 <
ffff8e2303c4c540 2252766093 C Ii:2:008:1 0:1 7 = 02001330 fc0000
ffff8e2303c4c540 2252766108 S Ii:2:008:1 -115:1 8 <
ffff8e2303c4c540 2252774092 C Ii:2:008:1 0:1 7 = 02001170 fc0000
ffff8e2303c4c540 2252774109 S Ii:2:008:1 -115:1 8 <
ffff8e2303c4c540 2252782094 C Ii:2:008:1 0:1 7 = 02000f80 fc0000
ffff8e2303c4c540 2252782110 S Ii:2:008:1 -115:1 8 <
ffff8e2303c4c540 2252790094 C Ii:2:008:1 0:1 7 = 02000e90 fc0000
ffff8e2303c4c540 2252790110 S Ii:2:008:1 -115:1 8 <
ffff8e2303c4c540 2252798097 C Ii:2:008:1 0:1 7 = 02000aa0 fc0000
ffff8e2303c4c540 2252798117 S Ii:2:008:1 -115:1 8 <
ffff8e2303c4c540 2252806094 C Ii:2:008:1 0:1 7 = 020009e0 fc0000
ffff8e2303c4c540 2252806110 S Ii:2:008:1 -115:1 8 <
ffff8e2303c4c540 2252814095 C Ii:2:008:1 0:1 7 = 02000740 fd0000
ffff8e2303c4c540 2252814112 S Ii:2:008:1 -115:1 8 <
ffff8e2303c4c540 2252822120 C Ii:2:008:1 0:1 7 = 02000890 fd0000
ffff8e2303c4c540 2252822137 S Ii:2:008:1 -115:1 8 <
ffff8e2303c4c540 2252830098 C Ii:2:008:1 0:1 7 = 020008e0 fd0000
ffff8e2303c4c540 2252830114 S Ii:2:008:1 -115:1 8 <
ffff8e2303c4c540 2252838120 C Ii:2:008:1 0:1 7 = 02000920 fe0000
ffff8e2303c4c540 2252838137 S Ii:2:008:1 -115:1 8 <
ffff8e2303c4c540 2252846121 C Ii:2:008:1 0:1 7 = 02000960 fe0000
ffff8e2303c4c540 2252846138 S Ii:2:008:1 -115:1 8 <
ffff8e2303c4c540 2252854122 C Ii:2:008:1 0:1 7 = 02000980 fe0000
ffff8e2303c4c540 2252854139 S Ii:2:008:1 -115:1 8 <
ffff8e2303c4c540 2252862093 C Ii:2:008:1 0:1 7 = 020009b0 fe0000
ffff8e2303c4c540 2252862109 S Ii:2:008:1 -115:1 8 <
ffff8e2303c4c540 2252870120 C Ii:2:008:1 0:1 7 = 020009e0 fe0000
ffff8e2303c4c540 2252870136 S Ii:2:008:1 -115:1 8 <
ffff8e2303c4c540 2252878094 C Ii:2:008:1 0:1 7 = 02000900 ff0000
ffff8e2303c4c540 2252878111 S Ii:2:008:1 -115:1 8 <
ffff8e2303c4c540 2252886120 C Ii:2:008:1 0:1 7 = 02000a30 ff0000
ffff8e2303c4c540 2252886137 S Ii:2:008:1 -115:1 8 <
ffff8e2303c4c540 2252894130 C Ii:2:008:1 0:1 7 = 02000950 ff0000
ffff8e2303c4c540 2252894147 S Ii:2:008:1 -115:1 8 <
ffff8e2303c4c540 2252902122 C Ii:2:008:1 0:1 7 = 02000980 ff0000
ffff8e2303c4c540 2252902139 S Ii:2:008:1 -115:1 8 <
ffff8e2303c4c540 2252910121 C Ii:2:008:1 0:1 7 = 020007b0 ff0000
ffff8e2303c4c540 2252910138 S Ii:2:008:1 -115:1 8 <
ffff8e2303c4c540 2252918120 C Ii:2:008:1 0:1 7 = 020004d0 ff0000
ffff8e2303c4c540 2252918138 S Ii:2:008:1 -115:1 8 <
ffff8e2303c4c540 2252926129 C Ii:2:008:1 0:1 7 = 020001f0 ff0000
ffff8e2303c4c540 2252926145 S Ii:2:008:1 -115:1 8 <
ffff8e2303c4c540 2252958122 C Ii:2:008:1 0:1 7 = 020002e0 ff0000
ffff8e2303c4c540 2252958138 S Ii:2:008:1 -115:1 8 <
ffff8e2303c4c540 2252966131 C Ii:2:008:1 0:1 7 = 020002e0 ff0000
ffff8e2303c4c540 2252966148 S Ii:2:008:1 -115:1 8 <
ffff8e2303c4c540 2252974132 C Ii:2:008:1 0:1 7 = 020005e0 ff0000
ffff8e2303c4c540 2252974148 S Ii:2:008:1 -115:1 8 <
ffff8e2303c4c540 2252982122 C Ii:2:008:1 0:1 7 = 020006d0 ff0000
ffff8e2303c4c540 2252982139 S Ii:2:008:1 -115:1 8 <
ffff8e2303c4c540 2252990122 C Ii:2:008:1 0:1 7 = 020008d0 ff0000
ffff8e2303c4c540 2252990139 S Ii:2:008:1 -115:1 8 <
ffff8e2303c4c540 2252998123 C Ii:2:008:1 0:1 7 = 020007e0 ff0000
ffff8e2303c4c540 2252998139 S Ii:2:008:1 -115:1 8 <
ffff8e2303c4c540 2253006132 C Ii:2:008:1 0:1 7 = 020004d0 ff0000
ffff8e2303c4c540 2253006149 S Ii:2:008:1 -115:1 8 <
ffff8e2303c4c540 2253014130 C Ii:2:008:1 0:1 7 = 020002f0 ff0000
ffff8e2303c4c540 2253014146 S Ii:2:008:1 -115:1 8 <
ffff8e2303c4c540 2253046129 C Ii:2:008:1 0:1 7 = 02000100 000000
ffff8e2303c4c540 2253046145 S Ii:2:008:1 -115:1 8 <
ffff8e2303c4c540 2253054099 C Ii:2:008:1 0:1 7 = 020004e0 ff0000
ffff8e2303c4c540 2253054119 S Ii:2:008:1 -115:1 8 <
ffff8e2303c4c540 2253062094 C Ii:2:008:1 0:1 7 = 020004e0 ff0000
ffff8e2303c4c540 2253062110 S Ii:2:008:1 -115:1 8 <
ffff8e2303c4c540 2253070104 C Ii:2:008:1 0:1 7 = 020006e0 ff0000
ffff8e2303c4c540 2253070121 S Ii:2:008:1 -115:1 8 <
ffff8e2303c4c540 2253078095 C Ii:2:008:1 0:1 7 = 020007e0 ff0000
ffff8e2303c4c540 2253078112 S Ii:2:008:1 -115:1 8 <
ffff8e2303c4c540 2253086096 C Ii:2:008:1 0:1 7 = 020005f0 ff0000
ffff8e2303c4c540 2253086112 S Ii:2:008:1 -115:1 8 <
ffff8e2303c4c540 2253094096 C Ii:2:008:1 0:1 7 = 02000400 000000
ffff8e2303c4c540 2253094112 S Ii:2:008:1 -115:1 8 <
ffff8e2303c4c540 2253102095 C Ii:2:008:1 0:1 7 = 02000500 000000
ffff8e2303c4c540 2253102111 S Ii:2:008:1 -115:1 8 <
ffff8e2303c4c540 2253110130 C Ii:2:008:1 0:1 7 = 02000400 000000
ffff8e2303c4c540 2253110147 S Ii:2:008:1 -115:1 8 <
ffff8e2303c4c540 2253118095 C Ii:2:008:1 0:1 7 = 02000700 000000
ffff8e2303c4c540 2253118111 S Ii:2:008:1 -115:1 8 <
ffff8e2303c4c540 2253126098 C Ii:2:008:1 0:1 7 = 02000900 000000
ffff8e2303c4c540 2253126113 S Ii:2:008:1 -115:1 8 <
ffff8e2303c4c540 2253134095 C Ii:2:008:1 0:1 7 = 02000a10 000000
ffff8e2303c4c540 2253134111 S Ii:2:008:1 -115:1 8 <
ffff8e2303c4c540 2253142096 C Ii:2:008:1 0:1 7 = 02000b20 000000
ffff8e2303c4c540 2253142113 S Ii:2:008:1 -115:1 8 <
ffff8e2303c4c540 2253150099 C Ii:2:008:1 0:1 7 = 02000a30 000000
ffff8e2303c4c540 2253150117 S Ii:2:008:1 -115:1 8 <
ffff8e2303c4c540 2253158123 C Ii:2:008:1 0:1 7 = 02000930 000000
ffff8e2303c4c540 2253158140 S Ii:2:008:1 -115:1 8 <
ffff8e2303c4c540 2253166121 C Ii:2:008:1 0:1 7 = 02000a30 000000
ffff8e2303c4c540 2253166138 S Ii:2:008:1 -115:1 8 <
ffff8e2303c4c540 2253174127 C Ii:2:008:1 0:1 7 = 02000b20 000000
ffff8e2303c4c540 2253174144 S Ii:2:008:1 -115:1 8 <
ffff8e2303c4c540 2253182122 C Ii:2:008:1 0:1 7 = 02000920 000000
ffff8e2303c4c540 2253182139 S Ii:2:008:1 -115:1 8 <
ffff8e2303c4c540 2253190122 C Ii:2:008:1 0:1 7 = 02000930 000000
ffff8e2303c4c540 2253190140 S Ii:2:008:1 -115:1 8 <
ffff8e2303c4c540 2253198122 C Ii:2:008:1 0:1 7 = 02000520 000000
ffff8e2303c4c540 2253198139 S Ii:2:008:1 -115:1 8 <
ffff8e2303c4c540 2253206131 C Ii:2:008:1 0:1 7 = 02000310 000000
ffff8e2303c4c540 2253206148 S Ii:2:008:1 -115:1 8 <
ffff8e2303c4c540 2253214125 C Ii:2:008:1 0:1 7 = 02000110 000000
ffff8e2303c4c540 2253214145 S Ii:2:008:1 -115:1 8 <
ffff8e2303c4c540 2253222131 C Ii:2:008:1 0:1 7 = 02000120 000000
ffff8e2303c4c540 2253222148 S Ii:2:008:1 -115:1 8 <
ffff8e2303c4c540 2253230123 C Ii:2:008:1 0:1 7 = 02000220 000000
ffff8e2303c4c540 2253230139 S Ii:2:008:1 -115:1 8 <
ffff8e2303c4c540 2253238121 C Ii:2:008:1 0:1 7 = 02000120 000000
ffff8e2303c4c540 2253238137 S Ii:2:008:1 -115:1 8 <
ffff8e2303c4c540 2253246095 C Ii:2:008:1 0:1 7 = 02000220 000000
ffff8e2303c4c540 2253246111 S Ii:2:008:1 -115:1 8 <
ffff8e2303c4c540 2253254134 C Ii:2:008:1 0:1 7 = 02000020 000000
ffff8e2303c4c540 2253254150 S Ii:2:008:1 -115:1 8 <
ffff8e2303c4c540 2253310100 C Ii:2:008:1 0:1 7 = 02000110 000000
ffff8e2303c4c540 2253310116 S Ii:2:008:1 -115:1 8 <
ffff8e2303c4c540 2253318129 C Ii:2:008:1 0:1 7 = 02000100 000000
ffff8e2303c4c540 2253318145 S Ii:2:008:1 -115:1 8 <
ffff8e2303c4c540 2253326124 C Ii:2:008:1 0:1 7 = 02000110 000000
ffff8e2303c4c540 2253326140 S Ii:2:008:1 -115:1 8 <
ffff8e2303c4c540 2253334125 C Ii:2:008:1 0:1 7 = 02000010 000000
ffff8e2303c4c540 2253334141 S Ii:2:008:1 -115:1 8 <
ffff8e2303c4c540 2253366122 C Ii:2:008:1 0:1 7 = 02000100 000000
ffff8e2303c4c540 2253366139 S Ii:2:008:1 -115:1 8 <
ffff8e2303c4c540 2253374137 C Ii:2:008:1 0:1 7 = 02000100 000000
ffff8e2303c4c540 2253374153 S Ii:2:008:1 -115:1 8 <
ffff8e2303c4c540 2253382124 C Ii:2:008:1 0:1 7 = 02000100 000000
ffff8e2303c4c540 2253382140 S Ii:2:008:1 -115:1 8 <
ffff8e2303c4c540 2253390096 C Ii:2:008:1 0:1 7 = 02000110 000000
ffff8e2303c4c540 2253390121 S Ii:2:008:1 -115:1 8 <
ffff8e2303c4c540 2253398096 C Ii:2:008:1 0:1 7 = 02000110 000000
ffff8e2303c4c540 2253398111 S Ii:2:008:1 -115:1 8 <
ffff8e2303c4c540 2253406097 C Ii:2:008:1 0:1 7 = 02000120 000000
ffff8e2303c4c540 2253406113 S Ii:2:008:1 -115:1 8 <
ffff8e2303c4c540 2253414097 C Ii:2:008:1 0:1 7 = 02000230 000000
ffff8e2303c4c540 2253414113 S Ii:2:008:1 -115:1 8 <
ffff8e2303c4c540 2253422097 C Ii:2:008:1 0:1 7 = 02000110 000000
ffff8e2303c4c540 2253422113 S Ii:2:008:1 -115:1 8 <
ffff8e2303c4c540 2253430096 C Ii:2:008:1 0:1 7 = 02000010 000000
ffff8e2303c4c540 2253430111 S Ii:2:008:1 -115:1 8 <
ffff8e2303c4c540 2253438124 C Ii:2:008:1 0:1 7 = 02000200 000000
ffff8e2303c4c540 2253438141 S Ii:2:008:1 -115:1 8 <
ffff8e2303c4c540 2253446097 C Ii:2:008:1 0:1 7 = 02000100 000000
ffff8e2303c4c540 2253446114 S Ii:2:008:1 -115:1 8 <
ffff8e2303c4c540 2253454097 C Ii:2:008:1 0:1 7 = 02000200 000000
ffff8e2303c4c540 2253454113 S Ii:2:008:1 -115:1 8 <
ffff8e2303c4c540 2253462097 C Ii:2:008:1 0:1 7 = 02000100 000000
ffff8e2303c4c540 2253462113 S Ii:2:008:1 -115:1 8 <
ffff8e2303c4c540 2253662124 C Ii:2:008:1 0:1 7 = 02010000 000000
ffff8e2303c4c540 2253662142 S Ii:2:008:1 -115:1 8 <
ffff8e2303c4c540 2253726099 C Ii:2:008:1 0:1 7 = 02000000 000000
ffff8e2303c4c540 2253726115 S Ii:2:008:1 -115:1 8 <
ffff8e2303c4c540 2253797132 C Ii:2:008:1 0:1 7 = 0200ff1f 000000
ffff8e2303c4c540 2253797170 S Ii:2:008:1 -115:1 8 <
ffff8e2303c4c540 2253805128 C Ii:2:008:1 0:1 7 = 0200fe4f 000000
ffff8e2303c4c540 2253805156 S Ii:2:008:1 -115:1 8 <
ffff8e2303c4c540 2253813128 C Ii:2:008:1 0:1 7 = 0200fd5f 000000
ffff8e2303c4c540 2253813154 S Ii:2:008:1 -115:1 8 <
ffff8e2303c4c540 2253821126 C Ii:2:008:1 0:1 7 = 0200fb7f 000000
ffff8e2303c4c540 2253821152 S Ii:2:008:1 -115:1 8 <
ffff8e2303c4c540 2253829124 C Ii:2:008:1 0:1 7 = 0200fbbf 000000
ffff8e2303c4c540 2253829149 S Ii:2:008:1 -115:1 8 <
ffff8e2303c4c540 2253837127 C Ii:2:008:1 0:1 7 = 0200facf 000000
ffff8e2303c4c540 2253837154 S Ii:2:008:1 -115:1 8 <
ffff8e2303c4c540 2253845124 C Ii:2:008:1 0:1 7 = 0200f62f 010000
ffff8e2303c4c540 2253845151 S Ii:2:008:1 -115:1 8 <
ffff8e2303c4c540 2253853125 C Ii:2:008:1 0:1 7 = 0200f66f 010000
ffff8e2303c4c540 2253853152 S Ii:2:008:1 -115:1 8 <
ffff8e2303c4c540 2253861124 C Ii:2:008:1 0:1 7 = 0200f28f 010000
ffff8e2303c4c540 2253861148 S Ii:2:008:1 -115:1 8 <
ffff8e2303c4c540 2253869124 C Ii:2:008:1 0:1 7 = 0200efaf 010000
ffff8e2303c4c540 2253869148 S Ii:2:008:1 -115:1 8 <
ffff8e2303c4c540 2253877123 C Ii:2:008:1 0:1 7 = 0200eccf 010000
ffff8e2303c4c540 2253877149 S Ii:2:008:1 -115:1 8 <
ffff8e2303c4c540 2253885124 C Ii:2:008:1 0:1 7 = 0200eadf 010000
ffff8e2303c4c540 2253885147 S Ii:2:008:1 -115:1 8 <
ffff8e2303c4c540 2253893123 C Ii:2:008:1 0:1 7 = 0200e8ef 010000
ffff8e2303c4c540 2253893148 S Ii:2:008:1 -115:1 8 <
ffff8e2303c4c540 2253901123 C Ii:2:008:1 0:1 7 = 0200e7ff 010000
ffff8e2303c4c540 2253901147 S Ii:2:008:1 -115:1 8 <
ffff8e2303c4c540 2253909123 C Ii:2:008:1 0:1 7 = 0200e70f 020000
ffff8e2303c4c540 2253909146 S Ii:2:008:1 -115:1 8 <
ffff8e2303c4c540 2253917125 C Ii:2:008:1 0:1 7 = 0200e7ff 010000
ffff8e2303c4c540 2253917150 S Ii:2:008:1 -115:1 8 <
ffff8e2303c4c540 2253925124 C Ii:2:008:1 0:1 7 = 0200e80f 020000
ffff8e2303c4c540 2253925147 S Ii:2:008:1 -115:1 8 <
ffff8e2303c4c540 2253933123 C Ii:2:008:1 0:1 7 = 0200e81f 020000
ffff8e2303c4c540 2253933146 S Ii:2:008:1 -115:1 8 <
ffff8e2303c4c540 2253941123 C Ii:2:008:1 0:1 7 = 0200e91f 020000
ffff8e2303c4c540 2253941146 S Ii:2:008:1 -115:1 8 <
ffff8e2303c4c540 2253949123 C Ii:2:008:1 0:1 7 = 0200e81f 020000
ffff8e2303c4c540 2253949147 S Ii:2:008:1 -115:1 8 <
ffff8e2303c4c540 2253957123 C Ii:2:008:1 0:1 7 = 0200e82f 020000
ffff8e2303c4c540 2253957146 S Ii:2:008:1 -115:1 8 <
ffff8e2303c4c540 2253965125 C Ii:2:008:1 0:1 7 = 0200e83f 020000
ffff8e2303c4c540 2253965148 S Ii:2:008:1 -115:1 8 <
ffff8e2303c4c540 2253973124 C Ii:2:008:1 0:1 7 = 0200e82f 020000
ffff8e2303c4c540 2253973146 S Ii:2:008:1 -115:1 8 <
ffff8e2303c4c540 2253981122 C Ii:2:008:1 0:1 7 = 0200e82f 020000
ffff8e2303c4c540 2253981147 S Ii:2:008:1 -115:1 8 <
ffff8e2303c4c540 2253989123 C Ii:2:008:1 0:1 7 = 0200ea0f 020000
ffff8e2303c4c540 2253989145 S Ii:2:008:1 -115:1 8 <
ffff8e2303c4c540 2253997123 C Ii:2:008:1 0:1 7 = 0200ebef 010000
ffff8e2303c4c540 2253997145 S Ii:2:008:1 -115:1 8 <
ffff8e2303c4c540 2254005140 C Ii:2:008:1 0:1 7 = 0200eccf 010000
ffff8e2303c4c540 2254005164 S Ii:2:008:1 -115:1 8 <
ffff8e2303c4c540 2254013122 C Ii:2:008:1 0:1 7 = 0200ee8f 010000
ffff8e2303c4c540 2254013146 S Ii:2:008:1 -115:1 8 <
ffff8e2303c4c540 2254021123 C Ii:2:008:1 0:1 7 = 0200ee4f 010000
ffff8e2303c4c540 2254021147 S Ii:2:008:1 -115:1 8 <
ffff8e2303c4c540 2254029123 C Ii:2:008:1 0:1 7 = 0200f2ff 000000
ffff8e2303c4c540 2254029148 S Ii:2:008:1 -115:1 8 <
ffff8e2303c4c540 2254037123 C Ii:2:008:1 0:1 7 = 0200f6bf 000000
ffff8e2303c4c540 2254037147 S Ii:2:008:1 -115:1 8 <
ffff8e2303c4c540 2254045123 C Ii:2:008:1 0:1 7 = 0200f96f 000000
ffff8e2303c4c540 2254045148 S Ii:2:008:1 -115:1 8 <
ffff8e2303c4c540 2254053124 C Ii:2:008:1 0:1 7 = 0200fb4f 000000
ffff8e2303c4c540 2254053148 S Ii:2:008:1 -115:1 8 <
ffff8e2303c4c540 2254061123 C Ii:2:008:1 0:1 7 = 0200fd5f 000000
ffff8e2303c4c540 2254061147 S Ii:2:008:1 -115:1 8 <
ffff8e2303c4c540 2254069123 C Ii:2:008:1 0:1 7 = 0200fe5f 000000
ffff8e2303c4c540 2254069148 S Ii:2:008:1 -115:1 8 <
ffff8e2303c4c540 2254077124 C Ii:2:008:1 0:1 7 = 0200fe4f 000000
ffff8e2303c4c540 2254077148 S Ii:2:008:1 -115:1 8 <
ffff8e2303c4c540 2254085123 C Ii:2:008:1 0:1 7 = 0200ff4f 000000
ffff8e2303c4c540 2254085147 S Ii:2:008:1 -115:1 8 <
ffff8e2303c4c540 2254093124 C Ii:2:008:1 0:1 7 = 0200ff1f 000000
ffff8e2303c4c540 2254093149 S Ii:2:008:1 -115:1 8 <
ffff8e2303c4c540 2254325127 C Ii:2:008:1 0:1 7 = 02000100 000000
ffff8e2303c4c540 2254325154 S Ii:2:008:1 -115:1 8 <
ffff8e2303c4c540 2254333135 C Ii:2:008:1 0:1 7 = 020002f0 ff0000
ffff8e2303c4c540 2254333160 S Ii:2:008:1 -115:1 8 <
ffff8e2303c4c540 2254341126 C Ii:2:008:1 0:1 7 = 020002e0 ff0000
ffff8e2303c4c540 2254341153 S Ii:2:008:1 -115:1 8 <
ffff8e2303c4c540 2254349135 C Ii:2:008:1 0:1 7 = 020004b0 ff0000
ffff8e2303c4c540 2254349160 S Ii:2:008:1 -115:1 8 <
ffff8e2303c4c540 2254357134 C Ii:2:008:1 0:1 7 = 020003b0 ff0000
ffff8e2303c4c540 2254357161 S Ii:2:008:1 -115:1 8 <
ffff8e2303c4c540 2254365128 C Ii:2:008:1 0:1 7 = 02000590 ff0000
ffff8e2303c4c540 2254365155 S Ii:2:008:1 -115:1 8 <
ffff8e2303c4c540 2254373127 C Ii:2:008:1 0:1 7 = 02000480 ff0000
ffff8e2303c4c540 2254373155 S Ii:2:008:1 -115:1 8 <
ffff8e2303c4c540 2254381127 C Ii:2:008:1 0:1 7 = 02000390 ff0000
ffff8e2303c4c540 2254381153 S Ii:2:008:1 -115:1 8 <
ffff8e2303c4c540 2254389126 C Ii:2:008:1 0:1 7 = 02000490 ff0000
ffff8e2303c4c540 2254389152 S Ii:2:008:1 -115:1 8 <
ffff8e2303c4c540 2254397129 C Ii:2:008:1 0:1 7 = 02000390 ff0000
ffff8e2303c4c540 2254397155 S Ii:2:008:1 -115:1 8 <
ffff8e2303c4c540 2254405128 C Ii:2:008:1 0:1 7 = 02000390 ff0000
ffff8e2303c4c540 2254405155 S Ii:2:008:1 -115:1 8 <
ffff8e2303c4c540 2254413105 C Ii:2:008:1 0:1 7 = 020002a0 ff0000
ffff8e2303c4c540 2254413142 S Ii:2:008:1 -115:1 8 <
ffff8e2303c4c540 2254421127 C Ii:2:008:1 0:1 7 = 020002a0 ff0000
ffff8e2303c4c540 2254421155 S Ii:2:008:1 -115:1 8 <
ffff8e2303c4c540 2254429131 C Ii:2:008:1 0:1 7 = 020001c0 ff0000
ffff8e2303c4c540 2254429159 S Ii:2:008:1 -115:1 8 <
ffff8e2303c4c540 2254437128 C Ii:2:008:1 0:1 7 = 020002b0 ff0000
ffff8e2303c4c540 2254437156 S Ii:2:008:1 -115:1 8 <
ffff8e2303c4c540 2254445136 C Ii:2:008:1 0:1 7 = 020001d0 ff0000
ffff8e2303c4c540 2254445162 S Ii:2:008:1 -115:1 8 <
ffff8e2303c4c540 2254453128 C Ii:2:008:1 0:1 7 = 020000d0 ff0000
ffff8e2303c4c540 2254453155 S Ii:2:008:1 -115:1 8 <
ffff8e2303c4c540 2254461127 C Ii:2:008:1 0:1 7 = 020000d0 ff0000
ffff8e2303c4c540 2254461153 S Ii:2:008:1 -115:1 8 <
ffff8e2303c4c540 2254469127 C Ii:2:008:1 0:1 7 = 020002d0 ff0000
ffff8e2303c4c540 2254469154 S Ii:2:008:1 -115:1 8 <
ffff8e2303c4c540 2254477132 C Ii:2:008:1 0:1 7 = 020001d0 ff0000
ffff8e2303c4c540 2254477158 S Ii:2:008:1 -115:1 8 <
ffff8e2303c4c540 2254485118 C Ii:2:008:1 0:1 7 = 020002e0 ff0000
ffff8e2303c4c540 2254485143 S Ii:2:008:1 -115:1 8 <
ffff8e2303c4c540 2254493129 C Ii:2:008:1 0:1 7 = 020001e0 ff0000
ffff8e2303c4c540 2254493157 S Ii:2:008:1 -115:1 8 <
ffff8e2303c4c540 2254501128 C Ii:2:008:1 0:1 7 = 020002e0 ff0000
ffff8e2303c4c540 2254501155 S Ii:2:008:1 -115:1 8 <
ffff8e2303c4c540 2254509126 C Ii:2:008:1 0:1 7 = 020002d0 ff0000
ffff8e2303c4c540 2254509153 S Ii:2:008:1 -115:1 8 <
ffff8e2303c4c540 2254517136 C Ii:2:008:1 0:1 7 = 020002c0 ff0000
ffff8e2303c4c540 2254517162 S Ii:2:008:1 -115:1 8 <
ffff8e2303c4c540 2254525129 C Ii:2:008:1 0:1 7 = 020003b0 ff0000
ffff8e2303c4c540 2254525156 S Ii:2:008:1 -115:1 8 <
ffff8e2303c4c540 2254533129 C Ii:2:008:1 0:1 7 = 020002e0 ff0000
ffff8e2303c4c540 2254533157 S Ii:2:008:1 -115:1 8 <
ffff8e2302151980 2254538110 S Bo:2:002:2 -115 31 = 55534243 b0050000 00000000 00000600 00000000 00000000 00000000 000000
ffff8e2302151980 2254538142 C Bo:2:002:2 0 31 >
ffff8e2302151980 2254538152 S Bi:2:002:1 -115 13 <
ffff8e2302151980 2254538189 C Bi:2:002:1 0 13 = 55534253 b0050000 00000000 00
ffff8e2303c4c540 2254541129 C Ii:2:008:1 0:1 7 = 020001f0 ff0000
ffff8e2303c4c540 2254541155 S Ii:2:008:1 -115:1 8 <
ffff8e2303c4c540 2254549128 C Ii:2:008:1 0:1 7 = 020001e0 ff0000
ffff8e2303c4c540 2254549156 S Ii:2:008:1 -115:1 8 <
ffff8e2303c4c540 2254557128 C Ii:2:008:1 0:1 7 = 020001f0 ff0000
ffff8e2303c4c540 2254557155 S Ii:2:008:1 -115:1 8 <
ffff8e2303c4c540 2254565135 C Ii:2:008:1 0:1 7 = 02000100 000000
ffff8e2303c4c540 2254565161 S Ii:2:008:1 -115:1 8 <
ffff8e2303c4c540 2254573129 C Ii:2:008:1 0:1 7 = 020000f0 ff0000
ffff8e2303c4c540 2254573157 S Ii:2:008:1 -115:1 8 <
ffff8e2303c4c540 2254701129 C Ii:2:008:1 0:1 7 = 02010000 000000
ffff8e2303c4c540 2254701157 S Ii:2:008:1 -115:1 8 <
ffff8e2303c4c540 2254765105 C Ii:2:008:1 0:1 7 = 020100f0 ff0000
ffff8e2303c4c540 2254765138 S Ii:2:008:1 -115:1 8 <
ffff8e2303c4c540 2254773101 C Ii:2:008:1 0:1 7 = 0201fdff ff0000
ffff8e2303c4c540 2254773125 S Ii:2:008:1 -115:1 8 <
ffff8e2303c4c540 2254781101 C Ii:2:008:1 0:1 7 = 0201fd0f 000000
ffff8e2303c4c540 2254781125 S Ii:2:008:1 -115:1 8 <
ffff8e2303c4c540 2254789106 C Ii:2:008:1 0:1 7 = 0200faff ff0000
ffff8e2303c4c540 2254789136 S Ii:2:008:1 -115:1 8 <
ffff8e2303c4c540 2254797101 C Ii:2:008:1 0:1 7 = 0200f90f 000000
ffff8e2303c4c540 2254797117 S Ii:2:008:1 -115:1 8 <
ffff8e2303c4c540 2254805101 C Ii:2:008:1 0:1 7 = 0200fb0f 000000
ffff8e2303c4c540 2254805118 S Ii:2:008:1 -115:1 8 <
ffff8e2303c4c540 2254813102 C Ii:2:008:1 0:1 7 = 0200fc0f 000000
ffff8e2303c4c540 2254813127 S Ii:2:008:1 -115:1 8 <
ffff8e2303c4c540 2254821102 C Ii:2:008:1 0:1 7 = 0200fe0f 000000
ffff8e2303c4c540 2254821118 S Ii:2:008:1 -115:1 8 <
ffff8e2315a10f00 2255920113 C Ii:2:005:1 0:16 8 = 00000600 00000000
ffff8e2315a10f00 2255920146 S Ii:2:005:1 -115:16 8 <
ffff8e2315a10f00 2256064137 C Ii:2:005:1 0:16 8 = 00000000 00000000
ffff8e2315a10f00 2256064164 S Ii:2:005:1 -115:16 8 <
ffff8e2315a10f00 2256224136 C Ii:2:005:1 0:16 8 = 00001213 00000000
ffff8e2315a10f00 2256224163 S Ii:2:005:1 -115:16 8 <
ffff8e2315a10f00 2256256109 C Ii:2:005:1 0:16 8 = 00001200 00000000
ffff8e2315a10f00 2256256133 S Ii:2:005:1 -115:16 8 <
ffff8e2315a10f00 2256272140 C Ii:2:005:1 0:16 8 = 00001012 00000000
ffff8e2315a10f00 2256272164 S Ii:2:005:1 -115:16 8 <
ffff8e2315a10f00 2256336137 C Ii:2:005:1 0:16 8 = 00001000 00000000
ffff8e2315a10f00 2256336163 S Ii:2:005:1 -115:16 8 <
ffff8e2315a10f00 2256400139 C Ii:2:005:1 0:16 8 = 00000000 00000000
ffff8e2315a10f00 2256400164 S Ii:2:005:1 -115:16 8 <
ffff8e2315a10f00 2256560146 C Ii:2:005:1 0:16 8 = 00001300 00000000
ffff8e2315a10f00 2256560172 S Ii:2:005:1 -115:16 8 <
ffff8e2302151980 2256586094 S Bo:2:002:2 -115 31 = 55534243 b1050000 00000000 00000600 00000000 00000000 00000000 000000
ffff8e2302151980 2256586152 C Bo:2:002:2 0 31 >
ffff8e2302151980 2256586162 S Bi:2:002:1 -115 13 <
ffff8e2302151980 2256586191 C Bi:2:002:1 0 13 = 55534253 b1050000 00000000 00
ffff8e2315a10f00 2256656140 C Ii:2:005:1 0:16 8 = 00000f13 00000000
ffff8e2315a10f00 2256656165 S Ii:2:005:1 -115:16 8 <
ffff8e2315a10f00 2256704139 C Ii:2:005:1 0:16 8 = 00000f00 00000000
ffff8e2315a10f00 2256704166 S Ii:2:005:1 -115:16 8 <
ffff8e2315a10f00 2256768142 C Ii:2:005:1 0:16 8 = 00000000 00000000
ffff8e2315a10f00 2256768167 S Ii:2:005:1 -115:16 8 <
ffff8e2315a10f00 2257312114 C Ii:2:005:1 0:16 8 = 00002a00 00000000
ffff8e2315a10f00 2257312138 S Ii:2:005:1 -115:16 8 <
ffff8e2315a10f00 2257376143 C Ii:2:005:1 0:16 8 = 00000000 00000000
ffff8e2315a10f00 2257376170 S Ii:2:005:1 -115:16 8 <
ffff8e2315a10f00 2257632152 C Ii:2:005:1 0:16 8 = 00002a00 00000000
ffff8e2315a10f00 2257632179 S Ii:2:005:1 -115:16 8 <
ffff8e2315a10f00 2257696144 C Ii:2:005:1 0:16 8 = 00000000 00000000
ffff8e2315a10f00 2257696169 S Ii:2:005:1 -115:16 8 <
ffff8e2315a10f00 2257808144 C Ii:2:005:1 0:16 8 = 00002a00 00000000
ffff8e2315a10f00 2257808170 S Ii:2:005:1 -115:16 8 <
ffff8e2315a10f00 2257856145 C Ii:2:005:1 0:16 8 = 00000000 00000000
ffff8e2315a10f00 2257856170 S Ii:2:005:1 -115:16 8 <
ffff8e2315a10f00 2257936143 C Ii:2:005:1 0:16 8 = 00002a00 00000000
ffff8e2315a10f00 2257936169 S Ii:2:005:1 -115:16 8 <
ffff8e2315a10f00 2258000118 C Ii:2:005:1 0:16 8 = 00000000 00000000
ffff8e2315a10f00 2258000141 S Ii:2:005:1 -115:16 8 <
ffff8e2315a10f00 2258192145 C Ii:2:005:1 0:16 8 = 00001000 00000000
ffff8e2315a10f00 2258192174 S Ii:2:005:1 -115:16 8 <
ffff8e2315a10f00 2258272147 C Ii:2:005:1 0:16 8 = 00000000 00000000
ffff8e2315a10f00 2258272173 S Ii:2:005:1 -115:16 8 <
ffff8e2315a10f00 2258464158 C Ii:2:005:1 0:16 8 = 00001300 00000000
ffff8e2315a10f00 2258464185 S Ii:2:005:1 -115:16 8 <
ffff8e2315a10f00 2258592151 C Ii:2:005:1 0:16 8 = 00000f13 00000000
ffff8e2315a10f00 2258592180 S Ii:2:005:1 -115:16 8 <
ffff8e2315a10f00 2258624146 C Ii:2:005:1 0:16 8 = 00000f00 00000000
ffff8e2315a10f00 2258624171 S Ii:2:005:1 -115:16 8 <
ffff8e2302151980 2258634165 S Bo:2:002:2 -115 31 = 55534243 b2050000 00000000 00000600 00000000 00000000 00000000 000000
ffff8e2302151980 2258634221 C Bo:2:002:2 0 31 >
ffff8e2302151980 2258634232 S Bi:2:002:1 -115 13 <
ffff8e2302151980 2258634261 C Bi:2:002:1 0 13 = 55534253 b2050000 00000000 00
ffff8e2315a10f00 2258688148 C Ii:2:005:1 0:16 8 = 00000000 00000000
ffff8e2315a10f00 2258688173 S Ii:2:005:1 -115:16 8 <
ffff8e2315a10f00 2258704157 C Ii:2:005:1 0:16 8 = 00000800 00000000
ffff8e2315a10f00 2258704182 S Ii:2:005:1 -115:16 8 <
ffff8e2315a10f00 2258816148 C Ii:2:005:1 0:16 8 = 00001700 00000000
ffff8e2315a10f00 2258816176 S Ii:2:005:1 -115:16 8 <
ffff8e2315a10f00 2258928151 C Ii:2:005:1 0:16 8 = 00000817 00000000
ffff8e2315a10f00 2258928183 S Ii:2:005:1 -115:16 8 <
ffff8e2315a10f00 2258976158 C Ii:2:005:1 0:16 8 = 00000800 00000000
ffff8e2315a10f00 2258976191 S Ii:2:005:1 -115:16 8 <
ffff8e2315a10f00 2259024152 C Ii:2:005:1 0:16 8 = 00000000 00000000
ffff8e2315a10f00 2259024183 S Ii:2:005:1 -115:16 8 <
ffff8e2315a10f00 2259312153 C Ii:2:005:1 0:16 8 = 00002800 00000000
ffff8e2315a10f00 2259312188 S Ii:2:005:1 -115:16 8 <
ffff8e2315a10f00 2259424126 C Ii:2:005:1 0:16 8 = 00000000 00000000
ffff8e2315a10f00 2259424155 S Ii:2:005:1 -115:16 8 <
ffff8e2302151980 2260682102 S Bo:2:002:2 -115 31 = 55534243 b3050000 00000000 00000600 00000000 00000000 00000000 000000
ffff8e2302151980 2260682136 C Bo:2:002:2 0 31 >
ffff8e2302151980 2260682147 S Bi:2:002:1 -115 13 <
ffff8e2302151980 2260682183 C Bi:2:002:1 0 13 = 55534253 b3050000 00000000 00
ffff8e2302151980 2262731096 S Bo:2:002:2 -115 31 = 55534243 b4050000 00000000 00000600 00000000 00000000 00000000 000000
ffff8e2302151980 2262731128 C Bo:2:002:2 0 31 >
ffff8e2302151980 2262731139 S Bi:2:002:1 -115 13 <
ffff8e2302151980 2262731176 C Bi:2:002:1 0 13 = 55534253 b4050000 00000000 00
ffff8e2302151980 2264778448 S Bo:2:002:2 -115 31 = 55534243 b5050000 00000000 00000600 00000000 00000000 00000000 000000
ffff8e2302151980 2264778487 C Bo:2:002:2 0 31 >
ffff8e2302151980 2264778501 S Bi:2:002:1 -115 13 <
ffff8e2302151980 2264778523 C Bi:2:002:1 0 13 = 55534253 b5050000 00000000 00
